site,search_url,details_url,price,original_currency,price_per_m2,city,neighborhood,offer_type,property_type,area,floor,total_floors,raw_title,raw_description,agency,agency_url,num_photos,ref_no,date_time_added,total_offers,fingerprint_hash
bulgarianproperties,https://www.bulgarianproperties.bg/Search/index.php?sady=2&stown_text1769203711=%E3%F0.+%D1%EE%F4%E8%FF&squarter_text1769203711=&stop_text1769203711=&spredlog=in&sdevv_text1769203711=&stip%5B%5D=10&minprice=&maxprice=&minarea=&mingarden=&minbedrom=&skeyword=&sref_no=&c=Search&from_search_form=advanced&stown=4732,https://www.bulgarianproperties.bg/imoti-tristayni-apartamenti/imot-78171-tristaen-apartament-pod-naem-v-sofiya.html,1700.0,EUR,10.56,София,Лозенец,наем,тристаен,161.0,8,,Луксозно обзаведен апартамент под наем на 350 метра от метростанция „Джеймс Баучер“,"Наем, Отлично обзаведен, тристаен апартамент в луксозна сграда в кв. Лозенец близо до метростанция „Джеймс Баучер“ и хотел Маринела. Висок клас строителство с панорамен асансьор, луксозно фойае с рецепция, ресторант, видеонаблюдение, пожароизвестяване и денонощна охрана. Сградата е",Иван Каменов,,2,78171,2026-02-07 06:09:56.086720,76,367bd82c42d5aa19e089c82fd02ef2c2
bulgarianproperties,https://www.bulgarianproperties.bg/Search/index.php?sady=2&stown_text1769203711=%E3%F0.+%D1%EE%F4%E8%FF&squarter_text1769203711=&stop_text1769203711=&spredlog=in&sdevv_text1769203711=&stip%5B%5D=10&minprice=&maxprice=&minarea=&mingarden=&minbedrom=&skeyword=&sref_no=&c=Search&from_search_form=advanced&stown=4732,https://www.bulgarianproperties.bg/imoti-tristayni-apartamenti/imot-64911-tristaen-apartament-pod-naem-v-sofiya.html,1000.0,EUR,12.5,София,Докторски паметник,наем,тристаен,80.0,4,,Тристаен апартамент в кв. Докторски паметник,"Наем, Луксозен апартамент с изискан интериор предлага висок стандарт на живот в сърцето на столицата. Жилище с обща площ от 80 кв.м. в района на Докторската градина в стилна тухлена сграда от 60-те с ремонтирани общи части. Изключително висок клас имот в престижен, спокоен и търсен",Иван Каменов,,2,64911,2026-02-07 06:09:56.086720,76,8fe7181fcd47aec670d71a0d783a0107
bulgarianproperties,https://www.bulgarianproperties.bg/Search/index.php?sady=2&stown_text1769203711=%E3%F0.+%D1%EE%F4%E8%FF&squarter_text1769203711=&stop_text1769203711=&spredlog=in&sdevv_text1769203711=&stip%5B%5D=10&minprice=&maxprice=&minarea=&mingarden=&minbedrom=&skeyword=&sref_no=&c=Search&from_search_form=advanced&stown=4732,https://www.bulgarianproperties.bg/imoti-tristayni-apartamenti/imot-77020-tristaen-apartament-pod-naem-v-sofiya.html,430.0,EUR,6.14,София,Младост 4,наем,тристаен,70.0,1,,Тристаен апартамент под наем в близост до Бизнес парк София,"Наем, Имаме удоволствието да представим под наем тристаен апартамент с възлова локация в кв. Младост 4,  в близост до Бизнес парк София, магазини, кафене, училище, детска градина, парк, възлови булеварди, супермаркети Билла и Лидъл, Околовръстен път, бул. Александър Малинов, ул. Проф.",Стойчо Бугов,,2,77020,2026-02-07 06:09:56.086720,76,4e60aafba064a1e9abe8228e5182856e
bulgarianproperties,https://www.bulgarianproperties.bg/Search/index.php?sady=2&stown_text1769203711=%E3%F0.+%D1%EE%F4%E8%FF&squarter_text1769203711=&stop_text1769203711=&spredlog=in&sdevv_text1769203711=&stip%5B%5D=10&minprice=&maxprice=&minarea=&mingarden=&minbedrom=&skeyword=&sref_no=&c=Search&from_search_form=advanced&stown=4732,https://www.bulgarianproperties.bg/imoti-tristayni-apartamenti/imot-62501-tristaen-apartament-pod-naem-v-sofiya.html,1250.0,EUR,11.36,София,Докторски паметник,наем,тристаен,110.0,4,,Бутиков тристаен апартамент в район Докторски паметник,"Наем, -4%, Имаме удоволствие да Ви представим уникален, бутиков апартамент с две спални, намиращ се в района на Докторски паметник, между улиците Велико Търново и Шипка в столицата - локация, известна с емблематични сгради и посолства, едва на 50 м до парк Заимов, на 400 м до Докторска",Иван Каменов,,2,62501,2026-02-07 06:09:56.086720,76,0573d6ff58c30cae17f4e8647eb533f6
bulgarianproperties,https://www.bulgarianproperties.bg/Search/index.php?sady=2&stown_text1769203711=%E3%F0.+%D1%EE%F4%E8%FF&squarter_text1769203711=&stop_text1769203711=&spredlog=in&sdevv_text1769203711=&stip%5B%5D=10&minprice=&maxprice=&minarea=&mingarden=&minbedrom=&skeyword=&sref_no=&c=Search&from_search_form=advanced&stown=4732,https://www.bulgarianproperties.bg/imoti-tristayni-apartamenti/imot-72092-tristaen-apartament-pod-naem-v-sofiya.html,1400.0,EUR,11.86,София,Докторски паметник,наем,тристаен,118.0,2,,Безупречно обзаведен апртамент с две спални до „Докторска градина“,"Наем, Потопете се в атмосферата на този уникален апартамент с две спални, обзаведен по дизайнерски проект, истинско бижу в сърцето на столицата. Дом, където под един покрив се преплитат топлина и уюта на дървото с модерните технологии. Имотът е част от масивна тухлена сграда с",Иван Каменов,,2,72092,2026-02-07 06:09:56.086720,76,ec57d3a80ec6b5fea38af37c05b8feae
bulgarianproperties,https://www.bulgarianproperties.bg/Search/index.php?sady=2&stown_text1769203711=%E3%F0.+%D1%EE%F4%E8%FF&squarter_text1769203711=&stop_text1769203711=&spredlog=in&sdevv_text1769203711=&stip%5B%5D=10&minprice=&maxprice=&minarea=&mingarden=&minbedrom=&skeyword=&sref_no=&c=Search&from_search_form=advanced&stown=4732,https://www.bulgarianproperties.bg/imoti-tristayni-apartamenti/imot-72055-tristaen-apartament-pod-naem-v-sofiya.html,850.0,EUR,7.73,София,Витоша,наем,тристаен,110.0,3,,Светъл и луксозен апартамент в комплекс Maxi/Макси в кв. Витоша,"Наем, Съчетание от лукс, простор, висок клас довършителни работи, функционалност при избора на мебели и сигурността на затворените комплекси ще намерите в новото ни предложение. Този прекрасен апартамент с две спални се намира в комплекс Макси и очаква новите си наематели с чисто ново",Иван Каменов,,2,72055,2026-02-07 06:09:56.086720,76,f10cef21bed623b5116230c080185a96
