raw_title,raw_description,price,currency,without_dds,offer_type,property_type,city,neighborhood,contact_info,agency,agency_url,details_url,num_photos,date_time_added,search_url,site,total_offers,ref_no,time,price_per_m2,area,floor,fingerprint_hash
"продаваДвустаен апартамент,59 м2","Двустаен апартамент в добро състояние, на кръстовището на бул. Гоце Делчев и бул. България. Жилището се продава с налично обзавеждане при желание от бъдещия купувач. Разпределение: входно антре,...",200900.0,EUR,False,продава,двустаен,София,Белите брези,,продава,,https://www.imoti.net/bg/obiava/prodava/sofia/belite-brezi/dvustaen/6199027/?sid=iKI3oo&page=1,12,2026-01-19 20:20:48.984685,,imotinet,,,,Цена на /м2/:3 405EUR/6 659.77BGN,59 м2,Етаж: 6 от 11,0cb7d10773418aebc07cc1d8ebfbe075
"продаваТристаен апартамент,85 м2","Просторен 3 стаен апартамент в един от най-хубавите южни квартали на гр. София. Имота е в поддържан блок с отлични общи части, поддържана градинка пред входа, контролиран достъп. Състои се от 2...",224990.0,EUR,False,продава,тристаен,София,Лагера,,продава,,https://www.imoti.net/bg/obiava/prodava/sofia/lagera/tristaen/6192083/?sid=iKI3oo&page=1,14,2026-01-19 20:20:48.985476,,imotinet,,,,Цена на /м2/:2 647EUR/5 176.97BGN,85 м2,Етаж: 7 от 7,a72fe29ec230a07189f2c1ed8b2be48b
"продаваТристаен апартамент,63 м2","3 стаен апартамент преустроен от 2 стаен в кв. Хиподрума. Апартаментът се намира на етаж 2 със ЗП 63кв.м. и следното разпределение: коридор, всекидневна с кухненски бокс, родителска спалня, детска...",248990.0,EUR,False,продава,тристаен,София,Хиподрума,,продава,,https://www.imoti.net/bg/obiava/prodava/sofia/hipodruma/tristaen/6167255/?sid=iKI3oo&page=1,15,2026-01-19 20:20:48.986216,,imotinet,,,,Цена на /м2/:3 952EUR/7 729.87BGN,63 м2,Етаж: 2 от 3,e0c55f7eb90672e0622bf3c48911b956
"продаваДвустаен апартамент,73 м2","Голям двустаен апартамент находящ се на втори жилищен етаж в поддържана тухлена сграда. Имотът се състои от хол, кухненски бокс и трапезария, спалня, баня с тоалетна и две тераси. Застроената...",250000.0,EUR,False,продава,двустаен,София,Хиподрума,,продава,,https://www.imoti.net/bg/obiava/prodava/sofia/hipodruma/dvustaen/6139981/?sid=iKI3oo&page=1,5,2026-01-19 20:20:48.986938,,imotinet,,,,Цена на /м2/:3 425EUR/6 698.05BGN,73 м2,Етаж: 2 от 7,567c9c1bb9d8447755e6777af617e402
"продаваДвустаен апартамент,65 м2","Непреходен двустаен апартамент с едностранно южно изложение, състоящ се от две стаи, кухненски бокс с трапезария, баня с тоалетна и голяма тераса. Жилищната сграда се намира в характерната за горен...",259990.0,EUR,False,продава,двустаен,София,Лозенец,,продава,,https://www.imoti.net/bg/obiava/prodava/sofia/lozenec/dvustaen/6192324/?sid=iKI3oo&page=1,15,2026-01-19 20:20:48.987735,,imotinet,,,,Цена на /м2/:4 000EUR/7 823.02BGN,65 м2,Етаж: 4 от 4,b8213cd1d77377d2801499549e4bd801
"продаваТристаен апартамент,127 м2","Предлагаме за продажба голям и светъл тристаен апартамент със застроена площ от 127 кв.м., разположен във вътрешната част на квартала, в спокойна и озеленена зона с отлична инфраструктура....",370000.0,EUR,False,продава,тристаен,София,Лагера,,продава,,https://www.imoti.net/bg/obiava/prodava/sofia/lagera/tristaen/6147251/?sid=iKI3oo&page=1,26,2026-01-19 20:20:48.988478,,imotinet,,,,Цена на /м2/:2 913EUR/5 698.09BGN,127 м2,Етаж: 3 от 6,451605c6e4ff6d01253bd67321d02b8d
"продаваЧетиристаен апартамент,150 м2","RealNet продава просторен и функционален четиристаен апартамент, със застроена площ от 150 кв.м. (около 170 кв.м. с включени идеални части от общите части на сградата), находящ се на първи...",499500.0,EUR,False,продава,четиристаен,София,Лозенец,,продава,,https://www.imoti.net/bg/obiava/prodava/sofia/lozenec/chetiristaen/6181104/?sid=iKI3oo&page=1,14,2026-01-19 20:20:48.989214,,imotinet,,,,Цена на /м2/:3 330EUR/6 512.91BGN,150 м2,Етаж: 2 от 6,c6ad50e3b697641093bb988e3952bf08
"продаваТристаен апартамент,170 м2","A P A R T M E N T  0 1 2С Апартамент 012 ELEHOME ви предлага една изключително красива, функционална и резонираща с нашето ежедневие и съвременност архитектура. Семпла, изчистена и...",615000.0,EUR,False,продава,тристаен,София,Лозенец,,продава,,https://www.imoti.net/bg/obiava/prodava/sofia/lozenec/tristaen/5566759/?sid=iKI3oo&page=1,12,2026-01-19 20:20:48.989949,,imotinet,,,,Цена на /м2/:3 618EUR/7 075.50BGN,170 м2,Етаж: 3 от 8,19119fdad135d55fd96e2973bc1da39a
"продаваТристаен апартамент,87 м2","Агенция за недвижими имоти ""Пандора Естейт"" продава ексклузивно тристаен апартамент в кв. Бели Брези на цена от 132,000 евро.Имотът е с площ от 87 кв.м, разположен на 9-ти етаж от...",132000.0,EUR,False,продава,тристаен,София,Белите брези,,продава,,https://www.imoti.net/bg/obiava/prodava/sofia/belite-brezi/tristaen/5983760/?sid=iKI3oo&page=1,6,2026-01-19 20:20:48.990661,,imotinet,,,,Цена на /м2/:1 517EUR/2 967.47BGN,87 м2,Етаж: 9 от 12,af5f8004c4e5243df6ad5274cbb4f761
"продаваДвустаен апартамент,45 м2","Продава се двустаен апартамент в кв. Лагера първи етаж, източно изложениеЛокация: кв. Лагера тиха и добре уредена част на София, с удобен достъп до центъра, градски транспорт (трамвай,...",149000.0,EUR,False,продава,двустаен,София,Лагера,,продава,,https://www.imoti.net/bg/obiava/prodava/sofia/lagera/dvustaen/6183919/?sid=iKI3oo&page=1,14,2026-01-19 20:20:48.991419,,imotinet,,,,Цена на /м2/:3 311EUR/6 475.97BGN,45 м2,Етаж: 1 от 4,0d0fad7168b7f3fb3aed2ab64b49e278
"продаваДвустаен апартамент,45 м2","Компания `ЕКС` представя на Вашето внимание двустаен апартамент в ж.к. Лагера.МЕСТОПОЛОЖЕНИЕ: В близост ще намерите различни транспортни връзки, училища, детски градини и търговски...",179000.0,EUR,False,продава,двустаен,София,Лагера,,продава,,https://www.imoti.net/bg/obiava/prodava/sofia/lagera/dvustaen/6107928/?sid=iKI3oo&page=1,1,2026-01-19 20:20:48.992124,,imotinet,,,,Цена на /м2/:3 978EUR/7 779.86BGN,45 м2,Етаж: 3 от 6,f822bb01f3a47863bd03cdd68888d42b
"продаваДвустаен апартамент,45 м2","Светло двустайно жилище с югоизточно изложение, на 12-ти, последен етаж , с панорамни гледки към планината. Състои се от просторна дневна, спалня, обособен кухненески бокс,...",179000.0,EUR,False,продава,двустаен,София,Стрелбище,,продава,,https://www.imoti.net/bg/obiava/prodava/sofia/strelbishte/dvustaen/6197115/?sid=iKI3oo&page=1,14,2026-01-19 20:20:48.992801,,imotinet,,,,Цена на /м2/:3 978EUR/7 779.86BGN,45 м2,Етаж: 12 от 12,f822bb01f3a47863bd03cdd68888d42b
"продаваДвустаен апартамент,50 м2",,180000.0,EUR,False,продава,двустаен,София,Лагера,,продава,,https://www.imoti.net/bg/obiava/prodava/sofia/lagera/dvustaen/6099325/?sid=iKI3oo&page=1,6,2026-01-19 20:20:48.993484,,imotinet,,,,Цена на /м2/:3 600EUR/7 040.99BGN,50 м2,Етаж: 14 от 18,23445a86aefc548450dab3aca7433c7c
"продаваТристаен апартамент,55 м2","За повече информация свържете се с нас и цитирайте референтния номер на имота. Моля, кажете, че сте видeли обявата в imoti.net.Референтен номер: Sfa 87954Тел: 0882 817...",185000.0,EUR,False,продава,тристаен,София,Лозенец,,продава,,https://www.imoti.net/bg/obiava/prodava/sofia/lozenec/tristaen/6195910/?sid=iKI3oo&page=1,16,2026-01-19 20:20:48.994254,,imotinet,,,,Цена на /м2/:3 364EUR/6 578.70BGN,55 м2,Етаж:  от 1,4b4148ab30b208dc4d111885ac1d75fd
"продаваДвустаен апартамент,78 м2","Агенция Пандора Естейт предлага ЕКСКЛУЗИВНО за продажба двустаен обзаведен апартамент в кв. Стрелбище.Имотът разполага с отопление на ток, с възможност за поставяне на радиатори за...",187000.0,EUR,False,продава,двустаен,София,Стрелбище,,продава,,https://www.imoti.net/bg/obiava/prodava/sofia/strelbishte/dvustaen/5982548/?sid=iKI3oo&page=1,4,2026-01-19 20:20:48.994943,,imotinet,,,,Цена на /м2/:2 397EUR/4 688.98BGN,78 м2,Етаж: 7 от 13,fd392fce5cad5dbd81a91061c6919f73
"продаваДвустаен апартамент,50 м2","Хоум Лайт предлага на Вашето внимание двустаен апартамент, разположен на метри от Южен парк в един от най- желаните райони на южна София, кв. Стрелбище.Тих, спокоен и зелен район с отлично...",190000.0,EUR,False,продава,двустаен,София,Стрелбище,,продава,,https://www.imoti.net/bg/obiava/prodava/sofia/strelbishte/dvustaen/6098655/?sid=iKI3oo&page=1,1,2026-01-19 20:20:48.995633,,imotinet,,,,Цена на /м2/:3 800EUR/7 432.15BGN,50 м2,Етаж: 3 от 14,a368c3b6c5bbb600f81a2e36d29ba14e
"продаваТристаен апартамент,84 м2","Агенция за недвижими имоти Пандора естейт продава ексклузивно.Реф. № 110192.Тристайни апартаменти в кв. Хиподрума, с отличен достъп до транспортни средства и удобства.Цена:...",191000.0,EUR,False,продава,тристаен,София,Хиподрума,,продава,,https://www.imoti.net/bg/obiava/prodava/sofia/hipodruma/tristaen/6019423/?sid=iKI3oo&page=1,8,2026-01-19 20:20:48.996339,,imotinet,,,,Цена на /м2/:2 274EUR/4 447.18BGN,84 м2,Етаж: 2 от 15,9e32e68c3c80e6dad49306e5f0f3b17f
"продаваДвустаен апартамент,64 м2","МЕТРО!ПАЗАР КРАСНО СЕЛО!Предстоящо строителство на малка и кокетна сграда в един от най-предпочитаните райони за живеене, а именно район Красно село. Висок клас...",192000.0,EUR,False,продава,двустаен,София,Белите брези,,продава,,https://www.imoti.net/bg/obiava/prodava--v-stroej/sofia/belite-brezi/dvustaen/6139302/?sid=iKI3oo&page=1,1,2026-01-19 20:20:48.997026,,imotinet,,,,Цена на /м2/:3 000EUR/5 867.49BGN,64 м2,Етаж: 3 от 6,22f09e4844323c495e75e6c326435c5c
"продаваДвустаен апартамент,62 м2","ЕРА Голд представя двустаен апартамент в новострояща се сграда в ж.к. Стрелбище на перфектна локация в близост до бул. България, супермаркет Фантастико, не далеч от Южен Парк, в близост до...",192617.0,EUR,False,продава,двустаен,София,Стрелбище,,продава,,https://www.imoti.net/bg/obiava/prodava--v-stroej/sofia/strelbishte/dvustaen/6037572/?sid=iKI3oo&page=1,2,2026-01-19 20:20:48.997706,,imotinet,,,,Цена на /м2/:3 107EUR/6 076.23BGN,62 м2,Етаж: 6 от 8,5ccc6a51e902bae98b808764828d95aa
"продаваДвустаен апартамент,62 м2","Компания `ЕКС` представя на Вашето внимание двустаен апартамент в ж.к. Стрелбище.МЕСТОПОЛОЖЕНИЕ: В близост до спирки на градски транспорт, училище, магазини от всякакъв тип....",192617.0,EUR,False,продава,двустаен,София,Стрелбище,,продава,,https://www.imoti.net/bg/obiava/prodava/sofia/strelbishte/dvustaen/6001078/?sid=iKI3oo&page=1,1,2026-01-19 20:20:48.998406,,imotinet,,,,Цена на /м2/:3 107EUR/6 076.23BGN,62 м2,Етаж: 6 от 8,5ccc6a51e902bae98b808764828d95aa
"продаваДвустаен апартамент,67 м2","Двустаен апартамент в новострояща се жилищна сграда пред Акт 14, жк. Лагера, гр. София.Очакван Акт 16 - Декември 2026г.Основни характеристики:Обща площ - 67 кв.м, чиста...",196286.0,EUR,False,продава,двустаен,София,Лагера,,продава,,https://www.imoti.net/bg/obiava/prodava/sofia/lagera/dvustaen/6192218/?sid=iKI3oo&page=1,2,2026-01-19 20:20:48.999123,,imotinet,,,,Цена на /м2/:2 930EUR/5 729.88BGN,67 м2,Етаж: 3 от 6,627235e70e17c9ad7b1675b0fb280081
"продаваДвустаен апартамент,75 м2",.  .  .  .  .  .  .  .  .  .  .  .  .  .  .  .  .  .  .  .  .  .  .  .  .  .  .  .  .  . НОВ .  .  .  .  .  .  .  .  .  .  .  .  .  .  .  .  .  .  .  .  .  .  .  .  .  .  .  .  .  .С А16...,198000.0,EUR,False,продава,двустаен,София,Хладилника,,продава,,https://www.imoti.net/bg/obiava/prodava/sofia/hladilnika/dvustaen/6020840/?sid=iKI3oo&page=1,1,2026-01-19 20:20:48.999804,,imotinet,,,,Цена на /м2/:2 640EUR/5 163.39BGN,75 м2,Етаж: 5 от 11,e2771f362ce4bebf86b7cb17c1944728
"продаваДвустаен апартамент,77 м2",Агенция Пандора Естейт предлага ексклузивно за продажба двустаен апартамент в престижния квартал Лозенец.Площ: 77 кв. мТип строителство: ТухлаГодина на строителство:...,198000.0,EUR,False,продава,двустаен,София,Лозенец,,продава,,https://www.imoti.net/bg/obiava/prodava/sofia/lozenec/dvustaen/5981942/?sid=iKI3oo&page=1,4,2026-01-19 20:20:49.000518,,imotinet,,,,Цена на /м2/:2 571EUR/5 029.28BGN,77 м2,Етаж: 5 от 7,4d228fe49535d57c3e13e46a2899b7be
"продаваТристаен апартамент,80 м2","Просторен тристаен апартамент, ул. Житница, ситуиран на 4-ви етаж от 8, в панелен блок. Жилището е със застроена площ от 80 кв.м. по нотариален акт.  Разпределение: кухня с остъклен балкон,...",199000.0,EUR,False,продава,тристаен,София,Лагера,,продава,,https://www.imoti.net/bg/obiava/prodava/sofia/lagera/tristaen/6071948/?sid=iKI3oo&page=1,16,2026-01-19 20:20:49.001206,,imotinet,,,,Цена на /м2/:2 488EUR/4 865.13BGN,80 м2,Етаж: 4 от 8,eb13a79e78d02700c98bdf0e3d27bbde
"продаваДвустаен апартамент,66 м2",,199999.0,EUR,False,продава,двустаен,София,Лагера,,продава,,https://www.imoti.net/bg/obiava/prodava/sofia/lagera/dvustaen/6032520/?sid=iKI3oo&page=1,16,2026-01-19 20:20:49.001937,,imotinet,,,,Цена на /м2/:3 030EUR/5 926.73BGN,66 м2,Етаж: 2 от 6,749deab6fc505e469419ead3241478da
"продаваДвустаен апартамент,62 м2","Ексклузивно предложение!!! Двустаен, обзаведен в стара тухлена сграда със ЗП- 56.07 кв.м. на ул.“Деде Агач“ в близост до училище, супермаркет, пазар, метростанция, стадион, парк, спирки на градския...",200000.0,EUR,False,продава,двустаен,София,Стрелбище,,продава,,https://www.imoti.net/bg/obiava/prodava/sofia/strelbishte/dvustaen/6142562/?sid=iKI3oo&page=1,14,2026-01-19 20:20:49.002617,,imotinet,,,,Цена на /м2/:3 226EUR/6 309.13BGN,62 м2,Етаж: 7 от 7,5a3422bd5783bee5db27c4b8bfbc70cc
"продаваДвустаен апартамент,59 м2","Двустаен апартамент в добро състояние, на кръстовището на бул. Гоце Делчев и бул. България. Жилището се продава с налично обзавеждане при желание от бъдещия купувач. Разпределение: входно антре,...",200900.0,EUR,False,продава,двустаен,София,Хиподрума,,продава,,https://www.imoti.net/bg/obiava/prodava/sofia/hipodruma/dvustaen/6199028/?sid=iKI3oo&page=1,12,2026-01-19 20:20:49.003348,,imotinet,,,,Цена на /м2/:3 405EUR/6 659.77BGN,59 м2,Етаж: 6 от 11,0cb7d10773418aebc07cc1d8ebfbe075
"продаваДвустаен апартамент,69 м2","ЕРА Младост продава апартамент в сграда с разрешение за ползване от 2024 година,  в динамично развиващия се район Хладилника на община Лозенец, в частта известна като „белия квартал“. В...",205600.0,EUR,False,продава,двустаен,София,Хладилника,,продава,,https://www.imoti.net/bg/obiava/prodava/sofia/hladilnika/dvustaen/6155708/?sid=iKI3oo&page=1,1,2026-01-19 20:20:49.004014,,imotinet,,,,Цена на /м2/:2 980EUR/5 827.81BGN,69 м2,Етаж: 9 от 11,f7b87050a5b0b65d1e959e3938c030bd
"продаваДвустаен апартамент,65 м2",АБ ИМОТИ КОНСУЛТ продава двустаен апартамент преустроен в тристаен. Намира се на бул. 'Цар Борис III' до СРС. Не гледа към булеварда.Атрактивна локация-800 м до метростанция...,205990.0,EUR,False,продава,двустаен,София,Лагера,,продава,,https://www.imoti.net/bg/obiava/prodava/sofia/lagera/dvustaen/6183198/?sid=iKI3oo&page=1,12,2026-01-19 20:20:49.004720,,imotinet,,,,Цена на /м2/:3 169EUR/6 198.18BGN,65 м2,Етаж: 6 от 10,8616e393f6f4c5f2b57e4aff7091657b
"продаваДвустаен апартамент,40 м2",,207500.0,EUR,False,продава,двустаен,София,Лозенец,,продава,,https://www.imoti.net/bg/obiava/prodava/sofia/lozenec/dvustaen/6085382/?sid=iKI3oo&page=1,2,2026-01-19 20:20:49.005424,,imotinet,,,,Цена на /м2/:5 188EUR/10 145.87BGN,40 м2,Етаж: 3 от 5,af5f8557a6deb4ac201241c038635212
"продаваДвустаен апартамент,42 м2",Референтен номер: 2094783Революшън Естейт представя Двустаен апартамент в ж.к. Хиподрума.- Етаж: 1-ви от 3-ти.- Площ: 42 кв.м.- Разпределение:...,210000.0,EUR,False,продава,двустаен,София,Хиподрума,,продава,,https://www.imoti.net/bg/obiava/prodava/sofia/hipodruma/dvustaen/6141285/?sid=iKI3oo&page=2,10,2026-01-19 20:20:53.228925,,imotinet,,,,Цена на /м2/:5 000EUR/9 779.15BGN,42 м2,Етаж: 1 от 3,8e07a0c7b135a91a39788b91df650de4
"продаваДвустаен апартамент,57 м2","Предлагаме Ви двустаен слънчев, напълно обзаведен апартамент в кв.Лагера. Състои се от входно антре, всекидневна с кухненски бокс, спалня, баня с тоалетна, голям балкон. Югоизточно изложение. На...",214300.0,EUR,False,продава,двустаен,София,Лагера,,продава,,https://www.imoti.net/bg/obiava/prodava/sofia/lagera/dvustaen/6177295/?sid=iKI3oo&page=2,10,2026-01-19 20:20:53.229634,,imotinet,,,,Цена на /м2/:3 760EUR/7 353.23BGN,57 м2,Етаж: 6 от 6,07dd107e270d8bf207af0f7ba7a10129
"продаваДвустаен апартамент,78 м2",New Estates има удоволствието да ви представи нова бутикова сграда в един от най-желаните райони в София - кв. Лозенец. Районът е добре позициониран от гледна точка на комуникации и достъпност в...,217775.0,EUR,False,продава,двустаен,София,Лозенец,,продава,,https://www.imoti.net/bg/obiava/prodava--v-stroej/sofia/lozenec/dvustaen/5759535/?sid=iKI3oo&page=2,17,2026-01-19 20:20:53.230323,,imotinet,,,,Цена на /м2/:2 792EUR/5 460.65BGN,78 м2,Етаж: 3 от 7,c971713090d42031e87e420bae7662e1
"продаваДвустаен апартамент,76 м2",НАЧАЛЕН ЕТАП НА СТРОИТЕЛСТВО!АКТ 14 МАРТ НА 2026г.!АКТ 15 КРАЯ НА 2026г!АКТ 16 НАЧАЛОТО НА 2027г!ИРИДА НЕДВИЖИМИ ИМОТИ продава просторен двустаен апартамент в...,218526.0,EUR,False,продава,двустаен,София,Стрелбище,,продава,,https://www.imoti.net/bg/obiava/prodava--v-stroej/sofia/strelbishte/dvustaen/6038314/?sid=iKI3oo&page=2,6,2026-01-19 20:20:53.231100,,imotinet,,,,Цена на /м2/:2 875EUR/5 623.68BGN,76 м2,Етаж: 2 от 8,1ac8839c84f2222ed24725411fd3274b
"продаваДвустаен апартамент,76 м2","Пред Акт 14 - 02.2026 г. Акт 16 - 11.2026 г.Представяме двустаен апартамент за продажба в атрактивна сграда ново строителство на топ локация в кв. ""Стрелбище"", в близост до булеварди...",218526.0,EUR,False,продава,двустаен,София,Стрелбище,,продава,,https://www.imoti.net/bg/obiava/prodava--v-stroej/sofia/strelbishte/dvustaen/6026314/?sid=iKI3oo&page=2,3,2026-01-19 20:20:53.231790,,imotinet,,,,Цена на /м2/:2 875EUR/5 623.68BGN,76 м2,Етаж:  от 8,1ac8839c84f2222ed24725411fd3274b
"продаваТристаен апартамент,94 м2","Агенция за недвижими имоти Пандора естейт продава ексклузивно.Реф. № 110146.Тристаен апартамент в кв. Хладилника, намиращ се в модерен район с всички необходими удобства....",220000.0,EUR,False,продава,тристаен,София,Хладилника,,продава,,https://www.imoti.net/bg/obiava/prodava/sofia/hladilnika/tristaen/5983884/?sid=iKI3oo&page=2,8,2026-01-19 20:20:53.232504,,imotinet,,,,Цена на /м2/:2 340EUR/4 577.47BGN,94 м2,Етаж: 3 от 5,857c1102007f3219938f2f1f9c6f5c61
"продаваДвустаен апартамент,81 м2",РС ЕСТЕЙТС предлага за продажба:Двустаен апартамент в новострояща се луксозна сграда „Twin Tower“ – модерен жилищен проект в премиум градска среда. Първата бранд жилищна сграда у...,220000.0,EUR,False,продава,двустаен,София,Лозенец,,продава,,https://www.imoti.net/bg/obiava/prodava/sofia/lozenec/dvustaen/6154486/?sid=iKI3oo&page=2,12,2026-01-19 20:20:53.233202,,imotinet,,,,Цена на /м2/:2 716EUR/5 312.13BGN,81 м2,Етаж: 7 от 24,56c1f7ff2cc0e4fc3c0c7196861acb1c
