raw_title,raw_description,price,currency,without_dds,offer_type,property_type,city,neighborhood,contact_info,agency,agency_url,details_url,num_photos,date_time_added,search_url,site,total_offers,ref_no,time,price_per_m2,area,floor,fingerprint_hash
"продаваЧетиристаен апартамент,131 м2","ЕРА Голд Ви представя слънчев четиристаен апартамент в нова жилищна сграда в близост до центъра на София и Военномедицинска болница, кв. Лагера.Апартаментът се състои от: предверие,...",241666.0,EUR,False,продава,четиристаен,София,Лагера,,продава,,https://www.imoti.net/bg/obiava/prodava--v-stroej/sofia/lagera/chetiristaen/6121054/?sid=iKI3oo&page=2,7,2026-01-19 20:21:22.811121,,imotinet,,,,Цена на /м2/:1 845EUR/3 608.07BGN,131 м2,Етаж: 6 от 8,c4ce924179f05c1227aeafd616fd75d1
"продаваДвустаен апартамент,85 м2",АКТ 14 МАРТ НА 2026г.!АКТ 15 КРАЯ НА 2026г!АКТ 16 НАЧАЛОТО НА 2027г!ИРИДА НЕДВИЖИМИ ИМОТИ продава просторен двустаен апартамент в сграда с изключително висококачествено...,242395.0,EUR,False,продава,двустаен,София,Стрелбище,,продава,,https://www.imoti.net/bg/obiava/prodava--v-stroej/sofia/strelbishte/dvustaen/6038315/?sid=iKI3oo&page=2,6,2026-01-19 20:21:22.811854,,imotinet,,,,Цена на /м2/:2 852EUR/5 577.45BGN,85 м2,Етаж: 2 от 8,ce642eb4b757f943dbffad23d7956341
"продаваДвустаен апартамент,85 м2",АКТ 14 МАРТ НА 2026г.!АКТ 15 КРАЯ НА 2026!АКТ 16 НАЧАЛОТО НА 2027!ИРИДА НЕДВИЖИМИ ИМОТИ продава просторен двустаен апартамент в сграда с изключително висококачествено...,242395.0,EUR,False,продава,двустаен,София,Стрелбище,,продава,,https://www.imoti.net/bg/obiava/prodava--v-stroej/sofia/strelbishte/dvustaen/6038122/?sid=iKI3oo&page=2,6,2026-01-19 20:21:22.812593,,imotinet,,,,Цена на /м2/:2 852EUR/5 577.45BGN,85 м2,Етаж: 1 от 8,ce642eb4b757f943dbffad23d7956341
"продаваДвустаен апартамент,85 м2",Без комисионна от страна на купувача!!! Galiano Estates има удоволствието да ви представи двустаен апартамент в новострояща се сграда. Разполагаме с ограничени бройки двустайни и тристайни...,242399.0,EUR,False,продава,двустаен,София,Стрелбище,,продава,,https://www.imoti.net/bg/obiava/prodava/sofia/strelbishte/dvustaen/5999886/?sid=iKI3oo&page=2,2,2026-01-19 20:21:22.813396,,imotinet,,,,Цена на /м2/:2 852EUR/5 577.54BGN,85 м2,Етаж: 2 от 7,ce642eb4b757f943dbffad23d7956341
"продаваДвустаен апартамент,84 м2",РС ЕСТЕЙТС предлага за продажба:Апартаменти в нова жилищна сграда в кв. „Стрелбище“Локация:Сградата е разположена на тиха и спокойна улица сред...,242399.0,EUR,False,продава,двустаен,София,Стрелбище,,продава,,https://www.imoti.net/bg/obiava/prodava/sofia/strelbishte/dvustaen/6134165/?sid=iKI3oo&page=2,10,2026-01-19 20:21:22.814141,,imotinet,,,,Цена на /м2/:2 886EUR/5 643.94BGN,84 м2,Етаж: 1 от 6,1d41800a6becb0a3a21a28c2843f719b
"продаваДвустаен апартамент,66 м2","Предлагаме двустаен апартамент, разположен в модерна новострояща се сграда, част от открит комплекс с иновативен дизайн, съвременни технологии и материали от най-висок клас. Локацията е...",243000.0,EUR,False,продава,двустаен,София,Лозенец,,продава,,https://www.imoti.net/bg/obiava/prodava--v-stroej/sofia/lozenec/dvustaen/6174371/?sid=iKI3oo&page=2,4,2026-01-19 20:21:22.814910,,imotinet,,,,Цена на /м2/:3 682EUR/7 201.01BGN,66 м2,Етаж:  от 21,b0a79baddf35bae28e1b65dd363479c3
"продаваТристаен апартамент,146 м2","ЕРА Голд Ви представя южен тристаен апартамент в нова жилищна сграда в близост до центъра на София и Военномедицинска болница, кв. Лагера.Апартаментът се състои от : входно антре,...",250000.0,EUR,False,продава,тристаен,София,Лагера,,продава,,https://www.imoti.net/bg/obiava/prodava--v-stroej/sofia/lagera/tristaen/6121065/?sid=iKI3oo&page=2,5,2026-01-19 20:21:22.816108,,imotinet,,,,Цена на /м2/:1 712EUR/3 349.02BGN,146 м2,Етаж: 2 от 7,28864ed72fbe758838ba719e8eebdc5f
"продаваДвустаен апартамент,42 м2","Двустаен апартамент 42 кв.м. на партерен етаж с изложение изток/запад, в близост до спирка на метро, тролей, трамвайРазположение дневна с кухненси бокс, спалня, баня, коридор, килер,...",250000.0,EUR,False,продава,двустаен,София,Хиподрума,,продава,,https://www.imoti.net/bg/obiava/prodava/sofia/hipodruma/dvustaen/6112763/?sid=iKI3oo&page=2,11,2026-01-19 20:21:22.816823,,imotinet,,,,Цена на /м2/:5 952EUR/11 641.85BGN,42 м2,Етаж: 1 от 4,2259456b4b37377f17ffbef8890c950e
"продаваТристаен апартамент,107 м2",БЕЗ КОМИСИОННА ОТ КУПУВАЧА!Компания `ЕКС` представя на Вашето внимание тристаен апартамент в кв. Хладилника.МЕСТОПОЛОЖЕНИЕ: В близост до спирка на градски...,253000.0,EUR,False,продава,тристаен,София,Хладилника,,продава,,https://www.imoti.net/bg/obiava/prodava--v-stroej/sofia/hladilnika/tristaen/6003109/?sid=iKI3oo&page=2,1,2026-01-19 20:21:22.817533,,imotinet,,,,Цена на /м2/:2 364EUR/4 624.53BGN,107 м2,Етаж: 3 от 18,a81e54f2b9d492dd14cd6739cb185215
"продаваТристаен апартамент,108 м2","БЕЗ КОМИСИОННА ОТ КУПУВАЧА!Компания `ЕКС` представя на Вашето внимание тристаен апартамент в кв. Хладилника.МЕСТОПОЛОЖЕНИЕ: В близост до спирка на градски транспорт,...",255000.0,EUR,False,продава,тристаен,София,Хладилника,,продава,,https://www.imoti.net/bg/obiava/prodava--v-stroej/sofia/hladilnika/tristaen/6003133/?sid=iKI3oo&page=2,1,2026-01-19 20:21:22.818226,,imotinet,,,,Цена на /м2/:2 361EUR/4 617.93BGN,108 м2,Етаж: 3 от 18,436e4af14576adef5ea16316562a8018
"продаваДвустаен апартамент,74 м2","Елегантност в сърцето на един от най-желаните и престижни райони на красивата София!В непосредствена близост до метро, Южен парк, училища, детски градини, множество заведения,...",258778.0,EUR,False,продава,двустаен,София,Лозенец,,продава,,https://www.imoti.net/bg/obiava/prodava--v-stroej/sofia/lozenec/dvustaen/6168797/?sid=iKI3oo&page=2,1,2026-01-19 20:21:22.818888,,imotinet,,,,Цена на /м2/:3 497EUR/6 839.54BGN,74 м2,Етаж: 3 от 6,1dfac2570ba96f00e2d8130b92c98df6
"продаваДвустаен апартамент,42 м2",Референтен номер: 2094783Революшън Естейт представя Двустаен апартамент в ж.к. Хиподрума.- Етаж: 1-ви от 3-ти.- Площ: 42 кв.м.- Разпределение:...,210000.0,EUR,False,продава,двустаен,София,Хиподрума,,продава,,https://www.imoti.net/bg/obiava/prodava/sofia/hipodruma/dvustaen/6141285/?sid=iKI3oo&page=2,10,2026-01-19 20:21:26.694182,,imotinet,,,,Цена на /м2/:5 000EUR/9 779.15BGN,42 м2,Етаж: 1 от 3,8e07a0c7b135a91a39788b91df650de4
"продаваДвустаен апартамент,57 м2","Предлагаме Ви двустаен слънчев, напълно обзаведен апартамент в кв.Лагера. Състои се от входно антре, всекидневна с кухненски бокс, спалня, баня с тоалетна, голям балкон. Югоизточно изложение. На...",214300.0,EUR,False,продава,двустаен,София,Лагера,,продава,,https://www.imoti.net/bg/obiava/prodava/sofia/lagera/dvustaen/6177295/?sid=iKI3oo&page=2,10,2026-01-19 20:21:26.694840,,imotinet,,,,Цена на /м2/:3 760EUR/7 353.23BGN,57 м2,Етаж: 6 от 6,07dd107e270d8bf207af0f7ba7a10129
"продаваДвустаен апартамент,78 м2",New Estates има удоволствието да ви представи нова бутикова сграда в един от най-желаните райони в София - кв. Лозенец. Районът е добре позициониран от гледна точка на комуникации и достъпност в...,217775.0,EUR,False,продава,двустаен,София,Лозенец,,продава,,https://www.imoti.net/bg/obiava/prodava--v-stroej/sofia/lozenec/dvustaen/5759535/?sid=iKI3oo&page=2,17,2026-01-19 20:21:26.695511,,imotinet,,,,Цена на /м2/:2 792EUR/5 460.65BGN,78 м2,Етаж: 3 от 7,c971713090d42031e87e420bae7662e1
"продаваДвустаен апартамент,76 м2",НАЧАЛЕН ЕТАП НА СТРОИТЕЛСТВО!АКТ 14 МАРТ НА 2026г.!АКТ 15 КРАЯ НА 2026г!АКТ 16 НАЧАЛОТО НА 2027г!ИРИДА НЕДВИЖИМИ ИМОТИ продава просторен двустаен апартамент в...,218526.0,EUR,False,продава,двустаен,София,Стрелбище,,продава,,https://www.imoti.net/bg/obiava/prodava--v-stroej/sofia/strelbishte/dvustaen/6038314/?sid=iKI3oo&page=2,6,2026-01-19 20:21:26.696249,,imotinet,,,,Цена на /м2/:2 875EUR/5 623.68BGN,76 м2,Етаж: 2 от 8,1ac8839c84f2222ed24725411fd3274b
"продаваДвустаен апартамент,76 м2","Пред Акт 14 - 02.2026 г. Акт 16 - 11.2026 г.Представяме двустаен апартамент за продажба в атрактивна сграда ново строителство на топ локация в кв. ""Стрелбище"", в близост до булеварди...",218526.0,EUR,False,продава,двустаен,София,Стрелбище,,продава,,https://www.imoti.net/bg/obiava/prodava--v-stroej/sofia/strelbishte/dvustaen/6026314/?sid=iKI3oo&page=2,3,2026-01-19 20:21:26.696906,,imotinet,,,,Цена на /м2/:2 875EUR/5 623.68BGN,76 м2,Етаж:  от 8,1ac8839c84f2222ed24725411fd3274b
"продаваТристаен апартамент,94 м2","Агенция за недвижими имоти Пандора естейт продава ексклузивно.Реф. № 110146.Тристаен апартамент в кв. Хладилника, намиращ се в модерен район с всички необходими удобства....",220000.0,EUR,False,продава,тристаен,София,Хладилника,,продава,,https://www.imoti.net/bg/obiava/prodava/sofia/hladilnika/tristaen/5983884/?sid=iKI3oo&page=2,8,2026-01-19 20:21:26.697583,,imotinet,,,,Цена на /м2/:2 340EUR/4 577.47BGN,94 м2,Етаж: 3 от 5,857c1102007f3219938f2f1f9c6f5c61
"продаваДвустаен апартамент,81 м2",РС ЕСТЕЙТС предлага за продажба:Двустаен апартамент в новострояща се луксозна сграда „Twin Tower“ – модерен жилищен проект в премиум градска среда. Първата бранд жилищна сграда у...,220000.0,EUR,False,продава,двустаен,София,Лозенец,,продава,,https://www.imoti.net/bg/obiava/prodava/sofia/lozenec/dvustaen/6154486/?sid=iKI3oo&page=2,12,2026-01-19 20:21:26.698250,,imotinet,,,,Цена на /м2/:2 716EUR/5 312.13BGN,81 м2,Етаж: 7 от 24,56c1f7ff2cc0e4fc3c0c7196861acb1c
"продаваДвустаен апартамент,78 м2",АКТ 14 МАРТ НА 2026г.!АКТ 15 КРАЯ НА 2026!АКТ 16 НАЧАЛОТО НА 2027!ИРИДА НЕДВИЖИМИ ИМОТИ продава просторен двустаен апартамент в сграда с изключително висококачествено...,224596.0,EUR,False,продава,двустаен,София,Стрелбище,,продава,,https://www.imoti.net/bg/obiava/prodava--v-stroej/sofia/strelbishte/dvustaen/6038321/?sid=iKI3oo&page=2,6,2026-01-19 20:21:26.698972,,imotinet,,,,Цена на /м2/:2 879EUR/5 631.69BGN,78 м2,Етаж: 7 от 8,58e126723ea18a88a2dd0e4d2130e1f4
"продаваДвустаен апартамент,78 м2","ЕРА Голд представя двустаен апартамент в новострояща се сграда в ж.к. Стрелбище на перфектна локация в близост до бул. България, супермаркет Фантастико, не далеч от Южен Парк, в близост до...",224596.0,EUR,False,продава,двустаен,София,Стрелбище,,продава,,https://www.imoti.net/bg/obiava/prodava--v-stroej/sofia/strelbishte/dvustaen/6037574/?sid=iKI3oo&page=2,2,2026-01-19 20:21:26.699634,,imotinet,,,,Цена на /м2/:2 879EUR/5 631.69BGN,78 м2,Етаж: 7 от 8,58e126723ea18a88a2dd0e4d2130e1f4
"продаваДвустаен апартамент,81 м2",РС ЕСТЕЙТС предлага за продажба:Двустаен апартамент в новострояща се луксозна сграда „Twin Tower“ – модерен жилищен проект в премиум градска среда. Първата бранд жилищна сграда у...,226800.0,EUR,False,продава,двустаен,София,Лозенец,,продава,,https://www.imoti.net/bg/obiava/prodava--v-stroej/sofia/lozenec/dvustaen/6156808/?sid=iKI3oo&page=2,9,2026-01-19 20:21:26.700312,,imotinet,,,,Цена на /м2/:2 800EUR/5 476.32BGN,81 м2,Етаж: 7 от 24,1f2014dc8735daff81c55334522e9f86
"продаваДвустаен апартамент,79 м2","АКТ 14 МАРТ НА 2026г.!АКТ 15 КРАЯ НА 2026!АКТ 16 НАЧАЛОТО НА 2027!ИРИДА НЕДВИЖИМИ ИМОТИ продава двустаен апартамент в новоизграждаща се сграда, с изключително...",227000.0,EUR,False,продава,двустаен,София,Стрелбище,,продава,,https://www.imoti.net/bg/obiava/prodava--v-stroej/sofia/strelbishte/dvustaen/6038123/?sid=iKI3oo&page=2,6,2026-01-19 20:21:26.701045,,imotinet,,,,Цена на /м2/:2 873EUR/5 619.92BGN,79 м2,Етаж: 0 от 8,5180e2dc14ae64b7a5310787b1be030a
"продаваДвустаен апартамент,60 м2","Апартамента е ремонтиран преди 2 год. , изцяло източно изложение с гледка към южен парк Общите части са нови и подържани.Реални 60кв./м. жилищна площ.ЗА ДИРЕКТНИ КЛИЕНТИНе...",228000.0,EUR,False,продава,двустаен,София,Стрелбище,,продава,,https://www.imoti.net/bg/obiava/prodava/sofia/strelbishte/dvustaen/6130042/?sid=iKI3oo&page=2,11,2026-01-19 20:21:26.701738,,imotinet,,,,Цена на /м2/:3 800EUR/7 432.15BGN,60 м2,Етаж: 6 от 8,b1d1c6289bd1a49f6008a5e7898a5237
"продаваДвустаен апартамент,74 м2","Просторен тухлен апартамент в нова сграда, в района на Военномедицинска академия, супермаркет БИЛА, ул. Св. Георги Софийски и Медицинска академия.Съобразно, изключително привлекателното и...",230000.0,EUR,False,продава,двустаен,София,Лагера,,продава,,https://www.imoti.net/bg/obiava/prodava/sofia/lagera/dvustaen/6179093/?sid=iKI3oo&page=2,7,2026-01-19 20:21:26.702402,,imotinet,,,,Цена на /м2/:3 108EUR/6 078.93BGN,74 м2,Етаж: 2 от 6,56db96d84455b201fb417cf7f7975f6e
"продаваДвустаен апартамент,73 м2",".  .  .  .  .  .  .  .  .  .  .  .  .  .  .  .  .  .  .  .  .  .  .  .  .  .  .  .  .  . ИЗКЛЮЧИТЕЛЕН .  .  .  .  .  .  .  .  .  .  .  .  .  .  .  .  .  .  .  .  .  .  .  .  .  .  .  .  .  .,",230000.0,EUR,False,продава,двустаен,София,Хиподрума,,продава,,https://www.imoti.net/bg/obiava/prodava/sofia/hipodruma/dvustaen/6041661/?sid=iKI3oo&page=2,8,2026-01-19 20:21:26.703048,,imotinet,,,,Цена на /м2/:3 151EUR/6 162.20BGN,73 м2,Етаж: 2 от 7,07db99ea218475921601e63e1a647388
"продаваТристаен апартамент,135 м2","ЕРА Голд Ви представя южен тристаен апартамент в нова жилищна сграда в близост до центъра на София и Военномедицинска болница, кв. Лагера.Разпределение: Входно антре и коридор,...",233333.0,EUR,False,продава,тристаен,София,Лагера,,продава,,https://www.imoti.net/bg/obiava/prodava--v-stroej/sofia/lagera/tristaen/6121064/?sid=iKI3oo&page=2,5,2026-01-19 20:21:26.703714,,imotinet,,,,Цена на /м2/:1 728EUR/3 380.44BGN,135 м2,Етаж: 4 от 7,8d502c9a8daf673cdbe5cefe0dacbdde
"продаваДвустаен апартамент,68 м2","Чисто нов, луксозно обзаведен и напълно оборудван апартамент в нова сграда с Акт 16 от 12.2024 г.Намира се на тиха, но комуникативна улица, само на няколко минути от бул. Черни връх....",235000.0,EUR,False,продава,двустаен,София,Лозенец,,продава,,https://www.imoti.net/bg/obiava/prodava/sofia/lozenec/dvustaen/6138464/?sid=iKI3oo&page=2,12,2026-01-19 20:21:26.704382,,imotinet,,,,Цена на /м2/:3 456EUR/6 759.12BGN,68 м2,Етаж: 2 от 5,08637e98cf8ab6e108843f6de9e330e7
"продаваДвустаен апартамент,58 м2","Двустаен апартамент с обзавеждане в кв.'Стрелбище' на бул.България  срещу Парк „Хиподрума“ и метростанция ""България"". Сградата е с разрешение за ползване от 2000 г. Имотът се намира на удобно място...",238000.0,EUR,False,продава,двустаен,София,Стрелбище,,продава,,https://www.imoti.net/bg/obiava/prodava--v-stroej/sofia/strelbishte/dvustaen/6128527/?sid=iKI3oo&page=2,14,2026-01-19 20:21:26.705087,,imotinet,,,,Цена на /м2/:4 103EUR/8 025.65BGN,58 м2,Етаж:  от 10,e283d617e941aea9934a10f4dd7d4f0e
"продаваДвустаен апартамент,70 м2",Депозиран!Двустаен апартамент в кв. Стрелбище – отлична локация и удобства!l в един от най- желаните райони в столицата !Примо+ Недвижими имоти има удоволствието да Ви...,239900.0,EUR,False,продава,двустаен,София,Стрелбище,,продава,,https://www.imoti.net/bg/obiava/prodava/sofia/strelbishte/dvustaen/6158636/?sid=iKI3oo&page=2,9,2026-01-19 20:21:26.705775,,imotinet,,,,Цена на /м2/:3 427EUR/6 702.91BGN,70 м2,Етаж: 2 от 6,fb8e58d77b0fb31f6206a10cbb376c6e
"продаваДвустаен апартамент,60 м2","ХОУМ ЛАЙТ продава напълно обзаведен двустаен апартамент в тухлена, монолитна сграда на улица Софийски герой, на границата на кварталите Хиподрума и Медицинска академия.Жилището е разположено...",239900.0,EUR,False,продава,двустаен,София,Хиподрума,,продава,,https://www.imoti.net/bg/obiava/prodava/sofia/hipodruma/dvustaen/6112411/?sid=iKI3oo&page=2,5,2026-01-19 20:21:26.706435,,imotinet,,,,Цена на /м2/:3 998EUR/7 820.06BGN,60 м2,Етаж: 6 от 8,df3813070e04b83b5fd5ee3232b754e7
"продаваЧетиристаен апартамент,131 м2","ЕРА Голд Ви представя слънчев четиристаен апартамент в нова жилищна сграда в близост до центъра на София и Военномедицинска болница, кв. Лагера.Апартаментът се състои от: предверие,...",241666.0,EUR,False,продава,четиристаен,София,Лагера,,продава,,https://www.imoti.net/bg/obiava/prodava--v-stroej/sofia/lagera/chetiristaen/6121054/?sid=iKI3oo&page=2,7,2026-01-19 20:21:26.707103,,imotinet,,,,Цена на /м2/:1 845EUR/3 608.07BGN,131 м2,Етаж: 6 от 8,c4ce924179f05c1227aeafd616fd75d1
"продаваДвустаен апартамент,85 м2",АКТ 14 МАРТ НА 2026г.!АКТ 15 КРАЯ НА 2026г!АКТ 16 НАЧАЛОТО НА 2027г!ИРИДА НЕДВИЖИМИ ИМОТИ продава просторен двустаен апартамент в сграда с изключително висококачествено...,242395.0,EUR,False,продава,двустаен,София,Стрелбище,,продава,,https://www.imoti.net/bg/obiava/prodava--v-stroej/sofia/strelbishte/dvustaen/6038315/?sid=iKI3oo&page=2,6,2026-01-19 20:21:26.707824,,imotinet,,,,Цена на /м2/:2 852EUR/5 577.45BGN,85 м2,Етаж: 2 от 8,ce642eb4b757f943dbffad23d7956341
"продаваДвустаен апартамент,85 м2",АКТ 14 МАРТ НА 2026г.!АКТ 15 КРАЯ НА 2026!АКТ 16 НАЧАЛОТО НА 2027!ИРИДА НЕДВИЖИМИ ИМОТИ продава просторен двустаен апартамент в сграда с изключително висококачествено...,242395.0,EUR,False,продава,двустаен,София,Стрелбище,,продава,,https://www.imoti.net/bg/obiava/prodava--v-stroej/sofia/strelbishte/dvustaen/6038122/?sid=iKI3oo&page=2,6,2026-01-19 20:21:26.708552,,imotinet,,,,Цена на /м2/:2 852EUR/5 577.45BGN,85 м2,Етаж: 1 от 8,ce642eb4b757f943dbffad23d7956341
"продаваДвустаен апартамент,85 м2",Без комисионна от страна на купувача!!! Galiano Estates има удоволствието да ви представи двустаен апартамент в новострояща се сграда. Разполагаме с ограничени бройки двустайни и тристайни...,242399.0,EUR,False,продава,двустаен,София,Стрелбище,,продава,,https://www.imoti.net/bg/obiava/prodava/sofia/strelbishte/dvustaen/5999886/?sid=iKI3oo&page=2,2,2026-01-19 20:21:26.709257,,imotinet,,,,Цена на /м2/:2 852EUR/5 577.54BGN,85 м2,Етаж: 2 от 7,ce642eb4b757f943dbffad23d7956341
"продаваДвустаен апартамент,84 м2",РС ЕСТЕЙТС предлага за продажба:Апартаменти в нова жилищна сграда в кв. „Стрелбище“Локация:Сградата е разположена на тиха и спокойна улица сред...,242399.0,EUR,False,продава,двустаен,София,Стрелбище,,продава,,https://www.imoti.net/bg/obiava/prodava/sofia/strelbishte/dvustaen/6134165/?sid=iKI3oo&page=2,10,2026-01-19 20:21:26.709937,,imotinet,,,,Цена на /м2/:2 886EUR/5 643.94BGN,84 м2,Етаж: 1 от 6,1d41800a6becb0a3a21a28c2843f719b
"продаваДвустаен апартамент,66 м2","Предлагаме двустаен апартамент, разположен в модерна новострояща се сграда, част от открит комплекс с иновативен дизайн, съвременни технологии и материали от най-висок клас. Локацията е...",243000.0,EUR,False,продава,двустаен,София,Лозенец,,продава,,https://www.imoti.net/bg/obiava/prodava--v-stroej/sofia/lozenec/dvustaen/6174371/?sid=iKI3oo&page=2,4,2026-01-19 20:21:26.710649,,imotinet,,,,Цена на /м2/:3 682EUR/7 201.01BGN,66 м2,Етаж:  от 21,b0a79baddf35bae28e1b65dd363479c3
