imotbg_title,imotbg_price,imotbg_listing_id,imotbg_location,imotbg_description,imotbg_contact_info,imotbg_agency_url,imotbg_details_url,imotbg_num_photos,imotbg_date_added,title,price,currency,offer_type,property_type,city,neighborhood,description,contact_info,agency_url,details_url,num_photos,date_added,site,floor,price_per_m2,ref_no
Продава 3-СТАЕН,399 000 EUR,1c171336547356465,"град София, Хладилника","132 кв.м, 4-ти ет. от 5, Тухла 2024 г., Титан Пропъртис - офис Черни връх има удоволствието да Ви представи слънчев непреходен тристаен апар ..., тел.: 0889017557",0889017557,https://titanteam.imot.bg/,https://www.imot.bg/pcgi/imot.cgi?act=5&adv=1c171336547356465&slink=bi18s2&f1=14,12,2025-01-06 18:02:40.146837,Продава 3-СТАЕН,399000,EUR,Продава,PropertyType.TRISTAEN,град София,Хладилника,"132 кв.м, 4-ти ет. от 5, Тухла 2024 г., Титан Пропъртис - офис Черни връх има удоволствието да Ви представи слънчев непреходен тристаен апар ..., тел.: 0889017557",0889017557,https://titanteam.imot.bg/,https://www.imot.bg/pcgi/imot.cgi?act=5&adv=1c171336547356465&slink=bi18s2&f1=14,12,2025-01-06 18:02:40.146837,Site.IMOTBG,,,1c171336547356465
Продава 3-СТАЕН,399 000 EUR,1c173289062798797,"град София, Хладилника","124 кв.м, 5-ти ет. от 6, Тухла 2023 г., ***Видео под текста*** Комплекс So Home е с абсолютно безкомпромисни общи части, изцяло подземен пар ..., тел.: 0892041111",0892041111,https://k5imoti.imot.bg/,https://www.imot.bg/pcgi/imot.cgi?act=5&adv=1c173289062798797&slink=bi18s2&f1=14,17,2025-01-06 18:02:40.147123,Продава 3-СТАЕН,399000,EUR,Продава,PropertyType.TRISTAEN,град София,Хладилника,"124 кв.м, 5-ти ет. от 6, Тухла 2023 г., ***Видео под текста*** Комплекс So Home е с абсолютно безкомпромисни общи части, изцяло подземен пар ..., тел.: 0892041111",0892041111,https://k5imoti.imot.bg/,https://www.imot.bg/pcgi/imot.cgi?act=5&adv=1c173289062798797&slink=bi18s2&f1=14,17,2025-01-06 18:02:40.147123,Site.IMOTBG,,,1c173289062798797
Продава 3-СТАЕН,400 000 EUR,1c173333104659902,"град София, Хладилника","118 кв.м, 3-ти ет. от 8, ТЕЦ, Тухла 2004 г., Топъл и слънчев непреходен тристаен апартамент на супер комуникативно място. В близост до Метро, тра ..., тел.: 0887623517",0887623517,https://none/,https://www.imot.bg/pcgi/imot.cgi?act=5&adv=1c173333104659902&slink=bi18s2&f1=14,17,2025-01-06 18:02:40.147403,Продава 3-СТАЕН,400000,EUR,Продава,PropertyType.TRISTAEN,град София,Хладилника,"118 кв.м, 3-ти ет. от 8, ТЕЦ, Тухла 2004 г., Топъл и слънчев непреходен тристаен апартамент на супер комуникативно място. В близост до Метро, тра ..., тел.: 0887623517",0887623517,https://none/,https://www.imot.bg/pcgi/imot.cgi?act=5&adv=1c173333104659902&slink=bi18s2&f1=14,17,2025-01-06 18:02:40.147403,Site.IMOTBG,,,1c173333104659902
Продава 3-СТАЕН,400 000 EUR,1c173141556325951,"град София, Хладилника","130 кв.м, 5-ти ет. от 8, Газ, ТЕЦ, Тухла 2022 г., БЕЗ КОМИСИОН ОТ КУПУВАЧ!   С Апартамент 022 ELEHOME ви предлага една изключително красива, функциона ..., тел.: 0885588888",0885588888,https://elehome.imot.bg/,https://www.imot.bg/pcgi/imot.cgi?act=5&adv=1c173141556325951&slink=bi18s2&f1=14,17,2025-01-06 18:02:40.147717,Продава 3-СТАЕН,400000,EUR,Продава,PropertyType.TRISTAEN,град София,Хладилника,"130 кв.м, 5-ти ет. от 8, Газ, ТЕЦ, Тухла 2022 г., БЕЗ КОМИСИОН ОТ КУПУВАЧ!   С Апартамент 022 ELEHOME ви предлага една изключително красива, функциона ..., тел.: 0885588888",0885588888,https://elehome.imot.bg/,https://www.imot.bg/pcgi/imot.cgi?act=5&adv=1c173141556325951&slink=bi18s2&f1=14,17,2025-01-06 18:02:40.147717,Site.IMOTBG,,,1c173141556325951
Продава 3-СТАЕН,410 000 EUR,1c173392397868783,"град София, Хладилника","112 кв.м, 4-ти ет. от 6, Газ, Предлагаме на вашето внимание изключителен тристаен апартамент, разположен в 'Белият квартал'.  Пара ..., тел.: 0882731870",0882731870,https://eshome.imot.bg/,https://www.imot.bg/pcgi/imot.cgi?act=5&adv=1c173392397868783&slink=bi18s2&f1=14,13,2025-01-06 18:02:40.147996,Продава 3-СТАЕН,410000,EUR,Продава,PropertyType.TRISTAEN,град София,Хладилника,"112 кв.м, 4-ти ет. от 6, Газ, Предлагаме на вашето внимание изключителен тристаен апартамент, разположен в 'Белият квартал'.  Пара ..., тел.: 0882731870",0882731870,https://eshome.imot.bg/,https://www.imot.bg/pcgi/imot.cgi?act=5&adv=1c173392397868783&slink=bi18s2&f1=14,13,2025-01-06 18:02:40.147996,Site.IMOTBG,,,1c173392397868783
Продава 3-СТАЕН,420 000 EUR,1c172191340558769,"град София, Хладилника","132 кв.м, 4-ти ет. от 5, Тухла 2024 г., Компания `ЕКС` представя на Вашето внимание тристаен апартамент в един от най-предпочитаните райони  ..., тел.: 0887779990",0887779990,https://exnvd.imot.bg/,https://www.imot.bg/pcgi/imot.cgi?act=5&adv=1c172191340558769&slink=bi18s2&f1=14,4,2025-01-06 18:02:40.148279,Продава 3-СТАЕН,420000,EUR,Продава,PropertyType.TRISTAEN,град София,Хладилника,"132 кв.м, 4-ти ет. от 5, Тухла 2024 г., Компания `ЕКС` представя на Вашето внимание тристаен апартамент в един от най-предпочитаните райони  ..., тел.: 0887779990",0887779990,https://exnvd.imot.bg/,https://www.imot.bg/pcgi/imot.cgi?act=5&adv=1c172191340558769&slink=bi18s2&f1=14,4,2025-01-06 18:02:40.148279,Site.IMOTBG,,,1c172191340558769
Продава 3-СТАЕН,373 350 EURЦената е без ДДС,1c171766746696125,"град София, Хладилника","131 кв.м, 4-ти ет. от 6, BULGARIA SOTHEBY S INTERNATIONAL REALTY представя на Вашето внимание функционален тристаен апартамен ..., тел.: 02/9632460",02/9632460,https://bulgariasir.imot.bg/,https://www.imot.bg/pcgi/imot.cgi?act=5&adv=1c171766746696125&slink=bi18s2&f1=14,17,2025-01-06 18:02:40.148592,Продава 3-СТАЕН,373350,EUR,Продава,PropertyType.TRISTAEN,град София,Хладилника,"131 кв.м, 4-ти ет. от 6, BULGARIA SOTHEBY S INTERNATIONAL REALTY представя на Вашето внимание функционален тристаен апартамен ..., тел.: 02/9632460",02/9632460,https://bulgariasir.imot.bg/,https://www.imot.bg/pcgi/imot.cgi?act=5&adv=1c171766746696125&slink=bi18s2&f1=14,17,2025-01-06 18:02:40.148592,Site.IMOTBG,,,1c171766746696125
Продава 3-СТАЕН,462 000 EUR,1c170323542824663,"град София, Хладилника","130 кв.м, 1-ви ет. от 5, Тухла 2020 г., Предлагаме за продажба тристаен апартамент с площ от 130 кв.м, разположен на първи етаж над партер,  ..., тел.: 02 439 4000",02 439 4000,https://braintrust.imot.bg/,https://www.imot.bg/pcgi/imot.cgi?act=5&adv=1c170323542824663&slink=bi18s2&f1=14,13,2025-01-06 18:02:40.148883,Продава 3-СТАЕН,462000,EUR,Продава,PropertyType.TRISTAEN,град София,Хладилника,"130 кв.м, 1-ви ет. от 5, Тухла 2020 г., Предлагаме за продажба тристаен апартамент с площ от 130 кв.м, разположен на първи етаж над партер,  ..., тел.: 02 439 4000",02 439 4000,https://braintrust.imot.bg/,https://www.imot.bg/pcgi/imot.cgi?act=5&adv=1c170323542824663&slink=bi18s2&f1=14,13,2025-01-06 18:02:40.148883,Site.IMOTBG,,,1c170323542824663
Продава 3-СТАЕН,473 800 EUR,1c173494577460777,"град София, Хладилника","110 кв.м, 5-ти ет. от 6, Лок.отопл., Тухла 2023 г., Агенция за недвижими имоти Калиста Естейт има огромното удоволствие да Ви представи тристаен апартам ..., тел.: 0882125404",0882125404,https://calista_estate.imot.bg/,https://www.imot.bg/pcgi/imot.cgi?act=5&adv=1c173494577460777&slink=bi18s2&f1=14,8,2025-01-06 18:02:40.149168,Продава 3-СТАЕН,473800,EUR,Продава,PropertyType.TRISTAEN,град София,Хладилника,"110 кв.м, 5-ти ет. от 6, Лок.отопл., Тухла 2023 г., Агенция за недвижими имоти Калиста Естейт има огромното удоволствие да Ви представи тристаен апартам ..., тел.: 0882125404",0882125404,https://calista_estate.imot.bg/,https://www.imot.bg/pcgi/imot.cgi?act=5&adv=1c173494577460777&slink=bi18s2&f1=14,8,2025-01-06 18:02:40.149168,Site.IMOTBG,,,1c173494577460777
Продава 3-СТАЕН,420 000 EURЦената е без ДДС,1c172588625045941,"град София, Хладилника","131 кв.м, 4-ти ет. от 6, Тухла 2024 г., AVASOLIS има удоволствието да ви представи тристаен апартамент за продажба в съвременен жилищен комп ..., тел.: 0884342900",0884342900,https://avasolis.imot.bg/,https://www.imot.bg/pcgi/imot.cgi?act=5&adv=1c172588625045941&slink=bi18s2&f1=14,17,2025-01-06 18:02:40.149456,Продава 3-СТАЕН,420000,EUR,Продава,PropertyType.TRISTAEN,град София,Хладилника,"131 кв.м, 4-ти ет. от 6, Тухла 2024 г., AVASOLIS има удоволствието да ви представи тристаен апартамент за продажба в съвременен жилищен комп ..., тел.: 0884342900",0884342900,https://avasolis.imot.bg/,https://www.imot.bg/pcgi/imot.cgi?act=5&adv=1c172588625045941&slink=bi18s2&f1=14,17,2025-01-06 18:02:40.149456,Site.IMOTBG,,,1c172588625045941
Продава 3-СТАЕН,510 000 EUR,1c173141747990728,"град София, Хладилника","170 кв.м, 3-ти ет. от 8, Газ, ТЕЦ, Тухла 2022 г., БЕЗ КОМИСИОН ОТ КУПУВАЧ!  С Апартамент 012 ELEHOME ви предлага една изключително красива, функционал ..., тел.: 0885588888",0885588888,https://elehome.imot.bg/,https://www.imot.bg/pcgi/imot.cgi?act=5&adv=1c173141747990728&slink=bi18s2&f1=14,17,2025-01-06 18:02:40.149739,Продава 3-СТАЕН,510000,EUR,Продава,PropertyType.TRISTAEN,град София,Хладилника,"170 кв.м, 3-ти ет. от 8, Газ, ТЕЦ, Тухла 2022 г., БЕЗ КОМИСИОН ОТ КУПУВАЧ!  С Апартамент 012 ELEHOME ви предлага една изключително красива, функционал ..., тел.: 0885588888",0885588888,https://elehome.imot.bg/,https://www.imot.bg/pcgi/imot.cgi?act=5&adv=1c173141747990728&slink=bi18s2&f1=14,17,2025-01-06 18:02:40.149739,Site.IMOTBG,,,1c173141747990728
Продава 3-СТАЕН,512 000 EUR,1c173169115189228,"град София, Хладилника","128 кв.м, 5-ти ет. от 7, ТЕЦ, Тухла 2024 г., Агенция Явлена продава: в гр. София, кв. Лозенец- тристаен апартамент в сграда с акт 16 от октомври  ..., тел.: 0892516009",0892516009,https://yavlena_iztok.imot.bg/,https://www.imot.bg/pcgi/imot.cgi?act=5&adv=1c173169115189228&slink=bi18s2&f1=14,10,2025-01-06 18:02:40.150021,Продава 3-СТАЕН,512000,EUR,Продава,PropertyType.TRISTAEN,град София,Хладилника,"128 кв.м, 5-ти ет. от 7, ТЕЦ, Тухла 2024 г., Агенция Явлена продава: в гр. София, кв. Лозенец- тристаен апартамент в сграда с акт 16 от октомври  ..., тел.: 0892516009",0892516009,https://yavlena_iztok.imot.bg/,https://www.imot.bg/pcgi/imot.cgi?act=5&adv=1c173169115189228&slink=bi18s2&f1=14,10,2025-01-06 18:02:40.150021,Site.IMOTBG,,,1c173169115189228
Продава 3-СТАЕН,460 000 EURЦената е без ДДС,1c173289281033407,"град София, Хладилника","110 кв.м, 5-ти ет. от 6, Тухла 2021 г., Компания `ЕКС` представя на Вашето внимание тристаен апартамент в жк. Хладилника.  МЕСТОПОЛОЖЕНИЕ: О ..., тел.: 0887779990",0887779990,https://exnvd.imot.bg/,https://www.imot.bg/pcgi/imot.cgi?act=5&adv=1c173289281033407&slink=bi18s2&f1=14,9,2025-01-06 18:02:40.150309,Продава 3-СТАЕН,460000,EUR,Продава,PropertyType.TRISTAEN,град София,Хладилника,"110 кв.м, 5-ти ет. от 6, Тухла 2021 г., Компания `ЕКС` представя на Вашето внимание тристаен апартамент в жк. Хладилника.  МЕСТОПОЛОЖЕНИЕ: О ..., тел.: 0887779990",0887779990,https://exnvd.imot.bg/,https://www.imot.bg/pcgi/imot.cgi?act=5&adv=1c173289281033407&slink=bi18s2&f1=14,9,2025-01-06 18:02:40.150309,Site.IMOTBG,,,1c173289281033407
Продава 3-СТАЕН,570 000 EUR,1c172975803556179,"град София, Хладилника","150 кв.м, 1-ви ет. от 6, Тухла 2000 г., Агенция за недвижими имоти представя на вашето внимание имот с ненадмината локация, разположен между ..., тел.: 0889081887",0889081887,https://ngconsult2021.imot.bg/,https://www.imot.bg/pcgi/imot.cgi?act=5&adv=1c172975803556179&slink=bi18s2&f1=14,13,2025-01-06 18:02:40.150592,Продава 3-СТАЕН,570000,EUR,Продава,PropertyType.TRISTAEN,град София,Хладилника,"150 кв.м, 1-ви ет. от 6, Тухла 2000 г., Агенция за недвижими имоти представя на вашето внимание имот с ненадмината локация, разположен между ..., тел.: 0889081887",0889081887,https://ngconsult2021.imot.bg/,https://www.imot.bg/pcgi/imot.cgi?act=5&adv=1c172975803556179&slink=bi18s2&f1=14,13,2025-01-06 18:02:40.150592,Site.IMOTBG,,,1c172975803556179
Продава 3-СТАЕН,570 000 EUR,1c173020782923999,"град София, Хладилника","146 кв.м, 1-ви ет. от 6, Тухла 2000 г., ARCO REAL ESTATE предлага на Вашето внимание просторен тристаен апаратаментв кв. Хладилника.  Районъ ..., тел.: 0894466902",0894466902,https://arcoimoti.imot.bg/,https://www.imot.bg/pcgi/imot.cgi?act=5&adv=1c173020782923999&slink=bi18s2&f1=15,17,2025-01-06 18:02:41.129513,Продава 3-СТАЕН,570000,EUR,Продава,PropertyType.TRISTAEN,град София,Хладилника,"146 кв.м, 1-ви ет. от 6, Тухла 2000 г., ARCO REAL ESTATE предлага на Вашето внимание просторен тристаен апаратаментв кв. Хладилника.  Районъ ..., тел.: 0894466902",0894466902,https://arcoimoti.imot.bg/,https://www.imot.bg/pcgi/imot.cgi?act=5&adv=1c173020782923999&slink=bi18s2&f1=15,17,2025-01-06 18:02:41.129513,Site.IMOTBG,,,1c173020782923999
Продава 3-СТАЕН,570 000 EUR,1c173020782923999,"град София, Хладилника","146 кв.м, 1-ви ет. от 6, Тухла 2000 г., ARCO REAL ESTATE предлага на Вашето внимание просторен тристаен апаратаментв кв. Хладилника.  Районъ ..., тел.: 0894466902",0894466902,https://arcoimoti.imot.bg/,https://www.imot.bg/pcgi/imot.cgi?act=5&adv=1c173020782923999&slink=bi18s2&f1=15,17,2025-01-06 18:02:41.130212,Продава 3-СТАЕН,570000,EUR,Продава,PropertyType.TRISTAEN,град София,Хладилника,"146 кв.м, 1-ви ет. от 6, Тухла 2000 г., ARCO REAL ESTATE предлага на Вашето внимание просторен тристаен апаратаментв кв. Хладилника.  Районъ ..., тел.: 0894466902",0894466902,https://arcoimoti.imot.bg/,https://www.imot.bg/pcgi/imot.cgi?act=5&adv=1c173020782923999&slink=bi18s2&f1=15,17,2025-01-06 18:02:41.130212,Site.IMOTBG,,,1c173020782923999
Продава 4-СТАЕН,320 000 EUR,1d173442038879008,"град София, Докторски паметник","160 кв.м, 5-ти ет. от 5, ТЕЦ, Тухла 2025 г., Кантора Миленков ви представя 3/4 стаен апартамент в новострояща се сграда в Оборище. Жилището е раз ..., тел.: 0888787997",0888787997,https://none/,https://www.imot.bg/pcgi/imot.cgi?act=5&adv=1d173442038879008&slink=bi18s2&f1=15,9,2025-01-06 18:02:41.130486,Продава 4-СТАЕН,320000,EUR,Продава,PropertyType.CHETIRISTAEN,град София,Докторски паметник,"160 кв.м, 5-ти ет. от 5, ТЕЦ, Тухла 2025 г., Кантора Миленков ви представя 3/4 стаен апартамент в новострояща се сграда в Оборище. Жилището е раз ..., тел.: 0888787997",0888787997,https://none/,https://www.imot.bg/pcgi/imot.cgi?act=5&adv=1d173442038879008&slink=bi18s2&f1=15,9,2025-01-06 18:02:41.130486,Site.IMOTBG,,,1d173442038879008
Продава 4-СТАЕН,405 000 EUR,1d172137739724934,"град София, Докторски паметник","90 кв.м, 5-ти ет. от 6, Тухла 1960 г., 100442733 Мирела продава страхотен апартамент на ул. Върбица, Докторски паметник - на метри от парк  ..., тел.: 0883942825",0883942825,https://mirela.imot.bg/,https://www.imot.bg/pcgi/imot.cgi?act=5&adv=1d172137739724934&slink=bi18s2&f1=15,13,2025-01-06 18:02:41.130802,Продава 4-СТАЕН,405000,EUR,Продава,PropertyType.CHETIRISTAEN,град София,Докторски паметник,"90 кв.м, 5-ти ет. от 6, Тухла 1960 г., 100442733 Мирела продава страхотен апартамент на ул. Върбица, Докторски паметник - на метри от парк  ..., тел.: 0883942825",0883942825,https://mirela.imot.bg/,https://www.imot.bg/pcgi/imot.cgi?act=5&adv=1d172137739724934&slink=bi18s2&f1=15,13,2025-01-06 18:02:41.130802,Site.IMOTBG,,,1d172137739724934
Продава 4-СТАЕН,420 000 EUR,1d171571671476073,"град София, Докторски паметник","140 кв.м, 3-ти ет. от 3, ТЕЦ, Тухла 1906 г., Агенция Явлена продава: в гр.София,  Докторски паметник/район Оборище   четиристаен апартамент, в тр ..., тел.: 0892516904",0892516904,https://yavlena_iztok.imot.bg/,https://www.imot.bg/pcgi/imot.cgi?act=5&adv=1d171571671476073&slink=bi18s2&f1=15,14,2025-01-06 18:02:41.131080,Продава 4-СТАЕН,420000,EUR,Продава,PropertyType.CHETIRISTAEN,град София,Докторски паметник,"140 кв.м, 3-ти ет. от 3, ТЕЦ, Тухла 1906 г., Агенция Явлена продава: в гр.София,  Докторски паметник/район Оборище   четиристаен апартамент, в тр ..., тел.: 0892516904",0892516904,https://yavlena_iztok.imot.bg/,https://www.imot.bg/pcgi/imot.cgi?act=5&adv=1d171571671476073&slink=bi18s2&f1=15,14,2025-01-06 18:02:41.131080,Site.IMOTBG,,,1d171571671476073
Продава 4-СТАЕН,430 000 EUR,1d172863233260315,"град София, Докторски паметник","110 кв.м, ул. Шипка, Партер от 6, ТЕЦ, Тухла 1938 г., Атрактивен имот с топ локация в отлично състояние! Застроена площ 110 кв.м.!Жилището се намира на ул ..., тел.: 0898458357",0898458357,https://rivazone.imot.bg/,https://www.imot.bg/pcgi/imot.cgi?act=5&adv=1d172863233260315&slink=bi18s2&f1=15,7,2025-01-06 18:02:41.131362,Продава 4-СТАЕН,430000,EUR,Продава,PropertyType.CHETIRISTAEN,град София,Докторски паметник,"110 кв.м, ул. Шипка, Партер от 6, ТЕЦ, Тухла 1938 г., Атрактивен имот с топ локация в отлично състояние! Застроена площ 110 кв.м.!Жилището се намира на ул ..., тел.: 0898458357",0898458357,https://rivazone.imot.bg/,https://www.imot.bg/pcgi/imot.cgi?act=5&adv=1d172863233260315&slink=bi18s2&f1=15,7,2025-01-06 18:02:41.131362,Site.IMOTBG,,,1d172863233260315
Продава 4-СТАЕН,440 700 EUR,1d171006987202251,"град София, Докторски паметник","126 кв.м, 1-ви ет. от 3, ТЕЦ, Тухла 1950 г., Предлагаме на вашето  внимание:Четиристаен апартамент находящ се на  парка Заимов,намира се на тихо  ..., тел.: 0888269798",0888269798,https://none/,https://www.imot.bg/pcgi/imot.cgi?act=5&adv=1d171006987202251&slink=bi18s2&f1=15,5,2025-01-06 18:02:41.131636,Продава 4-СТАЕН,440700,EUR,Продава,PropertyType.CHETIRISTAEN,град София,Докторски паметник,"126 кв.м, 1-ви ет. от 3, ТЕЦ, Тухла 1950 г., Предлагаме на вашето  внимание:Четиристаен апартамент находящ се на  парка Заимов,намира се на тихо  ..., тел.: 0888269798",0888269798,https://none/,https://www.imot.bg/pcgi/imot.cgi?act=5&adv=1d171006987202251&slink=bi18s2&f1=15,5,2025-01-06 18:02:41.131636,Site.IMOTBG,,,1d171006987202251
Продава 4-СТАЕН,466 689 EURЦената е без ДДС,1d173253783783214,"град София, Докторски паметник","171 кв.м, 8-ми ет. от 14, ТЕЦ, Тухла 2026 г., Unique Estates представя просторен четиристаен апартамент, разположен в нов затворен комплекс, в сър ..., тел.: 0882 300 400",0882 300 400,https://uniqueestates.imot.bg/,https://www.imot.bg/pcgi/imot.cgi?act=5&adv=1d173253783783214&slink=bi18s2&f1=15,17,2025-01-06 18:02:41.131950,Продава 4-СТАЕН,466689,EUR,Продава,PropertyType.CHETIRISTAEN,град София,Докторски паметник,"171 кв.м, 8-ми ет. от 14, ТЕЦ, Тухла 2026 г., Unique Estates представя просторен четиристаен апартамент, разположен в нов затворен комплекс, в сър ..., тел.: 0882 300 400",0882 300 400,https://uniqueestates.imot.bg/,https://www.imot.bg/pcgi/imot.cgi?act=5&adv=1d173253783783214&slink=bi18s2&f1=15,17,2025-01-06 18:02:41.131950,Site.IMOTBG,,,1d173253783783214
Продава 4-СТАЕН,650 000 EUR,1d172435815372130,"град София, Докторски паметник","150 кв.м, 2-ри ет. от 5, Тухла 1906 г., Агенция Явлена продава: в гр.София,  Докторски паметник/район Оборище, в триетажна жилищна сграда. Л ..., тел.: 0892516943",0892516943,https://yavlena_iztok.imot.bg/,https://www.imot.bg/pcgi/imot.cgi?act=5&adv=1d172435815372130&slink=bi18s2&f1=15,17,2025-01-06 18:02:41.132229,Продава 4-СТАЕН,650000,EUR,Продава,PropertyType.CHETIRISTAEN,град София,Докторски паметник,"150 кв.м, 2-ри ет. от 5, Тухла 1906 г., Агенция Явлена продава: в гр.София,  Докторски паметник/район Оборище, в триетажна жилищна сграда. Л ..., тел.: 0892516943",0892516943,https://yavlena_iztok.imot.bg/,https://www.imot.bg/pcgi/imot.cgi?act=5&adv=1d172435815372130&slink=bi18s2&f1=15,17,2025-01-06 18:02:41.132229,Site.IMOTBG,,,1d172435815372130
