imotbg_title,imotbg_price,imotbg_listing_id,imotbg_location,imotbg_description,imotbg_contact_info,imotbg_agency_url,imotbg_details_url,imotbg_num_photos,imotbg_date_added,title,price,currency,offer_type,property_type,city,neighborhood,description,contact_info,agency_url,details_url,num_photos,date_added,site,floor,price_per_m2,ref_no
Продава 3-СТАЕН,290 000 EUR,1c173013122472048,"град София, Оборище","115 кв.м, 2-ри ет. от 11, ТЕЦ, LUXIMMO FINEST ESTATES: www.luximmo.bg Ексклузивно представяме за продажба комфортен тристаен апарта ..., тел.: 0988154593",0988154593,https://luximmo.imot.bg/,https://www.imot.bg/pcgi/imot.cgi?act=5&adv=1c173013122472048&slink=bi18s2&f1=10,5,2025-01-06 18:02:36.261477,Продава 3-СТАЕН,290000,EUR,Продава,PropertyType.TRISTAEN,град София,Оборище,"115 кв.м, 2-ри ет. от 11, ТЕЦ, LUXIMMO FINEST ESTATES: www.luximmo.bg Ексклузивно представяме за продажба комфортен тристаен апарта ..., тел.: 0988154593",0988154593,https://luximmo.imot.bg/,https://www.imot.bg/pcgi/imot.cgi?act=5&adv=1c173013122472048&slink=bi18s2&f1=10,5,2025-01-06 18:02:36.261477,Site.IMOTBG,,,1c173013122472048
Продава 3-СТАЕН,295 000 EUR,1c172016420218267,"град София, Оборище","81 кв.м, 2-ри ет. от 4, ТЕЦ, Тухла 1950 г., Разкошен, тристаен апартамент! Декориран в свежи цветове! Вътрешен с ниски месечни сметки за отоплен ..., тел.: 0887069908",0887069908,https://imotivasilev7.imot.bg/,https://www.imot.bg/pcgi/imot.cgi?act=5&adv=1c172016420218267&slink=bi18s2&f1=10,8,2025-01-06 18:02:36.261753,Продава 3-СТАЕН,295000,EUR,Продава,PropertyType.TRISTAEN,град София,Оборище,"81 кв.м, 2-ри ет. от 4, ТЕЦ, Тухла 1950 г., Разкошен, тристаен апартамент! Декориран в свежи цветове! Вътрешен с ниски месечни сметки за отоплен ..., тел.: 0887069908",0887069908,https://imotivasilev7.imot.bg/,https://www.imot.bg/pcgi/imot.cgi?act=5&adv=1c172016420218267&slink=bi18s2&f1=10,8,2025-01-06 18:02:36.261753,Site.IMOTBG,,,1c172016420218267
Продава 3-СТАЕН,295 000 EUR,1c172069563996609,"град София, Оборище","81 кв.м, 2-ри ет. от 4, ТЕЦ, Тухла 1950 г., Компания `ЕКС` представя на Вашето внимание тристаен апартамент в един от най-аристократичните и пре ..., тел.: 0887779990",0887779990,https://exnvd.imot.bg/,https://www.imot.bg/pcgi/imot.cgi?act=5&adv=1c172069563996609&slink=bi18s2&f1=10,6,2025-01-06 18:02:36.262031,Продава 3-СТАЕН,295000,EUR,Продава,PropertyType.TRISTAEN,град София,Оборище,"81 кв.м, 2-ри ет. от 4, ТЕЦ, Тухла 1950 г., Компания `ЕКС` представя на Вашето внимание тристаен апартамент в един от най-аристократичните и пре ..., тел.: 0887779990",0887779990,https://exnvd.imot.bg/,https://www.imot.bg/pcgi/imot.cgi?act=5&adv=1c172069563996609&slink=bi18s2&f1=10,6,2025-01-06 18:02:36.262031,Site.IMOTBG,,,1c172069563996609
Продава 3-СТАЕН,295 000 EUR,1c172830907392129,"град София, Оборище","81 кв.м, 2-ри ет. от 6, ТЕЦ, Тухла 1960 г., Тристаен апартамент, състоящ се от коридор, дневна 40 кв.м., спалня, отделна кухня с усвоен балкон,  ..., тел.: 088 21 21 450",088 21 21 450,https://address.imot.bg/,https://www.imot.bg/pcgi/imot.cgi?act=5&adv=1c172830907392129&slink=bi18s2&f1=10,5,2025-01-06 18:02:36.262306,Продава 3-СТАЕН,295000,EUR,Продава,PropertyType.TRISTAEN,град София,Оборище,"81 кв.м, 2-ри ет. от 6, ТЕЦ, Тухла 1960 г., Тристаен апартамент, състоящ се от коридор, дневна 40 кв.м., спалня, отделна кухня с усвоен балкон,  ..., тел.: 088 21 21 450",088 21 21 450,https://address.imot.bg/,https://www.imot.bg/pcgi/imot.cgi?act=5&adv=1c172830907392129&slink=bi18s2&f1=10,5,2025-01-06 18:02:36.262306,Site.IMOTBG,,,1c172830907392129
Продава 3-СТАЕН,297 000 EUR,1c173608978023706,"град София, Оборище","120 кв.м, 2-ри ет. от 5, Тухла 2024 г., - Район Оборище. Изискана нова сграда с АКТ - 16 в близост до Театър София. На пешеходно разстояние  ..., тел.: 0877 613 094",0877 613 094,https://expertbrokers.imot.bg/,https://www.imot.bg/pcgi/imot.cgi?act=5&adv=1c173608978023706&slink=bi18s2&f1=10,3,2025-01-06 18:02:36.262583,Продава 3-СТАЕН,297000,EUR,Продава,PropertyType.TRISTAEN,град София,Оборище,"120 кв.м, 2-ри ет. от 5, Тухла 2024 г., - Район Оборище. Изискана нова сграда с АКТ - 16 в близост до Театър София. На пешеходно разстояние  ..., тел.: 0877 613 094",0877 613 094,https://expertbrokers.imot.bg/,https://www.imot.bg/pcgi/imot.cgi?act=5&adv=1c173608978023706&slink=bi18s2&f1=10,3,2025-01-06 18:02:36.262583,Site.IMOTBG,,,1c173608978023706
Продава 3-СТАЕН,248 285 EURЦената е без ДДС,1c172969218026855,"град София, Оборище","108 кв.м, 3-ти ет. от 6, Тухла 2024 г., ПЕРФЕКТНА ИНВЕСТИЦИЯ! НА МЕТРИ ОТ ИДЕАЛНИЯ ЦЕНТЪР! БЕЗ КОМИСИОН ЗА КУПУВАЧА!  'Образцов вход' ..., тел.: 0885880770",0885880770,https://obrazcov.imot.bg/,https://www.imot.bg/pcgi/imot.cgi?act=5&adv=1c172969218026855&slink=bi18s2&f1=10,9,2025-01-06 18:02:36.262863,Продава 3-СТАЕН,248285,EUR,Продава,PropertyType.TRISTAEN,град София,Оборище,"108 кв.м, 3-ти ет. от 6, Тухла 2024 г., ПЕРФЕКТНА ИНВЕСТИЦИЯ! НА МЕТРИ ОТ ИДЕАЛНИЯ ЦЕНТЪР! БЕЗ КОМИСИОН ЗА КУПУВАЧА!  'Образцов вход' ..., тел.: 0885880770",0885880770,https://obrazcov.imot.bg/,https://www.imot.bg/pcgi/imot.cgi?act=5&adv=1c172969218026855&slink=bi18s2&f1=10,9,2025-01-06 18:02:36.262863,Site.IMOTBG,,,1c172969218026855
Продава 3-СТАЕН,298 000 EUR,1c173478952489521,"град София, Оборище","67 кв.м, 2-ри ет. от 5, ТЕЦ, Тухла 1973 г., Прекрасен тристаен апартамент в Оборище с паркомясто в цената! Апартамента е разположен в престижния ..., тел.: 0887144424",0887144424,https://none/,https://www.imot.bg/pcgi/imot.cgi?act=5&adv=1c173478952489521&slink=bi18s2&f1=10,8,2025-01-06 18:02:36.263136,Продава 3-СТАЕН,298000,EUR,Продава,PropertyType.TRISTAEN,град София,Оборище,"67 кв.м, 2-ри ет. от 5, ТЕЦ, Тухла 1973 г., Прекрасен тристаен апартамент в Оборище с паркомясто в цената! Апартамента е разположен в престижния ..., тел.: 0887144424",0887144424,https://none/,https://www.imot.bg/pcgi/imot.cgi?act=5&adv=1c173478952489521&slink=bi18s2&f1=10,8,2025-01-06 18:02:36.263136,Site.IMOTBG,,,1c173478952489521
Продава 3-СТАЕН,299 000 EUR,1c172499865409525,"град София, Оборище","115 кв.м, 7-ми ет. от 9, Тухла 1997 г., ERA Младост представя просторен и светъл апартамент с потенциал да бъде преустроен в четиристаен, ра ..., тел.: 0885772455",0885772455,https://erabulgaria.imot.bg/,https://www.imot.bg/pcgi/imot.cgi?act=5&adv=1c172499865409525&slink=bi18s2&f1=10,11,2025-01-06 18:02:36.263451,Продава 3-СТАЕН,299000,EUR,Продава,PropertyType.TRISTAEN,град София,Оборище,"115 кв.м, 7-ми ет. от 9, Тухла 1997 г., ERA Младост представя просторен и светъл апартамент с потенциал да бъде преустроен в четиристаен, ра ..., тел.: 0885772455",0885772455,https://erabulgaria.imot.bg/,https://www.imot.bg/pcgi/imot.cgi?act=5&adv=1c172499865409525&slink=bi18s2&f1=10,11,2025-01-06 18:02:36.263451,Site.IMOTBG,,,1c172499865409525
Продава 3-СТАЕН,300 000 EUR,1c172985414795323,"град София, Оборище","60 кв.м, 4-ти ет. от 7, ТЕЦ, Тухла 2000 г., Просторен тристаен апартамент! Състои се от две спални, кухня, балкон, баня и тоалетна! Отопление с  ..., тел.: 0887069908",0887069908,https://imotivasilev7.imot.bg/,https://www.imot.bg/pcgi/imot.cgi?act=5&adv=1c172985414795323&slink=bi18s2&f1=10,5,2025-01-06 18:02:36.263727,Продава 3-СТАЕН,300000,EUR,Продава,PropertyType.TRISTAEN,град София,Оборище,"60 кв.м, 4-ти ет. от 7, ТЕЦ, Тухла 2000 г., Просторен тристаен апартамент! Състои се от две спални, кухня, балкон, баня и тоалетна! Отопление с  ..., тел.: 0887069908",0887069908,https://imotivasilev7.imot.bg/,https://www.imot.bg/pcgi/imot.cgi?act=5&adv=1c172985414795323&slink=bi18s2&f1=10,5,2025-01-06 18:02:36.263727,Site.IMOTBG,,,1c172985414795323
Продава 3-СТАЕН,304 000 EUR,1c172830073263649,"град София, Оборище","80 кв.м, 2-ри ет. от 5, Тухла 2025 г., Имоти ПРЕМИЕР представя на Вашето внимание тристаен апартамент в ж.к Оборище! Жилището е ситуирано н ..., тел.: 0879590094",0879590094,https://premierimotisf.imot.bg/,https://www.imot.bg/pcgi/imot.cgi?act=5&adv=1c172830073263649&slink=bi18s2&f1=10,,2025-01-06 18:02:36.264022,Продава 3-СТАЕН,304000,EUR,Продава,PropertyType.TRISTAEN,град София,Оборище,"80 кв.м, 2-ри ет. от 5, Тухла 2025 г., Имоти ПРЕМИЕР представя на Вашето внимание тристаен апартамент в ж.к Оборище! Жилището е ситуирано н ..., тел.: 0879590094",0879590094,https://premierimotisf.imot.bg/,https://www.imot.bg/pcgi/imot.cgi?act=5&adv=1c172830073263649&slink=bi18s2&f1=10,,2025-01-06 18:02:36.264022,Site.IMOTBG,,,1c172830073263649
Продава 3-СТАЕН,257 500 EURЦената е без ДДС,1c170444341552830,"град София, Оборище","103 кв.м, 1-ви ет. от 5, Unique Estates има удоволствието да Ви предложи просторен и елегантен апартамент с две спални за про ..., тел.: 0882 300 400",0882 300 400,https://uniqueestates.imot.bg/,https://www.imot.bg/pcgi/imot.cgi?act=5&adv=1c170444341552830&slink=bi18s2&f1=10,6,2025-01-06 18:02:36.264299,Продава 3-СТАЕН,257500,EUR,Продава,PropertyType.TRISTAEN,град София,Оборище,"103 кв.м, 1-ви ет. от 5, Unique Estates има удоволствието да Ви предложи просторен и елегантен апартамент с две спални за про ..., тел.: 0882 300 400",0882 300 400,https://uniqueestates.imot.bg/,https://www.imot.bg/pcgi/imot.cgi?act=5&adv=1c170444341552830&slink=bi18s2&f1=10,6,2025-01-06 18:02:36.264299,Site.IMOTBG,,,1c170444341552830
Продава 3-СТАЕН,265 704 EURЦената е без ДДС,1c172969038623443,"град София, Оборище","111 кв.м, 4-ти ет. от 6, Тухла 2024 г., ПЕРФЕКТНА ИНВЕСТИЦИЯ! НА МЕТРИ ОТ ИДЕАЛНИЯ ЦЕНТЪР! БЕЗ КОМИСИОН ЗА КУПУВАЧА!  'Образцов вход' продав ..., тел.: 0885880770",0885880770,https://obrazcov.imot.bg/,https://www.imot.bg/pcgi/imot.cgi?act=5&adv=1c172969038623443&slink=bi18s2&f1=10,9,2025-01-06 18:02:36.264620,Продава 3-СТАЕН,265704,EUR,Продава,PropertyType.TRISTAEN,град София,Оборище,"111 кв.м, 4-ти ет. от 6, Тухла 2024 г., ПЕРФЕКТНА ИНВЕСТИЦИЯ! НА МЕТРИ ОТ ИДЕАЛНИЯ ЦЕНТЪР! БЕЗ КОМИСИОН ЗА КУПУВАЧА!  'Образцов вход' продав ..., тел.: 0885880770",0885880770,https://obrazcov.imot.bg/,https://www.imot.bg/pcgi/imot.cgi?act=5&adv=1c172969038623443&slink=bi18s2&f1=10,9,2025-01-06 18:02:36.264620,Site.IMOTBG,,,1c172969038623443
Продава 3-СТАЕН,323 070 EUR,1c173028395835797,"град София, Оборище","108 кв.м, 5-ти ет. от 9, ТЕЦ, Тухла 2026 г., Ексклузивна възможност за инвестиция в новострояща се сграда в престижния квартал ОБОРИЩЕ!  Представ ..., тел.: 0877734412",0877734412,https://buildingbox.imot.bg/,https://www.imot.bg/pcgi/imot.cgi?act=5&adv=1c173028395835797&slink=bi18s2&f1=10,3,2025-01-06 18:02:36.264911,Продава 3-СТАЕН,323070,EUR,Продава,PropertyType.TRISTAEN,град София,Оборище,"108 кв.м, 5-ти ет. от 9, ТЕЦ, Тухла 2026 г., Ексклузивна възможност за инвестиция в новострояща се сграда в престижния квартал ОБОРИЩЕ!  Представ ..., тел.: 0877734412",0877734412,https://buildingbox.imot.bg/,https://www.imot.bg/pcgi/imot.cgi?act=5&adv=1c173028395835797&slink=bi18s2&f1=10,3,2025-01-06 18:02:36.264911,Site.IMOTBG,,,1c173028395835797
Продава 3-СТАЕН,271 425 EURЦената е без ДДС,1c170603466934537,"град София, Оборище","105 кв.м, 8-ми ет. от 9, Референтен номер: 653.     Teatralna Park Residence е един от вдъхновяващите жилищни проекти на стол ..., тел.: 0893069404",0893069404,https://maxview050221.imot.bg/,https://www.imot.bg/pcgi/imot.cgi?act=5&adv=1c170603466934537&slink=bi18s2&f1=10,6,2025-01-06 18:02:36.265191,Продава 3-СТАЕН,271425,EUR,Продава,PropertyType.TRISTAEN,град София,Оборище,"105 кв.м, 8-ми ет. от 9, Референтен номер: 653.     Teatralna Park Residence е един от вдъхновяващите жилищни проекти на стол ..., тел.: 0893069404",0893069404,https://maxview050221.imot.bg/,https://www.imot.bg/pcgi/imot.cgi?act=5&adv=1c170603466934537&slink=bi18s2&f1=10,6,2025-01-06 18:02:36.265191,Site.IMOTBG,,,1c170603466934537
Продава 3-СТАЕН,325 710 EUR,1c168658249440519,"град София, Оборище","105 кв.м, 8-ми ет. от 14, ТЕЦ, Тухла 2026 г., Без комисиона от купувача. Тристаен апартамент, състоящ се от: входно преддверие, две спални, дневна ..., тел.: 088 21 21 488",088 21 21 488,https://imoteka.imot.bg/,https://www.imot.bg/pcgi/imot.cgi?act=5&adv=1c168658249440519&slink=bi18s2&f1=10,4,2025-01-06 18:02:36.265474,Продава 3-СТАЕН,325710,EUR,Продава,PropertyType.TRISTAEN,град София,Оборище,"105 кв.м, 8-ми ет. от 14, ТЕЦ, Тухла 2026 г., Без комисиона от купувача. Тристаен апартамент, състоящ се от: входно преддверие, две спални, дневна ..., тел.: 088 21 21 488",088 21 21 488,https://imoteka.imot.bg/,https://www.imot.bg/pcgi/imot.cgi?act=5&adv=1c168658249440519&slink=bi18s2&f1=10,4,2025-01-06 18:02:36.265474,Site.IMOTBG,,,1c168658249440519
Продава 3-СТАЕН,272 000 EURЦената е без ДДС,1c170905242631604,"град София, Оборище","90 кв.м, 8-ми ет. от 14, ТЕЦ, Тухла 2026 г., Без комисиона от купувача.Тристайни апартаменти от 90 кв.м. до 121 кв.м.,разположени от 2-ри до 14-т ..., тел.: 0884 932363",0884 932363,https://iskar.imot.bg/,https://www.imot.bg/pcgi/imot.cgi?act=5&adv=1c170905242631604&slink=bi18s2&f1=10,2,2025-01-06 18:02:36.265757,Продава 3-СТАЕН,272000,EUR,Продава,PropertyType.TRISTAEN,град София,Оборище,"90 кв.м, 8-ми ет. от 14, ТЕЦ, Тухла 2026 г., Без комисиона от купувача.Тристайни апартаменти от 90 кв.м. до 121 кв.м.,разположени от 2-ри до 14-т ..., тел.: 0884 932363",0884 932363,https://iskar.imot.bg/,https://www.imot.bg/pcgi/imot.cgi?act=5&adv=1c170905242631604&slink=bi18s2&f1=10,2,2025-01-06 18:02:36.265757,Site.IMOTBG,,,1c170905242631604
Продава 3-СТАЕН,327 376 EUR,1c173347922027716,"град София, Оборище","88 кв.м, 3-ти ет. от 7, ТЕЦ, Тухла 2026 г., LUXIMMO FINEST ESTATES: www.luximmo.bg Тристаен апартамент за продажба в новострояща се сграда на ул ..., тел.: 0882817580",0882817580,https://luximmo.imot.bg/,https://www.imot.bg/pcgi/imot.cgi?act=5&adv=1c173347922027716&slink=bi18s2&f1=10,7,2025-01-06 18:02:36.266040,Продава 3-СТАЕН,327376,EUR,Продава,PropertyType.TRISTAEN,град София,Оборище,"88 кв.м, 3-ти ет. от 7, ТЕЦ, Тухла 2026 г., LUXIMMO FINEST ESTATES: www.luximmo.bg Тристаен апартамент за продажба в новострояща се сграда на ул ..., тел.: 0882817580",0882817580,https://luximmo.imot.bg/,https://www.imot.bg/pcgi/imot.cgi?act=5&adv=1c173347922027716&slink=bi18s2&f1=10,7,2025-01-06 18:02:36.266040,Site.IMOTBG,,,1c173347922027716
Продава 3-СТАЕН,328 000 EUR,1c172119483564660,"град София, Оборище","126 кв.м, 9-ти ет. от 10, ТЕЦ, Тухла 2024 г., Тристаен апартамент разположен на 9ти реален етаж, със ЗП 109 кв.м., състоящ се от преддверие, дневн ..., тел.: 088 21 21 450",088 21 21 450,https://address.imot.bg/,https://www.imot.bg/pcgi/imot.cgi?act=5&adv=1c172119483564660&slink=bi18s2&f1=10,,2025-01-06 18:02:36.266346,Продава 3-СТАЕН,328000,EUR,Продава,PropertyType.TRISTAEN,град София,Оборище,"126 кв.м, 9-ти ет. от 10, ТЕЦ, Тухла 2024 г., Тристаен апартамент разположен на 9ти реален етаж, със ЗП 109 кв.м., състоящ се от преддверие, дневн ..., тел.: 088 21 21 450",088 21 21 450,https://address.imot.bg/,https://www.imot.bg/pcgi/imot.cgi?act=5&adv=1c172119483564660&slink=bi18s2&f1=10,,2025-01-06 18:02:36.266346,Site.IMOTBG,,,1c172119483564660
Продава 3-СТАЕН,331 108 EUR,1c171414358053780,"град София, Оборище","102 кв.м, 5-ти ет. от 6, ТЕЦ, Тухла 2025 г., Тристаен апартамент, разположен на 5 етаж със застроена площ 83.09 кв.м., с общи части 102.39 кв.м., ..., тел.: 0884 932363",0884 932363,https://iskar.imot.bg/,https://www.imot.bg/pcgi/imot.cgi?act=5&adv=1c171414358053780&slink=bi18s2&f1=10,,2025-01-06 18:02:36.266651,Продава 3-СТАЕН,331108,EUR,Продава,PropertyType.TRISTAEN,град София,Оборище,"102 кв.м, 5-ти ет. от 6, ТЕЦ, Тухла 2025 г., Тристаен апартамент, разположен на 5 етаж със застроена площ 83.09 кв.м., с общи части 102.39 кв.м., ..., тел.: 0884 932363",0884 932363,https://iskar.imot.bg/,https://www.imot.bg/pcgi/imot.cgi?act=5&adv=1c171414358053780&slink=bi18s2&f1=10,,2025-01-06 18:02:36.266651,Site.IMOTBG,,,1c171414358053780
Продава 3-СТАЕН,334 950 EUR,1c171802978066625,"град София, Оборище","108 кв.м, 5-ти ет. от 13, Тухла 2026 г., ДРИЙМ ВИЖЪН НЕДВИЖИМИ ИМОТИ Продава тристаен апартамент в кв. Оборище на комуникативно място в близо ..., тел.: 0885 98 11 00",0885 98 11 00,https://dreamvision.imot.bg/,https://www.imot.bg/pcgi/imot.cgi?act=5&adv=1c171802978066625&slink=bi18s2&f1=10,3,2025-01-06 18:02:36.266933,Продава 3-СТАЕН,334950,EUR,Продава,PropertyType.TRISTAEN,град София,Оборище,"108 кв.м, 5-ти ет. от 13, Тухла 2026 г., ДРИЙМ ВИЖЪН НЕДВИЖИМИ ИМОТИ Продава тристаен апартамент в кв. Оборище на комуникативно място в близо ..., тел.: 0885 98 11 00",0885 98 11 00,https://dreamvision.imot.bg/,https://www.imot.bg/pcgi/imot.cgi?act=5&adv=1c171802978066625&slink=bi18s2&f1=10,3,2025-01-06 18:02:36.266933,Site.IMOTBG,,,1c171802978066625
Продава 3-СТАЕН,334 950 EUR,1c169851595113412,"град София, Оборище","162 кв.м, 4-ти ет. от 14, ТЕЦ, Тухла 2026 г., БЕЗ КОМИСИОННА ОТ КУПУВАЧА! Galiano Estates има удоволствието да ви представи разкошен тристаен апар ..., тел.: 0898980170",0898980170,https://galianoestates.imot.bg/,https://www.imot.bg/pcgi/imot.cgi?act=5&adv=1c169851595113412&slink=bi18s2&f1=10,7,2025-01-06 18:02:36.267216,Продава 3-СТАЕН,334950,EUR,Продава,PropertyType.TRISTAEN,град София,Оборище,"162 кв.м, 4-ти ет. от 14, ТЕЦ, Тухла 2026 г., БЕЗ КОМИСИОННА ОТ КУПУВАЧА! Galiano Estates има удоволствието да ви представи разкошен тристаен апар ..., тел.: 0898980170",0898980170,https://galianoestates.imot.bg/,https://www.imot.bg/pcgi/imot.cgi?act=5&adv=1c169851595113412&slink=bi18s2&f1=10,7,2025-01-06 18:02:36.267216,Site.IMOTBG,,,1c169851595113412
Продава 3-СТАЕН,334 990 EUR,1c173142282533594,"град София, Оборище","90 кв.м, бул. Евл. и Хр. Георгиеви, 3-ти ет. от 6, ТЕЦ, Тухла 1958 г., Коледна промоция! Просторен апартамент с открити гледки на бул. Евлоги Георгиев в близост до Военна  ..., тел.: 0878928703",0878928703,https://jupiter.imot.bg/,https://www.imot.bg/pcgi/imot.cgi?act=5&adv=1c173142282533594&slink=bi18s2&f1=10,17,2025-01-06 18:02:36.267499,Продава 3-СТАЕН,334990,EUR,Продава,PropertyType.TRISTAEN,град София,Оборище,"90 кв.м, бул. Евл. и Хр. Георгиеви, 3-ти ет. от 6, ТЕЦ, Тухла 1958 г., Коледна промоция! Просторен апартамент с открити гледки на бул. Евлоги Георгиев в близост до Военна  ..., тел.: 0878928703",0878928703,https://jupiter.imot.bg/,https://www.imot.bg/pcgi/imot.cgi?act=5&adv=1c173142282533594&slink=bi18s2&f1=10,17,2025-01-06 18:02:36.267499,Site.IMOTBG,,,1c173142282533594
Продава 3-СТАЕН,335 000 EUR,1c173529030178682,"град София, Оборище","82 кв.м, 5-ти ет. от 5, ТЕЦ, Тухла 1941 г., ЕРА Идеа има удоволствието да ви представи прекрасен тристаен апартамент за продажба в район ' О ..., тел.: 0888661760",0888661760,https://ideaera1020.imot.bg/,https://www.imot.bg/pcgi/imot.cgi?act=5&adv=1c173529030178682&slink=bi18s2&f1=10,13,2025-01-06 18:02:36.267794,Продава 3-СТАЕН,335000,EUR,Продава,PropertyType.TRISTAEN,град София,Оборище,"82 кв.м, 5-ти ет. от 5, ТЕЦ, Тухла 1941 г., ЕРА Идеа има удоволствието да ви представи прекрасен тристаен апартамент за продажба в район ' О ..., тел.: 0888661760",0888661760,https://ideaera1020.imot.bg/,https://www.imot.bg/pcgi/imot.cgi?act=5&adv=1c173529030178682&slink=bi18s2&f1=10,13,2025-01-06 18:02:36.267794,Site.IMOTBG,,,1c173529030178682
Продава 3-СТАЕН,336 609 EUR,1c173347921189106,"град София, Оборище","86 кв.м, 5-ти ет. от 7, ТЕЦ, Тухла 2026 г., LUXIMMO FINEST ESTATES: www.luximmo.bg Представяме Ви тристаен апартамент за продажба в новострояща  ..., тел.: 0882817580",0882817580,https://luximmo.imot.bg/,https://www.imot.bg/pcgi/imot.cgi?act=5&adv=1c173347921189106&slink=bi18s2&f1=10,6,2025-01-06 18:02:36.268078,Продава 3-СТАЕН,336609,EUR,Продава,PropertyType.TRISTAEN,град София,Оборище,"86 кв.м, 5-ти ет. от 7, ТЕЦ, Тухла 2026 г., LUXIMMO FINEST ESTATES: www.luximmo.bg Представяме Ви тристаен апартамент за продажба в новострояща  ..., тел.: 0882817580",0882817580,https://luximmo.imot.bg/,https://www.imot.bg/pcgi/imot.cgi?act=5&adv=1c173347921189106&slink=bi18s2&f1=10,6,2025-01-06 18:02:36.268078,Site.IMOTBG,,,1c173347921189106
