imotbg_title,imotbg_price,imotbg_listing_id,imotbg_location,imotbg_description,imotbg_contact_info,imotbg_agency_url,imotbg_details_url,imotbg_num_photos,imotbg_date_added,title,price,currency,offer_type,property_type,city,neighborhood,description,contact_info,agency_url,details_url,num_photos,date_added,site,floor,price_per_m2,ref_no
Продава 2-СТАЕН,195 428 EURЦената е без ДДС,1b170472967055103,"град София, Оборище","64 кв.м, 12-ти ет. от 14, LUXIMMO FINEST ESTATES: www.luximmo.bg Представяме ви затворен комплекс в престижния квартал Оборище ..., тел.: 0988154584",0988154584,https://luximmo.imot.bg/,https://www.imot.bg/pcgi/imot.cgi?act=5&adv=1b170472967055103&slink=bi18s2&f1=5,14,2025-01-06 18:02:30.846846,Продава 2-СТАЕН,195428,EUR,Продава,PropertyType.DVUSTAEN,град София,Оборище,"64 кв.м, 12-ти ет. от 14, LUXIMMO FINEST ESTATES: www.luximmo.bg Представяме ви затворен комплекс в престижния квартал Оборище ..., тел.: 0988154584",0988154584,https://luximmo.imot.bg/,https://www.imot.bg/pcgi/imot.cgi?act=5&adv=1b170472967055103&slink=bi18s2&f1=5,14,2025-01-06 18:02:30.846846,Site.IMOTBG,,,1b170472967055103
Продава 2-СТАЕН,195 428 EURЦената е без ДДС,1b172967160686138,"град София, Оборище","64 кв.м, 12-ти ет. от 14, ТЕЦ, BULGARIA SOTHEBY S INTERNATIONAL REALTY представя жилищен комплекс от затворен тип, хармонично вписа ..., тел.: 02/9632460",02/9632460,https://bulgariasir.imot.bg/,https://www.imot.bg/pcgi/imot.cgi?act=5&adv=1b172967160686138&slink=bi18s2&f1=5,9,2025-01-06 18:02:30.847135,Продава 2-СТАЕН,195428,EUR,Продава,PropertyType.DVUSTAEN,град София,Оборище,"64 кв.м, 12-ти ет. от 14, ТЕЦ, BULGARIA SOTHEBY S INTERNATIONAL REALTY представя жилищен комплекс от затворен тип, хармонично вписа ..., тел.: 02/9632460",02/9632460,https://bulgariasir.imot.bg/,https://www.imot.bg/pcgi/imot.cgi?act=5&adv=1b172967160686138&slink=bi18s2&f1=5,9,2025-01-06 18:02:30.847135,Site.IMOTBG,,,1b172967160686138
Продава 2-СТАЕН,235 000 EUR,1b173584874931638,"град София, Оборище","78 кв.м, 2-ри ет. от 5, ТЕЦ, Явлена предлага етаж от къща сравним с много обширен ДВУСТАЕН апартамент в един от най-хубавите квар ..., тел.: 0892544850",0892544850,https://yavlena.imot.bg/,https://www.imot.bg/pcgi/imot.cgi?act=5&adv=1b173584874931638&slink=bi18s2&f1=5,8,2025-01-06 18:02:30.847424,Продава 2-СТАЕН,235000,EUR,Продава,PropertyType.DVUSTAEN,град София,Оборище,"78 кв.м, 2-ри ет. от 5, ТЕЦ, Явлена предлага етаж от къща сравним с много обширен ДВУСТАЕН апартамент в един от най-хубавите квар ..., тел.: 0892544850",0892544850,https://yavlena.imot.bg/,https://www.imot.bg/pcgi/imot.cgi?act=5&adv=1b173584874931638&slink=bi18s2&f1=5,8,2025-01-06 18:02:30.847424,Site.IMOTBG,,,1b173584874931638
Продава 2-СТАЕН,235 000 EUR,1b170722682745580,"град София, Оборище","80 кв.м, 2-ри ет. от 3, ТЕЦ, Тухла 1940 г., Апартаментът представлява 2-ри етаж от къща, построена на калкан с жилищен блок.  Намира се в непоср ..., тел.: 0898682018",0898682018,https://asi2001.imot.bg/,https://www.imot.bg/pcgi/imot.cgi?act=5&adv=1b170722682745580&slink=bi18s2&f1=5,15,2025-01-06 18:02:30.847702,Продава 2-СТАЕН,235000,EUR,Продава,PropertyType.DVUSTAEN,град София,Оборище,"80 кв.м, 2-ри ет. от 3, ТЕЦ, Тухла 1940 г., Апартаментът представлява 2-ри етаж от къща, построена на калкан с жилищен блок.  Намира се в непоср ..., тел.: 0898682018",0898682018,https://asi2001.imot.bg/,https://www.imot.bg/pcgi/imot.cgi?act=5&adv=1b170722682745580&slink=bi18s2&f1=5,15,2025-01-06 18:02:30.847702,Site.IMOTBG,,,1b170722682745580
Продава 2-СТАЕН,235 000 EUR,1b173090719632495,"град София, Оборище","77 кв.м, 2-ри ет. от 3, ТЕЦ, ПАРК ТЕАТРАЛНА !!! СРЕДЕН ЕТАЖ !!! ГЛЕДКА КЪМ ВЪТРЕШЕН ДВОР !!! ИСУЛ ! ! ! Home2U представя на Вашет ..., тел.: 0875363330",0875363330,https://home2umontevideo.imot.bg/,https://www.imot.bg/pcgi/imot.cgi?act=5&adv=1b173090719632495&slink=bi18s2&f1=5,10,2025-01-06 18:02:30.847985,Продава 2-СТАЕН,235000,EUR,Продава,PropertyType.DVUSTAEN,град София,Оборище,"77 кв.м, 2-ри ет. от 3, ТЕЦ, ПАРК ТЕАТРАЛНА !!! СРЕДЕН ЕТАЖ !!! ГЛЕДКА КЪМ ВЪТРЕШЕН ДВОР !!! ИСУЛ ! ! ! Home2U представя на Вашет ..., тел.: 0875363330",0875363330,https://home2umontevideo.imot.bg/,https://www.imot.bg/pcgi/imot.cgi?act=5&adv=1b173090719632495&slink=bi18s2&f1=5,10,2025-01-06 18:02:30.847985,Site.IMOTBG,,,1b173090719632495
Продава 2-СТАЕН,196 350 EURЦената е без ДДС,1b171604391118083,"град София, Оборище","61 кв.м, 14-ти ет. от 14, Газ, Тухла 2024 г., БЕЗ КОМИСИОН ОТ КУПУВАЧА!!!  ИРИДА НЕДВИЖИМИ ИМОТИ продава слънчев двустаен апартамент в новоизгражд ..., тел.: 0885229006",0885229006,https://irida.imot.bg/,https://www.imot.bg/pcgi/imot.cgi?act=5&adv=1b171604391118083&slink=bi18s2&f1=5,7,2025-01-06 18:02:30.848272,Продава 2-СТАЕН,196350,EUR,Продава,PropertyType.DVUSTAEN,град София,Оборище,"61 кв.м, 14-ти ет. от 14, Газ, Тухла 2024 г., БЕЗ КОМИСИОН ОТ КУПУВАЧА!!!  ИРИДА НЕДВИЖИМИ ИМОТИ продава слънчев двустаен апартамент в новоизгражд ..., тел.: 0885229006",0885229006,https://irida.imot.bg/,https://www.imot.bg/pcgi/imot.cgi?act=5&adv=1b171604391118083&slink=bi18s2&f1=5,7,2025-01-06 18:02:30.848272,Site.IMOTBG,,,1b171604391118083
Продава 2-СТАЕН,238 000 EUR,1b172958943512985,"град София, Оборище","66 кв.м, 7-ми ет. от 8, ТЕЦ, Тухла 1992 г., Двустаен апартамент в Центъра на Столицата - ул.Оборище, състоящ се от хол, спалня, кухня, коридор,  ..., тел.: 088 21 21 450",088 21 21 450,https://address.imot.bg/,https://www.imot.bg/pcgi/imot.cgi?act=5&adv=1b172958943512985&slink=bi18s2&f1=5,8,2025-01-06 18:02:30.848586,Продава 2-СТАЕН,238000,EUR,Продава,PropertyType.DVUSTAEN,град София,Оборище,"66 кв.м, 7-ми ет. от 8, ТЕЦ, Тухла 1992 г., Двустаен апартамент в Центъра на Столицата - ул.Оборище, състоящ се от хол, спалня, кухня, коридор,  ..., тел.: 088 21 21 450",088 21 21 450,https://address.imot.bg/,https://www.imot.bg/pcgi/imot.cgi?act=5&adv=1b172958943512985&slink=bi18s2&f1=5,8,2025-01-06 18:02:30.848586,Site.IMOTBG,,,1b172958943512985
Продава 2-СТАЕН,207 300 EURЦената е без ДДС,1b173028389371686,"град София, Оборище","69 кв.м, 5-ти ет. от 9, ТЕЦ, Тухла 2026 г., Ексклузивна възможност за инвестиция в новострояща се сграда в престижния квартал ОБОРИЩЕ!  Представ ..., тел.: 0877734412",0877734412,https://buildingbox.imot.bg/,https://www.imot.bg/pcgi/imot.cgi?act=5&adv=1b173028389371686&slink=bi18s2&f1=5,3,2025-01-06 18:02:30.849066,Продава 2-СТАЕН,207300,EUR,Продава,PropertyType.DVUSTAEN,град София,Оборище,"69 кв.м, 5-ти ет. от 9, ТЕЦ, Тухла 2026 г., Ексклузивна възможност за инвестиция в новострояща се сграда в престижния квартал ОБОРИЩЕ!  Представ ..., тел.: 0877734412",0877734412,https://buildingbox.imot.bg/,https://www.imot.bg/pcgi/imot.cgi?act=5&adv=1b173028389371686&slink=bi18s2&f1=5,3,2025-01-06 18:02:30.849066,Site.IMOTBG,,,1b173028389371686
Продава 2-СТАЕН,250 000 EUR,1b172733830769982,"град София, Оборище","41 кв.м, 1-ви ет. от 5, ТЕЦ, Тухла 1975 г., ЕКИП имоти предлага за продажба двустаен апартамент разположен в ТОП центъра на София - Докторски па ..., тел.: 0897919431-ЕКИП",0897919431-ЕКИП,https://ekip.imot.bg/,https://www.imot.bg/pcgi/imot.cgi?act=5&adv=1b172733830769982&slink=bi18s2&f1=5,6,2025-01-06 18:02:30.849397,Продава 2-СТАЕН,250000,EUR,Продава,PropertyType.DVUSTAEN,град София,Оборище,"41 кв.м, 1-ви ет. от 5, ТЕЦ, Тухла 1975 г., ЕКИП имоти предлага за продажба двустаен апартамент разположен в ТОП центъра на София - Докторски па ..., тел.: 0897919431-ЕКИП",0897919431-ЕКИП,https://ekip.imot.bg/,https://www.imot.bg/pcgi/imot.cgi?act=5&adv=1b172733830769982&slink=bi18s2&f1=5,6,2025-01-06 18:02:30.849397,Site.IMOTBG,,,1b172733830769982
Продава 2-СТАЕН,255 000 EUR,1b173132315391134,"град София, Оборище","60 кв.м, 3-ти ет. от 5, ТЕЦ, Тухла 1958 г., ХОУМ ЛАЙТ Ви предлага двустаен апартамент в тухлена кооперация на престижна локация - кв. Яворов!  С ..., тел.: 0893211311",0893211311,https://none/,https://www.imot.bg/pcgi/imot.cgi?act=5&adv=1b173132315391134&slink=bi18s2&f1=5,12,2025-01-06 18:02:30.849676,Продава 2-СТАЕН,255000,EUR,Продава,PropertyType.DVUSTAEN,град София,Оборище,"60 кв.м, 3-ти ет. от 5, ТЕЦ, Тухла 1958 г., ХОУМ ЛАЙТ Ви предлага двустаен апартамент в тухлена кооперация на престижна локация - кв. Яворов!  С ..., тел.: 0893211311",0893211311,https://none/,https://www.imot.bg/pcgi/imot.cgi?act=5&adv=1b173132315391134&slink=bi18s2&f1=5,12,2025-01-06 18:02:30.849676,Site.IMOTBG,,,1b173132315391134
Продава 2-СТАЕН,259 990 EUR,1b173609257387780,"град София, Оборище","70 кв.м, 2-ри ет. от 4, ТЕЦ, Тухла 1970 г., - Обзаведен двустаен апартамент в тухлена кооперация , строена през началото на седемдесетте години  ..., тел.: 0877 613 094",0877 613 094,https://expertbrokers.imot.bg/,https://www.imot.bg/pcgi/imot.cgi?act=5&adv=1b173609257387780&slink=bi18s2&f1=5,6,2025-01-06 18:02:30.850003,Продава 2-СТАЕН,259990,EUR,Продава,PropertyType.DVUSTAEN,град София,Оборище,"70 кв.м, 2-ри ет. от 4, ТЕЦ, Тухла 1970 г., - Обзаведен двустаен апартамент в тухлена кооперация , строена през началото на седемдесетте години  ..., тел.: 0877 613 094",0877 613 094,https://expertbrokers.imot.bg/,https://www.imot.bg/pcgi/imot.cgi?act=5&adv=1b173609257387780&slink=bi18s2&f1=5,6,2025-01-06 18:02:30.850003,Site.IMOTBG,,,1b173609257387780
Продава 2-СТАЕН,260 000 EUR,1b172967389458189,"град София, Оборище","68 кв.м, 2-ри ет. от 4, ТЕЦ, ул. Стара планина. Тухла от 70-те. Дневна, спалня, кухня, баня с тоалетна, две тераси. Мазе, таван,  ..., тел.: 0889550950",0889550950,https://imolux.imot.bg/,https://www.imot.bg/pcgi/imot.cgi?act=5&adv=1b172967389458189&slink=bi18s2&f1=5,7,2025-01-06 18:02:30.850287,Продава 2-СТАЕН,260000,EUR,Продава,PropertyType.DVUSTAEN,град София,Оборище,"68 кв.м, 2-ри ет. от 4, ТЕЦ, ул. Стара планина. Тухла от 70-те. Дневна, спалня, кухня, баня с тоалетна, две тераси. Мазе, таван,  ..., тел.: 0889550950",0889550950,https://imolux.imot.bg/,https://www.imot.bg/pcgi/imot.cgi?act=5&adv=1b172967389458189&slink=bi18s2&f1=5,7,2025-01-06 18:02:30.850287,Site.IMOTBG,,,1b172967389458189
Продава 2-СТАЕН,263 340 EUR,1b168658232897093,"град София, Оборище","88 кв.м, 7-ми ет. от 14, ТЕЦ, Тухла 2026 г., Без комисиона от купувача. Двустаен апартамент, състоящ се от: входно преддверие, дневна с трапезари ..., тел.: 088 21 21 488",088 21 21 488,https://imoteka.imot.bg/,https://www.imot.bg/pcgi/imot.cgi?act=5&adv=1b168658232897093&slink=bi18s2&f1=5,4,2025-01-06 18:02:30.850569,Продава 2-СТАЕН,263340,EUR,Продава,PropertyType.DVUSTAEN,град София,Оборище,"88 кв.м, 7-ми ет. от 14, ТЕЦ, Тухла 2026 г., Без комисиона от купувача. Двустаен апартамент, състоящ се от: входно преддверие, дневна с трапезари ..., тел.: 088 21 21 488",088 21 21 488,https://imoteka.imot.bg/,https://www.imot.bg/pcgi/imot.cgi?act=5&adv=1b168658232897093&slink=bi18s2&f1=5,4,2025-01-06 18:02:30.850569,Site.IMOTBG,,,1b168658232897093
Продава 2-СТАЕН,275 000 EUR,1b173609409341201,"град София, Оборище","75 кв.м, 3-ти ет. от 5, ТЕЦ, Тухла 1941 г., - Напълно обзаведен двустаен апартамент след освежителен ремонт , в тухлена кооперация , строена пре ..., тел.: 0877 613 094",0877 613 094,https://expertbrokers.imot.bg/,https://www.imot.bg/pcgi/imot.cgi?act=5&adv=1b173609409341201&slink=bi18s2&f1=5,10,2025-01-06 18:02:30.850856,Продава 2-СТАЕН,275000,EUR,Продава,PropertyType.DVUSTAEN,град София,Оборище,"75 кв.м, 3-ти ет. от 5, ТЕЦ, Тухла 1941 г., - Напълно обзаведен двустаен апартамент след освежителен ремонт , в тухлена кооперация , строена пре ..., тел.: 0877 613 094",0877 613 094,https://expertbrokers.imot.bg/,https://www.imot.bg/pcgi/imot.cgi?act=5&adv=1b173609409341201&slink=bi18s2&f1=5,10,2025-01-06 18:02:30.850856,Site.IMOTBG,,,1b173609409341201
Продава 2-СТАЕН,277 200 EUR,1b168658233369998,"град София, Оборище","88 кв.м, 9-ти ет. от 14, ТЕЦ, Тухла 2026 г., Без комисиона от купувача. Двустаен апартамент, състоящ се от: входно преддверие, дневна с трапезари ..., тел.: 088 21 21 488",088 21 21 488,https://imoteka.imot.bg/,https://www.imot.bg/pcgi/imot.cgi?act=5&adv=1b168658233369998&slink=bi18s2&f1=5,4,2025-01-06 18:02:30.851140,Продава 2-СТАЕН,277200,EUR,Продава,PropertyType.DVUSTAEN,град София,Оборище,"88 кв.м, 9-ти ет. от 14, ТЕЦ, Тухла 2026 г., Без комисиона от купувача. Двустаен апартамент, състоящ се от: входно преддверие, дневна с трапезари ..., тел.: 088 21 21 488",088 21 21 488,https://imoteka.imot.bg/,https://www.imot.bg/pcgi/imot.cgi?act=5&adv=1b168658233369998&slink=bi18s2&f1=5,4,2025-01-06 18:02:30.851140,Site.IMOTBG,,,1b168658233369998
Продава 2-СТАЕН,284 130 EUR,1b170911935190967,"град София, Оборище","87 кв.м, 10-ти ет. от 14, ТЕЦ, Тухла 2026 г., Без комисиона от купувача. Двустаен апартамент, състоящ се от: входно преддверие, дневна с трапезари ..., тел.: 088 21 21 488",088 21 21 488,https://imoteka.imot.bg/,https://www.imot.bg/pcgi/imot.cgi?act=5&adv=1b170911935190967&slink=bi18s2&f1=5,4,2025-01-06 18:02:30.851422,Продава 2-СТАЕН,284130,EUR,Продава,PropertyType.DVUSTAEN,град София,Оборище,"87 кв.м, 10-ти ет. от 14, ТЕЦ, Тухла 2026 г., Без комисиона от купувача. Двустаен апартамент, състоящ се от: входно преддверие, дневна с трапезари ..., тел.: 088 21 21 488",088 21 21 488,https://imoteka.imot.bg/,https://www.imot.bg/pcgi/imot.cgi?act=5&adv=1b170911935190967&slink=bi18s2&f1=5,4,2025-01-06 18:02:30.851422,Site.IMOTBG,,,1b170911935190967
Продава 2-СТАЕН,291 000 EUR,1b168658241984515,"град София, Оборище","87 кв.м, 11-ти ет. от 14, ТЕЦ, Тухла 2026 г., Без комисиона от купувача. Двустаен апартамент, състоящ се от: входно преддверие, дневна с трапезари ..., тел.: 088 21 21 488",088 21 21 488,https://imoteka.imot.bg/,https://www.imot.bg/pcgi/imot.cgi?act=5&adv=1b168658241984515&slink=bi18s2&f1=5,4,2025-01-06 18:02:30.851703,Продава 2-СТАЕН,291000,EUR,Продава,PropertyType.DVUSTAEN,град София,Оборище,"87 кв.м, 11-ти ет. от 14, ТЕЦ, Тухла 2026 г., Без комисиона от купувача. Двустаен апартамент, състоящ се от: входно преддверие, дневна с трапезари ..., тел.: 088 21 21 488",088 21 21 488,https://imoteka.imot.bg/,https://www.imot.bg/pcgi/imot.cgi?act=5&adv=1b168658241984515&slink=bi18s2&f1=5,4,2025-01-06 18:02:30.851703,Site.IMOTBG,,,1b168658241984515
Продава 2-СТАЕН,242 550 EURЦената е без ДДС,1b171604603451218,"град София, Оборище","87 кв.м, 11-ти ет. от 14, Газ, Тухла 2024 г., БЕЗ КОМИСИОН ОТ КУПУВАЧА!!!  ИРИДА НЕДВИЖИМИ ИМОТИ продава слънчев двустаен апартамент в новоизгражд ..., тел.: 0885229006",0885229006,https://irida.imot.bg/,https://www.imot.bg/pcgi/imot.cgi?act=5&adv=1b171604603451218&slink=bi18s2&f1=6,7,2025-01-06 18:02:31.840448,Продава 2-СТАЕН,242550,EUR,Продава,PropertyType.DVUSTAEN,град София,Оборище,"87 кв.м, 11-ти ет. от 14, Газ, Тухла 2024 г., БЕЗ КОМИСИОН ОТ КУПУВАЧА!!!  ИРИДА НЕДВИЖИМИ ИМОТИ продава слънчев двустаен апартамент в новоизгражд ..., тел.: 0885229006",0885229006,https://irida.imot.bg/,https://www.imot.bg/pcgi/imot.cgi?act=5&adv=1b171604603451218&slink=bi18s2&f1=6,7,2025-01-06 18:02:31.840448,Site.IMOTBG,,,1b171604603451218
Продава 2-СТАЕН,242 550 EURЦената е без ДДС,1b171604603451218,"град София, Оборище","87 кв.м, 11-ти ет. от 14, Газ, Тухла 2024 г., БЕЗ КОМИСИОН ОТ КУПУВАЧА!!!  ИРИДА НЕДВИЖИМИ ИМОТИ продава слънчев двустаен апартамент в новоизгражд ..., тел.: 0885229006",0885229006,https://irida.imot.bg/,https://www.imot.bg/pcgi/imot.cgi?act=5&adv=1b171604603451218&slink=bi18s2&f1=6,7,2025-01-06 18:02:31.841172,Продава 2-СТАЕН,242550,EUR,Продава,PropertyType.DVUSTAEN,град София,Оборище,"87 кв.м, 11-ти ет. от 14, Газ, Тухла 2024 г., БЕЗ КОМИСИОН ОТ КУПУВАЧА!!!  ИРИДА НЕДВИЖИМИ ИМОТИ продава слънчев двустаен апартамент в новоизгражд ..., тел.: 0885229006",0885229006,https://irida.imot.bg/,https://www.imot.bg/pcgi/imot.cgi?act=5&adv=1b171604603451218&slink=bi18s2&f1=6,7,2025-01-06 18:02:31.841172,Site.IMOTBG,,,1b171604603451218
Продава 2-СТАЕН,295 000 EUR,1b173072097019904,"град София, Оборище","80 кв.м, ул. Оборище, 5-ти ет. от 6, ТЕЦ, Тухла 1962 г., НЕПРЕХОДЕН и ФУНКЦИОНАЛЕН ГОЛЯМ ДВУСТАЕН АПАРТАМЕНТ /възможност за ПРЕУСТРОЙСТВО в ТРИСТАЕН! в ЦЕНТЪ ..., тел.: 02/9802903 АЛДЕС",02/9802903 АЛДЕС,https://aldes.imot.bg/,https://www.imot.bg/pcgi/imot.cgi?act=5&adv=1b173072097019904&slink=bi18s2&f1=6,11,2025-01-06 18:02:31.841459,Продава 2-СТАЕН,295000,EUR,Продава,PropertyType.DVUSTAEN,град София,Оборище,"80 кв.м, ул. Оборище, 5-ти ет. от 6, ТЕЦ, Тухла 1962 г., НЕПРЕХОДЕН и ФУНКЦИОНАЛЕН ГОЛЯМ ДВУСТАЕН АПАРТАМЕНТ /възможност за ПРЕУСТРОЙСТВО в ТРИСТАЕН! в ЦЕНТЪ ..., тел.: 02/9802903 АЛДЕС",02/9802903 АЛДЕС,https://aldes.imot.bg/,https://www.imot.bg/pcgi/imot.cgi?act=5&adv=1b173072097019904&slink=bi18s2&f1=6,11,2025-01-06 18:02:31.841459,Site.IMOTBG,,,1b173072097019904
Продава 2-СТАЕН,297 990 EUR,1b168658233867128,"град София, Оборище","87 кв.м, 12-ти ет. от 14, ТЕЦ, Тухла 2026 г., Без комисиона от купувача. Двустаен апартамент, състоящ се от: входно преддверие, дневна с трапезари ..., тел.: 088 21 21 488",088 21 21 488,https://imoteka.imot.bg/,https://www.imot.bg/pcgi/imot.cgi?act=5&adv=1b168658233867128&slink=bi18s2&f1=6,4,2025-01-06 18:02:31.841740,Продава 2-СТАЕН,297990,EUR,Продава,PropertyType.DVUSTAEN,град София,Оборище,"87 кв.м, 12-ти ет. от 14, ТЕЦ, Тухла 2026 г., Без комисиона от купувача. Двустаен апартамент, състоящ се от: входно преддверие, дневна с трапезари ..., тел.: 088 21 21 488",088 21 21 488,https://imoteka.imot.bg/,https://www.imot.bg/pcgi/imot.cgi?act=5&adv=1b168658233867128&slink=bi18s2&f1=6,4,2025-01-06 18:02:31.841740,Site.IMOTBG,,,1b168658233867128
Продава 2-СТАЕН,248 325 EURЦената е без ДДС,1b171604510550501,"град София, Оборище","87 кв.м, 12-ти ет. от 14, Газ, Тухла 2024 г., БЕЗ КОМИСИОН ОТ КУПУВАЧА!!!  ИРИДА НЕДВИЖИМИ ИМОТИ продава слънчев двустаен апартамент в новоизгражд ..., тел.: 0885229006",0885229006,https://irida.imot.bg/,https://www.imot.bg/pcgi/imot.cgi?act=5&adv=1b171604510550501&slink=bi18s2&f1=6,7,2025-01-06 18:02:31.842021,Продава 2-СТАЕН,248325,EUR,Продава,PropertyType.DVUSTAEN,град София,Оборище,"87 кв.м, 12-ти ет. от 14, Газ, Тухла 2024 г., БЕЗ КОМИСИОН ОТ КУПУВАЧА!!!  ИРИДА НЕДВИЖИМИ ИМОТИ продава слънчев двустаен апартамент в новоизгражд ..., тел.: 0885229006",0885229006,https://irida.imot.bg/,https://www.imot.bg/pcgi/imot.cgi?act=5&adv=1b171604510550501&slink=bi18s2&f1=6,7,2025-01-06 18:02:31.842021,Site.IMOTBG,,,1b171604510550501
Продава 2-СТАЕН,304 500 EUR,1b172172141351670,"град София, Оборище","87 кв.м, 4-ти ет. от 6, Тухла 2024 г., БЕЗ КОМИСИОН ОТ КУПУВАЧА!   ИРИДА НЕДВИЖИМИ ИМОТИ Ви предлага за продажба двустаен апартамент с южно ..., тел.: 0877332218",0877332218,https://irida.imot.bg/,https://www.imot.bg/pcgi/imot.cgi?act=5&adv=1b172172141351670&slink=bi18s2&f1=6,,2025-01-06 18:02:31.842325,Продава 2-СТАЕН,304500,EUR,Продава,PropertyType.DVUSTAEN,град София,Оборище,"87 кв.м, 4-ти ет. от 6, Тухла 2024 г., БЕЗ КОМИСИОН ОТ КУПУВАЧА!   ИРИДА НЕДВИЖИМИ ИМОТИ Ви предлага за продажба двустаен апартамент с южно ..., тел.: 0877332218",0877332218,https://irida.imot.bg/,https://www.imot.bg/pcgi/imot.cgi?act=5&adv=1b172172141351670&slink=bi18s2&f1=6,,2025-01-06 18:02:31.842325,Site.IMOTBG,,,1b172172141351670
