raw_title,raw_description,price,currency,without_dds,offer_type,property_type,city,neighborhood,contact_info,agency,agency_url,details_url,num_photos,date_time_added,search_url,site,total_offers,date,ref_no,time,price_per_m2,area,floor
"продава Двустаен апартамент, 50 м2","С ключ сме!Голямо помещение КОЕТО МОЖЕ ДА СЕ ОФОРМИ КАТО ДНЕВНА с бокс и една спалня.Има Акт16.Пода е на теракот , стени латекс . В близост до бул.Г.М.Димитров,зад Търговска лига.  Височина на...",99990.0,EUR,False,продава,двустаен,София, Дианабад,,Dekris,,https://www.imoti.net/bg/obiava/prodava/sofia/dianabad/dvustaen/6095183/?sid=gFM8jD&page=1,1.0,2025-07-21 06:03:07.400721,https://www.imoti.net/bg/obiavi/r/prodava/sofia/?page=1&sid=gFM8jD,imoti.net,397,2025-07-21,,,Цена на /м2/:2 000EUR, 50 м2,Етаж: 0 от 6
"продава Двустаен апартамент, 63 м2","МЕТРО!ТИШИНА!ЕЛЕГАНТНОСТ!ПРЕДПРОДАЖБА!СКОРО ОТНОВО ЩЕ ВДИГНЕМ ЦЕНАТА, ПОБЪРЗАЙТЕ!ВЕЧЕ 70% ОТ ЖИЛИЩАТА СА ЗАКУПЕНИ!Уникален мини...",144900.0,EUR,False,продава,двустаен,София, Подуене,,Елеганс Естейт,,https://www.imoti.net/bg/obiava/prodava--v-stroej/sofia/poduene/dvustaen/5982550/?sid=gFM8jD&page=1,4.0,2025-07-21 06:03:07.401212,https://www.imoti.net/bg/obiavi/r/prodava/sofia/?page=1&sid=gFM8jD,imoti.net,397,2025-07-21,,,Цена на /м2/:2 300EUR, 63 м2,Етаж: 4 от 6
"продава Двустаен апартамент, 78 м2","ИРИДА НЕДВИЖИМИ ИМОТИ, С КЛЮЧ В АГЕНЦИЯТА!!! Ви представя за продажба прекрасен двустаен апартамент в кв. Дианабад в гр. София, в близост до множество обществен транспорт, осигуряващ връзки с...",194900.0,EUR,False,продава,двустаен,София, Дианабад,,ИРИДА НЕДВИЖИМИ ИМОТИ,,https://www.imoti.net/bg/obiava/prodava--v-stroej/sofia/dianabad/dvustaen/6071658/?sid=gFM8jD&page=1,12.0,2025-07-21 06:03:07.401689,https://www.imoti.net/bg/obiavi/r/prodava/sofia/?page=1&sid=gFM8jD,imoti.net,397,2025-07-21,,,Цена на /м2/:2 499EUR, 78 м2,Етаж: 2 от 6
"продава Двустаен апартамент, 89 м2","Ексклузивно представяме за продажба двустаен апартамент №4.28 в сграда S-Tower - нов проект с отличителен дизайн, висок клас на изпълнение, комуникативна локация и отлична възможност за инвестиция....",247041.0,EUR,False,продава,двустаен,София, Дианабад,,Luximmo Finest Estates,,https://www.imoti.net/bg/obiava/prodava--v-stroej/sofia/dianabad/dvustaen/6032718/?sid=gFM8jD&page=1,12.0,2025-07-21 06:03:07.402145,https://www.imoti.net/bg/obiavi/r/prodava/sofia/?page=1&sid=gFM8jD,imoti.net,397,2025-07-21,,,Цена на /м2/:2 776EUR, 89 м2,Етаж:  от 15
"продава Двустаен апартамент, 78 м2","Панорамен, обзаведен, двустаен апартамент. Намира се в непосредствена близост до ул. Велчо Атанасов и ул. Атанас Узунов. В близост има детска градина, училище, читалище, парк, хипермаркет, голям...",249600.0,EUR,False,продава,двустаен,София, Редута,,ДОМИНО Риъл Естейт,,https://www.imoti.net/bg/obiava/prodava/sofia/reduta/dvustaen/6098647/?sid=gFM8jD&page=1,12.0,2025-07-21 06:03:07.402578,https://www.imoti.net/bg/obiavi/r/prodava/sofia/?page=1&sid=gFM8jD,imoti.net,397,2025-07-21,,,Цена на /м2/:3 200EUR, 78 м2,Етаж: 6 от 6
"продава Тристаен апартамент, 142 м2","ЕЛЕГАНТНОСТ, КРАСОТА И ФУНКЦИОНАЛНОСТ!МЕТРО!ПАРК!В непосредствена близост до метростанция! Елегантната бутикова сграда, предстои да се издигне в един от най-бързо...",298200.0,EUR,False,продава,тристаен,София, Подуене,,Елеганс Естейт,,https://www.imoti.net/bg/obiava/prodava--v-stroej/sofia/poduene/tristaen/6043650/?sid=gFM8jD&page=1,6.0,2025-07-21 06:03:07.403001,https://www.imoti.net/bg/obiavi/r/prodava/sofia/?page=1&sid=gFM8jD,imoti.net,397,2025-07-21,,,Цена на /м2/:2 100EUR, 142 м2,Етаж: 4 от 7
"продава Тристаен апартамент, 88 м2","Тристаен апартамент състоящ се от хол, кухня, коридор, две спални, баня, тоалетна, тераса и мазе. Жилището има външна изолация, ПВЦ дограма, външна ролетна щора на едната спалня. Жилището е...",310000.0,EUR,False,продава,тристаен,София, Изток,,АДРЕС Недвижими имоти АД,,https://www.imoti.net/bg/obiava/prodava/sofia/sofija-iztok/tristaen/6034982/?sid=gFM8jD&page=1,6.0,2025-07-21 06:03:07.403417,https://www.imoti.net/bg/obiavi/r/prodava/sofia/?page=1&sid=gFM8jD,imoti.net,397,2025-07-21,,,Цена на /м2/:3 523EUR, 88 м2,Етаж: 4 от 7
"продава Тристаен апартамент, 125 м2","Представяме тристаен апартамент в чисто нова бутикова сграда с отлична локация в кв. „Сухата река“. В непосредствена близост се намира метростанция „Хаджи Димитър“, а популярният парк „Заимов“,...",327132.0,EUR,False,продава,тристаен,София, Суха Река,,Luximmo Finest Estates,,https://www.imoti.net/bg/obiava/prodava--v-stroej/sofia/suha-reka/tristaen/5829598/?sid=gFM8jD&page=1,5.0,2025-07-21 06:03:07.403887,https://www.imoti.net/bg/obiavi/r/prodava/sofia/?page=1&sid=gFM8jD,imoti.net,397,2025-07-21,,,Цена на /м2/:2 617EUR, 125 м2,Етаж:  от 10
"продава Тристаен апартамент, 130 м2","Ексклузивно представяме за продажба тристаен апартамент в сграда S-Tower - нов проект с отличителен дизайн, висок клас на изпълнение, комуникативна локация и отлична възможност за инвестиция....",344644.0,EUR,False,продава,тристаен,София, Дианабад,,Luximmo Finest Estates,,https://www.imoti.net/bg/obiava/prodava--v-stroej/sofia/dianabad/tristaen/5805229/?sid=gFM8jD&page=1,12.0,2025-07-21 06:03:07.404341,https://www.imoti.net/bg/obiavi/r/prodava/sofia/?page=1&sid=gFM8jD,imoti.net,397,2025-07-21,,,Цена на /м2/:2 651EUR, 130 м2,Етаж:  от 15
"продава Тристаен апартамент, 86 м2","Просторен тристаен апартамент, състоящ се от хол с бокс, две спални, две бани и слънчева тераса към вътрешен двор в желания квартал Оборище. Тристайният апартамент е след основен ремонт, сменени...",350000.0,EUR,False,продава,тристаен,София, Оборище,,АДРЕС Недвижими имоти АД,,https://www.imoti.net/bg/obiava/prodava/sofia/oborishte/tristaen/6042651/?sid=gFM8jD&page=1,17.0,2025-07-21 06:03:07.404760,https://www.imoti.net/bg/obiavi/r/prodava/sofia/?page=1&sid=gFM8jD,imoti.net,397,2025-07-21,,,Цена на /м2/:4 070EUR, 86 м2,Етаж: 3 от 5
"продава Тристаен апартамент, 132 м2","МЕТРОПАРКЛУКСЕлеганс Естейт има удоволствието да представи на своите клиенти една емблематична новострояща се сграда, намираща се в непосредствена...",359961.0,EUR,False,продава,тристаен,София, Суха Река,,Елеганс Естейт,,https://www.imoti.net/bg/obiava/prodava--v-stroej/sofia/suha-reka/tristaen/6052785/?sid=gFM8jD&page=1,5.0,2025-07-21 06:03:07.405180,https://www.imoti.net/bg/obiavi/r/prodava/sofia/?page=1&sid=gFM8jD,imoti.net,397,2025-07-21,,,Цена на /м2/:2 727EUR, 132 м2,Етаж: 9 от 10
"продава Тристаен апартамент, 152 м2","Тристаен апартамент в Оборище, на две нива с обща застроена площ 152,60 кв.м., състоящ се на първо ниво от дневна, трапезария, коридор, кухня, тераса и баня, при обща площ на това първо ниво...",396000.0,EUR,False,продава,тристаен,София, Оборище,,АДРЕС Недвижими имоти АД,,https://www.imoti.net/bg/obiava/prodava/sofia/oborishte/tristaen/6013994/?sid=gFM8jD&page=1,14.0,2025-07-21 06:03:07.405602,https://www.imoti.net/bg/obiavi/r/prodava/sofia/?page=1&sid=gFM8jD,imoti.net,397,2025-07-21,,,Цена на /м2/:2 605EUR, 152 м2,Етаж: 5 от 6
"продава Тристаен апартамент, 128 м2","ИРИДА НЕДВИЖИМИ ИМОТИ продава слънчев тристаен апартамент в новоизграждащ се затворен жилищен комплекс, с изключително висококачествено строителство от доказан инвеститор на комуникативно място, в...",411250.0,EUR,False,продава,тристаен,София, Оборище,,ИРИДА НЕДВИЖИМИ ИМОТИ,,https://www.imoti.net/bg/obiava/prodava--v-stroej/sofia/oborishte/tristaen/6045933/?sid=gFM8jD&page=1,5.0,2025-07-21 06:03:07.406050,https://www.imoti.net/bg/obiavi/r/prodava/sofia/?page=1&sid=gFM8jD,imoti.net,397,2025-07-21,,,Цена на /м2/:3 213EUR, 128 м2,Етаж: 8 от 14
"продава Тристаен апартамент, 144 м2","ИРИДА НЕДВИЖИМИ ИМОТИ продава слънчев тристаен апартамент в новоизграждащ се затворен жилищен комплекс, с изключително висококачествено строителство от доказан инвеститор на комуникативно място, в...",472200.0,EUR,False,продава,тристаен,София, Оборище,,ИРИДА НЕДВИЖИМИ ИМОТИ,,https://www.imoti.net/bg/obiava/prodava--v-stroej/sofia/oborishte/tristaen/6040120/?sid=gFM8jD&page=1,7.0,2025-07-21 06:03:07.406498,https://www.imoti.net/bg/obiavi/r/prodava/sofia/?page=1&sid=gFM8jD,imoti.net,397,2025-07-21,,,Цена на /м2/:3 279EUR, 144 м2,Етаж: 7 от 14
"продава Четиристаен апартамент, 168 м2","Фърст естейтс има удоволствието да Ви представи ексклузивно този просторен апартамент в престижния квартал Изток. Перфектно проектиран за съвременно живеене, този имот предлага комбинация от...",635000.0,EUR,False,продава,четиристаен,София, Изток,,First Estates,,https://www.imoti.net/bg/obiava/prodava/sofia/sofija-iztok/chetiristaen/6098112/?sid=gFM8jD&page=1,16.0,2025-07-21 06:03:07.406952,https://www.imoti.net/bg/obiavi/r/prodava/sofia/?page=1&sid=gFM8jD,imoti.net,397,2025-07-21,,,Цена на /м2/:3 780EUR, 168 м2,Етаж: 2 от 5
"продава Многостаен апартамент, 191 м2","Апартаментът се състои от 3 спални- към две от спалните има прилежаща баня с WC; дневна с трапезария и кухненски бокс -42,00м², 3 бани с WC; входно антре със складово помещение...",653148.0,EUR,False,продава,многостаен,София, Оборище,,АДРЕС Недвижими имоти АД,,https://www.imoti.net/bg/obiava/prodava/sofia/oborishte/mnogostaen/6006570/?sid=gFM8jD&page=1,18.0,2025-07-21 06:03:07.407354,https://www.imoti.net/bg/obiavi/r/prodava/sofia/?page=1&sid=gFM8jD,imoti.net,397,2025-07-21,,,Цена на /м2/:3 420EUR, 191 м2,Етаж: 4 от 14
"продава Двустаен апартамент, 58 м2","Двустайно жилище състоящо се от: антре, дневна с кухненски бокс, спралня, баня с тоалетна и тераса. Към жилището има прилежащо мазе.Има възможност за закупуване на паркомясто.",100148.0,EUR,False,продава,двустаен,София, Суха Река,,АДРЕС Недвижими имоти АД,,https://www.imoti.net/bg/obiava/prodava/sofia/suha-reka/dvustaen/6096692/?sid=gFM8jD&page=1,5.0,2025-07-21 06:03:07.407796,https://www.imoti.net/bg/obiavi/r/prodava/sofia/?page=1&sid=gFM8jD,imoti.net,397,2025-07-21,,,Цена на /м2/:1 727EUR, 58 м2,Етаж: 4 от 5
"продава Двустаен апартамент, 46 м2",Предлагаме за продажба пред АКТ 14двустайно ателие номер 1Разпределение:▪ входно антре▪  дневна с кухненски бокс▪ самостоятелна спалня,100148.0,EUR,False,продава,двустаен,София, Суха Река,,Имотека,,https://www.imoti.net/bg/obiava/prodava/sofia/suha-reka/dvustaen/6095588/?sid=gFM8jD&page=1,2.0,2025-07-21 06:03:07.408248,https://www.imoti.net/bg/obiavi/r/prodava/sofia/?page=1&sid=gFM8jD,imoti.net,397,2025-07-21,,,Цена на /м2/:2 177EUR, 46 м2,Етаж: 4 от 5
"продава Двустаен апартамент, 62 м2","Двустайно жилище състоящо се от: антре, дневна с кухненски бокс, спралня, баня с тоалетна и тераса. Към жилището има прилежащо мазе.Има възможност за закупуване на паркомясто.",106185.0,EUR,False,продава,двустаен,София, Суха Река,,АДРЕС Недвижими имоти АД,,https://www.imoti.net/bg/obiava/prodava/sofia/suha-reka/dvustaen/6096691/?sid=gFM8jD&page=1,5.0,2025-07-21 06:03:07.408691,https://www.imoti.net/bg/obiavi/r/prodava/sofia/?page=1&sid=gFM8jD,imoti.net,397,2025-07-21,,,Цена на /м2/:1 713EUR, 62 м2,Етаж: 4 от 5
"продава Двустаен апартамент, 49 м2",Предлагаме за продажба пред АКТ 14двустаен апартамент №2Разпределение:▪ входно антре▪ просторна дневна с кухненски бокс▪ самостоятелна спалня...,106185.0,EUR,False,продава,двустаен,София, Суха Река,,Имотека,,https://www.imoti.net/bg/obiava/prodava/sofia/suha-reka/dvustaen/6095587/?sid=gFM8jD&page=1,2.0,2025-07-21 06:03:07.409139,https://www.imoti.net/bg/obiavi/r/prodava/sofia/?page=1&sid=gFM8jD,imoti.net,397,2025-07-21,,,Цена на /м2/:2 167EUR, 49 м2,Етаж: 4 от 5
"продава Двустаен апартамент, 59 м2","Двустаен апартамент състоящ се от: антре, дневна с кухненски бокс, спралня, баня с тоалетна и тераса. Към жилището има прилежащо мазе.Има възможност за закупуване на паркомясто.",112462.0,EUR,False,продава,двустаен,София, Суха Река,,АДРЕС Недвижими имоти АД,,https://www.imoti.net/bg/obiava/prodava/sofia/suha-reka/dvustaen/6096693/?sid=gFM8jD&page=1,5.0,2025-07-21 06:03:07.409587,https://www.imoti.net/bg/obiavi/r/prodava/sofia/?page=1&sid=gFM8jD,imoti.net,397,2025-07-21,,,Цена на /м2/:1 906EUR, 59 м2,Етаж: 2 от 5
"продава Двустаен апартамент, 47 м2","Предлагаме за продажба пред АКТ 14двустаен апартамент №1,разположен на втори етаж в модерна сграда ново строителствоРазпределение:▪ входно антре",113650.0,EUR,False,продава,двустаен,София, Суха Река,,Имотека,,https://www.imoti.net/bg/obiava/prodava/sofia/suha-reka/dvustaen/6095589/?sid=gFM8jD&page=1,2.0,2025-07-21 06:03:07.410036,https://www.imoti.net/bg/obiavi/r/prodava/sofia/?page=1&sid=gFM8jD,imoti.net,397,2025-07-21,,,Цена на /м2/:2 418EUR, 47 м2,Етаж: 2 от 5
"продава Тристаен апартамент, 84 м2","Явлена-Изток продава 3-стаен апартамент 84 кв.м. в ж.к. Сухата река. Състоящ се от: дневна, две спални, кухня, баня, тоалетна, мокро помещение, гардеробно и две тераси. Сградата е панел от 1974г....",125000.0,EUR,False,продава,тристаен,София, Суха Река,,Явлена Изток,,https://www.imoti.net/bg/obiava/prodava/sofia/suha-reka/tristaen/5675521/?sid=gFM8jD&page=1,12.0,2025-07-21 06:03:07.410456,https://www.imoti.net/bg/obiavi/r/prodava/sofia/?page=1&sid=gFM8jD,imoti.net,397,2025-07-21,,,Цена на /м2/:1 488EUR, 84 м2,Етаж: 6 от 8
"продава Двустаен апартамент, 47 м2","Нов среден южен партерен имот със статут офис. Сграда с Акт 16 от 2024 г.ТЕЦ.Топ - локация в широк център, непосредствено до ул. Черковна. Сградата е на 200 метра от метростанция, 1040 м....",125000.0,EUR,False,продава,двустаен,София, Суха Река,,Юпитер-8,,https://www.imoti.net/bg/obiava/prodava/sofia/suha-reka/dvustaen/6044312/?sid=gFM8jD&page=1,6.0,2025-07-21 06:03:07.410890,https://www.imoti.net/bg/obiavi/r/prodava/sofia/?page=1&sid=gFM8jD,imoti.net,397,2025-07-21,,,Цена на /м2/:2 660EUR, 47 м2,Етаж: 1 от 9
"продава Двустаен апартамент, 47 м2","Нов среден южен партерен имот със статут офис. Сграда с Акт 16 от 2024 г.ТЕЦ.Топ - локация в широк център, непосредствено до ул. Черковна. Сградата е на 200 метра от метростанция, 1040 м....",125000.0,EUR,False,продава,двустаен,София, Подуене,,Юпитер-8,,https://www.imoti.net/bg/obiava/prodava/sofia/poduene/dvustaen/6044314/?sid=gFM8jD&page=1,6.0,2025-07-21 06:03:07.411312,https://www.imoti.net/bg/obiavi/r/prodava/sofia/?page=1&sid=gFM8jD,imoti.net,397,2025-07-21,,,Цена на /м2/:2 660EUR, 47 м2,Етаж: 1 от 9
"продава Двустаен апартамент, 47 м2","Нов среден южен партерен имот със статут офис. Сграда с Акт 16 от 2024 г.ТЕЦ.Топ - локация в широк център, непосредствено до ул. Черковна. Сградата е на 200 метра от метростанция, 1040 м....",125000.0,EUR,False,продава,двустаен,София, Оборище,,Юпитер-8,,https://www.imoti.net/bg/obiava/prodava/sofia/oborishte/dvustaen/6044316/?sid=gFM8jD&page=1,9.0,2025-07-21 06:03:07.411750,https://www.imoti.net/bg/obiavi/r/prodava/sofia/?page=1&sid=gFM8jD,imoti.net,397,2025-07-21,,,Цена на /м2/:2 660EUR, 47 м2,Етаж: 1 от 9
"продава Двустаен апартамент, 66 м2","Представяме двустаен апартамент за продажба в нова сграда в кв. ""Редута"".Сградата е с Акт 16 от 2025 г.Имотът се намира на тиха и спокойна улица, гарантираща комфорта...",135000.0,EUR,False,продава,двустаен,София, Редута,,SUPRIMMO,,https://www.imoti.net/bg/obiava/prodava--v-stroej/sofia/reduta/dvustaen/6002958/?sid=gFM8jD&page=1,2.0,2025-07-21 06:03:07.412187,https://www.imoti.net/bg/obiavi/r/prodava/sofia/?page=1&sid=gFM8jD,imoti.net,397,2025-07-21,,,Цена на /м2/:2 045EUR, 66 м2,Етаж:  от 6
"продава Двустаен апартамент, 77 м2","Компания `ЕКС` представя на Вашето внимание двустаен апартамент в жк Сухата река.МЕСТОПОЛОЖЕНИЕ: В близост до спирка на градски транспорт, детска градина, училище, магазини от...",138726.0,EUR,False,продава,двустаен,София, Суха Река,,ЕКС НВД,,https://www.imoti.net/bg/obiava/prodava--v-stroej/sofia/suha-reka/dvustaen/5899149/?sid=gFM8jD&page=1,2.0,2025-07-21 06:03:07.412625,https://www.imoti.net/bg/obiavi/r/prodava/sofia/?page=1&sid=gFM8jD,imoti.net,397,2025-07-21,,,Цена на /м2/:1 802EUR, 77 м2,Етаж: 4 от 6
"продава Двустаен апартамент, 77 м2","Компания `ЕКС` представя на Вашето внимание двустаен апартамент в жк Сухата река.МЕСТОПОЛОЖЕНИЕ: В близост до спирка на градски транспорт, детска градина, училище, магазини от...",139000.0,EUR,False,продава,двустаен,София, Суха Река,,ЕКС НВД,,https://www.imoti.net/bg/obiava/prodava--v-stroej/sofia/suha-reka/dvustaen/5900575/?sid=gFM8jD&page=1,2.0,2025-07-21 06:03:07.413050,https://www.imoti.net/bg/obiavi/r/prodava/sofia/?page=1&sid=gFM8jD,imoti.net,397,2025-07-21,,,Цена на /м2/:1 805EUR, 77 м2,Етаж: 5 от 6
"продава Двустаен апартамент, 38 м2","Представяме Ви гарсониера, разположена в тих и зелен район на квартал „Оборище“. Имотът се намира в район с добра изградена инфраструктура и комуникации, с бърз достъп до основни пътни артерии и...",150000.0,EUR,False,продава,двустаен,София, Оборище,,Luximmo Finest Estates,,https://www.imoti.net/bg/obiava/prodava--v-stroej/sofia/oborishte/dvustaen/6096796/?sid=gFM8jD&page=1,4.0,2025-07-21 06:03:07.413542,https://www.imoti.net/bg/obiavi/r/prodava/sofia/?page=1&sid=gFM8jD,imoti.net,397,2025-07-21,,,Цена на /м2/:3 947EUR, 38 м2,Етаж:  от 4
"продава Двустаен апартамент, 70 м2","New Estates представя двустаен апартамент в новострояща се жилищна сграда, която се намира на едно от най-комуникативните места в София.Централното, но същевременно тихо и спокойно...",152920.0,EUR,False,продава,двустаен,София, Подуене,,New Estates,,https://www.imoti.net/bg/obiava/prodava--v-stroej/sofia/poduene/dvustaen/6044477/?sid=gFM8jD&page=2,6.0,2025-07-21 06:03:11.659684,https://www.imoti.net/bg/obiavi/r/prodava/sofia/?page=1&sid=gFM8jD,imoti.net,397,2025-07-21,,,Цена на /м2/:2 185EUR, 70 м2,Етаж: 8 от 9
"продава Тристаен апартамент, 65 м2","Ексклузивно!!! Galiano Estates има удоволствието да ви представи комфортен двустаен апартамент с южно изложение, функционално преустроен в два самостоятелни имота, разположен в кв. Сухата река – в...",158000.0,EUR,False,продава,тристаен,София, Суха Река,,Galiano Estates,,https://www.imoti.net/bg/obiava/prodava/sofia/suha-reka/tristaen/6097387/?sid=gFM8jD&page=2,9.0,2025-07-21 06:03:11.660248,https://www.imoti.net/bg/obiavi/r/prodava/sofia/?page=1&sid=gFM8jD,imoti.net,397,2025-07-21,,,Цена на /м2/:2 431EUR, 65 м2,Етаж: 1 от 8
"продава Двустаен апартамент, 60 м2","Открийте мястото, където ще се чувствате у дома от първия момент.Титан Пропъртис- офис Хиподрума с радост предлага на Вашето внимание двустаен апартамент в ж.к. Сухата река, София....",160000.0,EUR,False,продава,двустаен,София, Суха Река,,Титан Пропъртис София,,https://www.imoti.net/bg/obiava/prodava/sofia/suha-reka/dvustaen/6098362/?sid=gFM8jD&page=2,3.0,2025-07-21 06:03:11.660692,https://www.imoti.net/bg/obiavi/r/prodava/sofia/?page=1&sid=gFM8jD,imoti.net,397,2025-07-21,,,Цена на /м2/:2 667EUR, 60 м2,Етаж: 2 от 8
