raw_title,raw_description,price,currency,without_dds,offer_type,property_type,city,neighborhood,contact_info,agency,agency_url,details_url,num_photos,date_time_added,search_url,site,total_offers,date,ref_no,time,price_per_m2,area,floor
"продава Тристаен апартамент, 113 м2",АКТ 14!!!НА 1 МИН. ОТ МЕТРОТО! НА 10 МИН. ОТ КУБЕТАТА НА ХРАМ ПАМЕТНИК АЛЕКСАНДЪР НЕВСКИ!Ексклузивно предложение!Това е една от най-красивите сгради в София....,316400.0,EUR,False,продава,тристаен,София, Суха Река,,Елеганс Естейт,,https://www.imoti.net/bg/obiava/prodava--v-stroej/sofia/suha-reka/tristaen/5971906/?sid=gFM8jD&page=7,6.0,2025-07-21 06:03:32.499556,https://www.imoti.net/bg/obiavi/r/prodava/sofia/?page=1&sid=gFM8jD,imoti.net,397,2025-07-21,,,Цена на /м2/:2 800EUR, 113 м2,Етаж: 5 от 10
"продава Тристаен апартамент, 117 м2","Ексклузивно представяме за продажба комфортен тристаен апартамент №7.52 в сграда S-Tower - нов проект с отличителен дизайн, висок клас на изпълнение, комуникативна локация и отлична възможност за...",317620.0,EUR,False,продава,тристаен,София, Дианабад,,Luximmo Finest Estates,,https://www.imoti.net/bg/obiava/prodava--v-stroej/sofia/dianabad/tristaen/6017652/?sid=gFM8jD&page=7,12.0,2025-07-21 06:03:32.500058,https://www.imoti.net/bg/obiavi/r/prodava/sofia/?page=1&sid=gFM8jD,imoti.net,397,2025-07-21,,,Цена на /м2/:2 715EUR, 117 м2,Етаж:  от 15
"продава Тристаен апартамент, 110 м2","ARCO REAL ESTATE представя нов проект в кв. Редута, с отличаващ се дизайн и висок клас на изпълнение. Сградата е девететажна, с озеленен двор и обособени места за паркиране.Апартамент № 20 е...",318240.0,EUR,False,продава,тристаен,София, Редута,,ARCO REAL ESTATE,,https://www.imoti.net/bg/obiava/prodava/sofia/reduta/tristaen/6096855/?sid=gFM8jD&page=7,2.0,2025-07-21 06:03:32.500553,https://www.imoti.net/bg/obiavi/r/prodava/sofia/?page=1&sid=gFM8jD,imoti.net,397,2025-07-21,,,Цена на /м2/:2 893EUR, 110 м2,Етаж: 5 от 9
"продава Тристаен апартамент, 98 м2","Скала Ди предлага имот с уникална локация в престижния кв. Изток. Комуникативно място, на пешеходно разстояние от Метростанция и автобусна спирка, В близост до детска ясла и детска градина,...",319000.0,EUR,False,продава,тристаен,София, Изток,,Скала Ди недвижими имоти,,https://www.imoti.net/bg/obiava/prodava/sofia/sofija-iztok/tristaen/6079385/?sid=gFM8jD&page=7,10.0,2025-07-21 06:03:32.501027,https://www.imoti.net/bg/obiavi/r/prodava/sofia/?page=1&sid=gFM8jD,imoti.net,397,2025-07-21,,,Цена на /м2/:3 255EUR, 98 м2,Етаж: 2 от 4
"продава Тристаен апартамент, 62 м2","Представяме на Вашето внимание ексклузивен тристаен апартамент с площ от 62,71 кв.м, разположен на първи етаж в жилищна сграда на улица ""Алеко Константинов"" в един от най-емблематичните и...",319900.0,EUR,False,продава,тристаен,София, Оборище,,Luximmo Finest Estates,,https://www.imoti.net/bg/obiava/prodava--v-stroej/sofia/oborishte/tristaen/6071498/?sid=gFM8jD&page=7,28.0,2025-07-21 06:03:32.501503,https://www.imoti.net/bg/obiavi/r/prodava/sofia/?page=1&sid=gFM8jD,imoti.net,397,2025-07-21,,,Цена на /м2/:5 160EUR, 62 м2,Етаж:  от 4
"продава Тристаен апартамент, 62 м2","Представяме на Вашето внимание ексклузивен тристаен апартамент с чиста площ от 62,71 кв.м, разположен на първи етаж в жилищна сграда на улица ""Алеко Константинов"" в един от най-емблематичните и...",319900.0,EUR,False,продава,тристаен,София, Оборище,,Luximmo Finest Estates,,https://www.imoti.net/bg/obiava/prodava--v-stroej/sofia/oborishte/tristaen/6071036/?sid=gFM8jD&page=7,28.0,2025-07-21 06:03:32.501993,https://www.imoti.net/bg/obiavi/r/prodava/sofia/?page=1&sid=gFM8jD,imoti.net,397,2025-07-21,,,Цена на /м2/:5 160EUR, 62 м2,Етаж:  от 4
"продава Двустаен апартамент, 88 м2",.  .  .  .  .  .  .  .  .  .  .  .  .  .  .  .  .  .  .  .  .  .  .  .  .  .  .  .  .  . ПРЕУСТРОЕН .  .  .  .  .  .  .  .  .  .  .  .  .  .  .  .  .  .  .  .  .  .  .  .  .  .  .  .  .  .В...,320000.0,EUR,False,продава,двустаен,София, Изгрев,,АРСЕНАЛ - недвижими имоти,,https://www.imoti.net/bg/obiava/prodava/sofia/sofija-izgrev/dvustaen/5988906/?sid=gFM8jD&page=7,10.0,2025-07-21 06:03:32.502414,https://www.imoti.net/bg/obiavi/r/prodava/sofia/?page=1&sid=gFM8jD,imoti.net,397,2025-07-21,,,Цена на /м2/:3 636EUR, 88 м2,Етаж: 2 от 17
"продава Четиристаен апартамент, 115 м2",".  .  .  .  .  .  .  .  .  .  .  ЩЕ .  .  .  .  .  .  .  .  .  .  .  .  .  .  .  .  .  .  .  .  . Ви предложим 'многофункционален' имот, ПОДХОДЯЩ както за жилище, така и за офис. Апартаментът се...",320000.0,EUR,False,продава,четиристаен,София, Изток,,АРСЕНАЛ - недвижими имоти,,https://www.imoti.net/bg/obiava/prodava/sofia/sofija-iztok/chetiristaen/5608324/?sid=gFM8jD&page=7,10.0,2025-07-21 06:03:32.502848,https://www.imoti.net/bg/obiavi/r/prodava/sofia/?page=1&sid=gFM8jD,imoti.net,397,2025-07-21,,,Цена на /м2/:2 783EUR, 115 м2,Етаж: 2 от 9
"продава Четиристаен апартамент, 167 м2",КЛИЕНТИТЕ НА MARTIN'S СА ПО-ДОВОЛНИ! ПОПИТАЙ ЗАЩО!Предлагаме четиристаен апартамент с обща площ от 166.86 кв.м. в сграда ново строителство. Имотът е ситуиран на шести етаж в сграда с общо 9...,320373.0,EUR,False,продава,четиристаен,София, Суха Река,,MARTIN’S,,https://www.imoti.net/bg/obiava/prodava--v-stroej/sofia/suha-reka/chetiristaen/5970854/?sid=gFM8jD&page=7,3.0,2025-07-21 06:03:32.503282,https://www.imoti.net/bg/obiavi/r/prodava/sofia/?page=1&sid=gFM8jD,imoti.net,397,2025-07-21,,,Цена на /м2/:1 918EUR, 167 м2,Етаж: 6 от 9
"продава Тристаен апартамент, 146 м2","ARCO REAL ESTATE предлага тристаен апартамент със застроена площ 127 кв.м., южно изложенив, в луксозна жилищна сграда на десет етажа в кв. Сухата река, на пет минути пешеходно разстояние от...",321900.0,EUR,False,продава,тристаен,София, Суха Река,,ARCO REAL ESTATE,,https://www.imoti.net/bg/obiava/prodava/sofia/suha-reka/tristaen/5971430/?sid=gFM8jD&page=7,5.0,2025-07-21 06:03:32.503767,https://www.imoti.net/bg/obiavi/r/prodava/sofia/?page=1&sid=gFM8jD,imoti.net,397,2025-07-21,,,Цена на /м2/:2 205EUR, 146 м2,Етаж: 3 от 10
"продава Двустаен апартамент, 75 м2","ХОУМ ЛАЙТ Ви предлага уютен, двустаен апартамент на перфектна локация в кв. Изток!Жилището се намира на девети етаж в тухлена сграда, разположена в непосредствена близост до парк...",325000.0,EUR,False,продава,двустаен,София, Изток,,ХОУМЛАЙТ,,https://www.imoti.net/bg/obiava/prodava/sofia/sofija-iztok/dvustaen/6023443/?sid=gFM8jD&page=7,11.0,2025-07-21 06:03:32.504196,https://www.imoti.net/bg/obiavi/r/prodava/sofia/?page=1&sid=gFM8jD,imoti.net,397,2025-07-21,,,Цена на /м2/:4 333EUR, 75 м2,Етаж: 9 от 10
"продава Тристаен апартамент, 108 м2",Имоти ПРЕМИЕР представя на Вашето внимание тристаен апартамент в кв. Редута !Жилището е ситуирано на трети етаж в тухлена сграда без асансьор. Изложение Изток/Запад/Север. Обща площ...,325000.0,EUR,False,продава,тристаен,София, Редута,,Имоти Премиер,,https://www.imoti.net/bg/obiava/prodava/sofia/reduta/tristaen/6089525/?sid=gFM8jD&page=7,10.0,2025-07-21 06:03:32.504695,https://www.imoti.net/bg/obiavi/r/prodava/sofia/?page=1&sid=gFM8jD,imoti.net,397,2025-07-21,,,Цена на /м2/:3 009EUR, 108 м2,Етаж: 3 от 4
"продава Тристаен апартамент, 81 м2","Реф. № 012053Агенция за недвижими имоти BAS Properties предлага за продажба тристаен апартамент, разположен в престижния кв. Оборище, гр. София. Имотът е обзаведен, вътрешен, с...",328000.0,EUR,False,продава,тристаен,София, Оборище,,БАС Пропъртис,,https://www.imoti.net/bg/obiava/prodava/sofia/oborishte/tristaen/6086676/?sid=gFM8jD&page=8,10.0,2025-07-21 06:03:39.751685,https://www.imoti.net/bg/obiavi/r/prodava/sofia/?page=1&sid=gFM8jD,imoti.net,397,2025-07-21,,,Цена на /м2/:4 049EUR, 81 м2,Етаж: 2 от 4
"продава Тристаен апартамент, 97 м2","Революшън Естейт представя на Вашето внимание тристаен апартамент в ж.к. Редута.Намира се на комуникативно място в близост до ясли, детски градини, парк Гео Милев, спирки на градски...",330000.0,EUR,False,продава,тристаен,София, Редута,,Революшън Естейт България,,https://www.imoti.net/bg/obiava/prodava/sofia/reduta/tristaen/6047262/?sid=gFM8jD&page=8,15.0,2025-07-21 06:03:39.752200,https://www.imoti.net/bg/obiavi/r/prodava/sofia/?page=1&sid=gFM8jD,imoti.net,397,2025-07-21,,,Цена на /м2/:3 402EUR, 97 м2,Етаж: 3 от 5
"продава Двустаен апартамент, 91 м2","Открийте мястото, където ще се чувствате у дома от първия момент.Титан Пропъртис - офис Младост с радост предлага на Вашето внимание двустаен апартамент в жк. Оборище, София. С площ...",330000.0,EUR,False,продава,двустаен,София, Оборище,,Титан Пропъртис Рент,,https://www.imoti.net/bg/obiava/prodava/sofia/oborishte/dvustaen/6078943/?sid=gFM8jD&page=8,8.0,2025-07-21 06:03:39.752643,https://www.imoti.net/bg/obiavi/r/prodava/sofia/?page=1&sid=gFM8jD,imoti.net,397,2025-07-21,,,Цена на /м2/:3 626EUR, 91 м2,Етаж: 2 от 4
"продава Тристаен апартамент, 119 м2","Явлена-Изток представя тристаен апартамент в квартал Редута, на комуникативно място и добра локация. ПРЕД АКТ 16!Апартамента е непреходен, със северозападно изложение, на партерен етаж с...",332000.0,EUR,False,продава,тристаен,София, Редута,,Явлена Изток,,https://www.imoti.net/bg/obiava/prodava/sofia/reduta/tristaen/6031547/?sid=gFM8jD&page=8,8.0,2025-07-21 06:03:39.753067,https://www.imoti.net/bg/obiavi/r/prodava/sofia/?page=1&sid=gFM8jD,imoti.net,397,2025-07-21,,,Цена на /м2/:2 790EUR, 119 м2,Етаж: 0 от 8
"продава Тристаен апартамент, 117 м2","Тристаен слънчев апартамент, на втори етаж със следното разпределение: предверие/коридор със склад/гардеробна, хол с кухненски бокс, две спални, баня с тоалетна, втора тоалетна, 2 тераси. Към...",333000.0,EUR,False,продава,тристаен,София, Оборище,,АДРЕС Недвижими имоти АД,,https://www.imoti.net/bg/obiava/prodava/sofia/oborishte/tristaen/6092152/?sid=gFM8jD&page=8,11.0,2025-07-21 06:03:39.753483,https://www.imoti.net/bg/obiavi/r/prodava/sofia/?page=1&sid=gFM8jD,imoti.net,397,2025-07-21,,,Цена на /м2/:2 846EUR, 117 м2,Етаж: 2 от 10
"продава Двустаен апартамент, 74 м2","Unique estates има удоволствието да ви представи на вашето внимание едно изключително предложение за продажба – прекрасно обзаведен двустаен апартамент, разположен в...",333000.0,EUR,False,продава,двустаен,София, Дианабад,,ЮНИК ЕСТЕЙТС,,https://www.imoti.net/bg/obiava/prodava/sofia/dianabad/dvustaen/6088416/?sid=gFM8jD&page=8,10.0,2025-07-21 06:03:39.753941,https://www.imoti.net/bg/obiavi/r/prodava/sofia/?page=1&sid=gFM8jD,imoti.net,397,2025-07-21,,,Цена на /м2/:4 500EUR, 74 м2,Етаж: 1 от 6
"продава Тристаен апартамент, 100 м2","Ексклузивно представяме автентично тристайно жилище от 80-те години, с обща площ 100 кв.м, за продажба в престижния столичен кв. ""Изток"".Местоположението на имота е на емблематичната...",335000.0,EUR,False,продава,тристаен,София, Изток,,Luximmo Finest Estates,,https://www.imoti.net/bg/obiava/prodava--v-stroej/sofia/sofija-iztok/tristaen/5716842/?sid=gFM8jD&page=8,5.0,2025-07-21 06:03:39.754415,https://www.imoti.net/bg/obiavi/r/prodava/sofia/?page=1&sid=gFM8jD,imoti.net,397,2025-07-21,,,Цена на /м2/:3 350EUR, 100 м2,Етаж:  от 14
"продава Двустаен апартамент, 139 м2","ЕРА Идеа предлага тристаен апартамент в нова  жилищна сграда в кв. ""Редута"" - на 200м. от парк ""Гео Милев"", най -привлекателната част на квартала.Апартаментът се намира на 5ти жилищен етаж....",335328.0,EUR,False,продава,двустаен,София, Редута,,Ера Идеа,,https://www.imoti.net/bg/obiava/prodava--v-stroej/sofia/reduta/dvustaen/6079631/?sid=gFM8jD&page=8,2.0,2025-07-21 06:03:39.754849,https://www.imoti.net/bg/obiavi/r/prodava/sofia/?page=1&sid=gFM8jD,imoti.net,397,2025-07-21,,,Цена на /м2/:2 412EUR, 139 м2,Етаж: 5 от 6
"продава Тристаен апартамент, 139 м2","Предлагаме на Вашето внимание тристаен апартамент, разположен на пети етаж в модерна жилищна сграда в един от най-предпочитаните райони на столицата – кв. Редута. Имотът е с обща площ от 53.70...",335328.0,EUR,False,продава,тристаен,София, Редута,,Luximmo Finest Estates,,https://www.imoti.net/bg/obiava/prodava--v-stroej/sofia/reduta/tristaen/6070498/?sid=gFM8jD&page=8,4.0,2025-07-21 06:03:39.755315,https://www.imoti.net/bg/obiavi/r/prodava/sofia/?page=1&sid=gFM8jD,imoti.net,397,2025-07-21,,,Цена на /м2/:2 412EUR, 139 м2,Етаж:  от 6
"продава Тристаен апартамент, 139 м2",​​​​​​Апартамент 14 е със следното разпределение:входно антре(6.99 кв.м.)баня с тоалетна (2.88 кв.м.)баня с тоалетна (2.20 кв.м.)...,336000.0,EUR,False,продава,тристаен,София, Редута,,Имотека,,https://www.imoti.net/bg/obiava/prodava/sofia/reduta/tristaen/6094080/?sid=gFM8jD&page=8,1.0,2025-07-21 06:03:39.755769,https://www.imoti.net/bg/obiavi/r/prodava/sofia/?page=1&sid=gFM8jD,imoti.net,397,2025-07-21,,,Цена на /м2/:2 417EUR, 139 м2,Етаж: 6 от 7
"продава Многостаен апартамент, 145 м2","ПРОСТОРЕН!!! ИМОТ С ПОТЕНЦИАЛ !!! В ТИХАТА ЧАСТ НА КВ.ИЗТОК!!! Явлена представя на Вашето внимание многостаен апартамент находящ се в един от най-предпочитаните квартали в столицата, а именно...",349000.0,EUR,False,продава,многостаен,София, Изток,,Явлена София,,https://www.imoti.net/bg/obiava/prodava/sofia/sofija-iztok/mnogostaen/6002209/?sid=gFM8jD&page=8,10.0,2025-07-21 06:03:39.756242,https://www.imoti.net/bg/obiavi/r/prodava/sofia/?page=1&sid=gFM8jD,imoti.net,397,2025-07-21,,,Цена на /м2/:2 407EUR, 145 м2,Етаж: 2 от 6
"продава Тристаен апартамент, 95 м2",Адрес Недвижими имоти продава ексклузивно обзаведен тристаен апартамент на хубаво и тихо място на границата на Дианабад и Изгрев.Разположен на четвърти жилищен етаж в пететажна тухлена...,349900.0,EUR,False,продава,тристаен,София, Изгрев,,АДРЕС Недвижими имоти АД,,https://www.imoti.net/bg/obiava/prodava/sofia/sofija-izgrev/tristaen/6089047/?sid=gFM8jD&page=8,16.0,2025-07-21 06:03:39.756676,https://www.imoti.net/bg/obiavi/r/prodava/sofia/?page=1&sid=gFM8jD,imoti.net,397,2025-07-21,,,Цена на /м2/:3 683EUR, 95 м2,Етаж:  от 5
"продава Четиристаен апартамент, 114 м2","Представяме на Вашето внимание четиристаен апартамент за продажба в бутикова жилищна сграда в престижния столичен квартал “Оборище”.Разположен в живописното спокойствие на уединена улица,...",350000.0,EUR,False,продава,четиристаен,София, Оборище,,SUPRIMMO,,https://www.imoti.net/bg/obiava/prodava--v-stroej/sofia/oborishte/chetiristaen/5897035/?sid=gFM8jD&page=8,5.0,2025-07-21 06:03:39.757098,https://www.imoti.net/bg/obiavi/r/prodava/sofia/?page=1&sid=gFM8jD,imoti.net,397,2025-07-21,,,Цена на /м2/:3 070EUR, 114 м2,Етаж:  от 6
"продава Тристаен апартамент, 127 м2",***СГРАДА НАЙ-ВИСОК КЛАС. ***ВИСОЧИНА НА ПОМЕЩЕНИЯТА 340см. ***СТАРТ НА ИЗКОПНИТЕ ДЕЙНОСТИ. ***ПАРКОВА СРЕДА И ТОП ЛОКАЦИЯ.***Цени без ДДС!,351425.0,EUR,False,продава,тристаен,София, Оборище,,Имотека,,https://www.imoti.net/bg/obiava/prodava/sofia/oborishte/tristaen/6094414/?sid=gFM8jD&page=8,3.0,2025-07-21 06:03:39.757543,https://www.imoti.net/bg/obiavi/r/prodava/sofia/?page=1&sid=gFM8jD,imoti.net,397,2025-07-21,,,Цена на /м2/:2 767EUR, 127 м2,Етаж: 6 от 7
"продава Тристаен апартамент, 141 м2","Unique Estates представя на Вашето внимание един просторен тристаен апартамент с площ от 141кв.м., в новострояща се сграда в близост до ул. Черковна.",352000.0,EUR,False,продава,тристаен,София, Оборище,,ЮНИК ЕСТЕЙТС,,https://www.imoti.net/bg/obiava/prodava--v-stroej/sofia/oborishte/tristaen/6037233/?sid=gFM8jD&page=8,5.0,2025-07-21 06:03:39.757972,https://www.imoti.net/bg/obiavi/r/prodava/sofia/?page=1&sid=gFM8jD,imoti.net,397,2025-07-21,,,Цена на /м2/:2 496EUR, 141 м2,Етаж: 4 от 7
"продава Тристаен апартамент, 116 м2","ЕРА Идеа предлага в продажба тристаен апартамент - ново строителство в кв. Редута! Жилището се намира на 5ти етаж в бутикова жилищна сграда, която се строи в най - хубавата част на квартала! В...",352700.0,EUR,False,продава,тристаен,София, Редута,,Ера Идеа,,https://www.imoti.net/bg/obiava/prodava--v-stroej/sofia/reduta/tristaen/6054933/?sid=gFM8jD&page=8,3.0,2025-07-21 06:03:39.758397,https://www.imoti.net/bg/obiavi/r/prodava/sofia/?page=1&sid=gFM8jD,imoti.net,397,2025-07-21,,,Цена на /м2/:3 041EUR, 116 м2,Етаж: 5 от 6
"продава Тристаен апартамент, 136 м2","Galiano Estates Ви предлага тристаен апартамент в сграда с AKT16, която се намира в кв. Дианабад,Разпределението на помещенията е както следва: входно антре, всекидневна с трапезария и...",354000.0,EUR,False,продава,тристаен,София, Дианабад,,Galiano Estates,,https://www.imoti.net/bg/obiava/prodava/sofia/dianabad/tristaen/5955338/?sid=gFM8jD&page=8,3.0,2025-07-21 06:03:39.758882,https://www.imoti.net/bg/obiavi/r/prodava/sofia/?page=1&sid=gFM8jD,imoti.net,397,2025-07-21,,,Цена на /м2/:2 603EUR, 136 м2,Етаж: 2 от 9
"продава Тристаен апартамент, 100 м2","ЧАЛАШКАНОВ ЕСТЕЙТС продава обзаведен тристаен апартамент със следното разпределение: голям коридор, хол с преходна спалня, самостоятелна спалня, кухня, санит.помещения.Апартаментът е...",354998.0,EUR,False,продава,тристаен,София, Изток,,ЧАЛАШКАНОВ ЕСТЕЙТС,,https://www.imoti.net/bg/obiava/prodava/sofia/sofija-iztok/tristaen/6096386/?sid=gFM8jD&page=8,7.0,2025-07-21 06:03:39.759308,https://www.imoti.net/bg/obiavi/r/prodava/sofia/?page=1&sid=gFM8jD,imoti.net,397,2025-07-21,,,Цена на /м2/:3 550EUR, 100 м2,Етаж: 1 от 5
"продава Тристаен апартамент, 100 м2","Собственик продава личен тристаен, преходен апартамент в най-спокойните и предпочитане за живеене в София квартал Изток. В близост до Билла / Цариградско Шосе висок партер (над мазета), на 200м от...",355000.0,EUR,False,продава,тристаен,София, Изток,,частно лице,,https://www.imoti.net/bg/obiava/prodava/sofia/sofija-iztok/tristaen/6087764/?sid=gFM8jD&page=8,11.0,2025-07-21 06:03:39.759739,https://www.imoti.net/bg/obiavi/r/prodava/sofia/?page=1&sid=gFM8jD,imoti.net,397,2025-07-21,,,Цена на /м2/:3 550EUR, 100 м2,Етаж: 1 от 5
"продава Четиристаен апартамент, 124 м2","ARCO REAL ESTATE представя нов проект в кв. Редута, с отличаващ се дизайн и висок клас на изпълнение. Сградата е девететажна, с озеленен двор и обособени места за паркиране.Апартамент № 22 е...",355939.0,EUR,False,продава,четиристаен,София, Редута,,ARCO REAL ESTATE,,https://www.imoti.net/bg/obiava/prodava/sofia/reduta/chetiristaen/6096857/?sid=gFM8jD&page=8,2.0,2025-07-21 06:03:39.760220,https://www.imoti.net/bg/obiavi/r/prodava/sofia/?page=1&sid=gFM8jD,imoti.net,397,2025-07-21,,,Цена на /м2/:2 870EUR, 124 м2,Етаж: 6 от 9
"продава Тристаен апартамент, 135 м2","Представяме на Вашето внимание тристаен апартамент в сграда въведена в експлоатация 2010 година.Апартаментът е със следното разпределение: входно антре,просторна всекидневна с кухненски бокс,две...",360000.0,EUR,False,продава,тристаен,София, Оборище,,Имотен център България 2021,,https://www.imoti.net/bg/obiava/prodava/sofia/oborishte/tristaen/6088541/?sid=gFM8jD&page=8,17.0,2025-07-21 06:03:39.760710,https://www.imoti.net/bg/obiavi/r/prodava/sofia/?page=1&sid=gFM8jD,imoti.net,397,2025-07-21,,,Цена на /м2/:2 667EUR, 135 м2,Етаж: 3 от 7
