raw_title,raw_description,price,currency,without_dds,offer_type,property_type,city,neighborhood,contact_info,agency,agency_url,details_url,num_photos,date_time_added,search_url,site,total_offers,date,ref_no,time,price_per_m2,area,floor
"продава Тристаен апартамент, 148 м2","ИРИДА НЕДВИЖИМИ ИМОТИ продава слънчев тристаен апартамент в новоизграждащ се затворен жилищен комплекс, с изключително висококачествено строителство от доказан инвеститор на комуникативно място в...",485900.0,EUR,False,продава,тристаен,София, Оборище,,ИРИДА НЕДВИЖИМИ ИМОТИ,,https://www.imoti.net/bg/obiava/prodava--v-stroej/sofia/oborishte/tristaen/6040119/?sid=gFM8jD&page=10,7.0,2025-07-21 06:03:47.444641,https://www.imoti.net/bg/obiavi/r/prodava/sofia/?page=1&sid=gFM8jD,imoti.net,397,2025-07-21,,,Цена на /м2/:3 283EUR, 148 м2,Етаж: 7 от 14
"продава Тристаен апартамент, 148 м2","ИРИДА НЕДВИЖИМИ ИМОТИ продава слънчев тристаен апартамент в новоизграждащ се затворен жилищен комплекс, с изключително висококачествено строителство от доказан инвеститор на комуникативно място в...",485900.0,EUR,False,продава,тристаен,София, Оборище,,ИРИДА НЕДВИЖИМИ ИМОТИ,,https://www.imoti.net/bg/obiava/prodava--v-stroej/sofia/oborishte/tristaen/5909424/?sid=gFM8jD&page=10,1.0,2025-07-21 06:03:47.445115,https://www.imoti.net/bg/obiavi/r/prodava/sofia/?page=1&sid=gFM8jD,imoti.net,397,2025-07-21,,,Цена на /м2/:3 283EUR, 148 м2,Етаж: 7 от 14
"продава Тристаен апартамент, 147 м2","ИРИДА НЕДВИЖИМИ ИМОТИ продава слънчев тристаен апартамент в новоизграждащ се затворен жилищен комплекс, с изключително висококачествено строителство от доказан инвеститор на комуникативно място, в...",487500.0,EUR,False,продава,тристаен,София, Оборище,,ИРИДА НЕДВИЖИМИ ИМОТИ,,https://www.imoti.net/bg/obiava/prodava--v-stroej/sofia/oborishte/tristaen/6045931/?sid=gFM8jD&page=10,5.0,2025-07-21 06:03:47.445594,https://www.imoti.net/bg/obiavi/r/prodava/sofia/?page=1&sid=gFM8jD,imoti.net,397,2025-07-21,,,Цена на /м2/:3 316EUR, 147 м2,Етаж: 9 от 14
"продава Тристаен апартамент, 129 м2","First Estates има огромното удоволствие да Ви представи най-новия луксозен жилищен комплекс, сгушен до парка Заимов в сърцето на града. Този изключителен проект предефинира градския живот, като...",493500.0,EUR,False,продава,тристаен,София, Оборище,,First Estates,,https://www.imoti.net/bg/obiava/prodava/sofia/oborishte/tristaen/5808436/?sid=gFM8jD&page=11,15.0,2025-07-21 06:03:51.470375,https://www.imoti.net/bg/obiavi/r/prodava/sofia/?page=1&sid=gFM8jD,imoti.net,397,2025-07-21,,,Цена на /м2/:3 826EUR, 129 м2,Етаж: 8 от 14
"продава Многостаен апартамент, 209 м2","Просторен многостаен апартамент в престижен район на София.Предлагаме Ви мезонет на две нива с застроена площ от 209 кв.м.  и отеделен вход,  Ползван като офис, по...",494800.0,EUR,False,продава,многостаен,София, Изток,,Имотека,,https://www.imoti.net/bg/obiava/prodava/sofia/sofija-iztok/mnogostaen/6088808/?sid=gFM8jD&page=11,18.0,2025-07-21 06:03:51.470880,https://www.imoti.net/bg/obiavi/r/prodava/sofia/?page=1&sid=gFM8jD,imoti.net,397,2025-07-21,,,Цена на /м2/:2 367EUR, 209 м2,Етаж: 1 от 6
"продава Четиристаен апартамент, 227 м2","ARCO REAL ESTATE предлага четиристаен апартамент със застроена площ 217 кв.м., южно изложение, в луксозна жилищна сграда на десет етажа в кв. Сухата река, на пет минути пешеходно разстояние от...",499000.0,EUR,False,продава,четиристаен,София, Суха Река,,ARCO REAL ESTATE,,https://www.imoti.net/bg/obiava/prodava/sofia/suha-reka/chetiristaen/6096965/?sid=gFM8jD&page=11,1.0,2025-07-21 06:03:51.471359,https://www.imoti.net/bg/obiavi/r/prodava/sofia/?page=1&sid=gFM8jD,imoti.net,397,2025-07-21,,,Цена на /м2/:2 198EUR, 227 м2,Етаж: 4 от 10
"продава Тристаен апартамент, 200 м2","Тристайният апартамент, който представяме за продажба е част от нова бурикова сграда в кв.""Оборище"". Имотът е подходящ за лично позване или отадване под наем като жилище или офис пространство....",500000.0,EUR,False,продава,тристаен,София, Оборище,,SUPRIMMO,,https://www.imoti.net/bg/obiava/prodava--v-stroej/sofia/oborishte/tristaen/5868552/?sid=gFM8jD&page=11,7.0,2025-07-21 06:03:51.471797,https://www.imoti.net/bg/obiavi/r/prodava/sofia/?page=1&sid=gFM8jD,imoti.net,397,2025-07-21,,,Цена на /м2/:2 500EUR, 200 м2,Етаж:  от 5
"продава Тристаен апартамент, 142 м2","First Estates има огромното удоволствие да Ви представи най-новия луксозен жилищен комплекс, сгушен до парка Заимов в сърцето на града. Този изключителен проект предефинира градския живот, като...",509820.0,EUR,False,продава,тристаен,София, Оборище,,First Estates,,https://www.imoti.net/bg/obiava/prodava/sofia/oborishte/tristaen/5869794/?sid=gFM8jD&page=11,15.0,2025-07-21 06:03:51.472268,https://www.imoti.net/bg/obiavi/r/prodava/sofia/?page=1&sid=gFM8jD,imoti.net,397,2025-07-21,,,Цена на /м2/:3 590EUR, 142 м2,Етаж: 10 от 14
"продава Четиристаен апартамент, 155 м2","Без комисионна! Цена на инвеститор! Ера Младост представя сложен и взискателен жилищен комплекс с Централна локация продиктувана от няколко ключови изисквания за проекта:Градски силует,...",519850.0,EUR,False,продава,четиристаен,София, Оборище,,ERA Младост,,https://www.imoti.net/bg/obiava/prodava--v-stroej/sofia/oborishte/chetiristaen/6027247/?sid=gFM8jD&page=11,6.0,2025-07-21 06:03:51.472703,https://www.imoti.net/bg/obiavi/r/prodava/sofia/?page=1&sid=gFM8jD,imoti.net,397,2025-07-21,,,Цена на /м2/:3 354EUR, 155 м2,Етаж: 10 от 14
"продава Тристаен апартамент, 127 м2","Представяме луксозен тристаен апартамент в една от емблематичните сгради в столицата, на топ локация до метростанция ""Г.М. Димитров"". Близо до ключов голям булевард ""Г.М. Димитров"", в сърцето на...",520000.0,EUR,False,продава,тристаен,София, Дианабад,,Luximmo Finest Estates,,https://www.imoti.net/bg/obiava/prodava--v-stroej/sofia/dianabad/tristaen/6080716/?sid=gFM8jD&page=11,40.0,2025-07-21 06:03:51.473177,https://www.imoti.net/bg/obiavi/r/prodava/sofia/?page=1&sid=gFM8jD,imoti.net,397,2025-07-21,,,Цена на /м2/:4 094EUR, 127 м2,Етаж:  от 16
"продава Тристаен апартамент, 149 м2",Революшън Естейт има удоволствието да Ви представи просторен тристаен апартамент в ж.к. Изток.Основни характеристики на имота:- Площ: 149 кв.м.-...,530000.0,EUR,False,продава,тристаен,София, Изток,,Революшън Естейт България,,https://www.imoti.net/bg/obiava/prodava/sofia/sofija-iztok/tristaen/5986359/?sid=gFM8jD&page=11,11.0,2025-07-21 06:03:51.473622,https://www.imoti.net/bg/obiavi/r/prodava/sofia/?page=1&sid=gFM8jD,imoti.net,397,2025-07-21,,,Цена на /м2/:3 557EUR, 149 м2,Етаж: 3 от 4
"продава Четиристаен апартамент, 180 м2","БЕЗ КОМИСИОННА ОТ КУПУВАЧА! Galiano Estates има удоволствието да ви представи уникален четиристаен апартамент в затворен комплекс ""Teatralna Park Residence"" в кв. Оборище до парк ""Заимов"" и...",531700.0,EUR,False,продава,четиристаен,София, Оборище,,Galiano Estates,,https://www.imoti.net/bg/obiava/prodava/sofia/oborishte/chetiristaen/5852954/?sid=gFM8jD&page=11,6.0,2025-07-21 06:03:51.474097,https://www.imoti.net/bg/obiavi/r/prodava/sofia/?page=1&sid=gFM8jD,imoti.net,397,2025-07-21,,,Цена на /м2/:2 954EUR, 180 м2,Етаж: 3 от 14
"продава Четиристаен апартамент, 176 м2","ИРИДА НЕДВИЖИМИ ИМОТИ продава слънчев четиристаен апартамент в новоизграждащ се затворен жилищен комплекс, с изключително висококачествено строителство от доказан инвеститор на комуникативно място...",531700.0,EUR,False,продава,четиристаен,София, Оборище,,ИРИДА НЕДВИЖИМИ ИМОТИ,,https://www.imoti.net/bg/obiava/prodava--v-stroej/sofia/oborishte/chetiristaen/5909982/?sid=gFM8jD&page=11,1.0,2025-07-21 06:03:51.474580,https://www.imoti.net/bg/obiavi/r/prodava/sofia/?page=1&sid=gFM8jD,imoti.net,397,2025-07-21,,,Цена на /м2/:3 021EUR, 176 м2,Етаж: 3 от 14
"продава Четиристаен апартамент, 178 м2","ИРИДА НЕДВИЖИМИ ИМОТИ продава слънчев четиристаен апартамент в новоизграждащ се затворен жилищен комплекс, с изключително висококачествено строителство от доказан инвеститор на комуникативно място...",532800.0,EUR,False,продава,четиристаен,София, Оборище,,ИРИДА НЕДВИЖИМИ ИМОТИ,,https://www.imoti.net/bg/obiava/prodava--v-stroej/sofia/oborishte/chetiristaen/6045939/?sid=gFM8jD&page=11,4.0,2025-07-21 06:03:51.475050,https://www.imoti.net/bg/obiavi/r/prodava/sofia/?page=1&sid=gFM8jD,imoti.net,397,2025-07-21,,,Цена на /м2/:2 993EUR, 178 м2,Етаж: 7 от 14
"продава Двустаен апартамент, 96 м2","За повече информация свържете се с нас и цитирайте референтния номер на имота. Моля, кажете, че сте видeли обявата в imoti.net.Референтен номер: Sfa 87396Тел: 0882 817...",533005.0,EUR,False,продава,двустаен,София, Изток,,BULGARIAN PROPERTIES,,https://www.imoti.net/bg/obiava/prodava--v-stroej/sofia/sofija-iztok/dvustaen/6084973/?sid=gFM8jD&page=11,20.0,2025-07-21 06:03:51.475546,https://www.imoti.net/bg/obiavi/r/prodava/sofia/?page=1&sid=gFM8jD,imoti.net,397,2025-07-21,,,Цена на /м2/:5 552EUR, 96 м2,Етаж: 1 от 7
"продава Двустаен апартамент, 96 м2","ЕРА Младост има удоволтвието да предложи на Вашето внимание, апартаменти в нова малка сграда с модерна визия , разположена в един от най-желаните райони на столицата – в непосредствена близост до...",533005.0,EUR,False,продава,двустаен,София, Изток,,ERA Младост,,https://www.imoti.net/bg/obiava/prodava--v-stroej/sofia/sofija-iztok/dvustaen/6097780/?sid=gFM8jD&page=11,3.0,2025-07-21 06:03:51.475967,https://www.imoti.net/bg/obiavi/r/prodava/sofia/?page=1&sid=gFM8jD,imoti.net,397,2025-07-21,,,Цена на /м2/:5 552EUR, 96 м2,Етаж: 1 от 6
"продава Тристаен апартамент, 121 м2","Ексклузивно представяме една рядко срещана възможност за покупка на тристаен апартамент в престижния кв. ""Оборище"".Апартаментът се намира на топ локация на улица ""Буная"" №14, само на...",535000.0,EUR,False,продава,тристаен,София, Оборище,,Luximmo Finest Estates,,https://www.imoti.net/bg/obiava/prodava--v-stroej/sofia/oborishte/tristaen/6066001/?sid=gFM8jD&page=11,28.0,2025-07-21 06:03:51.476440,https://www.imoti.net/bg/obiavi/r/prodava/sofia/?page=1&sid=gFM8jD,imoti.net,397,2025-07-21,,,Цена на /м2/:4 421EUR, 121 м2,Етаж:  от 6
"продава Четиристаен апартамент, 183 м2","ИРИДА НЕДВИЖИМИ ИМОТИ продава слънчев четиристаен апартамент в новоизграждащ се затворен жилищен комплекс, с изключително висококачествено строителство от доказан инвеститор на комуникативно място...",539700.0,EUR,False,продава,четиристаен,София, Оборище,,ИРИДА НЕДВИЖИМИ ИМОТИ,,https://www.imoti.net/bg/obiava/prodava--v-stroej/sofia/oborishte/chetiristaen/6045938/?sid=gFM8jD&page=11,4.0,2025-07-21 06:03:51.476922,https://www.imoti.net/bg/obiavi/r/prodava/sofia/?page=1&sid=gFM8jD,imoti.net,397,2025-07-21,,,Цена на /м2/:2 949EUR, 183 м2,Етаж: 6 от 14
"продава Четиристаен апартамент, 191 м2","ИРИДА НЕДВИЖИМИ ИМОТИ продава слънчев четиристаен апартамент в новоизграждащ се затворен жилищен комплекс, с изключително висококачествено строителство от доказан инвеститор на комуникативно място...",544290.0,EUR,False,продава,четиристаен,София, Оборище,,ИРИДА НЕДВИЖИМИ ИМОТИ,,https://www.imoti.net/bg/obiava/prodava--v-stroej/sofia/oborishte/chetiristaen/6040116/?sid=gFM8jD&page=11,5.0,2025-07-21 06:03:51.477391,https://www.imoti.net/bg/obiavi/r/prodava/sofia/?page=1&sid=gFM8jD,imoti.net,397,2025-07-21,,,Цена на /м2/:2 850EUR, 191 м2,Етаж: 4 от 14
"продава Четиристаен апартамент, 190 м2","Представяме ви затворен комплекс в престижния квартал Оборище, на метри от парк ""Заимов"". Архитектурният проект предлага за продажба 277 двустайни, тристайни, четиристайни, многостайни апартаменти...",544290.0,EUR,False,продава,четиристаен,София, Оборище,,Luximmo Finest Estates,,https://www.imoti.net/bg/obiava/prodava--v-stroej/sofia/oborishte/chetiristaen/5719706/?sid=gFM8jD&page=11,14.0,2025-07-21 06:03:51.477883,https://www.imoti.net/bg/obiavi/r/prodava/sofia/?page=1&sid=gFM8jD,imoti.net,397,2025-07-21,,,Цена на /м2/:2 865EUR, 190 м2,Етаж:  от 14
"продава Тристаен апартамент, 131 м2","Вдъхновяващият тристаен апартамент в престижната сграда ""Диамант"" на Артекс представлява уникална комбинация от изисканост, модерен дизайн и лукс. С впечатляващ изглед от високият етаж, този дом...",548000.0,EUR,False,продава,тристаен,София, Изгрев,,Явлена София,,https://www.imoti.net/bg/obiava/prodava/sofia/sofija-izgrev/tristaen/6050563/?sid=gFM8jD&page=11,13.0,2025-07-21 06:03:51.478357,https://www.imoti.net/bg/obiavi/r/prodava/sofia/?page=1&sid=gFM8jD,imoti.net,397,2025-07-21,,,Цена на /м2/:4 183EUR, 131 м2,Етаж: 16 от 16
"продава Тристаен апартамент, 220 м2","ЕРА Фамилия има удоволствието да ви представи тристаен апартамент ( N  504 ), разположен на пети последен в нова  сграда с АКТ 16 . Сградата е на шест етажа с подземен гараж.За имота:...",550000.0,EUR,False,продава,тристаен,София, Дианабад,,ЕРА Фамилия,,https://www.imoti.net/bg/obiava/prodava/sofia/dianabad/tristaen/5944340/?sid=gFM8jD&page=11,10.0,2025-07-21 06:03:51.478794,https://www.imoti.net/bg/obiavi/r/prodava/sofia/?page=1&sid=gFM8jD,imoti.net,397,2025-07-21,,,Цена на /м2/:2 500EUR, 220 м2,Етаж: 5 от 5
"продава Тристаен апартамент, 211 м2","Galardo Real Estate ви представя прекрасен панорамен апартамент, разположен в нова сграда, с АКТ 16, в близост до от хотел Вега.Апартаментът е разположен на на 5-ти, последен етаж с...",550000.0,EUR,False,продава,тристаен,София, Дианабад,,Galardo Real Estate,,https://www.imoti.net/bg/obiava/prodava/sofia/dianabad/tristaen/6041667/?sid=gFM8jD&page=11,15.0,2025-07-21 06:03:51.479218,https://www.imoti.net/bg/obiavi/r/prodava/sofia/?page=1&sid=gFM8jD,imoti.net,397,2025-07-21,,,Цена на /м2/:2 607EUR, 211 м2,Етаж: 5 от 5
"продава Четиристаен апартамент, 155 м2","ИРИДА НЕДВИЖИМИ ИМОТИ продава слънчев четиристаен апартамент в новоизграждащ се затворен жилищен комплекс, с изключително висококачествено строителство от доказан инвеститор на комуникативно място...",557790.0,EUR,False,продава,четиристаен,София, Оборище,,ИРИДА НЕДВИЖИМИ ИМОТИ,,https://www.imoti.net/bg/obiava/prodava--v-stroej/sofia/oborishte/chetiristaen/6045313/?sid=gFM8jD&page=11,4.0,2025-07-21 06:03:51.479702,https://www.imoti.net/bg/obiavi/r/prodava/sofia/?page=1&sid=gFM8jD,imoti.net,397,2025-07-21,,,Цена на /м2/:3 599EUR, 155 м2,Етаж: 9 от 14
"продава Четиристаен апартамент, 155 м2","ИРИДА НЕДВИЖИМИ ИМОТИ продава слънчев четиристаен апартамент в новоизграждащ се затворен жилищен комплекс, с изключително висококачествено строителство от доказан инвеститор на комуникативно място...",557790.0,EUR,False,продава,четиристаен,София, Оборище,,ИРИДА НЕДВИЖИМИ ИМОТИ,,https://www.imoti.net/bg/obiava/prodava--v-stroej/sofia/oborishte/chetiristaen/6045941/?sid=gFM8jD&page=11,4.0,2025-07-21 06:03:51.480173,https://www.imoti.net/bg/obiavi/r/prodava/sofia/?page=1&sid=gFM8jD,imoti.net,397,2025-07-21,,,Цена на /м2/:3 599EUR, 155 м2,Етаж: 9 от 14
"продава Тристаен апартамент, 110 м2","ДОКТОРСКИ ПАМЕТНИК!!! ТОП ЛОКАЦИЯ!!! ПРОСТОРЕН!!!  ВЪЗМОЖНОСТ ЗА ПАРКИРАНЕ ВЪВ ВЪТРЕШЕН ДВОР!!! Явлена прадставя на Вашето внимание изключително ценен имот, находящ се на самия Докторски паметник!...",570000.0,EUR,False,продава,тристаен,София, Оборище,,Явлена София,,https://www.imoti.net/bg/obiava/prodava/sofia/oborishte/tristaen/6048692/?sid=gFM8jD&page=11,12.0,2025-07-21 06:03:51.480657,https://www.imoti.net/bg/obiavi/r/prodava/sofia/?page=1&sid=gFM8jD,imoti.net,397,2025-07-21,,,Цена на /м2/:5 182EUR, 110 м2,Етаж: 1 от 6
"продава Четиристаен апартамент, 186 м2","ИРИДА НЕДВИЖИМИ ИМОТИ продава слънчев четиристаен апартамент в новоизграждащ се затворен жилищен комплекс, с изключително висококачествено строителство от доказан инвеститор на комуникативно място...",576300.0,EUR,False,продава,четиристаен,София, Оборище,,ИРИДА НЕДВИЖИМИ ИМОТИ,,https://www.imoti.net/bg/obiava/prodava--v-stroej/sofia/oborishte/chetiristaen/6045314/?sid=gFM8jD&page=11,5.0,2025-07-21 06:03:51.481127,https://www.imoti.net/bg/obiavi/r/prodava/sofia/?page=1&sid=gFM8jD,imoti.net,397,2025-07-21,,,Цена на /м2/:3 098EUR, 186 м2,Етаж: 10 от 14
"продава Четиристаен апартамент, 194 м2","ИРИДА НЕДВИЖИМИ ИМОТИ продава слънчев четиристаен апартамент в новоизграждащ се затворен жилищен комплекс, с изключително висококачествено строителство от доказан инвеститор на комуникативно място...",576790.0,EUR,False,продава,четиристаен,София, Оборище,,ИРИДА НЕДВИЖИМИ ИМОТИ,,https://www.imoti.net/bg/obiava/prodava--v-stroej/sofia/oborishte/chetiristaen/6040115/?sid=gFM8jD&page=11,5.0,2025-07-21 06:03:51.481614,https://www.imoti.net/bg/obiavi/r/prodava/sofia/?page=1&sid=gFM8jD,imoti.net,397,2025-07-21,,,Цена на /м2/:2 973EUR, 194 м2,Етаж: 7 от 14
"продава Тристаен апартамент, 145 м2","Представяме Ви тристаен апартамент с включено паркомясто за продажба. Намира се в Театрална Парк Резиденс, затворен комплекс в престижния квартал Оборище, на метри от парк ""Заимов"".Имотът е...",585600.0,EUR,False,продава,тристаен,София, Оборище,,Luximmo Finest Estates,,https://www.imoti.net/bg/obiava/prodava--v-stroej/sofia/oborishte/tristaen/6089790/?sid=gFM8jD&page=11,19.0,2025-07-21 06:03:51.482092,https://www.imoti.net/bg/obiavi/r/prodava/sofia/?page=1&sid=gFM8jD,imoti.net,397,2025-07-21,,,Цена на /м2/:4 039EUR, 145 м2,Етаж:  от 14
"продава Тристаен апартамент, 97 м2","Galiano Estates има удоволствието да ви представи страхотен тристаен апартамент на ул. ""Оборище"".Разпределение: входен коридор, две помещения със свод помежду им, кухня, две спални, баня с...",589000.0,EUR,False,продава,тристаен,София, Оборище,,Galiano Estates,,https://www.imoti.net/bg/obiava/prodava/sofia/oborishte/tristaen/5997385/?sid=gFM8jD&page=11,6.0,2025-07-21 06:03:51.482575,https://www.imoti.net/bg/obiavi/r/prodava/sofia/?page=1&sid=gFM8jD,imoti.net,397,2025-07-21,,,Цена на /м2/:6 072EUR, 97 м2,Етаж: 1 от 4
"продава Тристаен апартамент, 173 м2",Външната фасада е изцяло окачена и облечена с естествен камък.Луксозните общи части и дизайнерския вход по неповторим начин допълват усещането за красота и комфорт. Фоайето е изпълнено от...,589119.0,EUR,False,продава,тристаен,София, Изгрев,,RE/MAX Alliance,,https://www.imoti.net/bg/obiava/prodava--v-stroej/sofia/sofija-izgrev/tristaen/6046589/?sid=gFM8jD&page=11,13.0,2025-07-21 06:03:51.483001,https://www.imoti.net/bg/obiavi/r/prodava/sofia/?page=1&sid=gFM8jD,imoti.net,397,2025-07-21,,,Цена на /м2/:3 405EUR, 173 м2,Етаж: 5 от 8
