raw_title,raw_description,price,currency,without_dds,offer_type,property_type,city,neighborhood,contact_info,agency,agency_url,details_url,num_photos,date_time_added,search_url,site,total_offers,date,ref_no,time,price_per_m2,area,floor
"продава Тристаен апартамент, 107 м2","ARCO REAL ESTATE представя нов проект в кв. Редута, с отличаващ се дизайн и висок клас на изпълнение. Сградата е девететажна, с озеленен двор и обособени места за паркиране.Апартамент № 14 е...",308563.0,BGN,False,продава,тристаен,София, Редута,,ARCO REAL ESTATE,,https://www.imoti.net/bg/obiava/prodava/sofia/reduta/tristaen/6096853/?sid=gFM8jD&page=7,2.0,2025-08-30 18:02:52.420046,https://www.imoti.net/bg/obiavi/r/prodava/sofia/?page=1&sid=gFM8jD,imoti.net,447,2025-08-30,,,Цена на /м2/:2 884EUR/5 640.16BGN, 107 м2,Етаж: 3 от 9
"продава Тристаен апартамент, 88 м2","Представяме просторен имот с потенциал, тристайно жилище за основен ремонт, в престижния столичен район ""Изток"".ЛокацияЛокацията на сградата е в непосредствена близост...",310000.0,BGN,False,продава,тристаен,София, Изток,,SUPRIMMO,,https://www.imoti.net/bg/obiava/prodava--v-stroej/sofia/sofija-iztok/tristaen/6060808/?sid=gFM8jD&page=7,13.0,2025-08-30 18:02:52.420501,https://www.imoti.net/bg/obiavi/r/prodava/sofia/?page=1&sid=gFM8jD,imoti.net,447,2025-08-30,,,Цена на /м2/:3 523EUR/6 889.86BGN, 88 м2,Етаж:  от 8
"продава Тристаен апартамент, 88 м2","Тристаен апартамент състоящ се от хол, кухня, коридор, две спални, баня, тоалетна, тераса и мазе. Жилището има външна изолация, ПВЦ дограма, външна ролетна щора на едната спалня. Жилището е...",310000.0,BGN,False,продава,тристаен,София, Изток,,АДРЕС Недвижими имоти АД,,https://www.imoti.net/bg/obiava/prodava/sofia/sofija-iztok/tristaen/6034982/?sid=gFM8jD&page=7,6.0,2025-08-30 18:02:52.420963,https://www.imoti.net/bg/obiavi/r/prodava/sofia/?page=1&sid=gFM8jD,imoti.net,447,2025-08-30,,,Цена на /м2/:3 523EUR/6 889.86BGN, 88 м2,Етаж: 4 от 7
"продава Четиристаен апартамент, 148 м2","Явлена Изток продава мезонет с 3 отделни спални от надежден инвеститор и строител с много добра репутация, доказал се с последните 30г. в които строи.Етап - пред разрешение за строеж....",310950.0,BGN,False,продава,четиристаен,София, Редута,,Явлена Изток,,https://www.imoti.net/bg/obiava/prodava/sofia/reduta/chetiristaen/6018676/?sid=gFM8jD&page=7,6.0,2025-08-30 18:02:52.421414,https://www.imoti.net/bg/obiavi/r/prodava/sofia/?page=1&sid=gFM8jD,imoti.net,447,2025-08-30,,,Цена на /м2/:2 101EUR/4 109.23BGN, 148 м2,Етаж: 6 от 6
"продава Тристаен апартамент, 141 м2",***СГРАДА НАЙ-ВИСОК КЛАС. ***ВИСОЧИНА НА ПОМЕЩЕНИЯТА 340см. ***СТАРТ НА ИЗКОПНИТЕ ДЕЙНОСТИ. ***ПАРКОВА СРЕДА И ТОП ЛОКАЦИЯ.***Цени без ДДС!,311077.0,BGN,False,продава,тристаен,София, Оборище,,Имотека,,https://www.imoti.net/bg/obiava/prodava/sofia/oborishte/tristaen/6113356/?sid=gFM8jD&page=7,2.0,2025-08-30 18:02:52.421867,https://www.imoti.net/bg/obiavi/r/prodava/sofia/?page=1&sid=gFM8jD,imoti.net,447,2025-08-30,,,Цена на /м2/:2 206EUR/4 314.99BGN, 141 м2,Етаж: 4 от 7
"продава Тристаен апартамент, 141 м2",***СГРАДА НАЙ-ВИСОК КЛАС. ***ВИСОЧИНА НА ПОМЕЩЕНИЯТА 340см. ***СТАРТ НА ИЗКОПНИТЕ ДЕЙНОСТИ. ***ПАРКОВА СРЕДА И ТОП ЛОКАЦИЯ.***Цени без ДДС!,311077.0,BGN,False,продава,тристаен,София, Оборище,,Имотека,,https://www.imoti.net/bg/obiava/prodava/sofia/oborishte/tristaen/6113357/?sid=gFM8jD&page=7,2.0,2025-08-30 18:02:52.422342,https://www.imoti.net/bg/obiavi/r/prodava/sofia/?page=1&sid=gFM8jD,imoti.net,447,2025-08-30,,,Цена на /м2/:2 206EUR/4 314.99BGN, 141 м2,Етаж: 2 от 7
"продава Тристаен апартамент, 141 м2","Unique Estates представя на Вашето внимание един просторен тристаен апартамент с площ от 141кв.м., в новострояща се сграда в близост до ул. Черковна.",312000.0,BGN,False,продава,тристаен,София, Оборище,,ЮНИК ЕСТЕЙТС,,https://www.imoti.net/bg/obiava/prodava--v-stroej/sofia/oborishte/tristaen/6037233/?sid=gFM8jD&page=7,5.0,2025-08-30 18:02:52.422795,https://www.imoti.net/bg/obiavi/r/prodava/sofia/?page=1&sid=gFM8jD,imoti.net,447,2025-08-30,,,Цена на /м2/:2 213EUR/4 327.79BGN, 141 м2,Етаж: 4 от 7
"продава Тристаен апартамент, 103 м2","Начален етап на строителство!!!ИРИДА НЕДВИЖИМИ ИМОТИ продава тристаен апартамент в новоизграждаща се сграда, с изключително висококачествено строителство от доказан инвеститор на...",313020.0,BGN,False,продава,тристаен,София, Дианабад,,ИРИДА НЕДВИЖИМИ ИМОТИ,,https://www.imoti.net/bg/obiava/prodava--v-stroej/sofia/dianabad/tristaen/6082476/?sid=gFM8jD&page=7,4.0,2025-08-30 18:02:52.423309,https://www.imoti.net/bg/obiavi/r/prodava/sofia/?page=1&sid=gFM8jD,imoti.net,447,2025-08-30,,,Цена на /м2/:3 039EUR/5 943.82BGN, 103 м2,Етаж: 3 от 7
"продава Тристаен апартамент, 97 м2","Агенция   Явлена  ,  продава   тристаен апартамент   на   границата   на   Дианабад   и   Студентски   град .  Имотът   е   в   близост   до  автобусни   спирки,  хранителни магазини  ,  детска...",314800.0,BGN,False,продава,тристаен,София, Дианабад,,Явлена Изток,,https://www.imoti.net/bg/obiava/prodava/sofia/dianabad/tristaen/6027882/?sid=gFM8jD&page=7,5.0,2025-08-30 18:02:52.423752,https://www.imoti.net/bg/obiavi/r/prodava/sofia/?page=1&sid=gFM8jD,imoti.net,447,2025-08-30,,,Цена на /м2/:3 245EUR/6 347.37BGN, 97 м2,Етаж: 5 от 6
"продава Четиристаен апартамент, 109 м2","ARCO REAL ESTATE представя нов проект в кв. Редута, с отличаващ се дизайн и висок клас на изпълнение. Сградата е девететажна, с озеленен двор и обособени места за паркиране.Апартамент № 11 е...",315014.0,BGN,False,продава,четиристаен,София, Редута,,ARCO REAL ESTATE,,https://www.imoti.net/bg/obiava/prodava/sofia/reduta/chetiristaen/6096856/?sid=gFM8jD&page=7,2.0,2025-08-30 18:02:52.424259,https://www.imoti.net/bg/obiavi/r/prodava/sofia/?page=1&sid=gFM8jD,imoti.net,447,2025-08-30,,,Цена на /м2/:2 890EUR/5 652.42BGN, 109 м2,Етаж: 3 от 9
"продава Многостаен апартамент, 139 м2","Просторен и функционален многостаен апартамент с площ от 139 кв.м, разположен в престижния квартал Витоша, в близост до кв. Дианабад. Жилището се намира в поддържана сграда с отлична локация,...",315500.0,BGN,False,продава,многостаен,София, Дианабад,,АДРЕС Недвижими имоти АД,,https://www.imoti.net/bg/obiava/prodava/sofia/dianabad/mnogostaen/6096689/?sid=gFM8jD&page=7,1.0,2025-08-30 18:02:52.424705,https://www.imoti.net/bg/obiavi/r/prodava/sofia/?page=1&sid=gFM8jD,imoti.net,447,2025-08-30,,,Цена на /м2/:2 270EUR/4 439.31BGN, 139 м2,Етаж: 1 от 8
"продава Тристаен апартамент, 113 м2",АКТ 14!!!НА 1 МИН. ОТ МЕТРОТО! НА 10 МИН. ОТ КУБЕТАТА НА ХРАМ ПАМЕТНИК АЛЕКСАНДЪР НЕВСКИ!Ексклузивно предложение!Това е една от най-красивите сгради в София....,316400.0,BGN,False,продава,тристаен,София, Суха Река,,Елеганс Естейт,,https://www.imoti.net/bg/obiava/prodava--v-stroej/sofia/suha-reka/tristaen/5971906/?sid=gFM8jD&page=7,6.0,2025-08-30 18:02:52.425172,https://www.imoti.net/bg/obiavi/r/prodava/sofia/?page=1&sid=gFM8jD,imoti.net,447,2025-08-30,,,Цена на /м2/:2 800EUR/5 476.32BGN, 113 м2,Етаж: 5 от 10
"продава Тристаен апартамент, 110 м2","ARCO REAL ESTATE представя нов проект в кв. Редута, с отличаващ се дизайн и висок клас на изпълнение. Сградата е девететажна, с озеленен двор и обособени места за паркиране.Апартамент № 20 е...",318240.0,BGN,False,продава,тристаен,София, Редута,,ARCO REAL ESTATE,,https://www.imoti.net/bg/obiava/prodava/sofia/reduta/tristaen/6096855/?sid=gFM8jD&page=7,2.0,2025-08-30 18:02:52.425672,https://www.imoti.net/bg/obiavi/r/prodava/sofia/?page=1&sid=gFM8jD,imoti.net,447,2025-08-30,,,Цена на /м2/:2 893EUR/5 658.39BGN, 110 м2,Етаж: 5 от 9
"продава Тристаен апартамент, 98 м2","Скала Ди предлага имот с уникална локация в престижния кв. Изток. Комуникативно място, на пешеходно разстояние от Метростанция и автобусна спирка, В близост до детска ясла и детска градина,...",319000.0,BGN,False,продава,тристаен,София, Изток,,Скала Ди недвижими имоти,,https://www.imoti.net/bg/obiava/prodava/sofia/sofija-iztok/tristaen/6079385/?sid=gFM8jD&page=7,10.0,2025-08-30 18:02:52.426178,https://www.imoti.net/bg/obiavi/r/prodava/sofia/?page=1&sid=gFM8jD,imoti.net,447,2025-08-30,,,Цена на /м2/:3 255EUR/6 366.43BGN, 98 м2,Етаж: 2 от 4
"продава Двустаен апартамент, 68 м2","Референтен номер: 2095368Революшън Естейт представя Двустаен в ж.к. Оборище.- Етаж: 5-ти от 9-ти.- Площ: 68.44 кв.м- Разпределение: входно антре,...",320000.0,BGN,False,продава,двустаен,София, Оборище,,Революшън Естейт България,,https://www.imoti.net/bg/obiava/prodava/sofia/oborishte/dvustaen/6106651/?sid=gFM8jD&page=7,7.0,2025-08-30 18:02:52.426635,https://www.imoti.net/bg/obiavi/r/prodava/sofia/?page=1&sid=gFM8jD,imoti.net,447,2025-08-30,,,Цена на /м2/:4 706EUR/9 203.91BGN, 68 м2,Етаж: 5 от 9
"продава Двустаен апартамент, 88 м2",.  .  .  .  .  .  .  .  .  .  .  .  .  .  .  .  .  .  .  .  .  .  .  .  .  .  .  .  .  . ПРЕУСТРОЕН .  .  .  .  .  .  .  .  .  .  .  .  .  .  .  .  .  .  .  .  .  .  .  .  .  .  .  .  .  .В...,320000.0,BGN,False,продава,двустаен,София, Изгрев,,АРСЕНАЛ - недвижими имоти,,https://www.imoti.net/bg/obiava/prodava/sofia/sofija-izgrev/dvustaen/5988906/?sid=gFM8jD&page=7,10.0,2025-08-30 18:02:52.427097,https://www.imoti.net/bg/obiavi/r/prodava/sofia/?page=1&sid=gFM8jD,imoti.net,447,2025-08-30,,,Цена на /м2/:3 636EUR/7 112.11BGN, 88 м2,Етаж: 2 от 17
"продава Двустаен апартамент, 68 м2","Открийте мястото, където ще се чувствате у дома от първия момент.Титан Пропъртис- офис Хиподрума с радост предлага на Вашето внимание тристаен апартамент в ж.к. Оборище, София,за...",320000.0,BGN,False,продава,двустаен,София, Оборище,,Титан Пропъртис София,,https://www.imoti.net/bg/obiava/prodava/sofia/oborishte/dvustaen/6113341/?sid=gFM8jD&page=8,7.0,2025-08-30 18:02:56.180794,https://www.imoti.net/bg/obiavi/r/prodava/sofia/?page=1&sid=gFM8jD,imoti.net,447,2025-08-30,,,Цена на /м2/:4 706EUR/9 203.91BGN, 68 м2,Етаж: 5 от 9
"продава Тристаен апартамент, 117 м2","Тристаен апартамент, в нов, модерен затворен комплекс в престижния квартал ""Оборище"", на метри от парк ""Заимов"".Имотът е разположен във вход ""Е"", на втори етаж и е с...",320000.0,BGN,False,продава,тристаен,София, Оборище,,АДРЕС Недвижими имоти АД,,https://www.imoti.net/bg/obiava/prodava/sofia/oborishte/tristaen/6083153/?sid=gFM8jD&page=8,4.0,2025-08-30 18:02:56.181299,https://www.imoti.net/bg/obiavi/r/prodava/sofia/?page=1&sid=gFM8jD,imoti.net,447,2025-08-30,,,Цена на /м2/:2 735EUR/5 349.28BGN, 117 м2,Етаж: 2 от 11
"продава Тристаен апартамент, 68 м2","Реф. № 012233Агенция за недвижими имоти BAS Properties предлага за продажба обзаведен апартамент в престижния кв. Оборище, в непосредствена близост до парк „Заимов“. Имотът се...",320000.0,BGN,False,продава,тристаен,София, Оборище,,БАС Пропъртис,,https://www.imoti.net/bg/obiava/prodava/sofia/oborishte/tristaen/6106734/?sid=gFM8jD&page=8,16.0,2025-08-30 18:02:56.181753,https://www.imoti.net/bg/obiavi/r/prodava/sofia/?page=1&sid=gFM8jD,imoti.net,447,2025-08-30,,,Цена на /м2/:4 706EUR/9 203.91BGN, 68 м2,Етаж: 5 от 9
"продава Двустаен апартамент, 69 м2",Компания `ЕКС` представя на Вашето внимание двустаен апартамент в кв. Оборище.МЕСТОПОЛОЖЕНИЕ: Намира се до парк Заимов.СТРОИТЕЛСТВО: Апартаментът е ситуиран на 5-ти...,320000.0,BGN,False,продава,двустаен,София, Оборище,,ЕКС НВД,,https://www.imoti.net/bg/obiava/prodava/sofia/oborishte/dvustaen/6114673/?sid=gFM8jD&page=8,11.0,2025-08-30 18:02:56.182214,https://www.imoti.net/bg/obiavi/r/prodava/sofia/?page=1&sid=gFM8jD,imoti.net,447,2025-08-30,,,Цена на /м2/:4 638EUR/9 070.52BGN, 69 м2,Етаж: 5 от 9
"продава Четиристаен апартамент, 115 м2",".  .  .  .  .  .  .  .  .  .  .  ЩЕ .  .  .  .  .  .  .  .  .  .  .  .  .  .  .  .  .  .  .  .  . Ви предложим 'многофункционален' имот, ПОДХОДЯЩ както за жилище, така и за офис. Апартаментът се...",320000.0,BGN,False,продава,четиристаен,София, Изток,,АРСЕНАЛ - недвижими имоти,,https://www.imoti.net/bg/obiava/prodava/sofia/sofija-iztok/chetiristaen/5608324/?sid=gFM8jD&page=8,10.0,2025-08-30 18:02:56.182652,https://www.imoti.net/bg/obiavi/r/prodava/sofia/?page=1&sid=gFM8jD,imoti.net,447,2025-08-30,,,Цена на /м2/:2 783EUR/5 442.31BGN, 115 м2,Етаж: 2 от 9
"продава Двустаен апартамент, 75 м2","АРТЕМИС ЕСТЕЙТ ви представя двустаен апартамент в кв. Оборище.Имотът разполага с площ от 75 кв.м / коридор, всекидневна с кухненски бокс, спалня, баня с тоалетна и тераса. Намира се...",320000.0,BGN,False,продава,двустаен,София, Оборище,,Артемис Естейт,,https://www.imoti.net/bg/obiava/prodava/sofia/oborishte/dvustaen/6110390/?sid=gFM8jD&page=8,11.0,2025-08-30 18:02:56.183110,https://www.imoti.net/bg/obiavi/r/prodava/sofia/?page=1&sid=gFM8jD,imoti.net,447,2025-08-30,,,Цена на /м2/:4 267EUR/8 344.87BGN, 75 м2,Етаж: 5 от 9
"продава Тристаен апартамент, 144 м2","Unique Estates представя на Вашето внимание един просторен тристаен апартамент с площ от 144кв.м., в новострояща се сграда в близост до ул. Черковна.",320000.0,BGN,False,продава,тристаен,София, Оборище,,ЮНИК ЕСТЕЙТС,,https://www.imoti.net/bg/obiava/prodava--v-stroej/sofia/oborishte/tristaen/6037232/?sid=gFM8jD&page=8,4.0,2025-08-30 18:02:56.183557,https://www.imoti.net/bg/obiavi/r/prodava/sofia/?page=1&sid=gFM8jD,imoti.net,447,2025-08-30,,,Цена на /м2/:2 222EUR/4 346.29BGN, 144 м2,Етаж: 2 от 6
"продава Тристаен апартамент, 146 м2","ARCO REAL ESTATE предлага тристаен апартамент със застроена площ 127 кв.м., южно изложенив, в луксозна жилищна сграда на десет етажа в кв. Сухата река, на пет минути пешеходно разстояние от...",321900.0,BGN,False,продава,тристаен,София, Суха Река,,ARCO REAL ESTATE,,https://www.imoti.net/bg/obiava/prodava/sofia/suha-reka/tristaen/5971430/?sid=gFM8jD&page=8,5.0,2025-08-30 18:02:56.184058,https://www.imoti.net/bg/obiavi/r/prodava/sofia/?page=1&sid=gFM8jD,imoti.net,447,2025-08-30,,,Цена на /м2/:2 205EUR/4 312.20BGN, 146 м2,Етаж: 3 от 10
"продава Двустаен апартамент, 75 м2","ХОУМ ЛАЙТ Ви предлага уютен, двустаен апартамент на перфектна локация в кв. Изток!Жилището се намира на девети етаж в тухлена сграда, разположена в непосредствена близост до парк...",325000.0,BGN,False,продава,двустаен,София, Изток,,ХОУМЛАЙТ,,https://www.imoti.net/bg/obiava/prodava/sofia/sofija-iztok/dvustaen/6023443/?sid=gFM8jD&page=8,11.0,2025-08-30 18:02:56.184558,https://www.imoti.net/bg/obiavi/r/prodava/sofia/?page=1&sid=gFM8jD,imoti.net,447,2025-08-30,,,Цена на /м2/:4 333EUR/8 475.26BGN, 75 м2,Етаж: 9 от 10
"продава Тристаен апартамент, 108 м2","Mirador Real Estates има удоволствието да Ви представи разкошен тристаен апартамент,срещу Мол Сердика, на втора линия от булевард Ситняково .Намира се на тиха вътрешна уличка със...",325000.0,BGN,False,продава,тристаен,София, Редута,,МИРАДОР НЕДВИЖИМИ ИМОТИ,,https://www.imoti.net/bg/obiava/prodava/sofia/reduta/tristaen/6102303/?sid=gFM8jD&page=8,7.0,2025-08-30 18:02:56.185023,https://www.imoti.net/bg/obiavi/r/prodava/sofia/?page=1&sid=gFM8jD,imoti.net,447,2025-08-30,,,Цена на /м2/:3 009EUR/5 885.60BGN, 108 м2,Етаж: 3 от 4
"продава Тристаен апартамент, 108 м2",Имоти ПРЕМИЕР представя на Вашето внимание тристаен апартамент в кв. Редута !Жилището е ситуирано на трети етаж в тухлена сграда без асансьор. Изложение Изток/Запад/Север. Обща площ...,325000.0,BGN,False,продава,тристаен,София, Редута,,Имоти Премиер,,https://www.imoti.net/bg/obiava/prodava/sofia/reduta/tristaen/6089525/?sid=gFM8jD&page=8,10.0,2025-08-30 18:02:56.185547,https://www.imoti.net/bg/obiavi/r/prodava/sofia/?page=1&sid=gFM8jD,imoti.net,447,2025-08-30,,,Цена на /м2/:3 009EUR/5 885.60BGN, 108 м2,Етаж: 3 от 4
"продава Тристаен апартамент, 108 м2","Реф. № 012050Агенция за недвижими имоти BAS Properties предлага за продажба просторен тристаен апартамент в кв. Редута, гр. София – отлична локация срещу Мол Сердика, на тиха...",325000.0,BGN,False,продава,тристаен,София, Редута,,БАС Пропъртис,,https://www.imoti.net/bg/obiava/prodava/sofia/reduta/tristaen/6115393/?sid=gFM8jD&page=8,10.0,2025-08-30 18:02:56.186011,https://www.imoti.net/bg/obiavi/r/prodava/sofia/?page=1&sid=gFM8jD,imoti.net,447,2025-08-30,,,Цена на /м2/:3 009EUR/5 885.60BGN, 108 м2,Етаж: 3 от 4
"продава Тристаен апартамент, 125 м2","Представяме тристаен апартамент в чисто нова бутикова сграда с отлична локация в кв. „Сухата река“. В непосредствена близост се намира метростанция „Хаджи Димитър“, а популярният парк „Заимов“,...",327132.0,BGN,False,продава,тристаен,София, Суха Река,,Luximmo Finest Estates,,https://www.imoti.net/bg/obiava/prodava--v-stroej/sofia/suha-reka/tristaen/5829598/?sid=gFM8jD&page=8,5.0,2025-08-30 18:02:56.186503,https://www.imoti.net/bg/obiavi/r/prodava/sofia/?page=1&sid=gFM8jD,imoti.net,447,2025-08-30,,,Цена на /м2/:2 617EUR/5 118.52BGN, 125 м2,Етаж:  от 10
"продава Тристаен апартамент, 81 м2","Реф. № 012053Агенция за недвижими имоти BAS Properties предлага за продажба тристаен апартамент, разположен в престижния кв. Оборище, гр. София. Имотът е обзаведен, вътрешен, с...",328000.0,BGN,False,продава,тристаен,София, Оборище,,БАС Пропъртис,,https://www.imoti.net/bg/obiava/prodava/sofia/oborishte/tristaen/6086676/?sid=gFM8jD&page=8,10.0,2025-08-30 18:02:56.186959,https://www.imoti.net/bg/obiavi/r/prodava/sofia/?page=1&sid=gFM8jD,imoti.net,447,2025-08-30,,,Цена на /м2/:4 049EUR/7 919.90BGN, 81 м2,Етаж: 2 от 4
"продава Двустаен апартамент, 81 м2",Имоти ПРЕМИЕР представя на Вашето внимание двустаен апартамент кв. Оборище!Жилището е ситуирано на втори етаж в тухлена сграда .Вътрешен апартамент с изложение Юг/Север. Обща площ от 81...,330000.0,BGN,False,продава,двустаен,София, Оборище,,Имоти Премиер,,https://www.imoti.net/bg/obiava/prodava/sofia/oborishte/dvustaen/5965598/?sid=gFM8jD&page=8,9.0,2025-08-30 18:02:56.187452,https://www.imoti.net/bg/obiavi/r/prodava/sofia/?page=1&sid=gFM8jD,imoti.net,447,2025-08-30,,,Цена на /м2/:4 074EUR/7 968.20BGN, 81 м2,Етаж: 2 от 4
"продава Тристаен апартамент, 119 м2","Явлена-Изток представя тристаен апартамент в квартал Редута, на комуникативно място и добра локация. ПРЕД АКТ 16!Апартамента е непреходен, със северозападно изложение, на партерен етаж с...",332000.0,BGN,False,продава,тристаен,София, Редута,,Явлена Изток,,https://www.imoti.net/bg/obiava/prodava/sofia/reduta/tristaen/6031547/?sid=gFM8jD&page=8,8.0,2025-08-30 18:02:56.187892,https://www.imoti.net/bg/obiavi/r/prodava/sofia/?page=1&sid=gFM8jD,imoti.net,447,2025-08-30,,,Цена на /м2/:2 790EUR/5 456.60BGN, 119 м2,Етаж: 0 от 8
"продава Тристаен апартамент, 111 м2","Имоти ПРЕМИЕР представя на Вашето внимание тристаен апартамент в р-н Оборище!﻿Жилището е ситуирано на етаж 4 от 6 в новострояща се бутикова, тухлена сграда. Изложение...",332130.0,BGN,False,продава,тристаен,София, Оборище,,Имоти Премиер,,https://www.imoti.net/bg/obiava/prodava/sofia/oborishte/tristaen/6064380/?sid=gFM8jD&page=8,9.0,2025-08-30 18:02:56.188400,https://www.imoti.net/bg/obiavi/r/prodava/sofia/?page=1&sid=gFM8jD,imoti.net,447,2025-08-30,,,Цена на /м2/:2 992EUR/5 852.16BGN, 111 м2,Етаж: 4 от 6
