raw_title,raw_description,price,currency,without_dds,offer_type,property_type,city,neighborhood,contact_info,agency,agency_url,details_url,num_photos,date_time_added,search_url,site,total_offers,date,ref_no,time,price_per_m2,area,floor
"продава Тристаен апартамент, 123 м2","Многостаен апартамент, състоящ се от дневна с кухненски бокс, две спални, две бани с тоалетна и тераса.",473000.0,EUR,False,продава,тристаен,София, Лозенец,,Имотека,,https://www.imoti.net/bg/obiava/prodava/sofia/lozenec/tristaen/6096183/?sid=iKI3oo&page=14,8.0,2025-07-21 18:04:51.694564,https://www.imoti.net/bg/obiavi/r/prodava/sofia/?page=1&sid=iKI3oo,imoti.net,542,2025-07-21,,,Цена на /м2/:3 846EUR, 123 м2,Етаж: 12 от 21
"продава Тристаен апартамент, 126 м2","Предлагаме за продажба просторен 3-стаен апартамент на две нива (мезонет) в престижния квартал ""Лозенец"". Апартаментът се намира в тухлена сграда с асансьор, в непосредствена близост до Южен парк и...",479000.0,EUR,False,продава,тристаен,София, Лозенец,,NEXT,,https://www.imoti.net/bg/obiava/prodava/sofia/lozenec/tristaen/6100761/?sid=iKI3oo&page=14,17.0,2025-07-21 18:04:51.694979,https://www.imoti.net/bg/obiavi/r/prodava/sofia/?page=1&sid=iKI3oo,imoti.net,542,2025-07-21,,,Цена на /м2/:3 802EUR, 126 м2,Етаж: 6 от 7
"продава Многостаен апартамент, 150 м2",Референтен номер: 2093853.Революшън Естейт Ви  представя многостаен апартамент в луксозна сграда с АКТ 16 на 2 минути пешеходно разтояние до Южен парк  в ж.к. Лозенец.,479668.0,EUR,False,продава,многостаен,София, Лозенец,,Революшън Естейт България,,https://www.imoti.net/bg/obiava/prodava/sofia/lozenec/mnogostaen/6098341/?sid=iKI3oo&page=14,16.0,2025-07-21 18:04:51.695418,https://www.imoti.net/bg/obiavi/r/prodava/sofia/?page=1&sid=iKI3oo,imoti.net,542,2025-07-21,,,Цена на /м2/:3 198EUR, 150 м2,Етаж: 7 от 7
"продава Тристаен апартамент, 120 м2",,480000.0,EUR,False,продава,тристаен,София, Лозенец,,Глобъл Сървисиз,,https://www.imoti.net/bg/obiava/prodava/sofia/lozenec/tristaen/6093121/?sid=iKI3oo&page=14,13.0,2025-07-21 18:04:51.695833,https://www.imoti.net/bg/obiavi/r/prodava/sofia/?page=1&sid=iKI3oo,imoti.net,542,2025-07-21,,,Цена на /м2/:4 000EUR, 120 м2,Етаж: 7 от 10
"продава Тристаен апартамент, 102 м2","ПРОСТОРЕН, ВЪТРЕШЕН, ТИХ ап. на ТОП място: на минути от входа на Южния парк, МОЛ Парк център, в близост до метростанция Европейски съюз, множество спирки на градския транспорт, пешеходно разстояние...",480000.0,EUR,False,продава,тристаен,София, Лозенец,,АЛДЕС ИМОТИ ЕООД,,https://www.imoti.net/bg/obiava/prodava/sofia/lozenec/tristaen/6082921/?sid=iKI3oo&page=14,19.0,2025-07-21 18:04:51.696247,https://www.imoti.net/bg/obiavi/r/prodava/sofia/?page=1&sid=iKI3oo,imoti.net,542,2025-07-21,,,Цена на /м2/:4 706EUR, 102 м2,Етаж: 7 от 9
"продава Тристаен апартамент, 110 м2","Представяме полуобзаведен тристаен апартамент в бутикова сграда в кв. ""Лозенец"". Локацията на имота е на тиха локация, на крачки от Южен парк и същевременно на метри от бул. ""Черни връх"" и от там...",480000.0,EUR,False,продава,тристаен,София, Лозенец,,Luximmo Finest Estates,,https://www.imoti.net/bg/obiava/prodava--v-stroej/sofia/lozenec/tristaen/6096309/?sid=iKI3oo&page=14,30.0,2025-07-21 18:04:51.696727,https://www.imoti.net/bg/obiavi/r/prodava/sofia/?page=1&sid=iKI3oo,imoti.net,542,2025-07-21,,,Цена на /м2/:4 364EUR, 110 м2,Етаж:  от 6
"продава Тристаен апартамент, 140 м2","БЕЗ КОМИСИОННА!БЕЗ ИНДЕКСАЦИЯ НА ЦЕНАТА!НАПРЕДВАЩО СТОИТЕЛСТВО!LUXIMMO представя луксозна сграда с отличителен дизайн, висок клас на изпълнение, комуникативна локация и...",480000.0,EUR,False,продава,тристаен,София, Стрелбище,,Luximmo Finest Estates,,https://www.imoti.net/bg/obiava/prodava--v-stroej/sofia/strelbishte/tristaen/5760746/?sid=iKI3oo&page=14,4.0,2025-07-21 18:04:51.697202,https://www.imoti.net/bg/obiavi/r/prodava/sofia/?page=1&sid=iKI3oo,imoti.net,542,2025-07-21,,,Цена на /м2/:3 429EUR, 140 м2,Етаж:  от 8
"продава Четиристаен апартамент, 175 м2","Galardo Real Estate предлага на Вашето внимание четиристаен и стилно обзаведен апартамент с три спални, разположен в престижна сграда, предлагащ невероятна гледка и комфорт.Апартаментът е...",484339.0,EUR,False,продава,четиристаен,София, Лозенец,,Galardo Real Estate,,https://www.imoti.net/bg/obiava/prodava/sofia/lozenec/chetiristaen/6084715/?sid=iKI3oo&page=14,28.0,2025-07-21 18:04:51.697662,https://www.imoti.net/bg/obiavi/r/prodava/sofia/?page=1&sid=iKI3oo,imoti.net,542,2025-07-21,,,Цена на /м2/:2 768EUR, 175 м2,Етаж: 6 от 6
"продава Четиристаен апартамент, 120 м2",4 ОТДЕЛНИ СТАИ! В БЛИЗОСТ ДО МЕТРОСТАНЦИЯ! ВЪЗМОЖНОСТ ЗА ПАРКИРАНЕ В ДВОРА НА СГРАДАТА! 10 КВ.М. ПАНОРАМНА ТЕРАСА!Имоти Премиер Ви представя изключителен...,486990.0,EUR,False,продава,четиристаен,София, Лозенец,,Имоти Премиер,,https://www.imoti.net/bg/obiava/prodava/sofia/lozenec/chetiristaen/6096625/?sid=iKI3oo&page=14,14.0,2025-07-21 18:04:51.698144,https://www.imoti.net/bg/obiavi/r/prodava/sofia/?page=1&sid=iKI3oo,imoti.net,542,2025-07-21,,,Цена на /м2/:4 058EUR, 120 м2,Етаж: 7 от 10
"продава Многостаен апартамент, 211 м2","Многостаен апартамент  в Бели брези, след ремонт и закупуване на нови ел. уреди и мебели, в кв. Бели брези с паркомясто във вътрешен двор с ограничен достъп включено в цената, с възможност за...",490000.0,EUR,False,продава,многостаен,София, Белите Брези,,АДРЕС Недвижими имоти АД,,https://www.imoti.net/bg/obiava/prodava/sofia/belite-brezi/mnogostaen/6079835/?sid=iKI3oo&page=14,37.0,2025-07-21 18:04:51.698575,https://www.imoti.net/bg/obiavi/r/prodava/sofia/?page=1&sid=iKI3oo,imoti.net,542,2025-07-21,,,Цена на /м2/:2 322EUR, 211 м2,Етаж: 5 от 6
"продава Тристаен апартамент, 98 м2","Unique Estates Ви предлага  тристаен апартамент в най-престижната част на кв. Лозенец на ул. Синчец, с площ от 90 кв.м. Жилището е напълно ремонтирано до ключ, с...",490000.0,EUR,False,продава,тристаен,София, Лозенец,,ЮНИК ЕСТЕЙТС,,https://www.imoti.net/bg/obiava/prodava/sofia/lozenec/tristaen/6028710/?sid=iKI3oo&page=14,8.0,2025-07-21 18:04:51.699000,https://www.imoti.net/bg/obiavi/r/prodava/sofia/?page=1&sid=iKI3oo,imoti.net,542,2025-07-21,,,Цена на /м2/:5 000EUR, 98 м2,Етаж: 2 от 3
"продава Четиристаен апартамент, 124 м2","БЕЗ КОМИСИОНА ОТ КУПУВАЧА! ЕРА Голд има удоволствието да Ви представи слънчев четиристаен апартамент със зелени гледки в кв. Лозенец. Сградата е разположена на тиха улица, с богато озеленена околна...",492210.0,EUR,False,продава,четиристаен,София, Лозенец,,ЕРА Голд,,https://www.imoti.net/bg/obiava/prodava--v-stroej/sofia/lozenec/chetiristaen/5966944/?sid=iKI3oo&page=14,6.0,2025-07-21 18:04:51.699435,https://www.imoti.net/bg/obiavi/r/prodava/sofia/?page=1&sid=iKI3oo,imoti.net,542,2025-07-21,,,Цена на /м2/:3 969EUR, 124 м2,Етаж: 2 от 5
"продава Многостаен апартамент, 210 м2","Вашият дом с история и бъдеще. Енергоефективност, независимост, иновативност и заслужен комфорт за всички собственици на комплекса. Многостаен апартамент състоящ се от: дневна с кухненски...",493839.0,EUR,False,продава,многостаен,София, Хладилника,,АДРЕС Недвижими имоти АД,,https://www.imoti.net/bg/obiava/prodava/sofia/hladilnika/mnogostaen/6035652/?sid=iKI3oo&page=14,11.0,2025-07-21 18:04:51.699867,https://www.imoti.net/bg/obiavi/r/prodava/sofia/?page=1&sid=iKI3oo,imoti.net,542,2025-07-21,,,Цена на /м2/:2 352EUR, 210 м2,Етаж: 2 от 15
"продава Многостаен апартамент, 210 м2","Вашият дом с история и бъдеще. Енергоефективност, независимост, иновативност и заслужен комфорт за всички собственици на комплекса. Многостаен апартамент състоящ се от: дневна с кухненски...",493839.0,EUR,False,продава,многостаен,София, Хладилника,,АДРЕС Недвижими имоти АД,,https://www.imoti.net/bg/obiava/prodava/sofia/hladilnika/mnogostaen/6035659/?sid=iKI3oo&page=14,11.0,2025-07-21 18:04:51.700282,https://www.imoti.net/bg/obiavi/r/prodava/sofia/?page=1&sid=iKI3oo,imoti.net,542,2025-07-21,,,Цена на /м2/:2 352EUR, 210 м2,Етаж: 2 от 15
"продава Тристаен апартамент, 140 м2","С АКТ 14!АКТ 15 МАЙ НА 2026г.!АКТ16 КРАЯ НА 2026!ИРИДА НЕДВИЖИМИ ИМОТИ продава панорамен слънчев тристаен апартамент в новоизграждаща се сграда, с изключително...",495000.0,EUR,False,продава,тристаен,София, Стрелбище,,ИРИДА НЕДВИЖИМИ ИМОТИ,,https://www.imoti.net/bg/obiava/prodava--v-stroej/sofia/strelbishte/tristaen/6038128/?sid=iKI3oo&page=14,3.0,2025-07-21 18:04:51.700781,https://www.imoti.net/bg/obiavi/r/prodava/sofia/?page=1&sid=iKI3oo,imoti.net,542,2025-07-21,,,Цена на /м2/:3 536EUR, 140 м2,Етаж: 6 от 9
"продава Четиристаен апартамент, 191 м2","Unique Estates представя изключителен пентхаус, разположен на две нива, с впечатляващи гледки към Южен парк и Витоша. Жилището се отличава с просторни и светли помещения, модерна...",498000.0,EUR,False,продава,четиристаен,София, Стрелбище,,ЮНИК ЕСТЕЙТС,,https://www.imoti.net/bg/obiava/prodava/sofia/strelbishte/chetiristaen/6073395/?sid=iKI3oo&page=14,7.0,2025-07-21 18:04:51.701219,https://www.imoti.net/bg/obiavi/r/prodava/sofia/?page=1&sid=iKI3oo,imoti.net,542,2025-07-21,,,Цена на /м2/:2 607EUR, 191 м2,Етаж: 6 от 6
"продава Тристаен апартамент, 102 м2","ЕРА Младост има удоволствието да ви представи ексклузивно тристаен апартамент в един от най-предпочитаните райони на София – кв. Лозенец, на бул. „Арсеналски“, в непосредствена близост до входа на...",498000.0,EUR,False,продава,тристаен,София, Лозенец,,ERA Младост,,https://www.imoti.net/bg/obiava/prodava/sofia/lozenec/tristaen/6049998/?sid=iKI3oo&page=14,7.0,2025-07-21 18:04:51.701657,https://www.imoti.net/bg/obiavi/r/prodava/sofia/?page=1&sid=iKI3oo,imoti.net,542,2025-07-21,,,Цена на /м2/:4 882EUR, 102 м2,Етаж: 5 от 8
"продава Тристаен апартамент, 180 м2","Предлагаме светъл и просторен апартамент в Лозенец – отлична локация!Представяме на Вашето внимание просторен и светъл апартамент, разположен в предпочитания квартал Лозенец, в...",499000.0,EUR,False,продава,тристаен,София, Лозенец,,Глобъл Сървисиз,,https://www.imoti.net/bg/obiava/prodava/sofia/lozenec/tristaen/6019397/?sid=iKI3oo&page=14,16.0,2025-07-21 18:04:51.702083,https://www.imoti.net/bg/obiavi/r/prodava/sofia/?page=1&sid=iKI3oo,imoti.net,542,2025-07-21,,,Цена на /м2/:2 772EUR, 180 м2,Етаж: 4 от 5
"продава Мезонет, 150 м2",". . . . . . . . . . . . . . . . . УНИКАЛЕН . . . . . . . . . . . . . . . . мезонет ситуиран в тухлена кооперация с ТЕЦ и АСАНСЬОР, разположен до ул. 'Трепетлика' и 'Водната кула'. Жилището е с...",500000.0,EUR,False,продава,мезонет,София, Лозенец,,АРСЕНАЛ - недвижими имоти,,https://www.imoti.net/bg/obiava/prodava/sofia/lozenec/mezonet/5727513/?sid=iKI3oo&page=15,1.0,2025-07-21 18:04:55.668046,https://www.imoti.net/bg/obiavi/r/prodava/sofia/?page=1&sid=iKI3oo,imoti.net,542,2025-07-21,,,Цена на /м2/:3 333EUR, 150 м2,Етаж: 6 от 7
"продава Тристаен апартамент, 145 м2","Революшън Естейт Ви представя красив тристаен апартамент с възможност за закупуване на ГАРАЖ в ж.к. Лозенец.Сградата се намира на чудесна локация - НА МЕТРИ до бул. Пейо К. Яворов,...",500000.0,EUR,False,продава,тристаен,София, Лозенец,,Революшън Естейт България,,https://www.imoti.net/bg/obiava/prodava/sofia/lozenec/tristaen/6033809/?sid=iKI3oo&page=15,17.0,2025-07-21 18:04:55.668544,https://www.imoti.net/bg/obiavi/r/prodava/sofia/?page=1&sid=iKI3oo,imoti.net,542,2025-07-21,,,Цена на /м2/:3 448EUR, 145 м2,Етаж: 1 от 7
"продава Многостаен апартамент, 168 м2","Жилището се състои от светла всекидневна с кухненски бокс, който осигурява удобство и практичност с гледка към парка на Семинарията. Разполага с три просторни спални, идеални за...",500000.0,EUR,False,продава,многостаен,София, Лозенец,,АДРЕС Недвижими имоти АД,,https://www.imoti.net/bg/obiava/prodava/sofia/lozenec/mnogostaen/6034895/?sid=iKI3oo&page=15,4.0,2025-07-21 18:04:55.668981,https://www.imoti.net/bg/obiavi/r/prodava/sofia/?page=1&sid=iKI3oo,imoti.net,542,2025-07-21,,,Цена на /м2/:2 976EUR, 168 м2,Етаж: 4 от 6
"продава Тристаен апартамент, 106 м2",ARCO REAL ESTATE предлага тристаен апартамент с площ 106 (89) кв.м. в малка бутикова сграда в кв. Лозенец в близост до Семинарията.Апартамента разполага с дневна с трапезария и кухненски...,508560.0,EUR,False,продава,тристаен,София, Лозенец,,ARCO REAL ESTATE,,https://www.imoti.net/bg/obiava/prodava/sofia/lozenec/tristaen/6090035/?sid=iKI3oo&page=15,1.0,2025-07-21 18:04:55.669471,https://www.imoti.net/bg/obiavi/r/prodava/sofia/?page=1&sid=iKI3oo,imoti.net,542,2025-07-21,,,Цена на /м2/:4 798EUR, 106 м2,Етаж: 2 от 5
"продава Многостаен апартамент, 204 м2","Слънчев многостаен апартамент с обща квадратура от 204 кв.м. Състои се от: входно предверие, складово помещение, три спални, голяма дневна с кухненски бокс и трапезария, две бани с тоалетни и...",511500.0,EUR,False,продава,многостаен,София, Хладилника,,АДРЕС Недвижими имоти АД,,https://www.imoti.net/bg/obiava/prodava/sofia/hladilnika/mnogostaen/6100093/?sid=iKI3oo&page=15,4.0,2025-07-21 18:04:55.669894,https://www.imoti.net/bg/obiavi/r/prodava/sofia/?page=1&sid=iKI3oo,imoti.net,542,2025-07-21,,,Цена на /м2/:2 507EUR, 204 м2,Етаж: 7 от 10
"продава Тристаен апартамент, 128 м2","Агенция Явлена продава: в гр. София, кв. Лозенец- тристаен апартамент в сграда с акт 16 от октомври 2024г. Специфика: емблематична сграда, висок клас строителство и довършителни работи, двоен...",512000.0,EUR,False,продава,тристаен,София, Лозенец,,Явлена Изток,,https://www.imoti.net/bg/obiava/prodava/sofia/lozenec/tristaen/5981441/?sid=iKI3oo&page=15,10.0,2025-07-21 18:04:55.670311,https://www.imoti.net/bg/obiavi/r/prodava/sofia/?page=1&sid=iKI3oo,imoti.net,542,2025-07-21,,,Цена на /м2/:4 000EUR, 128 м2,Етаж: 5 от 7
"продава Тристаен апартамент, 124 м2",Представяме напълно обзаведен апартамент за продажба в предпочитания затворен комплекс So Home Residential Park .SoHome Residential Park e отличен с престижната награда “Сграда на...,520000.0,EUR,False,продава,тристаен,София, Лозенец,,Luximmo Finest Estates,,https://www.imoti.net/bg/obiava/prodava--v-stroej/sofia/lozenec/tristaen/6063836/?sid=iKI3oo&page=15,22.0,2025-07-21 18:04:55.670793,https://www.imoti.net/bg/obiavi/r/prodava/sofia/?page=1&sid=iKI3oo,imoti.net,542,2025-07-21,,,Цена на /м2/:4 194EUR, 124 м2,Етаж:  от 5
"продава Тристаен апартамент, 108 м2","НЕПОВТОРИМ ИМОТ!СТИЛ И ЕЛЕГАНТНОСТ!ТОП ЛОКАЦИЯ!Красив и много светъл дизайнерски обзаведен апартамент, в една от най-желаните и престижни локации в София. Жилището...",524997.0,EUR,False,продава,тристаен,София, Иван Вазов,,Елеганс Естейт,,https://www.imoti.net/bg/obiava/prodava/sofia/ivan-vazov/tristaen/6100403/?sid=iKI3oo&page=15,5.0,2025-07-21 18:04:55.671251,https://www.imoti.net/bg/obiavi/r/prodava/sofia/?page=1&sid=iKI3oo,imoti.net,542,2025-07-21,,,Цена на /м2/:4 861EUR, 108 м2,Етаж: 3 от 6
"продава Тристаен апартамент, 154 м2","Тристаен тухлен апартамент със застроена площ от 103.40 кв.м. Състои се от: дневна с кухненски бокс от 24.34 кв.м., две спални по 16.30 кв.м. и 10.28 кв.м., две санитарни помещения, дрешник, мокро...",530138.0,EUR,False,продава,тристаен,София, Лозенец,,АДРЕС Недвижими имоти АД,,https://www.imoti.net/bg/obiava/prodava/sofia/lozenec/tristaen/5924904/?sid=iKI3oo&page=15,3.0,2025-07-21 18:04:55.671679,https://www.imoti.net/bg/obiavi/r/prodava/sofia/?page=1&sid=iKI3oo,imoti.net,542,2025-07-21,,,Цена на /м2/:3 442EUR, 154 м2,Етаж: 5 от 7
"продава Тристаен апартамент, 112 м2","New Estates представя изключителна бутикова сграда, вписваща се перфектно на тиха локация, само на няколко метра от Южен парк. Проектът включва 8 апартамента, внимателно разпределени на 5 етажа,...",530832.0,EUR,False,продава,тристаен,София, Лозенец,,New Estates,,https://www.imoti.net/bg/obiava/prodava--v-stroej/sofia/lozenec/tristaen/5845757/?sid=iKI3oo&page=15,15.0,2025-07-21 18:04:55.672097,https://www.imoti.net/bg/obiavi/r/prodava/sofia/?page=1&sid=iKI3oo,imoti.net,542,2025-07-21,,,Цена на /м2/:4 740EUR, 112 м2,Етаж: 1 от 5
"продава Четиристаен апартамент, 169 м2","Представяме просторен четиристаен апартамент за продажба в бутикова нова сграда, създадена с визия за устойчивост и комфорт.Планиран Акт 16 - декември 2026 г....",537179.0,EUR,False,продава,четиристаен,София, Лозенец,,Luximmo Finest Estates,,https://www.imoti.net/bg/obiava/prodava--v-stroej/sofia/lozenec/chetiristaen/6007620/?sid=iKI3oo&page=15,13.0,2025-07-21 18:04:55.672591,https://www.imoti.net/bg/obiavi/r/prodava/sofia/?page=1&sid=iKI3oo,imoti.net,542,2025-07-21,,,Цена на /м2/:3 179EUR, 169 м2,Етаж:  от 6
"продава Многостаен апартамент, 190 м2","Просторен апартамент на две нива с градина и атриум – ТОП локация в кв. Лозенец, ул. Голо Бърдо 8.Продава се уникален имот с площ от 190 кв.м., разположен на партерно и сутеренно...",543400.0,EUR,False,продава,многостаен,София, Лозенец,,МАРТИТРАНС,,https://www.imoti.net/bg/obiava/prodava--v-stroej/sofia/lozenec/mnogostaen/6098673/?sid=iKI3oo&page=15,1.0,2025-07-21 18:04:55.673014,https://www.imoti.net/bg/obiavi/r/prodava/sofia/?page=1&sid=iKI3oo,imoti.net,542,2025-07-21,,,Цена на /м2/:2 860EUR, 190 м2,Етаж: 0 от 2
"продава Тристаен апартамент, 138 м2",ОБЗАВЕДЕН!ЛУКСОЗНО ЗАВЪРШЕН АПАРТАМЕНТ! ЕМБЛЕМАТИЧНА СГРАДА! Великолепна сграда разположена в сърцето на един от най - престижните квартали в София    кв. Лозенец. Сградата е уникална както с...,552000.0,EUR,False,продава,тристаен,София, Лозенец,,Джей и Джей Корпорейшън,,https://www.imoti.net/bg/obiava/prodava/sofia/lozenec/tristaen/6099761/?sid=iKI3oo&page=15,17.0,2025-07-21 18:04:55.673439,https://www.imoti.net/bg/obiavi/r/prodava/sofia/?page=1&sid=iKI3oo,imoti.net,542,2025-07-21,,,Цена на /м2/:4 000EUR, 138 м2,Етаж: 3 от 8
"продава Тристаен апартамент, 139 м2","Galiano Estates ви представя елегантен апартамент в сградата е с впечатляваща визия и архитектура. Жилището в момента се обзавежда. Разполага с просторна дневна с кухненска зона, две спални, две...",552960.0,EUR,False,продава,тристаен,София, Лозенец,,Galiano Estates,,https://www.imoti.net/bg/obiava/prodava/sofia/lozenec/tristaen/5854343/?sid=iKI3oo&page=15,13.0,2025-07-21 18:04:55.673910,https://www.imoti.net/bg/obiavi/r/prodava/sofia/?page=1&sid=iKI3oo,imoti.net,542,2025-07-21,,,Цена на /м2/:3 978EUR, 139 м2,Етаж: 3 от 8
"продава Многостаен апартамент, 231 м2","Вашият дом с история и бъдеще. Енергоефективност, независимост, иновативност и заслужен комфорт за всички собственици на комплекса. Многостаен апартамент състоящ се от: дневна с кухненски...",555966.0,EUR,False,продава,многостаен,София, Хладилника,,АДРЕС Недвижими имоти АД,,https://www.imoti.net/bg/obiava/prodava/sofia/hladilnika/mnogostaen/6035647/?sid=iKI3oo&page=15,11.0,2025-07-21 18:04:55.674323,https://www.imoti.net/bg/obiavi/r/prodava/sofia/?page=1&sid=iKI3oo,imoti.net,542,2025-07-21,,,Цена на /м2/:2 407EUR, 231 м2,Етаж: 2 от 15
