raw_title,raw_description,price,currency,without_dds,offer_type,property_type,city,neighborhood,contact_info,agency,agency_url,details_url,num_photos,date_time_added,search_url,site,total_offers,date,ref_no,time,price_per_m2,area,floor
"продава Тристаен апартамент, 110 м2","Имоти ПРЕМИЕР представя на Вашето внимание тристаен апартамент в ж.к Лагера! УНИКАЛНА ГЛЕДКА КЪМ ВИТОША!Жилището е ситуирано на етаж 14 от 18 в сграда ЕПК .Обща площ от 110м2 , която...",249999.0,EUR,False,продава,тристаен,София, Лагера,,Имоти Премиер,,https://www.imoti.net/bg/obiava/prodava/sofia/lagera/tristaen/6049687/?sid=iKI3oo&page=5,10.0,2025-07-21 18:04:16.286386,https://www.imoti.net/bg/obiavi/r/prodava/sofia/?page=1&sid=iKI3oo,imoti.net,542,2025-07-21,,,Цена на /м2/:2 273EUR, 110 м2,Етаж: 14 от 18
"продава Двустаен апартамент, 73 м2",".  .  .  .  .  .  .  .  .  .  .  .  .  .  .  .  .  .  .  .  .  .  .  .  .  .  .  .  .  . ИЗКЛЮЧИТЕЛЕН .  .  .  .  .  .  .  .  .  .  .  .  .  .  .  .  .  .  .  .  .  .  .  .  .  .  .  .  .  .,",250000.0,EUR,False,продава,двустаен,София, Хиподрума,,АРСЕНАЛ - недвижими имоти,,https://www.imoti.net/bg/obiava/prodava/sofia/hipodruma/dvustaen/6041661/?sid=iKI3oo&page=5,1.0,2025-07-21 18:04:16.286819,https://www.imoti.net/bg/obiavi/r/prodava/sofia/?page=1&sid=iKI3oo,imoti.net,542,2025-07-21,,,Цена на /м2/:3 425EUR, 73 м2,Етаж: 2 от 7
"продава Двустаен апартамент, 68 м2","СВОБОДА, СТИЛ И ЛУКС!Функционален двустаен апартамент с отлично разпределение – перфектен избор както за лично ползване, така и за инвестиция. С квадратура от 67.25 кв.м / 58.48...",250000.0,EUR,False,продава,двустаен,София, Лозенец,,АДРЕС Недвижими имоти АД,,https://www.imoti.net/bg/obiava/prodava/sofia/lozenec/dvustaen/6063969/?sid=iKI3oo&page=5,7.0,2025-07-21 18:04:16.287239,https://www.imoti.net/bg/obiavi/r/prodava/sofia/?page=1&sid=iKI3oo,imoti.net,542,2025-07-21,,,Цена на /м2/:3 676EUR, 68 м2,Етаж: 4 от 21
"продава Двустаен апартамент, 77 м2",Имаме удоволствието да Ви представим двустаен апартамент с Акт 16 в емблематичният комплекс “SoHome Residential Park” отличен с първо място в конкурса „Сграда на годината“ за 2022 и 2024 година.,250000.0,EUR,False,продава,двустаен,София, Лозенец,,Luximmo Finest Estates,,https://www.imoti.net/bg/obiava/prodava--v-stroej/sofia/lozenec/dvustaen/6081739/?sid=iKI3oo&page=5,11.0,2025-07-21 18:04:16.287718,https://www.imoti.net/bg/obiavi/r/prodava/sofia/?page=1&sid=iKI3oo,imoti.net,542,2025-07-21,,,Цена на /м2/:3 247EUR, 77 м2,Етаж:  от 8
"продава Двустаен апартамент, 67 м2","Двустаен апартамент, състоящ се от дневна с кухненски бокс, спалня, баня с тоалетна и тераси.",251000.0,EUR,False,продава,двустаен,София, Лозенец,,Имотека,,https://www.imoti.net/bg/obiava/prodava/sofia/lozenec/dvustaen/6096189/?sid=iKI3oo&page=5,8.0,2025-07-21 18:04:16.288139,https://www.imoti.net/bg/obiavi/r/prodava/sofia/?page=1&sid=iKI3oo,imoti.net,542,2025-07-21,,,Цена на /м2/:3 746EUR, 67 м2,Етаж: 6 от 6
"продава Двустаен апартамент, 67 м2","Двустаен апартамент, състоящ се от дневна с кухненски бокс, спалня, баня с тоалетна и тераса.",251000.0,EUR,False,продава,двустаен,София, Лозенец,,Имотека,,https://www.imoti.net/bg/obiava/prodava/sofia/lozenec/dvustaen/6096191/?sid=iKI3oo&page=5,8.0,2025-07-21 18:04:16.288568,https://www.imoti.net/bg/obiavi/r/prodava/sofia/?page=1&sid=iKI3oo,imoti.net,542,2025-07-21,,,Цена на /м2/:3 746EUR, 67 м2,Етаж: 5 от 21
"продава Двустаен апартамент, 68 м2","СВОБОДА, СТИЛ И ЛУКС!Функционален двустаен апартамент с отлично разпределение – перфектен избор както за лично ползване, така и за инвестиция. С площ от 67.25 кв.м / 58.48 кв.м...",251000.0,EUR,False,продава,двустаен,София, Лозенец,,АДРЕС Недвижими имоти АД,,https://www.imoti.net/bg/obiava/prodava/sofia/lozenec/dvustaen/6063956/?sid=iKI3oo&page=5,7.0,2025-07-21 18:04:16.288990,https://www.imoti.net/bg/obiavi/r/prodava/sofia/?page=1&sid=iKI3oo,imoti.net,542,2025-07-21,,,Цена на /м2/:3 691EUR, 68 м2,Етаж: 5 от 21
"продава Двустаен апартамент, 86 м2","Вашият дом с история и бъдеще. Енергоефективност, независимост, иновативност и заслужен комфорт за всички собственици на комплекса. Двустаен апартамент състоящ се от: дневна с кухненски бокс,...",251187.0,EUR,False,продава,двустаен,София, Хладилника,,АДРЕС Недвижими имоти АД,,https://www.imoti.net/bg/obiava/prodava/sofia/hladilnika/dvustaen/6035572/?sid=iKI3oo&page=5,11.0,2025-07-21 18:04:16.289423,https://www.imoti.net/bg/obiavi/r/prodava/sofia/?page=1&sid=iKI3oo,imoti.net,542,2025-07-21,,,Цена на /м2/:2 921EUR, 86 м2,Етаж: 6 от 15
"продава Двустаен апартамент, 98 м2","Голям двустаен апартамент със застроена площ 75,74 кв.м. Разпределение: дневна с кухненски бокс 36,64 кв.м, спалня 12,96 кв.м, тераса 15 кв.м и баня с тоалетна. Възможност за закупуване...",252467.0,EUR,False,продава,двустаен,София, Стрелбище,,АДРЕС Недвижими имоти АД,,https://www.imoti.net/bg/obiava/prodava/sofia/strelbishte/dvustaen/5965688/?sid=iKI3oo&page=5,2.0,2025-07-21 18:04:16.289842,https://www.imoti.net/bg/obiavi/r/prodava/sofia/?page=1&sid=iKI3oo,imoti.net,542,2025-07-21,,,Цена на /м2/:2 576EUR, 98 м2,Етаж: 7 от 8
"продава Двустаен апартамент, 95 м2","Вашият дом с история и бъдеще. Енергоефективност, независимост, иновативност и заслужен комфорт за всички собственици на комплекса. Двустаен апартамент състоящ се от: дневна с кухненски бокс,...",252679.0,EUR,False,продава,двустаен,София, Хладилника,,АДРЕС Недвижими имоти АД,,https://www.imoti.net/bg/obiava/prodava/sofia/hladilnika/dvustaen/6035662/?sid=iKI3oo&page=5,11.0,2025-07-21 18:04:16.290253,https://www.imoti.net/bg/obiavi/r/prodava/sofia/?page=1&sid=iKI3oo,imoti.net,542,2025-07-21,,,Цена на /м2/:2 660EUR, 95 м2,Етаж: 5 от 15
"продава Двустаен апартамент, 95 м2","Вашият дом с история и бъдеще. Енергоефективност, независимост, иновативност и заслужен комфорт за всички собственици на комплекса. Двустаен апартамент състоящ се от: дневна с кухненски бокс,...",252679.0,EUR,False,продава,двустаен,София, Хладилника,,АДРЕС Недвижими имоти АД,,https://www.imoti.net/bg/obiava/prodava/sofia/hladilnika/dvustaen/6035424/?sid=iKI3oo&page=5,11.0,2025-07-21 18:04:16.290678,https://www.imoti.net/bg/obiavi/r/prodava/sofia/?page=1&sid=iKI3oo,imoti.net,542,2025-07-21,,,Цена на /м2/:2 660EUR, 95 м2,Етаж: 5 от 15
"продава Двустаен апартамент, 75 м2","Unique Estates представя прекрасен двустаен апартамент, намиращ в един от най-престижните улици в София- ул. ""Богатица"" в квартал ""Лозенец"".",254000.0,EUR,False,продава,двустаен,София, Лозенец,,ЮНИК ЕСТЕЙТС,,https://www.imoti.net/bg/obiava/prodava/sofia/lozenec/dvustaen/6048780/?sid=iKI3oo&page=5,6.0,2025-07-21 18:04:16.291096,https://www.imoti.net/bg/obiavi/r/prodava/sofia/?page=1&sid=iKI3oo,imoti.net,542,2025-07-21,,,Цена на /м2/:3 387EUR, 75 м2,Етаж: 2 от 7
"продава Тристаен апартамент, 80 м2","Намира се на ул.Богатица в близост до р-т ""ХЕПИ"", бул.Дж.Баучер, Х-л Маринела, Правителствена болница , ЮЖЕН ПАРК.Състои се от 2 спални, дневна с трапезария и кухненски бокс, баня с...",254000.0,EUR,False,продава,тристаен,София, Лозенец,,Глобъл Сървисиз,,https://www.imoti.net/bg/obiava/prodava/sofia/lozenec/tristaen/5734081/?sid=iKI3oo&page=5,12.0,2025-07-21 18:04:16.291523,https://www.imoti.net/bg/obiavi/r/prodava/sofia/?page=1&sid=iKI3oo,imoti.net,542,2025-07-21,,,Цена на /м2/:3 175EUR, 80 м2,Етаж: 2
"продава Двустаен апартамент, 81 м2","Жилището се състои от: входно антре с голям вграден гардероб, светла дневна с трапезария и кухненски бокс, уютна спалня и добре поддържан санитарен възел, тераса. Апартаментът е с югоисточно...",255000.0,EUR,False,продава,двустаен,София, Хиподрума,,АДРЕС Недвижими имоти АД,,https://www.imoti.net/bg/obiava/prodava/sofia/hipodruma/dvustaen/6075304/?sid=iKI3oo&page=5,11.0,2025-07-21 18:04:16.291937,https://www.imoti.net/bg/obiavi/r/prodava/sofia/?page=1&sid=iKI3oo,imoti.net,542,2025-07-21,,,Цена на /м2/:3 148EUR, 81 м2,Етаж: 4 от 9
"продава Двустаен апартамент, 87 м2","Вашият дом с история и бъдеще. Енергоефективност, независимост, иновативност и заслужен комфорт за всички собственици на комплекса. Двустаен апартамент състоящ се от: дневна с кухненски бокс,...",256393.0,EUR,False,продава,двустаен,София, Хладилника,,АДРЕС Недвижими имоти АД,,https://www.imoti.net/bg/obiava/prodava/sofia/hladilnika/dvustaen/6035423/?sid=iKI3oo&page=5,11.0,2025-07-21 18:04:16.292350,https://www.imoti.net/bg/obiavi/r/prodava/sofia/?page=1&sid=iKI3oo,imoti.net,542,2025-07-21,,,Цена на /м2/:2 947EUR, 87 м2,Етаж: 5 от 15
"продава Четиристаен апартамент, 100 м2","Прекрасен четиристаен апартамент за продажба, разположен на тиха и зелена улица в един от най-престижните и предпочитани квартали на столицата – Лозенец. Имотът е на две нива и се отличава с...",258000.0,EUR,False,продава,четиристаен,София, Лозенец,,Глобъл Сървисиз,,https://www.imoti.net/bg/obiava/prodava/sofia/lozenec/chetiristaen/6076216/?sid=iKI3oo&page=6,9.0,2025-07-21 18:04:20.168285,https://www.imoti.net/bg/obiavi/r/prodava/sofia/?page=1&sid=iKI3oo,imoti.net,542,2025-07-21,,,Цена на /м2/:2 580EUR, 100 м2,Етаж: 5 от 5
"продава Тристаен апартамент, 84 м2","ЕРА Голд има удоволствието да Ви представи тристаен апартамент с отделна кухня в кв. Лозенец - ул. Миджур.Разпределение: Просторно входно антре, всекидневна с трапезария, отделна...",260000.0,EUR,False,продава,тристаен,София, Лозенец,,ЕРА Голд,,https://www.imoti.net/bg/obiava/prodava/sofia/lozenec/tristaen/6036174/?sid=iKI3oo&page=6,9.0,2025-07-21 18:04:20.168775,https://www.imoti.net/bg/obiavi/r/prodava/sofia/?page=1&sid=iKI3oo,imoti.net,542,2025-07-21,,,Цена на /м2/:3 095EUR, 84 м2,Етаж: 4 от 4
"продава Тристаен апартамент, 76 м2",,260000.0,EUR,False,продава,тристаен,София, Стрелбище,,Глобъл Сървисиз,,https://www.imoti.net/bg/obiava/prodava/sofia/strelbishte/tristaen/6097371/?sid=iKI3oo&page=6,1.0,2025-07-21 18:04:20.169197,https://www.imoti.net/bg/obiavi/r/prodava/sofia/?page=1&sid=iKI3oo,imoti.net,542,2025-07-21,,,Цена на /м2/:3 421EUR, 76 м2,Етаж: 6 от 8
"продава Двустаен апартамент, 159 м2","Двустаен апартамент, с АКТ 16, състоящ се от: дневна с кухненски бокс, спалня с дрешник, баня с тоалетна и тераса. Обявената цена е без ДДС.",260480.0,EUR,False,продава,двустаен,София, Лозенец,,Имотека,,https://www.imoti.net/bg/obiava/prodava/sofia/lozenec/dvustaen/6096212/?sid=iKI3oo&page=6,4.0,2025-07-21 18:04:20.169630,https://www.imoti.net/bg/obiavi/r/prodava/sofia/?page=1&sid=iKI3oo,imoti.net,542,2025-07-21,,,Цена на /м2/:1 638EUR, 159 м2,Етаж: 6 от 6
"продава Двустаен апартамент, 82 м2","VISTATE има удоволствието да ви представи двустаен апартамент в нова сграда пред Акт 15 в отличен район близо до метростанция България, на пешеходно разстояние от Южен парк и НДК. Доверен строител...",262000.0,EUR,False,продава,двустаен,София, Стрелбище,,VISTATE,,https://www.imoti.net/bg/obiava/prodava/sofia/strelbishte/dvustaen/6038589/?sid=iKI3oo&page=6,4.0,2025-07-21 18:04:20.170042,https://www.imoti.net/bg/obiavi/r/prodava/sofia/?page=1&sid=iKI3oo,imoti.net,542,2025-07-21,,,Цена на /м2/:3 195EUR, 82 м2,Етаж: 4 от 6
"продава Двустаен апартамент, 82 м2",С АКТ 14АКТ 15 МАЙ НА 2026г.!АКТ16 КРАЯ НА 2026!ИРИДА НЕДВИЖИМИ ИМОТИ продава просторен двустаен апартамент в сграда с изключително висококачествено строителство от...,262000.0,EUR,False,продава,двустаен,София, Стрелбище,,ИРИДА НЕДВИЖИМИ ИМОТИ,,https://www.imoti.net/bg/obiava/prodava--v-stroej/sofia/strelbishte/dvustaen/6038125/?sid=iKI3oo&page=6,3.0,2025-07-21 18:04:20.170532,https://www.imoti.net/bg/obiavi/r/prodava/sofia/?page=1&sid=iKI3oo,imoti.net,542,2025-07-21,,,Цена на /м2/:3 195EUR, 82 м2,Етаж: 4 от 9
"продава Тристаен апартамент, 98 м2","КЛИЕНТИТЕ НА MARTIN'S СА ПО-ДОВОЛНИ! ПОПИТАЙ ЗАЩО!Представяме просторен и светъл, вътрешен апартамент с много добра локация. Намира се в един от най-предпочитаните за живеене столични...",265000.0,EUR,False,продава,тристаен,София, Лагера,,MARTIN’S,,https://www.imoti.net/bg/obiava/prodava/sofia/lagera/tristaen/6064753/?sid=iKI3oo&page=6,15.0,2025-07-21 18:04:20.170956,https://www.imoti.net/bg/obiavi/r/prodava/sofia/?page=1&sid=iKI3oo,imoti.net,542,2025-07-21,,,Цена на /м2/:2 704EUR, 98 м2,Етаж: 1 от 12
"продава Тристаен апартамент, 133 м2","ЕРА Голд Ви представя южен двустаен апартамент в нова жилищна сграда в близост до центъра на София и Военномедицинска болница, кв. Лагера.Апартаментът се състои от : входно антре,...",266666.0,EUR,False,продава,тристаен,София, Лагера,,ЕРА Голд,,https://www.imoti.net/bg/obiava/prodava--v-stroej/sofia/lagera/tristaen/6083532/?sid=iKI3oo&page=6,5.0,2025-07-21 18:04:20.171377,https://www.imoti.net/bg/obiavi/r/prodava/sofia/?page=1&sid=iKI3oo,imoti.net,542,2025-07-21,,,Цена на /м2/:2 005EUR, 133 м2,Етаж: 5 от 7
"продава Двустаен апартамент, 101 м2","Вашият дом с история и бъдеще. Енергоефективност, независимост, иновативност и заслужен комфорт за всички собственици на комплекса. Двустаен апартамент състоящ се от: дневна с кухненски бокс,...",269122.0,EUR,False,продава,двустаен,София, Хладилника,,АДРЕС Недвижими имоти АД,,https://www.imoti.net/bg/obiava/prodava/sofia/hladilnika/dvustaen/6035571/?sid=iKI3oo&page=6,11.0,2025-07-21 18:04:20.171813,https://www.imoti.net/bg/obiavi/r/prodava/sofia/?page=1&sid=iKI3oo,imoti.net,542,2025-07-21,,,Цена на /м2/:2 665EUR, 101 м2,Етаж: 6 от 15
"продава Тристаен апартамент, 92 м2","Представяме Ви ексклузивно просторен, тристаен апартамент, с функционалност на четиристаен. Разположен в един от най-комуникативните райони в столицата - кв. Хиподрума, бл.133 на висок етаж. В...",270000.0,EUR,False,продава,тристаен,София, Хиподрума,,SUPRIMMO,,https://www.imoti.net/bg/obiava/prodava--v-stroej/sofia/hipodruma/tristaen/6073429/?sid=iKI3oo&page=6,12.0,2025-07-21 18:04:20.172232,https://www.imoti.net/bg/obiavi/r/prodava/sofia/?page=1&sid=iKI3oo,imoti.net,542,2025-07-21,,,Цена на /м2/:2 935EUR, 92 м2,Етаж:  от 14
"продава Двустаен апартамент, 70 м2","Агенция за недвижими имоти Експрес Дом Консулт България предлага на вашето внимание ОСНОВНО РЕМОНТИРАН двустаен апартамент на изключително комуникативно място, в близост до спирки на градския...",270000.0,EUR,False,продава,двустаен,София, Стрелбище,,Експрес Дом Консулт,,https://www.imoti.net/bg/obiava/prodava--v-stroej/sofia/strelbishte/dvustaen/6099054/?sid=iKI3oo&page=6,17.0,2025-07-21 18:04:20.172658,https://www.imoti.net/bg/obiavi/r/prodava/sofia/?page=1&sid=iKI3oo,imoti.net,542,2025-07-21,,,Цена на /м2/:3 857EUR, 70 м2,Етаж: 5 от 7
"продава Двустаен апартамент, 101 м2","Вашият дом с история и бъдеще. Енергоефективност, независимост, иновативност и заслужен комфорт за всички собственици на комплекса. Двустаен апартамент състоящ се от: дневна с кухненски бокс,...",271134.0,EUR,False,продава,двустаен,София, Хладилника,,АДРЕС Недвижими имоти АД,,https://www.imoti.net/bg/obiava/prodava/sofia/hladilnika/dvustaen/6035569/?sid=iKI3oo&page=6,14.0,2025-07-21 18:04:20.173072,https://www.imoti.net/bg/obiavi/r/prodava/sofia/?page=1&sid=iKI3oo,imoti.net,542,2025-07-21,,,Цена на /м2/:2 684EUR, 101 м2,Етаж: 7 от 15
"продава Двустаен апартамент, 101 м2","Вашият дом с история и бъдеще. Енергоефективност, независимост, иновативност и заслужен комфорт за всички собственици на комплекса. Двустаен апартамент състоящ се от: дневна с кухненски бокс,...",271134.0,EUR,False,продава,двустаен,София, Хладилника,,АДРЕС Недвижими имоти АД,,https://www.imoti.net/bg/obiava/prodava/sofia/hladilnika/dvustaen/6035425/?sid=iKI3oo&page=6,11.0,2025-07-21 18:04:20.173496,https://www.imoti.net/bg/obiavi/r/prodava/sofia/?page=1&sid=iKI3oo,imoti.net,542,2025-07-21,,,Цена на /м2/:2 684EUR, 101 м2,Етаж: 7 от 15
"продава Тристаен апартамент, 101 м2","Тристаен апартамент на 5 етан изложение И/З.Състои се от антре , самостоятелна кухня с малка тераса, две спални, дневна с излаз на тераса, баня и отделна тоалетна.Към жилището има мазе 7.23...",274000.0,EUR,False,продава,тристаен,София, Лозенец,,АДРЕС Недвижими имоти АД,,https://www.imoti.net/bg/obiava/prodava/sofia/lozenec/tristaen/5925091/?sid=iKI3oo&page=6,4.0,2025-07-21 18:04:20.173909,https://www.imoti.net/bg/obiavi/r/prodava/sofia/?page=1&sid=iKI3oo,imoti.net,542,2025-07-21,,,Цена на /м2/:2 713EUR, 101 м2,Етаж: 5 от 20
"продава Тристаен апартамент, 94 м2","Просторен тристаен апартамент, който лесно може да се преустрои в четиристаен. Жилището е със застроена площ от 94,47 кв.м., в които не влиза квадратурата на двете усвоени тераси. Апартаментът е...",275000.0,EUR,False,продава,тристаен,София, Хиподрума,,АДРЕС Недвижими имоти АД,,https://www.imoti.net/bg/obiava/prodava/sofia/hipodruma/tristaen/6089778/?sid=iKI3oo&page=6,16.0,2025-07-21 18:04:20.174320,https://www.imoti.net/bg/obiavi/r/prodava/sofia/?page=1&sid=iKI3oo,imoti.net,542,2025-07-21,,,Цена на /м2/:2 926EUR, 94 м2,Етаж: 2 от 14
"продава Тристаен апартамент, 131 м2","Представяме нов, супер просторен тристаен апартамент за продажба, в новострояща се сграда на удобна локация в столицата, до бул. ""Цар Борис III"", кв. ""Лагера"".Сградата е разположена в...",275000.0,EUR,False,продава,тристаен,София, Лагера,,Luximmo Finest Estates,,https://www.imoti.net/bg/obiava/prodava--v-stroej/sofia/lagera/tristaen/6052575/?sid=iKI3oo&page=6,6.0,2025-07-21 18:04:20.174802,https://www.imoti.net/bg/obiavi/r/prodava/sofia/?page=1&sid=iKI3oo,imoti.net,542,2025-07-21,,,Цена на /м2/:2 099EUR, 131 м2,Етаж:  от 8
"продава Двустаен апартамент, 107 м2","Вашият дом с история и бъдеще. Енергоефективност, независимост, иновативност и заслужен комфорт за всички собственици на комплекса. Двустаен апартамент състоящ се от: дневна с кухненски бокс,...",276037.0,EUR,False,продава,двустаен,София, Хладилника,,АДРЕС Недвижими имоти АД,,https://www.imoti.net/bg/obiava/prodava/sofia/hladilnika/dvustaen/6035648/?sid=iKI3oo&page=6,11.0,2025-07-21 18:04:20.175213,https://www.imoti.net/bg/obiavi/r/prodava/sofia/?page=1&sid=iKI3oo,imoti.net,542,2025-07-21,,,Цена на /м2/:2 580EUR, 107 м2,Етаж: 2 от 15
"продава Двустаен апартамент, 87 м2","Вашият дом с история и бъдеще. Енергоефективност, независимост, иновативност и заслужен комфорт за всички собственици на комплекса. Двустаен апартамент състоящ се от: дневна с кухненски бокс,...",279362.0,EUR,False,продава,двустаен,София, Хладилника,,АДРЕС Недвижими имоти АД,,https://www.imoti.net/bg/obiava/prodava/sofia/hladilnika/dvustaen/6035052/?sid=iKI3oo&page=6,11.0,2025-07-21 18:04:20.175638,https://www.imoti.net/bg/obiavi/r/prodava/sofia/?page=1&sid=iKI3oo,imoti.net,542,2025-07-21,,,Цена на /м2/:3 211EUR, 87 м2,Етаж: 11 от 15
