raw_title,raw_description,price,currency,without_dds,offer_type,property_type,city,neighborhood,contact_info,agency,agency_url,details_url,num_photos,date_time_added,search_url,site,total_offers,date,ref_no,time,price_per_m2,area,floor
"продава Двустаен апартамент, 68 м2","СВОБОДА, СТИЛ И ЛУКС!Западен двустаен апартамент с отлично разпределение – перфектен избор както за лично ползване, така и за инвестиция с квадратура 67.25 кв.м / 58.48 кв.м.със...",225000.0,EUR,False,продава,двустаен,София, Лозенец,,АДРЕС Недвижими имоти АД,,https://www.imoti.net/bg/obiava/prodava/sofia/lozenec/dvustaen/6062084/?sid=iKI3oo&page=1,7.0,2025-07-21 18:04:00.513644,https://www.imoti.net/bg/obiavi/r/prodava/sofia/?page=1&sid=iKI3oo,imoti.net,542,2025-07-21,,,Цена на /м2/:3 309EUR, 68 м2,Етаж: 4 от 21
"продава Тристаен апартамент, 93 м2","Продажби директно от инвеститора, без комисиона за купувача!SoHome Residential Park гр. София е отличен с първа награда в националния конкурс Сграда на годината за 2022г. и за 2024г....",273859.0,EUR,False,продава,тристаен,София, Лозенец,,ХЪС ИНВЕСТ СОФИЯ,,https://www.imoti.net/bg/obiava/prodava--v-stroej/sofia/lozenec/tristaen/3358536/?sid=iKI3oo&page=1,9.0,2025-07-21 18:04:00.514140,https://www.imoti.net/bg/obiavi/r/prodava/sofia/?page=1&sid=iKI3oo,imoti.net,542,2025-07-21,,,Цена на /м2/:2 945EUR, 93 м2,Етаж: 2 от 9
"продава Многостаен апартамент, 160 м2","160 кв.м. простор , лукс и светлина в квартал Стрелбище за апартамент с южно изложение на ул. „Мила Родина“ 26  в ж.к. Стрелбище на първи етаж над магазини.Много важен акцент...",450000.0,EUR,False,продава,многостаен,София, Стрелбище,,АДРЕС Недвижими имоти АД,,https://www.imoti.net/bg/obiava/prodava/sofia/strelbishte/mnogostaen/6067978/?sid=iKI3oo&page=1,9.0,2025-07-21 18:04:00.514558,https://www.imoti.net/bg/obiavi/r/prodava/sofia/?page=1&sid=iKI3oo,imoti.net,542,2025-07-21,,,Цена на /м2/:2 813EUR, 160 м2,Етаж: 1 от 6
"продава Тристаен апартамент, 131 м2","Продажба от собственик, без комисиона за купувача! Възможност за данъчен кредит!С Акт 16!Представеният апартамент А13, се намира в Сграда 1, ет. 4 в SoHome Residential Park....",478800.0,EUR,False,продава,тристаен,София, Лозенец,,ХЪС ИНВЕСТ СОФИЯ,,https://www.imoti.net/bg/obiava/prodava/sofia/lozenec/tristaen/3381302/?sid=iKI3oo&page=1,17.0,2025-07-21 18:04:00.515012,https://www.imoti.net/bg/obiavi/r/prodava/sofia/?page=1&sid=iKI3oo,imoti.net,542,2025-07-21,,,Цена на /м2/:3 655EUR, 131 м2,Етаж: 4 от 6
"продава Тристаен апартамент, 165 м2","Продажби директно от инвеститора, без комисиона за купувача!SoHome Residential Park гр. София е отличен с първа награда в националния конкурс Сграда на годината за 2022г и за 2024г....",503815.0,EUR,False,продава,тристаен,София, Лозенец,,ХЪС ИНВЕСТ СОФИЯ,,https://www.imoti.net/bg/obiava/prodava--v-stroej/sofia/lozenec/tristaen/3381250/?sid=iKI3oo&page=1,12.0,2025-07-21 18:04:00.515508,https://www.imoti.net/bg/obiavi/r/prodava/sofia/?page=1&sid=iKI3oo,imoti.net,542,2025-07-21,,,Цена на /м2/:3 053EUR, 165 м2,Етаж: 3 от 9
"продава Тристаен апартамент, 145 м2","Продажби директно от инвеститора, без комисиона за купувача!SoHome Residential Park гр. София е отличен два пъти с първа награда в националния конкурс Сграда на годината за 2022г. и за...",513169.0,EUR,False,продава,тристаен,София, Лозенец,,ХЪС ИНВЕСТ СОФИЯ,,https://www.imoti.net/bg/obiava/prodava--v-stroej/sofia/lozenec/tristaen/3381292/?sid=iKI3oo&page=1,12.0,2025-07-21 18:04:00.515960,https://www.imoti.net/bg/obiavi/r/prodava/sofia/?page=1&sid=iKI3oo,imoti.net,542,2025-07-21,,,Цена на /м2/:3 539EUR, 145 м2,Етаж: 1 от 9
"продава Тристаен апартамент, 98 м2","НЕПОВТОРИМ ИМОТ!СТИЛ И ЕЛЕГАНТНОСТ!ТОП ЛОКАЦИЯ!Красив и много светъл дизайнерски обзаведен апартамент, в една от най-желаните и престижни локации в София. Жилището...",514987.0,EUR,False,продава,тристаен,София, Иван Вазов,,Елеганс Естейт,,https://www.imoti.net/bg/obiava/prodava/sofia/ivan-vazov/tristaen/6100805/?sid=iKI3oo&page=1,11.0,2025-07-21 18:04:00.516369,https://www.imoti.net/bg/obiavi/r/prodava/sofia/?page=1&sid=iKI3oo,imoti.net,542,2025-07-21,,,Цена на /м2/:5 255EUR, 98 м2,Етаж: 2 от 6
"продава Тристаен апартамент, 201 м2","Представяме тристаен апартамент за продажба, част от нова сграда със смесено предназначение в кв. ""Лозенец"", гр. София.Сградата е с получен Акт 16.Районът е един от...",603240.0,EUR,False,продава,тристаен,София, Лозенец,,Luximmo Finest Estates,,https://www.imoti.net/bg/obiava/prodava--v-stroej/sofia/lozenec/tristaen/5750082/?sid=iKI3oo&page=1,24.0,2025-07-21 18:04:00.516828,https://www.imoti.net/bg/obiavi/r/prodava/sofia/?page=1&sid=iKI3oo,imoti.net,542,2025-07-21,,,Цена на /м2/:3 001EUR, 201 м2,Етаж:  от 9
"продава Двустаен апартамент, 70 м2","ЕРА Палитра ви предлага за продажба уютен ДВУСТАЕН апартамент в комплекс от затворен тип ""Лалов Егрек"", разположен в живописното курортно селище Лозенец.Разположението на комплекса е с...",75000.0,EUR,False,продава,двустаен,София, Лозенец,,ЕРА ПАЛИТРА,,https://www.imoti.net/bg/obiava/prodava/sofia/lozenec/dvustaen/6099762/?sid=iKI3oo&page=1,13.0,2025-07-21 18:04:00.517260,https://www.imoti.net/bg/obiavi/r/prodava/sofia/?page=1&sid=iKI3oo,imoti.net,542,2025-07-21,,,Цена на /м2/:1 071EUR, 70 м2,Етаж: 2 от 3
"продава Двустаен апартамент, 68 м2","Компания `ЕКС` представя на Вашето внимание двустаен апартамент в кв. Хладилника.МЕСТОПОЛОЖЕНИЕ: В близост до спирка на градски транспорт, училища, магазини от всякакъв тип....",143000.0,EUR,False,продава,двустаен,София, Хладилника,,ЕКС НВД,,https://www.imoti.net/bg/obiava/prodava/sofia/hladilnika/dvustaen/6003077/?sid=iKI3oo&page=1,1.0,2025-07-21 18:04:00.517707,https://www.imoti.net/bg/obiavi/r/prodava/sofia/?page=1&sid=iKI3oo,imoti.net,542,2025-07-21,,,Цена на /м2/:2 103EUR, 68 м2,Етаж: 2 от 8
"продава Двустаен апартамент, 68 м2","БЕЗ КОМИСИОННА ОТ КУПУВАЧА!Компания `ЕКС` представя на Вашето внимание двустаен апартамент в кв. Хладилника.МЕСТОПОЛОЖЕНИЕ: В близост до спирка на градски транспорт,...",144000.0,EUR,False,продава,двустаен,София, Хладилника,,ЕКС НВД,,https://www.imoti.net/bg/obiava/prodava/sofia/hladilnika/dvustaen/6003114/?sid=iKI3oo&page=1,1.0,2025-07-21 18:04:00.518150,https://www.imoti.net/bg/obiavi/r/prodava/sofia/?page=1&sid=iKI3oo,imoti.net,542,2025-07-21,,,Цена на /м2/:2 118EUR, 68 м2,Етаж: 2 от 18
"продава Двустаен апартамент, 78 м2","ЕРА Голд Ви представя южен двустаен апартамент в нова жилищна сграда в близост до центъра на София и Военномедицинска болница, кв. Лагера.Апартаментът се състои от : входно антре,...",145833.0,EUR,False,продава,двустаен,София, Лагера,,ЕРА Голд,,https://www.imoti.net/bg/obiava/prodava--v-stroej/sofia/lagera/dvustaen/6056270/?sid=iKI3oo&page=1,5.0,2025-07-21 18:04:00.518598,https://www.imoti.net/bg/obiavi/r/prodava/sofia/?page=1&sid=iKI3oo,imoti.net,542,2025-07-21,,,Цена на /м2/:1 870EUR, 78 м2,Етаж: 2 от 8
"продава Двустаен апартамент, 74 м2","БЕЗ КОМИСИОННА ОТ КУПУВАЧА!Компания `ЕКС` представя на Вашето внимание двустаен апартамент в кв. Хладилника.МЕСТОПОЛОЖЕНИЕ: В близост до спирка на градски транспорт,...",155000.0,EUR,False,продава,двустаен,София, Хладилника,,ЕКС НВД,,https://www.imoti.net/bg/obiava/prodava/sofia/hladilnika/dvustaen/6003120/?sid=iKI3oo&page=1,1.0,2025-07-21 18:04:00.519034,https://www.imoti.net/bg/obiavi/r/prodava/sofia/?page=1&sid=iKI3oo,imoti.net,542,2025-07-21,,,Цена на /м2/:2 095EUR, 74 м2,Етаж: 2 от 18
"продава Двустаен апартамент, 45 м2","ИРИДА НЕДВИЖИМИ ИМОТИ Ви предлага за продажба обзаведен апартамент в кв. Стрелбище . Разположен на четвърти жилищен етаж от осем  .Намира се в непосредствена близост до детски градини,...",160000.0,EUR,False,продава,двустаен,София, Стрелбище,,ИРИДА НЕДВИЖИМИ ИМОТИ,,https://www.imoti.net/bg/obiava/prodava--v-stroej/sofia/strelbishte/dvustaen/6097115/?sid=iKI3oo&page=1,1.0,2025-07-21 18:04:00.519527,https://www.imoti.net/bg/obiavi/r/prodava/sofia/?page=1&sid=iKI3oo,imoti.net,542,2025-07-21,,,Цена на /м2/:3 556EUR, 45 м2,Етаж: 4 от 8
"продава Двустаен апартамент, 51 м2","Продаваме изключително слънчев, двустаен апартамент.Жилището е с югозападно изложение и прекрасна гледка към Витоша.Отоплението и топлата вода са от ТЕЦ.Общите части се...",168000.0,EUR,False,продава,двустаен,София, Белите Брези,,UNIVERSI,,https://www.imoti.net/bg/obiava/prodava/sofia/belite-brezi/dvustaen/6085729/?sid=iKI3oo&page=1,13.0,2025-07-21 18:04:00.519957,https://www.imoti.net/bg/obiavi/r/prodava/sofia/?page=1&sid=iKI3oo,imoti.net,542,2025-07-21,,,Цена на /м2/:3 294EUR, 51 м2,Етаж: 11 от 13
"продава Двустаен апартамент, 50 м2",,180000.0,EUR,False,продава,двустаен,София, Лагера,,Глобъл Сървисиз,,https://www.imoti.net/bg/obiava/prodava/sofia/lagera/dvustaen/6099325/?sid=iKI3oo&page=1,6.0,2025-07-21 18:04:00.520376,https://www.imoti.net/bg/obiavi/r/prodava/sofia/?page=1&sid=iKI3oo,imoti.net,542,2025-07-21,,,Цена на /м2/:3 600EUR, 50 м2,Етаж: 14 от 18
"продава Мезонет, 84 м2","Представяме просторен апартамент от 100 кв.м за продажба, на удобна локация само на 200 м от метростанция ""Красно село"" в кв. ""Лагера"". В района ще откриете множество удобства, в близост са...",190000.0,EUR,False,продава,мезонет,София, Лагера,,SUPRIMMO,,https://www.imoti.net/bg/obiava/prodava--v-stroej/sofia/lagera/mezonet/6021842/?sid=iKI3oo&page=1,8.0,2025-07-21 18:04:00.520820,https://www.imoti.net/bg/obiavi/r/prodava/sofia/?page=1&sid=iKI3oo,imoti.net,542,2025-07-21,,,Цена на /м2/:2 262EUR, 84 м2,Етаж:  от 6
"продава Двустаен апартамент, 50 м2","Хоум Лайт предлага на Вашето внимание двустаен апартамент, разположен на метри от Южен парк в един от най- желаните райони на южна София, кв. Стрелбище.Тих, спокоен и зелен район с отлично...",190000.0,EUR,False,продава,двустаен,София, Стрелбище,,ХОУМЛАЙТ,,https://www.imoti.net/bg/obiava/prodava/sofia/strelbishte/dvustaen/6098655/?sid=iKI3oo&page=1,1.0,2025-07-21 18:04:00.521247,https://www.imoti.net/bg/obiavi/r/prodava/sofia/?page=1&sid=iKI3oo,imoti.net,542,2025-07-21,,,Цена на /м2/:3 800EUR, 50 м2,Етаж: 3 от 14
"продава Двустаен апартамент, 50 м2",,190000.0,EUR,False,продава,двустаен,София, Стрелбище,,Глобъл Сървисиз,,https://www.imoti.net/bg/obiava/prodava/sofia/strelbishte/dvustaen/6097389/?sid=iKI3oo&page=1,1.0,2025-07-21 18:04:00.521679,https://www.imoti.net/bg/obiavi/r/prodava/sofia/?page=1&sid=iKI3oo,imoti.net,542,2025-07-21,,,Цена на /м2/:3 800EUR, 50 м2,Етаж: 3 от 14
"продава Тристаен апартамент, 109 м2","Луксозно ново строителство с безкрайна гледка към планината, метростанция на крачка от комплекса, само на 4,8 км. от центъра на града. Завършен етап ""груб строеж“ – края на 2024 г., разрешение за...",192178.0,EUR,False,продава,тристаен,София, Лагера,,Глобъл Сървисиз,,https://www.imoti.net/bg/obiava/prodava/sofia/lagera/tristaen/5899222/?sid=iKI3oo&page=1,3.0,2025-07-21 18:04:00.522101,https://www.imoti.net/bg/obiavi/r/prodava/sofia/?page=1&sid=iKI3oo,imoti.net,542,2025-07-21,,,Цена на /м2/:1 763EUR, 109 м2,Етаж: 3 от 16
"продава Двустаен апартамент, 72 м2","Двустаен апартамент със застроена площ 56,09 кв.м + тераса 10,48 кв.м. Разпределение: дневна с кухненски бокс 26,71 кв.м, спалня 9,21 кв и баня с тоалетна....",192616.0,EUR,False,продава,двустаен,София, Стрелбище,,АДРЕС Недвижими имоти АД,,https://www.imoti.net/bg/obiava/prodava/sofia/strelbishte/dvustaen/5965693/?sid=iKI3oo&page=1,2.0,2025-07-21 18:04:00.522531,https://www.imoti.net/bg/obiavi/r/prodava/sofia/?page=1&sid=iKI3oo,imoti.net,542,2025-07-21,,,Цена на /м2/:2 675EUR, 72 м2,Етаж: 6 от 8
"продава Двустаен апартамент, 62 м2",Без комисионна от страна на купувача!!! Galiano Estates има удоволствието да ви представи двустаен апартамент в новострояща се сграда. Разполагаме с ограничени бройки двустайни и тристайни...,192617.0,EUR,False,продава,двустаен,София, Стрелбище,,Galiano Estates,,https://www.imoti.net/bg/obiava/prodava/sofia/strelbishte/dvustaen/5999886/?sid=iKI3oo&page=1,2.0,2025-07-21 18:04:00.523000,https://www.imoti.net/bg/obiavi/r/prodava/sofia/?page=1&sid=iKI3oo,imoti.net,542,2025-07-21,,,Цена на /м2/:3 107EUR, 62 м2,Етаж: 6 от 7
"продава Двустаен апартамент, 62 м2","ЕРА Голд представя двустаен апартамент в новострояща се сграда в ж.к. Стрелбище на перфектна локация в близост до бул. България, супермаркет Фантастико, не далеч от Южен Парк, в близост до...",192617.0,EUR,False,продава,двустаен,София, Стрелбище,,ЕРА Голд,,https://www.imoti.net/bg/obiava/prodava--v-stroej/sofia/strelbishte/dvustaen/6037572/?sid=iKI3oo&page=1,2.0,2025-07-21 18:04:00.523435,https://www.imoti.net/bg/obiavi/r/prodava/sofia/?page=1&sid=iKI3oo,imoti.net,542,2025-07-21,,,Цена на /м2/:3 107EUR, 62 м2,Етаж: 6 от 8
"продава Двустаен апартамент, 62 м2","Компания `ЕКС` представя на Вашето внимание двустаен апартамент в ж.к. Стрелбище.МЕСТОПОЛОЖЕНИЕ: В близост до спирки на градски транспорт, училище, магазини от всякакъв тип....",192617.0,EUR,False,продава,двустаен,София, Стрелбище,,ЕКС НВД,,https://www.imoti.net/bg/obiava/prodava/sofia/strelbishte/dvustaen/6001078/?sid=iKI3oo&page=1,1.0,2025-07-21 18:04:00.523882,https://www.imoti.net/bg/obiavi/r/prodava/sofia/?page=1&sid=iKI3oo,imoti.net,542,2025-07-21,,,Цена на /м2/:3 107EUR, 62 м2,Етаж: 6 от 8
"продава Двустаен апартамент, 72 м2","За повече информация свържете се с нас и цитирайте референтния номер на имота. Моля, кажете, че сте видeли обявата в imoti.net.Референтен номер: Sfa 85507Тел: 0882 817...",192617.0,EUR,False,продава,двустаен,София, Стрелбище,,BULGARIAN PROPERTIES,,https://www.imoti.net/bg/obiava/prodava--v-stroej/sofia/strelbishte/dvustaen/5957311/?sid=iKI3oo&page=1,17.0,2025-07-21 18:04:00.524387,https://www.imoti.net/bg/obiavi/r/prodava/sofia/?page=1&sid=iKI3oo,imoti.net,542,2025-07-21,,,Цена на /м2/:2 675EUR, 72 м2,Етаж: 1 от 8
"продава Двустаен апартамент, 63 м2","2 стаен апартамент с възможност за преустройство в 3 стаен - кв. Хиподрума на 1 минута от метростанция ""бул. България"". Среден етаж 2 от 3 в тухлена сграда със ЗП 63 кв.м. Южен,...",194500.0,EUR,False,продава,двустаен,София, Хиподрума,,АДРЕС Недвижими имоти АД,,https://www.imoti.net/bg/obiava/prodava/sofia/hipodruma/dvustaen/6087917/?sid=iKI3oo&page=1,12.0,2025-07-21 18:04:00.524838,https://www.imoti.net/bg/obiavi/r/prodava/sofia/?page=1&sid=iKI3oo,imoti.net,542,2025-07-21,,,Цена на /м2/:3 087EUR, 63 м2,Етаж:  от 3
"продава Двустаен апартамент, 70 м2","Агенция Явлена има удоволствието да предложи за продажба двустаен тухлен апартамент в непосредствена близост до пазар Красно село и метростанция Красно село, на тиха вътрешна уличка в квартал Бели...",195000.0,EUR,False,продава,двустаен,София, Белите Брези,,Явлена София,,https://www.imoti.net/bg/obiava/prodava/sofia/belite-brezi/dvustaen/6026250/?sid=iKI3oo&page=1,8.0,2025-07-21 18:04:00.525327,https://www.imoti.net/bg/obiavi/r/prodava/sofia/?page=1&sid=iKI3oo,imoti.net,542,2025-07-21,,,Цена на /м2/:2 786EUR, 70 м2,Етаж: 3 от 7
"продава Тристаен апартамент, 75 м2",Явлена Изток продава 3-стаен апартамент със ЗП 75 м2 в атрактивен район. Входът е с контролиран достъп и поддържани общи части. Имотът е напълно обзаведен с всички необходими за едно домакинство...,195000.0,EUR,False,продава,тристаен,София, Лозенец,,Явлена Изток,,https://www.imoti.net/bg/obiava/prodava/sofia/lozenec/tristaen/5626434/?sid=iKI3oo&page=1,7.0,2025-07-21 18:04:00.525771,https://www.imoti.net/bg/obiavi/r/prodava/sofia/?page=1&sid=iKI3oo,imoti.net,542,2025-07-21,,,Цена на /м2/:2 600EUR, 75 м2,Етаж: 6 от 7
"продава Двустаен апартамент, 75 м2",.  .  .  .  .  .  .  .  .  .  .  .  .  .  .  .  .  .  .  .  .  .  .  .  .  .  .  .  .  . НОВ .  .  .  .  .  .  .  .  .  .  .  .  .  .  .  .  .  .  .  .  .  .  .  .  .  .  .  .  .  .С А16...,198000.0,EUR,False,продава,двустаен,София, Хладилника,,АРСЕНАЛ - недвижими имоти,,https://www.imoti.net/bg/obiava/prodava/sofia/hladilnika/dvustaen/6020840/?sid=iKI3oo&page=1,1.0,2025-07-21 18:04:00.526208,https://www.imoti.net/bg/obiavi/r/prodava/sofia/?page=1&sid=iKI3oo,imoti.net,542,2025-07-21,,,Цена на /м2/:2 640EUR, 75 м2,Етаж: 5 от 11
"продава Тристаен апартамент, 81 м2","Реф. № 012018Агенция за недвижими имоти BAS Properties предлага за продажба тристаен апартамент с отлична локация в жк. Лагера, гр. София.Основни...",199999.0,EUR,False,продава,тристаен,София, Лагера,,БАС Пропъртис,,https://www.imoti.net/bg/obiava/prodava/sofia/lagera/tristaen/6079348/?sid=iKI3oo&page=1,10.0,2025-07-21 18:04:00.526668,https://www.imoti.net/bg/obiavi/r/prodava/sofia/?page=1&sid=iKI3oo,imoti.net,542,2025-07-21,,,Цена на /м2/:2 469EUR, 81 м2,Етаж: 3 от 8
"продава Двустаен апартамент, 66 м2",,199999.0,EUR,False,продава,двустаен,София, Лагера,,Имоти Премиер,,https://www.imoti.net/bg/obiava/prodava/sofia/lagera/dvustaen/6032520/?sid=iKI3oo&page=2,16.0,2025-07-21 18:04:04.502306,https://www.imoti.net/bg/obiavi/r/prodava/sofia/?page=1&sid=iKI3oo,imoti.net,542,2025-07-21,,,Цена на /м2/:3 030EUR, 66 м2,Етаж: 2 от 6
"продава Двустаен апартамент, 87 м2","Явлена представя на Вашето внимание просторен и светъл двустаен апартамент в модерна жилищна сграда, намираща се в спокойна градска околна среда в ж.к. ""Лагера"". На пешеходно разстояние от 7 минути...",200374.0,EUR,False,продава,двустаен,София, Лагера,,Явлена Изток,,https://www.imoti.net/bg/obiava/prodava/sofia/lagera/dvustaen/6023061/?sid=iKI3oo&page=2,4.0,2025-07-21 18:04:04.502797,https://www.imoti.net/bg/obiavi/r/prodava/sofia/?page=1&sid=iKI3oo,imoti.net,542,2025-07-21,,,Цена на /м2/:2 303EUR, 87 м2,Етаж: 1 от 9
"продава Двустаен апартамент, 88 м2","Непреходен двустаен апартамент на партрерно ниво в един от най - предпочитаните южни квартали на столицата - `Лагера`.Сграда: монолитна, качествена нова сграда - тип затворен...",200500.0,EUR,False,продава,двустаен,София, Лагера,,Ависта Офис Експерт,,https://www.imoti.net/bg/obiava/prodava/sofia/lagera/dvustaen/6049975/?sid=iKI3oo&page=2,9.0,2025-07-21 18:04:04.503234,https://www.imoti.net/bg/obiavi/r/prodava/sofia/?page=1&sid=iKI3oo,imoti.net,542,2025-07-21,,,Цена на /м2/:2 278EUR, 88 м2,Етаж: 0 от 9
"продава Двустаен апартамент, 75 м2","Ексклузивно, БЕЗ КОМИСИОН от купувач.Предлагаме нов, функционален апартамент в модерна сграда с А16-юни 2024г.Сградата е разположена на ул. Филип Кутев, в близост до МОЛ Парадайс,...",206000.0,EUR,False,продава,двустаен,София, Хладилника,,Еколит,,https://www.imoti.net/bg/obiava/prodava/sofia/hladilnika/dvustaen/6016010/?sid=iKI3oo&page=2,,2025-07-21 18:04:04.503655,https://www.imoti.net/bg/obiavi/r/prodava/sofia/?page=1&sid=iKI3oo,imoti.net,542,2025-07-21,,,Цена на /м2/:2 747EUR, 75 м2,Етаж: 4 от 11
"продава Двустаен апартамент, 40 м2",,207500.0,EUR,False,продава,двустаен,София, Лозенец,,Глобъл Сървисиз,,https://www.imoti.net/bg/obiava/prodava/sofia/lozenec/dvustaen/6085382/?sid=iKI3oo&page=2,2.0,2025-07-21 18:04:04.504080,https://www.imoti.net/bg/obiavi/r/prodava/sofia/?page=1&sid=iKI3oo,imoti.net,542,2025-07-21,,,Цена на /м2/:5 188EUR, 40 м2,Етаж: 3 от 5
