raw_title,raw_description,price,currency,without_dds,offer_type,property_type,city,neighborhood,contact_info,agency,agency_url,details_url,num_photos,date_time_added,search_url,site,total_offers,date,ref_no,time,price_per_m2,area,floor
"продава Тристаен апартамент, 139 м2","Апартаментът се състои от 2 спални- към едната от спалните има прилежаща баня с WC и гардеробна; дневна с трапезария и кухненски бокс, 2 бани с WC;мокро помешение; входно антре със...",509820.0,BGN,False,продава,тристаен,София, Оборище,,АДРЕС Недвижими имоти АД,,https://www.imoti.net/bg/obiava/prodava/sofia/oborishte/tristaen/6010495/?sid=gFM8jD&page=11,18.0,2025-08-30 18:03:08.834641,https://www.imoti.net/bg/obiavi/r/prodava/sofia/?page=1&sid=gFM8jD,imoti.net,447,2025-08-30,,,Цена на /м2/:3 668EUR/7 173.53BGN, 139 м2,Етаж: 5 от 14
"продава Тристаен апартамент, 142 м2","First Estates има огромното удоволствие да Ви представи най-новия луксозен жилищен комплекс, сгушен до парка Заимов в сърцето на града. Този изключителен проект предефинира градския живот, като...",509820.0,BGN,False,продава,тристаен,София, Оборище,,First Estates,,https://www.imoti.net/bg/obiava/prodava/sofia/oborishte/tristaen/5869794/?sid=gFM8jD&page=11,15.0,2025-08-30 18:03:08.835145,https://www.imoti.net/bg/obiavi/r/prodava/sofia/?page=1&sid=gFM8jD,imoti.net,447,2025-08-30,,,Цена на /м2/:3 590EUR/7 021.98BGN, 142 м2,Етаж: 10 от 14
"продава Тристаен апартамент, 134 м2","Апартаментът се състои от 2 спални- към едната от спалните има прилежаща баня с WC и гардеробна; дневна с трапезария и кухненски бокс, 2 бани с WC;мокро помешение; входно антре със...",510360.0,BGN,False,продава,тристаен,София, Оборище,,АДРЕС Недвижими имоти АД,,https://www.imoti.net/bg/obiava/prodava/sofia/oborishte/tristaen/6010494/?sid=gFM8jD&page=11,18.0,2025-08-30 18:03:08.835585,https://www.imoti.net/bg/obiavi/r/prodava/sofia/?page=1&sid=gFM8jD,imoti.net,447,2025-08-30,,,Цена на /м2/:3 809EUR/7 449.09BGN, 134 м2,Етаж: 6 от 14
"продава Многостаен апартамент, 171 м2","Имоти ПРЕМИЕР представя на Вашето внимание многостаен апартамент в р-н Оборище!﻿Жилището е ситуирано на етаж 6 от 6 в новострояща се бутикова, тухлена сграда. Единствен на етажа!...",514080.0,BGN,False,продава,многостаен,София, Оборище,,Имоти Премиер,,https://www.imoti.net/bg/obiava/prodava/sofia/oborishte/mnogostaen/6064382/?sid=gFM8jD&page=11,9.0,2025-08-30 18:03:08.836092,https://www.imoti.net/bg/obiavi/r/prodava/sofia/?page=1&sid=gFM8jD,imoti.net,447,2025-08-30,,,Цена на /м2/:3 006EUR/5 879.84BGN, 171 м2,Етаж: 6 от 6
"продава Тристаен апартамент, 135 м2","Апартаментът се състои от 2 спални- към едната от спалните има прилежаща баня с WC; дневна с трапезария и кухненски бокс, 2 бани с WC; входно антре със складово помещение ; тераси....",516240.0,BGN,False,продава,тристаен,София, Оборище,,АДРЕС Недвижими имоти АД,,https://www.imoti.net/bg/obiava/prodava/sofia/oborishte/tristaen/6011695/?sid=gFM8jD&page=11,18.0,2025-08-30 18:03:08.836529,https://www.imoti.net/bg/obiavi/r/prodava/sofia/?page=1&sid=gFM8jD,imoti.net,447,2025-08-30,,,Цена на /м2/:3 824EUR/7 479.09BGN, 135 м2,Етаж: 6 от 14
"продава Четиристаен апартамент, 155 м2","Без комисионна! Цена на инвеститор! Ера Младост представя сложен и взискателен жилищен комплекс с Централна локация продиктувана от няколко ключови изисквания за проекта:Градски силует,...",519850.0,BGN,False,продава,четиристаен,София, Оборище,,ERA Младост,,https://www.imoti.net/bg/obiava/prodava--v-stroej/sofia/oborishte/chetiristaen/6027247/?sid=gFM8jD&page=11,6.0,2025-08-30 18:03:08.836979,https://www.imoti.net/bg/obiavi/r/prodava/sofia/?page=1&sid=gFM8jD,imoti.net,447,2025-08-30,,,Цена на /м2/:3 354EUR/6 559.60BGN, 155 м2,Етаж: 10 от 14
"продава Тристаен апартамент, 127 м2","Впечатляващият луксозен тристаен  апартамент, разположен  в сграда ""Хармония"" на ""Артекс"", представлява изключително уютно и стилно жилище с безкомпромисно качество и модерен дизайн. При влизане в...",520000.0,BGN,False,продава,тристаен,София, Дианабад,,Явлена София,,https://www.imoti.net/bg/obiava/prodava/sofia/dianabad/tristaen/6116030/?sid=gFM8jD&page=11,13.0,2025-08-30 18:03:08.837471,https://www.imoti.net/bg/obiavi/r/prodava/sofia/?page=1&sid=gFM8jD,imoti.net,447,2025-08-30,,,Цена на /м2/:4 094EUR/8 008.12BGN, 127 м2,Етаж: 14 от 18
"продава Тристаен апартамент, 127 м2","Представяме луксозен тристаен апартамент в една от емблематичните сгради в столицата, на топ локация до метростанция ""Г.М. Димитров"". Близо до ключов голям булевард ""Г.М. Димитров"", в сърцето на...",520000.0,BGN,False,продава,тристаен,София, Дианабад,,Luximmo Finest Estates,,https://www.imoti.net/bg/obiava/prodava--v-stroej/sofia/dianabad/tristaen/6080716/?sid=gFM8jD&page=12,40.0,2025-08-30 18:03:13.087671,https://www.imoti.net/bg/obiavi/r/prodava/sofia/?page=1&sid=gFM8jD,imoti.net,447,2025-08-30,,,Цена на /м2/:4 094EUR/8 008.12BGN, 127 м2,Етаж:  от 16
"продава Тристаен апартамент, 143 м2","Апартаментът се състои от 2 спални- към едната от спалните има прилежаща баня с WC; дневна с трапезария и кухненски бокс, 2 бани с WC; входно антре със складово помещение ; тераси....",521640.0,BGN,False,продава,тристаен,София, Оборище,,АДРЕС Недвижими имоти АД,,https://www.imoti.net/bg/obiava/prodava/sofia/oborishte/tristaen/6011696/?sid=gFM8jD&page=12,18.0,2025-08-30 18:03:13.088188,https://www.imoti.net/bg/obiavi/r/prodava/sofia/?page=1&sid=gFM8jD,imoti.net,447,2025-08-30,,,Цена на /м2/:3 648EUR/7 134.54BGN, 143 м2,Етаж: 5 от 14
"продава Четиристаен апартамент, 180 м2","ИРИДА НЕДВИЖИМИ ИМОТИ продава слънчев четиристаен апартамент в затворен жилищен комплекс, с изключително висококачествено строителство от доказан инвеститор на комуникативно място в квартал Оборище...",531700.0,BGN,False,продава,четиристаен,София, Оборище,,ИРИДА НЕДВИЖИМИ ИМОТИ,,https://www.imoti.net/bg/obiava/prodava--v-stroej/sofia/oborishte/chetiristaen/6105730/?sid=gFM8jD&page=12,8.0,2025-08-30 18:03:13.088681,https://www.imoti.net/bg/obiavi/r/prodava/sofia/?page=1&sid=gFM8jD,imoti.net,447,2025-08-30,,,Цена на /м2/:2 954EUR/5 777.30BGN, 180 м2,Етаж: 3 от 14
"продава Четиристаен апартамент, 178 м2","ИРИДА НЕДВИЖИМИ ИМОТИ продава слънчев четиристаен апартамент в новоизграждащ се затворен жилищен комплекс, с изключително висококачествено строителство от доказан инвеститор на комуникативно място...",532800.0,BGN,False,продава,четиристаен,София, Оборище,,ИРИДА НЕДВИЖИМИ ИМОТИ,,https://www.imoti.net/bg/obiava/prodava--v-stroej/sofia/oborishte/chetiristaen/6045939/?sid=gFM8jD&page=12,3.0,2025-08-30 18:03:13.089271,https://www.imoti.net/bg/obiavi/r/prodava/sofia/?page=1&sid=gFM8jD,imoti.net,447,2025-08-30,,,Цена на /м2/:2 993EUR/5 854.30BGN, 178 м2,Етаж: 7 от 14
"продава Двустаен апартамент, 96 м2","За повече информация свържете се с нас и цитирайте референтния номер на имота. Моля, кажете, че сте видeли обявата в imoti.net.Референтен номер: Sfa 87396Тел: 0882 817...",533005.0,BGN,False,продава,двустаен,София, Изток,,BULGARIAN PROPERTIES,,https://www.imoti.net/bg/obiava/prodava--v-stroej/sofia/sofija-iztok/dvustaen/6084973/?sid=gFM8jD&page=12,20.0,2025-08-30 18:03:13.089780,https://www.imoti.net/bg/obiavi/r/prodava/sofia/?page=1&sid=gFM8jD,imoti.net,447,2025-08-30,,,Цена на /м2/:5 552EUR/10 859.03BGN, 96 м2,Етаж: 1 от 7
"продава Тристаен апартамент, 121 м2","Ексклузивно представяме една рядко срещана възможност за покупка на тристаен апартамент в престижния кв. ""Оборище"".Апартаментът се намира на топ локация на улица ""Буная"" №14, само на...",535000.0,BGN,False,продава,тристаен,София, Оборище,,Luximmo Finest Estates,,https://www.imoti.net/bg/obiava/prodava--v-stroej/sofia/oborishte/tristaen/6066001/?sid=gFM8jD&page=12,28.0,2025-08-30 18:03:13.090287,https://www.imoti.net/bg/obiavi/r/prodava/sofia/?page=1&sid=gFM8jD,imoti.net,447,2025-08-30,,,Цена на /м2/:4 421EUR/8 647.68BGN, 121 м2,Етаж:  от 6
"продава Тристаен апартамент, 132 м2","Апартаментът се състои от 2 спални- към едната от спалните има прилежаща баня с WC; дневна с трапезария и кухненски бокс, 2 бани с WC; входно антре със складово помещение ; тераси....",537300.0,BGN,False,продава,тристаен,София, Оборище,,АДРЕС Недвижими имоти АД,,https://www.imoti.net/bg/obiava/prodava/sofia/oborishte/tristaen/6010506/?sid=gFM8jD&page=12,18.0,2025-08-30 18:03:13.090726,https://www.imoti.net/bg/obiavi/r/prodava/sofia/?page=1&sid=gFM8jD,imoti.net,447,2025-08-30,,,Цена на /м2/:4 070EUR/7 961.12BGN, 132 м2,Етаж: 9 от 14
"продава Четиристаен апартамент, 191 м2","ИРИДА НЕДВИЖИМИ ИМОТИ продава слънчев четиристаен апартамент в новоизграждащ се затворен жилищен комплекс, с изключително висококачествено строителство от доказан инвеститор на комуникативно място...",544290.0,BGN,False,продава,четиристаен,София, Оборище,,ИРИДА НЕДВИЖИМИ ИМОТИ,,https://www.imoti.net/bg/obiava/prodava--v-stroej/sofia/oborishte/chetiristaen/6040116/?sid=gFM8jD&page=12,4.0,2025-08-30 18:03:13.091223,https://www.imoti.net/bg/obiavi/r/prodava/sofia/?page=1&sid=gFM8jD,imoti.net,447,2025-08-30,,,Цена на /м2/:2 850EUR/5 573.50BGN, 191 м2,Етаж: 4 от 14
"продава Четиристаен апартамент, 190 м2","Представяме ви затворен комплекс в престижния квартал Оборище, на метри от парк ""Заимов"". Архитектурният проект предлага за продажба 277 двустайни, тристайни, четиристайни, многостайни апартаменти...",544290.0,BGN,False,продава,четиристаен,София, Оборище,,Luximmo Finest Estates,,https://www.imoti.net/bg/obiava/prodava--v-stroej/sofia/oborishte/chetiristaen/5719706/?sid=gFM8jD&page=12,14.0,2025-08-30 18:03:13.091715,https://www.imoti.net/bg/obiavi/r/prodava/sofia/?page=1&sid=gFM8jD,imoti.net,447,2025-08-30,,,Цена на /м2/:2 865EUR/5 602.84BGN, 190 м2,Етаж:  от 14
"продава Тристаен апартамент, 131 м2","Вдъхновяващият тристаен апартамент в престижната сграда ""Диамант"" на Артекс представлява уникална комбинация от изисканост, модерен дизайн и лукс. С впечатляващ изглед от високият етаж, този дом...",548000.0,BGN,False,продава,тристаен,София, Изгрев,,Явлена София,,https://www.imoti.net/bg/obiava/prodava/sofia/sofija-izgrev/tristaen/6050563/?sid=gFM8jD&page=12,13.0,2025-08-30 18:03:13.092214,https://www.imoti.net/bg/obiavi/r/prodava/sofia/?page=1&sid=gFM8jD,imoti.net,447,2025-08-30,,,Цена на /м2/:4 183EUR/8 181.64BGN, 131 м2,Етаж: 16 от 16
"продава Тристаен апартамент, 209 м2","Просторен тристаен апартамент, ситуиран е на последен 6-ти етаж (5-ти жилищен) и е със следното разпределение: коридор, просторна дневна с кухненски бокс, две спални, две бани и три...",550000.0,BGN,False,продава,тристаен,София, Дианабад,,АДРЕС Недвижими имоти АД,,https://www.imoti.net/bg/obiava/prodava/sofia/dianabad/tristaen/6040883/?sid=gFM8jD&page=12,11.0,2025-08-30 18:03:13.092647,https://www.imoti.net/bg/obiavi/r/prodava/sofia/?page=1&sid=gFM8jD,imoti.net,447,2025-08-30,,,Цена на /м2/:2 632EUR/5 146.92BGN, 209 м2,Етаж: 5 от 6
"продава Тристаен апартамент, 211 м2","Galardo Real Estate ви представя прекрасен панорамен апартамент, разположен в нова сграда, с АКТ 16, в близост до хотел Вега.Апартаментът е разположен на на 5-ти, последен етаж с просторни...",550000.0,BGN,False,продава,тристаен,София, Дианабад,,Galardo Real Estate,,https://www.imoti.net/bg/obiava/prodava/sofia/dianabad/tristaen/6041667/?sid=gFM8jD&page=12,15.0,2025-08-30 18:03:13.093105,https://www.imoti.net/bg/obiavi/r/prodava/sofia/?page=1&sid=gFM8jD,imoti.net,447,2025-08-30,,,Цена на /м2/:2 607EUR/5 098.14BGN, 211 м2,Етаж: 5 от 5
"продава Двустаен апартамент, 124 м2","""Явлена - Изток"" ООД предлага на Вашето внимание на ТОП локация един прекрасен двустаен апартамент в предпочитания квартал ""Изток"" на ул. ""Атанас Далчев"" в новопостроена сграда с акт 16 и...",552894.0,BGN,False,продава,двустаен,София, Изток,,Явлена Изток,,https://www.imoti.net/bg/obiava/prodava/sofia/sofija-iztok/dvustaen/6116108/?sid=gFM8jD&page=12,12.0,2025-08-30 18:03:13.093538,https://www.imoti.net/bg/obiavi/r/prodava/sofia/?page=1&sid=gFM8jD,imoti.net,447,2025-08-30,,,Цена на /м2/:4 459EUR/8 720.70BGN, 124 м2,Етаж: 3 от 8
"продава Тристаен апартамент, 145 м2","Апартаментът се състои от 2 спални- към едната от спалните има прилежаща баня с WC и гардеробна; дневна с трапезария и кухненски бокс, 2 бани с WC;мокро помешение; входно антре със...",566640.0,BGN,False,продава,тристаен,София, Оборище,,АДРЕС Недвижими имоти АД,,https://www.imoti.net/bg/obiava/prodava/sofia/oborishte/tristaen/6010492/?sid=gFM8jD&page=12,18.0,2025-08-30 18:03:13.093981,https://www.imoti.net/bg/obiavi/r/prodava/sofia/?page=1&sid=gFM8jD,imoti.net,447,2025-08-30,,,Цена на /м2/:3 908EUR/7 643.11BGN, 145 м2,Етаж: 7 от 14
"продава Тристаен апартамент, 110 м2","ДОКТОРСКИ ПАМЕТНИК!!! ТОП ЛОКАЦИЯ!!! ПРОСТОРЕН!!!  ВЪЗМОЖНОСТ ЗА ПАРКИРАНЕ ВЪВ ВЪТРЕШЕН ДВОР!!! Явлена прадставя на Вашето внимание изключително ценен имот, находящ се на самия Докторски паметник!...",570000.0,BGN,False,продава,тристаен,София, Оборище,,Явлена София,,https://www.imoti.net/bg/obiava/prodava/sofia/oborishte/tristaen/6048692/?sid=gFM8jD&page=12,12.0,2025-08-30 18:03:13.094467,https://www.imoti.net/bg/obiavi/r/prodava/sofia/?page=1&sid=gFM8jD,imoti.net,447,2025-08-30,,,Цена на /м2/:5 182EUR/10 134.76BGN, 110 м2,Етаж: 1 от 6
"продава Двустаен апартамент, 127 м2","""Явлена - Изток"" ООД предлага на Вашето внимание на ТОП локация един прекрасен двустаен апартамент в предпочитания квартал ""Изток"" на ул. ""Атанас Далчев"" в новопостроена сграда с акт 16 и...",570730.0,BGN,False,продава,двустаен,София, Изток,,Явлена Изток,,https://www.imoti.net/bg/obiava/prodava/sofia/sofija-iztok/dvustaen/6116815/?sid=gFM8jD&page=12,13.0,2025-08-30 18:03:13.094902,https://www.imoti.net/bg/obiavi/r/prodava/sofia/?page=1&sid=gFM8jD,imoti.net,447,2025-08-30,,,Цена на /м2/:4 494EUR/8 789.38BGN, 127 м2,Етаж: 2 от 8
"продава Двустаен апартамент, 129 м2","""Явлена - Изток"" ООД предлага на Вашето внимание на ТОП локация един прекрасен двустаен апартамент в предпочитания квартал ""Изток"" на ул. ""Атанас Далчев"" в новопостроена сграда с акт 16 и...",573988.0,BGN,False,продава,двустаен,София, Изток,,Явлена Изток,,https://www.imoti.net/bg/obiava/prodava/sofia/sofija-iztok/dvustaen/6116825/?sid=gFM8jD&page=12,13.0,2025-08-30 18:03:13.095350,https://www.imoti.net/bg/obiavi/r/prodava/sofia/?page=1&sid=gFM8jD,imoti.net,447,2025-08-30,,,Цена на /м2/:4 450EUR/8 702.50BGN, 129 м2,Етаж: 1 от 8
"продава Четиристаен апартамент, 186 м2","ИРИДА НЕДВИЖИМИ ИМОТИ продава слънчев четиристаен апартамент в новоизграждащ се затворен жилищен комплекс, с изключително висококачествено строителство от доказан инвеститор на комуникативно място...",576300.0,BGN,False,продава,четиристаен,София, Оборище,,ИРИДА НЕДВИЖИМИ ИМОТИ,,https://www.imoti.net/bg/obiava/prodava--v-stroej/sofia/oborishte/chetiristaen/6045314/?sid=gFM8jD&page=12,4.0,2025-08-30 18:03:13.095839,https://www.imoti.net/bg/obiavi/r/prodava/sofia/?page=1&sid=gFM8jD,imoti.net,447,2025-08-30,,,Цена на /м2/:3 098EUR/6 059.92BGN, 186 м2,Етаж: 10 от 14
"продава Четиристаен апартамент, 194 м2","ИРИДА НЕДВИЖИМИ ИМОТИ продава слънчев четиристаен апартамент в новоизграждащ се затворен жилищен комплекс, с изключително висококачествено строителство от доказан инвеститор на комуникативно място...",576790.0,BGN,False,продава,четиристаен,София, Оборище,,ИРИДА НЕДВИЖИМИ ИМОТИ,,https://www.imoti.net/bg/obiava/prodava--v-stroej/sofia/oborishte/chetiristaen/6040115/?sid=gFM8jD&page=12,4.0,2025-08-30 18:03:13.096337,https://www.imoti.net/bg/obiavi/r/prodava/sofia/?page=1&sid=gFM8jD,imoti.net,447,2025-08-30,,,Цена на /м2/:2 973EUR/5 814.96BGN, 194 м2,Етаж: 7 от 14
"продава Тристаен апартамент, 110 м2","Явлена Изток, представя на Вашето внимание тристаен апартамент в сграда , ситуирана в един от най-престижните и оживени  столични квартали – Изток. Локацията й е в атрактивен икомуникативен...",580000.0,BGN,False,продава,тристаен,София, Изток,,Явлена Изток,,https://www.imoti.net/bg/obiava/prodava/sofia/sofija-iztok/tristaen/6063164/?sid=gFM8jD&page=12,18.0,2025-08-30 18:03:13.096774,https://www.imoti.net/bg/obiavi/r/prodava/sofia/?page=1&sid=gFM8jD,imoti.net,447,2025-08-30,,,Цена на /м2/:5 273EUR/10 312.56BGN, 110 м2,Етаж: 2 от 6
"продава Тристаен апартамент, 109 м2","Продава се тристаен апартамент в луксозна нова сграда в кв. Изток, до Борисовата градинаПредлагаме за продажба просторен тристаен апартамент с площ от 109.73 кв.м., разположен на...",580000.0,BGN,False,продава,тристаен,София, Изток,,Имотека,,https://www.imoti.net/bg/obiava/prodava/sofia/sofija-iztok/tristaen/6113351/?sid=gFM8jD&page=12,4.0,2025-08-30 18:03:13.097227,https://www.imoti.net/bg/obiavi/r/prodava/sofia/?page=1&sid=gFM8jD,imoti.net,447,2025-08-30,,,Цена на /м2/:5 321EUR/10 407.17BGN, 109 м2,Етаж: 2 от 6
"продава Тристаен апартамент, 149 м2","Апартаментът се състои от 2 спални- към едната от спалните има прилежаща баня с WC; дневна с трапезария и кухненски бокс, 2 бани с WC; входно антре със складово помещение ; тераси....",583080.0,BGN,False,продава,тристаен,София, Оборище,,АДРЕС Недвижими имоти АД,,https://www.imoti.net/bg/obiava/prodava/sofia/oborishte/tristaen/6010502/?sid=gFM8jD&page=12,18.0,2025-08-30 18:03:13.097662,https://www.imoti.net/bg/obiavi/r/prodava/sofia/?page=1&sid=gFM8jD,imoti.net,447,2025-08-30,,,Цена на /м2/:3 913EUR/7 653.73BGN, 149 м2,Етаж: 7 от 14
"продава Тристаен апартамент, 129 м2","Напълно обзаведено жилище, уникален дизайн. Състои се от трапезария и кухня, две спални с дрешник, мокро помещение, една баня с тоалетна и тоалетна за гости.Изложението е...",585000.0,BGN,False,продава,тристаен,София, Изток,,АДРЕС Недвижими имоти АД,,https://www.imoti.net/bg/obiava/prodava/sofia/sofija-iztok/tristaen/5924936/?sid=gFM8jD&page=12,12.0,2025-08-30 18:03:13.098114,https://www.imoti.net/bg/obiavi/r/prodava/sofia/?page=1&sid=gFM8jD,imoti.net,447,2025-08-30,,,Цена на /м2/:4 535EUR/8 869.46BGN, 129 м2,Етаж: 9 от 10
"продава Тристаен апартамент, 145 м2","Апартаментът се състои от 2 спални- към едната от спалните има прилежаща баня с WC и гардеробна; дневна с трапезария и кухненски бокс, 2 бани с WC;мокро помешение; входно антре със...",585000.0,BGN,False,продава,тристаен,София, Оборище,,АДРЕС Недвижими имоти АД,,https://www.imoti.net/bg/obiava/prodava/sofia/oborishte/tristaen/6010491/?sid=gFM8jD&page=12,18.0,2025-08-30 18:03:13.098550,https://www.imoti.net/bg/obiavi/r/prodava/sofia/?page=1&sid=gFM8jD,imoti.net,447,2025-08-30,,,Цена на /м2/:4 034EUR/7 890.76BGN, 145 м2,Етаж: 9 от 14
