raw_title,raw_description,price,currency,without_dds,offer_type,property_type,city,neighborhood,contact_info,agency,agency_url,details_url,num_photos,date_time_added,search_url,site,total_offers,date,ref_no,time,price_per_m2,area,floor
"продава Тристаен апартамент, 118 м2","Продава се тристаен апартамент в близост до кръстовището на ул.Оборище и  ул.ЧерковнаРазпределение: просторна дневна, две отделни спални , самостоятелна кухня , баня с тоалетна,...",440000.0,EUR,False,продава,тристаен,София, Оборище,,Глобъл Сървисиз,,https://www.imoti.net/bg/obiava/prodava/sofia/oborishte/tristaen/5853894/?sid=gFM8jD&page=7,15.0,2025-07-02 06:03:24.001977,https://www.imoti.net/bg/obiavi/r/prodava/sofia/?page=1&sid=gFM8jD,imoti.net,289,2025-07-02,,,Цена на /м2/:3 729EUR, 118 м2,Етаж: 4 от 7
"продава Тристаен апартамент, 106 м2","Unique Estates представя изключително стилен и напълно обновен тристаен апартамент, разположен в една от най-предпочитаните и престижни части на кв. Оборище, на крачки от...",444000.0,EUR,False,продава,тристаен,София, Оборище,,ЮНИК ЕСТЕЙТС,,https://www.imoti.net/bg/obiava/prodava/sofia/oborishte/tristaen/6062202/?sid=gFM8jD&page=7,8.0,2025-07-02 06:03:24.002394,https://www.imoti.net/bg/obiavi/r/prodava/sofia/?page=1&sid=gFM8jD,imoti.net,289,2025-07-02,,,Цена на /м2/:4 189EUR, 106 м2,Етаж: 4 от 4
"продава Тристаен апартамент, 118 м2","ИРИДА НЕДВИЖИМИ ИМОТИ предлага за продажба прекрасен тристаен апартамент в район Оборище. Имотът се намира в новостроящ се затворен комплекс в близост до парк Заимов пл.  Св. Александър Невски ,...",445000.0,EUR,False,продава,тристаен,София, Оборище,,ИРИДА НЕДВИЖИМИ ИМОТИ,,https://www.imoti.net/bg/obiava/prodava--v-stroej/sofia/oborishte/tristaen/6071657/?sid=gFM8jD&page=7,2.0,2025-07-02 06:03:24.002925,https://www.imoti.net/bg/obiavi/r/prodava/sofia/?page=1&sid=gFM8jD,imoti.net,289,2025-07-02,,,Цена на /м2/:3 771EUR, 118 м2,Етаж: 5 от 12
"продава Тристаен апартамент, 135 м2","ИРИДА НЕДВИЖИМИ ИМОТИ продава слънчев тристаен апартамент в новоизграждащ се затворен жилищен комплекс, с изключително висококачествено строителство от доказан инвеститор на комуникативно място, в...",447750.0,EUR,False,продава,тристаен,София, Оборище,,ИРИДА НЕДВИЖИМИ ИМОТИ,,https://www.imoti.net/bg/obiava/prodava--v-stroej/sofia/oborishte/tristaen/6045932/?sid=gFM8jD&page=7,5.0,2025-07-02 06:03:24.003403,https://www.imoti.net/bg/obiavi/r/prodava/sofia/?page=1&sid=gFM8jD,imoti.net,289,2025-07-02,,,Цена на /м2/:3 317EUR, 135 м2,Етаж: 9 от 14
"продава Тристаен апартамент, 140 м2","Unique Estates представя на Вашето внимание слънчев апартамент за продажба, намиращ се в район Оборище. Имотът е изключително просторен с отлично...",450000.0,EUR,False,продава,тристаен,София, Оборище,,ЮНИК ЕСТЕЙТС,,https://www.imoti.net/bg/obiava/prodava/sofia/oborishte/tristaen/5876985/?sid=gFM8jD&page=7,6.0,2025-07-02 06:03:24.003851,https://www.imoti.net/bg/obiavi/r/prodava/sofia/?page=1&sid=gFM8jD,imoti.net,289,2025-07-02,,,Цена на /м2/:3 214EUR, 140 м2,Етаж: 6 от 9
"продава Четиристаен апартамент, 138 м2","Предлагаме за продажба напълно обзаведен многостаен апартамент в кв. Редута, на ул. „Стоил Войвода”. Районът е богато озеленен и осигурява спокойна и приятна жилищна атмосфера, същевременно...",450000.0,EUR,False,продава,четиристаен,София, Редута,,SUPRIMMO,,https://www.imoti.net/bg/obiava/prodava--v-stroej/sofia/reduta/chetiristaen/6062586/?sid=gFM8jD&page=7,15.0,2025-07-02 06:03:24.004265,https://www.imoti.net/bg/obiavi/r/prodava/sofia/?page=1&sid=gFM8jD,imoti.net,289,2025-07-02,,,Цена на /м2/:3 261EUR, 138 м2,Етаж:  от 4
"продава Четиристаен апартамент, 137 м2","Начален етап на строителство!!!ИРИДА НЕДВИЖИМИ ИМОТИ продава четиристаен апартамент в новоизграждаща се сграда, с изключително висококачествено строителство от доказан инвеститор на...",450565.0,EUR,False,продава,четиристаен,София, Дианабад,,ИРИДА НЕДВИЖИМИ ИМОТИ,,https://www.imoti.net/bg/obiava/prodava--v-stroej/sofia/dianabad/chetiristaen/6082477/?sid=gFM8jD&page=7,2.0,2025-07-02 06:03:24.004751,https://www.imoti.net/bg/obiavi/r/prodava/sofia/?page=1&sid=gFM8jD,imoti.net,289,2025-07-02,,,Цена на /м2/:3 289EUR, 137 м2,Етаж: 7 от 7
"продава Многостаен апартамент, 137 м2","Начален етап на строителство!!!ИРИДА НЕДВИЖИМИ ИМОТИ продава четиристаен апартамент в новоизграждаща се сграда, с изключително висококачествено строителство от доказан инвеститор на...",450565.0,EUR,False,продава,многостаен,София, Дианабад,,ИРИДА НЕДВИЖИМИ ИМОТИ,,https://www.imoti.net/bg/obiava/prodava--v-stroej/sofia/dianabad/mnogostaen/6082478/?sid=gFM8jD&page=7,2.0,2025-07-02 06:03:24.005224,https://www.imoti.net/bg/obiavi/r/prodava/sofia/?page=1&sid=gFM8jD,imoti.net,289,2025-07-02,,,Цена на /м2/:3 289EUR, 137 м2,Етаж: 7 от 7
"продава Двустаен апартамент, 168 м2","Фърст Естейтс има удоволствието да Ви представи отлично завършен луксозен пентхаус в Голф Резорт в сърцето на Европа.Тези жилищни имоти идеално се вписват в идеята за инвестиционен имот,...",452900.0,EUR,False,продава,двустаен,София, Оборище,,First Estates,,https://www.imoti.net/bg/obiava/prodava/sofia/oborishte/dvustaen/5958485/?sid=gFM8jD&page=7,12.0,2025-07-02 06:03:24.005720,https://www.imoti.net/bg/obiavi/r/prodava/sofia/?page=1&sid=gFM8jD,imoti.net,289,2025-07-02,,,Цена на /м2/:2 696EUR, 168 м2,Етаж: 0 от 2
"продава Четиристаен апартамент, 195 м2",,456225.0,EUR,False,продава,четиристаен,София, Оборище,,New Estates,,https://www.imoti.net/bg/obiava/prodava--v-stroej/sofia/oborishte/chetiristaen/6027030/?sid=gFM8jD&page=7,17.0,2025-07-02 06:03:24.006140,https://www.imoti.net/bg/obiavi/r/prodava/sofia/?page=1&sid=gFM8jD,imoti.net,289,2025-07-02,,,Цена на /м2/:2 340EUR, 195 м2,Етаж: 8 от 14
"продава Мезонет, 266 м2",".  .  .  .  .  .  .  .  .  .  .  .  .  .  . ЩЕ .  .  .  .  .  .  .  .  .  .  .  .  .  .  .  .  .  .  .  . Ви предложим УНИКАЛЕН като МЕСТОПОЛОЖЕНИЕ, внушителен като полезна използваема площ и...",457520.0,EUR,False,продава,мезонет,София, Изток,,АРСЕНАЛ - недвижими имоти,,https://www.imoti.net/bg/obiava/prodava/sofia/sofija-iztok/mezonet/3523449/?sid=gFM8jD&page=7,12.0,2025-07-02 06:03:24.006556,https://www.imoti.net/bg/obiavi/r/prodava/sofia/?page=1&sid=gFM8jD,imoti.net,289,2025-07-02,,,Цена на /м2/:1 720EUR, 266 м2,Етаж: 4 от 5
"продава Тристаен апартамент, 166 м2","Явлена-Изток представя тристаен апартамент в квартал Редута, на комуникативно място и добра локация. ПРЕД АКТ 16! Апартамента е непреходен, със северозападно изложение, на четвърти етаж. Голяма...",465000.0,EUR,False,продава,тристаен,София, Редута,,Явлена Изток,,https://www.imoti.net/bg/obiava/prodava/sofia/reduta/tristaen/6031549/?sid=gFM8jD&page=7,7.0,2025-07-02 06:03:24.006991,https://www.imoti.net/bg/obiavi/r/prodava/sofia/?page=1&sid=gFM8jD,imoti.net,289,2025-07-02,,,Цена на /м2/:2 801EUR, 166 м2,Етаж: 4 от 8
"продава Тристаен апартамент, 138 м2","БЕЗ КОМИСИОННА! Предлагаме тристаен апартамент в новостроящ се бутиков жилищен комплекс, близо до метростанция 'Театрална' и парк 'Заимов'. Имотът е на етаж 7 от 14 с обща площ 138.55 кв.м и чиста...",465540.0,EUR,False,продава,тристаен,София, Оборище,,Бг Брокер,,https://www.imoti.net/bg/obiava/prodava/sofia/oborishte/tristaen/5814591/?sid=gFM8jD&page=7,6.0,2025-07-02 06:03:24.007402,https://www.imoti.net/bg/obiavi/r/prodava/sofia/?page=1&sid=gFM8jD,imoti.net,289,2025-07-02,,,Цена на /м2/:3 373EUR, 138 м2,Етаж: 7 от 14
"продава Многостаен апартамент, 120 м2","Титан Пропъртис - офис Черни връх има удоволствието да ви престави многостаен апартамент , в един от най - предпочитаните райони на град София , а именно район Оборище - комуникативно място , в...",470000.0,EUR,False,продава,многостаен,София, Оборище,,Титан пропъртис продажби,,https://www.imoti.net/bg/obiava/prodava/sofia/oborishte/mnogostaen/5898604/?sid=gFM8jD&page=7,10.0,2025-07-02 06:03:24.007825,https://www.imoti.net/bg/obiavi/r/prodava/sofia/?page=1&sid=gFM8jD,imoti.net,289,2025-07-02,,,Цена на /м2/:3 917EUR, 120 м2,Етаж: 5 от 6
"продава Тристаен апартамент, 144 м2","ИРИДА НЕДВИЖИМИ ИМОТИ продава слънчев тристаен апартамент в новоизграждащ се затворен жилищен комплекс, с изключително висококачествено строителство от доказан инвеститор на комуникативно място, в...",472200.0,EUR,False,продава,тристаен,София, Оборище,,ИРИДА НЕДВИЖИМИ ИМОТИ,,https://www.imoti.net/bg/obiava/prodava--v-stroej/sofia/oborishte/tristaen/5909423/?sid=gFM8jD&page=8,1.0,2025-07-02 06:03:28.422427,https://www.imoti.net/bg/obiavi/r/prodava/sofia/?page=1&sid=gFM8jD,imoti.net,289,2025-07-02,,,Цена на /м2/:3 279EUR, 144 м2,Етаж: 7 от 14
"продава Тристаен апартамент, 148 м2","ИРИДА НЕДВИЖИМИ ИМОТИ продава слънчев тристаен апартамент в новоизграждащ се затворен жилищен комплекс, с изключително висококачествено строителство от доказан инвеститор на комуникативно място в...",485900.0,EUR,False,продава,тристаен,София, Оборище,,ИРИДА НЕДВИЖИМИ ИМОТИ,,https://www.imoti.net/bg/obiava/prodava--v-stroej/sofia/oborishte/tristaen/5909424/?sid=gFM8jD&page=8,1.0,2025-07-02 06:03:28.422974,https://www.imoti.net/bg/obiavi/r/prodava/sofia/?page=1&sid=gFM8jD,imoti.net,289,2025-07-02,,,Цена на /м2/:3 283EUR, 148 м2,Етаж: 7 от 14
"продава Тристаен апартамент, 147 м2","ИРИДА НЕДВИЖИМИ ИМОТИ продава слънчев тристаен апартамент в новоизграждащ се затворен жилищен комплекс, с изключително висококачествено строителство от доказан инвеститор на комуникативно място, в...",487500.0,EUR,False,продава,тристаен,София, Оборище,,ИРИДА НЕДВИЖИМИ ИМОТИ,,https://www.imoti.net/bg/obiava/prodava--v-stroej/sofia/oborishte/tristaen/6045931/?sid=gFM8jD&page=8,5.0,2025-07-02 06:03:28.423458,https://www.imoti.net/bg/obiavi/r/prodava/sofia/?page=1&sid=gFM8jD,imoti.net,289,2025-07-02,,,Цена на /м2/:3 316EUR, 147 м2,Етаж: 9 от 14
"продава Тристаен апартамент, 129 м2","First Estates има огромното удоволствие да Ви представи най-новия луксозен жилищен комплекс, сгушен до парка Заимов в сърцето на града. Този изключителен проект предефинира градския живот, като...",493500.0,EUR,False,продава,тристаен,София, Оборище,,First Estates,,https://www.imoti.net/bg/obiava/prodava/sofia/oborishte/tristaen/5808436/?sid=gFM8jD&page=8,15.0,2025-07-02 06:03:28.423947,https://www.imoti.net/bg/obiavi/r/prodava/sofia/?page=1&sid=gFM8jD,imoti.net,289,2025-07-02,,,Цена на /м2/:3 826EUR, 129 м2,Етаж: 8 от 14
"продава Тристаен апартамент, 200 м2","Тристайният апартамент, който представяме за продажба е част от нова бурикова сграда в кв.""Оборище"". Имотът е подходящ за лично позване или отадване под наем като жилище или офис пространство....",500000.0,EUR,False,продава,тристаен,София, Оборище,,SUPRIMMO,,https://www.imoti.net/bg/obiava/prodava--v-stroej/sofia/oborishte/tristaen/5868552/?sid=gFM8jD&page=8,7.0,2025-07-02 06:03:28.424371,https://www.imoti.net/bg/obiavi/r/prodava/sofia/?page=1&sid=gFM8jD,imoti.net,289,2025-07-02,,,Цена на /м2/:2 500EUR, 200 м2,Етаж:  от 5
"продава Тристаен апартамент, 142 м2","First Estates има огромното удоволствие да Ви представи най-новия луксозен жилищен комплекс, сгушен до парка Заимов в сърцето на града. Този изключителен проект предефинира градския живот, като...",509820.0,EUR,False,продава,тристаен,София, Оборище,,First Estates,,https://www.imoti.net/bg/obiava/prodava/sofia/oborishte/tristaen/5869794/?sid=gFM8jD&page=8,15.0,2025-07-02 06:03:28.424853,https://www.imoti.net/bg/obiavi/r/prodava/sofia/?page=1&sid=gFM8jD,imoti.net,289,2025-07-02,,,Цена на /м2/:3 590EUR, 142 м2,Етаж: 10 от 14
"продава Четиристаен апартамент, 155 м2","Без комисионна! Цена на инвеститор! Ера Младост представя сложен и взискателен жилищен комплекс с Централна локация продиктувана от няколко ключови изисквания за проекта:Градски силует,...",519850.0,EUR,False,продава,четиристаен,София, Оборище,,ERA Младост,,https://www.imoti.net/bg/obiava/prodava--v-stroej/sofia/oborishte/chetiristaen/6027247/?sid=gFM8jD&page=8,6.0,2025-07-02 06:03:28.425276,https://www.imoti.net/bg/obiavi/r/prodava/sofia/?page=1&sid=gFM8jD,imoti.net,289,2025-07-02,,,Цена на /м2/:3 354EUR, 155 м2,Етаж: 10 от 14
"продава Тристаен апартамент, 127 м2","Представяме луксозен тристаен апартамент в една от емблематичните сгради в столицата, на топ локация до метростанция ""Г.М. Димитров"". Близо до ключов голям булевард ""Г.М. Димитров"", в сърцето на...",520000.0,EUR,False,продава,тристаен,София, Дианабад,,Luximmo Finest Estates,,https://www.imoti.net/bg/obiava/prodava--v-stroej/sofia/dianabad/tristaen/6080716/?sid=gFM8jD&page=8,40.0,2025-07-02 06:03:28.425756,https://www.imoti.net/bg/obiavi/r/prodava/sofia/?page=1&sid=gFM8jD,imoti.net,289,2025-07-02,,,Цена на /м2/:4 094EUR, 127 м2,Етаж:  от 16
"продава Тристаен апартамент, 149 м2",Революшън Естейт има удоволствието да Ви представи просторен тристаен апартамент в ж.к. Изток.Основни характеристики на имота:- Площ: 149 кв.м.-...,530000.0,EUR,False,продава,тристаен,София, Изток,,Революшън Естейт България,,https://www.imoti.net/bg/obiava/prodava/sofia/sofija-iztok/tristaen/5986359/?sid=gFM8jD&page=8,11.0,2025-07-02 06:03:28.426190,https://www.imoti.net/bg/obiavi/r/prodava/sofia/?page=1&sid=gFM8jD,imoti.net,289,2025-07-02,,,Цена на /м2/:3 557EUR, 149 м2,Етаж: 3 от 4
"продава Четиристаен апартамент, 180 м2","БЕЗ КОМИСИОННА ОТ КУПУВАЧА! Galiano Estates има удоволствието да ви представи уникален четиристаен апартамент в затворен комплекс ""Teatralna Park Residence"" в кв. Оборище до парк ""Заимов"" и...",531700.0,EUR,False,продава,четиристаен,София, Оборище,,Galiano Estates,,https://www.imoti.net/bg/obiava/prodava/sofia/oborishte/chetiristaen/5852954/?sid=gFM8jD&page=8,6.0,2025-07-02 06:03:28.426656,https://www.imoti.net/bg/obiavi/r/prodava/sofia/?page=1&sid=gFM8jD,imoti.net,289,2025-07-02,,,Цена на /м2/:2 954EUR, 180 м2,Етаж: 3 от 14
"продава Четиристаен апартамент, 176 м2","ИРИДА НЕДВИЖИМИ ИМОТИ продава слънчев четиристаен апартамент в новоизграждащ се затворен жилищен комплекс, с изключително висококачествено строителство от доказан инвеститор на комуникативно място...",531700.0,EUR,False,продава,четиристаен,София, Оборище,,ИРИДА НЕДВИЖИМИ ИМОТИ,,https://www.imoti.net/bg/obiava/prodava--v-stroej/sofia/oborishte/chetiristaen/5909982/?sid=gFM8jD&page=8,1.0,2025-07-02 06:03:28.427134,https://www.imoti.net/bg/obiavi/r/prodava/sofia/?page=1&sid=gFM8jD,imoti.net,289,2025-07-02,,,Цена на /м2/:3 021EUR, 176 м2,Етаж: 3 от 14
"продава Четиристаен апартамент, 178 м2","ИРИДА НЕДВИЖИМИ ИМОТИ продава слънчев четиристаен апартамент в новоизграждащ се затворен жилищен комплекс, с изключително висококачествено строителство от доказан инвеститор на комуникативно място...",532800.0,EUR,False,продава,четиристаен,София, Оборище,,ИРИДА НЕДВИЖИМИ ИМОТИ,,https://www.imoti.net/bg/obiava/prodava--v-stroej/sofia/oborishte/chetiristaen/6045939/?sid=gFM8jD&page=8,4.0,2025-07-02 06:03:28.427604,https://www.imoti.net/bg/obiavi/r/prodava/sofia/?page=1&sid=gFM8jD,imoti.net,289,2025-07-02,,,Цена на /м2/:2 993EUR, 178 м2,Етаж: 7 от 14
"продава Двустаен апартамент, 96 м2","За повече информация свържете се с нас и цитирайте референтния номер на имота. Моля, кажете, че сте видeли обявата в imoti.net.Референтен номер: Sfa 87396Тел: 0882 817...",533005.0,EUR,False,продава,двустаен,София, Изток,,BULGARIAN PROPERTIES,,https://www.imoti.net/bg/obiava/prodava--v-stroej/sofia/sofija-iztok/dvustaen/6084973/?sid=gFM8jD&page=8,20.0,2025-07-02 06:03:28.428092,https://www.imoti.net/bg/obiavi/r/prodava/sofia/?page=1&sid=gFM8jD,imoti.net,289,2025-07-02,,,Цена на /м2/:5 552EUR, 96 м2,Етаж: 1 от 7
"продава Тристаен апартамент, 121 м2","Ексклузивно представяме една рядко срещана възможност за покупка на тристаен апартамент в престижния кв. ""Оборище"".Апартаментът се намира на топ локация на улица ""Буная"" №14, само на...",535000.0,EUR,False,продава,тристаен,София, Оборище,,Luximmo Finest Estates,,https://www.imoti.net/bg/obiava/prodava--v-stroej/sofia/oborishte/tristaen/6066001/?sid=gFM8jD&page=8,28.0,2025-07-02 06:03:28.428583,https://www.imoti.net/bg/obiavi/r/prodava/sofia/?page=1&sid=gFM8jD,imoti.net,289,2025-07-02,,,Цена на /м2/:4 421EUR, 121 м2,Етаж:  от 6
"продава Четиристаен апартамент, 183 м2","ИРИДА НЕДВИЖИМИ ИМОТИ продава слънчев четиристаен апартамент в новоизграждащ се затворен жилищен комплекс, с изключително висококачествено строителство от доказан инвеститор на комуникативно място...",539700.0,EUR,False,продава,четиристаен,София, Оборище,,ИРИДА НЕДВИЖИМИ ИМОТИ,,https://www.imoti.net/bg/obiava/prodava--v-stroej/sofia/oborishte/chetiristaen/6045938/?sid=gFM8jD&page=8,4.0,2025-07-02 06:03:28.429073,https://www.imoti.net/bg/obiavi/r/prodava/sofia/?page=1&sid=gFM8jD,imoti.net,289,2025-07-02,,,Цена на /м2/:2 949EUR, 183 м2,Етаж: 6 от 14
"продава Четиристаен апартамент, 190 м2","Представяме ви затворен комплекс в престижния квартал Оборище, на метри от парк ""Заимов"". Архитектурният проект предлага за продажба 277 двустайни, тристайни, четиристайни, многостайни апартаменти...",544290.0,EUR,False,продава,четиристаен,София, Оборище,,Luximmo Finest Estates,,https://www.imoti.net/bg/obiava/prodava--v-stroej/sofia/oborishte/chetiristaen/5719706/?sid=gFM8jD&page=8,14.0,2025-07-02 06:03:28.429547,https://www.imoti.net/bg/obiavi/r/prodava/sofia/?page=1&sid=gFM8jD,imoti.net,289,2025-07-02,,,Цена на /м2/:2 865EUR, 190 м2,Етаж:  от 14
"продава Тристаен апартамент, 131 м2","Вдъхновяващият тристаен апартамент в престижната сграда ""Диамант"" на Артекс представлява уникална комбинация от изисканост, модерен дизайн и лукс. С впечатляващ изглед от високият етаж, този дом...",548000.0,EUR,False,продава,тристаен,София, Изгрев,,Явлена София,,https://www.imoti.net/bg/obiava/prodava/sofia/sofija-izgrev/tristaen/6050563/?sid=gFM8jD&page=8,13.0,2025-07-02 06:03:28.430026,https://www.imoti.net/bg/obiavi/r/prodava/sofia/?page=1&sid=gFM8jD,imoti.net,289,2025-07-02,,,Цена на /м2/:4 183EUR, 131 м2,Етаж: 16 от 16
"продава Тристаен апартамент, 220 м2","ЕРА Фамилия има удоволствието да ви представи тристаен апартамент ( N  504 ), разположен на пети последен в нова  сграда с АКТ 16 . Сградата е на шест етажа с подземен гараж.За имота:...",550000.0,EUR,False,продава,тристаен,София, Дианабад,,ЕРА Фамилия,,https://www.imoti.net/bg/obiava/prodava/sofia/dianabad/tristaen/5944340/?sid=gFM8jD&page=8,10.0,2025-07-02 06:03:28.430456,https://www.imoti.net/bg/obiavi/r/prodava/sofia/?page=1&sid=gFM8jD,imoti.net,289,2025-07-02,,,Цена на /м2/:2 500EUR, 220 м2,Етаж: 5 от 5
