raw_title,raw_description,price,currency,without_dds,offer_type,property_type,city,neighborhood,contact_info,agency,agency_url,details_url,num_photos,date_time_added,search_url,site,total_offers,date,ref_no,time,price_per_m2,area,floor
"продава Двустаен апартамент, 89 м2","ЕРА Младост предлага двустаен апартамент №304 на 3 етаж над магазини в малка  - 5 етажна сграда с 16 апартамента. Апартаментът е с изложение изток-север и следното разпределение: Дневна с кухня,...",230000.0,EUR,False,продава,двустаен,София, Дианабад,,ERA Младост,,https://www.imoti.net/bg/obiava/prodava/sofia/dianabad/dvustaen/6086475/?sid=gFM8jD&page=3,9.0,2025-07-02 06:03:07.132256,https://www.imoti.net/bg/obiavi/r/prodava/sofia/?page=1&sid=gFM8jD,imoti.net,289,2025-07-02,,,Цена на /м2/:2 584EUR, 89 м2,Етаж: 3 от 5
"продава Двустаен апартамент, 80 м2","АБ ИМОТИ КОНСУЛТ продава двустаен апартамент в сграда с Акт 16 от 2003 г. Намира се на бул. Драган Цанков до КАТ. Метростанция  Г. М. Димитров  е съвсем близо, също близо са и множество други...",230000.0,EUR,False,продава,двустаен,София, Изток,,АБ ИМОТИ КОНСУЛТ,,https://www.imoti.net/bg/obiava/prodava/sofia/sofija-iztok/dvustaen/6058391/?sid=gFM8jD&page=3,12.0,2025-07-02 06:03:07.132674,https://www.imoti.net/bg/obiavi/r/prodava/sofia/?page=1&sid=gFM8jD,imoti.net,289,2025-07-02,,,Цена на /м2/:2 875EUR, 80 м2,Етаж: 6 от 9
"продава Двустаен апартамент, 62 м2","ИРИДА НЕДВИЖИМИ ИМОТИ Ви предлага за продажба обзаведен двустаен апартамент в кв. Редута.Жилището е с чиста застроена площ от 55,80 кв.м. Разположен на трети жилищен етаж от седем....",230000.0,EUR,False,продава,двустаен,София, Редута,,ИРИДА НЕДВИЖИМИ ИМОТИ,,https://www.imoti.net/bg/obiava/prodava--v-stroej/sofia/reduta/dvustaen/6083327/?sid=gFM8jD&page=3,5.0,2025-07-02 06:03:07.133159,https://www.imoti.net/bg/obiavi/r/prodava/sofia/?page=1&sid=gFM8jD,imoti.net,289,2025-07-02,,,Цена на /м2/:3 710EUR, 62 м2,Етаж: 3 от 7
"продава Тристаен апартамент, 111 м2","МЕТРО!ТИШИНА!ЕЛЕГАНТНОСТ!ПРЕДПРОДАЖБА!СКОРО ОТНОВО ЩЕ ВДИГНЕМ ЦЕНАТА, ПОБЪРЗАЙТЕ!ВЕЧЕ 60% ОТ ЖИЛИЩАТА СА ЗАКУПЕНИ!Уникален мини...",233100.0,EUR,False,продава,тристаен,София, Подуене,,Елеганс Естейт,,https://www.imoti.net/bg/obiava/prodava--v-stroej/sofia/poduene/tristaen/5982551/?sid=gFM8jD&page=3,2.0,2025-07-02 06:03:07.133594,https://www.imoti.net/bg/obiavi/r/prodava/sofia/?page=1&sid=gFM8jD,imoti.net,289,2025-07-02,,,Цена на /м2/:2 100EUR, 111 м2,Етаж: 4 от 6
"продава Двустаен апартамент, 66 м2",Явлена    Изток    продава    двустаен  апартамент      в    ж.к.    Дианабад  в   нова  тухлена  сграда  от  2013  година находящ  се  на втори  етаж  .    Апартаментът     е    напълно...,233900.0,EUR,False,продава,двустаен,София, Дианабад,,Явлена Изток,,https://www.imoti.net/bg/obiava/prodava/sofia/dianabad/dvustaen/6057637/?sid=gFM8jD&page=3,11.0,2025-07-02 06:03:07.134025,https://www.imoti.net/bg/obiavi/r/prodava/sofia/?page=1&sid=gFM8jD,imoti.net,289,2025-07-02,,,Цена на /м2/:3 544EUR, 66 м2,Етаж: 2 от 8
"продава Тристаен апартамент, 107 м2","БЕЗ КОМИСИОН ОТ КУПУВАЧ!Предлагаме тристаен апартамент в новострояща се жилищна сграда с два входа, находяща се в кв. Подуяне, на 3 мин от метростанция Хаджи Димитър и на 13 мин....",234674.0,EUR,False,продава,тристаен,София, Подуене,,Бг Брокер,,https://www.imoti.net/bg/obiava/prodava/sofia/poduene/tristaen/6071113/?sid=gFM8jD&page=3,6.0,2025-07-02 06:03:07.134482,https://www.imoti.net/bg/obiavi/r/prodava/sofia/?page=1&sid=gFM8jD,imoti.net,289,2025-07-02,,,Цена на /м2/:2 193EUR, 107 м2,Етаж: 5 от 9
"продава Двустаен апартамент, 106 м2","Ера Тера продава двустаен апартамент- А10 с площ 106.67 кв.м., намиращ се на шести жилищен етаж, състоящ се от: дневна, две спални, баня с тоалетна, тоалетна, антре, склад и балкон. Имотът се...",234674.0,EUR,False,продава,двустаен,София, Суха Река,,ERA TERA,,https://www.imoti.net/bg/obiava/prodava--v-stroej/sofia/suha-reka/dvustaen/5725298/?sid=gFM8jD&page=3,2.0,2025-07-02 06:03:07.134923,https://www.imoti.net/bg/obiavi/r/prodava/sofia/?page=1&sid=gFM8jD,imoti.net,289,2025-07-02,,,Цена на /м2/:2 214EUR, 106 м2,Етаж: 6 от 9
"продава Двустаен апартамент, 89 м2","Galardo Real Estate ви представя двустаен апартамент с АКТ 16, разположен в нова сграда, в близост до хотел Вега.Апартаментът е разположен на на четвърти етаж.Жилището е просторно и...",235000.0,EUR,False,продава,двустаен,София, Дианабад,,Galardo Real Estate,,https://www.imoti.net/bg/obiava/prodava/sofia/dianabad/dvustaen/6041668/?sid=gFM8jD&page=3,12.0,2025-07-02 06:03:07.135400,https://www.imoti.net/bg/obiavi/r/prodava/sofia/?page=1&sid=gFM8jD,imoti.net,289,2025-07-02,,,Цена на /м2/:2 640EUR, 89 м2,Етаж: 4 от 5
"продава Двустаен апартамент, 89 м2","ЕРА Младост предлага двустаен апартамент №403 на 4 етаж над магазини в малка  - 5 етажна сграда с 16 апартамента. Апартаментът е с изложение запад - изток и следното разпределение: Дневна с кухня,...",235000.0,EUR,False,продава,двустаен,София, Дианабад,,ERA Младост,,https://www.imoti.net/bg/obiava/prodava/sofia/dianabad/dvustaen/6086474/?sid=gFM8jD&page=3,9.0,2025-07-02 06:03:07.135846,https://www.imoti.net/bg/obiavi/r/prodava/sofia/?page=1&sid=gFM8jD,imoti.net,289,2025-07-02,,,Цена на /м2/:2 640EUR, 89 м2,Етаж: 4 от 5
"продава Тристаен апартамент, 86 м2","Представяме ви просторен тристаен апартамент с изцяло подменени ел. и ВиК инсталации. Жилището е подготвено за финални довършителни работи – готово за полагане на настилки, гипсокартон и санитария...",235000.0,EUR,False,продава,тристаен,София, Суха Река,,New Estates,,https://www.imoti.net/bg/obiava/prodava--v-stroej/sofia/suha-reka/tristaen/6038096/?sid=gFM8jD&page=3,5.0,2025-07-02 06:03:07.136258,https://www.imoti.net/bg/obiavi/r/prodava/sofia/?page=1&sid=gFM8jD,imoti.net,289,2025-07-02,,,Цена на /м2/:2 733EUR, 86 м2,Етаж: 5 от 11
"продава Тристаен апартамент, 76 м2",Агенция за недвижими имоти 'Имотен Център България' Ви представя тристаен апартамент в един от най-предпочитаните квартали за живеен в столицата - Дианабад- Разпределение на имота:...,235000.0,EUR,False,продава,тристаен,София, Дианабад,,Имотен център България 2021,,https://www.imoti.net/bg/obiava/prodava/sofia/dianabad/tristaen/6080863/?sid=gFM8jD&page=3,10.0,2025-07-02 06:03:07.136753,https://www.imoti.net/bg/obiavi/r/prodava/sofia/?page=1&sid=gFM8jD,imoti.net,289,2025-07-02,,,Цена на /м2/:3 092EUR, 76 м2,Етаж: 5 от 8
"продава Двустаен апартамент, 48 м2",ИРИДА НЕДВИЖИМИ ИМОТИ Ви предлага за продажба обзаведен двустаен апартамент в кв. Оборище . Разположен на четвърти жилищен етаж от четири .Намира се в непосредствена близост до детски...,235000.0,EUR,False,продава,двустаен,София, Оборище,,ИРИДА НЕДВИЖИМИ ИМОТИ,,https://www.imoti.net/bg/obiava/prodava--v-stroej/sofia/oborishte/dvustaen/6089416/?sid=gFM8jD&page=3,8.0,2025-07-02 06:03:07.137233,https://www.imoti.net/bg/obiavi/r/prodava/sofia/?page=1&sid=gFM8jD,imoti.net,289,2025-07-02,,,Цена на /м2/:4 896EUR, 48 м2,Етаж: 4 от 4
"продава Тристаен апартамент, 118 м2","Агенция Явлена ви представя тристаен апартамент за продажба ново строителство, разположено в тих и удобен и комуникативен район. Жилището включва входно антре, просторна дневна с кухненски бокс и...",236000.0,EUR,False,продава,тристаен,София, Дианабад,,Явлена Изток,,https://www.imoti.net/bg/obiava/prodava/sofia/dianabad/tristaen/6050108/?sid=gFM8jD&page=3,8.0,2025-07-02 06:03:07.137731,https://www.imoti.net/bg/obiavi/r/prodava/sofia/?page=1&sid=gFM8jD,imoti.net,289,2025-07-02,,,Цена на /м2/:2 000EUR, 118 м2,Етаж: 2 от 7
"продава Тристаен апартамент, 77 м2","Начален етап на строителство!!!ИРИДА НЕДВИЖИМИ ИМОТИ продава маломерен тристаен апартамент в новоизграждаща се сграда, с изключително висококачествено строителство от доказан...",237030.0,EUR,False,продава,тристаен,София, Дианабад,,ИРИДА НЕДВИЖИМИ ИМОТИ,,https://www.imoti.net/bg/obiava/prodava--v-stroej/sofia/dianabad/tristaen/6082474/?sid=gFM8jD&page=3,2.0,2025-07-02 06:03:07.138214,https://www.imoti.net/bg/obiavi/r/prodava/sofia/?page=1&sid=gFM8jD,imoti.net,289,2025-07-02,,,Цена на /м2/:3 078EUR, 77 м2,Етаж: 4 от 7
"продава Двустаен апартамент, 63 м2","Агенция за недвижими имоти ""First Estates"" с удоволствие представя двустаен апартамент в иновативна жилищна сграда, първата в България, която ще бъде сертифицирана по международния стандарт за...",240000.0,EUR,False,продава,двустаен,София, Изгрев,,First Estates,,https://www.imoti.net/bg/obiava/prodava/sofia/sofija-izgrev/dvustaen/5958471/?sid=gFM8jD&page=3,8.0,2025-07-02 06:03:07.138681,https://www.imoti.net/bg/obiavi/r/prodava/sofia/?page=1&sid=gFM8jD,imoti.net,289,2025-07-02,,,Цена на /м2/:3 810EUR, 63 м2,Етаж: 3 от 8
"продава Двустаен апартамент, 85 м2",Просторен 2ст апартамент напълно завършен и обзаведен в добре поддържана сграда на тихо и спокойно място и същевременно на централна локация до бул. Дондуков и в близост до Народното...,240000.0,EUR,False,продава,двустаен,София, Оборище,,Глобъл Сървисиз,,https://www.imoti.net/bg/obiava/prodava/sofia/oborishte/dvustaen/5946872/?sid=gFM8jD&page=3,17.0,2025-07-02 06:03:07.139112,https://www.imoti.net/bg/obiavi/r/prodava/sofia/?page=1&sid=gFM8jD,imoti.net,289,2025-07-02,,,Цена на /м2/:2 824EUR, 85 м2,Етаж: 4 от 6
"продава Двустаен апартамент, 64 м2","БЕЗ КОМИСИОННА! Предлагаме двустаен апартамент в новостроящ се бутиков жилищен комплекс, близо до метростанция 'Театрална' и парк 'Заимов'. Имотът е на етаж 12 от 14 с обща площ 64.32 кв.м и чиста...",246480.0,EUR,False,продава,двустаен,София, Оборище,,Бг Брокер,,https://www.imoti.net/bg/obiava/prodava/sofia/oborishte/dvustaen/5814527/?sid=gFM8jD&page=3,9.0,2025-07-02 06:03:07.139527,https://www.imoti.net/bg/obiavi/r/prodava/sofia/?page=1&sid=gFM8jD,imoti.net,289,2025-07-02,,,Цена на /м2/:3 851EUR, 64 м2,Етаж: 12 от 14
"продава Мезонет, 148 м2","Открийте мястото, където ще се чувствате у дома от първия момент.Титан Пропъртис с радост предлага на Вашето внимание мезонет, разположен в квартал Сухата река, София. Сградата е...",247000.0,EUR,False,продава,мезонет,София, Суха Река,,Титан Пропъртис,,https://www.imoti.net/bg/obiava/prodava/sofia/suha-reka/mezonet/6077192/?sid=gFM8jD&page=3,2.0,2025-07-02 06:03:07.139960,https://www.imoti.net/bg/obiavi/r/prodava/sofia/?page=1&sid=gFM8jD,imoti.net,289,2025-07-02,,,Цена на /м2/:1 669EUR, 148 м2,Етаж: 8 от 9
"продава Тристаен апартамент, 70 м2","New Estates представя тристаен апартамент в новострояща се жилищна сграда, която се намира на едно от най-комуникативните места в София.Централното, но същевременно тихо и спокойно...",248840.0,EUR,False,продава,тристаен,София, Подуене,,New Estates,,https://www.imoti.net/bg/obiava/prodava--v-stroej/sofia/poduene/tristaen/6044479/?sid=gFM8jD&page=3,6.0,2025-07-02 06:03:07.140377,https://www.imoti.net/bg/obiavi/r/prodava/sofia/?page=1&sid=gFM8jD,imoti.net,289,2025-07-02,,,Цена на /м2/:3 555EUR, 70 м2,Етаж: 2 от 9
"продава Двустаен апартамент, 66 м2","ИРИДА НЕДВИЖИМИ ИМОТИ предлага за продажба апартамент в кв. Дианадад .Имотът се намира в непосредствена близост до станция на метрото, училище, детска градина, различни магазини. Разположен...",249000.0,EUR,False,продава,двустаен,София, Дианабад,,ИРИДА НЕДВИЖИМИ ИМОТИ,,https://www.imoti.net/bg/obiava/prodava--v-stroej/sofia/dianabad/dvustaen/6058398/?sid=gFM8jD&page=3,9.0,2025-07-02 06:03:07.140856,https://www.imoti.net/bg/obiavi/r/prodava/sofia/?page=1&sid=gFM8jD,imoti.net,289,2025-07-02,,,Цена на /м2/:3 773EUR, 66 м2,Етаж: 2 от 8
"продава Тристаен апартамент, 104 м2","Предлагаме на Вашето внимание тристаен апартамент, разположен на трети етаж в модерна жилищна сграда в един от най-предпочитаните райони на столицата – кв. Редута. Имотът е с обща площ от 53.70...",249720.0,EUR,False,продава,тристаен,София, Редута,,Luximmo Finest Estates,,https://www.imoti.net/bg/obiava/prodava--v-stroej/sofia/reduta/tristaen/6070497/?sid=gFM8jD&page=3,4.0,2025-07-02 06:03:07.141330,https://www.imoti.net/bg/obiavi/r/prodava/sofia/?page=1&sid=gFM8jD,imoti.net,289,2025-07-02,,,Цена на /м2/:2 401EUR, 104 м2,Етаж:  от 6
"продава Четиристаен апартамент, 148 м2","Четиристаен апартамент 148 м2 в ж.к.Сухата река, на 300 м от метростанция Хаджи Димитър и бул.Мадрид. Доказан строител. Oтлична локация!Жилището е на две нива със застроена площ...",249900.0,EUR,False,продава,четиристаен,София, Суха Река,,Анети,,https://www.imoti.net/bg/obiava/prodava--v-stroej/sofia/suha-reka/chetiristaen/5912213/?sid=gFM8jD&page=3,1.0,2025-07-02 06:03:07.141766,https://www.imoti.net/bg/obiavi/r/prodava/sofia/?page=1&sid=gFM8jD,imoti.net,289,2025-07-02,,,Цена на /м2/:1 689EUR, 148 м2,Етаж: 8 от 8
"продава Тристаен апартамент, 85 м2","Номер на офертата в агенцията 13351. Предлага се просторен, светъл апартамент на ул.'Оборище' до МОЛ Сердика, ет.7 от 8 чиста площ 85кв.м.два просторни хола,спалня и отделно кухня, юг,изток,запад...",249990.0,EUR,False,продава,тристаен,София, Оборище,,Глобъл Сървисиз,,https://www.imoti.net/bg/obiava/prodava--v-stroej/sofia/oborishte/tristaen/5977959/?sid=gFM8jD&page=3,14.0,2025-07-02 06:03:07.142182,https://www.imoti.net/bg/obiavi/r/prodava/sofia/?page=1&sid=gFM8jD,imoti.net,289,2025-07-02,,,Цена на /м2/:2 941EUR, 85 м2,Етаж: 7 от 8
"продава Тристаен апартамент, 125 м2","Без комисионна от Купувача!!!Ара Естейт продава тристаен апартамент с площ 125.19 кв.м., намиращ се на шести етаж, състоящ се от: дневна, две спални , баня с тоалетна, тоалетна,...",250380.0,EUR,False,продава,тристаен,София, Суха Река,,АРА ЕСТЕЙТ,,https://www.imoti.net/bg/obiava/prodava/sofia/suha-reka/tristaen/5976356/?sid=gFM8jD&page=3,2.0,2025-07-02 06:03:07.142597,https://www.imoti.net/bg/obiavi/r/prodava/sofia/?page=1&sid=gFM8jD,imoti.net,289,2025-07-02,,,Цена на /м2/:2 003EUR, 125 м2,Етаж: 6 от 9
"продава Тристаен апартамент, 148 м2","Представяме нов мезонет с обща площ 148.06 кв.м за продажба, в бутикова жилищна сграда пред Акт 15 в София.Сградата се очаква да бъде готова до края на 2025 г....",251702.0,EUR,False,продава,тристаен,София, Суха Река,,Luximmo Finest Estates,,https://www.imoti.net/bg/obiava/prodava--v-stroej/sofia/suha-reka/tristaen/6045190/?sid=gFM8jD&page=4,6.0,2025-07-02 06:03:11.270743,https://www.imoti.net/bg/obiavi/r/prodava/sofia/?page=1&sid=gFM8jD,imoti.net,289,2025-07-02,,,Цена на /м2/:1 701EUR, 148 м2,Етаж:  от 9
"продава Тристаен апартамент, 80 м2","Тристаен панелен апартамент с две големи спални / едната е с преход през дневната /, тоалетна , склад, малка баня с тоалетна, дневна, кухня, тераса на юг към дневната. Чудесно ремонтиран преди...",252000.0,EUR,False,продава,тристаен,София, Изток,,АДРЕС Недвижими имоти АД,,https://www.imoti.net/bg/obiava/prodava/sofia/sofija-iztok/tristaen/6083560/?sid=gFM8jD&page=4,2.0,2025-07-02 06:03:11.271227,https://www.imoti.net/bg/obiavi/r/prodava/sofia/?page=1&sid=gFM8jD,imoti.net,289,2025-07-02,,,Цена на /м2/:3 150EUR, 80 м2,Етаж: 6 от 6
"продава Двустаен апартамент, 61 м2",Фърст Естейтс има удоволствието да Ви представи отлично завършен луксозент двустаен апартамент в Голф Резорт в сърцето на Европа.Имотът има размера и създава усещането на луксозен...,254900.0,EUR,False,продава,двустаен,София, Оборище,,First Estates,,https://www.imoti.net/bg/obiava/prodava/sofia/oborishte/dvustaen/5958487/?sid=gFM8jD&page=4,10.0,2025-07-02 06:03:11.271724,https://www.imoti.net/bg/obiavi/r/prodava/sofia/?page=1&sid=gFM8jD,imoti.net,289,2025-07-02,,,Цена на /м2/:4 179EUR, 61 м2,Етаж: 0 от 2
"продава Двустаен апартамент, 63 м2","First Estates има огромното удоволствие да Ви представи най-новия луксозен жилищен комплекс, сгушен до парка Заимов в сърцето на града. Този изключителен проект предефинира градския живот, като...",255324.0,EUR,False,продава,двустаен,София, Оборище,,First Estates,,https://www.imoti.net/bg/obiava/prodava/sofia/oborishte/dvustaen/5808435/?sid=gFM8jD&page=4,12.0,2025-07-02 06:03:11.272199,https://www.imoti.net/bg/obiavi/r/prodava/sofia/?page=1&sid=gFM8jD,imoti.net,289,2025-07-02,,,Цена на /м2/:4 053EUR, 63 м2,Етаж: 9 от 14
"продава Тристаен апартамент, 81 м2","Скала Ди предлага на вниманието Ви ЕКСКЛУЗИВНО!СЛЪНЧЕВ, кокетен апартамент с ОТЛИЧНА ЛОКАЦИЯ- кв.Изток, в непосредствена близост до спирки на градски транспорт.Апартаментът е...",262000.0,EUR,False,продава,тристаен,София, Изток,,Скала Ди недвижими имоти,,https://www.imoti.net/bg/obiava/prodava/sofia/sofija-iztok/tristaen/6048496/?sid=gFM8jD&page=4,7.0,2025-07-02 06:03:11.272674,https://www.imoti.net/bg/obiavi/r/prodava/sofia/?page=1&sid=gFM8jD,imoti.net,289,2025-07-02,,,Цена на /м2/:3 235EUR, 81 м2,Етаж: 8 от 9
"продава Двустаен апартамент, 81 м2","НОВА ТОП ЦЕНА!Скала Ди предлага на вниманието Ви ЕКСКЛУЗИВНО!СЛЪНЧЕВ, кокетен апартамент с ОТЛИЧНА ЛОКАЦИЯ- кв.Изток, в непосредствена близост до спирки на градски транспорт....",262000.0,EUR,False,продава,двустаен,София, Изток,,Скала Ди недвижими имоти,,https://www.imoti.net/bg/obiava/prodava/sofia/sofija-iztok/dvustaen/6048497/?sid=gFM8jD&page=4,7.0,2025-07-02 06:03:11.273171,https://www.imoti.net/bg/obiavi/r/prodava/sofia/?page=1&sid=gFM8jD,imoti.net,289,2025-07-02,,,Цена на /м2/:3 235EUR, 81 м2,Етаж: 8 от 9
"продава Двустаен апартамент, 62 м2","Представяме Ви двустаен апартамент с включено паркомясто за продажба. Намира се в Театрална Парк Резиденс, затворен комплекс в престижния квартал Оборище, на метри от парк ""Заимов"".Имотът е...",264600.0,EUR,False,продава,двустаен,София, Оборище,,Luximmo Finest Estates,,https://www.imoti.net/bg/obiava/prodava--v-stroej/sofia/oborishte/dvustaen/6089474/?sid=gFM8jD&page=4,16.0,2025-07-02 06:03:11.273654,https://www.imoti.net/bg/obiavi/r/prodava/sofia/?page=1&sid=gFM8jD,imoti.net,289,2025-07-02,,,Цена на /м2/:4 268EUR, 62 м2,Етаж:  от 14
"продава Тристаен апартамент, 133 м2",Явлена Фронт офис предлага за продажба тристаен апартамент на две нива в сграда на етап Акт 14. Апартаментът е на 6-ти и 7-ми етаж и има застроена площ от 117.50 кв.м. Разпределението му е...,265000.0,EUR,False,продава,тристаен,София, Суха Река,,Явлена София,,https://www.imoti.net/bg/obiava/prodava/sofia/suha-reka/tristaen/6020641/?sid=gFM8jD&page=4,6.0,2025-07-02 06:03:11.274136,https://www.imoti.net/bg/obiavi/r/prodava/sofia/?page=1&sid=gFM8jD,imoti.net,289,2025-07-02,,,Цена на /м2/:1 992EUR, 133 м2,Етаж: 6 от 7
