raw_title,raw_description,price,currency,without_dds,offer_type,property_type,city,neighborhood,contact_info,agency,agency_url,details_url,num_photos,date_time_added,search_url,site,total_offers,date,ref_no,time,price_per_m2,area,floor
"продава Тристаен апартамент, 104 м2","БЕЗ КОМИСИОН ОТ КУПУВАЧА!!!ИРИДА НЕДВИЖИМИ ИМОТИ продава слънчев тристаен апартамент в новоизграждащ се затворен жилищен комплекс, с изключително висококачествено строителство от...",282975.0,EUR,False,продава,тристаен,София, Оборище,,ИРИДА НЕДВИЖИМИ ИМОТИ,,https://www.imoti.net/bg/obiava/prodava--v-stroej/sofia/oborishte/tristaen/5909426/?sid=gFM8jD&page=9,1.0,2025-01-16 06:03:28.804428,https://www.imoti.net/bg/obiavi/r/prodava/sofia/?page=1&sid=gFM8jD,imoti.net,498,2025-01-16,,,Цена на /м2/:2 721EUR, 104 м2,Етаж: 10 от 14
"продава Тристаен апартамент, 105 м2","First Estates има огромното удоволствие да Ви представи най-новия луксозен жилищен комплекс, сгушен до парка Заимов в сърцето на града. Този изключителен проект предефинира градския живот, като...",282975.0,EUR,False,продава,тристаен,София, Оборище,,First Estates,,https://www.imoti.net/bg/obiava/prodava--v-stroej/sofia/oborishte/tristaen/5869794/?sid=gFM8jD&page=9,15.0,2025-01-16 06:03:28.804923,https://www.imoti.net/bg/obiavi/r/prodava/sofia/?page=1&sid=gFM8jD,imoti.net,498,2025-01-16,,,Цена на /м2/:2 695EUR, 105 м2,Етаж: 10 от 14
"продава Тристаен апартамент, 120 м2",Възможност за покупка чрез кредит!!! Безплатно съдействие за кредит при най добри условия за купувача!!! Нова жилищна сграда с Разрешение за ползване (Акт 16). Отлично местоположение  с  добре...,288300.0,EUR,False,продава,тристаен,София, Суха Река,,Дом Консулт,,https://www.imoti.net/bg/obiava/prodava/sofia/suha-reka/tristaen/6001953/?sid=gFM8jD&page=9,11.0,2025-01-16 06:03:28.805353,https://www.imoti.net/bg/obiavi/r/prodava/sofia/?page=1&sid=gFM8jD,imoti.net,498,2025-01-16,,,Цена на /м2/:2 403EUR, 120 м2,Етаж: 6 от 8
"продава Тристаен апартамент, 120 м2",Възможност за покупка чрез кредит!!! Безплатно съдействие за кредит при най добри условия за купувача!!! Нова жилищна сграда с Разрешение за ползване (Акт 16). Отлично местоположение  с  добре...,288300.0,EUR,False,продава,тристаен,София, Подуене,,Дом Консулт,,https://www.imoti.net/bg/obiava/prodava/sofia/poduene/tristaen/6007879/?sid=gFM8jD&page=9,13.0,2025-01-16 06:03:28.805781,https://www.imoti.net/bg/obiavi/r/prodava/sofia/?page=1&sid=gFM8jD,imoti.net,498,2025-01-16,,,Цена на /м2/:2 403EUR, 120 м2,Етаж: 6 от 8
"продава Тристаен апартамент, 105 м2","БЕЗ КОМИСИОН ОТ КУПУВАЧА!!!ИРИДА НЕДВИЖИМИ ИМОТИ продава слънчев тристаен апартамент в новоизграждащ се затворен жилищен комплекс, с изключително висококачествено строителство от...",288750.0,EUR,False,продава,тристаен,София, Оборище,,ИРИДА НЕДВИЖИМИ ИМОТИ,,https://www.imoti.net/bg/obiava/prodava--v-stroej/sofia/oborishte/tristaen/5909425/?sid=gFM8jD&page=9,1.0,2025-01-16 06:03:28.806273,https://www.imoti.net/bg/obiavi/r/prodava/sofia/?page=1&sid=gFM8jD,imoti.net,498,2025-01-16,,,Цена на /м2/:2 750EUR, 105 м2,Етаж: 11 от 14
"продава Тристаен апартамент, 87 м2",Продава се разкошен апартамент община ОборищеИдеален избор за инвестиция с висока възвръщаемост!Aко търсите висока доходност и стабилна възвръщаемост на вашата...,289000.0,EUR,False,продава,тристаен,София, Оборище,,ЕКС НВД,,https://www.imoti.net/bg/obiava/prodava/sofia/oborishte/tristaen/6005805/?sid=gFM8jD&page=9,11.0,2025-01-16 06:03:28.806710,https://www.imoti.net/bg/obiavi/r/prodava/sofia/?page=1&sid=gFM8jD,imoti.net,498,2025-01-16,,,Цена на /м2/:3 322EUR, 87 м2,Етаж: 3 от 3
"продава Тристаен апартамент, 87 м2",Продава се разкошен апартамент община ОборищеИдеален избор за инвестиция с висока възвръщаемост!Aко търсите висока доходност и стабилна възвръщаемост на вашата...,289000.0,EUR,False,продава,тристаен,София, Оборище,,ЕКС НВД,,https://www.imoti.net/bg/obiava/prodava/sofia/oborishte/tristaen/6005808/?sid=gFM8jD&page=9,11.0,2025-01-16 06:03:28.807149,https://www.imoti.net/bg/obiavi/r/prodava/sofia/?page=1&sid=gFM8jD,imoti.net,498,2025-01-16,,,Цена на /м2/:3 322EUR, 87 м2,Етаж: 3 от 3
"продава Тристаен апартамент, 100 м2","РИКОМС НЕДВИЖИМИ ИМОТИ ПРОДАВА ТРИСТАЕН АПАРТАМЕНТ В: Квартал Оборище  ул.Оборище. Имотът може да бъде преустроен на четиристаен. Има много потенциал.РАЗПРЕДЕЛЕНИЕ: Коридор, две спални...",289000.0,EUR,False,продава,тристаен,София, Оборище,,Ри-Ком,,https://www.imoti.net/bg/obiava/prodava/sofia/oborishte/tristaen/6013650/?sid=gFM8jD&page=10,12.0,2025-01-16 06:03:33.007460,https://www.imoti.net/bg/obiavi/r/prodava/sofia/?page=1&sid=gFM8jD,imoti.net,498,2025-01-16,,,Цена на /м2/:2 890EUR, 100 м2,Етаж: 4 от 5
"продава Тристаен апартамент, 115 м2","Ексклузивно представяме за продажба комфортен тристаен апартамент, в нов, модерен затворен комплекс в престижния квартал ""Оборище"", на метри от парк ""Заимов"".Имотът е разположен във...",290000.0,EUR,False,продава,тристаен,София, Оборище,,Luximmo Finest Estates,,https://www.imoti.net/bg/obiava/prodava--v-stroej/sofia/oborishte/tristaen/5984470/?sid=gFM8jD&page=10,5.0,2025-01-16 06:03:33.008004,https://www.imoti.net/bg/obiavi/r/prodava/sofia/?page=1&sid=gFM8jD,imoti.net,498,2025-01-16,,,Цена на /м2/:2 522EUR, 115 м2,Етаж:  от 11
"продава Тристаен апартамент, 134 м2","iHOME REAL ESTATE предлага тристаен апартамент в сграда в близост до Парк 'Заимов' ,'бул. 'Мадрид  и ул. Черковна'.Апартамент 08 е с площ 134 кв.м. и застроена площ 105 кв.м. е...",293100.0,EUR,False,продава,тристаен,София, Оборище,,iHOME REAL ESTATE,,https://www.imoti.net/bg/obiava/prodava/sofia/oborishte/tristaen/5984927/?sid=gFM8jD&page=10,10.0,2025-01-16 06:03:33.008503,https://www.imoti.net/bg/obiavi/r/prodava/sofia/?page=1&sid=gFM8jD,imoti.net,498,2025-01-16,,,Цена на /м2/:2 187EUR, 134 м2,Етаж: 5 от 9
"продава Тристаен апартамент, 133 м2","iHOME REAL ESTATE предлага тристаен апартамент в близост до Парк ""Заимов"", бул. ""Мадрид"" и ул. ""Черковна"". На една трамвайна спирка до МОЛ Сердика, в близост до Малък градски театър ""Зад канала"" и...",293100.0,EUR,False,продава,тристаен,София, Подуене,,iHOME REAL ESTATE,,https://www.imoti.net/bg/obiava/prodava/sofia/poduene/tristaen/5982968/?sid=gFM8jD&page=10,15.0,2025-01-16 06:03:33.009010,https://www.imoti.net/bg/obiavi/r/prodava/sofia/?page=1&sid=gFM8jD,imoti.net,498,2025-01-16,,,Цена на /м2/:2 204EUR, 133 м2,Етаж: 5 от 9
"продава Двустаен апартамент, 81 м2",Имоти ПРЕМИЕР представя на Вашето внимание двустаен апартамент кв. Оборище!Жилището е ситуирано на втори етаж в тухлена сграда .Вътрешен апартамент с изложение Юг/Север. Обща площ от 81...,295000.0,EUR,False,продава,двустаен,София, Оборище,,Имоти Премиер,,https://www.imoti.net/bg/obiava/prodava/sofia/oborishte/dvustaen/5965598/?sid=gFM8jD&page=10,9.0,2025-01-16 06:03:33.009504,https://www.imoti.net/bg/obiavi/r/prodava/sofia/?page=1&sid=gFM8jD,imoti.net,498,2025-01-16,,,Цена на /м2/:3 642EUR, 81 м2,Етаж: 2 от 4
"продава Тристаен апартамент, 81 м2",Компания `ЕКС` представя на Вашето внимание тристаен апартамент в един от най-аристократичните и предпочитани райони на гр. София- кв. Оборище.МЕСТОПОЛОЖЕНИЕ: В близост до спирка на...,295000.0,EUR,False,продава,тристаен,София, Оборище,,ЕКС НВД,,https://www.imoti.net/bg/obiava/prodava/sofia/oborishte/tristaen/5934689/?sid=gFM8jD&page=10,7.0,2025-01-16 06:03:33.009943,https://www.imoti.net/bg/obiavi/r/prodava/sofia/?page=1&sid=gFM8jD,imoti.net,498,2025-01-16,,,Цена на /м2/:3 642EUR, 81 м2,Етаж: 2 от 4
"продава Двустаен апартамент, 76 м2","НЕПРЕХОДЕН и ФУНКЦИОНАЛЕН ГОЛЯМ ДВУСТАЕН АПАРТАМЕНТ /възможност за ПРЕУСТРОЙСТВО в ТРИСТАЕН! в ЦЕНТЪР//кв. ОБОРИЩЕ, до ул. ОБОРИЩЕ на етаж 4НП/под тавани, БЕЗ асансьор, в тухлена сграда ЖСК от 1962...",295000.0,EUR,False,продава,двустаен,София, Оборище,,АЛДЕС ИМОТИ ЕООД,,https://www.imoti.net/bg/obiava/prodava/sofia/oborishte/dvustaen/5987276/?sid=gFM8jD&page=10,18.0,2025-01-16 06:03:33.010378,https://www.imoti.net/bg/obiavi/r/prodava/sofia/?page=1&sid=gFM8jD,imoti.net,498,2025-01-16,,,Цена на /м2/:3 882EUR, 76 м2,Етаж: 5 от 5
"продава Тристаен апартамент, 115 м2","ERA Младост представя просторен и светъл апартамент с потенциал да бъде преустроен в четиристаен, разположен на комуникативния бул. Мадрид. Имотът е със статут на апартамент и разполага с...",299000.0,EUR,False,продава,тристаен,София, Оборище,,ERA Младост,,https://www.imoti.net/bg/obiava/prodava/sofia/oborishte/tristaen/5957078/?sid=gFM8jD&page=10,11.0,2025-01-16 06:03:33.010812,https://www.imoti.net/bg/obiavi/r/prodava/sofia/?page=1&sid=gFM8jD,imoti.net,498,2025-01-16,,,Цена на /м2/:2 600EUR, 115 м2,Етаж:
"продава Четиристаен апартамент, 115 м2","ERA Младост представя просторен и светъл апартамент с потенциал да бъде преустроен в четиристаен, разположен на комуникативния бул. Мадрид. Имотът е със статут на апартамент и разполага с...",299000.0,EUR,False,продава,четиристаен,София, Оборище,,ERA Младост,,https://www.imoti.net/bg/obiava/prodava/sofia/oborishte/chetiristaen/5998811/?sid=gFM8jD&page=10,11.0,2025-01-16 06:03:33.011242,https://www.imoti.net/bg/obiavi/r/prodava/sofia/?page=1&sid=gFM8jD,imoti.net,498,2025-01-16,,,Цена на /м2/:2 600EUR, 115 м2,Етаж:
"продава Тристаен апартамент, 85 м2","Явлена - Изток продава класически тристаен апартамент, находящ се в гр. София, ж.к. Изток, ул. М.Юрий Гагарин. В близост се намират Борисова градина, транспортна спирка ""Х-л Плиска"", метростанция...",299800.0,EUR,False,продава,тристаен,София, Изток,,Явлена Изток,,https://www.imoti.net/bg/obiava/prodava/sofia/sofija-iztok/tristaen/5994713/?sid=gFM8jD&page=10,9.0,2025-01-16 06:03:33.011679,https://www.imoti.net/bg/obiavi/r/prodava/sofia/?page=1&sid=gFM8jD,imoti.net,498,2025-01-16,,,Цена на /м2/:3 527EUR, 85 м2,Етаж: 3 от 4
"продава Четиристаен апартамент, 109 м2","Представяме ви просторен апартамент за продажба, разположен на втория етаж в квартал Дианабад в София, на самата граница с престижния квартал Изток, близо до булевард Драган Цанков, само на 350...",299900.0,EUR,False,продава,четиристаен,София, Дианабад,,SUPRIMMO,,https://www.imoti.net/bg/obiava/prodava--v-stroej/sofia/dianabad/chetiristaen/5931785/?sid=gFM8jD&page=10,12.0,2025-01-16 06:03:33.012112,https://www.imoti.net/bg/obiavi/r/prodava/sofia/?page=1&sid=gFM8jD,imoti.net,498,2025-01-16,,,Цена на /м2/:2 751EUR, 109 м2,Етаж:  от 8
"продава Тристаен апартамент, 209 м2",РА Младост предлага тристаен апартамент №501 на 5 етаж над магазини в малка  - 5 етажна сграда с 16 апартамента. Апартаментът е с изложение изток -запад-север - юг и следното разпределение: Дневна...,304000.0,EUR,False,продава,тристаен,София, Дианабад,,ERA Младост,,https://www.imoti.net/bg/obiava/prodava--v-stroej/sofia/dianabad/tristaen/5888247/?sid=gFM8jD&page=10,11.0,2025-01-16 06:03:33.012547,https://www.imoti.net/bg/obiavi/r/prodava/sofia/?page=1&sid=gFM8jD,imoti.net,498,2025-01-16,,,Цена на /м2/:1 455EUR, 209 м2,Етаж:
"продава Двустаен апартамент, 96 м2","Ексклузивно представяме за продажба двустаен апартамент в сграда S-Tower - нов проект с отличителен дизайн, висок клас на изпълнение, комуникативна локация и отлична възможност за инвестиция....",307400.0,EUR,False,продава,двустаен,София, Дианабад,,Luximmo Finest Estates,,https://www.imoti.net/bg/obiava/prodava--v-stroej/sofia/dianabad/dvustaen/6019453/?sid=gFM8jD&page=10,24.0,2025-01-16 06:03:33.013049,https://www.imoti.net/bg/obiavi/r/prodava/sofia/?page=1&sid=gFM8jD,imoti.net,498,2025-01-16,,,Цена на /м2/:3 202EUR, 96 м2,Етаж:  от 15
"продава Тристаен апартамент, 119 м2","Явлена-Изток представя тристаен апартамент в квартал Редута, на комуникативно място и добра локация. Пред акт 15.Апартамента е непреходен, със северозападно изложение, на партерен етаж с...",307800.0,EUR,False,продава,тристаен,София, Редута,,Явлена Изток,,https://www.imoti.net/bg/obiava/prodava/sofia/reduta/tristaen/5933313/?sid=gFM8jD&page=10,8.0,2025-01-16 06:03:33.013488,https://www.imoti.net/bg/obiavi/r/prodava/sofia/?page=1&sid=gFM8jD,imoti.net,498,2025-01-16,,,Цена на /м2/:2 587EUR, 119 м2,Етаж: 1 от 8
"продава Многостаен апартамент, 107 м2","Напълно обзаведен многостаен апартамент за продажба в ж.к. Редута със застроена площ от 94 кв. м и самостоятелен двор от 100 кв. м. Състои се от входно антре, всекидневна с кухненски...",310000.0,EUR,False,продава,многостаен,София, Редута,,АДРЕС Недвижими имоти АД,,https://www.imoti.net/bg/obiava/prodava/sofia/reduta/mnogostaen/6003295/?sid=gFM8jD&page=10,12.0,2025-01-16 06:03:33.013920,https://www.imoti.net/bg/obiavi/r/prodava/sofia/?page=1&sid=gFM8jD,imoti.net,498,2025-01-16,,,Цена на /м2/:2 897EUR, 107 м2,Етаж: 1
"продава Четиристаен апартамент, 148 м2","Явлена Изток продава мезонет с 3 отделни спални от надежден инвеститор и строител с много добра репутация, доказал се с последните 30г. в които строи.Етап - пред разрешение за строеж....",310950.0,EUR,False,продава,четиристаен,София, Редута,,Явлена Изток,,https://www.imoti.net/bg/obiava/prodava/sofia/reduta/chetiristaen/6018676/?sid=gFM8jD&page=10,6.0,2025-01-16 06:03:33.014358,https://www.imoti.net/bg/obiavi/r/prodava/sofia/?page=1&sid=gFM8jD,imoti.net,498,2025-01-16,,,Цена на /м2/:2 101EUR, 148 м2,Етаж: 6 от 6
"продава Мезонет, 145 м2",First Estates предлага за продажба бутиков мезонет с две спални в кв. Изток в санирана сграда с падземен паркинг от 2002 г.Към апаратмента може да се закупи и гараж на цена от 45000 Е....,315000.0,EUR,False,продава,мезонет,София, Изток,,First Estates,,https://www.imoti.net/bg/obiava/prodava--v-stroej/sofia/sofija-iztok/mezonet/5958668/?sid=gFM8jD&page=10,19.0,2025-01-16 06:03:33.014846,https://www.imoti.net/bg/obiavi/r/prodava/sofia/?page=1&sid=gFM8jD,imoti.net,498,2025-01-16,,,Цена на /м2/:2 172EUR, 145 м2,Етаж: 8 от 9
"продава Тристаен апартамент, 117 м2","Ексклузивно представяме за продажба комфортен тристаен апартамент №7.52 в сграда S-Tower - нов проект с отличителен дизайн, висок клас на изпълнение, комуникативна локация и отлична възможност за...",317620.0,EUR,False,продава,тристаен,София, Дианабад,,Luximmo Finest Estates,,https://www.imoti.net/bg/obiava/prodava--v-stroej/sofia/dianabad/tristaen/6017652/?sid=gFM8jD&page=10,25.0,2025-01-16 06:03:33.015333,https://www.imoti.net/bg/obiavi/r/prodava/sofia/?page=1&sid=gFM8jD,imoti.net,498,2025-01-16,,,Цена на /м2/:2 715EUR, 117 м2,Етаж:  от 15
"продава Тристаен апартамент, 104 м2",Революшън Естейт Ви представя уникален тристаен апартамент в бутиков затворен комплекс С АКТ 16 и луксозни общи части в ж.к. Дианабад.Комплексът е разположен в чудесната част на кв....,320000.0,EUR,False,продава,тристаен,София, Дианабад,,Революшън Сейлс,,https://www.imoti.net/bg/obiava/prodava/sofia/dianabad/tristaen/5984771/?sid=gFM8jD&page=10,11.0,2025-01-16 06:03:33.015777,https://www.imoti.net/bg/obiavi/r/prodava/sofia/?page=1&sid=gFM8jD,imoti.net,498,2025-01-16,,,Цена на /м2/:3 077EUR, 104 м2,Етаж: 2 от 8
"продава Двустаен апартамент, 88 м2",.  .  .  .  .  .  .  .  .  .  .  .  .  .  .  .  .  .  .  .  .  .  .  .  .  .  .  .  .  . ПРЕУСТРОЕН .  .  .  .  .  .  .  .  .  .  .  .  .  .  .  .  .  .  .  .  .  .  .  .  .  .  .  .  .  .В...,320000.0,EUR,False,продава,двустаен,София, Изгрев,,АРСЕНАЛ - недвижими имоти,,https://www.imoti.net/bg/obiava/prodava/sofia/sofija-izgrev/dvustaen/5988906/?sid=gFM8jD&page=10,10.0,2025-01-16 06:03:33.016214,https://www.imoti.net/bg/obiavi/r/prodava/sofia/?page=1&sid=gFM8jD,imoti.net,498,2025-01-16,,,Цена на /м2/:3 636EUR, 88 м2,Етаж: 2 от 17
"продава Четиристаен апартамент, 115 м2",".  .  .  .  .  .  .  .  .  .  .  ЩЕ .  .  .  .  .  .  .  .  .  .  .  .  .  .  .  .  .  .  .  .  . Ви предложим 'многофункционален' имот, ПОДХОДЯЩ както за жилище, така и за офис. Апартаментът се...",320000.0,EUR,False,продава,четиристаен,София, Изток,,АРСЕНАЛ - недвижими имоти,,https://www.imoti.net/bg/obiava/prodava/sofia/sofija-iztok/chetiristaen/5608324/?sid=gFM8jD&page=10,10.0,2025-01-16 06:03:33.016648,https://www.imoti.net/bg/obiavi/r/prodava/sofia/?page=1&sid=gFM8jD,imoti.net,498,2025-01-16,,,Цена на /м2/:2 783EUR, 115 м2,Етаж: 2 от 9
"продава Двустаен апартамент, 92 м2",Unique Estates предлага за продажба апартамент с една спалня в нова сграда на ул.Латинка в кв.Изгрев.Апртаментът разполага с голяма всекиднвна с трапезария от 30кв.м. и...,320000.0,EUR,False,продава,двустаен,София, Изгрев,,ЮНИК ЕСТЕЙТС,,https://www.imoti.net/bg/obiava/prodava--v-stroej/sofia/sofija-izgrev/dvustaen/5871546/?sid=gFM8jD&page=10,1.0,2025-01-16 06:03:33.017157,https://www.imoti.net/bg/obiavi/r/prodava/sofia/?page=1&sid=gFM8jD,imoti.net,498,2025-01-16,,,Цена на /м2/:3 478EUR, 92 м2,Етаж: 3 от 7
"продава Тристаен апартамент, 167 м2","БЕЗ КОМИСИОН ОТ КУПУВАЧА!НОВ ПРОЕКТ!ИРИДА НЕДВИЖИМИ ИМОТИ Ви предлага за продажба тристаен апартамент, в новострояща се сграда в район Подуяне!...",320371.0,EUR,False,продава,тристаен,София, Подуене,,ИРИДА НЕДВИЖИМИ ИМОТИ,,https://www.imoti.net/bg/obiava/prodava--v-stroej/sofia/poduene/tristaen/5943606/?sid=gFM8jD&page=10,1.0,2025-01-16 06:03:33.017663,https://www.imoti.net/bg/obiavi/r/prodava/sofia/?page=1&sid=gFM8jD,imoti.net,498,2025-01-16,,,Цена на /м2/:1 918EUR, 167 м2,Етаж: 6 от 9
"продава Четиристаен апартамент, 167 м2",КЛИЕНТИТЕ НА MARTIN'S СА ПО-ДОВОЛНИ! ПОПИТАЙ ЗАЩО!Предлагаме четиристаен апартамент с обща площ от 166.86 кв.м. в сграда ново строителство. Имотът е ситуиран на шести етаж в сграда с общо 9...,320373.0,EUR,False,продава,четиристаен,София, Суха Река,,MARTIN’S,,https://www.imoti.net/bg/obiava/prodava--v-stroej/sofia/suha-reka/chetiristaen/5970854/?sid=gFM8jD&page=10,3.0,2025-01-16 06:03:33.018100,https://www.imoti.net/bg/obiavi/r/prodava/sofia/?page=1&sid=gFM8jD,imoti.net,498,2025-01-16,,,Цена на /м2/:1 918EUR, 167 м2,Етаж: 6 от 9
"продава Мезонет, 193 м2",Предлагаме на вниманието Ви мезонет с разкошна панорамна гледка към планината Витоша в новострояща се бутикова сграда в кв. Редута. Сградата се намира на около 10-12 минути пешеходно разстояние от...,321588.0,EUR,False,продава,мезонет,София, Редута,,SUPRIMMO,,https://www.imoti.net/bg/obiava/prodava--v-stroej/sofia/reduta/mezonet/5914645/?sid=gFM8jD&page=10,12.0,2025-01-16 06:03:33.018528,https://www.imoti.net/bg/obiavi/r/prodava/sofia/?page=1&sid=gFM8jD,imoti.net,498,2025-01-16,,,Цена на /м2/:1 666EUR, 193 м2,Етаж:  от 6
"продава Тристаен апартамент, 100 м2","Титан Пропъртис - офис Черни връх , има удоволствието да Ви представи тристаен апартамент в кв.Редута - комуникативно място, в близост до спирки на градски транспорт,бъдеща метростанция, училище ,...",325000.0,EUR,False,продава,тристаен,София, Редута,,Титан пропъртис продажби,,https://www.imoti.net/bg/obiava/prodava/sofia/reduta/tristaen/5998766/?sid=gFM8jD&page=10,8.0,2025-01-16 06:03:33.018960,https://www.imoti.net/bg/obiavi/r/prodava/sofia/?page=1&sid=gFM8jD,imoti.net,498,2025-01-16,,,Цена на /м2/:3 250EUR, 100 м2,Етаж: 4 от 7
