raw_title,raw_description,price,currency,without_dds,offer_type,property_type,city,neighborhood,contact_info,agency,agency_url,details_url,num_photos,date_time_added,search_url,site,total_offers,date,ref_no,time,price_per_m2,area,floor
"продава Двустаен апартамент, 72 м2","Имоти Премиер представят на Вашето внимание двустаен апартамент в кв. Редута, като имотът е напълно обзаведен с отлична локация и функционално разпределение, готов за незабавно нанасяне. Жилището...",200000.0,EUR,False,продава,двустаен,София, Редута,,Имоти Премиер,,https://www.imoti.net/bg/obiava/prodava--v-stroej/sofia/reduta/dvustaen/5944542/?sid=gFM8jD&page=5,11.0,2025-01-16 06:03:00.047283,https://www.imoti.net/bg/obiavi/r/prodava/sofia/?page=1&sid=gFM8jD,imoti.net,498,2025-01-16,,,Цена на /м2/:2 778EUR, 72 м2,Етаж: 1 от 5
"продава Двустаен апартамент, 72 м2","Революшън Естейт представя на Вашето внимание уютен двустаен апартамент в ж.к. Редута.Намира се на 100 метра до парк Гео Милев, в близост до ДГ 155, посолство на Беларус, стадион...",200000.0,EUR,False,продава,двустаен,София, Редута,,Революшън Сейлс,,https://www.imoti.net/bg/obiava/prodava/sofia/reduta/dvustaen/5962730/?sid=gFM8jD&page=5,9.0,2025-01-16 06:03:00.047726,https://www.imoti.net/bg/obiavi/r/prodava/sofia/?page=1&sid=gFM8jD,imoti.net,498,2025-01-16,,,Цена на /м2/:2 778EUR, 72 м2,Етаж: 1 от 5
"продава Двустаен апартамент, 89 м2","ЕРА Младост предлага двустаен апартамент №304 на 3 етаж над магазини в малка  - 5 етажна сграда с 16 апартамента. Апартаментът е с изложение изток-север и следното разпределение: Дневна с кухня,...",200000.0,EUR,False,продава,двустаен,София, Дианабад,,ERA Младост,,https://www.imoti.net/bg/obiava/prodava/sofia/dianabad/dvustaen/5888248/?sid=gFM8jD&page=5,9.0,2025-01-16 06:03:00.048157,https://www.imoti.net/bg/obiavi/r/prodava/sofia/?page=1&sid=gFM8jD,imoti.net,498,2025-01-16,,,Цена на /м2/:2 247EUR, 89 м2,Етаж:
"продава Двустаен апартамент, 72 м2","Номер на офертата в агенцията 13364. Имотът се намира в кв.Редута,първи над партерен /над гаражи/ етаж. Непреходен ,три отделни стаи. На 100м. от парк Гео Милев и автобусна спирка на автобус 72,на...",200000.0,EUR,False,продава,двустаен,София, Редута,,Глобъл Сървисиз,,https://www.imoti.net/bg/obiava/prodava--v-stroej/sofia/reduta/dvustaen/5977086/?sid=gFM8jD&page=5,14.0,2025-01-16 06:03:00.048589,https://www.imoti.net/bg/obiavi/r/prodava/sofia/?page=1&sid=gFM8jD,imoti.net,498,2025-01-16,,,Цена на /м2/:2 778EUR, 72 м2,Етаж: 1 от 5
"продава Двустаен апартамент, 72 м2",Агенция за недвижими имоти Калиста Естейт има огромното удоволствие да Ви представи двустаен апартамент в ж.к. Редута.Обзавеждане: напълно обзаведенЕтап на строителство: с...,200000.0,EUR,False,продава,двустаен,София, Редута,,Калиста Естейт,,https://www.imoti.net/bg/obiava/prodava/sofia/reduta/dvustaen/5944318/?sid=gFM8jD&page=5,10.0,2025-01-16 06:03:00.049045,https://www.imoti.net/bg/obiavi/r/prodava/sofia/?page=1&sid=gFM8jD,imoti.net,498,2025-01-16,,,Цена на /м2/:2 778EUR, 72 м2,Етаж: 1 от 5
"продава Двустаен апартамент, 66 м2",iHOME Real Estate предлага двустаен апартамент в единствен по рода си Затворен Коплекс до парк Заимов.Апартамент №49 е разположен на 14-ти етаж състояща се от:...,201595.0,EUR,False,продава,двустаен,София, Оборище,,iHOME REAL ESTATE,,https://www.imoti.net/bg/obiava/prodava--v-stroej/sofia/oborishte/dvustaen/5964705/?sid=gFM8jD&page=5,9.0,2025-01-16 06:03:00.049544,https://www.imoti.net/bg/obiavi/r/prodava/sofia/?page=1&sid=gFM8jD,imoti.net,498,2025-01-16,,,Цена на /м2/:3 054EUR, 66 м2,Етаж: 14 от 14
"продава Тристаен апартамент, 107 м2","ХОУМ ЛАЙТ Ви представя новострояща се жилищна сграда, която се намира на едно от най-комуникативните места в София!Централното, но същевременно тихо и спокойно местоположение на...",204806.0,EUR,False,продава,тристаен,София, Подуене,,ХОУМЛАЙТ,,https://www.imoti.net/bg/obiava/prodava--v-stroej/sofia/poduene/tristaen/5908667/?sid=gFM8jD&page=5,5.0,2025-01-16 06:03:00.049985,https://www.imoti.net/bg/obiavi/r/prodava/sofia/?page=1&sid=gFM8jD,imoti.net,498,2025-01-16,,,Цена на /м2/:1 914EUR, 107 м2,Етаж: 4 от 9
"продава Тристаен апартамент, 114 м2","Galiano Estates ви предлага нов тристаен апартамент в жилищна сграда със сутерен, четири надземни и един подпокривен етаж. В сутерена на сградата се помещава подземният гараж, на партера са...",205000.0,EUR,False,продава,тристаен,София, Подуене,,Galiano Estates,,https://www.imoti.net/bg/obiava/prodava--v-stroej/sofia/poduene/tristaen/5968669/?sid=gFM8jD&page=5,2.0,2025-01-16 06:03:00.050468,https://www.imoti.net/bg/obiavi/r/prodava/sofia/?page=1&sid=gFM8jD,imoti.net,498,2025-01-16,,,Цена на /м2/:1 798EUR, 114 м2,Етаж: 2 от 6
"продава Двустаен апартамент, 74 м2","Home Life Point има удоволствието да Ви представи завършен двустаен апартамент с чиста застроена площ от 66 кв.м. и площ от 74 кв.м. по документи, на отлична локация в кв. Оборище - ул. Петра,...",205000.0,EUR,False,продава,двустаен,София, Оборище,,Home Life Point Realty,,https://www.imoti.net/bg/obiava/prodava--v-stroej/sofia/oborishte/dvustaen/5972823/?sid=gFM8jD&page=5,18.0,2025-01-16 06:03:00.050944,https://www.imoti.net/bg/obiavi/r/prodava/sofia/?page=1&sid=gFM8jD,imoti.net,498,2025-01-16,,,Цена на /м2/:2 770EUR, 74 м2,Етаж: 2 от 6
"продава Двустаен апартамент, 72 м2","Реф. № 011742Агенция за недвижими имоти BAS Properties представя на Вашето внимание двустаен апартамент в кв. Редута, гр. София.Основни характеристики:",205000.0,EUR,False,продава,двустаен,София, Редута,,БАС Пропъртис,,https://www.imoti.net/bg/obiava/prodava/sofia/reduta/dvustaen/6010797/?sid=gFM8jD&page=5,12.0,2025-01-16 06:03:00.051391,https://www.imoti.net/bg/obiavi/r/prodava/sofia/?page=1&sid=gFM8jD,imoti.net,498,2025-01-16,,,Цена на /м2/:2 847EUR, 72 м2,Етаж: 3 от 5
"продава Тристаен апартамент, 90 м2","Компания `ЕКС` представя на Вашето внимание тристаен апартамент в кв. Редута.МЕСТОПОЛОЖЕНИЕ: В близост до спирка на градски транспорт, училище, Сердика Център, магазини от всякакъв...",205000.0,EUR,False,продава,тристаен,София, Редута,,ЕКС НВД,,https://www.imoti.net/bg/obiava/prodava--v-stroej/sofia/reduta/tristaen/5858255/?sid=gFM8jD&page=5,2.0,2025-01-16 06:03:00.051829,https://www.imoti.net/bg/obiavi/r/prodava/sofia/?page=1&sid=gFM8jD,imoti.net,498,2025-01-16,,,Цена на /м2/:2 278EUR, 90 м2,Етаж: 1 от 6
"продава Тристаен апартамент, 124 м2",ЕРА Идеа предлага за продажба тристаен апартамент в новострояща се жилищна сграда в кв. Подуяне. Жилището се намира на трети етаж с застроена площ 98.76кв.м. и обща площ 124.63кв.м. Изложение юг -...,205400.0,EUR,False,продава,тристаен,София, Подуене,,Ера Идеа,,https://www.imoti.net/bg/obiava/prodava--v-stroej/sofia/poduene/tristaen/6002024/?sid=gFM8jD&page=5,4.0,2025-01-16 06:03:00.052264,https://www.imoti.net/bg/obiavi/r/prodava/sofia/?page=1&sid=gFM8jD,imoti.net,498,2025-01-16,,,Цена на /м2/:1 656EUR, 124 м2,Етаж:
"продава Тристаен апартамент, 114 м2","БЕЗ КОМИСИОН ОТ КУПУВАЧА!ИРИДА НЕДВИЖИМИ ИМОТИ Ви предлага за продажба тристаен апартамент, в новострояща се луксозна сграда, строяща се само с най-качествени материали в район...",208000.0,EUR,False,продава,тристаен,София, Суха Река,,ИРИДА НЕДВИЖИМИ ИМОТИ,,https://www.imoti.net/bg/obiava/prodava--v-stroej/sofia/suha-reka/tristaen/5936668/?sid=gFM8jD&page=5,1.0,2025-01-16 06:03:00.052761,https://www.imoti.net/bg/obiavi/r/prodava/sofia/?page=1&sid=gFM8jD,imoti.net,498,2025-01-16,,,Цена на /м2/:1 825EUR, 114 м2,Етаж: 2 от 6
"продава Тристаен апартамент, 125 м2","БЕЗ КОМИСИОН ОТ КУПУВАЧА!ИРИДА НЕДВИЖИМИ ИМОТИ Ви предлага за продажба просторен тристаен апартамент, в новострояща се луксозна сграда, строяща се само с най-качествени материали в...",208600.0,EUR,False,продава,тристаен,София, Суха Река,,ИРИДА НЕДВИЖИМИ ИМОТИ,,https://www.imoti.net/bg/obiava/prodava--v-stroej/sofia/suha-reka/tristaen/5936886/?sid=gFM8jD&page=5,1.0,2025-01-16 06:03:00.053272,https://www.imoti.net/bg/obiavi/r/prodava/sofia/?page=1&sid=gFM8jD,imoti.net,498,2025-01-16,,,Цена на /м2/:1 669EUR, 125 м2,Етаж: 3 от 6
"продава Тристаен апартамент, 125 м2","БЕЗ КОМИСИОН ОТ КУПУВАЧА!ИРИДА НЕДВИЖИМИ ИМОТИ Ви предлага за продажба просторен тристаен апартамент, в новострояща се луксозна сграда, строяща се само с най-качествени материали в...",208800.0,EUR,False,продава,тристаен,София, Суха Река,,ИРИДА НЕДВИЖИМИ ИМОТИ,,https://www.imoti.net/bg/obiava/prodava--v-stroej/sofia/suha-reka/tristaen/5936880/?sid=gFM8jD&page=5,1.0,2025-01-16 06:03:00.053771,https://www.imoti.net/bg/obiavi/r/prodava/sofia/?page=1&sid=gFM8jD,imoti.net,498,2025-01-16,,,Цена на /м2/:1 670EUR, 125 м2,Етаж: 2 от 6
"продава Двустаен апартамент, 75 м2","НА ПЕШЕХОДНО РАЗСТОЯНИЕ ОТ МЕТРОСТАНЦИЯ! ЕДИН ОТ НАЙ-ЖЕЛАНИТЕ РАЙОНИ В СТОЛИЦАТА!Имоти Премиер представя на Вашето внимание двустаен апартамент, разположен в един от...",209000.0,EUR,False,продава,двустаен,София, Дианабад,,Имоти Премиер,,https://www.imoti.net/bg/obiava/prodava/sofia/dianabad/dvustaen/6007381/?sid=gFM8jD&page=5,6.0,2025-01-16 06:03:00.054277,https://www.imoti.net/bg/obiavi/r/prodava/sofia/?page=1&sid=gFM8jD,imoti.net,498,2025-01-16,,,Цена на /м2/:2 787EUR, 75 м2,Етаж: 13 от 16
"продава Тристаен апартамент, 182 м2","Имоти Премиер предлага на Вашето внимание тристаен апартамент за продажба в град София, Сухата река.С акт 16 от 2023 г. до метротоАпартамента е цял етаж...",209000.0,EUR,False,продава,тристаен,София, Суха Река,,Имоти Премиер,,https://www.imoti.net/bg/obiava/prodava--v-stroej/sofia/suha-reka/tristaen/5979067/?sid=gFM8jD&page=5,2.0,2025-01-16 06:03:00.054785,https://www.imoti.net/bg/obiavi/r/prodava/sofia/?page=1&sid=gFM8jD,imoti.net,498,2025-01-16,,,Цена на /м2/:1 148EUR, 182 м2,Етаж: 5 от 5
"продава Тристаен апартамент, 115 м2","БЕЗ КОМИСИОН ОТ КУПУВАЧА!ИРИДА НЕДВИЖИМИ ИМОТИ Ви предлага за продажба тристаен апартамент, в новострояща се луксозна сграда, строяща се само с най-качествени материали в район...",209400.0,EUR,False,продава,тристаен,София, Суха Река,,ИРИДА НЕДВИЖИМИ ИМОТИ,,https://www.imoti.net/bg/obiava/prodava--v-stroej/sofia/suha-reka/tristaen/5936899/?sid=gFM8jD&page=5,1.0,2025-01-16 06:03:00.055279,https://www.imoti.net/bg/obiavi/r/prodava/sofia/?page=1&sid=gFM8jD,imoti.net,498,2025-01-16,,,Цена на /м2/:1 821EUR, 115 м2,Етаж: 4 от 6
"продава Двустаен апартамент, 72 м2","Обява за продажба на апартамент в кв. РедутаСлънчев и уютен двустаен апартамент с южно изложение!Топ локация, готов за нанасяне!Среден етаж в тухлена сграда от 2013 г.!...",210000.0,EUR,False,продава,двустаен,София, Редута,,CLOUD HOMES,,https://www.imoti.net/bg/obiava/prodava--v-stroej/sofia/reduta/dvustaen/5946669/?sid=gFM8jD&page=5,9.0,2025-01-16 06:03:00.055722,https://www.imoti.net/bg/obiavi/r/prodava/sofia/?page=1&sid=gFM8jD,imoti.net,498,2025-01-16,,,Цена на /м2/:2 917EUR, 72 м2,Етаж: 2 от 6
"продава Двустаен апартамент, 68 м2","Явлена - Младост представя двустаен непреходен апартамент на границата между кварталите Изток и Изгрев.Жилището се състои от хол,спалня,кухня, две усвоени тераси,складово...",210000.0,EUR,False,продава,двустаен,София, Изток,,Явлена София,,https://www.imoti.net/bg/obiava/prodava/sofia/sofija-iztok/dvustaen/5989185/?sid=gFM8jD&page=6,12.0,2025-01-16 06:03:07.724031,https://www.imoti.net/bg/obiavi/r/prodava/sofia/?page=1&sid=gFM8jD,imoti.net,498,2025-01-16,,,Цена на /м2/:3 088EUR, 68 м2,Етаж: 2
"продава Тристаен апартамент, 90 м2","Титан Пропъртис представя на Вашето внимание тристаен апартамент със страхотна локацията, а именно кв. Редута. В близост са разположени търговски обекти, спирки на градски транспорт, училище,...",210000.0,EUR,False,продава,тристаен,София, Редута,,Титан Пропъртис,,https://www.imoti.net/bg/obiava/prodava/sofia/reduta/tristaen/5870709/?sid=gFM8jD&page=6,2.0,2025-01-16 06:03:07.724529,https://www.imoti.net/bg/obiavi/r/prodava/sofia/?page=1&sid=gFM8jD,imoti.net,498,2025-01-16,,,Цена на /м2/:2 333EUR, 90 м2,Етаж: 1 от 6
"продава Тристаен апартамент, 111 м2","МЕТРО!ТИШИНА!ЕЛЕГАНТНОСТ!ПРЕДПРОДАЖБА!СКОРО ОТНОВО ЩЕ ВДИГНЕМ ЦЕНАТА, ПОБЪРЗАЙТЕ!ВЕЧЕ 60% ОТ ЖИЛИЩАТА СА ЗАКУПЕНИ!Уникален мини...",210900.0,EUR,False,продава,тристаен,София, Подуене,,Елеганс Естейт,,https://www.imoti.net/bg/obiava/prodava--v-stroej/sofia/poduene/tristaen/5982551/?sid=gFM8jD&page=6,2.0,2025-01-16 06:03:07.725021,https://www.imoti.net/bg/obiavi/r/prodava/sofia/?page=1&sid=gFM8jD,imoti.net,498,2025-01-16,,,Цена на /м2/:1 900EUR, 111 м2,Етаж: 4 от 6
"продава Тристаен апартамент, 107 м2","iHOME REAL ESTATE предлага голям тристаен апартамент в новострояща се сграда с отлична локация до градина Родина и ул. Черковна.Апартамент А08 е с площ 106,67 кв.м. и е разположен на 5 от 9...",213340.0,EUR,False,продава,тристаен,София, Подуене,,iHOME REAL ESTATE,,https://www.imoti.net/bg/obiava/prodava--v-stroej/sofia/poduene/tristaen/5962029/?sid=gFM8jD&page=6,2.0,2025-01-16 06:03:07.725520,https://www.imoti.net/bg/obiavi/r/prodava/sofia/?page=1&sid=gFM8jD,imoti.net,498,2025-01-16,,,Цена на /м2/:1 994EUR, 107 м2,Етаж: 5 от 9
"продава Тристаен апартамент, 107 м2","БЕЗ КОМИСИОН ОТ КУПУВАЧА!НОВ ПРОЕКТ!ИРИДА НЕДВИЖИМИ ИМОТИ Ви предлага за продажба тристаен апартамент, в новострояща се сграда в район Подуяне!...",213340.0,EUR,False,продава,тристаен,София, Подуене,,ИРИДА НЕДВИЖИМИ ИМОТИ,,https://www.imoti.net/bg/obiava/prodava--v-stroej/sofia/poduene/tristaen/5943599/?sid=gFM8jD&page=6,1.0,2025-01-16 06:03:07.726031,https://www.imoti.net/bg/obiavi/r/prodava/sofia/?page=1&sid=gFM8jD,imoti.net,498,2025-01-16,,,Цена на /м2/:1 994EUR, 107 м2,Етаж: 5 от 9
"продава Тристаен апартамент, 107 м2","БЕЗ КОМИСИОН ОТ КУПУВАЧА, ЦЕНА ДИРЕКТНО ОТ СТРОИТЕЛЯ!Южен тристаен апартамент със застроена площ от 90.41 м2 (106,67 м2 с общите части). Разпределението е както следва: дневна с кухнески...",213340.0,EUR,False,продава,тристаен,София, Подуене,,Имо Хоум,,https://www.imoti.net/bg/obiava/prodava--v-stroej/sofia/poduene/tristaen/6018608/?sid=gFM8jD&page=6,10.0,2025-01-16 06:03:07.726469,https://www.imoti.net/bg/obiavi/r/prodava/sofia/?page=1&sid=gFM8jD,imoti.net,498,2025-01-16,,,Цена на /м2/:1 994EUR, 107 м2,Етаж: 6 от 9
"продава Тристаен апартамент, 107 м2","Титан Пропъртис има удоволствието да Ви представи тристаен апартамент в новострояща се жилищна сграда в кв. Подуяне. В близост са разположени множество спирки на градския транспорт, търговски...",213340.0,EUR,False,продава,тристаен,София, Подуене,,Титан Пропъртис,,https://www.imoti.net/bg/obiava/prodava/sofia/poduene/tristaen/5970940/?sid=gFM8jD&page=6,6.0,2025-01-16 06:03:07.726900,https://www.imoti.net/bg/obiavi/r/prodava/sofia/?page=1&sid=gFM8jD,imoti.net,498,2025-01-16,,,Цена на /м2/:1 994EUR, 107 м2,Етаж: 5 от 9
"продава Тристаен апартамент, 125 м2",ЕРА Идеа предлага за продажба тристаен апартамент в новострояща се жилищна сграда в кв. Подуяне. Жилището се намира на четвърти етаж с застроена площ 99.58кв.м. и обща площ 125.74кв.м. Изложение...,213800.0,EUR,False,продава,тристаен,София, Подуене,,Ера Идеа,,https://www.imoti.net/bg/obiava/prodava--v-stroej/sofia/poduene/tristaen/6009277/?sid=gFM8jD&page=6,4.0,2025-01-16 06:03:07.727332,https://www.imoti.net/bg/obiavi/r/prodava/sofia/?page=1&sid=gFM8jD,imoti.net,498,2025-01-16,,,Цена на /м2/:1 710EUR, 125 м2,Етаж:
"продава Тристаен апартамент, 90 м2","Явлена-Изток продава тристаен апартамент в новострояща се сграда в кв. Редута с площ-90 кв.м. Състоящ  се от: дневна с кухненски бокс и балкон,  две спални от която се излиза на общ балкона , две...",214000.0,EUR,False,продава,тристаен,София, Редута,,Явлена Изток,,https://www.imoti.net/bg/obiava/prodava/sofia/reduta/tristaen/5989884/?sid=gFM8jD&page=6,6.0,2025-01-16 06:03:07.727766,https://www.imoti.net/bg/obiavi/r/prodava/sofia/?page=1&sid=gFM8jD,imoti.net,498,2025-01-16,,,Цена на /м2/:2 378EUR, 90 м2,Етаж: 4 от 7
"продава Тристаен апартамент, 102 м2","Тристаен апартамент 102,15м2 с паркомясто, на 300м от метростанция Хаджи Димитър и бул.Мадрид. Доказан строител. Отлично местоположение!Жилището е със застроена площ от 82,68 м2, с...",214200.0,EUR,False,продава,тристаен,София, Суха Река,,Анети,,https://www.imoti.net/bg/obiava/prodava--v-stroej/sofia/suha-reka/tristaen/6020440/?sid=gFM8jD&page=6,7.0,2025-01-16 06:03:07.728203,https://www.imoti.net/bg/obiavi/r/prodava/sofia/?page=1&sid=gFM8jD,imoti.net,498,2025-01-16,,,Цена на /м2/:2 100EUR, 102 м2,Етаж: 6 от 8
"продава Двустаен апартамент, 72 м2","Имоти Сердика 1 продава двустаен апартамент в ж.к. Редута, гр. София. Имотът е с площ от 72кв.м. и се състои от всекидневна с кухня, спалня, баня с тоалетна, балкон към задния двор на кооперацията...",214999.0,EUR,False,продава,двустаен,София, Редута,,Сердика 1,,https://www.imoti.net/bg/obiava/prodava--v-stroej/sofia/reduta/dvustaen/5984561/?sid=gFM8jD&page=6,10.0,2025-01-16 06:03:07.728636,https://www.imoti.net/bg/obiavi/r/prodava/sofia/?page=1&sid=gFM8jD,imoti.net,498,2025-01-16,,,Цена на /м2/:2 986EUR, 72 м2,Етаж: 3 от 5
"продава Тристаен апартамент, 115 м2","БЕЗ КОМИСИОН ОТ КУПУВАЧА!ИРИДА НЕДВИЖИМИ ИМОТИ Ви предлага за продажба просторен тристаен апартамент, в новострояща се луксозна сграда, строяща се само с най-качествени материали в...",215400.0,EUR,False,продава,тристаен,София, Суха Река,,ИРИДА НЕДВИЖИМИ ИМОТИ,,https://www.imoti.net/bg/obiava/prodava--v-stroej/sofia/suha-reka/tristaen/5936892/?sid=gFM8jD&page=6,1.0,2025-01-16 06:03:07.729144,https://www.imoti.net/bg/obiavi/r/prodava/sofia/?page=1&sid=gFM8jD,imoti.net,498,2025-01-16,,,Цена на /м2/:1 873EUR, 115 м2,Етаж: 5 от 6
"продава Тристаен апартамент, 125 м2","БЕЗ КОМИСИОН ОТ КУПУВАЧА!ИРИДА НЕДВИЖИМИ ИМОТИ Ви предлага за продажба просторен тристаен апартамент, в новострояща се луксозна сграда, строяща се само с най-качествени материали в...",215600.0,EUR,False,продава,тристаен,София, Суха Река,,ИРИДА НЕДВИЖИМИ ИМОТИ,,https://www.imoti.net/bg/obiava/prodava--v-stroej/sofia/suha-reka/tristaen/5962804/?sid=gFM8jD&page=6,1.0,2025-01-16 06:03:07.729642,https://www.imoti.net/bg/obiavi/r/prodava/sofia/?page=1&sid=gFM8jD,imoti.net,498,2025-01-16,,,Цена на /м2/:1 725EUR, 125 м2,Етаж: 4 от 6
"продава Двустаен апартамент, 105 м2","БЕЗ КОМИСИОН ОТ КУПУВАЧА!НОВ ПРОЕКТ!ИРИДА НЕДВИЖИМИ ИМОТИ Ви предлага за продажба двустаен апартамент, в новострояща се сграда в район Подуяне!...",216790.0,EUR,False,продава,двустаен,София, Подуене,,ИРИДА НЕДВИЖИМИ ИМОТИ,,https://www.imoti.net/bg/obiava/prodava--v-stroej/sofia/poduene/dvustaen/5943597/?sid=gFM8jD&page=6,1.0,2025-01-16 06:03:07.730143,https://www.imoti.net/bg/obiavi/r/prodava/sofia/?page=1&sid=gFM8jD,imoti.net,498,2025-01-16,,,Цена на /м2/:2 065EUR, 105 м2,Етаж: 9 от 9
