raw_title,raw_description,price,currency,without_dds,offer_type,property_type,city,neighborhood,contact_info,agency,agency_url,details_url,num_photos,date_time_added,search_url,site,total_offers,date,ref_no,time,price_per_m2,area,floor
"продава Двустаен апартамент, 50 м2","Голямо помещение което е завършено до ключ . МОЖЕ ДА СЕ ОФОРМИ КАТО ДНЕВНА с бокс и една спалня. Има климатик и централен тец ,централно топла вода . Има Акт16.Пода е на теракот , стени латекс . В...",103500.0,BGN,False,продава,двустаен,София, Дианабад,,Dekris,,https://www.imoti.net/bg/obiava/prodava/sofia/dianabad/dvustaen/6111930/?sid=gFM8jD&page=1,4.0,2025-08-30 18:02:26.985927,https://www.imoti.net/bg/obiavi/r/prodava/sofia/?page=1&sid=gFM8jD,imoti.net,447,2025-08-30,,,Цена на /м2/:2 070EUR/4 048.57BGN, 50 м2,Етаж: 0 от 6
"продава Двустаен апартамент, 57 м2","ЕРА Идеа продава ексклузивно двустаен апартамент в ж. к. Изток. Апартаментът е разположен на 3ти етаж в сграда  ЕПК от 80-те години. Застроената площ на имота е 57.72 кв.м. Състои се от антре, две...",195000.0,BGN,False,продава,двустаен,София, Изток,,Ера Идеа,,https://www.imoti.net/bg/obiava/prodava/sofia/sofija-iztok/dvustaen/6109033/?sid=gFM8jD&page=1,13.0,2025-08-30 18:02:26.986431,https://www.imoti.net/bg/obiavi/r/prodava/sofia/?page=1&sid=gFM8jD,imoti.net,447,2025-08-30,,,Цена на /м2/:3 421EUR/6 691.00BGN, 57 м2,Етаж: 3 от 9
"продава Тристаен апартамент, 91 м2","ЕРА Идеа предлага обзаведен тристаен апартамент в ж.к. ""Сухата река"" в сграда, въведена в експлоатация през 2024г. Жилището се намира на първи жилищен етаж над гаражи. Застроената площ на имота е...",226000.0,BGN,False,продава,тристаен,София, Суха Река,,Ера Идеа,,https://www.imoti.net/bg/obiava/prodava/sofia/suha-reka/tristaen/6106708/?sid=gFM8jD&page=1,18.0,2025-08-30 18:02:26.986859,https://www.imoti.net/bg/obiavi/r/prodava/sofia/?page=1&sid=gFM8jD,imoti.net,447,2025-08-30,,,Цена на /м2/:2 484EUR/4 857.34BGN, 91 м2,Етаж: 2 от 5
"продава Двустаен апартамент, 89 м2","Ексклузивно представяме за продажба двустаен апартамент №4.28 в сграда S-Tower - нов проект с отличителен дизайн, висок клас на изпълнение, комуникативна локация и отлична възможност за инвестиция....",247041.0,BGN,False,продава,двустаен,София, Дианабад,,Luximmo Finest Estates,,https://www.imoti.net/bg/obiava/prodava--v-stroej/sofia/dianabad/dvustaen/6032718/?sid=gFM8jD&page=1,12.0,2025-08-30 18:02:26.987331,https://www.imoti.net/bg/obiavi/r/prodava/sofia/?page=1&sid=gFM8jD,imoti.net,447,2025-08-30,,,Цена на /м2/:2 776EUR/5 428.88BGN, 89 м2,Етаж:  от 15
"продава Двустаен апартамент, 65 м2","Двустаен непреходен апартамент състои се от дневна с кухненски бокс и трапезария; спалня; баня с WC; входно антре със складово помещение ; тераса.  Изложение –Североизток, Изток",255324.0,BGN,False,продава,двустаен,София, Оборище,,АДРЕС Недвижими имоти АД,,https://www.imoti.net/bg/obiava/prodava/sofia/oborishte/dvustaen/6035712/?sid=gFM8jD&page=1,18.0,2025-08-30 18:02:26.987759,https://www.imoti.net/bg/obiavi/r/prodava/sofia/?page=1&sid=gFM8jD,imoti.net,447,2025-08-30,,,Цена на /м2/:3 928EUR/7 682.62BGN, 65 м2,Етаж: 14 от 14
"продава Тристаен апартамент, 117 м2","Ексклузивно представяме за продажба комфортен тристаен апартамент №7.52 в сграда S-Tower - нов проект с отличителен дизайн, висок клас на изпълнение, комуникативна локация и отлична възможност за...",317620.0,BGN,False,продава,тристаен,София, Дианабад,,Luximmo Finest Estates,,https://www.imoti.net/bg/obiava/prodava--v-stroej/sofia/dianabad/tristaen/6017652/?sid=gFM8jD&page=1,12.0,2025-08-30 18:02:26.988238,https://www.imoti.net/bg/obiavi/r/prodava/sofia/?page=1&sid=gFM8jD,imoti.net,447,2025-08-30,,,Цена на /м2/:2 715EUR/5 309.49BGN, 117 м2,Етаж:  от 15
"продава Тристаен апартамент, 130 м2","Ексклузивно представяме за продажба тристаен апартамент в сграда S-Tower - нов проект с отличителен дизайн, висок клас на изпълнение, комуникативна локация и отлична възможност за инвестиция....",344645.0,BGN,False,продава,тристаен,София, Дианабад,,Luximmo Finest Estates,,https://www.imoti.net/bg/obiava/prodava--v-stroej/sofia/dianabad/tristaen/5805229/?sid=gFM8jD&page=1,12.0,2025-08-30 18:02:26.988706,https://www.imoti.net/bg/obiavi/r/prodava/sofia/?page=1&sid=gFM8jD,imoti.net,447,2025-08-30,,,Цена на /м2/:2 651EUR/5 185.13BGN, 130 м2,Етаж:  от 15
"продава Четиристаен апартамент, 143 м2","Продава се НОВ ПАНОРАМЕН 4-СТАЕН АПАРТАМЕНТ Т С ИЗГЛЕД КЪМ ВИТОШАград София, кв. ПодуянеЦена: 395 000 евро (2 762 евро/кв.м.)Статут: АпартаментАКТ 16...",395000.0,BGN,False,продава,четиристаен,София, Подуене,,частно лице,,https://www.imoti.net/bg/obiava/prodava/sofia/poduene/chetiristaen/6100608/?sid=gFM8jD&page=1,17.0,2025-08-30 18:02:26.989217,https://www.imoti.net/bg/obiavi/r/prodava/sofia/?page=1&sid=gFM8jD,imoti.net,447,2025-08-30,,,Цена на /м2/:2 762EUR/5 402.47BGN, 143 м2,Етаж: 6 от 10
"продава Четиристаен апартамент, 143 м2","Продава се НОВ ПАНОРАМЕН 4-СТАЕН АПАРТАМЕНТ Т С ИЗГЛЕД КЪМ ВИТОШАград София, кв. ПодуянеЦена: 395 000 евро (2 762 евро/кв.м.)Статут: АпартаментАКТ 16...",395000.0,BGN,False,продава,четиристаен,София, Суха Река,,частно лице,,https://www.imoti.net/bg/obiava/prodava/sofia/suha-reka/chetiristaen/6100609/?sid=gFM8jD&page=1,16.0,2025-08-30 18:02:26.989717,https://www.imoti.net/bg/obiavi/r/prodava/sofia/?page=1&sid=gFM8jD,imoti.net,447,2025-08-30,,,Цена на /м2/:2 762EUR/5 402.47BGN, 143 м2,Етаж: 6 от 10
"продава Четиристаен апартамент, 143 м2","Продава се НОВ ПАНОРАМЕН 4-СТАЕН АПАРТАМЕНТ Т С ИЗГЛЕД КЪМ ВИТОШАград София, кв. ПодуянеЦена: 395 000 евро (2 762 евро/кв.м.)Статут: АпартаментАКТ 16...",395000.0,BGN,False,продава,четиристаен,София, Редута,,частно лице,,https://www.imoti.net/bg/obiava/prodava/sofia/reduta/chetiristaen/6100610/?sid=gFM8jD&page=1,16.0,2025-08-30 18:02:26.990227,https://www.imoti.net/bg/obiavi/r/prodava/sofia/?page=1&sid=gFM8jD,imoti.net,447,2025-08-30,,,Цена на /м2/:2 762EUR/5 402.47BGN, 143 м2,Етаж: 6 от 10
"продава Четиристаен апартамент, 143 м2","Продава се НОВ ПАНОРАМЕН 4-СТАЕН АПАРТАМЕНТ Т С ИЗГЛЕД КЪМ ВИТОШАград София, кв. ПодуянеЦена: 395 000 евро (2 762 евро/кв.м.)Статут: АпартаментАКТ 16...",395000.0,BGN,False,продава,четиристаен,София, Оборище,,частно лице,,https://www.imoti.net/bg/obiava/prodava/sofia/oborishte/chetiristaen/6100611/?sid=gFM8jD&page=1,16.0,2025-08-30 18:02:26.990728,https://www.imoti.net/bg/obiavi/r/prodava/sofia/?page=1&sid=gFM8jD,imoti.net,447,2025-08-30,,,Цена на /м2/:2 762EUR/5 402.47BGN, 143 м2,Етаж: 6 от 10
"продава Тристаен апартамент, 122 м2","НОВА СГРАДА С АКТ 16! В НАЙ-ЖЕЛАНИЯ КВАРТАЛ - ИЗГРЕВ! Представяме на Вашето внимание тристаен апартамент, разположен на ул. Тинтява - район, който се отличава с тишина, много зеленина и модерна...",525000.0,BGN,False,продава,тристаен,София, Изгрев,,Джей и Джей Корпорейшън,,https://www.imoti.net/bg/obiava/prodava/sofia/sofija-izgrev/tristaen/6101060/?sid=gFM8jD&page=1,18.0,2025-08-30 18:02:26.991163,https://www.imoti.net/bg/obiavi/r/prodava/sofia/?page=1&sid=gFM8jD,imoti.net,447,2025-08-30,,,Цена на /м2/:4 303EUR/8 416.48BGN, 122 м2,Етаж: 4 от 7
"продава Четиристаен апартамент, 195 м2","First Estates има огромното удоволствие да Ви представи най-новия луксозен жилищен комплекс, сгушен до парка Заимов в сърцето на града. Този изключителен проект предефинира градския живот, като...",715008.0,BGN,False,продава,четиристаен,София, Оборище,,First Estates,,https://www.imoti.net/bg/obiava/prodava/sofia/oborishte/chetiristaen/5808437/?sid=gFM8jD&page=1,17.0,2025-08-30 18:02:26.991618,https://www.imoti.net/bg/obiavi/r/prodava/sofia/?page=1&sid=gFM8jD,imoti.net,447,2025-08-30,,,Цена на /м2/:3 667EUR/7 171.46BGN, 195 м2,Етаж: 3 от 14
"продава Четиристаен апартамент, 188 м2","Агенция за недвижими имоти ""First Estates"" с удоволствие представя семейно жилище с три спални в новострояща се луксозна сграда в кв.Изток.Разпределението е модерно с отворен план и се...",1022378.0,BGN,False,продава,четиристаен,София, Изгрев,,First Estates,,https://www.imoti.net/bg/obiava/prodava/sofia/sofija-izgrev/chetiristaen/5958473/?sid=gFM8jD&page=1,6.0,2025-08-30 18:02:26.992110,https://www.imoti.net/bg/obiavi/r/prodava/sofia/?page=1&sid=gFM8jD,imoti.net,447,2025-08-30,,,Цена на /м2/:5 438EUR/10 636.16BGN, 188 м2,Етаж: 7 от 8
"продава Двустаен апартамент, 58 м2","Двустайно жилище състоящо се от: антре, дневна с кухненски бокс, спралня, баня с тоалетна и тераса. Към жилището има прилежащо мазе.Има възможност за закупуване на паркомясто.",100148.0,BGN,False,продава,двустаен,София, Суха Река,,АДРЕС Недвижими имоти АД,,https://www.imoti.net/bg/obiava/prodava/sofia/suha-reka/dvustaen/6110133/?sid=gFM8jD&page=1,5.0,2025-08-30 18:02:26.992576,https://www.imoti.net/bg/obiavi/r/prodava/sofia/?page=1&sid=gFM8jD,imoti.net,447,2025-08-30,,,Цена на /м2/:1 727EUR/3 377.11BGN, 58 м2,Етаж: 4 от 5
"продава Двустаен апартамент, 46 м2",Предлагаме за продажба пред АКТ 14двустайно ателие номер 1Разпределение:▪ входно антре▪  дневна с кухненски бокс▪ самостоятелна спалня,100148.0,BGN,False,продава,двустаен,София, Суха Река,,Имотека,,https://www.imoti.net/bg/obiava/prodava/sofia/suha-reka/dvustaen/6095588/?sid=gFM8jD&page=1,2.0,2025-08-30 18:02:26.993053,https://www.imoti.net/bg/obiavi/r/prodava/sofia/?page=1&sid=gFM8jD,imoti.net,447,2025-08-30,,,Цена на /м2/:2 177EUR/4 258.10BGN, 46 м2,Етаж: 4 от 5
"продава Двустаен апартамент, 62 м2","Двустайно жилище състоящо се от: антре, дневна с кухненски бокс, спралня, баня с тоалетна и тераса. Към жилището има прилежащо мазе.Има възможност за закупуване на паркомясто.",106185.0,BGN,False,продава,двустаен,София, Суха Река,,АДРЕС Недвижими имоти АД,,https://www.imoti.net/bg/obiava/prodava/sofia/suha-reka/dvustaen/6110132/?sid=gFM8jD&page=1,5.0,2025-08-30 18:02:26.993506,https://www.imoti.net/bg/obiavi/r/prodava/sofia/?page=1&sid=gFM8jD,imoti.net,447,2025-08-30,,,Цена на /м2/:1 713EUR/3 349.67BGN, 62 м2,Етаж: 4 от 5
"продава Двустаен апартамент, 49 м2",Предлагаме за продажба пред АКТ 14двустаен апартамент №2Разпределение:▪ входно антре▪ просторна дневна с кухненски бокс▪ самостоятелна спалня...,106185.0,BGN,False,продава,двустаен,София, Суха Река,,Имотека,,https://www.imoti.net/bg/obiava/prodava/sofia/suha-reka/dvustaen/6095587/?sid=gFM8jD&page=1,2.0,2025-08-30 18:02:26.993979,https://www.imoti.net/bg/obiavi/r/prodava/sofia/?page=1&sid=gFM8jD,imoti.net,447,2025-08-30,,,Цена на /м2/:2 167EUR/4 238.36BGN, 49 м2,Етаж: 4 от 5
"продава Двустаен апартамент, 70 м2","Хоумлайт Ви представя за продажба двустаен апартамент в кв. Подуяне.Имотът се намира в малка бутикова жилищна сграда в процес на строителство, разположена на комуникативна локация, с удобен...",112000.0,BGN,False,продава,двустаен,София, Подуене,,ХОУМЛАЙТ,,https://www.imoti.net/bg/obiava/prodava/sofia/poduene/dvustaen/6106676/?sid=gFM8jD&page=1,6.0,2025-08-30 18:02:26.994479,https://www.imoti.net/bg/obiavi/r/prodava/sofia/?page=1&sid=gFM8jD,imoti.net,447,2025-08-30,,,Цена на /м2/:1 600EUR/3 129.33BGN, 70 м2,Етаж: 3 от 6
"продава Двустаен апартамент, 46 м2","ARCO REAL ESTATE представя: Двустаен апартамент в нова кооперация с АКТ 14 в кв.Сухата река.Апартамент 1 е на ет.1-ви над гаражи, със застроена площ 43..67 кв.м. с западно изложение....",112462.0,BGN,False,продава,двустаен,София, Суха Река,,ARCO REAL ESTATE,,https://www.imoti.net/bg/obiava/prodava/sofia/suha-reka/dvustaen/6101634/?sid=gFM8jD&page=1,2.0,2025-08-30 18:02:26.994985,https://www.imoti.net/bg/obiavi/r/prodava/sofia/?page=1&sid=gFM8jD,imoti.net,447,2025-08-30,,,Цена на /м2/:2 445EUR/4 781.66BGN, 46 м2,Етаж: 2 от 5
"продава Двустаен апартамент, 59 м2","Двустаен апартамент състоящ се от: антре, дневна с кухненски бокс, спралня, баня с тоалетна и тераса. Към жилището има прилежащо мазе.Има възможност за закупуване на паркомясто.",112462.0,BGN,False,продава,двустаен,София, Суха Река,,АДРЕС Недвижими имоти АД,,https://www.imoti.net/bg/obiava/prodava/sofia/suha-reka/dvustaen/6110135/?sid=gFM8jD&page=1,5.0,2025-08-30 18:02:26.995434,https://www.imoti.net/bg/obiavi/r/prodava/sofia/?page=1&sid=gFM8jD,imoti.net,447,2025-08-30,,,Цена на /м2/:1 906EUR/3 728.08BGN, 59 м2,Етаж: 2 от 5
"продава Двустаен апартамент, 47 м2","Предлагаме за продажба пред АКТ 14двустаен апартамент №1,разположен на втори етаж в модерна сграда ново строителствоРазпределение:▪ входно антре",113650.0,BGN,False,продава,двустаен,София, Суха Река,,Имотека,,https://www.imoti.net/bg/obiava/prodava/sofia/suha-reka/dvustaen/6095589/?sid=gFM8jD&page=1,2.0,2025-08-30 18:02:26.995891,https://www.imoti.net/bg/obiavi/r/prodava/sofia/?page=1&sid=gFM8jD,imoti.net,447,2025-08-30,,,Цена на /м2/:2 418EUR/4 729.36BGN, 47 м2,Етаж: 2 от 5
"продава Двустаен апартамент, 47 м2","Нов среден южен партерен имот със статут офис. Сграда с Акт 16 от 2024 г.ТЕЦ.Топ - локация в широк център, непосредствено до ул. Черковна. Сградата е на 200 метра от метростанция, 1040 м....",125000.0,BGN,False,продава,двустаен,София, Суха Река,,Юпитер-8,,https://www.imoti.net/bg/obiava/prodava/sofia/suha-reka/dvustaen/6044312/?sid=gFM8jD&page=1,6.0,2025-08-30 18:02:26.996351,https://www.imoti.net/bg/obiavi/r/prodava/sofia/?page=1&sid=gFM8jD,imoti.net,447,2025-08-30,,,Цена на /м2/:2 660EUR/5 201.68BGN, 47 м2,Етаж: 1 от 9
"продава Двустаен апартамент, 47 м2","Нов среден южен партерен имот със статут офис. Сграда с Акт 16 от 2024 г.ТЕЦ.Топ - локация в широк център, непосредствено до ул. Черковна. Сградата е на 200 метра от метростанция, 1040 м....",125000.0,BGN,False,продава,двустаен,София, Подуене,,Юпитер-8,,https://www.imoti.net/bg/obiava/prodava/sofia/poduene/dvustaen/6044314/?sid=gFM8jD&page=1,6.0,2025-08-30 18:02:26.996791,https://www.imoti.net/bg/obiavi/r/prodava/sofia/?page=1&sid=gFM8jD,imoti.net,447,2025-08-30,,,Цена на /м2/:2 660EUR/5 201.68BGN, 47 м2,Етаж: 1 от 9
"продава Двустаен апартамент, 47 м2","Нов среден южен партерен имот със статут офис. Сграда с Акт 16 от 2024 г.ТЕЦ.Топ - локация в широк център, непосредствено до ул. Черковна. Сградата е на 200 метра от метростанция, 1040 м....",125000.0,BGN,False,продава,двустаен,София, Оборище,,Юпитер-8,,https://www.imoti.net/bg/obiava/prodava/sofia/oborishte/dvustaen/6044316/?sid=gFM8jD&page=1,9.0,2025-08-30 18:02:26.997252,https://www.imoti.net/bg/obiavi/r/prodava/sofia/?page=1&sid=gFM8jD,imoti.net,447,2025-08-30,,,Цена на /м2/:2 660EUR/5 201.68BGN, 47 м2,Етаж: 1 от 9
"продава Тристаен апартамент, 76 м2","Ексклузивно! Инвест Пропъртис предлага НОВ, напълно обзаведен тристаен апартамен с ПАРКОМЯСТО. Район с перфектни комуникации- до ул. Бесарабия в близост до бул.Ботевградско шосе, стадион Герена,...",125000.0,BGN,False,продава,тристаен,София, Суха Река,,Ай пропъртис,,https://www.imoti.net/bg/obiava/prodava/sofia/suha-reka/tristaen/6114045/?sid=gFM8jD&page=1,17.0,2025-08-30 18:02:26.997697,https://www.imoti.net/bg/obiavi/r/prodava/sofia/?page=1&sid=gFM8jD,imoti.net,447,2025-08-30,,,Цена на /м2/:1 645EUR/3 216.83BGN, 76 м2,Етаж: 4 от 4
"продава Четиристаен апартамент, 86 м2","Имоти Премиер предлага на Вашето внимание имот със статут на апартамент в кв. Оборище.Намира се на полусутерен в тухлена сграда. Състои се от 4 помещения, два санитарни възела и има...",126800.0,BGN,False,продава,четиристаен,София, Оборище,,Имоти Премиер,,https://www.imoti.net/bg/obiava/prodava/sofia/oborishte/chetiristaen/5885595/?sid=gFM8jD&page=1,11.0,2025-08-30 18:02:26.998208,https://www.imoti.net/bg/obiavi/r/prodava/sofia/?page=1&sid=gFM8jD,imoti.net,447,2025-08-30,,,Цена на /м2/:1 474EUR/2 883.71BGN, 86 м2,Етаж: 0 от 5
"продава Двустаен апартамент, 80 м2","Хоумлайт Ви представя за продажба двустаен апартамент в кв. Подуяне.Имотът се намира в малка бутикова жилищна сграда в процес на строителство, разположена на комуникативна локация, с удобен...",128000.0,BGN,False,продава,двустаен,София, Подуене,,ХОУМЛАЙТ,,https://www.imoti.net/bg/obiava/prodava/sofia/poduene/dvustaen/6106527/?sid=gFM8jD&page=1,5.0,2025-08-30 18:02:26.998704,https://www.imoti.net/bg/obiavi/r/prodava/sofia/?page=1&sid=gFM8jD,imoti.net,447,2025-08-30,,,Цена на /м2/:1 600EUR/3 129.33BGN, 80 м2,Етаж: 1 от 6
"продава Двустаен апартамент, 60 м2","Mirador Real Estates има удоволствието да Ви представим двустаен апартамент, 60кв.м гр.София, кв. Сухата река. В близост до метростанция (3 мин.пеша), училище, детска градина, парк Герена....",145000.0,BGN,False,продава,двустаен,София, Суха Река,,МИРАДОР НЕДВИЖИМИ ИМОТИ,,https://www.imoti.net/bg/obiava/prodava/sofia/suha-reka/dvustaen/6102304/?sid=gFM8jD&page=1,12.0,2025-08-30 18:02:26.999155,https://www.imoti.net/bg/obiavi/r/prodava/sofia/?page=1&sid=gFM8jD,imoti.net,447,2025-08-30,,,Цена на /м2/:2 417EUR/4 726.59BGN, 60 м2,Етаж: 1 от 8
"продава Двустаен апартамент, 60 м2","ERA Фамилия представя функционален апартамент в тих и озеленен район, съчетаващ спокойствие и бърз достъп до центъра на София. Имотът е двустаен с много добри параметри и възможност за...",154000.0,BGN,False,продава,двустаен,София, Суха Река,,ЕРА Фамилия,,https://www.imoti.net/bg/obiava/prodava/sofia/suha-reka/dvustaen/6111379/?sid=gFM8jD&page=1,10.0,2025-08-30 18:02:26.999604,https://www.imoti.net/bg/obiavi/r/prodava/sofia/?page=1&sid=gFM8jD,imoti.net,447,2025-08-30,,,Цена на /м2/:2 567EUR/5 019.96BGN, 60 м2,Етаж: 2 от 4
"продава Тристаен апартамент, 65 м2","Ексклузивно!!! Galiano Estates има удоволствието да ви представи комфортен двустаен апартамент с южно изложение, функционално преустроен в два самостоятелни имота, разположен в кв. Сухата река – в...",157000.0,BGN,False,продава,тристаен,София, Суха Река,,Galiano Estates,,https://www.imoti.net/bg/obiava/prodava/sofia/suha-reka/tristaen/6097387/?sid=gFM8jD&page=2,9.0,2025-08-30 18:02:31.129063,https://www.imoti.net/bg/obiavi/r/prodava/sofia/?page=1&sid=gFM8jD,imoti.net,447,2025-08-30,,,Цена на /м2/:2 415EUR/4 724.08BGN, 65 м2,Етаж: 1 от 8
"продава Двустаен апартамент, 65 м2","'Брикс 99' продава 2-стаен слънчев и с панорама апартамент, разположен в кв. Сухата река. Апартаментът е на тихо и комуникативно място. В близост има детска градина, училище, поликлиника,...",159900.0,BGN,False,продава,двустаен,София, Суха Река,,Брикс 99,,https://www.imoti.net/bg/obiava/prodava/sofia/suha-reka/dvustaen/6109931/?sid=gFM8jD&page=2,11.0,2025-08-30 18:02:31.129565,https://www.imoti.net/bg/obiavi/r/prodava/sofia/?page=1&sid=gFM8jD,imoti.net,447,2025-08-30,,,Цена на /м2/:2 460EUR/4 811.34BGN, 65 м2,Етаж: 6 от 8
"продава Тристаен апартамент, 63 м2",,160000.0,BGN,False,продава,тристаен,София, Суха Река,,Имоти Премиер,,https://www.imoti.net/bg/obiava/prodava/sofia/suha-reka/tristaen/6094846/?sid=gFM8jD&page=2,16.0,2025-08-30 18:02:31.130087,https://www.imoti.net/bg/obiavi/r/prodava/sofia/?page=1&sid=gFM8jD,imoti.net,447,2025-08-30,,,Цена на /м2/:2 540EUR/4 967.19BGN, 63 м2,Етаж: 3 от 3
