raw_title,raw_description,price,currency,without_dds,offer_type,property_type,city,neighborhood,contact_info,agency,agency_url,details_url,num_photos,date_time_added,search_url,site,total_offers,date,ref_no,time,price_per_m2,area,floor
"продава Двустаен апартамент, 89 м2","Ексклузивно представяме за продажба двустаен апартамент №4.28 в сграда S-Tower - нов проект с отличителен дизайн, висок клас на изпълнение, комуникативна локация и отлична възможност за инвестиция....",247041.0,EUR,False,продава,двустаен,София, Дианабад,,Luximmo Finest Estates,,https://www.imoti.net/bg/obiava/prodava--v-stroej/sofia/dianabad/dvustaen/6032718/?sid=gFM8jD&page=1,12.0,2025-07-02 06:02:58.942489,https://www.imoti.net/bg/obiavi/r/prodava/sofia/?page=1&sid=gFM8jD,imoti.net,289,2025-07-02,,,Цена на /м2/:2 776EUR, 89 м2,Етаж:  от 15
"продава Двустаен апартамент, 65 м2","Двустаен непреходен апартамент състои се от дневна с кухненски бокс и трапезария; спалня; баня с WC; входно антре със складово помещение ; тераса.  Изложение –Североизток, Изток",255324.0,EUR,False,продава,двустаен,София, Оборище,,АДРЕС Недвижими имоти АД,,https://www.imoti.net/bg/obiava/prodava/sofia/oborishte/dvustaen/6035712/?sid=gFM8jD&page=1,18.0,2025-07-02 06:02:58.942983,https://www.imoti.net/bg/obiavi/r/prodava/sofia/?page=1&sid=gFM8jD,imoti.net,289,2025-07-02,,,Цена на /м2/:3 928EUR, 65 м2,Етаж: 14 от 14
"продава Тристаен апартамент, 125 м2","Прекрасен и просторен тристаен апартамент. Състои се от: две самостоятелни спални със северно изложение, дневна с площ от 34 кв.м. и южно изложение, баня с тоалетна, втори санитарен възел, малък...",275418.0,EUR,False,продава,тристаен,София, Суха Река,,АДРЕС Недвижими имоти АД,,https://www.imoti.net/bg/obiava/prodava/sofia/suha-reka/tristaen/6035730/?sid=gFM8jD&page=1,1.0,2025-07-02 06:02:58.943401,https://www.imoti.net/bg/obiavi/r/prodava/sofia/?page=1&sid=gFM8jD,imoti.net,289,2025-07-02,,,Цена на /м2/:2 203EUR, 125 м2,Етаж: 5 от 9
"продава Тристаен апартамент, 95 м2","Обзаведен, панорамен, тристаен апартамент с възможност за паркиране във вътрешен двор на сградата. Намира се в непосредствена близост до ул. Велчо Атанасов и ул. Атанас Узунов. В близост има детска...",305000.0,EUR,False,продава,тристаен,София, Редута,,ДОМИНО Риъл Естейт,,https://www.imoti.net/bg/obiava/prodava/sofia/reduta/tristaen/6090649/?sid=gFM8jD&page=1,18.0,2025-07-02 06:02:58.943826,https://www.imoti.net/bg/obiavi/r/prodava/sofia/?page=1&sid=gFM8jD,imoti.net,289,2025-07-02,,,Цена на /м2/:3 211EUR, 95 м2,Етаж: 5 от 6
"продава Тристаен апартамент, 130 м2","Ексклузивно представяме за продажба тристаен апартамент в сграда S-Tower - нов проект с отличителен дизайн, висок клас на изпълнение, комуникативна локация и отлична възможност за инвестиция....",344644.0,EUR,False,продава,тристаен,София, Дианабад,,Luximmo Finest Estates,,https://www.imoti.net/bg/obiava/prodava--v-stroej/sofia/dianabad/tristaen/5805229/?sid=gFM8jD&page=1,12.0,2025-07-02 06:02:58.944281,https://www.imoti.net/bg/obiavi/r/prodava/sofia/?page=1&sid=gFM8jD,imoti.net,289,2025-07-02,,,Цена на /м2/:2 651EUR, 130 м2,Етаж:  от 15
"продава Тристаен апартамент, 168 м2","Фърст естейтс има удоволствието да Ви представи ексклузивно този просторен тристаен апартамент в престижния квартал Изток. Перфектно проектиран за съвременно живеене, този имот предлага комбинация...",635000.0,EUR,False,продава,тристаен,София, Изток,,First Estates,,https://www.imoti.net/bg/obiava/prodava/sofia/sofija-iztok/tristaen/6090722/?sid=gFM8jD&page=1,16.0,2025-07-02 06:02:58.944739,https://www.imoti.net/bg/obiavi/r/prodava/sofia/?page=1&sid=gFM8jD,imoti.net,289,2025-07-02,,,Цена на /м2/:3 780EUR, 168 м2,Етаж: 2 от 5
"продава Четиристаен апартамент, 197 м2","Ексклузивно представяме супер просторен и уютен, четиристаен апартамент в един от най-предпочитаните райони на София – квартал ""Изток"".Жилището е част от модерна сграда, разположена...",650000.0,EUR,False,продава,четиристаен,София, Изток,,Luximmo Finest Estates,,https://www.imoti.net/bg/obiava/prodava--v-stroej/sofia/sofija-iztok/chetiristaen/5983325/?sid=gFM8jD&page=1,14.0,2025-07-02 06:02:58.945184,https://www.imoti.net/bg/obiavi/r/prodava/sofia/?page=1&sid=gFM8jD,imoti.net,289,2025-07-02,,,Цена на /м2/:3 299EUR, 197 м2,Етаж:  от 8
"продава Двустаен апартамент, 55 м2","Титан Пропъртис - офис Черни връх има удоволствието да Ви представи двустаен апартамент в Оборище. Мястото е комуникативно , в близост е до метростанция Театрална, спирки на градски транспорт,...",110000.0,EUR,False,продава,двустаен,София, Оборище,,Титан пропъртис продажби,,https://www.imoti.net/bg/obiava/prodava/sofia/oborishte/dvustaen/6022943/?sid=gFM8jD&page=1,7.0,2025-07-02 06:02:58.945612,https://www.imoti.net/bg/obiavi/r/prodava/sofia/?page=1&sid=gFM8jD,imoti.net,289,2025-07-02,,,Цена на /м2/:2 000EUR, 55 м2,Етаж: 1 от 4
"продава Тристаен апартамент, 84 м2","Явлена-Изток продава 3-стаен апартамент 84 кв.м. в ж.к. Сухата река. Състоящ се от: дневна, две спални, кухня, баня, тоалетна, мокро помещение, гардеробно и две тераси. Сградата е панел от 1974г....",125000.0,EUR,False,продава,тристаен,София, Суха Река,,Явлена Изток,,https://www.imoti.net/bg/obiava/prodava/sofia/suha-reka/tristaen/5675521/?sid=gFM8jD&page=1,12.0,2025-07-02 06:02:58.946052,https://www.imoti.net/bg/obiavi/r/prodava/sofia/?page=1&sid=gFM8jD,imoti.net,289,2025-07-02,,,Цена на /м2/:1 488EUR, 84 м2,Етаж: 6 от 8
"продава Двустаен апартамент, 47 м2","Нов среден южен партерен имот със статут офис. Сграда с Акт 16 от 2024 г.ТЕЦ.Топ - локация в широк център, непосредствено до ул. Черковна. Сградата е на 200 метра от метростанция, 1040 м....",125000.0,EUR,False,продава,двустаен,София, Суха Река,,Юпитер-8,,https://www.imoti.net/bg/obiava/prodava/sofia/suha-reka/dvustaen/6044312/?sid=gFM8jD&page=1,,2025-07-02 06:02:58.946457,https://www.imoti.net/bg/obiavi/r/prodava/sofia/?page=1&sid=gFM8jD,imoti.net,289,2025-07-02,,,Цена на /м2/:2 660EUR, 47 м2,Етаж: 1 от 9
"продава Двустаен апартамент, 47 м2","Нов среден южен партерен имот със статут офис. Сграда с Акт 16 от 2024 г.ТЕЦ.Топ - локация в широк център, непосредствено до ул. Черковна. Сградата е на 200 метра от метростанция, 1040 м....",125000.0,EUR,False,продава,двустаен,София, Подуене,,Юпитер-8,,https://www.imoti.net/bg/obiava/prodava/sofia/poduene/dvustaen/6044314/?sid=gFM8jD&page=1,,2025-07-02 06:02:58.946871,https://www.imoti.net/bg/obiavi/r/prodava/sofia/?page=1&sid=gFM8jD,imoti.net,289,2025-07-02,,,Цена на /м2/:2 660EUR, 47 м2,Етаж: 1 от 9
"продава Двустаен апартамент, 47 м2","Нов среден южен партерен имот със статут офис. Сграда с Акт 16 от 2024 г.ТЕЦ.Топ - локация в широк център, непосредствено до ул. Черковна. Сградата е на 200 метра от метростанция, 1040 м....",125000.0,EUR,False,продава,двустаен,София, Оборище,,Юпитер-8,,https://www.imoti.net/bg/obiava/prodava/sofia/oborishte/dvustaen/6044316/?sid=gFM8jD&page=1,,2025-07-02 06:02:58.947275,https://www.imoti.net/bg/obiavi/r/prodava/sofia/?page=1&sid=gFM8jD,imoti.net,289,2025-07-02,,,Цена на /м2/:2 660EUR, 47 м2,Етаж: 1 от 9
"продава Двустаен апартамент, 66 м2","Представяме двустаен апартамент за продажба в нова сграда в кв. ""Редута"".Сградата е с Акт 16 от 2025 г.Имотът се намира на тиха и спокойна улица, гарантираща комфорта...",135000.0,EUR,False,продава,двустаен,София, Редута,,SUPRIMMO,,https://www.imoti.net/bg/obiava/prodava--v-stroej/sofia/reduta/dvustaen/6002958/?sid=gFM8jD&page=1,2.0,2025-07-02 06:02:58.947723,https://www.imoti.net/bg/obiavi/r/prodava/sofia/?page=1&sid=gFM8jD,imoti.net,289,2025-07-02,,,Цена на /м2/:2 045EUR, 66 м2,Етаж:  от 6
"продава Двустаен апартамент, 77 м2","Компания `ЕКС` представя на Вашето внимание двустаен апартамент в жк Сухата река.МЕСТОПОЛОЖЕНИЕ: В близост до спирка на градски транспорт, детска градина, училище, магазини от...",138726.0,EUR,False,продава,двустаен,София, Суха Река,,ЕКС НВД,,https://www.imoti.net/bg/obiava/prodava/sofia/suha-reka/dvustaen/5899149/?sid=gFM8jD&page=1,2.0,2025-07-02 06:02:58.948156,https://www.imoti.net/bg/obiavi/r/prodava/sofia/?page=1&sid=gFM8jD,imoti.net,289,2025-07-02,,,Цена на /м2/:1 802EUR, 77 м2,Етаж: 4 от 6
"продава Двустаен апартамент, 77 м2","Компания `ЕКС` представя на Вашето внимание двустаен апартамент в жк Сухата река.МЕСТОПОЛОЖЕНИЕ: В близост до спирка на градски транспорт, детска градина, училище, магазини от...",139000.0,EUR,False,продава,двустаен,София, Суха Река,,ЕКС НВД,,https://www.imoti.net/bg/obiava/prodava--v-stroej/sofia/suha-reka/dvustaen/5900575/?sid=gFM8jD&page=1,2.0,2025-07-02 06:02:58.948581,https://www.imoti.net/bg/obiavi/r/prodava/sofia/?page=1&sid=gFM8jD,imoti.net,289,2025-07-02,,,Цена на /м2/:1 805EUR, 77 м2,Етаж: 5 от 6
"продава Двустаен апартамент, 70 м2","New Estates представя двустаен апартамент в новострояща се жилищна сграда, която се намира на едно от най-комуникативните места в София.Централното, но същевременно тихо и спокойно...",152920.0,EUR,False,продава,двустаен,София, Подуене,,New Estates,,https://www.imoti.net/bg/obiava/prodava--v-stroej/sofia/poduene/dvustaen/6044477/?sid=gFM8jD&page=1,6.0,2025-07-02 06:02:58.949015,https://www.imoti.net/bg/obiavi/r/prodava/sofia/?page=1&sid=gFM8jD,imoti.net,289,2025-07-02,,,Цена на /м2/:2 185EUR, 70 м2,Етаж: 8 от 9
"продава Тристаен апартамент, 79 м2","МЕТРО!ТИШИНА!ЕЛЕГАНТНОСТ!ПРЕДПРОДАЖБА!СКОРО ОТНОВО ЩЕ ВДИГНЕМ ЦЕНАТА, ПОБЪРЗАЙТЕ!ВЕЧЕ 60% ОТ ЖИЛИЩАТА СА ЗАКУПЕНИ!Уникален мини...",165821.0,EUR,False,продава,тристаен,София, Суха Река,,Елеганс Естейт,,https://www.imoti.net/bg/obiava/prodava--v-stroej/sofia/suha-reka/tristaen/5986842/?sid=gFM8jD&page=1,4.0,2025-07-02 06:02:58.949482,https://www.imoti.net/bg/obiavi/r/prodava/sofia/?page=1&sid=gFM8jD,imoti.net,289,2025-07-02,,,Цена на /м2/:2 099EUR, 79 м2,Етаж: 7 от 7
"продава Тристаен апартамент, 79 м2",,165900.0,EUR,False,продава,тристаен,София, Суха Река,,Глобъл Сървисиз,,https://www.imoti.net/bg/obiava/prodava/sofia/suha-reka/tristaen/6085996/?sid=gFM8jD&page=1,1.0,2025-07-02 06:02:58.949917,https://www.imoti.net/bg/obiavi/r/prodava/sofia/?page=1&sid=gFM8jD,imoti.net,289,2025-07-02,,,Цена на /м2/:2 100EUR, 79 м2,Етаж: 1 от 8
"продава Двустаен апартамент, 60 м2","Начален етап на строителство!!!ИРИДА НЕДВИЖИМИ ИМОТИ продава голям двустаен апартамент в новоизграждаща се сграда, с изключително висококачествено строителство от доказан инвеститор...",176600.0,EUR,False,продава,двустаен,София, Дианабад,,ИРИДА НЕДВИЖИМИ ИМОТИ,,https://www.imoti.net/bg/obiava/prodava--v-stroej/sofia/dianabad/dvustaen/6082472/?sid=gFM8jD&page=1,2.0,2025-07-02 06:02:58.950392,https://www.imoti.net/bg/obiavi/r/prodava/sofia/?page=1&sid=gFM8jD,imoti.net,289,2025-07-02,,,Цена на /м2/:2 943EUR, 60 м2,Етаж: 2 от 7
"продава Двустаен апартамент, 78 м2",СТАРА ТУХЛАСВОБОДНО ПАРКИРАНЕВЪЗМОЖНОСТ ЗА ПРЕУСТРОЙСТВОИРИДА НЕДВИЖИМИ ИМОТИ Ви предлага за продажба двустаен апартамент на тиха и спокойна улица обградена от...,180000.0,EUR,False,продава,двустаен,София, Суха Река,,ИРИДА НЕДВИЖИМИ ИМОТИ,,https://www.imoti.net/bg/obiava/prodava--v-stroej/sofia/suha-reka/dvustaen/6024949/?sid=gFM8jD&page=1,13.0,2025-07-02 06:02:58.950887,https://www.imoti.net/bg/obiavi/r/prodava/sofia/?page=1&sid=gFM8jD,imoti.net,289,2025-07-02,,,Цена на /м2/:2 308EUR, 78 м2,Етаж: 3 от 4
"продава Тристаен апартамент, 75 м2","Явлена- Изток продава тристаен апартамент със площ 75 м2, на 5 минути пеша от метростанция и две автобусни линии, на 10 минути пеша от Цариградско шосе, до нова детска градина и озеленено...",181000.0,EUR,False,продава,тристаен,София, Изток,,Явлена Изток,,https://www.imoti.net/bg/obiava/prodava/sofia/sofija-iztok/tristaen/5849570/?sid=gFM8jD&page=1,10.0,2025-07-02 06:02:58.951310,https://www.imoti.net/bg/obiavi/r/prodava/sofia/?page=1&sid=gFM8jD,imoti.net,289,2025-07-02,,,Цена на /м2/:2 413EUR, 75 м2,Етаж: 5 от 6
"продава Двустаен апартамент, 55 м2",Явлена Изток представя ексклузивно на Вашето вниманиедвустаен обзаведен апартамент в тухлена жилищна сграда на топ локация в гр. София район Оборище. Жилището се намира на трети жилищен...,185000.0,EUR,False,продава,двустаен,София, Оборище,,Явлена Изток,,https://www.imoti.net/bg/obiava/prodava/sofia/oborishte/dvustaen/6057856/?sid=gFM8jD&page=1,5.0,2025-07-02 06:02:58.951744,https://www.imoti.net/bg/obiavi/r/prodava/sofia/?page=1&sid=gFM8jD,imoti.net,289,2025-07-02,,,Цена на /м2/:3 364EUR, 55 м2,Етаж: 3
"продава Двустаен апартамент, 74 м2","Представяме просторен, южен двустаен имот за продажба в спокоен и зелен район, на 10 мин пеша от парк ""Герена"".Имотът е разположен на 4-ти етаж от 6. Сградата е построена от...",185000.0,EUR,False,продава,двустаен,София, Суха Река,,SUPRIMMO,,https://www.imoti.net/bg/obiava/prodava--v-stroej/sofia/suha-reka/dvustaen/6087356/?sid=gFM8jD&page=1,14.0,2025-07-02 06:02:58.952170,https://www.imoti.net/bg/obiavi/r/prodava/sofia/?page=1&sid=gFM8jD,imoti.net,289,2025-07-02,,,Цена на /м2/:2 500EUR, 74 м2,Етаж:  от 6
"продава Тристаен апартамент, 96 м2",ЕРА Идеа предлага за продажба тристаен апартамент в нова жилищна сграда в кв. Подуяне. Жилището се намира на пети етаж със застроена площ 76.90 кв.м. и обща площ 96.67кв.м. Изложение североизток....,189500.0,EUR,False,продава,тристаен,София, Подуене,,Ера Идеа,,https://www.imoti.net/bg/obiava/prodava--v-stroej/sofia/poduene/tristaen/6081194/?sid=gFM8jD&page=1,13.0,2025-07-02 06:02:58.952589,https://www.imoti.net/bg/obiavi/r/prodava/sofia/?page=1&sid=gFM8jD,imoti.net,289,2025-07-02,,,Цена на /м2/:1 974EUR, 96 м2,Етаж: 5 от 6
"продава Четиристаен апартамент, 91 м2","ПРОСТОРЕН, ВЪТРЕШЕН, ЮЖЕН, НЕПРЕХОДЕН ап. на ТОП място, в сграда на строител, завършил сгради в района, множество спирки на градския транспорт, магазини, училища, поликлиника, в спокоен и уреден...",190000.0,EUR,False,продава,четиристаен,София, Суха Река,,АЛДЕС ИМОТИ ЕООД,,https://www.imoti.net/bg/obiava/prodava/sofia/suha-reka/chetiristaen/6041858/?sid=gFM8jD&page=1,18.0,2025-07-02 06:02:58.953018,https://www.imoti.net/bg/obiavi/r/prodava/sofia/?page=1&sid=gFM8jD,imoti.net,289,2025-07-02,,,Цена на /м2/:2 088EUR, 91 м2,Етаж: 3 от 4
"продава Тристаен апартамент, 91 м2","ПРОСТОРЕН, ВЪТРЕШЕН, ЮЖЕН, НЕПРЕХОДЕН ап. на ТОП място, в сграда на строител, завършил сгради в района, множество спирки на градския транспорт, магазини, училища, поликлиника, в спокоен и уреден...",190000.0,EUR,False,продава,тристаен,София, Суха Река,,АЛДЕС ИМОТИ ЕООД,,https://www.imoti.net/bg/obiava/prodava/sofia/suha-reka/tristaen/6041859/?sid=gFM8jD&page=1,18.0,2025-07-02 06:02:58.953442,https://www.imoti.net/bg/obiavi/r/prodava/sofia/?page=1&sid=gFM8jD,imoti.net,289,2025-07-02,,,Цена на /м2/:2 088EUR, 91 м2,Етаж: 3 от 4
"продава Тристаен апартамент, 153 м2","Просторен тристаен апартамент в нова тухлена кооперация близо до Ботевградско шосе. Разпределението е входно антре, слънчева всекидневна с бокс и панорамна тераса, две спални, две санитарни...",190000.0,EUR,False,продава,тристаен,София, Суха Река,,Еколит,,https://www.imoti.net/bg/obiava/prodava/sofia/suha-reka/tristaen/3234140/?sid=gFM8jD&page=1,,2025-07-02 06:02:58.953857,https://www.imoti.net/bg/obiavi/r/prodava/sofia/?page=1&sid=gFM8jD,imoti.net,289,2025-07-02,,,Цена на /м2/:1 242EUR, 153 м2,Етаж: 6 от 7
"продава Двустаен апартамент, 71 м2","Unique Estates с Ексклузивни права да представя помещение за продажба, което е със статут на ателие и е разположено в нова и модерна сграда. Модерен комплекс състоящ се от...",190000.0,EUR,False,продава,двустаен,София, Изгрев,,ЮНИК ЕСТЕЙТС,,https://www.imoti.net/bg/obiava/prodava/sofia/sofija-izgrev/dvustaen/6040494/?sid=gFM8jD&page=1,7.0,2025-07-02 06:02:58.954280,https://www.imoti.net/bg/obiavi/r/prodava/sofia/?page=1&sid=gFM8jD,imoti.net,289,2025-07-02,,,Цена на /м2/:2 676EUR, 71 м2,Етаж: 0 от 17
"продава Тристаен апартамент, 95 м2","Явлена продава 3 - стаен непреходен апартамент с чиста площ от 77.71кв.м. или 94.91кв.м. с общи части на среден 4 - ти етаж в нова сграда  с акт 14 на границата между кварталите, Дианабад - Витоша...",194566.0,EUR,False,продава,тристаен,София, Дианабад,,Явлена София,,https://www.imoti.net/bg/obiava/prodava/sofia/dianabad/tristaen/6060727/?sid=gFM8jD&page=1,1.0,2025-07-02 06:02:58.954762,https://www.imoti.net/bg/obiavi/r/prodava/sofia/?page=1&sid=gFM8jD,imoti.net,289,2025-07-02,,,Цена на /м2/:2 048EUR, 95 м2,Етаж:
"продава Двустаен апартамент, 78 м2","ИРИДА НЕДВИЖИМИ ИМОТИ, С КЛЮЧ В АГЕНЦИЯТА!!! Ви представя за продажба прекрасен двустаен апартамент в кв. Дианабад в гр. София, в близост до множество обществен транспорт, осигуряващ връзки с...",194900.0,EUR,False,продава,двустаен,София, Дианабад,,ИРИДА НЕДВИЖИМИ ИМОТИ,,https://www.imoti.net/bg/obiava/prodava--v-stroej/sofia/dianabad/dvustaen/6071658/?sid=gFM8jD&page=1,12.0,2025-07-02 06:02:58.955231,https://www.imoti.net/bg/obiavi/r/prodava/sofia/?page=1&sid=gFM8jD,imoti.net,289,2025-07-02,,,Цена на /м2/:2 499EUR, 78 м2,Етаж: 2 от 6
"продава Двустаен апартамент, 56 м2","Реф.   012080BAS Properties предлага за продажба двустаен апартамент, разположен в един от най-предпочитаните квартали на столицата   ж.к. Дианабад, гр. София.Основни...",195000.0,EUR,False,продава,двустаен,София, Дианабад,,БАС Пропъртис,,https://www.imoti.net/bg/obiava/prodava/sofia/dianabad/dvustaen/6089818/?sid=gFM8jD&page=2,14.0,2025-07-02 06:03:02.823780,https://www.imoti.net/bg/obiavi/r/prodava/sofia/?page=1&sid=gFM8jD,imoti.net,289,2025-07-02,,,Цена на /м2/:3 482EUR, 56 м2,Етаж: 6 от 8
"продава Тристаен апартамент, 95 м2","Ново предложение! Голям тристаен класически апартамент във високата част на Редута, състои се от светла кухня с връзка към голям хол с балкон, две отделни слани, самостоятелна тоалетна, отделна...",195000.0,EUR,False,продава,тристаен,София, Редута,,SPRING,,https://www.imoti.net/bg/obiava/prodava/sofia/reduta/tristaen/6077288/?sid=gFM8jD&page=2,6.0,2025-07-02 06:03:02.824262,https://www.imoti.net/bg/obiavi/r/prodava/sofia/?page=1&sid=gFM8jD,imoti.net,289,2025-07-02,,,Цена на /м2/:2 053EUR, 95 м2,Етаж: 2 от 9
"продава Двустаен апартамент, 71 м2","Предлагаме за продажба светъл и напълно обзаведен двустаен апартамент в модерна сграда в кв. Дианабад.Статут на ателие!Имотът е със ЗП от 71 кв.м., разположен на висок 1-ви жилищен етаж над...",195000.0,EUR,False,продава,двустаен,София, Дианабад,,Luximmo Finest Estates,,https://www.imoti.net/bg/obiava/prodava--v-stroej/sofia/dianabad/dvustaen/6066667/?sid=gFM8jD&page=2,13.0,2025-07-02 06:03:02.824760,https://www.imoti.net/bg/obiavi/r/prodava/sofia/?page=1&sid=gFM8jD,imoti.net,289,2025-07-02,,,Цена на /м2/:2 746EUR, 71 м2,Етаж:  от 7
