raw_title,raw_description,price,currency,without_dds,offer_type,property_type,city,neighborhood,contact_info,agency,agency_url,details_url,num_photos,date_time_added,search_url,site,total_offers,date,ref_no,time,price_per_m2,area,floor
"продава Тристаен апартамент, 97 м2","Агенция   Явлена  ,  продава   тристаен апартамент   на   границата   на   Дианабад   и   Студентски   град .  Имотът   е   в   близост   до  автобусни   спирки,  хранителни магазини  ,  детска...",314800.0,EUR,False,продава,тристаен,София, Дианабад,,Явлена Изток,,https://www.imoti.net/bg/obiava/prodava/sofia/dianabad/tristaen/6027882/?sid=gFM8jD&page=5,5.0,2025-07-02 06:03:15.459295,https://www.imoti.net/bg/obiavi/r/prodava/sofia/?page=1&sid=gFM8jD,imoti.net,289,2025-07-02,,,Цена на /м2/:3 245EUR, 97 м2,Етаж: 5 от 6
"продава Тристаен апартамент, 117 м2","Ексклузивно представяме за продажба комфортен тристаен апартамент №7.52 в сграда S-Tower - нов проект с отличителен дизайн, висок клас на изпълнение, комуникативна локация и отлична възможност за...",317620.0,EUR,False,продава,тристаен,София, Дианабад,,Luximmo Finest Estates,,https://www.imoti.net/bg/obiava/prodava--v-stroej/sofia/dianabad/tristaen/6017652/?sid=gFM8jD&page=5,12.0,2025-07-02 06:03:15.459806,https://www.imoti.net/bg/obiavi/r/prodava/sofia/?page=1&sid=gFM8jD,imoti.net,289,2025-07-02,,,Цена на /м2/:2 715EUR, 117 м2,Етаж:  от 15
"продава Тристаен апартамент, 98 м2","Скала Ди предлага имот с уникална локация в престижния кв. Изток. Комуникативно място, на пешеходно разстояние от Метростанция и автобусна спирка, В близост до детска ясла и детска градина,...",319000.0,EUR,False,продава,тристаен,София, Изток,,Скала Ди недвижими имоти,,https://www.imoti.net/bg/obiava/prodava/sofia/sofija-iztok/tristaen/6079385/?sid=gFM8jD&page=5,10.0,2025-07-02 06:03:15.460278,https://www.imoti.net/bg/obiavi/r/prodava/sofia/?page=1&sid=gFM8jD,imoti.net,289,2025-07-02,,,Цена на /м2/:3 255EUR, 98 м2,Етаж: 2 от 4
"продава Тристаен апартамент, 98 м2","Скала Ди предлага имот с уникална локация в престижния кв. Изток. Комуникативно място, на пешеходно разстояние от Метростанция и автобусна спирка, В близост до детска ясла и детска градина,...",319000.0,EUR,False,продава,тристаен,София, Изток,,Скала Ди недвижими имоти,,https://www.imoti.net/bg/obiava/prodava/sofia/sofija-iztok/tristaen/6079386/?sid=gFM8jD&page=5,12.0,2025-07-02 06:03:15.460761,https://www.imoti.net/bg/obiavi/r/prodava/sofia/?page=1&sid=gFM8jD,imoti.net,289,2025-07-02,,,Цена на /м2/:3 255EUR, 98 м2,Етаж: 2 от 4
"продава Двустаен апартамент, 88 м2",.  .  .  .  .  .  .  .  .  .  .  .  .  .  .  .  .  .  .  .  .  .  .  .  .  .  .  .  .  . ПРЕУСТРОЕН .  .  .  .  .  .  .  .  .  .  .  .  .  .  .  .  .  .  .  .  .  .  .  .  .  .  .  .  .  .В...,320000.0,EUR,False,продава,двустаен,София, Изгрев,,АРСЕНАЛ - недвижими имоти,,https://www.imoti.net/bg/obiava/prodava/sofia/sofija-izgrev/dvustaen/5988906/?sid=gFM8jD&page=5,10.0,2025-07-02 06:03:15.461185,https://www.imoti.net/bg/obiavi/r/prodava/sofia/?page=1&sid=gFM8jD,imoti.net,289,2025-07-02,,,Цена на /м2/:3 636EUR, 88 м2,Етаж: 2 от 17
"продава Тристаен апартамент, 117 м2","Тристаен апартамент, в нов, модерен затворен комплекс в престижния квартал ""Оборище"", на метри от парк ""Заимов"".Имотът е разположен във вход ""Е"", на втори етаж и е с...",320000.0,EUR,False,продава,тристаен,София, Оборище,,АДРЕС Недвижими имоти АД,,https://www.imoti.net/bg/obiava/prodava/sofia/oborishte/tristaen/6083153/?sid=gFM8jD&page=5,4.0,2025-07-02 06:03:15.461611,https://www.imoti.net/bg/obiavi/r/prodava/sofia/?page=1&sid=gFM8jD,imoti.net,289,2025-07-02,,,Цена на /м2/:2 735EUR, 117 м2,Етаж: 2 от 11
"продава Четиристаен апартамент, 115 м2",".  .  .  .  .  .  .  .  .  .  .  ЩЕ .  .  .  .  .  .  .  .  .  .  .  .  .  .  .  .  .  .  .  .  . Ви предложим 'многофункционален' имот, ПОДХОДЯЩ както за жилище, така и за офис. Апартаментът се...",320000.0,EUR,False,продава,четиристаен,София, Изток,,АРСЕНАЛ - недвижими имоти,,https://www.imoti.net/bg/obiava/prodava/sofia/sofija-iztok/chetiristaen/5608324/?sid=gFM8jD&page=5,10.0,2025-07-02 06:03:15.462048,https://www.imoti.net/bg/obiavi/r/prodava/sofia/?page=1&sid=gFM8jD,imoti.net,289,2025-07-02,,,Цена на /м2/:2 783EUR, 115 м2,Етаж: 2 от 9
"продава Двустаен апартамент, 75 м2","ХОУМ ЛАЙТ Ви предлага уютен, двустаен апартамент на перфектна локация в кв. Изток!Жилището се намира на девети етаж в тухлена сграда, разположена в непосредствена близост до парк...",325000.0,EUR,False,продава,двустаен,София, Изток,,ХОУМЛАЙТ,,https://www.imoti.net/bg/obiava/prodava/sofia/sofija-iztok/dvustaen/6023443/?sid=gFM8jD&page=5,11.0,2025-07-02 06:03:15.462476,https://www.imoti.net/bg/obiavi/r/prodava/sofia/?page=1&sid=gFM8jD,imoti.net,289,2025-07-02,,,Цена на /м2/:4 333EUR, 75 м2,Етаж: 9 от 10
"продава Тристаен апартамент, 108 м2",Имоти ПРЕМИЕР представя на Вашето внимание тристаен апартамент в кв. Редута !Жилището е ситуирано на трети етаж в тухлена сграда без асансьор. Изложение Изток/Запад/Север. Обща площ...,325000.0,EUR,False,продава,тристаен,София, Редута,,Имоти Премиер,,https://www.imoti.net/bg/obiava/prodava/sofia/reduta/tristaen/6089525/?sid=gFM8jD&page=5,10.0,2025-07-02 06:03:15.462962,https://www.imoti.net/bg/obiavi/r/prodava/sofia/?page=1&sid=gFM8jD,imoti.net,289,2025-07-02,,,Цена на /м2/:3 009EUR, 108 м2,Етаж: 3 от 4
"продава Тристаен апартамент, 125 м2","Представяме тристаен апартамент в чисто нова бутикова сграда с отлична локация в кв. „Сухата река“. В непосредствена близост се намира метростанция „Хаджи Димитър“, а популярният парк „Заимов“,...",327132.0,EUR,False,продава,тристаен,София, Суха Река,,Luximmo Finest Estates,,https://www.imoti.net/bg/obiava/prodava--v-stroej/sofia/suha-reka/tristaen/5829598/?sid=gFM8jD&page=5,5.0,2025-07-02 06:03:15.463444,https://www.imoti.net/bg/obiavi/r/prodava/sofia/?page=1&sid=gFM8jD,imoti.net,289,2025-07-02,,,Цена на /м2/:2 617EUR, 125 м2,Етаж:  от 10
"продава Тристаен апартамент, 81 м2","Реф. № 012053Агенция за недвижими имоти BAS Properties предлага за продажба тристаен апартамент, разположен в престижния кв. Оборище, гр. София. Имотът е обзаведен, вътрешен, с...",328000.0,EUR,False,продава,тристаен,София, Оборище,,БАС Пропъртис,,https://www.imoti.net/bg/obiava/prodava/sofia/oborishte/tristaen/6086676/?sid=gFM8jD&page=5,10.0,2025-07-02 06:03:15.463891,https://www.imoti.net/bg/obiavi/r/prodava/sofia/?page=1&sid=gFM8jD,imoti.net,289,2025-07-02,,,Цена на /м2/:4 049EUR, 81 м2,Етаж: 2 от 4
"продава Тристаен апартамент, 97 м2","Революшън Естейт представя на Вашето внимание тристаен апартамент в ж.к. Редута.Намира се на комуникативно място в близост до ясли, детски градини, парк Гео Милев, спирки на градски...",330000.0,EUR,False,продава,тристаен,София, Редута,,Революшън Естейт България,,https://www.imoti.net/bg/obiava/prodava/sofia/reduta/tristaen/6047262/?sid=gFM8jD&page=5,15.0,2025-07-02 06:03:15.464321,https://www.imoti.net/bg/obiavi/r/prodava/sofia/?page=1&sid=gFM8jD,imoti.net,289,2025-07-02,,,Цена на /м2/:3 402EUR, 97 м2,Етаж: 3 от 5
"продава Тристаен апартамент, 119 м2","Явлена-Изток представя тристаен апартамент в квартал Редута, на комуникативно място и добра локация. ПРЕД АКТ 16!Апартамента е непреходен, със северозападно изложение, на партерен етаж с...",332000.0,EUR,False,продава,тристаен,София, Редута,,Явлена Изток,,https://www.imoti.net/bg/obiava/prodava/sofia/reduta/tristaen/6031547/?sid=gFM8jD&page=5,8.0,2025-07-02 06:03:15.464752,https://www.imoti.net/bg/obiavi/r/prodava/sofia/?page=1&sid=gFM8jD,imoti.net,289,2025-07-02,,,Цена на /м2/:2 790EUR, 119 м2,Етаж: 0 от 8
"продава Двустаен апартамент, 74 м2","Unique estates има удоволствието да ви представи на вашето внимание едно изключително предложение за продажба – прекрасно обзаведен двустаен апартамент, разположен в...",333000.0,EUR,False,продава,двустаен,София, Дианабад,,ЮНИК ЕСТЕЙТС,,https://www.imoti.net/bg/obiava/prodava/sofia/dianabad/dvustaen/6088416/?sid=gFM8jD&page=5,10.0,2025-07-02 06:03:15.465207,https://www.imoti.net/bg/obiavi/r/prodava/sofia/?page=1&sid=gFM8jD,imoti.net,289,2025-07-02,,,Цена на /м2/:4 500EUR, 74 м2,Етаж: 1 от 6
"продава Тристаен апартамент, 100 м2","Ексклузивно представяме автентично тристайно жилище от 80-те години, с обща площ 100 кв.м, за продажба в престижния столичен кв. ""Изток"".Местоположението на имота е на емблематичната...",335000.0,EUR,False,продава,тристаен,София, Изток,,Luximmo Finest Estates,,https://www.imoti.net/bg/obiava/prodava--v-stroej/sofia/sofija-iztok/tristaen/5716842/?sid=gFM8jD&page=5,5.0,2025-07-02 06:03:15.465682,https://www.imoti.net/bg/obiavi/r/prodava/sofia/?page=1&sid=gFM8jD,imoti.net,289,2025-07-02,,,Цена на /м2/:3 350EUR, 100 м2,Етаж:  от 14
"продава Двустаен апартамент, 139 м2","ЕРА Идеа предлага тристаен апартамент в нова  жилищна сграда в кв. ""Редута"" - на 200м. от парк ""Гео Милев"", най -привлекателната част на квартала.Апартаментът се намира на 5ти жилищен етаж....",335328.0,EUR,False,продава,двустаен,София, Редута,,Ера Идеа,,https://www.imoti.net/bg/obiava/prodava--v-stroej/sofia/reduta/dvustaen/6079631/?sid=gFM8jD&page=5,2.0,2025-07-02 06:03:15.466120,https://www.imoti.net/bg/obiavi/r/prodava/sofia/?page=1&sid=gFM8jD,imoti.net,289,2025-07-02,,,Цена на /м2/:2 412EUR, 139 м2,Етаж: 5 от 6
"продава Тристаен апартамент, 139 м2","Предлагаме на Вашето внимание тристаен апартамент, разположен на пети етаж в модерна жилищна сграда в един от най-предпочитаните райони на столицата – кв. Редута. Имотът е с обща площ от 53.70...",335328.0,EUR,False,продава,тристаен,София, Редута,,Luximmo Finest Estates,,https://www.imoti.net/bg/obiava/prodava--v-stroej/sofia/reduta/tristaen/6070498/?sid=gFM8jD&page=5,4.0,2025-07-02 06:03:15.466589,https://www.imoti.net/bg/obiavi/r/prodava/sofia/?page=1&sid=gFM8jD,imoti.net,289,2025-07-02,,,Цена на /м2/:2 412EUR, 139 м2,Етаж:  от 6
"продава Тристаен апартамент, 62 м2","Представяме на Вашето внимание ексклузивен тристаен апартамент с площ от 62,71 кв.м, разположен на първи етаж в жилищна сграда на улица ""Алеко Константинов"" в един от най-емблематичните и...",336000.0,EUR,False,продава,тристаен,София, Оборище,,Luximmo Finest Estates,,https://www.imoti.net/bg/obiava/prodava--v-stroej/sofia/oborishte/tristaen/6071498/?sid=gFM8jD&page=5,28.0,2025-07-02 06:03:15.467076,https://www.imoti.net/bg/obiavi/r/prodava/sofia/?page=1&sid=gFM8jD,imoti.net,289,2025-07-02,,,Цена на /м2/:5 419EUR, 62 м2,Етаж:  от 4
"продава Тристаен апартамент, 62 м2","Представяме на Вашето внимание ексклузивен тристаен апартамент с площ от 62,71 кв.м, разположен на първи етаж в жилищна сграда на улица ""Алеко Константинов"" в един от най-емблематичните и...",336000.0,EUR,False,продава,тристаен,София, Оборище,,Luximmo Finest Estates,,https://www.imoti.net/bg/obiava/prodava--v-stroej/sofia/oborishte/tristaen/6071036/?sid=gFM8jD&page=5,28.0,2025-07-02 06:03:15.467548,https://www.imoti.net/bg/obiavi/r/prodava/sofia/?page=1&sid=gFM8jD,imoti.net,289,2025-07-02,,,Цена на /м2/:5 419EUR, 62 м2,Етаж:  от 4
"продава Многостаен апартамент, 139 м2","Просторен и функционален многостаен апартамент с площ от 139 кв.м, разположен в престижния квартал Витоша, в близост до кв. Дианабад. Жилището се намира в поддържана сграда с отлична локация,...",347500.0,EUR,False,продава,многостаен,София, Дианабад,,АДРЕС Недвижими имоти АД,,https://www.imoti.net/bg/obiava/prodava/sofia/dianabad/mnogostaen/6089452/?sid=gFM8jD&page=6,1.0,2025-07-02 06:03:19.770815,https://www.imoti.net/bg/obiavi/r/prodava/sofia/?page=1&sid=gFM8jD,imoti.net,289,2025-07-02,,,Цена на /м2/:2 500EUR, 139 м2,Етаж: 1 от 8
"продава Многостаен апартамент, 145 м2","ПРОСТОРЕН!!! ИМОТ С ПОТЕНЦИАЛ !!! В ТИХАТА ЧАСТ НА КВ.ИЗТОК!!! Явлена представя на Вашето внимание многостаен апартамент находящ се в един от най-предпочитаните квартали в столицата, а именно...",349000.0,EUR,False,продава,многостаен,София, Изток,,Явлена София,,https://www.imoti.net/bg/obiava/prodava/sofia/sofija-iztok/mnogostaen/6002209/?sid=gFM8jD&page=6,10.0,2025-07-02 06:03:19.771344,https://www.imoti.net/bg/obiavi/r/prodava/sofia/?page=1&sid=gFM8jD,imoti.net,289,2025-07-02,,,Цена на /м2/:2 407EUR, 145 м2,Етаж: 2 от 6
"продава Четиристаен апартамент, 120 м2","Представяме Ви четиристаен апартамент на 300 метра от жълтите павета и ЦУМ, със застроена площ от 120 кв.м.Намира се в район ""Оборище"" на улица ""Сердика"", като на пешеходно разстояние се...",349990.0,EUR,False,продава,четиристаен,София, Оборище,,ANTRE,,https://www.imoti.net/bg/obiava/prodava/sofia/oborishte/chetiristaen/6076544/?sid=gFM8jD&page=6,11.0,2025-07-02 06:03:19.771786,https://www.imoti.net/bg/obiavi/r/prodava/sofia/?page=1&sid=gFM8jD,imoti.net,289,2025-07-02,,,Цена на /м2/:2 917EUR, 120 м2,Етаж: 3 от 5
"продава Тристаен апартамент, 120 м2","Представяме Ви тристаен апартамент на 300 метра от жълтите павета и ЦУМ, със застроена площ от 120 кв.м.Намира се в район ""Оборище"" на улица ""Сердика"", като на пешеходно разстояние се...",349990.0,EUR,False,продава,тристаен,София, Оборище,,ANTRE,,https://www.imoti.net/bg/obiava/prodava/sofia/oborishte/tristaen/6076546/?sid=gFM8jD&page=6,11.0,2025-07-02 06:03:19.772215,https://www.imoti.net/bg/obiavi/r/prodava/sofia/?page=1&sid=gFM8jD,imoti.net,289,2025-07-02,,,Цена на /м2/:2 917EUR, 120 м2,Етаж: 3 от 5
"продава Четиристаен апартамент, 114 м2","Представяме на Вашето внимание четиристаен апартамент за продажба в бутикова жилищна сграда в престижния столичен квартал “Оборище”.Разположен в живописното спокойствие на уединена улица,...",350000.0,EUR,False,продава,четиристаен,София, Оборище,,SUPRIMMO,,https://www.imoti.net/bg/obiava/prodava--v-stroej/sofia/oborishte/chetiristaen/5897035/?sid=gFM8jD&page=6,5.0,2025-07-02 06:03:19.772631,https://www.imoti.net/bg/obiavi/r/prodava/sofia/?page=1&sid=gFM8jD,imoti.net,289,2025-07-02,,,Цена на /м2/:3 070EUR, 114 м2,Етаж:  от 6
"продава Тристаен апартамент, 141 м2","Unique Estates представя на Вашето внимание един просторен тристаен апартамент с площ от 141кв.м., в новострояща се сграда в близост до ул. Черковна.",352000.0,EUR,False,продава,тристаен,София, Оборище,,ЮНИК ЕСТЕЙТС,,https://www.imoti.net/bg/obiava/prodava--v-stroej/sofia/oborishte/tristaen/6037233/?sid=gFM8jD&page=6,5.0,2025-07-02 06:03:19.773113,https://www.imoti.net/bg/obiavi/r/prodava/sofia/?page=1&sid=gFM8jD,imoti.net,289,2025-07-02,,,Цена на /м2/:2 496EUR, 141 м2,Етаж: 4 от 7
"продава Тристаен апартамент, 136 м2","Galiano Estates Ви предлага тристаен апартамент в сграда с AKT16, която се намира в кв. Дианабад,Разпределението на помещенията е както следва: входно антре, всекидневна с трапезария и...",354000.0,EUR,False,продава,тристаен,София, Дианабад,,Galiano Estates,,https://www.imoti.net/bg/obiava/prodava/sofia/dianabad/tristaen/5955338/?sid=gFM8jD&page=6,3.0,2025-07-02 06:03:19.773630,https://www.imoti.net/bg/obiavi/r/prodava/sofia/?page=1&sid=gFM8jD,imoti.net,289,2025-07-02,,,Цена на /м2/:2 603EUR, 136 м2,Етаж: 2 от 9
"продава Тристаен апартамент, 100 м2","Собственик продава личен тристаен, преходен апартамент в квартал Изток, в близост до Билла / Цариградско Шоде висок партер (над мазета), на 200м от Борисовата Градина. Стара тухла, ТЕЦ, климатик,...",355000.0,EUR,False,продава,тристаен,София, Изток,,частно лице,,https://www.imoti.net/bg/obiava/prodava/sofia/sofija-iztok/tristaen/6087764/?sid=gFM8jD&page=6,11.0,2025-07-02 06:03:19.774122,https://www.imoti.net/bg/obiavi/r/prodava/sofia/?page=1&sid=gFM8jD,imoti.net,289,2025-07-02,,,Цена на /м2/:3 550EUR, 100 м2,Етаж: 1 от 5
"продава Тристаен апартамент, 95 м2","Обзаведен тристаен в Дианабад на границата с Изгрев. На четвърти етаж от 5, изцяло покрит.Квадратура: 95 кв.м. ОП // 80 кв.м. ЧПРазпределение:Дневна с...",360000.0,EUR,False,продава,тристаен,София, Дианабад,,АДРЕС Недвижими имоти АД,,https://www.imoti.net/bg/obiava/prodava/sofia/dianabad/tristaen/6089047/?sid=gFM8jD&page=6,17.0,2025-07-02 06:03:19.774553,https://www.imoti.net/bg/obiavi/r/prodava/sofia/?page=1&sid=gFM8jD,imoti.net,289,2025-07-02,,,Цена на /м2/:3 789EUR, 95 м2,Етаж:  от 5
"продава Тристаен апартамент, 135 м2","Представяме на Вашето внимание тристаен апартамент в сграда въведена в експлоатация 2010 година.Апартаментът е със следното разпределение: входно антре,просторна всекидневна с кухненски бокс,две...",360000.0,EUR,False,продава,тристаен,София, Оборище,,Имотен център България 2021,,https://www.imoti.net/bg/obiava/prodava/sofia/oborishte/tristaen/6088541/?sid=gFM8jD&page=6,17.0,2025-07-02 06:03:19.775044,https://www.imoti.net/bg/obiavi/r/prodava/sofia/?page=1&sid=gFM8jD,imoti.net,289,2025-07-02,,,Цена на /м2/:2 667EUR, 135 м2,Етаж: 3 от 7
"продава Тристаен апартамент, 95 м2",Просторен тристаен апартамент в непосредствена близост до ул.Оборище и на пешеходно разстояние от мол Сердика- само на няколко крачки.  В близост е кръстовището на ул.Черковна и ул.Оборище и...,360000.0,EUR,False,продава,тристаен,София, Оборище,,Диана Хоумс,,https://www.imoti.net/bg/obiava/prodava/sofia/oborishte/tristaen/6062498/?sid=gFM8jD&page=6,10.0,2025-07-02 06:03:19.775514,https://www.imoti.net/bg/obiavi/r/prodava/sofia/?page=1&sid=gFM8jD,imoti.net,289,2025-07-02,,,Цена на /м2/:3 789EUR, 95 м2,Етаж: 3 от 3
"продава Тристаен апартамент, 144 м2","Unique Estates представя на Вашето внимание един просторен тристаен апартамент с площ от 144кв.м., в новострояща се сграда в близост до ул. Черковна.",360000.0,EUR,False,продава,тристаен,София, Оборище,,ЮНИК ЕСТЕЙТС,,https://www.imoti.net/bg/obiava/prodava--v-stroej/sofia/oborishte/tristaen/6037232/?sid=gFM8jD&page=6,4.0,2025-07-02 06:03:19.775947,https://www.imoti.net/bg/obiavi/r/prodava/sofia/?page=1&sid=gFM8jD,imoti.net,289,2025-07-02,,,Цена на /м2/:2 500EUR, 144 м2,Етаж: 2 от 6
"продава Двустаен апартамент, 105 м2","Unique Estates представя на Вашето внимание двустаен апартамент за продажба в уникална по рода си сграда, съчетаваща модерна архитектура, първокласно качество на строителство и...",365995.0,EUR,False,продава,двустаен,София, Дианабад,,ЮНИК ЕСТЕЙТС,,https://www.imoti.net/bg/obiava/prodava--v-stroej/sofia/dianabad/dvustaen/6076431/?sid=gFM8jD&page=6,9.0,2025-07-02 06:03:19.776367,https://www.imoti.net/bg/obiavi/r/prodava/sofia/?page=1&sid=gFM8jD,imoti.net,289,2025-07-02,,,Цена на /м2/:3 486EUR, 105 м2,Етаж: 7 от 15
"продава Тристаен апартамент, 146 м2","New Estates има удоволствието да ви представи 3-стаен апартамент в един от най-престижните жилищни комплекси в центъра на София. Новият отличителен проект се гордее със своя оригинален дизайн,...",366365.0,EUR,False,продава,тристаен,София, Оборище,,New Estates,,https://www.imoti.net/bg/obiava/prodava--v-stroej/sofia/oborishte/tristaen/6027028/?sid=gFM8jD&page=6,17.0,2025-07-02 06:03:19.776798,https://www.imoti.net/bg/obiavi/r/prodava/sofia/?page=1&sid=gFM8jD,imoti.net,289,2025-07-02,,,Цена на /м2/:2 509EUR, 146 м2,Етаж: 5 от 14
