raw_title,raw_description,price,currency,without_dds,offer_type,property_type,city,neighborhood,contact_info,agency,agency_url,details_url,num_photos,date_time_added,search_url,site,total_offers,date,ref_no,time,price_per_m2,area,floor
"продава Двустаен апартамент, 60 м2","Имотен Център ви предлага двустаен апартамент в нова жилищна сграда в кв.Сухата река на ул.Железни Врата 19.Апартаментът е перфектен, както за живеене, така и за отдаване под наем с...",99000.0,EUR,False,продава,двустаен,София, Суха Река,,Имотен център България 2021,,https://www.imoti.net/bg/obiava/prodava--v-stroej/sofia/suha-reka/dvustaen/6020928/?sid=gFM8jD&page=1,10.0,2025-01-16 06:02:29.693277,https://www.imoti.net/bg/obiavi/r/prodava/sofia/?page=1&sid=gFM8jD,imoti.net,498,2025-01-16,,,Цена на /м2/:1 650EUR, 60 м2,Етаж: 4 от 5
"продава Двустаен апартамент, 75 м2","Продава се ПРОСТОРЕН И УЮТЕН 2-СТАЕН АПАРТАМЕНТ с изглед към Витошаград София, кв. ПодуянеЦена: 179,232 евро (2,400 евро/кв.м.)Статут: Апартамент...",179232.0,EUR,False,продава,двустаен,София, Подуене,,частно лице,,https://www.imoti.net/bg/obiava/prodava/sofia/poduene/dvustaen/6010237/?sid=gFM8jD&page=1,13.0,2025-01-16 06:02:29.693843,https://www.imoti.net/bg/obiavi/r/prodava/sofia/?page=1&sid=gFM8jD,imoti.net,498,2025-01-16,,,Цена на /м2/:2 390EUR, 75 м2,Етаж: 6 от 10
"продава Двустаен апартамент, 75 м2","Продава се ПРОСТОРЕН И УЮТЕН 2-СТАЕН АПАРТАМЕНТ с изглед към Витошаград София, кв. ПодуянеЦена: 179,232 евро (2,400 евро/кв.м.)Статут: Апартамент...",179232.0,EUR,False,продава,двустаен,София, Суха Река,,частно лице,,https://www.imoti.net/bg/obiava/prodava/sofia/suha-reka/dvustaen/6019551/?sid=gFM8jD&page=1,16.0,2025-01-16 06:02:29.694346,https://www.imoti.net/bg/obiavi/r/prodava/sofia/?page=1&sid=gFM8jD,imoti.net,498,2025-01-16,,,Цена на /м2/:2 390EUR, 75 м2,Етаж: 6 от 10
"продава Тристаен апартамент, 91 м2","ЕКСКЛУЗИВНО! ЕРА ИДЕА предлага обзаведен апартамент в ж.к. ""Сухата река"". Апартамента се намира на 1ви жилищен етаж над гаражи в малка тухлена сграда. Застроената площ е 75 кв.м. със следното...",223000.0,EUR,False,продава,тристаен,София, Суха Река,,Ера Идеа,,https://www.imoti.net/bg/obiava/prodava--v-stroej/sofia/suha-reka/tristaen/5989559/?sid=gFM8jD&page=1,12.0,2025-01-16 06:02:29.694776,https://www.imoti.net/bg/obiavi/r/prodava/sofia/?page=1&sid=gFM8jD,imoti.net,498,2025-01-16,,,Цена на /м2/:2 451EUR, 91 м2,Етаж:
"продава Тристаен апартамент, 93 м2","Продава се НОВ ПАНОРАМЕН 3-СТАЕН АПАРТАМЕНТ С ИЗГЛЕД КЪМ ВИТОШАград София, кв. ПодуянеЦена: 229,000 евро (2,458 евро/кв.м.)Статут: АпартаментАКТ 16 -...",229000.0,EUR,False,продава,тристаен,София, Подуене,,частно лице,,https://www.imoti.net/bg/obiava/prodava/sofia/poduene/tristaen/6010221/?sid=gFM8jD&page=1,16.0,2025-01-16 06:02:29.695267,https://www.imoti.net/bg/obiavi/r/prodava/sofia/?page=1&sid=gFM8jD,imoti.net,498,2025-01-16,,,Цена на /м2/:2 462EUR, 93 м2,Етаж: 6 от 10
"продава Тристаен апартамент, 93 м2","ОписаниеПродава се НОВ ПАНОРАМЕН 3-СТАЕН АПАРТАМЕНТ С ИЗГЛЕД КЪМ ВИТОШАград София, кв. ПодуянеЦена: 229,000 евро (2,458 евро/кв.м.)Статут:...",229000.0,EUR,False,продава,тристаен,София, Суха Река,,частно лице,,https://www.imoti.net/bg/obiava/prodava/sofia/suha-reka/tristaen/6019550/?sid=gFM8jD&page=1,20.0,2025-01-16 06:02:29.695767,https://www.imoti.net/bg/obiavi/r/prodava/sofia/?page=1&sid=gFM8jD,imoti.net,498,2025-01-16,,,Цена на /м2/:2 462EUR, 93 м2,Етаж: 6 от 10
"продава Двустаен апартамент, 59 м2","Агенция за недвижими имоти 'ПРОХОУМ СОФИЯ' предлага двустаен апартамент в престижния комплекс 'ЕСТЕ'. Жилището е със следното разпределение: антре, хол с кухня, спалня, баня с тоалетна, тераса,...",249999.0,EUR,False,продава,двустаен,София, Изток,,ПРОХОУМ СОФИЯ,,https://www.imoti.net/bg/obiava/prodava/sofia/sofija-iztok/dvustaen/6005728/?sid=gFM8jD&page=1,16.0,2025-01-16 06:02:29.696448,https://www.imoti.net/bg/obiavi/r/prodava/sofia/?page=1&sid=gFM8jD,imoti.net,498,2025-01-16,,,Цена на /м2/:4 237EUR, 59 м2,Етаж: 5 от 7
"продава Тристаен апартамент, 90 м2","Агенция Релард Естейтс предлага обзаведен тристаен апартамент в тухлена сграда, предлагаща комфорт и стил в едно.Със своите две спални, всекидневна, кухня, баня с тоалетна,...",269000.0,EUR,False,продава,тристаен,София, Оборище,,Релард Естейтс,,https://www.imoti.net/bg/obiava/prodava/sofia/oborishte/tristaen/5966212/?sid=gFM8jD&page=1,11.0,2025-01-16 06:02:29.696943,https://www.imoti.net/bg/obiavi/r/prodava/sofia/?page=1&sid=gFM8jD,imoti.net,498,2025-01-16,,,Цена на /м2/:2 989EUR, 90 м2,Етаж: 2 от 6
"продава Четиристаен апартамент, 143 м2","Продава се НОВ ПАНОРАМЕН 4-СТАЕН АПАРТАМЕНТ Т С ИЗГЛЕД КЪМ ВИТОШАград София, кв. ПодуянеЦена: 314 600 евро (2,200 евро/кв.м.)Статут: АпартаментАКТ 16...",314600.0,EUR,False,продава,четиристаен,София, Подуене,,частно лице,,https://www.imoti.net/bg/obiava/prodava/sofia/poduene/chetiristaen/6010175/?sid=gFM8jD&page=1,20.0,2025-01-16 06:02:29.697464,https://www.imoti.net/bg/obiavi/r/prodava/sofia/?page=1&sid=gFM8jD,imoti.net,498,2025-01-16,,,Цена на /м2/:2 200EUR, 143 м2,Етаж: 6 от 10
"продава Четиристаен апартамент, 143 м2","Продава се НОВ ПАНОРАМЕН 4-СТАЕН АПАРТАМЕНТ Т С ИЗГЛЕД КЪМ ВИТОШАград София, кв. ПодуянеЦена: 314 600 евро (2,200 евро/кв.м.)Статут: АпартаментАКТ 16...",314600.0,EUR,False,продава,четиристаен,София, Суха Река,,частно лице,,https://www.imoti.net/bg/obiava/prodava/sofia/suha-reka/chetiristaen/6019549/?sid=gFM8jD&page=1,20.0,2025-01-16 06:02:29.697966,https://www.imoti.net/bg/obiavi/r/prodava/sofia/?page=1&sid=gFM8jD,imoti.net,498,2025-01-16,,,Цена на /м2/:2 200EUR, 143 м2,Етаж: 6 от 10
"продава Тристаен апартамент, 125 м2","Представяме тристаен апартамент в чисто нова бутикова сграда с отлична локация в кв. „Сухата река“. В непосредствена близост се намира метростанция „Хаджи Димитър“, а популярният парк „Заимов“,...",327132.0,EUR,False,продава,тристаен,София, Суха Река,,Luximmo Finest Estates,,https://www.imoti.net/bg/obiava/prodava--v-stroej/sofia/suha-reka/tristaen/5829598/?sid=gFM8jD&page=1,5.0,2025-01-16 06:02:29.698441,https://www.imoti.net/bg/obiavi/r/prodava/sofia/?page=1&sid=gFM8jD,imoti.net,498,2025-01-16,,,Цена на /м2/:2 617EUR, 125 м2,Етаж:  от 10
"продава Тристаен апартамент, 130 м2","Ексклузивно представяме за продажба тристаен апартамент в сграда S-Tower - нов проект с отличителен дизайн, висок клас на изпълнение, комуникативна локация и отлична възможност за инвестиция....",344644.0,EUR,False,продава,тристаен,София, Дианабад,,Luximmo Finest Estates,,https://www.imoti.net/bg/obiava/prodava--v-stroej/sofia/dianabad/tristaen/5805229/?sid=gFM8jD&page=1,25.0,2025-01-16 06:02:29.698917,https://www.imoti.net/bg/obiavi/r/prodava/sofia/?page=1&sid=gFM8jD,imoti.net,498,2025-01-16,,,Цена на /м2/:2 651EUR, 130 м2,Етаж:  от 15
"продава Четиристаен апартамент, 171 м2",Обзаведен четиристаен апартамент с премиум местоположение в затворен комплекс Fairplay кв. ИзтокBULGARIA SOTHEBY'S INTERNATIONAL REALTY има удоволствието да Ви предложи зашеметяващ...,770000.0,EUR,False,продава,четиристаен,София, Изток,,BULGARIA SOTHEBY'S INTERNATIONAL REALTY,,https://www.imoti.net/bg/obiava/prodava/sofia/sofija-iztok/chetiristaen/5907025/?sid=gFM8jD&page=1,11.0,2025-01-16 06:02:29.699435,https://www.imoti.net/bg/obiavi/r/prodava/sofia/?page=1&sid=gFM8jD,imoti.net,498,2025-01-16,,,Цена на /м2/:4 503EUR, 171 м2,Етаж: 2 от 7
"продава Двустаен апартамент, 40 м2","Представяме класическа гарсониера за продажба, на удобна локация на метри от магазин ""Фантастико"", спирка на градски транспорт и пазар, до парк ""Герена"" в кв. ""Сухата река"".Имотът е...",95000.0,EUR,False,продава,двустаен,София, Суха Река,,SUPRIMMO,,https://www.imoti.net/bg/obiava/prodava--v-stroej/sofia/suha-reka/dvustaen/6013795/?sid=gFM8jD&page=1,11.0,2025-01-16 06:02:29.699883,https://www.imoti.net/bg/obiavi/r/prodava/sofia/?page=1&sid=gFM8jD,imoti.net,498,2025-01-16,,,Цена на /м2/:2 375EUR, 40 м2,Етаж:  от 8
"продава Двустаен апартамент, 58 м2","АКТ 15АКТ 16-декември 2024г.ИРИДА НЕДВИЖИМИ ИМОТИ Ви предлага за продажба двустаен апартамент, в новопостроена сграда, в кв.Суха река!Апартаментът е със ЗП от 48...",110000.0,EUR,False,продава,двустаен,София, Суха Река,,ИРИДА НЕДВИЖИМИ ИМОТИ,,https://www.imoti.net/bg/obiava/prodava--v-stroej/sofia/suha-reka/dvustaen/5943393/?sid=gFM8jD&page=1,6.0,2025-01-16 06:02:29.700392,https://www.imoti.net/bg/obiavi/r/prodava/sofia/?page=1&sid=gFM8jD,imoti.net,498,2025-01-16,,,Цена на /м2/:1 897EUR, 58 м2,Етаж: 2 от 5
"продава Двустаен апартамент, 70 м2",iHOME REAL ESTATE предлага невероятна възможност за закупуване на самостоятелно жилище в кв. Сухата река на ул. Людвик Заменхов. Имотът съчетава в себе си идеалната възможност за спокойно живеене....,112700.0,EUR,False,продава,двустаен,София, Суха Река,,iHOME REAL ESTATE,,https://www.imoti.net/bg/obiava/prodava--v-stroej/sofia/suha-reka/dvustaen/5823797/?sid=gFM8jD&page=1,5.0,2025-01-16 06:02:29.700913,https://www.imoti.net/bg/obiavi/r/prodava/sofia/?page=1&sid=gFM8jD,imoti.net,498,2025-01-16,,,Цена на /м2/:1 610EUR, 70 м2,Етаж: 2 от 3
"продава Двустаен апартамент, 65 м2","БЕЗ КОМИСИОН ОТ КУПУВАЧА!ИРИДА НЕДВИЖИМИ ИМОТИ Ви предлага за продажба двустаен апартамент, в новострояща се луксозна сграда, строяща се само с най-качествени материали в...",115000.0,EUR,False,продава,двустаен,София, Суха Река,,ИРИДА НЕДВИЖИМИ ИМОТИ,,https://www.imoti.net/bg/obiava/prodava--v-stroej/sofia/suha-reka/dvustaen/5936887/?sid=gFM8jD&page=1,1.0,2025-01-16 06:02:29.701420,https://www.imoti.net/bg/obiavi/r/prodava/sofia/?page=1&sid=gFM8jD,imoti.net,498,2025-01-16,,,Цена на /м2/:1 769EUR, 65 м2,Етаж: 3 от 6
"продава Двустаен апартамент, 63 м2","МЕТРО!ТИШИНА!ЕЛЕГАНТНОСТ!ПРЕДПРОДАЖБА!СКОРО ОТНОВО ЩЕ ВДИГНЕМ ЦЕНАТА, ПОБЪРЗАЙТЕ!ВЕЧЕ 60% ОТ ЖИЛИЩАТА СА ЗАКУПЕНИ!Уникален мини...",119700.0,EUR,False,продава,двустаен,София, Подуене,,Елеганс Естейт,,https://www.imoti.net/bg/obiava/prodava--v-stroej/sofia/poduene/dvustaen/5982550/?sid=gFM8jD&page=1,4.0,2025-01-16 06:02:29.702061,https://www.imoti.net/bg/obiavi/r/prodava/sofia/?page=1&sid=gFM8jD,imoti.net,498,2025-01-16,,,Цена на /м2/:1 900EUR, 63 м2,Етаж: 4 от 6
"продава Двустаен апартамент, 39 м2","Явлена Изток продава малък компактен, но стсилен, със съвременно обзавеждане в панелен блок на много комуникаивно място в ж.к. Сухата река, в близост до Фантастико, Т Маркет, прекрасен парк и...",120000.0,EUR,False,продава,двустаен,София, Суха Река,,Явлена Изток,,https://www.imoti.net/bg/obiava/prodava/sofia/suha-reka/dvustaen/6018119/?sid=gFM8jD&page=1,4.0,2025-01-16 06:02:29.702523,https://www.imoti.net/bg/obiavi/r/prodava/sofia/?page=1&sid=gFM8jD,imoti.net,498,2025-01-16,,,Цена на /м2/:3 077EUR, 39 м2,Етаж: 2 от 7
"продава Двустаен апартамент, 38 м2","Титан Пропъртис - офис Младост има удоволствието да Ви представи двустаен апартамент в ж.к. Сухата река. В близост са разположени спирки на градски транспорт, Стадион „Георги Аспарухов“, супер...",120000.0,EUR,False,продава,двустаен,София, Суха Река,,Титан Пропъртис Рент,,https://www.imoti.net/bg/obiava/prodava/sofia/suha-reka/dvustaen/6014312/?sid=gFM8jD&page=1,7.0,2025-01-16 06:02:29.702969,https://www.imoti.net/bg/obiavi/r/prodava/sofia/?page=1&sid=gFM8jD,imoti.net,498,2025-01-16,,,Цена на /м2/:3 158EUR, 38 м2,Етаж: 2 от 7
"продава Двустаен апартамент, 38 м2",Имоти Премиер предлага на Вашето внимание Двустаен апартамент за продажба в кв. Суха река .Апартамента е след основен ремонт .Чистата площ на жилището е 38...,120000.0,EUR,False,продава,двустаен,София, Суха Река,,Имоти Премиер,,https://www.imoti.net/bg/obiava/prodava--v-stroej/sofia/suha-reka/dvustaen/6013691/?sid=gFM8jD&page=1,5.0,2025-01-16 06:02:29.703485,https://www.imoti.net/bg/obiavi/r/prodava/sofia/?page=1&sid=gFM8jD,imoti.net,498,2025-01-16,,,Цена на /м2/:3 158EUR, 38 м2,Етаж: 2 от 7
"продава Двустаен апартамент, 66 м2","БЕЗ КОМИСИОН ОТ КУПУВАЧА!ИРИДА НЕДВИЖИМИ ИМОТИ Ви предлага за продажба двустаен апартамент, в новострояща се луксозна сграда, строяща се само с най-качествени материали в район...",121600.0,EUR,False,продава,двустаен,София, Суха Река,,ИРИДА НЕДВИЖИМИ ИМОТИ,,https://www.imoti.net/bg/obiava/prodava--v-stroej/sofia/suha-reka/dvustaen/5936891/?sid=gFM8jD&page=1,1.0,2025-01-16 06:02:29.703985,https://www.imoti.net/bg/obiavi/r/prodava/sofia/?page=1&sid=gFM8jD,imoti.net,498,2025-01-16,,,Цена на /м2/:1 842EUR, 66 м2,Етаж: 5 от 6
"продава Двустаен апартамент, 56 м2","АКТ-16 апартамент с панорамна гледка Район Подуяне на минути от центъра на София Новa сграда контролиран достъп, видеонаблюдение; Високо качество и енергийна ефективностул_Княгиня Тамара11...",123000.0,EUR,False,продава,двустаен,София, Суха Река,,GLOBAL CONSULT,,https://www.imoti.net/bg/obiava/prodava/sofia/suha-reka/dvustaen/5979828/?sid=gFM8jD&page=1,13.0,2025-01-16 06:02:29.704425,https://www.imoti.net/bg/obiavi/r/prodava/sofia/?page=1&sid=gFM8jD,imoti.net,498,2025-01-16,,,Цена на /м2/:2 196EUR, 56 м2,Етаж: 4 от 6
"продава Тристаен апартамент, 84 м2","Явлена-Изток продава 3-стаен апартамент 84 кв.м. в ж.к. Сухата река. Състоящ се от: дневна, две спални, кухня, баня, тоалетна, мокро помещение, гардеробно и две тераси. Сградата е панел от 1974г....",125000.0,EUR,False,продава,тристаен,София, Суха Река,,Явлена Изток,,https://www.imoti.net/bg/obiava/prodava/sofia/suha-reka/tristaen/5675521/?sid=gFM8jD&page=1,12.0,2025-01-16 06:02:29.704889,https://www.imoti.net/bg/obiavi/r/prodava/sofia/?page=1&sid=gFM8jD,imoti.net,498,2025-01-16,,,Цена на /м2/:1 488EUR, 84 м2,Етаж: 6 от 8
"продава Двустаен апартамент, 63 м2","Компания `ЕКС` представя на Вашето внимание двустаен апартамент в ж.к. Сухата река.МЕСТОПОЛОЖЕНИЕ: В близост до спирка на градски транспорт, детска градина, училище, магазини от...",125020.0,EUR,False,продава,двустаен,София, Суха Река,,ЕКС НВД,,https://www.imoti.net/bg/obiava/prodava/sofia/suha-reka/dvustaen/6020754/?sid=gFM8jD&page=1,1.0,2025-01-16 06:02:29.705351,https://www.imoti.net/bg/obiavi/r/prodava/sofia/?page=1&sid=gFM8jD,imoti.net,498,2025-01-16,,,Цена на /м2/:1 984EUR, 63 м2,Етаж: 2 от 8
"продава Двустаен апартамент, 70 м2","Представяме двустаен апартамент за продажба в нова сграда с модерна визия в кв. ""Сухата река"", гр. София.Имотът е разположен на 4-ти етаж и предлага 70.06 кв.м, разпределена в антре,...",126100.0,EUR,False,продава,двустаен,София, Суха Река,,Luximmo Finest Estates,,https://www.imoti.net/bg/obiava/prodava--v-stroej/sofia/suha-reka/dvustaen/5710104/?sid=gFM8jD&page=1,2.0,2025-01-16 06:02:29.705855,https://www.imoti.net/bg/obiavi/r/prodava/sofia/?page=1&sid=gFM8jD,imoti.net,498,2025-01-16,,,Цена на /м2/:1 801EUR, 70 м2,Етаж:  от 9
"продава Двустаен апартамент, 74 м2","БЕЗ КОМИСИОН ОТ КУПУВАЧА!ИРИДА НЕДВИЖИМИ ИМОТИ Ви предлага за продажба двустаен апартамент, в новострояща се луксозна сграда, строяща се само с най-качествени материали в район...",128000.0,EUR,False,продава,двустаен,София, Суха Река,,ИРИДА НЕДВИЖИМИ ИМОТИ,,https://www.imoti.net/bg/obiava/prodava--v-stroej/sofia/suha-reka/dvustaen/5936669/?sid=gFM8jD&page=1,1.0,2025-01-16 06:02:29.706355,https://www.imoti.net/bg/obiavi/r/prodava/sofia/?page=1&sid=gFM8jD,imoti.net,498,2025-01-16,,,Цена на /м2/:1 730EUR, 74 м2,Етаж: 2 от 6
"продава Четиристаен апартамент, 86 м2","Имоти Премиер предлага на Вашето внимание имот със статут на апартамент в кв. Оборище.Намира се на полусутерен в тухлена сграда. Състои се от 4 помещения, два санитарни възела и има...",129000.0,EUR,False,продава,четиристаен,София, Оборище,,Имоти Премиер,,https://www.imoti.net/bg/obiava/prodava/sofia/oborishte/chetiristaen/5885595/?sid=gFM8jD&page=1,2.0,2025-01-16 06:02:29.706896,https://www.imoti.net/bg/obiavi/r/prodava/sofia/?page=1&sid=gFM8jD,imoti.net,498,2025-01-16,,,Цена на /м2/:1 500EUR, 86 м2,Етаж: 0 от 5
"продава Двустаен апартамент, 67 м2","Агенция за недвижими имоти Пандора естейт продава ексклузивно.Реф. № 110163.Двустаен апартамент в кв. Дианабад, разположен в престижен район с отлични транспортни връзки....",130000.0,EUR,False,продава,двустаен,София, Дианабад,,Пандора естейт,,https://www.imoti.net/bg/obiava/prodava/sofia/dianabad/dvustaen/6014130/?sid=gFM8jD&page=1,5.0,2025-01-16 06:02:29.707359,https://www.imoti.net/bg/obiavi/r/prodava/sofia/?page=1&sid=gFM8jD,imoti.net,498,2025-01-16,,,Цена на /м2/:1 940EUR, 67 м2,Етаж: 7 от 8
"продава Двустаен апартамент, 82 м2","БЕЗ КОМИСИОН ОТ КУПУВАЧА!ИРИДА НЕДВИЖИМИ ИМОТИ Ви предлага за продажба двустаен апартамент, в новострояща се луксозна сграда, строяща се само с най-качествени материали в...",130800.0,EUR,False,продава,двустаен,София, Суха Река,,ИРИДА НЕДВИЖИМИ ИМОТИ,,https://www.imoti.net/bg/obiava/prodava--v-stroej/sofia/suha-reka/dvustaen/5936888/?sid=gFM8jD&page=1,1.0,2025-01-16 06:02:29.707856,https://www.imoti.net/bg/obiavi/r/prodava/sofia/?page=1&sid=gFM8jD,imoti.net,498,2025-01-16,,,Цена на /м2/:1 595EUR, 82 м2,Етаж: 2 от 6
"продава Двустаен апартамент, 73 м2",КЛИЕНТИТЕ НА MARTIN'S СА ПО-ДОВОЛНИ! ПОПИТАЙ ЗАЩО!Предлагаме двустаен апартамент с обща площ от 72.94 кв.м. в сграда ново строителство с етап фундамент. Имотът се намира на втори етаж в...,131292.0,EUR,False,продава,двустаен,София, Суха Река,,MARTIN’S,,https://www.imoti.net/bg/obiava/prodava--v-stroej/sofia/suha-reka/dvustaen/5901591/?sid=gFM8jD&page=2,3.0,2025-01-16 06:02:37.261028,https://www.imoti.net/bg/obiavi/r/prodava/sofia/?page=1&sid=gFM8jD,imoti.net,498,2025-01-16,,,Цена на /м2/:1 799EUR, 73 м2,Етаж: 2 от 9
"продава Двустаен апартамент, 83 м2","БЕЗ КОМИСИОН ОТ КУПУВАЧА!ИРИДА НЕДВИЖИМИ ИМОТИ Ви предлага за продажба просторен двустаен апартамент, в новострояща се луксозна сграда, строяща се само с най-качествени...",131900.0,EUR,False,продава,двустаен,София, Суха Река,,ИРИДА НЕДВИЖИМИ ИМОТИ,,https://www.imoti.net/bg/obiava/prodava--v-stroej/sofia/suha-reka/dvustaen/5936885/?sid=gFM8jD&page=2,1.0,2025-01-16 06:02:37.261599,https://www.imoti.net/bg/obiavi/r/prodava/sofia/?page=1&sid=gFM8jD,imoti.net,498,2025-01-16,,,Цена на /м2/:1 589EUR, 83 м2,Етаж: 3 от 6
"продава Двустаен апартамент, 69 м2","ПРОСТОРЕН , ВЪТРЕШЕН, ФУНКЦИОНАЛЕН ап. на ТОП място в близост до център, до множество спирки на градския транспорт, на две спирки от метростанция Театрална, в близост до училище, детска градина,...",132600.0,EUR,False,продава,двустаен,София, Суха Река,,АЛДЕС ИМОТИ ЕООД,,https://www.imoti.net/bg/obiava/prodava/sofia/suha-reka/dvustaen/5972916/?sid=gFM8jD&page=2,8.0,2025-01-16 06:02:37.262052,https://www.imoti.net/bg/obiavi/r/prodava/sofia/?page=1&sid=gFM8jD,imoti.net,498,2025-01-16,,,Цена на /м2/:1 922EUR, 69 м2,Етаж: 5 от 8
