raw_title,raw_description,price,currency,without_dds,offer_type,property_type,city,neighborhood,contact_info,agency,agency_url,details_url,num_photos,date_time_added,search_url,site,total_offers,date,ref_no,time,price_per_m2,area,floor
"продава Тристаен апартамент, 123 м2","Тристаен апартамент с отлично разпределение – перфектен избор както за лично ползване, така и за инвестиция. С площ от 122.51 кв.м / 106.53 кв.м. с изложение Изток-Запад....",470000.0,BGN,False,продава,тристаен,София, Лозенец,,АДРЕС Недвижими имоти АД,,https://www.imoti.net/bg/obiava/prodava/sofia/lozenec/tristaen/6063751/?sid=iKI3oo&page=12,7.0,2026-01-02 18:04:45.570729,https://www.imoti.net/bg/obiavi/r/prodava/sofia/?page=1&sid=iKI3oo,imoti.net,463,2026-01-02,,,Цена на /м2/:3 821EUR/7 473.50BGN, 123 м2,Етаж: 14 от 21
"продава Тристаен апартамент, 123 м2","СВОБОДА, СТИЛ И ЛУКС!Тристаен апартамент с отлично разпределение – перфектен избор както за лично ползване, така и за инвестиция. С площ от 122.51 кв.м / 106.53 кв.м с изложение...",470000.0,BGN,False,продава,тристаен,София, Лозенец,,АДРЕС Недвижими имоти АД,,https://www.imoti.net/bg/obiava/prodava/sofia/lozenec/tristaen/6064033/?sid=iKI3oo&page=12,7.0,2026-01-02 18:04:45.571185,https://www.imoti.net/bg/obiavi/r/prodava/sofia/?page=1&sid=iKI3oo,imoti.net,463,2026-01-02,,,Цена на /м2/:3 821EUR/7 473.50BGN, 123 м2,Етаж: 11 от 21
"продава Тристаен апартамент, 123 м2","СВОБОДА, СТИЛ И ЛУКС!Тристаен апартамент с отлично разпределение – перфектен избор както за лично ползване, така и за инвестиция. С площ от 122.51 кв.м / 106.53 кв.м с изложение...",470000.0,BGN,False,продава,тристаен,София, Лозенец,,АДРЕС Недвижими имоти АД,,https://www.imoti.net/bg/obiava/prodava/sofia/lozenec/tristaen/6064037/?sid=iKI3oo&page=12,7.0,2026-01-02 18:04:45.571625,https://www.imoti.net/bg/obiavi/r/prodava/sofia/?page=1&sid=iKI3oo,imoti.net,463,2026-01-02,,,Цена на /м2/:3 821EUR/7 473.50BGN, 123 м2,Етаж: 10 от 21
"продава Тристаен апартамент, 123 м2","Тристаен апартамент, състоящ се от дневна с кухненски бокс, две спални, баня с тоалетна и тераси.",470000.0,BGN,False,продава,тристаен,София, Лозенец,,Имотека,,https://www.imoti.net/bg/obiava/prodava/sofia/lozenec/tristaen/6095528/?sid=iKI3oo&page=12,8.0,2026-01-02 18:04:45.572073,https://www.imoti.net/bg/obiavi/r/prodava/sofia/?page=1&sid=iKI3oo,imoti.net,463,2026-01-02,,,Цена на /м2/:3 821EUR/7 473.50BGN, 123 м2,Етаж: 10 от 21
"продава Тристаен апартамент, 123 м2","Многостаен апартамент, състоящ се от дневна с кухненски бокс, две спални, две бани с тоалетна и тераса.",473000.0,BGN,False,продава,тристаен,София, Лозенец,,Имотека,,https://www.imoti.net/bg/obiava/prodava/sofia/lozenec/tristaen/6096183/?sid=iKI3oo&page=12,8.0,2026-01-02 18:04:45.572520,https://www.imoti.net/bg/obiavi/r/prodava/sofia/?page=1&sid=iKI3oo,imoti.net,463,2026-01-02,,,Цена на /м2/:3 846EUR/7 521.20BGN, 123 м2,Етаж: 12 от 21
"продава Тристаен апартамент, 123 м2","СВОБОДА, СТИЛ И ЛУКС!Тристаен апартамент с отлично разпределение – перфектен избор както за лично ползване, така и за инвестиция. С площ от 122.51 кв.м / 106.53 кв.м с изложение...",473000.0,BGN,False,продава,тристаен,София, Лозенец,,АДРЕС Недвижими имоти АД,,https://www.imoti.net/bg/obiava/prodava/sofia/lozenec/tristaen/6064104/?sid=iKI3oo&page=12,7.0,2026-01-02 18:04:45.572980,https://www.imoti.net/bg/obiavi/r/prodava/sofia/?page=1&sid=iKI3oo,imoti.net,463,2026-01-02,,,Цена на /м2/:3 846EUR/7 521.20BGN, 123 м2,Етаж: 12 от 21
"продава Мезонет, 190 м2","За повече информация свържете се с нас и цитирайте референтния номер на имота. Моля, кажете, че сте видeли обявата в imoti.net.Референтен номер: Sfa 81624Тел: 0882 817...",475000.0,BGN,False,продава,мезонет,София, Белите Брези,,BULGARIAN PROPERTIES,,https://www.imoti.net/bg/obiava/prodava/sofia/belite-brezi/mezonet/5734045/?sid=iKI3oo&page=12,17.0,2026-01-02 18:04:45.573478,https://www.imoti.net/bg/obiavi/r/prodava/sofia/?page=1&sid=iKI3oo,imoti.net,463,2026-01-02,,,Цена на /м2/:2 500EUR/4 889.58BGN, 190 м2,Етаж: 5
"продава Четиристаен апартамент, 120 м2","Четиристаен апартамент с отлично местоположение само на метри от Южен парк и центъра на столицата. Жилището е част от сграда с Разрешение за ползване от 1995 г., разположена в кв. Лозенец. Районът...",475000.0,BGN,False,продава,четиристаен,София, Лозенец,,Luximmo Finest Estates,,https://www.imoti.net/bg/obiava/prodava--v-stroej/sofia/lozenec/chetiristaen/6115525/?sid=iKI3oo&page=12,20.0,2026-01-02 18:04:45.573962,https://www.imoti.net/bg/obiavi/r/prodava/sofia/?page=1&sid=iKI3oo,imoti.net,463,2026-01-02,,,Цена на /м2/:3 958EUR/7 741.83BGN, 120 м2,Етаж:  от 6
"продава Четиристаен апартамент, 200 м2","Мезонет в сграда от 2008г. със следното разпределение: първо ниво 150кв.м състоящо се от хол с кухненски бокс , просторна дневна с две тераси, две бани с тоалетни, две спални с тераси, складово...",480000.0,BGN,False,продава,четиристаен,София, Иван Вазов,,Глобъл Сървисиз,,https://www.imoti.net/bg/obiava/prodava/sofia/ivan-vazov/chetiristaen/5937421/?sid=iKI3oo&page=12,7.0,2026-01-02 18:04:45.574410,https://www.imoti.net/bg/obiavi/r/prodava/sofia/?page=1&sid=iKI3oo,imoti.net,463,2026-01-02,,,Цена на /м2/:2 400EUR/4 693.99BGN, 200 м2,Етаж: 8 от 8
"продава Тристаен апартамент, 140 м2",,480000.0,BGN,False,продава,тристаен,София, Стрелбище,,Глобъл Сървисиз,,https://www.imoti.net/bg/obiava/prodava/sofia/strelbishte/tristaen/6143788/?sid=iKI3oo&page=12,1.0,2026-01-02 18:04:45.574840,https://www.imoti.net/bg/obiavi/r/prodava/sofia/?page=1&sid=iKI3oo,imoti.net,463,2026-01-02,,,Цена на /м2/:3 429EUR/6 705.70BGN, 140 м2,Етаж: 2 от 8
"продава Тристаен апартамент, 120 м2",,480000.0,BGN,False,продава,тристаен,София, Лозенец,,Глобъл Сървисиз,,https://www.imoti.net/bg/obiava/prodava/sofia/lozenec/tristaen/6093121/?sid=iKI3oo&page=12,13.0,2026-01-02 18:04:45.575284,https://www.imoti.net/bg/obiavi/r/prodava/sofia/?page=1&sid=iKI3oo,imoti.net,463,2026-01-02,,,Цена на /м2/:4 000EUR/7 823.32BGN, 120 м2,Етаж: 7 от 10
"продава Тристаен апартамент, 102 м2","ПРОСТОРЕН, ВЪТРЕШЕН, ТИХ ап. на ТОП място: на минути от входа на Южния парк, МОЛ Парк център, в близост до метростанция Европейски съюз, множество спирки на градския транспорт, пешеходно разстояние...",480000.0,BGN,False,продава,тристаен,София, Лозенец,,АЛДЕС ИМОТИ ЕООД,,https://www.imoti.net/bg/obiava/prodava/sofia/lozenec/tristaen/6082921/?sid=iKI3oo&page=12,19.0,2026-01-02 18:04:45.575716,https://www.imoti.net/bg/obiavi/r/prodava/sofia/?page=1&sid=iKI3oo,imoti.net,463,2026-01-02,,,Цена на /м2/:4 706EUR/9 203.91BGN, 102 м2,Етаж: 7 от 9
"продава Тристаен апартамент, 110 м2","Представяме полуобзаведен тристаен апартамент в бутикова сграда в кв. ""Лозенец"". Локацията на имота е на тиха локация, на крачки от Южен парк и същевременно на метри от бул. ""Черни връх"" и от там...",480000.0,BGN,False,продава,тристаен,София, Лозенец,,Luximmo Finest Estates,,https://www.imoti.net/bg/obiava/prodava--v-stroej/sofia/lozenec/tristaen/6096309/?sid=iKI3oo&page=12,30.0,2026-01-02 18:04:45.576213,https://www.imoti.net/bg/obiavi/r/prodava/sofia/?page=1&sid=iKI3oo,imoti.net,463,2026-01-02,,,Цена на /м2/:4 364EUR/8 534.53BGN, 110 м2,Етаж:  от 6
"продава Тристаен апартамент, 111 м2","Представяме полуобзаведен тристаен апартамент в бутикова сграда в кв. ""Лозенец"". Локацията на имота е на тиха локация, на крачки от Южен парк и същевременно на метри от бул. ""Черни връх"" и от там...",480000.0,BGN,False,продава,тристаен,София, Лозенец,,Barnes Bulgaria,,https://www.imoti.net/bg/obiava/prodava/sofia/lozenec/tristaen/6125773/?sid=iKI3oo&page=12,19.0,2026-01-02 18:04:45.576727,https://www.imoti.net/bg/obiavi/r/prodava/sofia/?page=1&sid=iKI3oo,imoti.net,463,2026-01-02,,,Цена на /м2/:4 324EUR/8 457.64BGN, 111 м2,Етаж: 2 от 6
"продава Тристаен апартамент, 140 м2","БЕЗ КОМИСИОННА!БЕЗ ИНДЕКСАЦИЯ НА ЦЕНАТА!НАПРЕДВАЩО СТОИТЕЛСТВО!LUXIMMO представя луксозна сграда с отличителен дизайн, висок клас на изпълнение, комуникативна локация и...",480000.0,BGN,False,продава,тристаен,София, Стрелбище,,Luximmo Finest Estates,,https://www.imoti.net/bg/obiava/prodava--v-stroej/sofia/strelbishte/tristaen/5760746/?sid=iKI3oo&page=12,4.0,2026-01-02 18:04:45.577245,https://www.imoti.net/bg/obiavi/r/prodava/sofia/?page=1&sid=iKI3oo,imoti.net,463,2026-01-02,,,Цена на /м2/:3 429EUR/6 705.70BGN, 140 м2,Етаж:  от 8
"продава Многостаен апартамент, 190 м2","Просторен апартамент на две нива с градина и атриум – ТОП локация в кв. Лозенец, ул. Голо Бърдо 8.Продава се уникален имот с площ от 190 кв.м., разположен на партерно и сутеренно...",489000.0,BGN,False,продава,многостаен,София, Лозенец,,МАРТИТРАНС,,https://www.imoti.net/bg/obiava/prodava--v-stroej/sofia/lozenec/mnogostaen/6098673/?sid=iKI3oo&page=12,1.0,2026-01-02 18:04:45.577690,https://www.imoti.net/bg/obiavi/r/prodava/sofia/?page=1&sid=iKI3oo,imoti.net,463,2026-01-02,,,Цена на /м2/:2 574EUR/5 033.69BGN, 190 м2,Етаж: 0 от 2
"продава Многостаен апартамент, 211 м2","Многостаен апартамент  в Бели брези, след ремонт и закупуване на нови ел. уреди и мебели, в кв. Бели брези с паркомясто във вътрешен двор с ограничен достъп включено в цената, с възможност за...",490000.0,BGN,False,продава,многостаен,София, Белите Брези,,АДРЕС Недвижими имоти АД,,https://www.imoti.net/bg/obiava/prodava/sofia/belite-brezi/mnogostaen/6079835/?sid=iKI3oo&page=12,37.0,2026-01-02 18:04:45.578139,https://www.imoti.net/bg/obiavi/r/prodava/sofia/?page=1&sid=iKI3oo,imoti.net,463,2026-01-02,,,Цена на /м2/:2 322EUR/4 541.97BGN, 211 м2,Етаж: 5 от 6
"продава Мезонет, 185 м2","До два парка и метростанция. Уникални гледки към парка и Витоша. Огромни стаи. Гараж.Представяме Ви просторен мезонет на бул. Никола Й. Вапцаров 29, на метри от два парка, метростанция,...",490000.0,BGN,False,продава,мезонет,София, Хладилника,,ANTRE,,https://www.imoti.net/bg/obiava/prodava/sofia/hladilnika/mezonet/6172255/?sid=iKI3oo&page=12,13.0,2026-01-02 18:04:45.578576,https://www.imoti.net/bg/obiavi/r/prodava/sofia/?page=1&sid=iKI3oo,imoti.net,463,2026-01-02,,,Цена на /м2/:2 649EUR/5 180.31BGN, 185 м2,Етаж: 6 от 7
"продава Многостаен апартамент, 154 м2","Функционален многостаен апартамент С ВКЛЮЧЕНО ПОДЗЕМНО ПАРКОМЯСТО В ЦЕНАТА!Хол с трапезария и кухненски бокс, три непреходни спални, три бани, гардеробно, перално, две тераси....",490000.0,BGN,False,продава,многостаен,София, Лагера,,Имотека,,https://www.imoti.net/bg/obiava/prodava/sofia/lagera/mnogostaen/6158694/?sid=iKI3oo&page=12,6.0,2026-01-02 18:04:45.579033,https://www.imoti.net/bg/obiavi/r/prodava/sofia/?page=1&sid=iKI3oo,imoti.net,463,2026-01-02,,,Цена на /м2/:3 182EUR/6 223.10BGN, 154 м2,Етаж: 3 от 6
"продава Четиристаен апартамент, 124 м2","БЕЗ КОМИСИОНА ОТ КУПУВАЧА! ЕРА Голд има удоволствието да Ви представи слънчев четиристаен апартамент със зелени гледки в кв. Лозенец. Сградата е разположена на тиха улица, с богато озеленена околна...",492210.0,BGN,False,продава,четиристаен,София, Лозенец,,ЕРА Голд,,https://www.imoti.net/bg/obiava/prodava--v-stroej/sofia/lozenec/chetiristaen/5966944/?sid=iKI3oo&page=12,6.0,2026-01-02 18:04:45.579476,https://www.imoti.net/bg/obiavi/r/prodava/sofia/?page=1&sid=iKI3oo,imoti.net,463,2026-01-02,,,Цена на /м2/:3 969EUR/7 763.54BGN, 124 м2,Етаж: 2 от 5
"продава Тристаен апартамент, 140 м2","С АКТ 14!АКТ 15 МАЙ НА 2026г.!АКТ16 КРАЯ НА 2026!ИРИДА НЕДВИЖИМИ ИМОТИ продава панорамен слънчев тристаен апартамент в новоизграждаща се сграда, с изключително...",495000.0,BGN,False,продава,тристаен,София, Стрелбище,,ИРИДА НЕДВИЖИМИ ИМОТИ,,https://www.imoti.net/bg/obiava/prodava--v-stroej/sofia/strelbishte/tristaen/6038128/?sid=iKI3oo&page=12,3.0,2026-01-02 18:04:45.579982,https://www.imoti.net/bg/obiavi/r/prodava/sofia/?page=1&sid=iKI3oo,imoti.net,463,2026-01-02,,,Цена на /м2/:3 536EUR/6 915.26BGN, 140 м2,Етаж: 6 от 9
"продава Тристаен апартамент, 88 м2","Слънчев  тристаен апартамент в кв.""Лозенец"". Статут на Ателие. Застроена площ от 75.13 кв.м. Хол с кухненси бокс- около 25 м.кв, две спални между 8 м.кв и 9 м.кв. Усвоен балкон...",495000.0,BGN,False,продава,тристаен,София, Лозенец,,АДРЕС Недвижими имоти АД,,https://www.imoti.net/bg/obiava/prodava/sofia/lozenec/tristaen/6157964/?sid=iKI3oo&page=12,10.0,2026-01-02 18:04:45.580420,https://www.imoti.net/bg/obiavi/r/prodava/sofia/?page=1&sid=iKI3oo,imoti.net,463,2026-01-02,,,Цена на /м2/:5 625EUR/11 001.54BGN, 88 м2,Етаж: 4 от 5
"продава Тристаен апартамент, 90 м2","Тристаен непреходен апартамент със застроена площ от 78 кв.м. Разполага с хол с кухненски бокс от около 25 кв.м. и две неголеми спални, от които се излиза на балкон. Разположен е на висок...",495000.0,BGN,False,продава,тристаен,София, Лозенец,,АДРЕС Недвижими имоти АД,,https://www.imoti.net/bg/obiava/prodava/sofia/lozenec/tristaen/6157965/?sid=iKI3oo&page=12,14.0,2026-01-02 18:04:45.580853,https://www.imoti.net/bg/obiavi/r/prodava/sofia/?page=1&sid=iKI3oo,imoti.net,463,2026-01-02,,,Цена на /м2/:5 500EUR/10 757.07BGN, 90 м2,Етаж: 4 от 5
"продава Четиристаен апартамент, 180 м2","Предлагаме светъл и просторен апартамент в Лозенец – отлична локация!Представяме на Вашето внимание просторен и светъл апартамент, разположен в предпочитания квартал Лозенец, в...",499000.0,BGN,False,продава,четиристаен,София, Лозенец,,Глобъл Сървисиз,,https://www.imoti.net/bg/obiava/prodava/sofia/lozenec/chetiristaen/6019397/?sid=iKI3oo&page=12,16.0,2026-01-02 18:04:45.581304,https://www.imoti.net/bg/obiavi/r/prodava/sofia/?page=1&sid=iKI3oo,imoti.net,463,2026-01-02,,,Цена на /м2/:2 772EUR/5 422.00BGN, 180 м2,Етаж: 3 от 5
"продава Четиристаен апартамент, 224 м2",Galardo Real Estate предлага за продажба четиристаен мезонет с усещане за къща – в една от най-желаните локации на София.Имотът е разположен срещу Paradise Center и на крачки от Южен парк –...,499990.0,BGN,False,продава,четиристаен,София, Хладилника,,Galardo Real Estate,,https://www.imoti.net/bg/obiava/prodava/sofia/hladilnika/chetiristaen/6109941/?sid=iKI3oo&page=12,6.0,2026-01-02 18:04:45.581740,https://www.imoti.net/bg/obiavi/r/prodava/sofia/?page=1&sid=iKI3oo,imoti.net,463,2026-01-02,,,Цена на /м2/:2 232EUR/4 365.60BGN, 224 м2,Етаж: 6 от 7
"продава Четиристаен апартамент, 260 м2",Galardo Real Estate предлага за продажба четиристаен мезонет с усещане за къща – в една от най-желаните локации на София.Имотът е разположен срещу Paradise Center и на крачки от Южен парк –...,499990.0,BGN,False,продава,четиристаен,София, Хладилника,,Galardo Real Estate,,https://www.imoti.net/bg/obiava/prodava/sofia/hladilnika/chetiristaen/6109942/?sid=iKI3oo&page=13,14.0,2026-01-02 18:04:49.876240,https://www.imoti.net/bg/obiavi/r/prodava/sofia/?page=1&sid=iKI3oo,imoti.net,463,2026-01-02,,,Цена на /м2/:1 923EUR/3 761.14BGN, 260 м2,Етаж: 6 от 7
"продава Мезонет, 150 м2",". . . . . . . . . . . . . . . . . УНИКАЛЕН . . . . . . . . . . . . . . . . мезонет ситуиран в тухлена кооперация с ТЕЦ и АСАНСЬОР, разположен до ул. 'Трепетлика' и 'Водната кула'. Жилището е с...",500000.0,BGN,False,продава,мезонет,София, Лозенец,,АРСЕНАЛ - недвижими имоти,,https://www.imoti.net/bg/obiava/prodava/sofia/lozenec/mezonet/5727513/?sid=iKI3oo&page=13,1.0,2026-01-02 18:04:49.876721,https://www.imoti.net/bg/obiavi/r/prodava/sofia/?page=1&sid=iKI3oo,imoti.net,463,2026-01-02,,,Цена на /м2/:3 333EUR/6 519.43BGN, 150 м2,Етаж: 6 от 7
"продава Тристаен апартамент, 145 м2","Апартамент в представителна сграда със съвременна фасада с изолация . Намира се  ул. 'Галичица'. б близост до ул. Златовръх. Застроена площ 122 кв.м. Състои се от антре с коридор,...",500000.0,BGN,False,продава,тристаен,София, Лозенец,,Имотека,,https://www.imoti.net/bg/obiava/prodava/sofia/lozenec/tristaen/6131484/?sid=iKI3oo&page=13,29.0,2026-01-02 18:04:49.877178,https://www.imoti.net/bg/obiavi/r/prodava/sofia/?page=1&sid=iKI3oo,imoti.net,463,2026-01-02,,,Цена на /м2/:3 448EUR/6 744.24BGN, 145 м2,Етаж:  от 2
"продава Тристаен апартамент, 145 м2","ОТЛИЧЕН РАЙОН! СЛЕД РЕМОНТ! ГАРАЖ!JJcorporation  предлага на Вашето внимание просторен тристаен апартамент, находящ се тихо и спокойно място в кв. Лозенец на ул. Галичица. Апартаментът е на...",500000.0,BGN,False,продава,тристаен,София, Лозенец,,Джей и Джей Корпорейшън,,https://www.imoti.net/bg/obiava/prodava/sofia/lozenec/tristaen/6104180/?sid=iKI3oo&page=13,12.0,2026-01-02 18:04:49.877616,https://www.imoti.net/bg/obiavi/r/prodava/sofia/?page=1&sid=iKI3oo,imoti.net,463,2026-01-02,,,Цена на /м2/:3 448EUR/6 744.24BGN, 145 м2,Етаж: 2 от 7
"продава Тристаен апартамент, 145 м2","Революшън Естейт Ви представя красив тристаен апартамент с възможност за закупуване на ГАРАЖ в ж.к. Лозенец.Сградата се намира на чудесна локация - НА МЕТРИ до бул. Пейо К. Яворов,...",500000.0,BGN,False,продава,тристаен,София, Лозенец,,Революшън Естейт България,,https://www.imoti.net/bg/obiava/prodava/sofia/lozenec/tristaen/6033809/?sid=iKI3oo&page=13,18.0,2026-01-02 18:04:49.878071,https://www.imoti.net/bg/obiavi/r/prodava/sofia/?page=1&sid=iKI3oo,imoti.net,463,2026-01-02,,,Цена на /м2/:3 448EUR/6 744.24BGN, 145 м2,Етаж: 1 от 7
"продава Тристаен апартамент, 170 м2","Galardo Real Estate има удоволствието да Ви представи един прекрасен апартамент с 2 спални, разположен в един от най-перспективните райони в столицата - кв. Хладилника. Едва на минути от...",500000.0,BGN,False,продава,тристаен,София, Лозенец,,Galardo Real Estate,,https://www.imoti.net/bg/obiava/prodava/sofia/lozenec/tristaen/6130149/?sid=iKI3oo&page=13,13.0,2026-01-02 18:04:49.878509,https://www.imoti.net/bg/obiavi/r/prodava/sofia/?page=1&sid=iKI3oo,imoti.net,463,2026-01-02,,,Цена на /м2/:2 941EUR/5 752.44BGN, 170 м2,Етаж: 2 от 8
"продава Четиристаен апартамент, 150 м2","Просторен 4-стаен апартамент в кв. СтрелбищеПредлагаме изцяло ремонтиран и луксозно обзаведен 4-стаен апартамент, разположен на комуникативно място в кв. Стрелбище.",500000.0,BGN,False,продава,четиристаен,София, Стрелбище,,Глобъл Сървисиз,,https://www.imoti.net/bg/obiava/prodava/sofia/strelbishte/chetiristaen/6032108/?sid=iKI3oo&page=13,19.0,2026-01-02 18:04:49.878946,https://www.imoti.net/bg/obiavi/r/prodava/sofia/?page=1&sid=iKI3oo,imoti.net,463,2026-01-02,,,Цена на /м2/:3 333EUR/6 519.43BGN, 150 м2,Етаж: 3 от 12
"продава Тристаен апартамент, 106 м2",ARCO REAL ESTATE предлага тристаен апартамент с площ 106 (89) кв.м. в малка бутикова сграда в кв. Лозенец в близост до Семинарията.Апартамента разполага с дневна с трапезария и кухненски...,508560.0,BGN,False,продава,тристаен,София, Лозенец,,ARCO REAL ESTATE,,https://www.imoti.net/bg/obiava/prodava/sofia/lozenec/tristaen/6090035/?sid=iKI3oo&page=13,1.0,2026-01-02 18:04:49.879449,https://www.imoti.net/bg/obiavi/r/prodava/sofia/?page=1&sid=iKI3oo,imoti.net,463,2026-01-02,,,Цена на /м2/:4 798EUR/9 383.56BGN, 106 м2,Етаж: 2 от 5
