raw_title,raw_description,price,currency,without_dds,offer_type,property_type,city,neighborhood,contact_info,agency,agency_url,details_url,num_photos,date_time_added,search_url,site,total_offers,date,ref_no,time,price_per_m2,area,floor
"продава Двустаен апартамент, 64 м2","Реф.   012209Агенция за недвижими имоти BAS Properties предлага за продажба двустаен апартамент в ж.к. Лагера, гр. София   една от най-предпочитаните и добре устроени градски зони, с...",260000.0,BGN,False,продава,двустаен,София, Лагера,,БАС Пропъртис,,https://www.imoti.net/bg/obiava/prodava/sofia/lagera/dvustaen/6134125/?sid=iKI3oo&page=4,9.0,2026-01-02 18:04:08.785034,https://www.imoti.net/bg/obiavi/r/prodava/sofia/?page=1&sid=iKI3oo,imoti.net,463,2026-01-02,,,Цена на /м2/:4 063EUR/7 945.56BGN, 64 м2,Етаж: 6 от 7
"продава Тристаен апартамент, 116 м2",Тристаен апартамент с перфектните параметри в ж.к. Хиподрума. Жилището се намира на първи висок етаж със застроена площ от 100кв.м. ( 116 ОЧ) и има следното разпределение: огромна всекидневна...,260000.0,BGN,False,продава,тристаен,София, Хиподрума,,АДРЕС Недвижими имоти АД,,https://www.imoti.net/bg/obiava/prodava/sofia/hipodruma/tristaen/6145973/?sid=iKI3oo&page=4,14.0,2026-01-02 18:04:08.785480,https://www.imoti.net/bg/obiavi/r/prodava/sofia/?page=1&sid=iKI3oo,imoti.net,463,2026-01-02,,,Цена на /м2/:2 241EUR/4 383.76BGN, 116 м2,Етаж: 1 от 7
"продава Двустаен апартамент, 82 м2",С АКТ 14АКТ 15 МАЙ НА 2026г.!АКТ16 КРАЯ НА 2026!ИРИДА НЕДВИЖИМИ ИМОТИ продава просторен двустаен апартамент в сграда с изключително висококачествено строителство от...,262000.0,BGN,False,продава,двустаен,София, Стрелбище,,ИРИДА НЕДВИЖИМИ ИМОТИ,,https://www.imoti.net/bg/obiava/prodava--v-stroej/sofia/strelbishte/dvustaen/6038125/?sid=iKI3oo&page=4,3.0,2026-01-02 18:04:08.785999,https://www.imoti.net/bg/obiavi/r/prodava/sofia/?page=1&sid=iKI3oo,imoti.net,463,2026-01-02,,,Цена на /м2/:3 195EUR/6 249.12BGN, 82 м2,Етаж: 4 от 9
"продава Двустаен апартамент, 68 м2","СВОБОДА, СТИЛ И ЛУКС!Функционално двустайно ателие с отлично разпределение – перфектен избор както за лично ползване, така и за инвестиция. С площ от 67.25 кв.м / 58.48 кв.м с...",264000.0,BGN,False,продава,двустаен,София, Лозенец,,АДРЕС Недвижими имоти АД,,https://www.imoti.net/bg/obiava/prodava/sofia/lozenec/dvustaen/6154913/?sid=iKI3oo&page=4,7.0,2026-01-02 18:04:08.786453,https://www.imoti.net/bg/obiavi/r/prodava/sofia/?page=1&sid=iKI3oo,imoti.net,463,2026-01-02,,,Цена на /м2/:3 882EUR/7 593.22BGN, 68 м2,Етаж: 14 от 21
"продава Тристаен апартамент, 96 м2","Нов апартамент на шпакловка и замазка с Акт16, със застроена площ от 85.53кв.м. и мазе 2.96кв.м. Жилището се състои от входно антре, баня с тоалетна, отделно тоалетна, дневна с...",265000.0,BGN,False,продава,тристаен,София, Лагера,,Имотека,,https://www.imoti.net/bg/obiava/prodava/sofia/lagera/tristaen/6141955/?sid=iKI3oo&page=4,12.0,2026-01-02 18:04:08.786895,https://www.imoti.net/bg/obiavi/r/prodava/sofia/?page=1&sid=iKI3oo,imoti.net,463,2026-01-02,,,Цена на /м2/:2 760EUR/5 398.91BGN, 96 м2,Етаж: 1 от 6
"продава Тристаен апартамент, 133 м2","ЕРА Голд Ви представя южен двустаен апартамент в нова жилищна сграда в близост до центъра на София и Военномедицинска болница, кв. Лагера.Апартаментът се състои от : входно антре,...",266666.0,BGN,False,продава,тристаен,София, Лагера,,ЕРА Голд,,https://www.imoti.net/bg/obiava/prodava--v-stroej/sofia/lagera/tristaen/6121063/?sid=iKI3oo&page=4,6.0,2026-01-02 18:04:08.787356,https://www.imoti.net/bg/obiavi/r/prodava/sofia/?page=1&sid=iKI3oo,imoti.net,463,2026-01-02,,,Цена на /м2/:2 005EUR/3 921.45BGN, 133 м2,Етаж: 5 от 7
"продава Двустаен апартамент, 63 м2","Търсиш място, което има всичко? Това е твоят дом в сърцето на Лозенец - между две метростанции и Борисовата градина. И не е просто апартамент...получаваш два имота в един! Предимства, които си...",270000.0,BGN,False,продава,двустаен,София, Лозенец,,АДРЕС Недвижими имоти АД,,https://www.imoti.net/bg/obiava/prodava/sofia/lozenec/dvustaen/6151182/?sid=iKI3oo&page=4,18.0,2026-01-02 18:04:08.787798,https://www.imoti.net/bg/obiavi/r/prodava/sofia/?page=1&sid=iKI3oo,imoti.net,463,2026-01-02,,,Цена на /м2/:4 286EUR/8 382.13BGN, 63 м2,Етаж: 1 от 4
"продава Двустаен апартамент, 64 м2","Открийте мястото, където ще се чувствате у дома от първия момент.Титан Пропъртис- офис Хиподрума с радост предлага на Вашето внимание двустаен апартамент за продажба в ж.к. Лагера,...",270000.0,BGN,False,продава,двустаен,София, Лагера,,Титан Пропъртис София,,https://www.imoti.net/bg/obiava/prodava/sofia/lagera/dvustaen/6127674/?sid=iKI3oo&page=4,9.0,2026-01-02 18:04:08.788261,https://www.imoti.net/bg/obiavi/r/prodava/sofia/?page=1&sid=iKI3oo,imoti.net,463,2026-01-02,,,Цена на /м2/:4 219EUR/8 251.16BGN, 64 м2,Етаж: 6 от 7
"продава Двустаен апартамент, 77 м2","Двустаен апартамент за продажба в София, кв. Стрелбище – стил, простор и отлична локация!•",270000.0,BGN,False,продава,двустаен,София, Стрелбище,,Глобъл Сървисиз,,https://www.imoti.net/bg/obiava/prodava/sofia/strelbishte/dvustaen/6139064/?sid=iKI3oo&page=4,6.0,2026-01-02 18:04:08.788711,https://www.imoti.net/bg/obiavi/r/prodava/sofia/?page=1&sid=iKI3oo,imoti.net,463,2026-01-02,,,Цена на /м2/:3 506EUR/6 858.11BGN, 77 м2,Етаж: 2 от 7
"продава Тристаен апартамент, 101 м2","Тристаен апартамент на 5 етан изложение И/З.Състои се от антре , самостоятелна кухня с малка тераса, две спални, дневна с излаз на тераса, баня и отделна тоалетна.Към жилището има мазе 7.23...",274000.0,BGN,False,продава,тристаен,София, Лозенец,,АДРЕС Недвижими имоти АД,,https://www.imoti.net/bg/obiava/prodava/sofia/lozenec/tristaen/5925091/?sid=iKI3oo&page=4,4.0,2026-01-02 18:04:08.789168,https://www.imoti.net/bg/obiavi/r/prodava/sofia/?page=1&sid=iKI3oo,imoti.net,463,2026-01-02,,,Цена на /м2/:2 713EUR/5 305.92BGN, 101 м2,Етаж: 5 от 20
"продава Тристаен апартамент, 109 м2","ЕРА Младост продава апартамент в сграда с разрешение за ползване от 2024 година,  в динамично развиващия се район Хладилника на община Лозенец, в частта известна като „белия квартал“. В...",274300.0,BGN,False,продава,тристаен,София, Хладилника,,ERA Младост,,https://www.imoti.net/bg/obiava/prodava/sofia/hladilnika/tristaen/6183934/?sid=iKI3oo&page=4,1.0,2026-01-02 18:04:08.789611,https://www.imoti.net/bg/obiavi/r/prodava/sofia/?page=1&sid=iKI3oo,imoti.net,463,2026-01-02,,,Цена на /м2/:2 517EUR/4 921.87BGN, 109 м2,Етаж: 3 от 11
"продава Двустаен апартамент, 88 м2","Двустаен апартамент с южно изложение, предлагащ светлина и комфорт през целия ден. Жилището е със застроена площ от 75 кв.м. и обща площ от 88 кв.м., функционално разпределени, както следва:...",277550.0,BGN,False,продава,двустаен,София, Хладилника,,АДРЕС Недвижими имоти АД,,https://www.imoti.net/bg/obiava/prodava/sofia/hladilnika/dvustaen/6181852/?sid=iKI3oo&page=4,5.0,2026-01-02 18:04:08.790061,https://www.imoti.net/bg/obiavi/r/prodava/sofia/?page=1&sid=iKI3oo,imoti.net,463,2026-01-02,,,Цена на /м2/:3 154EUR/6 168.64BGN, 88 м2,Етаж: 7
"продава Тристаен апартамент, 80 м2",Galiano Estates Ви представя просторен тристаен апартамент застроена площ 80 кв. м много добра локация Ж.К Хиподрума. Апартаментът се състои от от хол с портал към отделна стая и друга стая с врата...,279000.0,BGN,False,продава,тристаен,София, Хиподрума,,Galiano Estates,,https://www.imoti.net/bg/obiava/prodava/sofia/hipodruma/tristaen/6139882/?sid=iKI3oo&page=4,15.0,2026-01-02 18:04:08.790559,https://www.imoti.net/bg/obiavi/r/prodava/sofia/?page=1&sid=iKI3oo,imoti.net,463,2026-01-02,,,Цена на /м2/:3 488EUR/6 820.96BGN, 80 м2,Етаж: 2 от 7
"продава Двустаен апартамент, 82 м2",,280000.0,BGN,False,продава,двустаен,София, Стрелбище,,Глобъл Сървисиз,,https://www.imoti.net/bg/obiava/prodava/sofia/strelbishte/dvustaen/6143787/?sid=iKI3oo&page=4,1.0,2026-01-02 18:04:08.791018,https://www.imoti.net/bg/obiavi/r/prodava/sofia/?page=1&sid=iKI3oo,imoti.net,463,2026-01-02,,,Цена на /м2/:3 415EUR/6 678.44BGN, 82 м2,Етаж: 4 от 8
"продава Тристаен апартамент, 110 м2","Имоти ПРЕМИЕР представя на Вашето внимание тристаен апартамент в ж.к Лагера! УНИКАЛНА ГЛЕДКА КЪМ ВИТОША!Жилището е ситуирано на етаж 14 от 18 в сграда ЕПК .Обща площ от 110м2 , която...",280000.0,BGN,False,продава,тристаен,София, Лагера,,Имоти Премиер,,https://www.imoti.net/bg/obiava/prodava/sofia/lagera/tristaen/6049687/?sid=iKI3oo&page=4,10.0,2026-01-02 18:04:08.791520,https://www.imoti.net/bg/obiavi/r/prodava/sofia/?page=1&sid=iKI3oo,imoti.net,463,2026-01-02,,,Цена на /м2/:2 545EUR/4 978.48BGN, 110 м2,Етаж: 14 от 18
"продава Двустаен апартамент, 95 м2",,280000.0,BGN,False,продава,двустаен,София, Лозенец,,Глобъл Сървисиз,,https://www.imoti.net/bg/obiava/prodava/sofia/lozenec/dvustaen/6143682/?sid=iKI3oo&page=4,3.0,2026-01-02 18:04:08.791972,https://www.imoti.net/bg/obiavi/r/prodava/sofia/?page=1&sid=iKI3oo,imoti.net,463,2026-01-02,,,Цена на /м2/:2 947EUR/5 764.55BGN, 95 м2,Етаж: 0
"продава Тристаен апартамент, 98 м2","ЕРА Голд представя тристаен апартамент в новострояща се сграда в ж.к. Стрелбище на перфектна локация в близост до бул. България, супермаркет Фантастико, не далеч от Южен Парк, в близост до...",281078.0,BGN,False,продава,тристаен,София, Стрелбище,,ЕРА Голд,,https://www.imoti.net/bg/obiava/prodava--v-stroej/sofia/strelbishte/tristaen/6109559/?sid=iKI3oo&page=4,2.0,2026-01-02 18:04:08.792417,https://www.imoti.net/bg/obiavi/r/prodava/sofia/?page=1&sid=iKI3oo,imoti.net,463,2026-01-02,,,Цена на /м2/:2 868EUR/5 609.60BGN, 98 м2,Етаж: 8 от 9
"продава Двустаен апартамент, 63 м2",Референтен номер: 2095505Революшън Естейт Ви  представя двустаен апартамент в луксозна сграда с АКТ 16 на 2 минути пешеходно разтояние до Южен парк  в ж.к. Лозенец.-...,283000.0,BGN,False,продава,двустаен,София, Лозенец,,Революшън Естейт България,,https://www.imoti.net/bg/obiava/prodava/sofia/lozenec/dvustaen/6108895/?sid=iKI3oo&page=4,13.0,2026-01-02 18:04:08.792874,https://www.imoti.net/bg/obiavi/r/prodava/sofia/?page=1&sid=iKI3oo,imoti.net,463,2026-01-02,,,Цена на /м2/:4 492EUR/8 785.71BGN, 63 м2,Етаж: 2 от 7
"продава Двустаен апартамент, 81 м2","Голям ъглов двустаен апартамент без аналог на пазара на висок първи етаж над гаражи 81кв.м. На 300м. от пазар и метростанция Красно Село. В момента е тристаен маломерен, много подходящ и за офис....",283500.0,BGN,False,продава,двустаен,София, Белите Брези,,Глобъл Сървисиз,,https://www.imoti.net/bg/obiava/prodava/sofia/belite-brezi/dvustaen/6143989/?sid=iKI3oo&page=4,1.0,2026-01-02 18:04:08.793336,https://www.imoti.net/bg/obiavi/r/prodava/sofia/?page=1&sid=iKI3oo,imoti.net,463,2026-01-02,,,Цена на /м2/:3 500EUR/6 845.41BGN, 81 м2,Етаж: 2 от 7
"продава Двустаен апартамент, 101 м2","Вашият дом с история и бъдеще. Енергоефективност, независимост, иновативност и заслужен комфорт за всички собственици на комплекса. Двустаен апартамент състоящ се от: дневна с кухненски бокс,...",283643.0,BGN,False,продава,двустаен,София, Хладилника,,АДРЕС Недвижими имоти АД,,https://www.imoti.net/bg/obiava/prodava/sofia/hladilnika/dvustaen/6035571/?sid=iKI3oo&page=5,11.0,2026-01-02 18:04:13.452475,https://www.imoti.net/bg/obiavi/r/prodava/sofia/?page=1&sid=iKI3oo,imoti.net,463,2026-01-02,,,Цена на /м2/:2 808EUR/5 492.65BGN, 101 м2,Етаж: 6 от 15
"продава Двустаен апартамент, 75 м2","Ексклузивно, БЕЗ КОМИСИОН от купувач.Предлагаме нов, функционален апартамент в модерна сграда с А16-юни 2024г.Сградата е разположена на ул. Филип Кутев, в близост до МОЛ Парадайс,...",285000.0,BGN,False,продава,двустаен,София, Хладилника,,Еколит,,https://www.imoti.net/bg/obiava/prodava/sofia/hladilnika/dvustaen/6016010/?sid=iKI3oo&page=5,,2026-01-02 18:04:13.452960,https://www.imoti.net/bg/obiavi/r/prodava/sofia/?page=1&sid=iKI3oo,imoti.net,463,2026-01-02,,,Цена на /м2/:3 800EUR/7 432.15BGN, 75 м2,Етаж: 4 от 11
"продава Двустаен апартамент, 63 м2","За повече информация свържете се с нас и цитирайте референтния номер на имота. Моля, кажете, че сте видeли обявата в imoti.net.Референтен номер: Sfa 88306Тел: 0882 817...",285000.0,BGN,False,продава,двустаен,София, Лозенец,,BULGARIAN PROPERTIES,,https://www.imoti.net/bg/obiava/prodava/sofia/lozenec/dvustaen/6133537/?sid=iKI3oo&page=5,20.0,2026-01-02 18:04:13.453477,https://www.imoti.net/bg/obiavi/r/prodava/sofia/?page=1&sid=iKI3oo,imoti.net,463,2026-01-02,,,Цена на /м2/:4 524EUR/8 847.80BGN, 63 м2,Етаж: 2
"продава Тристаен апартамент, 87 м2","Имоти Премиер представя една изключителна възможност за покупка на тристаен апартамент в София, квартал Хиподрума!** с възможност за преустроиство в четиристаен!!!",285000.0,BGN,False,продава,тристаен,София, Хиподрума,,Имоти Премиер,,https://www.imoti.net/bg/obiava/prodava/sofia/hipodruma/tristaen/6053534/?sid=iKI3oo&page=5,15.0,2026-01-02 18:04:13.453980,https://www.imoti.net/bg/obiavi/r/prodava/sofia/?page=1&sid=iKI3oo,imoti.net,463,2026-01-02,,,Цена на /м2/:3 276EUR/6 407.03BGN, 87 м2,Етаж: 8 от 9
"продава Двустаен апартамент, 101 м2","Вашият дом с история и бъдеще. Енергоефективност, независимост, иновативност и заслужен комфорт за всички собственици на комплекса. Двустаен апартамент състоящ се от: дневна с кухненски бокс,...",285631.0,BGN,False,продава,двустаен,София, Хладилника,,АДРЕС Недвижими имоти АД,,https://www.imoti.net/bg/obiava/prodava/sofia/hladilnika/dvustaen/6035569/?sid=iKI3oo&page=5,14.0,2026-01-02 18:04:13.454419,https://www.imoti.net/bg/obiavi/r/prodava/sofia/?page=1&sid=iKI3oo,imoti.net,463,2026-01-02,,,Цена на /м2/:2 828EUR/5 531.15BGN, 101 м2,Етаж: 7 от 15
"продава Тристаен апартамент, 105 м2",НА 10МИНУТИ ОТ ЮЖЕН ПАРКМЕТРОСТАНЦИЯ БЪЛГАРИЯПАРКОМЯСТО В ЦЕНАТАИРИДА НЕДВИЖИМИ ИМОТИ Ви предлага за продажба обзаведен тристаен апартамент в квартал Белите...,289999.0,BGN,False,продава,тристаен,София, Белите Брези,,ИРИДА НЕДВИЖИМИ ИМОТИ,,https://www.imoti.net/bg/obiava/prodava--v-stroej/sofia/belite-brezi/tristaen/6045929/?sid=iKI3oo&page=5,16.0,2026-01-02 18:04:13.454919,https://www.imoti.net/bg/obiavi/r/prodava/sofia/?page=1&sid=iKI3oo,imoti.net,463,2026-01-02,,,Цена на /м2/:2 762EUR/5 401.80BGN, 105 м2,Етаж: 1 от 5
"продава Тристаен апартамент, 131 м2","Представяме нов, супер просторен тристаен апартамент за продажба, в новострояща се сграда на удобна локация в столицата, до бул. ""Цар Борис III"", кв. ""Лагера"".Сградата е разположена в...",290000.0,BGN,False,продава,тристаен,София, Лагера,,Luximmo Finest Estates,,https://www.imoti.net/bg/obiava/prodava--v-stroej/sofia/lagera/tristaen/6052575/?sid=iKI3oo&page=5,6.0,2026-01-02 18:04:13.455430,https://www.imoti.net/bg/obiavi/r/prodava/sofia/?page=1&sid=iKI3oo,imoti.net,463,2026-01-02,,,Цена на /м2/:2 214EUR/4 329.70BGN, 131 м2,Етаж:  от 8
"продава Двустаен апартамент, 92 м2","Двустаен апартамент със застроена площ от 74.52 кв.м. и обща площ от 91.85 кв.м. Разположен е на пети от осем етажа. Състои се от: дневна с кухненски бокс – 29.24 кв.м., спалня – 13.16...",294400.0,BGN,False,продава,двустаен,София, Хладилника,,Имотека,,https://www.imoti.net/bg/obiava/prodava/sofia/hladilnika/dvustaen/6093340/?sid=iKI3oo&page=5,10.0,2026-01-02 18:04:13.455872,https://www.imoti.net/bg/obiavi/r/prodava/sofia/?page=1&sid=iKI3oo,imoti.net,463,2026-01-02,,,Цена на /м2/:3 200EUR/6 258.66BGN, 92 м2,Етаж: 5 от 8
"продава Двустаен апартамент, 92 м2",Двустаен апартамент със застроена площ от 74.52 кв.м. и обща площ от 91.85кв.м.Разположен е на четвърти от осем етажа.Състои се от: дневна с кухненски бокс –...,294400.0,BGN,False,продава,двустаен,София, Хладилника,,Имотека,,https://www.imoti.net/bg/obiava/prodava/sofia/hladilnika/dvustaen/6093342/?sid=iKI3oo&page=5,9.0,2026-01-02 18:04:13.456335,https://www.imoti.net/bg/obiavi/r/prodava/sofia/?page=1&sid=iKI3oo,imoti.net,463,2026-01-02,,,Цена на /м2/:3 200EUR/6 258.66BGN, 92 м2,Етаж: 4 от 8
"продава Тристаен апартамент, 100 м2",,295000.0,BGN,False,продава,тристаен,София, Хиподрума,,Имотен център България 2021,,https://www.imoti.net/bg/obiava/prodava/sofia/hipodruma/tristaen/6155830/?sid=iKI3oo&page=5,12.0,2026-01-02 18:04:13.456827,https://www.imoti.net/bg/obiavi/r/prodava/sofia/?page=1&sid=iKI3oo,imoti.net,463,2026-01-02,,,Цена на /м2/:2 950EUR/5 769.70BGN, 100 м2,Етаж: 1 от 5
"продава Тристаен апартамент, 114 м2","ЕРА Младост продава апартамент в сграда с разрешение за ползване от 2024 година,  в динамично развиващия се район Хладилника на община Лозенец, в частта известна като „белия квартал“. В...",297700.0,BGN,False,продава,тристаен,София, Хладилника,,ERA Младост,,https://www.imoti.net/bg/obiava/prodava/sofia/hladilnika/tristaen/6183932/?sid=iKI3oo&page=5,1.0,2026-01-02 18:04:13.457279,https://www.imoti.net/bg/obiavi/r/prodava/sofia/?page=1&sid=iKI3oo,imoti.net,463,2026-01-02,,,Цена на /м2/:2 611EUR/5 107.46BGN, 114 м2,Етаж: 5 от 11
"продава Тристаен апартамент, 86 м2",СОФИЯ ИМОТИ ГРУП предлага тристаен апартамент за продажба в един от предпочитаните квартали в София - Лагера.Площ: 86м2 чиста площ без общи части и тераси....,298000.0,BGN,False,продава,тристаен,София, Лагера,,СОФИЯ ИМОТИ ГРУП,,https://www.imoti.net/bg/obiava/prodava/sofia/lagera/tristaen/6154519/?sid=iKI3oo&page=5,9.0,2026-01-02 18:04:13.457730,https://www.imoti.net/bg/obiavi/r/prodava/sofia/?page=1&sid=iKI3oo,imoti.net,463,2026-01-02,,,Цена на /м2/:3 465EUR/6 777.18BGN, 86 м2,Етаж: 3 от 9
"продава Четиристаен апартамент, 100 м2","Реф. № 012603Агенция за недвижими имоти BAS Properties предлага за продажба светъл и просторен мезонет, разположен в един от най-предпочитаните квартали на София – Белите...",299000.0,BGN,False,продава,четиристаен,София, Белите Брези,,БАС Пропъртис,,https://www.imoti.net/bg/obiava/prodava/sofia/belite-brezi/chetiristaen/6181278/?sid=iKI3oo&page=5,9.0,2026-01-02 18:04:13.458191,https://www.imoti.net/bg/obiavi/r/prodava/sofia/?page=1&sid=iKI3oo,imoti.net,463,2026-01-02,,,Цена на /м2/:2 990EUR/5 847.93BGN, 100 м2,Етаж: 7 от 8
"продава Тристаен апартамент, 100 м2","Прекрасен тристаен апартамент, на метри от Метростанция ""Красно село"". Жилището се намира в новострояща сграда, на пети жилищен етаж и се състои от просторна дневна с трапезария и...",299500.0,BGN,False,продава,тристаен,София, Лагера,,Имотека,,https://www.imoti.net/bg/obiava/prodava/sofia/lagera/tristaen/6137173/?sid=iKI3oo&page=5,16.0,2026-01-02 18:04:13.458626,https://www.imoti.net/bg/obiavi/r/prodava/sofia/?page=1&sid=iKI3oo,imoti.net,463,2026-01-02,,,Цена на /м2/:2 995EUR/5 857.71BGN, 100 м2,Етаж: 6 от 7
"продава Двустаен апартамент, 96 м2","Вашият дом с история и бъдеще. Енергоефективност, независимост, иновативност и заслужен комфорт за всички собственици на комплекса. Двустаен апартамент състоящ се от: дневна с кухненски бокс,...",299796.0,BGN,False,продава,двустаен,София, Хладилника,,АДРЕС Недвижими имоти АД,,https://www.imoti.net/bg/obiava/prodava/sofia/hladilnika/dvustaen/6035570/?sid=iKI3oo&page=5,11.0,2026-01-02 18:04:13.459070,https://www.imoti.net/bg/obiavi/r/prodava/sofia/?page=1&sid=iKI3oo,imoti.net,463,2026-01-02,,,Цена на /м2/:3 123EUR/6 107.81BGN, 96 м2,Етаж: 7 от 15
