raw_title,raw_description,price,currency,without_dds,offer_type,property_type,city,neighborhood,contact_info,agency,agency_url,details_url,num_photos,date_time_added,search_url,site,total_offers,date,ref_no,time,price_per_m2,area,floor
"продава Двустаен апартамент, 115 м2","Квартал Лозенец е с утвърден престиж, отлична инфраструктура и бърз достъп до:•	супермаркети и бутикови магазини•	училища, детски градини и паркове•	удобен градски...",400000.0,BGN,False,продава,двустаен,София, Лозенец,,DHI group Ltd,,https://www.imoti.net/bg/obiava/prodava/sofia/lozenec/dvustaen/6190154/?sid=iKI3oo&page=1,1.0,2026-01-02 18:03:55.152900,https://www.imoti.net/bg/obiavi/r/prodava/sofia/?page=1&sid=iKI3oo,imoti.net,463,2026-01-02,,,Цена на /м2/:3 478EUR/6 802.89BGN, 115 м2,Етаж: 4 от 6
"продава Четиристаен апартамент, 150 м2","RealNet продава просторен и функционален четиристаен апартамент, със застроена площ от 150 кв.м. (около 170 кв.м. с включени идеални части от общите части на сградата), находящ се на първи...",499500.0,BGN,False,продава,четиристаен,София, Лозенец,,RealNet Office Partners,,https://www.imoti.net/bg/obiava/prodava/sofia/lozenec/chetiristaen/6181104/?sid=iKI3oo&page=1,14.0,2026-01-02 18:03:55.153382,https://www.imoti.net/bg/obiavi/r/prodava/sofia/?page=1&sid=iKI3oo,imoti.net,463,2026-01-02,,,Цена на /м2/:3 330EUR/6 512.91BGN, 150 м2,Етаж: 2 от 6
"продава Тристаен апартамент, 201 м2","Представяме тристаен апартамент за продажба, част от нова сграда със смесено предназначение в кв. ""Лозенец"", гр. София.Сградата е с получен Акт 16.Районът е един от...",603240.0,BGN,False,продава,тристаен,София, Лозенец,,Luximmo Finest Estates,,https://www.imoti.net/bg/obiava/prodava--v-stroej/sofia/lozenec/tristaen/5750082/?sid=iKI3oo&page=1,24.0,2026-01-02 18:03:55.153847,https://www.imoti.net/bg/obiavi/r/prodava/sofia/?page=1&sid=iKI3oo,imoti.net,463,2026-01-02,,,Цена на /м2/:3 001EUR/5 869.83BGN, 201 м2,Етаж:  от 9
"продава Тристаен апартамент, 170 м2","A P A R T M E N T  0 1 2С Апартамент 012 ELEHOME ви предлага една изключително красива, функционална и резонираща с нашето ежедневие и съвременност архитектура. Семпла, изчистена и...",615000.0,BGN,False,продава,тристаен,София, Лозенец,,ELEHOME,,https://www.imoti.net/bg/obiava/prodava/sofia/lozenec/tristaen/5566759/?sid=iKI3oo&page=1,12.0,2026-01-02 18:03:55.154276,https://www.imoti.net/bg/obiavi/r/prodava/sofia/?page=1&sid=iKI3oo,imoti.net,463,2026-01-02,,,Цена на /м2/:3 618EUR/7 075.50BGN, 170 м2,Етаж: 3 от 8
"продава Тристаен апартамент, 87 м2","Агенция за недвижими имоти ""Пандора Естейт"" продава ексклузивно тристаен апартамент в кв. Бели Брези на цена от 132,000 евро.Имотът е с площ от 87 кв.м, разположен на 9-ти етаж от...",132000.0,BGN,False,продава,тристаен,София, Белите Брези,,Пандора естейт,,https://www.imoti.net/bg/obiava/prodava/sofia/belite-brezi/tristaen/5983760/?sid=iKI3oo&page=1,6.0,2026-01-02 18:03:55.154723,https://www.imoti.net/bg/obiavi/r/prodava/sofia/?page=1&sid=iKI3oo,imoti.net,463,2026-01-02,,,Цена на /м2/:1 517EUR/2 967.47BGN, 87 м2,Етаж: 9 от 12
"продава Двустаен апартамент, 45 м2","Продава се двустаен апартамент в кв. Лагера първи етаж, източно изложениеЛокация: кв. Лагера тиха и добре уредена част на София, с удобен достъп до центъра, градски транспорт (трамвай,...",149000.0,BGN,False,продава,двустаен,София, Лагера,,Имотен център България 2021,,https://www.imoti.net/bg/obiava/prodava/sofia/lagera/dvustaen/6183919/?sid=iKI3oo&page=1,14.0,2026-01-02 18:03:55.155221,https://www.imoti.net/bg/obiavi/r/prodava/sofia/?page=1&sid=iKI3oo,imoti.net,463,2026-01-02,,,Цена на /м2/:3 311EUR/6 475.97BGN, 45 м2,Етаж: 1 от 4
"продава Двустаен апартамент, 55 м2","Продава се двустаен апартамент в Лозенец, подходящ за инвестиция. Апартаментът се намира на последен етаж в тухлена сграда без асансьор. Състои се от две стаи -: хол с кухненски бокс и спалня,...",175000.0,BGN,False,продава,двустаен,София, Лозенец,,Глобъл Сървисиз,,https://www.imoti.net/bg/obiava/prodava/sofia/lozenec/dvustaen/6143857/?sid=iKI3oo&page=1,7.0,2026-01-02 18:03:55.155652,https://www.imoti.net/bg/obiavi/r/prodava/sofia/?page=1&sid=iKI3oo,imoti.net,463,2026-01-02,,,Цена на /м2/:3 182EUR/6 223.10BGN, 55 м2,Етаж: 5 от 5
"продава Двустаен апартамент, 45 м2","Компания `ЕКС` представя на Вашето внимание двустаен апартамент в ж.к. Лагера.МЕСТОПОЛОЖЕНИЕ: В близост ще намерите различни транспортни връзки, училища, детски градини и търговски...",179000.0,BGN,False,продава,двустаен,София, Лагера,,ЕКС НВД,,https://www.imoti.net/bg/obiava/prodava/sofia/lagera/dvustaen/6107928/?sid=iKI3oo&page=1,1.0,2026-01-02 18:03:55.156104,https://www.imoti.net/bg/obiavi/r/prodava/sofia/?page=1&sid=iKI3oo,imoti.net,463,2026-01-02,,,Цена на /м2/:3 978EUR/7 779.86BGN, 45 м2,Етаж: 3 от 6
"продава Двустаен апартамент, 50 м2",,180000.0,BGN,False,продава,двустаен,София, Лагера,,Глобъл Сървисиз,,https://www.imoti.net/bg/obiava/prodava/sofia/lagera/dvustaen/6099325/?sid=iKI3oo&page=1,6.0,2026-01-02 18:03:55.156535,https://www.imoti.net/bg/obiavi/r/prodava/sofia/?page=1&sid=iKI3oo,imoti.net,463,2026-01-02,,,Цена на /м2/:3 600EUR/7 040.99BGN, 50 м2,Етаж: 14 от 18
"продава Двустаен апартамент, 71 м2","Предлагаме за продажба двустаен апартамент с разгъната застроена площ от 71 кв.м., разположен на 5-ти етаж от общо 6 в тухлена сграда с асансьор.Имотът е на шпакловка и замазка, което дава...",183600.0,BGN,False,продава,двустаен,София, Лагера,,Глобъл Сървисиз,,https://www.imoti.net/bg/obiava/prodava/sofia/lagera/dvustaen/6143775/?sid=iKI3oo&page=1,8.0,2026-01-02 18:03:55.156962,https://www.imoti.net/bg/obiavi/r/prodava/sofia/?page=1&sid=iKI3oo,imoti.net,463,2026-01-02,,,Цена на /м2/:2 586EUR/5 057.61BGN, 71 м2,Етаж: 5 от 6
"продава Двустаен апартамент, 78 м2","Агенция Пандора Естейт предлага ЕКСКЛУЗИВНО за продажба двустаен обзаведен апартамент в кв. Стрелбище.Имотът разполага с отопление на ток, с възможност за поставяне на радиатори за...",187000.0,BGN,False,продава,двустаен,София, Стрелбище,,Пандора естейт,,https://www.imoti.net/bg/obiava/prodava/sofia/strelbishte/dvustaen/5982548/?sid=iKI3oo&page=1,4.0,2026-01-02 18:03:55.157408,https://www.imoti.net/bg/obiavi/r/prodava/sofia/?page=1&sid=iKI3oo,imoti.net,463,2026-01-02,,,Цена на /м2/:2 397EUR/4 688.98BGN, 78 м2,Етаж: 7 от 13
"продава Двустаен апартамент, 45 м2","Двустайно жилище с югоизточно изложение, на 12-ти, последен етаж , с панорамни гледки към планината и много светлина. Състои се от просторна дневна, спалня, обособен кухненески...",188000.0,BGN,False,продава,двустаен,София, Стрелбище,,Имотека,,https://www.imoti.net/bg/obiava/prodava/sofia/strelbishte/dvustaen/6165824/?sid=iKI3oo&page=1,13.0,2026-01-02 18:03:55.157836,https://www.imoti.net/bg/obiavi/r/prodava/sofia/?page=1&sid=iKI3oo,imoti.net,463,2026-01-02,,,Цена на /м2/:4 178EUR/8 171.02BGN, 45 м2,Етаж: 12 от 12
"продава Двустаен апартамент, 65 м2","Просторен двустаен апартамент с южно изложение в ж.к. Стрелбище!Представяме ви слънчев и уютен апартамент, разположен на девети етаж в добре поддържана панелна сграда в един от...",190000.0,BGN,False,продава,двустаен,София, Стрелбище,,Имотека,,https://www.imoti.net/bg/obiava/prodava/sofia/strelbishte/dvustaen/6152176/?sid=iKI3oo&page=1,15.0,2026-01-02 18:03:55.158284,https://www.imoti.net/bg/obiavi/r/prodava/sofia/?page=1&sid=iKI3oo,imoti.net,463,2026-01-02,,,Цена на /м2/:2 923EUR/5 717.04BGN, 65 м2,Етаж: 9 от 9
"продава Тристаен апартамент, 84 м2","Агенция за недвижими имоти Пандора естейт продава ексклузивно.Реф. № 110192.Тристайни апартаменти в кв. Хиподрума, с отличен достъп до транспортни средства и удобства.Цена:...",191000.0,BGN,False,продава,тристаен,София, Хиподрума,,Пандора естейт,,https://www.imoti.net/bg/obiava/prodava/sofia/hipodruma/tristaen/6019423/?sid=iKI3oo&page=1,8.0,2026-01-02 18:03:55.158721,https://www.imoti.net/bg/obiavi/r/prodava/sofia/?page=1&sid=iKI3oo,imoti.net,463,2026-01-02,,,Цена на /м2/:2 274EUR/4 447.18BGN, 84 м2,Етаж: 2 от 15
"продава Двустаен апартамент, 62 м2","ЕРА Голд представя двустаен апартамент в новострояща се сграда в ж.к. Стрелбище на перфектна локация в близост до бул. България, супермаркет Фантастико, не далеч от Южен Парк, в близост до...",192617.0,BGN,False,продава,двустаен,София, Стрелбище,,ЕРА Голд,,https://www.imoti.net/bg/obiava/prodava--v-stroej/sofia/strelbishte/dvustaen/6037572/?sid=iKI3oo&page=1,2.0,2026-01-02 18:03:55.159161,https://www.imoti.net/bg/obiavi/r/prodava/sofia/?page=1&sid=iKI3oo,imoti.net,463,2026-01-02,,,Цена на /м2/:3 107EUR/6 076.23BGN, 62 м2,Етаж: 6 от 8
"продава Двустаен апартамент, 72 м2","За повече информация свържете се с нас и цитирайте референтния номер на имота. Моля, кажете, че сте видeли обявата в imoti.net.Референтен номер: Sfa 85507Тел: 0882 817...",192617.0,BGN,False,продава,двустаен,София, Стрелбище,,BULGARIAN PROPERTIES,,https://www.imoti.net/bg/obiava/prodava--v-stroej/sofia/strelbishte/dvustaen/5957311/?sid=iKI3oo&page=1,20.0,2026-01-02 18:03:55.159655,https://www.imoti.net/bg/obiavi/r/prodava/sofia/?page=1&sid=iKI3oo,imoti.net,463,2026-01-02,,,Цена на /м2/:2 675EUR/5 232.31BGN, 72 м2,Етаж: 1 от 8
"продава Двустаен апартамент, 75 м2",.  .  .  .  .  .  .  .  .  .  .  .  .  .  .  .  .  .  .  .  .  .  .  .  .  .  .  .  .  . НОВ .  .  .  .  .  .  .  .  .  .  .  .  .  .  .  .  .  .  .  .  .  .  .  .  .  .  .  .  .  .С А16...,198000.0,BGN,False,продава,двустаен,София, Хладилника,,АРСЕНАЛ - недвижими имоти,,https://www.imoti.net/bg/obiava/prodava/sofia/hladilnika/dvustaen/6020840/?sid=iKI3oo&page=1,1.0,2026-01-02 18:03:55.160099,https://www.imoti.net/bg/obiavi/r/prodava/sofia/?page=1&sid=iKI3oo,imoti.net,463,2026-01-02,,,Цена на /м2/:2 640EUR/5 163.39BGN, 75 м2,Етаж: 5 от 11
"продава Двустаен апартамент, 77 м2",Агенция Пандора Естейт предлага ексклузивно за продажба двустаен апартамент в престижния квартал Лозенец.Площ: 77 кв. мТип строителство: ТухлаГодина на строителство:...,198000.0,BGN,False,продава,двустаен,София, Лозенец,,Пандора естейт,,https://www.imoti.net/bg/obiava/prodava/sofia/lozenec/dvustaen/5981942/?sid=iKI3oo&page=1,4.0,2026-01-02 18:03:55.160550,https://www.imoti.net/bg/obiavi/r/prodava/sofia/?page=1&sid=iKI3oo,imoti.net,463,2026-01-02,,,Цена на /м2/:2 571EUR/5 029.28BGN, 77 м2,Етаж: 5 от 7
"продава Двустаен апартамент, 66 м2",,199999.0,BGN,False,продава,двустаен,София, Лагера,,Имоти Премиер,,https://www.imoti.net/bg/obiava/prodava/sofia/lagera/dvustaen/6032520/?sid=iKI3oo&page=1,16.0,2026-01-02 18:03:55.161039,https://www.imoti.net/bg/obiavi/r/prodava/sofia/?page=1&sid=iKI3oo,imoti.net,463,2026-01-02,,,Цена на /м2/:3 030EUR/5 926.73BGN, 66 м2,Етаж: 2 от 6
"продава Двустаен апартамент, 52 м2",Компания `ЕКС` представя на Вашето внимание двустаен апартамент в жк. Лагера.МЕСТОПОЛОЖЕНИЕ: Намира се в близост до трамвайна спирка ж.к. 'Лагера'.СТРОИТЕЛСТВО:...,199999.0,BGN,False,продава,двустаен,София, Лагера,,ЕКС НВД,,https://www.imoti.net/bg/obiava/prodava/sofia/lagera/dvustaen/6167198/?sid=iKI3oo&page=1,8.0,2026-01-02 18:03:55.161482,https://www.imoti.net/bg/obiavi/r/prodava/sofia/?page=1&sid=iKI3oo,imoti.net,463,2026-01-02,,,Цена на /м2/:3 846EUR/7 522.39BGN, 52 м2,Етаж: 13 от 13
"продава Тристаен апартамент, 74 м2","Тристаен апартамент, състоящ се от: една стая, дневна, столова кухненски бокс и други сервизни помещения, със застроена площ от 73,84 в цената е включен и 22 кв.м. надземен гаражИмота...",200000.0,BGN,False,продава,тристаен,София, Стрелбище,,Имотека,,https://www.imoti.net/bg/obiava/prodava/sofia/strelbishte/tristaen/6165825/?sid=iKI3oo&page=1,3.0,2026-01-02 18:03:55.161915,https://www.imoti.net/bg/obiavi/r/prodava/sofia/?page=1&sid=iKI3oo,imoti.net,463,2026-01-02,,,Цена на /м2/:2 703EUR/5 286.03BGN, 74 м2,Етаж: 6 от 9
"продава Двустаен апартамент, 62 м2","Ексклузивно предложение!!! Двустаен, обзаведен в стара тухлена сграда със ЗП- 56.07 кв.м. на ул.“Деде Агач“ в близост до училище, супермаркет, пазар, метростанция, стадион, парк, спирки на градския...",200000.0,BGN,False,продава,двустаен,София, Стрелбище,,Тамбуков недвижими имоти,,https://www.imoti.net/bg/obiava/prodava/sofia/strelbishte/dvustaen/6142562/?sid=iKI3oo&page=1,14.0,2026-01-02 18:03:55.162355,https://www.imoti.net/bg/obiavi/r/prodava/sofia/?page=1&sid=iKI3oo,imoti.net,463,2026-01-02,,,Цена на /м2/:3 226EUR/6 309.13BGN, 62 м2,Етаж: 7 от 7
"продава Двустаен апартамент, 65 м2",Global Services предлага на Вашето внимание двустаен апартамент в непосредствена близост до входа на ЮЖЕН ПАРК в кв. Стрелбище.Жилището е в отлично състояние и напълно обзаведено....,200000.0,BGN,False,продава,двустаен,София, Стрелбище,,Глобъл Сървисиз,,https://www.imoti.net/bg/obiava/prodava/sofia/strelbishte/dvustaen/6184151/?sid=iKI3oo&page=1,3.0,2026-01-02 18:03:55.162785,https://www.imoti.net/bg/obiavi/r/prodava/sofia/?page=1&sid=iKI3oo,imoti.net,463,2026-01-02,,,Цена на /м2/:3 077EUR/6 017.94BGN, 65 м2,Етаж: 1 от 6
"продава Двустаен апартамент, 69 м2","ЕРА Младост продава апартамент в сграда с разрешение за ползване от 2024 година,  в динамично развиващия се район Хладилника на община Лозенец, в частта известна като „белия квартал“. В...",205600.0,BGN,False,продава,двустаен,София, Хладилника,,ERA Младост,,https://www.imoti.net/bg/obiava/prodava/sofia/hladilnika/dvustaen/6155708/?sid=iKI3oo&page=1,1.0,2026-01-02 18:03:55.163223,https://www.imoti.net/bg/obiavi/r/prodava/sofia/?page=1&sid=iKI3oo,imoti.net,463,2026-01-02,,,Цена на /м2/:2 980EUR/5 827.81BGN, 69 м2,Етаж: 9 от 11
"продава Тристаен апартамент, 84 м2","Продава се мезонет/тризонет в кв. Лагера, гр. СофияСамо на 170 м от метростанция „Красно село“!Просторен, обзаведен и готов за живеене имот, разположен на последните два...",207000.0,BGN,False,продава,тристаен,София, Лагера,,Глобъл Сървисиз,,https://www.imoti.net/bg/obiava/prodava/sofia/lagera/tristaen/6144001/?sid=iKI3oo&page=1,17.0,2026-01-02 18:03:55.163660,https://www.imoti.net/bg/obiavi/r/prodava/sofia/?page=1&sid=iKI3oo,imoti.net,463,2026-01-02,,,Цена на /м2/:2 464EUR/4 819.72BGN, 84 м2,Етаж: 5 от 6
"продава Двустаен апартамент, 72 м2","Предлагаме уютен  двустаен апартамент с площ 72 кв.м (застроена площ 59.40 кв.м), разположен в един от най-предпочитаните и зелени квартали на София – кв. Лагера....",209900.0,BGN,False,продава,двустаен,София, Лагера,,АДРЕС Недвижими имоти АД,,https://www.imoti.net/bg/obiava/prodava/sofia/lagera/dvustaen/6152785/?sid=iKI3oo&page=1,7.0,2026-01-02 18:03:55.164103,https://www.imoti.net/bg/obiavi/r/prodava/sofia/?page=1&sid=iKI3oo,imoti.net,463,2026-01-02,,,Цена на /м2/:2 915EUR/5 701.79BGN, 72 м2,Етаж: 2 от 7
"продава Двустаен апартамент, 60 м2","светъл и уютен апартамент.Състоящ се от спалня, кухня ,трапезария ,санитарен възел и огромна тераса,която може да бъде обособена.Апартамента е вътрешен и топъл в зимните...",210000.0,BGN,False,продава,двустаен,София, Белите Брези,,Глобъл Сървисиз,,https://www.imoti.net/bg/obiava/prodava/sofia/belite-brezi/dvustaen/6144004/?sid=iKI3oo&page=1,1.0,2026-01-02 18:03:55.164538,https://www.imoti.net/bg/obiavi/r/prodava/sofia/?page=1&sid=iKI3oo,imoti.net,463,2026-01-02,,,Цена на /м2/:3 500EUR/6 845.41BGN, 60 м2,Етаж: 5 от 6
"продава Двустаен апартамент, 42 м2",Референтен номер: 2094783Революшън Естейт представя Двустаен апартамент в ж.к. Хиподрума.- Етаж: 1-ви от 3-ти.- Площ: 42 кв.м.- Разпределение:...,210000.0,BGN,False,продава,двустаен,София, Хиподрума,,Революшън Естейт България,,https://www.imoti.net/bg/obiava/prodava/sofia/hipodruma/dvustaen/6141285/?sid=iKI3oo&page=1,10.0,2026-01-02 18:03:55.164993,https://www.imoti.net/bg/obiavi/r/prodava/sofia/?page=1&sid=iKI3oo,imoti.net,463,2026-01-02,,,Цена на /м2/:5 000EUR/9 779.15BGN, 42 м2,Етаж: 1 от 3
"продава Двустаен апартамент, 57 м2","BULGARIA REAL ESTATE Ви предлагаДвустаен апартамент за продажба в София, кв. Лагера – функционален, светъл и уютен дом, подходящ както за лично ползване, така и за инвестиция. Сграда от 2011...",214300.0,BGN,False,продава,двустаен,София, Лагера,,BULGARIA REAL ESTATE,,https://www.imoti.net/bg/obiava/prodava/sofia/lagera/dvustaen/6181301/?sid=iKI3oo&page=1,10.0,2026-01-02 18:03:55.165433,https://www.imoti.net/bg/obiavi/r/prodava/sofia/?page=1&sid=iKI3oo,imoti.net,463,2026-01-02,,,Цена на /м2/:3 760EUR/7 353.23BGN, 57 м2,Етаж: 6 от 6
"продава Двустаен апартамент, 57 м2","Предлагаме Ви двустаен обзаведен апартамент в кв Лагера. С възможнист за промяна в тристаен. Състои се от входно антре, всекидневна с кухненски бокс, спалня, баня с тоалетна, балкон. Югоизточно...",215990.0,BGN,False,продава,двустаен,София, Лагера,,Имотека,,https://www.imoti.net/bg/obiava/prodava/sofia/lagera/dvustaen/6088727/?sid=iKI3oo&page=1,8.0,2026-01-02 18:03:55.165860,https://www.imoti.net/bg/obiavi/r/prodava/sofia/?page=1&sid=iKI3oo,imoti.net,463,2026-01-02,,,Цена на /м2/:3 789EUR/7 411.22BGN, 57 м2,Етаж: 9 от 9
"продава Двустаен апартамент, 69 м2","Двустаен апартамент със застроена площ от 60кв.м. На метри от Метростанция ""Красно село"". Жилището се намира в новострояща се сграда, на четвърти жилищен етаж и се състои от входно...",217800.0,BGN,False,продава,двустаен,София, Лагера,,Имотека,,https://www.imoti.net/bg/obiava/prodava/sofia/lagera/dvustaen/6157925/?sid=iKI3oo&page=2,8.0,2026-01-02 18:03:59.441363,https://www.imoti.net/bg/obiavi/r/prodava/sofia/?page=1&sid=iKI3oo,imoti.net,463,2026-01-02,,,Цена на /м2/:3 157EUR/6 173.62BGN, 69 м2,Етаж: 4 от 7
"продава Двустаен апартамент, 76 м2",НАЧАЛЕН ЕТАП НА СТРОИТЕЛСТВО!АКТ 14 МАРТ НА 2026г.!АКТ 15 КРАЯ НА 2026г!АКТ 16 НАЧАЛОТО НА 2027г!ИРИДА НЕДВИЖИМИ ИМОТИ продава просторен двустаен апартамент в...,218526.0,BGN,False,продава,двустаен,София, Стрелбище,,ИРИДА НЕДВИЖИМИ ИМОТИ,,https://www.imoti.net/bg/obiava/prodava--v-stroej/sofia/strelbishte/dvustaen/6038314/?sid=iKI3oo&page=2,6.0,2026-01-02 18:03:59.441930,https://www.imoti.net/bg/obiavi/r/prodava/sofia/?page=1&sid=iKI3oo,imoti.net,463,2026-01-02,,,Цена на /м2/:2 875EUR/5 623.68BGN, 76 м2,Етаж: 2 от 8
"продава Двустаен апартамент, 76 м2","Планирано завършване - до края на 2026 г.Представяме двустаен апартамент за продажба в атрактивна сграда ново строителство на топ локация в кв. ""Стрелбище"", в близост до булеварди...",218526.0,BGN,False,продава,двустаен,София, Стрелбище,,SUPRIMMO,,https://www.imoti.net/bg/obiava/prodava--v-stroej/sofia/strelbishte/dvustaen/6026314/?sid=iKI3oo&page=2,4.0,2026-01-02 18:03:59.442395,https://www.imoti.net/bg/obiavi/r/prodava/sofia/?page=1&sid=iKI3oo,imoti.net,463,2026-01-02,,,Цена на /м2/:2 875EUR/5 623.68BGN, 76 м2,Етаж:  от 8
"продава Тристаен апартамент, 78 м2","хубав, светъл и топъл тристаен апартамент, на метри от входа на Южен парк, с прекрасна гледка към Витоша. Разпределение: хол, две самостоятелни спални, кухня, баня, тоалетна и две тераси....",220000.0,BGN,False,продава,тристаен,София, Стрелбище,,Глобъл Сървисиз,,https://www.imoti.net/bg/obiava/prodava/sofia/strelbishte/tristaen/6143817/?sid=iKI3oo&page=2,1.0,2026-01-02 18:03:59.442836,https://www.imoti.net/bg/obiavi/r/prodava/sofia/?page=1&sid=iKI3oo,imoti.net,463,2026-01-02,,,Цена на /м2/:2 821EUR/5 516.44BGN, 78 м2,Етаж: 6 от 7
