raw_title,raw_description,price,currency,without_dds,offer_type,property_type,city,neighborhood,contact_info,agency,agency_url,details_url,num_photos,date_time_added,search_url,site,total_offers,date,ref_no,time,price_per_m2,area,floor
"продава Тристаен апартамент, 129 м2",НАЧАЛЕН ЕТАП НА СТРОИТЕЛСТВО!АКТ 14 МАРТ НА 2026г.!АКТ 15 КРАЯ НА 2026г!АКТ 16 НАЧАЛОТО НА 2027г!ИРИДА НЕДВИЖИМИ ИМОТИ продава панорамен слънчев тристаен...,370475.0,BGN,False,продава,тристаен,София, Стрелбище,,ИРИДА НЕДВИЖИМИ ИМОТИ,,https://www.imoti.net/bg/obiava/prodava--v-stroej/sofia/strelbishte/tristaen/6038121/?sid=iKI3oo&page=7,6.0,2026-01-02 18:04:22.523016,https://www.imoti.net/bg/obiavi/r/prodava/sofia/?page=1&sid=iKI3oo,imoti.net,463,2026-01-02,,,Цена на /м2/:2 872EUR/5 616.95BGN, 129 м2,Етаж: 2 от 8
"продава Тристаен апартамент, 127 м2","Предлагаме за продажба голям и светъл тристаен апартамент със застроена площ от 127 кв.м., разположен във вътрешната част на квартала, в спокойна и озеленена зона с отлична инфраструктура....",373000.0,BGN,False,продава,тристаен,София, Лагера,,АДРЕС Недвижими имоти АД,,https://www.imoti.net/bg/obiava/prodava/sofia/lagera/tristaen/6147251/?sid=iKI3oo&page=7,26.0,2026-01-02 18:04:22.523459,https://www.imoti.net/bg/obiavi/r/prodava/sofia/?page=1&sid=iKI3oo,imoti.net,463,2026-01-02,,,Цена на /м2/:2 937EUR/5 744.29BGN, 127 м2,Етаж: 3 от 6
"продава Мезонет, 224 м2","ЕРА Голд Ви представя южен мезонет с три спални в нова жилищна сграда в близост до центъра на София и Военномедицинска болница, кв. Лагера.Апартаментът се състои от :1 етаж :...",375000.0,BGN,False,продава,мезонет,София, Лагера,,ЕРА Голд,,https://www.imoti.net/bg/obiava/prodava--v-stroej/sofia/lagera/mezonet/6121059/?sid=iKI3oo&page=7,6.0,2026-01-02 18:04:22.523918,https://www.imoti.net/bg/obiavi/r/prodava/sofia/?page=1&sid=iKI3oo,imoti.net,463,2026-01-02,,,Цена на /м2/:1 674EUR/3 274.27BGN, 224 м2,Етаж: 7 от 7
"продава Многостаен апартамент, 215 м2","ЕРА Голд Ви представя апартамент с 4 спални в нова жилищна сграда в близост до центъра на София и Военномедицинска болница, кв. Лагера.Апартаментът се състои от входно антре, дневна с...",375000.0,BGN,False,продава,многостаен,София, Лагера,,ЕРА Голд,,https://www.imoti.net/bg/obiava/prodava--v-stroej/sofia/lagera/mnogostaen/6121062/?sid=iKI3oo&page=7,6.0,2026-01-02 18:04:22.524371,https://www.imoti.net/bg/obiavi/r/prodava/sofia/?page=1&sid=iKI3oo,imoti.net,463,2026-01-02,,,Цена на /м2/:1 744EUR/3 411.33BGN, 215 м2,Етаж: 3 от 8
"продава Двустаен апартамент, 98 м2","ДО ЮЖЕН ПАРК И ХОТЕЛ МАРИНЕЛА! Надилена риъл естейтс предлага за продажба елегантен апартамент със застроена площ от 98кв.м., ет. 5/от 6, с асансьор. Сградата е тухлена, строителство от 1998год., с...",378000.0,BGN,False,продава,двустаен,София, Лозенец,,Надилена риъл естейтс,,https://www.imoti.net/bg/obiava/prodava/sofia/lozenec/dvustaen/6158385/?sid=iKI3oo&page=7,16.0,2026-01-02 18:04:22.524864,https://www.imoti.net/bg/obiavi/r/prodava/sofia/?page=1&sid=iKI3oo,imoti.net,463,2026-01-02,,,Цена на /м2/:3 857EUR/7 543.92BGN, 98 м2,Етаж: 5 от 7
"продава Тристаен апартамент, 98 м2","ДО ЮЖЕН ПАРК И ХОТЕЛ МАРИНЕЛА! Надилена риъл естейтс предлага за продажба елегантен апартамент със застроена площ от 98кв.м., ет. 5/от 6, с асансьор. Сградата е тухлена, строителство от 1998год., с...",378000.0,BGN,False,продава,тристаен,София, Лозенец,,Надилена риъл естейтс,,https://www.imoti.net/bg/obiava/prodava/sofia/lozenec/tristaen/6158386/?sid=iKI3oo&page=7,16.0,2026-01-02 18:04:22.525371,https://www.imoti.net/bg/obiavi/r/prodava/sofia/?page=1&sid=iKI3oo,imoti.net,463,2026-01-02,,,Цена на /м2/:3 857EUR/7 543.92BGN, 98 м2,Етаж: 5 от 6
"продава Двустаен апартамент, 74 м2","Galiano Estates ви представя двустаен апартамент в Хладилника.Жилището е напълно обзаведено и има следното разпределение: Антре, хол, спалня, баня с тоалетна, две тераси едната от които е панорамна...",380000.0,BGN,False,продава,двустаен,София, Хладилника,,Galiano Estates,,https://www.imoti.net/bg/obiava/prodava/sofia/hladilnika/dvustaen/6080288/?sid=iKI3oo&page=7,11.0,2026-01-02 18:04:22.525865,https://www.imoti.net/bg/obiavi/r/prodava/sofia/?page=1&sid=iKI3oo,imoti.net,463,2026-01-02,,,Цена на /м2/:5 135EUR/10 043.45BGN, 74 м2,Етаж: 5 от 9
"продава Многостаен апартамент, 183 м2","Компания `ЕКС` представя на Вашето внимание многостаен апартамент в жк. Лозенец.МЕСТОПОЛОЖЕНИЕ: Намира се в близост до МОЛ Парадаис, множество магазини и спирки на градски...",380000.0,BGN,False,продава,многостаен,София, Лозенец,,ЕКС НВД,,https://www.imoti.net/bg/obiava/prodava/sofia/lozenec/mnogostaen/6113895/?sid=iKI3oo&page=7,14.0,2026-01-02 18:04:22.526326,https://www.imoti.net/bg/obiavi/r/prodava/sofia/?page=1&sid=iKI3oo,imoti.net,463,2026-01-02,,,Цена на /м2/:2 077EUR/4 061.29BGN, 183 м2,Етаж: 5 от 6
"продава Тристаен апартамент, 111 м2",,380000.0,BGN,False,продава,тристаен,София, Хиподрума,,Глобъл Сървисиз,,https://www.imoti.net/bg/obiava/prodava/sofia/hipodruma/tristaen/6087051/?sid=iKI3oo&page=8,1.0,2026-01-02 18:04:26.508955,https://www.imoti.net/bg/obiavi/r/prodava/sofia/?page=1&sid=iKI3oo,imoti.net,463,2026-01-02,,,Цена на /м2/:3 423EUR/6 695.63BGN, 111 м2,Етаж: 4 от 6
"продава Тристаен апартамент, 86 м2",Компания `ЕКС` представя на Вашето внимание тристаен апартамент в жк. Лозенец.МЕСТОПОЛОЖЕНИЕ: Намира се на няколко минути от булевард Джеймс Баучер.СТРОИТЕЛСТВО:...,380000.0,BGN,False,продава,тристаен,София, Лозенец,,ЕКС НВД,,https://www.imoti.net/bg/obiava/prodava/sofia/lozenec/tristaen/6179256/?sid=iKI3oo&page=8,8.0,2026-01-02 18:04:26.509474,https://www.imoti.net/bg/obiavi/r/prodava/sofia/?page=1&sid=iKI3oo,imoti.net,463,2026-01-02,,,Цена на /м2/:4 419EUR/8 642.04BGN, 86 м2,Етаж: 3 от 4
"продава Тристаен апартамент, 108 м2","Просторен и светъл апартамент в кв. Стрелбище, напълно обзаведен и състоящ се от голяма дневна с трапезария и отделна кухня, две спални, мокро помещение и четири тераси.Площ: 108 кв.м....",380000.0,BGN,False,продава,тристаен,София, Стрелбище,,Глобъл Сървисиз,,https://www.imoti.net/bg/obiava/prodava/sofia/strelbishte/tristaen/6144187/?sid=iKI3oo&page=8,16.0,2026-01-02 18:04:26.509920,https://www.imoti.net/bg/obiavi/r/prodava/sofia/?page=1&sid=iKI3oo,imoti.net,463,2026-01-02,,,Цена на /м2/:3 519EUR/6 881.62BGN, 108 м2,Етаж: 10 от 13
"продава Тристаен апартамент, 96 м2","Modern Home представя ексклузивно с ключ в агенцията! Невероятен апартамент с гледка към Южен парк и Витоша – локация без аналогПредставяме изключителен имот, разположен на една от...",381000.0,BGN,False,продава,тристаен,София, Иван Вазов,,MODERN HOME,,https://www.imoti.net/bg/obiava/prodava/sofia/ivan-vazov/tristaen/6154765/?sid=iKI3oo&page=8,15.0,2026-01-02 18:04:26.510377,https://www.imoti.net/bg/obiavi/r/prodava/sofia/?page=1&sid=iKI3oo,imoti.net,463,2026-01-02,,,Цена на /м2/:3 969EUR/7 762.20BGN, 96 м2,Етаж: 8 от 11
"продава Многостаен апартамент, 117 м2","Открийте мястото, където ще се чувствате у дома от първия момент.Титан Пропъртис с радост предлага на Вашето внимание многостаен апартамент за продажба в кв. Лозенец, София....",385000.0,BGN,False,продава,многостаен,София, Лозенец,,Титан Пропъртис,,https://www.imoti.net/bg/obiava/prodava/sofia/lozenec/mnogostaen/6149954/?sid=iKI3oo&page=8,17.0,2026-01-02 18:04:26.510819,https://www.imoti.net/bg/obiavi/r/prodava/sofia/?page=1&sid=iKI3oo,imoti.net,463,2026-01-02,,,Цена на /м2/:3 291EUR/6 435.85BGN, 117 м2,Етаж: 4 от 5
"продава Многостаен апартамент, 154 м2","Представяме ви уникален имот с площ от 154 кв.м, разположен на партер и първи жилищен етаж в малка тухлена кооперация с три етажа и общо седем апартамента. Имотът се намира в горната част на кв....",385000.0,BGN,False,продава,многостаен,София, Лозенец,,SUPRIMMO,,https://www.imoti.net/bg/obiava/prodava--v-stroej/sofia/lozenec/mnogostaen/6077044/?sid=iKI3oo&page=8,12.0,2026-01-02 18:04:26.511267,https://www.imoti.net/bg/obiavi/r/prodava/sofia/?page=1&sid=iKI3oo,imoti.net,463,2026-01-02,,,Цена на /м2/:2 500EUR/4 889.58BGN, 154 м2,Етаж:  от 3
"продава Четиристаен апартамент, 117 м2","ПРОСТОРЕН, ВЪТРЕШЕН, ТИХ ап. на ТОП място: на минути от входа на Южния парк, МОЛ Парк център, в близост до метростанция Европейски съюз, множество спирки на градския транспорт, пешеходно разстояние...",385000.0,BGN,False,продава,четиристаен,София, Лозенец,,АЛДЕС ИМОТИ ЕООД,,https://www.imoti.net/bg/obiava/prodava/sofia/lozenec/chetiristaen/6117777/?sid=iKI3oo&page=8,10.0,2026-01-02 18:04:26.511703,https://www.imoti.net/bg/obiavi/r/prodava/sofia/?page=1&sid=iKI3oo,imoti.net,463,2026-01-02,,,Цена на /м2/:3 291EUR/6 435.85BGN, 117 м2,Етаж: 4 от 5
"продава Многостаен апартамент, 117 м2","Продава се просторен и функционален многостаен апартамент, разположен на четвърти етаж от пететажна сграда, в една от най-предпочитаните локации в София. Имотът се намира в непосредствена близост...",385000.0,BGN,False,продава,многостаен,София, Лозенец,,Аякс недвижими имоти,,https://www.imoti.net/bg/obiava/prodava/sofia/lozenec/mnogostaen/6181554/?sid=iKI3oo&page=8,11.0,2026-01-02 18:04:26.512153,https://www.imoti.net/bg/obiavi/r/prodava/sofia/?page=1&sid=iKI3oo,imoti.net,463,2026-01-02,,,Цена на /м2/:3 291EUR/6 435.85BGN, 117 м2,Етаж: 4 от 5
"продава Тристаен апартамент, 135 м2","Просторен тристаен апартамент в един от най - предпочитаните южни квартали на столицата - `Лагера`.Разпределение: просторна дневна, две спални, две бани.Етап на...",388000.0,BGN,False,продава,тристаен,София, Лагера,,Ависта Офис Експерт,,https://www.imoti.net/bg/obiava/prodava/sofia/lagera/tristaen/6118913/?sid=iKI3oo&page=8,10.0,2026-01-02 18:04:26.512601,https://www.imoti.net/bg/obiavi/r/prodava/sofia/?page=1&sid=iKI3oo,imoti.net,463,2026-01-02,,,Цена на /м2/:2 874EUR/5 621.20BGN, 135 м2,Етаж: 2 от 8
"продава Тристаен апартамент, 146 м2",,388289.0,BGN,False,продава,тристаен,София, Лозенец,,Глобъл Сървисиз,,https://www.imoti.net/bg/obiava/prodava/sofia/lozenec/tristaen/6111412/?sid=iKI3oo&page=8,,2026-01-02 18:04:26.513032,https://www.imoti.net/bg/obiavi/r/prodava/sofia/?page=1&sid=iKI3oo,imoti.net,463,2026-01-02,,,Цена на /м2/:2 660EUR/5 201.56BGN, 146 м2,Етаж: 4
"продава Тристаен апартамент, 110 м2","Тристаен апартамент, състоящ се от дневна с кухненски бокс, две спални, две бани с тоалетна и тераса.",389000.0,BGN,False,продава,тристаен,София, Лозенец,,Имотека,,https://www.imoti.net/bg/obiava/prodava/sofia/lozenec/tristaen/6096188/?sid=iKI3oo&page=8,8.0,2026-01-02 18:04:26.513475,https://www.imoti.net/bg/obiavi/r/prodava/sofia/?page=1&sid=iKI3oo,imoti.net,463,2026-01-02,,,Цена на /м2/:3 536EUR/6 916.53BGN, 110 м2,Етаж: 3 от 6
"продава Многостаен апартамент, 117 м2","Компания `ЕКС` представя на Вашето внимание многостаен апартамент на две нива в жк. Лозенец.МЕСТОПОЛОЖЕНИЕ: Намира се в близост до Южния парк, плувен комплекс /Спартак/, пазар/...",390000.0,BGN,False,продава,многостаен,София, Лозенец,,ЕКС НВД,,https://www.imoti.net/bg/obiava/prodava/sofia/lozenec/mnogostaen/6112607/?sid=iKI3oo&page=8,15.0,2026-01-02 18:04:26.513915,https://www.imoti.net/bg/obiavi/r/prodava/sofia/?page=1&sid=iKI3oo,imoti.net,463,2026-01-02,,,Цена на /м2/:3 333EUR/6 519.43BGN, 117 м2,Етаж: 4 от 5
"продава Тристаен апартамент, 97 м2","Глобал Сержицес продава луксозен апартамент в кв. Иван Вазов, ул.Балша.Жилището е тухла, напълно обзаведено и ремонтирано с качествени материали и мебели. .Апартамента е с чиста площ...",390000.0,BGN,False,продава,тристаен,София, Иван Вазов,,Глобъл Сървисиз,,https://www.imoti.net/bg/obiava/prodava/sofia/ivan-vazov/tristaen/6143663/?sid=iKI3oo&page=8,17.0,2026-01-02 18:04:26.514367,https://www.imoti.net/bg/obiavi/r/prodava/sofia/?page=1&sid=iKI3oo,imoti.net,463,2026-01-02,,,Цена на /м2/:4 021EUR/7 863.65BGN, 97 м2,Етаж: 1 от 6
"продава Тристаен апартамент, 94 м2","Galiano Estates Ви представя тристаен апартамент застроена площ - 80.14 кв. м в близост до метростанция Витоша и Мол Парадайс. Апартаментът се състои от входно антре, всекидневна с кухня, две...",391000.0,BGN,False,продава,тристаен,София, Хладилника,,Galiano Estates,,https://www.imoti.net/bg/obiava/prodava/sofia/hladilnika/tristaen/6139863/?sid=iKI3oo&page=8,17.0,2026-01-02 18:04:26.514855,https://www.imoti.net/bg/obiavi/r/prodava/sofia/?page=1&sid=iKI3oo,imoti.net,463,2026-01-02,,,Цена на /м2/:4 160EUR/8 135.42BGN, 94 м2,Етаж: 3 от 6
"продава Тристаен апартамент, 111 м2","СВОБОДА, СТИЛ И ЛУКС!Тристаен апартамент с отлично разпределение – перфектен избор както за лично ползване, така и за инвестиция. С площ от 110.46 кв.м / 96.05 кв.м с изложение...",392000.0,BGN,False,продава,тристаен,София, Лозенец,,АДРЕС Недвижими имоти АД,,https://www.imoti.net/bg/obiava/prodava/sofia/lozenec/tristaen/6063971/?sid=iKI3oo&page=8,7.0,2026-01-02 18:04:26.515309,https://www.imoti.net/bg/obiavi/r/prodava/sofia/?page=1&sid=iKI3oo,imoti.net,463,2026-01-02,,,Цена на /м2/:3 532EUR/6 907.08BGN, 111 м2,Етаж: 4 от 6
"продава Тристаен апартамент, 111 м2","СВОБОДА, СТИЛ И ЛУКС!Тристаен апартамент с отлично разпределение – перфектен избор както за лично ползване, така и за инвестиция. С площ от 110.46 кв.м / 96.05 кв.м с изложение...",394000.0,BGN,False,продава,тристаен,София, Лозенец,,АДРЕС Недвижими имоти АД,,https://www.imoti.net/bg/obiava/prodava/sofia/lozenec/tristaen/6063960/?sid=iKI3oo&page=8,7.0,2026-01-02 18:04:26.515748,https://www.imoti.net/bg/obiavi/r/prodava/sofia/?page=1&sid=iKI3oo,imoti.net,463,2026-01-02,,,Цена на /м2/:3 550EUR/6 942.32BGN, 111 м2,Етаж: 5 от 6
"продава Тристаен апартамент, 108 м2","Galiano Estates ви представя просторен и светъл апартамент в кв. Стрелбище, напълно обзаведен и състоящ се от голяма дневна с трапезария и отделна кухня, две спални, мокро помещение и четири...",394000.0,BGN,False,продава,тристаен,София, Стрелбище,,Galiano Estates,,https://www.imoti.net/bg/obiava/prodava/sofia/strelbishte/tristaen/6139890/?sid=iKI3oo&page=8,10.0,2026-01-02 18:04:26.516252,https://www.imoti.net/bg/obiavi/r/prodava/sofia/?page=1&sid=iKI3oo,imoti.net,463,2026-01-02,,,Цена на /м2/:3 648EUR/7 135.16BGN, 108 м2,Етаж: 10 от 12
"продава Тристаен апартамент, 98 м2",Galiano Estates Ви представя комфортен тристаен апартамент в кв.Лозенец. Имотът се намира в реновирана триетажна масивна сграда с много добре поддържани общи части. Разпределение: всекидневна с...,395000.0,BGN,False,продава,тристаен,София, Лозенец,,Galiano Estates,,https://www.imoti.net/bg/obiava/prodava/sofia/lozenec/tristaen/6184879/?sid=iKI3oo&page=8,9.0,2026-01-02 18:04:26.516741,https://www.imoti.net/bg/obiavi/r/prodava/sofia/?page=1&sid=iKI3oo,imoti.net,463,2026-01-02,,,Цена на /м2/:4 031EUR/7 883.19BGN, 98 м2,Етаж: 3 от 3
"продава Тристаен апартамент, 128 м2","ЛОКАЦИЯ! ФУНКЦИОНАЛЕН и ПРАКТИЧЕН, ОБЗАВЕДЕН и ОБОРУДВАН, ТРИ/ЧЕТИРИСТАЕН АПАРТАМЕНТ тип МЕЗОНЕТ на етажи шест и седем в масивна тухлена сграда от 2004 год. на комуникативно място,...",395000.0,BGN,False,продава,тристаен,София, Лагера,,АЛДЕС ИМОТИ ЕООД,,https://www.imoti.net/bg/obiava/prodava/sofia/lagera/tristaen/5972401/?sid=iKI3oo&page=8,10.0,2026-01-02 18:04:26.517188,https://www.imoti.net/bg/obiavi/r/prodava/sofia/?page=1&sid=iKI3oo,imoti.net,463,2026-01-02,,,Цена на /м2/:3 086EUR/6 035.57BGN, 128 м2,Етаж: 6 от 7
"продава Тристаен апартамент, 142 м2","Вашият дом с история и бъдеще. Енергоефективност, независимост, иновативност и заслужен комфорт за всички собственици на комплекса. Тристаен апартамент състоящ се от: дневна с кухненски...",396504.0,BGN,False,продава,тристаен,София, Хладилника,,АДРЕС Недвижими имоти АД,,https://www.imoti.net/bg/obiava/prodava/sofia/hladilnika/tristaen/6035568/?sid=iKI3oo&page=8,11.0,2026-01-02 18:04:26.517627,https://www.imoti.net/bg/obiavi/r/prodava/sofia/?page=1&sid=iKI3oo,imoti.net,463,2026-01-02,,,Цена на /м2/:2 792EUR/5 461.23BGN, 142 м2,Етаж: 7 от 15
"продава Двустаен апартамент, 118 м2","Представяме Ви аристократичен напълно обзаведен двустаен апартамент за продажба, разположен на мансарден етаж в един от най-предпочитаните райони на София – кв. „Лозенец“. Имотът се намира на тиха...",397000.0,BGN,False,продава,двустаен,София, Лозенец,,Luximmo Finest Estates,,https://www.imoti.net/bg/obiava/prodava--v-stroej/sofia/lozenec/dvustaen/6134034/?sid=iKI3oo&page=8,13.0,2026-01-02 18:04:26.518126,https://www.imoti.net/bg/obiavi/r/prodava/sofia/?page=1&sid=iKI3oo,imoti.net,463,2026-01-02,,,Цена на /м2/:3 364EUR/6 580.21BGN, 118 м2,Етаж:  от 6
"продава Двустаен апартамент, 118 м2","Unique Estates има удоволствието да ви представи този изключителен артистичен двустаен апартамент, разположен в един от най-предпочитаните райони на София — кв. Лозенец....",397000.0,BGN,False,продава,двустаен,София, Лозенец,,ЮНИК ЕСТЕЙТС,,https://www.imoti.net/bg/obiava/prodava/sofia/lozenec/dvustaen/6149316/?sid=iKI3oo&page=8,6.0,2026-01-02 18:04:26.518566,https://www.imoti.net/bg/obiavi/r/prodava/sofia/?page=1&sid=iKI3oo,imoti.net,463,2026-01-02,,,Цена на /м2/:3 364EUR/6 580.21BGN, 118 м2,Етаж: 6 от 6
"продава Тристаен апартамент, 104 м2","Представяме комфортен тристаен апартамент за продажба, в новострояща се бутикова сграда в престижния кв. ""Лозенец"", един от най-предпочитаните райони в София.Планиран Акт 16 - 2027...",397138.0,BGN,False,продава,тристаен,София, Лозенец,,Luximmo Finest Estates,,https://www.imoti.net/bg/obiava/prodava--v-stroej/sofia/lozenec/tristaen/6068058/?sid=iKI3oo&page=8,3.0,2026-01-02 18:04:26.519071,https://www.imoti.net/bg/obiavi/r/prodava/sofia/?page=1&sid=iKI3oo,imoti.net,463,2026-01-02,,,Цена на /м2/:3 819EUR/7 468.60BGN, 104 м2,Етаж:  от 6
"продава Тристаен апартамент, 130 м2","ЕРА Голд Ви представя панорамен тристаен апартамент в луксозна резиденция с АКТ 16 до Южен парк, МОЛ Парадайс и метростанция Витоша.Апартаментът се състои от : входно антре, две...",397200.0,BGN,False,продава,тристаен,София, Хладилника,,ЕРА Голд,,https://www.imoti.net/bg/obiava/prodava--v-stroej/sofia/hladilnika/tristaen/5977322/?sid=iKI3oo&page=8,3.0,2026-01-02 18:04:26.519519,https://www.imoti.net/bg/obiavi/r/prodava/sofia/?page=1&sid=iKI3oo,imoti.net,463,2026-01-02,,,Цена на /м2/:3 055EUR/5 975.81BGN, 130 м2,Етаж:
"продава Тристаен апартамент, 84 м2","Светъл апартамент сред зеленина до Южен парк – престиж и потенциал на топ локацияПредставяме ви изключително предложение на метри от Южен парк – просторен, функционален...",398000.0,BGN,False,продава,тристаен,София, Стрелбище,,АДРЕС Недвижими имоти АД,,https://www.imoti.net/bg/obiava/prodava/sofia/strelbishte/tristaen/6182430/?sid=iKI3oo&page=8,6.0,2026-01-02 18:04:26.519960,https://www.imoti.net/bg/obiavi/r/prodava/sofia/?page=1&sid=iKI3oo,imoti.net,463,2026-01-02,,,Цена на /м2/:4 738EUR/9 266.91BGN, 84 м2,Етаж: 3 от 8
