raw_title,raw_description,price,currency,without_dds,offer_type,property_type,city,neighborhood,contact_info,agency,agency_url,details_url,num_photos,date_time_added,search_url,site,total_offers,ref_no,time,price_per_m2,area,floor,fingerprint_hash
"продаваДвустаен апартамент,62 м2",Референтен номер: 2098010Революшън Естейт представя Двустаен апартамент в ж.к. Сухата река.- Етаж: 10-ти от 14-ти.- Площ: 62 кв.м.- Разпределение:...,150000.0,EUR,False,продава,двустаен,София,Сухата река,,продава,,https://www.imoti.net/bg/obiava/prodava/sofia/suha-reka/dvustaen/6168855/?sid=gFM8jD&page=1,4.0,2026-01-25 20:39:49.947193,,imotinet,,,,Цена на /м2/:2 419EUR/4 731.85BGN,62 м2,Етаж: 10 от 14,eec7bd0692a93ea317c66216707968c2
"продаваДвустаен апартамент,65 м2",Продава се апартамент с потенциал за преустройство на тристаен в кв. „Редута“ – отличен избор за дом или инвестиция!Предлагаме на Вашето внимание светъл и функционален апартамент тип...,189000.0,EUR,False,продава,двустаен,София,Редута,,продава,,https://www.imoti.net/bg/obiava/prodava/sofia/reduta/dvustaen/6177224/?sid=gFM8jD&page=1,17.0,2026-01-25 20:39:49.947986,,imotinet,,,,Цена на /м2/:2 908EUR/5 686.95BGN,65 м2,Етаж: 7 от 9,48e8f271727422b1547f0a988c214aab
"продаваТристаен апартамент,89 м2","Нов панорамен тристаен мезонет до пл. Родина в сграда с Акт 16 от 2022 г. Намира се до ул. Черковна, на 200 м. от метростанция Подуяне. Завършен луксозно до ключ. Топ- локация в широк център само...",215000.0,EUR,False,продава,тристаен,София,Подуяне,,продава,,https://www.imoti.net/bg/obiava/prodava/sofia/poduene/tristaen/6125730/?sid=gFM8jD&page=1,36.0,2026-01-25 20:39:49.948752,,imotinet,,,,Цена на /м2/:2 416EUR/4 724.76BGN,89 м2,Етаж: 8 от 9,37d307dd2a1664d9d9caa4526ab1ec13
"продаваДвустаен апартамент,88 м2","Пред акт 16!Метро!Слънце и зеленина!Това не е просто жилище, а дом, подсигуряващ красив уют, окъпан в целодневна слънчева светлина, красива гкедка към синята...",244997.0,EUR,False,продава,двустаен,София,Сухата река,,продава,,https://www.imoti.net/bg/obiava/prodava--v-stroej/sofia/suha-reka/dvustaen/6203511/?sid=gFM8jD&page=1,9.0,2026-01-25 20:39:49.949548,,imotinet,,,,Цена на /м2/:2 784EUR/5 445.14BGN,88 м2,Етаж: 5 от 10,14e860267d58b0a36fa9ac2b86e8ce14
"продаваДвустаен апартамент,68 м2","Предлагаме за продажба двустаен апартамент в малка, бутикова сграда в кв.Сухата река.-Функционално разпределение - антре, просторна дневна с кухненски бокс, спалня, баня с тоалетна,...",115000.0,EUR,False,продава,двустаен,София,Сухата река,,продава,,https://www.imoti.net/bg/obiava/prodava/sofia/suha-reka/dvustaen/6185297/?sid=gFM8jD&page=1,4.0,2026-01-25 20:39:49.950332,,imotinet,,,,Цена на /м2/:1 691EUR/3 307.65BGN,68 м2,Етаж: 2 от 4,0f359fa5236623bee9dcf11406d91429
"продаваДвустаен апартамент,47 м2","Нов среден южен партерен имот със статут офис. Сграда с Акт 16 от 2024 г.ТЕЦ.Топ - локация в широк център, непосредствено до ул. Черковна. Сградата е на 200 метра от метростанция, 1040 м....",115000.0,EUR,False,продава,двустаен,София,Сухата река,,продава,,https://www.imoti.net/bg/obiava/prodava/sofia/suha-reka/dvustaen/6044312/?sid=gFM8jD&page=1,6.0,2026-01-25 20:39:49.951038,,imotinet,,,,Цена на /м2/:2 447EUR/4 785.54BGN,47 м2,Етаж: 1 от 9,749b598cc20e08fd52ed488baec3f5f9
"продаваДвустаен апартамент,47 м2","Нов среден южен партерен имот със статут офис. Сграда с Акт 16 от 2024 г.ТЕЦ.Топ - локация в широк център, непосредствено до ул. Черковна. Сградата е на 200 метра от метростанция, 1040 м....",115000.0,EUR,False,продава,двустаен,София,Подуяне,,продава,,https://www.imoti.net/bg/obiava/prodava/sofia/poduene/dvustaen/6044314/?sid=gFM8jD&page=1,16.0,2026-01-25 20:39:49.951737,,imotinet,,,,Цена на /м2/:2 447EUR/4 785.54BGN,47 м2,Етаж: 1 от 9,749b598cc20e08fd52ed488baec3f5f9
"продаваДвустаен апартамент,47 м2","Нов среден южен партерен имот със статут офис. Сграда с Акт 16 от 2024 г.ТЕЦ.Топ - локация в широк център, непосредствено до ул. Черковна. Сградата е на 200 метра от метростанция, 1040 м....",115000.0,EUR,False,продава,двустаен,София,Оборище,,продава,,https://www.imoti.net/bg/obiava/prodava/sofia/oborishte/dvustaen/6044316/?sid=gFM8jD&page=1,9.0,2026-01-25 20:39:49.952447,,imotinet,,,,Цена на /м2/:2 447EUR/4 785.54BGN,47 м2,Етаж: 1 от 9,749b598cc20e08fd52ed488baec3f5f9
"продаваДвустаен апартамент,42 м2",Реф. № 0127183D Виртуална разходка из апартамента -> https://my.matterport.com/show/?m=Q72j4CwkyidАгенция за недвижими имоти BAS Properties предлага за продажба двустаен...,120000.0,EUR,False,продава,двустаен,София,Сухата река,,продава,,https://www.imoti.net/bg/obiava/prodava/sofia/suha-reka/dvustaen/6195170/?sid=gFM8jD&page=1,8.0,2026-01-25 20:39:49.953168,,imotinet,,,,Цена на /м2/:2 857EUR/5 588.09BGN,42 м2,Етаж: 2 от 8,21d526423b7bf494cd52b511be869841
"продаваДвустаен апартамент,59 м2","Двустаен апартамент състоящ се от: антре, дневна с кухненски бокс, спралня, баня с тоалетна и тераса. Към жилището има прилежащо мазе.Има възможност за закупуване на паркомясто.",125550.0,EUR,False,продава,двустаен,София,Сухата река,,продава,,https://www.imoti.net/bg/obiava/prodava/sofia/suha-reka/dvustaen/6110135/?sid=gFM8jD&page=1,7.0,2026-01-25 20:39:49.953875,,imotinet,,,,Цена на /м2/:2 128EUR/4 161.94BGN,59 м2,Етаж: 2 от 5,0513d9ab2a80b55c2caeac2e483eeb6c
"продаваДвустаен апартамент,63 м2","Двустаен апартамент състоящ се от: антре, дневна с кухненски бокс, спралня, баня с тоалетна и тераса. Към жилището има прилежащо мазе.Има възможност за закупуване на паркомясто.",126600.0,EUR,False,продава,двустаен,София,Сухата река,,продава,,https://www.imoti.net/bg/obiava/prodava/sofia/suha-reka/dvustaen/6177556/?sid=gFM8jD&page=1,7.0,2026-01-25 20:39:49.954588,,imotinet,,,,Цена на /м2/:2 010EUR/3 930.29BGN,63 м2,Етаж: 2 от 5,46d5c304e566a6ec9a0b68f5beeae68c
"продаваЧетиристаен апартамент,86 м2","Имоти Премиер предлага на Вашето внимание имот със статут на апартамент в кв. Оборище.Намира се на полусутерен в тухлена сграда. Състои се от 4 помещения, два санитарни възела и има...",126800.0,EUR,False,продава,четиристаен,София,Оборище,,продава,,https://www.imoti.net/bg/obiava/prodava/sofia/oborishte/chetiristaen/5885595/?sid=gFM8jD&page=1,11.0,2026-01-25 20:39:49.955356,,imotinet,,,,Цена на /м2/:1 474EUR/2 883.71BGN,86 м2,Етаж: 0 от 5,35ec8c570f9d4f05d53bad1bdda1902f
"продаваДвустаен апартамент,40 м2","Слънчева гарсониера преустроена на двустаен, находяща се на етаж 8. Има следното разпределение: дневна с кухненски бокс, отделна спалня, баня с WC, тераса. Имотът е практичен и функционален,...",129000.0,EUR,False,продава,двустаен,София,Сухата река,,продава,,https://www.imoti.net/bg/obiava/prodava/sofia/suha-reka/dvustaen/6129514/?sid=gFM8jD&page=1,7.0,2026-01-25 20:39:49.956059,,imotinet,,,,Цена на /м2/:3 225EUR/6 307.55BGN,40 м2,Етаж: 8 от 8,321296dadfe82579f7b54f336d4a05ca
"продаваДвустаен апартамент,40 м2","СВОБОДНО МЯСТО ЗА ПАРКИРАНЕ ! МЕТРОСТАНЦИЯ ! ТЕРАСА ! ГРАДСКИ ТРАНСПОРТПредлагаме едностаен апартамент с площ от 40 кв.м, разположен на 5/8 етаж в поддържана панелна сграда в...",130000.0,EUR,False,продава,двустаен,София,Сухата река,,продава,,https://www.imoti.net/bg/obiava/prodava/sofia/suha-reka/dvustaen/6176538/?sid=gFM8jD&page=1,6.0,2026-01-25 20:39:49.956750,,imotinet,,,,Цена на /м2/:3 250EUR/6 356.45BGN,40 м2,Етаж: 5 от 8,a46c5e2a6ad353f6fbdb865d54cf4c2c
"продаваДвустаен апартамент,67 м2","Агенция за недвижими имоти Пандора естейт продава ексклузивно.Реф. № 110163.Двустаен апартамент в кв. Дианабад, разположен в престижен район с отлични транспортни връзки....",130000.0,EUR,False,продава,двустаен,София,Дианабад,,продава,,https://www.imoti.net/bg/obiava/prodava/sofia/dianabad/dvustaen/6014130/?sid=gFM8jD&page=1,5.0,2026-01-25 20:39:49.957457,,imotinet,,,,Цена на /м2/:1 940EUR/3 794.89BGN,67 м2,Етаж: 7 от 8,29ea9200b53f50900e49646954d2d9d2
"продаваДвустаен апартамент,28 м2","Компания `ЕКС` представя на Вашето внимание двустаен апартамент в жк. Изток.МЕСТОПОЛОЖЕНИЕ: На метри от метростанция, спирка на градски транспорт, магазини от всякакъв тип и всичко...",135000.0,EUR,False,продава,двустаен,София,Изток,,продава,,https://www.imoti.net/bg/obiava/prodava/sofia/sofija-iztok/dvustaen/6203275/?sid=gFM8jD&page=1,9.0,2026-01-25 20:39:49.958179,,imotinet,,,,Цена на /м2/:4 821EUR/9 429.89BGN,28 м2,Етаж: 1 от 5,a52f06ae036f2b10db7cdaeb34768a3e
"продаваДвустаен апартамент,40 м2","BG Broker предлага за продажба ремонтиран и преустроен двустаен апартамент (преустроена гарсониера) в кв. Сухата река, бл. 52, на бул. Ботевградско шосе, срещу 44 СУ „Неофит Бозвели“....",136000.0,EUR,False,продава,двустаен,София,Сухата река,,продава,,https://www.imoti.net/bg/obiava/prodava/sofia/suha-reka/dvustaen/6164405/?sid=gFM8jD&page=1,13.0,2026-01-25 20:39:49.958882,,imotinet,,,,Цена на /м2/:3 400EUR/6 649.82BGN,40 м2,Етаж: 8 от 8,d01a5dd75767a338b66b7b898344b247
"продаваДвустаен апартамент,63 м2","МЕТРО!ТИШИНА!ЕЛЕГАНТНОСТ!ПРЕДПРОДАЖБА!СКОРО ОТНОВО ЩЕ ВДИГНЕМ ЦЕНАТА, ПОБЪРЗАЙТЕ!ВЕЧЕ 70% ОТ ЖИЛИЩАТА СА ЗАКУПЕНИ!Уникален мини...",144900.0,EUR,False,продава,двустаен,София,Подуяне,,продава,,https://www.imoti.net/bg/obiava/prodava--v-stroej/sofia/poduene/dvustaen/5982550/?sid=gFM8jD&page=1,4.0,2026-01-25 20:39:49.959632,,imotinet,,,,Цена на /м2/:2 300EUR/4 498.41BGN,63 м2,Етаж: 4 от 6,029ebba4e3a2d82f8954d95659bbdf42
"продаваТристаен апартамент,90 м2","Агенция за недвижими имоти Пандора естейт продава ексклузивно.Реф. № 110185.Тристаен апартамент в кв. Дианабад.Цена: 155,000 евро.Площ: 90 кв.м.Етаж: 4 от...",155000.0,EUR,False,продава,тристаен,София,Дианабад,,продава,,https://www.imoti.net/bg/obiava/prodava/sofia/dianabad/tristaen/6019410/?sid=gFM8jD&page=1,5.0,2026-01-25 20:39:49.960360,,imotinet,,,,Цена на /м2/:1 722EUR/3 368.37BGN,90 м2,Етаж: 4 от 8,73bde60838f081dc3b466d4217be96dc
"продаваДвустаен апартамент,62 м2","Продаваме непреходен, двустаен апартамент.Жилището се намира на 6-ти етаж от 8, вътрешно е и изключително топло.Изложенията са Югозапад/Североизток, като от всички стаи има...",156000.0,EUR,False,продава,двустаен,София,Сухата река,,продава,,https://www.imoti.net/bg/obiava/prodava/sofia/suha-reka/dvustaen/6177287/?sid=gFM8jD&page=1,17.0,2026-01-25 20:39:49.961064,,imotinet,,,,Цена на /м2/:2 516EUR/4 921.12BGN,62 м2,Етаж: 6 от 8,a22e9152c86539e8820ea1dc87ded229
"продаваТристаен апартамент,62 м2","Продаваме непреходен, двустаен апартамент.Жилището се намира на 6-ти етаж от 8, вътрешно е и изключително топло.Изложенията са Югозапад/Североизток, като от всички стаи има...",156000.0,EUR,False,продава,тристаен,София,Сухата река,,продава,,https://www.imoti.net/bg/obiava/prodava/sofia/suha-reka/tristaen/6177290/?sid=gFM8jD&page=1,17.0,2026-01-25 20:39:49.961760,,imotinet,,,,Цена на /м2/:2 516EUR/4 921.12BGN,62 м2,Етаж: 6 от 8,552f58d5f0c02c2d802ab7327d51121a
"продаваДвустаен апартамент,28 м2","Открийте мястото, където ще се чувствате у дома от първия момент.Титан Пропъртис офис - Черни връх с радост предлага на Вашето внимание двустаен апартамент за продажба в ж.к. Изток....",159000.0,EUR,False,продава,двустаен,София,Изток,,продава,,https://www.imoti.net/bg/obiava/prodava/sofia/sofija-iztok/dvustaen/6199113/?sid=gFM8jD&page=1,8.0,2026-01-25 20:39:49.962470,,imotinet,,,,Цена на /м2/:5 679EUR/11 106.32BGN,28 м2,Етаж: 1 от 4,e6a2068025a6e210084deaae5d80e328
"продаваДвустаен апартамент,53 м2","Mirador Real Estates има удоволствието да ви представи компактен Двустаен Апартамент в кв. Сура река ул. Тодорини кукли.Жилището е светло, топло, обзаведено и готово за нанасяне....",160000.0,EUR,False,продава,двустаен,София,Сухата река,,продава,,https://www.imoti.net/bg/obiava/prodava/sofia/suha-reka/dvustaen/6152540/?sid=gFM8jD&page=1,6.0,2026-01-25 20:39:49.963174,,imotinet,,,,Цена на /м2/:3 019EUR/5 904.39BGN,53 м2,Етаж: 5 от 8,7444009b18960746cb9239c438009e5b
"продаваДвустаен апартамент,59 м2","ARCO REAL ESTATE предлага двустаен апартамент със застроена площ 51 кв.м., северозападно изложенив, в луксозна жилищна сграда на десет етажа в кв. Сухата река, на пет минути пешеходно разстояние от...",160000.0,EUR,False,продава,двустаен,София,Сухата река,,продава,,https://www.imoti.net/bg/obiava/prodava/sofia/suha-reka/dvustaen/6195584/?sid=gFM8jD&page=1,5.0,2026-01-25 20:39:49.963911,,imotinet,,,,Цена на /м2/:2 712EUR/5 303.95BGN,59 м2,Етаж: 8 от 11,a130884f41f8cf8ab1cc86b04bcb42fa
"продаваТристаен апартамент,67 м2","Предлагаме просторен тристаен апартамент с отлична локация – в непосредствена близост до парк „Герена“, пазар „Герена“, спирки на градски транспорт, училища, детска градина, супермаркет и...",163000.0,EUR,False,продава,тристаен,София,Сухата река,,продава,,https://www.imoti.net/bg/obiava/prodava/sofia/suha-reka/tristaen/6192490/?sid=gFM8jD&page=1,7.0,2026-01-25 20:39:49.964599,,imotinet,,,,Цена на /м2/:2 433EUR/4 758.21BGN,67 м2,Етаж: 4 от 8,bafebd94c9c11288d81e7fa12d2a9d7f
"продаваДвустаен апартамент,68 м2","Цена на инвеститор – 165 000 евро!!! БЕЗ КОМИСИОННА!!! Galiano Estates има удоволствието да ви представи слънчев двустаен апартамент в луксозна жилищна сграда, в кв. Подуяне, в близост до моста...",165000.0,EUR,False,продава,двустаен,София,Подуяне,,продава,,https://www.imoti.net/bg/obiava/prodava/sofia/poduene/dvustaen/6139726/?sid=gFM8jD&page=1,5.0,2026-01-25 20:39:49.965340,,imotinet,,,,Цена на /м2/:2 426EUR/4 745.76BGN,68 м2,Етаж: 6 от 9,d7d258e9f3ee89185a4db51ce0ba6c67
"продаваТристаен апартамент,110 м2","Титан Пропъртис - офис Хиподрума с радост предлага на Вашето внимание тристаен апартамент в продажба в кв. Редута, София. Обща площ 110 кв.м. и функционално разпределение в нова четириетажна...",165000.0,EUR,False,продава,тристаен,София,Редута,,продава,,https://www.imoti.net/bg/obiava/prodava/sofia/reduta/tristaen/6158513/?sid=gFM8jD&page=1,3.0,2026-01-25 20:39:49.966018,,imotinet,,,,Цена на /м2/:1 500EUR/2 933.75BGN,110 м2,Етаж: 1 от 4,2e5c903f75a5a4a92e31ab74d73ca192
"продаваТристаен апартамент,110 м2","Имоти Премиер представя уютен тристаен апартамент с отлична локация в кв. Редута, гр. София.С удоволствие ви запознаваме с този прекрасен имот, разположен в един от най-търсените и...",165000.0,EUR,False,продава,тристаен,София,Редута,,продава,,https://www.imoti.net/bg/obiava/prodava/sofia/reduta/tristaen/6076138/?sid=gFM8jD&page=1,8.0,2026-01-25 20:39:49.966766,,imotinet,,,,Цена на /м2/:1 500EUR/2 933.75BGN,110 м2,Етаж: 0 от 5,2e5c903f75a5a4a92e31ab74d73ca192
"продаваДвустаен апартамент,68 м2","Просторен двустаен апартамент, състои се от: коридор, хол, кухня,  спалня, два балкона, баня с тоалетна. Площ от 68 кв.м. с възможност да се преустрой в съвременен тристаен...",167000.0,EUR,False,продава,двустаен,София,Сухата река,,продава,,https://www.imoti.net/bg/obiava/prodava/sofia/suha-reka/dvustaen/6170735/?sid=gFM8jD&page=1,12.0,2026-01-25 20:39:49.967455,,imotinet,,,,Цена на /м2/:2 456EUR/4 803.29BGN,68 м2,Етаж: 8 от 8,13a7dd321ad3e8e61ef12b7b31fe8f8d
"продаваДвустаен апартамент,61 м2","Слънчев и топъл апартамент в четириетажна тухлена сграда.Районът е чист и спокоен, с прекрасни, добре поддържани тревни площи и безпроблемно паркиране.",169000.0,EUR,False,продава,двустаен,София,Сухата река,,продава,,https://www.imoti.net/bg/obiava/prodava/sofia/suha-reka/dvustaen/6056399/?sid=gFM8jD&page=1,13.0,2026-01-25 20:39:49.968183,,imotinet,,,,Цена на /м2/:2 770EUR/5 418.61BGN,61 м2,Етаж: 2 от 4,ee88ae913694fb2171965939a0226977
"продаваДвустаен апартамент,58 м2",Агенция за недвижими имоти 'Имотен център България' предлага за продажба двустаен апартамент в кв. 'Сухата река'.Сградата е санирана и се намира на бул. 'Ботевградско шосе' в близост до...,170000.0,EUR,False,продава,двустаен,София,Сухата река,,продава,,https://www.imoti.net/bg/obiava/prodava/sofia/suha-reka/dvustaen/6174730/?sid=gFM8jD&page=2,12.0,2026-01-25 20:39:53.907199,,imotinet,,,,Цена на /м2/:2 931EUR/5 732.61BGN,58 м2,Етаж: 1 от 8,88748da83403810eaec8f586d7990bc0
"продаваДвустаен апартамент,60 м2","Предлагаме за продажба просторен и светъл двустаен апартамент, разположен в един от най-предпочитаните и комуникативни райони на София – ж.к. „Сухата река“. Жилището се отличава с функционално...",170000.0,EUR,False,продава,двустаен,София,Сухата река,,продава,,https://www.imoti.net/bg/obiava/prodava--v-stroej/sofia/suha-reka/dvustaen/6172856/?sid=gFM8jD&page=2,10.0,2026-01-25 20:39:53.907917,,imotinet,,,,Цена на /м2/:2 833EUR/5 541.52BGN,60 м2,Етаж:  от 7,af986fc9f286e8dffe859e063c6f5bac
"продаваДвустаен апартамент,58 м2",Агенция за недвижими имоти 'Имотен център България' предлага за продажба двустаен апартамент в кв. 'Сухата река'.Сградата е санирана и се намира на бул. 'Ботевградско шосе' в близост до...,170000.0,EUR,False,продава,двустаен,София,Подуяне,,продава,,https://www.imoti.net/bg/obiava/prodava/sofia/poduene/dvustaen/6175196/?sid=gFM8jD&page=2,12.0,2026-01-25 20:39:53.908683,,imotinet,,,,Цена на /м2/:2 931EUR/5 732.61BGN,58 м2,Етаж: 1 от 8,88748da83403810eaec8f586d7990bc0
"продаваДвустаен апартамент,58 м2","Продаваме слънчев, двустаен апартамент.Жилището е с южно изложение, което е допълнение с голямото отстояние от близките сгради го прави изключително светло и топло.Сградата е с...",171000.0,EUR,False,продава,двустаен,София,Сухата река,,продава,,https://www.imoti.net/bg/obiava/prodava/sofia/suha-reka/dvustaen/6191798/?sid=gFM8jD&page=2,15.0,2026-01-25 20:39:53.909402,,imotinet,,,,Цена на /м2/:2 948EUR/5 766.33BGN,58 м2,Етаж: 2 от 8,d1dd12723331fe6b703486ac5c373a7a
"продаваДвустаен апартамент,60 м2",.  .  .  .  .  .  .  .  .  .  .  .  .  .  .  .  .  .  .  .  .  .  .  .  .  .  .  .  .  .  ПРОДАВАМЕ  .  .  .  .  .  .  .  .  .  .  .  .  .  .  .  .  .  .  .  .  .  .  .  .  .  .  .  .  .  ....,173000.0,EUR,False,продава,двустаен,София,Подуяне,,продава,,https://www.imoti.net/bg/obiava/prodava/sofia/poduene/dvustaen/6098100/?sid=gFM8jD&page=2,1.0,2026-01-25 20:39:53.910131,,imotinet,,,,Цена на /м2/:2 883EUR/5 639.31BGN,60 м2,Етаж: 2 от 6,a44eaf3e04540b25af6a6fab75374050
"продаваДвустаен апартамент,62 м2","Обзаведен апартамент в нова сграда от 2007 г. На бул. „Ботевградско шосе“.Разпределението включва, входно антре с портманто.Дневна, трапезария и кухненска част с...",173000.0,EUR,False,продава,двустаен,София,Сухата река,,продава,,https://www.imoti.net/bg/obiava/prodava/sofia/suha-reka/dvustaen/6096843/?sid=gFM8jD&page=2,,2026-01-25 20:39:53.910814,,imotinet,,,,Цена на /м2/:2 790EUR/5 457.40BGN,62 м2,Етаж: 2 от 6,01a7a94f03da47293218fcef480fe8de
