price_text,title,location,description,details_url,num_photos,agency,floor,price_per_m2,area,search_url,scraped_at
150 000€293 375BGN,"продаваДвустаен апартамент,62 м2","София, Суха Река",Референтен номер: 2098010Революшън Естейт представя Двустаен апартамент в ж.к. Сухата река.- Етаж: 10-ти от 14-ти.- Площ: 62 кв.м.- Разпределение:...,/bg/obiava/prodava/sofia/suha-reka/dvustaen/6168855/?sid=gFM8jD&page=1,4,продава,Етаж: 10 от 14,Цена на /м2/:2 419EUR/4 731.85BGN,62 м2,https://www.imoti.net/bg/obiavi/r/prodava/sofia/?page=1&sid=gFM8jD,2026-01-30T06:11:28.259557
189 000€369 652BGN,"продаваДвустаен апартамент,65 м2","София, Редута",Продава се апартамент с потенциал за преустройство на тристаен в кв. „Редута“ – отличен избор за дом или инвестиция!Предлагаме на Вашето внимание светъл и функционален апартамент тип...,/bg/obiava/prodava/sofia/reduta/dvustaen/6177224/?sid=gFM8jD&page=1,17,продава,Етаж: 7 от 9,Цена на /м2/:2 908EUR/5 686.95BGN,65 м2,https://www.imoti.net/bg/obiavi/r/prodava/sofia/?page=1&sid=gFM8jD,2026-01-30T06:11:28.260396
212 600€415 809BGN,"продаваДвустаен апартамент,80 м2","София, Дианабад","Ексклузивно представяме за продажба двустаен апартамент №4.32 в сграда S-Tower - нов проект с отличителен дизайн, висок клас на изпълнение, комуникативна локация и отлична възможност за инвестиция....",/bg/obiava/prodava--v-stroej/sofia/dianabad/dvustaen/6018722/?sid=gFM8jD&page=1,12,продава,Етаж:  от 15,Цена на /м2/:2 658EUR/5 197.62BGN,80 м2,https://www.imoti.net/bg/obiavi/r/prodava/sofia/?page=1&sid=gFM8jD,2026-01-30T06:11:28.261219
244 997€479 172BGN,"продаваДвустаен апартамент,74 м2","София, Суха Река","Пред акт 16!Метро!Слънце и зеленина!Това не е просто жилище, а дом, подсигуряващ красив уют, окъпан в целодневна слънчева светлина, красива гкедка към синята...",/bg/obiava/prodava--v-stroej/sofia/suha-reka/dvustaen/6203511/?sid=gFM8jD&page=1,9,продава,Етаж: 5 от 10,Цена на /м2/:3 311EUR/6 475.30BGN,74 м2,https://www.imoti.net/bg/obiavi/r/prodava/sofia/?page=1&sid=gFM8jD,2026-01-30T06:11:28.261997
370 655€724 938BGN,"продаваТристаен апартамент,130 м2","София, Дианабад","Ексклузивно представяме за продажба тристаен апартамент в сграда S-Tower - нов проект с отличителен дизайн, висок клас на изпълнение, комуникативна локация и отлична възможност за инвестиция....",/bg/obiava/prodava--v-stroej/sofia/dianabad/tristaen/5805229/?sid=gFM8jD&page=1,12,продава,Етаж:  от 15,Цена на /м2/:2 851EUR/5 576.45BGN,130 м2,https://www.imoti.net/bg/obiavi/r/prodava/sofia/?page=1&sid=gFM8jD,2026-01-30T06:11:28.262807
110 440€216 002BGN,"продаваДвустаен апартамент,58 м2","София, Суха Река","Двустайно жилище състоящо се от: антре, дневна с кухненски бокс, спралня, баня с тоалетна и тераса.Има възможност за закупуване на паркомясто.",/bg/obiava/prodava/sofia/suha-reka/dvustaen/6181839/?sid=gFM8jD&page=1,7,продава,Етаж: 4 от 5,Цена на /м2/:1 904EUR/3 724.17BGN,58 м2,https://www.imoti.net/bg/obiavi/r/prodava/sofia/?page=1&sid=gFM8jD,2026-01-30T06:11:28.263532
115 000€224 920BGN,"продаваДвустаен апартамент,68 м2","София, Суха Река","Предлагаме за продажба двустаен апартамент в малка, бутикова сграда в кв.Сухата река.-Функционално разпределение - антре, просторна дневна с кухненски бокс, спалня, баня с тоалетна,...",/bg/obiava/prodava/sofia/suha-reka/dvustaen/6185297/?sid=gFM8jD&page=1,4,продава,Етаж: 2 от 4,Цена на /м2/:1 691EUR/3 307.65BGN,68 м2,https://www.imoti.net/bg/obiavi/r/prodava/sofia/?page=1&sid=gFM8jD,2026-01-30T06:11:28.264306
115 000€224 920BGN,"продаваДвустаен апартамент,47 м2","София, Суха Река","Нов среден южен партерен имот със статут офис. Сграда с Акт 16 от 2024 г.ТЕЦ.Топ - локация в широк център, непосредствено до ул. Черковна. Сградата е на 200 метра от метростанция, 1040 м....",/bg/obiava/prodava/sofia/suha-reka/dvustaen/6044312/?sid=gFM8jD&page=1,6,продава,Етаж: 1 от 9,Цена на /м2/:2 447EUR/4 785.54BGN,47 м2,https://www.imoti.net/bg/obiavi/r/prodava/sofia/?page=1&sid=gFM8jD,2026-01-30T06:11:28.265009
115 000€224 920BGN,"продаваДвустаен апартамент,47 м2","София, Подуене","Нов среден южен партерен имот със статут офис. Сграда с Акт 16 от 2024 г.ТЕЦ.Топ - локация в широк център, непосредствено до ул. Черковна. Сградата е на 200 метра от метростанция, 1040 м....",/bg/obiava/prodava/sofia/poduene/dvustaen/6044314/?sid=gFM8jD&page=1,16,продава,Етаж: 1 от 9,Цена на /м2/:2 447EUR/4 785.54BGN,47 м2,https://www.imoti.net/bg/obiavi/r/prodava/sofia/?page=1&sid=gFM8jD,2026-01-30T06:11:28.265719
115 000€224 920BGN,"продаваДвустаен апартамент,47 м2","София, Оборище","Нов среден южен партерен имот със статут офис. Сграда с Акт 16 от 2024 г.ТЕЦ.Топ - локация в широк център, непосредствено до ул. Черковна. Сградата е на 200 метра от метростанция, 1040 м....",/bg/obiava/prodava/sofia/oborishte/dvustaen/6044316/?sid=gFM8jD&page=1,9,продава,Етаж: 1 от 9,Цена на /м2/:2 447EUR/4 785.54BGN,47 м2,https://www.imoti.net/bg/obiavi/r/prodava/sofia/?page=1&sid=gFM8jD,2026-01-30T06:11:28.266431
117 100€229 028BGN,"продаваДвустаен апартамент,62 м2","София, Суха Река","Двустайно жилище състоящо се от: антре, дневна с кухненски бокс, баня с тоалетна и тераса.Има възможност за закупуване на паркомясто.",/bg/obiava/prodava/sofia/suha-reka/dvustaen/6181838/?sid=gFM8jD&page=1,6,продава,Етаж: 4 от 5,Цена на /м2/:1 889EUR/3 694.00BGN,62 м2,https://www.imoti.net/bg/obiavi/r/prodava/sofia/?page=1&sid=gFM8jD,2026-01-30T06:11:28.267152
120 000€234 700BGN,"продаваДвустаен апартамент,42 м2","София, Суха Река",Реф. № 0127183D Виртуална разходка из апартамента -> https://my.matterport.com/show/?m=Q72j4CwkyidАгенция за недвижими имоти BAS Properties предлага за продажба двустаен...,/bg/obiava/prodava/sofia/suha-reka/dvustaen/6195170/?sid=gFM8jD&page=1,8,продава,Етаж: 2 от 8,Цена на /м2/:2 857EUR/5 588.09BGN,42 м2,https://www.imoti.net/bg/obiavi/r/prodava/sofia/?page=1&sid=gFM8jD,2026-01-30T06:11:28.267867
125 550€245 554BGN,"продаваДвустаен апартамент,59 м2","София, Суха Река","Двустаен апартамент състоящ се от: антре, дневна с кухненски бокс, спралня, баня с тоалетна и тераса. Към жилището има прилежащо мазе.Има възможност за закупуване на паркомясто.",/bg/obiava/prodava/sofia/suha-reka/dvustaen/6110135/?sid=gFM8jD&page=1,7,продава,Етаж: 2 от 5,Цена на /м2/:2 128EUR/4 161.94BGN,59 м2,https://www.imoti.net/bg/obiavi/r/prodava/sofia/?page=1&sid=gFM8jD,2026-01-30T06:11:28.268598
126 600€247 608BGN,"продаваДвустаен апартамент,63 м2","София, Суха Река","Двустаен апартамент състоящ се от: антре, дневна с кухненски бокс, спралня, баня с тоалетна и тераса. Към жилището има прилежащо мазе.Има възможност за закупуване на паркомясто.",/bg/obiava/prodava/sofia/suha-reka/dvustaen/6177556/?sid=gFM8jD&page=1,7,продава,Етаж: 2 от 5,Цена на /м2/:2 010EUR/3 930.29BGN,63 м2,https://www.imoti.net/bg/obiavi/r/prodava/sofia/?page=1&sid=gFM8jD,2026-01-30T06:11:28.269319
126 800€247 999BGN,"продаваЧетиристаен апартамент,86 м2","София, Оборище","Имоти Премиер предлага на Вашето внимание имот със статут на апартамент в кв. Оборище.Намира се на полусутерен в тухлена сграда. Състои се от 4 помещения, два санитарни възела и има...",/bg/obiava/prodava/sofia/oborishte/chetiristaen/5885595/?sid=gFM8jD&page=1,11,продава,Етаж: 0 от 5,Цена на /м2/:1 474EUR/2 883.71BGN,86 м2,https://www.imoti.net/bg/obiavi/r/prodava/sofia/?page=1&sid=gFM8jD,2026-01-30T06:11:28.270088
129 000€252 302BGN,"продаваДвустаен апартамент,40 м2","София, Суха Река","Слънчева гарсониера преустроена на двустаен, находяща се на етаж 8. Има следното разпределение: дневна с кухненски бокс, отделна спалня, баня с WC, тераса. Имотът е практичен и функционален,...",/bg/obiava/prodava/sofia/suha-reka/dvustaen/6129514/?sid=gFM8jD&page=1,7,продава,Етаж: 8 от 8,Цена на /м2/:3 225EUR/6 307.55BGN,40 м2,https://www.imoti.net/bg/obiavi/r/prodava/sofia/?page=1&sid=gFM8jD,2026-01-30T06:11:28.270770
130 000€254 258BGN,"продаваДвустаен апартамент,40 м2","София, Суха Река","СВОБОДНО МЯСТО ЗА ПАРКИРАНЕ ! МЕТРОСТАНЦИЯ ! ТЕРАСА ! ГРАДСКИ ТРАНСПОРТПредлагаме едностаен апартамент с площ от 40 кв.м, разположен на 5/8 етаж в поддържана панелна сграда в...",/bg/obiava/prodava/sofia/suha-reka/dvustaen/6176538/?sid=gFM8jD&page=1,6,продава,Етаж: 5 от 8,Цена на /м2/:3 250EUR/6 356.45BGN,40 м2,https://www.imoti.net/bg/obiavi/r/prodava/sofia/?page=1&sid=gFM8jD,2026-01-30T06:11:28.271487
130 000€254 258BGN,"продаваДвустаен апартамент,67 м2","София, Дианабад","Агенция за недвижими имоти Пандора естейт продава ексклузивно.Реф. № 110163.Двустаен апартамент в кв. Дианабад, разположен в престижен район с отлични транспортни връзки....",/bg/obiava/prodava/sofia/dianabad/dvustaen/6014130/?sid=gFM8jD&page=1,5,продава,Етаж: 7 от 8,Цена на /м2/:1 940EUR/3 794.89BGN,67 м2,https://www.imoti.net/bg/obiavi/r/prodava/sofia/?page=1&sid=gFM8jD,2026-01-30T06:11:28.272219
130 085€254 424BGN,"продаваДвустаен апартамент,47 м2","София, Подуене","Недвижими имоти сердика 1  представя на Вашето внимание Компактен 2-стаен апартамент в бутикова сграда – кв. Хаджи Димитър, в новострояща се бутикова сграда с едва 18 жилища. Търсите перфектното...",/bg/obiava/prodava/sofia/poduene/dvustaen/6205297/?sid=gFM8jD&page=1,9,продава,Етаж: 4 от 6,Цена на /м2/:2 768EUR/5 413.28BGN,47 м2,https://www.imoti.net/bg/obiavi/r/prodava/sofia/?page=1&sid=gFM8jD,2026-01-30T06:11:28.272905
135 000€264 037BGN,"продаваДвустаен апартамент,28 м2","София, Изток","Компания `ЕКС` представя на Вашето внимание двустаен апартамент в жк. Изток.МЕСТОПОЛОЖЕНИЕ: На метри от метростанция, спирка на градски транспорт, магазини от всякакъв тип и всичко...",/bg/obiava/prodava/sofia/sofija-iztok/dvustaen/6203275/?sid=gFM8jD&page=1,9,продава,Етаж: 1 от 5,Цена на /м2/:4 821EUR/9 429.89BGN,28 м2,https://www.imoti.net/bg/obiavi/r/prodava/sofia/?page=1&sid=gFM8jD,2026-01-30T06:11:28.273614
136 000€265 993BGN,"продаваДвустаен апартамент,40 м2","София, Суха Река","BG Broker предлага за продажба ремонтиран и преустроен двустаен апартамент (преустроена гарсониера) в кв. Сухата река, бл. 52, на бул. Ботевградско шосе, срещу 44 СУ „Неофит Бозвели“....",/bg/obiava/prodava/sofia/suha-reka/dvustaen/6164405/?sid=gFM8jD&page=1,13,продава,Етаж: 8 от 8,Цена на /м2/:3 400EUR/6 649.82BGN,40 м2,https://www.imoti.net/bg/obiavi/r/prodava/sofia/?page=1&sid=gFM8jD,2026-01-30T06:11:28.274323
144 900€283 400BGN,"продаваДвустаен апартамент,63 м2","София, Подуене","МЕТРО!ТИШИНА!ЕЛЕГАНТНОСТ!ПРЕДПРОДАЖБА!СКОРО ОТНОВО ЩЕ ВДИГНЕМ ЦЕНАТА, ПОБЪРЗАЙТЕ!ВЕЧЕ 70% ОТ ЖИЛИЩАТА СА ЗАКУПЕНИ!Уникален мини...",/bg/obiava/prodava--v-stroej/sofia/poduene/dvustaen/5982550/?sid=gFM8jD&page=1,4,продава,Етаж: 4 от 6,Цена на /м2/:2 300EUR/4 498.41BGN,63 м2,https://www.imoti.net/bg/obiavi/r/prodava/sofia/?page=1&sid=gFM8jD,2026-01-30T06:11:28.275076
155 000€303 154BGN,"продаваТристаен апартамент,90 м2","София, Дианабад","Агенция за недвижими имоти Пандора естейт продава ексклузивно.Реф. № 110185.Тристаен апартамент в кв. Дианабад.Цена: 155,000 евро.Площ: 90 кв.м.Етаж: 4 от...",/bg/obiava/prodava/sofia/dianabad/tristaen/6019410/?sid=gFM8jD&page=1,5,продава,Етаж: 4 от 8,Цена на /м2/:1 722EUR/3 368.37BGN,90 м2,https://www.imoti.net/bg/obiavi/r/prodava/sofia/?page=1&sid=gFM8jD,2026-01-30T06:11:28.275791
156 000€305 109BGN,"продаваДвустаен апартамент,62 м2","София, Суха Река","Продаваме непреходен, двустаен апартамент.Жилището се намира на 6-ти етаж от 8, вътрешно е и изключително топло.Изложенията са Югозапад/Североизток, като от всички стаи има...",/bg/obiava/prodava/sofia/suha-reka/dvustaen/6177287/?sid=gFM8jD&page=1,17,продава,Етаж: 6 от 8,Цена на /м2/:2 516EUR/4 921.12BGN,62 м2,https://www.imoti.net/bg/obiavi/r/prodava/sofia/?page=1&sid=gFM8jD,2026-01-30T06:11:28.276500
156 000€305 109BGN,"продаваТристаен апартамент,62 м2","София, Суха Река","Продаваме непреходен, двустаен апартамент.Жилището се намира на 6-ти етаж от 8, вътрешно е и изключително топло.Изложенията са Югозапад/Североизток, като от всички стаи има...",/bg/obiava/prodava/sofia/suha-reka/tristaen/6177290/?sid=gFM8jD&page=1,17,продава,Етаж: 6 от 8,Цена на /м2/:2 516EUR/4 921.12BGN,62 м2,https://www.imoti.net/bg/obiavi/r/prodava/sofia/?page=1&sid=gFM8jD,2026-01-30T06:11:28.277233
159 000€310 977BGN,"продаваДвустаен апартамент,28 м2","София, Изток","Открийте мястото, където ще се чувствате у дома от първия момент.Титан Пропъртис офис - Черни връх с радост предлага на Вашето внимание двустаен апартамент за продажба в ж.к. Изток....",/bg/obiava/prodava/sofia/sofija-iztok/dvustaen/6199113/?sid=gFM8jD&page=1,8,продава,Етаж: 1 от 4,Цена на /м2/:5 679EUR/11 106.32BGN,28 м2,https://www.imoti.net/bg/obiavi/r/prodava/sofia/?page=1&sid=gFM8jD,2026-01-30T06:11:28.277930
160 000€312 933BGN,"продаваДвустаен апартамент,53 м2","София, Суха Река","Mirador Real Estates има удоволствието да ви представи компактен Двустаен Апартамент в кв. Сура река ул. Тодорини кукли.Жилището е светло, топло, обзаведено и готово за нанасяне....",/bg/obiava/prodava/sofia/suha-reka/dvustaen/6152540/?sid=gFM8jD&page=1,6,продава,Етаж: 5 от 8,Цена на /м2/:3 019EUR/5 904.39BGN,53 м2,https://www.imoti.net/bg/obiavi/r/prodava/sofia/?page=1&sid=gFM8jD,2026-01-30T06:11:28.278643
160 000€312 933BGN,"продаваДвустаен апартамент,59 м2","София, Суха Река","ARCO REAL ESTATE предлага двустаен апартамент със застроена площ 51 кв.м., северозападно изложенив, в луксозна жилищна сграда на десет етажа в кв. Сухата река, на пет минути пешеходно разстояние от...",/bg/obiava/prodava/sofia/suha-reka/dvustaen/6195584/?sid=gFM8jD&page=1,5,продава,Етаж: 8 от 11,Цена на /м2/:2 712EUR/5 303.95BGN,59 м2,https://www.imoti.net/bg/obiavi/r/prodava/sofia/?page=1&sid=gFM8jD,2026-01-30T06:11:28.279396
163 000€318 800BGN,"продаваТристаен апартамент,67 м2","София, Суха Река","Предлагаме просторен тристаен апартамент с отлична локация – в непосредствена близост до парк „Герена“, пазар „Герена“, спирки на градски транспорт, училища, детска градина, супермаркет и...",/bg/obiava/prodava/sofia/suha-reka/tristaen/6192490/?sid=gFM8jD&page=1,7,продава,Етаж: 4 от 8,Цена на /м2/:2 433EUR/4 758.21BGN,67 м2,https://www.imoti.net/bg/obiavi/r/prodava/sofia/?page=1&sid=gFM8jD,2026-01-30T06:11:28.280090
165 000€322 712BGN,"продаваДвустаен апартамент,68 м2","София, Подуене","Цена на инвеститор – 165 000 евро!!! БЕЗ КОМИСИОННА!!! Galiano Estates има удоволствието да ви представи слънчев двустаен апартамент в луксозна жилищна сграда, в кв. Подуяне, в близост до моста...",/bg/obiava/prodava/sofia/poduene/dvustaen/6139726/?sid=gFM8jD&page=1,5,продава,Етаж: 6 от 9,Цена на /м2/:2 426EUR/4 745.76BGN,68 м2,https://www.imoti.net/bg/obiavi/r/prodava/sofia/?page=1&sid=gFM8jD,2026-01-30T06:11:28.280820
165 000€322 712BGN,"продаваТристаен апартамент,110 м2","София, Редута","Имоти Премиер представя уютен тристаен апартамент с отлична локация в кв. Редута, гр. София.С удоволствие ви запознаваме с този прекрасен имот, разположен в един от най-търсените и...",/bg/obiava/prodava/sofia/reduta/tristaen/6076138/?sid=gFM8jD&page=2,8,продава,Етаж: 0 от 5,Цена на /м2/:1 500EUR/2 933.75BGN,110 м2,https://www.imoti.net/bg/obiavi/r/prodava/sofia/?page=1&sid=gFM8jD,2026-01-30T06:11:32.465326
167 000€326 624BGN,"продаваДвустаен апартамент,68 м2","София, Суха Река","Просторен двустаен апартамент, състои се от: коридор, хол, кухня,  спалня, два балкона, баня с тоалетна. Площ от 68 кв.м. с възможност да се преустрой в съвременен тристаен...",/bg/obiava/prodava/sofia/suha-reka/dvustaen/6170735/?sid=gFM8jD&page=2,12,продава,Етаж: 8 от 8,Цена на /м2/:2 456EUR/4 803.29BGN,68 м2,https://www.imoti.net/bg/obiavi/r/prodava/sofia/?page=1&sid=gFM8jD,2026-01-30T06:11:32.466049
169 000€330 535BGN,"продаваДвустаен апартамент,61 м2","София, Суха Река","Слънчев и топъл апартамент в четириетажна тухлена сграда.Районът е чист и спокоен, с прекрасни, добре поддържани тревни площи и безпроблемно паркиране.",/bg/obiava/prodava/sofia/suha-reka/dvustaen/6056399/?sid=gFM8jD&page=2,13,продава,Етаж: 2 от 4,Цена на /м2/:2 770EUR/5 418.61BGN,61 м2,https://www.imoti.net/bg/obiavi/r/prodava/sofia/?page=1&sid=gFM8jD,2026-01-30T06:11:32.466785
170 000€332 491BGN,"продаваДвустаен апартамент,58 м2","София, Суха Река",Агенция за недвижими имоти 'Имотен център България' предлага за продажба двустаен апартамент в кв. 'Сухата река'.Сградата е санирана и се намира на бул. 'Ботевградско шосе' в близост до...,/bg/obiava/prodava/sofia/suha-reka/dvustaen/6174730/?sid=gFM8jD&page=2,12,продава,Етаж: 1 от 8,Цена на /м2/:2 931EUR/5 732.61BGN,58 м2,https://www.imoti.net/bg/obiavi/r/prodava/sofia/?page=1&sid=gFM8jD,2026-01-30T06:11:32.467572
170 000€332 491BGN,"продаваДвустаен апартамент,60 м2","София, Суха Река","Предлагаме за продажба просторен и светъл двустаен апартамент, разположен в един от най-предпочитаните и комуникативни райони на София – ж.к. „Сухата река“. Жилището се отличава с функционално...",/bg/obiava/prodava--v-stroej/sofia/suha-reka/dvustaen/6172856/?sid=gFM8jD&page=2,10,продава,Етаж:  от 7,Цена на /м2/:2 833EUR/5 541.52BGN,60 м2,https://www.imoti.net/bg/obiavi/r/prodava/sofia/?page=1&sid=gFM8jD,2026-01-30T06:11:32.468283
170 000€332 491BGN,"продаваДвустаен апартамент,60 м2","София, Суха Река","iHOME real estate продава 2-стаен апартамент в кв. Сухата река, в близост до Ботевградско шосе, Районът е спокоен и добре устроен, като в близост има училище, детска градина, мгазини и спирки на...",/bg/obiava/prodava/sofia/suha-reka/dvustaen/6191821/?sid=gFM8jD&page=2,1,продава,Етаж: 2,Цена на /м2/:2 833EUR/5 541.52BGN,60 м2,https://www.imoti.net/bg/obiavi/r/prodava/sofia/?page=1&sid=gFM8jD,2026-01-30T06:11:32.469025
170 000€332 491BGN,"продаваДвустаен апартамент,58 м2","София, Подуене",Агенция за недвижими имоти 'Имотен център България' предлага за продажба двустаен апартамент в кв. 'Сухата река'.Сградата е санирана и се намира на бул. 'Ботевградско шосе' в близост до...,/bg/obiava/prodava/sofia/poduene/dvustaen/6175196/?sid=gFM8jD&page=2,12,продава,Етаж: 1 от 8,Цена на /м2/:2 931EUR/5 732.61BGN,58 м2,https://www.imoti.net/bg/obiavi/r/prodava/sofia/?page=1&sid=gFM8jD,2026-01-30T06:11:32.469842
