raw_title,raw_description,price,currency,without_dds,offer_type,property_type,city,neighborhood,contact_info,agency,agency_url,details_url,num_photos,date_time_added,search_url,site,total_offers,ref_no,time,price_per_m2,area,floor,fingerprint_hash
Продава ЗЕМЕДЕЛСКА ЗЕМЯ,"Нива, кат. 2, с Аренден договор до 12.12.2025 г. и рента 200 лв./год., 11340 дка, С.Царичино, Продавам парцел 11310кв.м в местност З-ЩЕ с.Царичино. общ Балчик. Парцел с лице 90м на асфалтов път  ..., тел.: 0879559838",,,False,продава,земя,Царичино,Област Добрич,0879559838,,https://diamondhome.imot.bg,https://www.imot.bg/pcgi/imot.cgi?act=5&adv=1s174213256898547&slink=bt2aub&f1=1,,,,imotbg,618,,,,,,cb04a3e5b9e1ebb1a26065da1b866754
Продава ЗЕМЕДЕЛСКА ЗЕМЯ,"Нива, кат. 2, с Аренден договор до 12.12.2025 г. и рента 200 лв./год., 11340 дка, С.Царичино, Продавам парцел 11310кв.м в местност З-ЩЕ с.Царичино. общ Балчик. Парцел с лице 90м на асфалтов път  ..., тел.: 0879559838",,,False,продава,земя,Царичино,Област Добрич,0879559838,,https:None,https://www.imot.bg/pcgi/imot.cgi?act=5&adv=1s174213256898547&slink=bt2aub&f1=1,,,,imotbg,618,,,,,,cb04a3e5b9e1ebb1a26065da1b866754
Продава ЗЕМЕДЕЛСКА ЗЕМЯ,"Нива, кат. 3, с Аренден договор до 01.10.2025 г. и рента 110 лв./год., 18 дка, Гекко Хоум ви предлага един парцел 18 д-ка раположен в район Добрич, населено място Крушари. Нивата  ..., тел.: 0893717250",,,False,продава,земя,Крушари,Област Добрич,0893717250,,https://gekkohome.imot.bg,https://www.imot.bg/pcgi/imot.cgi?act=5&adv=1s173986806402068&slink=bt2aub&f1=1,,,,imotbg,618,,,,,,53e909b6231d934273df7ad91bfde8ae
Продава ЗЕМЕДЕЛСКА ЗЕМЯ,"Нива, кат. 3, с Аренден договор до 01.10.2025 г. и рента 160 лв./год., 48 дка, Нова много намалена цена! Предлагаме за продажба 48 декара земеделска земя в землището на с.Плачидол ..., тел.: 0888785777",,,False,продава,земя,Плачидол,Област Добрич,0888785777,,https://domm.imot.bg,https://www.imot.bg/pcgi/imot.cgi?act=5&adv=1s173979378776771&slink=bt2aub&f1=1,,,,imotbg,618,,,,,,4d547b48cfbf430d5ef3bd3caee76bb4
Продава ЗЕМЕДЕЛСКА ЗЕМЯ,"Нива, кат. 3, с Аренден договор до 01.10.2025 г. и рента 110 лв./год., 13 дка, Гекко Хоум ви предлага един парцел 13 д-ка раположен в район Добрич, населено място Северняк. Нивата ..., тел.: 0893717250",,,False,продава,земя,Северняк,Област Добрич,0893717250,,https://gekkohome.imot.bg,https://www.imot.bg/pcgi/imot.cgi?act=5&adv=1s173997751177289&slink=bt2aub&f1=1,,,,imotbg,618,,,,,,c10dcf587cf35ddcb1e3563402c7da0a
Продава ЗЕМЕДЕЛСКА ЗЕМЯ,"Ливада, кат. 3, 7 дка, РЕАЛНА ОФЕРТА!!! НА ВНИМАНИЕТО ВИ ПРЕДЛАГАМЕ ЗЕМЕДЕЛСКА ЗЕМЯ РАВНА 7000кв.м, В НЕПОСРЕДСТВЕНА БЛИЗОС ..., тел.: 0878414123",,,False,продава,земя,Студена,Област Перник,0878414123,,https://elitkomers122.imot.bg,https://www.imot.bg/pcgi/imot.cgi?act=5&adv=1s168934860560961&slink=bt2aub&f1=1,,,,imotbg,618,,,,,,0140df9fd5e282ea4652f66a7f0ce510
Продава ЗЕМЕДЕЛСКА ЗЕМЯ,"Нива, кат. 3, 2680 дка, Околовръсно шосе, Предлагаме на Вашето внимание парцел - земеделска земя - категория 3, НТП Нива,с площ 2680 кв.м , ко ..., тел.: 0877898622",,,False,продава,земя,Пловдив,Област Пловдив,0877898622,,https://progressplovdiv.imot.bg,https://www.imot.bg/pcgi/imot.cgi?act=5&adv=1s174186573004306&slink=bt2aub&f1=1,,,,imotbg,618,,,,,,99b4255d800a7e68ffa3726da19f4629
Продава ЗЕМЕДЕЛСКА ЗЕМЯ,"Нива, кат. 3, с Аренден договор до 01.09.2025 г. и рента 70 лв./год., 81.53 дка, Предлагаме за продажба обработваема земеделска земя в землището на с. Радецки, общ. Нова Загора, обл ..., тел.: 0879332276",,,False,продава,земя,Радецки,Област Сливен,0879332276,,https:None,https://www.imot.bg/pcgi/imot.cgi?act=5&adv=1s173649180711166&slink=bt2aub&f1=1,,,,imotbg,618,,,,,,94654719dea318b241b2c64e973c47d4
Продава ЗЕМЕДЕЛСКА ЗЕМЯ,"Нива, кат. 3, с Аренден договор до 01.09.2025 г. и рента 70 лв./год., 20.204 дка, Предлагаме за продажба в землището на село Бенковски, общ. Стара Загора, обл. Стара Загора: 1. 03856 ..., тел.: 0879332276",,,False,продава,земя,Бенковски,Област Стара Загора,0879332276,,https:None,https://www.imot.bg/pcgi/imot.cgi?act=5&adv=1s173852305891175&slink=bt2aub&f1=1,,,,imotbg,618,,,,,,6420e673088632922c8dffc1cec44208
Продава ЗЕМЕДЕЛСКА ЗЕМЯ,"Нива, кат. 3, 10 дка, Предлагаме Ви атрактивен парцел по главен път Габрово   Севлиево. Недвижим имот с различни възможнос ..., тел.: 0898 675 565",,,False,продава,земя,Габрово,Център,0898 675 565,,https://dikova.imot.bg,https://www.imot.bg/pcgi/imot.cgi?act=5&adv=1s155497096674724&slink=bt2aub&f1=1,,,,imotbg,618,,,,,,b9da4274e03ea9bc649826ced80b3bc4
Продава ЗЕМЕДЕЛСКА ЗЕМЯ,"Нива, кат. 3, 7770 дка, Явлена продава нива от 7,770 дка трета категория находяща се в местността ' Чанлъка' в землището на  ..., тел.: 0886426180",,,False,продава,земя,Стара Загора,Зора,0886426180,,https://yavlena_sz.imot.bg,https://www.imot.bg/pcgi/imot.cgi?act=5&adv=1s156655360699782&slink=bt2aub&f1=1,,,,imotbg,618,,,,,,b5cb6b4b33b1e4670a3c505cc2b7ff2c
Продава ЗЕМЕДЕЛСКА ЗЕМЯ,"Нива, кат. 1, 2.5 дка, ПРЕЦИЗ ИМОТИ Ви предлага: Земеделска нива от 2,5 дка, в регулация. Имота е напълно подходящ и за зас ..., тел.: 0897836446",,,False,продава,земя,Шумен,Дивдядово,0897836446,,https://preciz_imoti.imot.bg,https://www.imot.bg/pcgi/imot.cgi?act=5&adv=1s155299501559672&slink=bt2aub&f1=1,,,,imotbg,618,,,,,,2b00f1c2249dcbad07f8606d48251c21
Продава ЗЕМЕДЕЛСКА ЗЕМЯ,"Нива, кат. 3, 2 дка, Сити пропъртис предлага за продажба земеделски имот попадащ в зона за преотреждане с площ от 1876 кв ..., тел.: 0896505565",,,False,продава,земя,Благоевград,Област Благоевград,0896505565,,https://cityproperties.imot.bg,https://www.imot.bg/pcgi/imot.cgi?act=5&adv=1s163300812377315&slink=bt2aub&f1=1,,,,imotbg,618,,,,,,b9b648ad6854cfd48c74f30d99030393
Продава ЗЕМЕДЕЛСКА ЗЕМЯ,"Нива, кат. 3, 5 дка, Драмски път, Имотът е разположен на Драмски път в близост до магазин 'Кинг Тойс' и магазин 'Фреш маркет', няма ли ..., тел.: 0878488113",,,False,продава,земя,Гоце Делчев,Област Благоевград,0878488113,,https://tolex.imot.bg,https://www.imot.bg/pcgi/imot.cgi?act=5&adv=1s174015260600798&slink=bt2aub&f1=1,,,,imotbg,618,,,,,,21e9f8b3441780c30ba70f7d4bec4ef0
Продава ЗЕМЕДЕЛСКА ЗЕМЯ,"Нива, кат. 3, 2.5 дка, тел.: 0887072928",,,False,продава,земя,Симитли,Област Благоевград,0887072928,,https:None,https://www.imot.bg/pcgi/imot.cgi?act=5&adv=1s170945746099634&slink=bt2aub&f1=1,,,,imotbg,618,,,,,,189abc6fcc14c7e2435a692305002a45
Продава ЗЕМЕДЕЛСКА ЗЕМЯ,"Нива, кат. 1, 1 дка, Предлагаме за продажба парцел земеделска земя по пътя Баня - Банско, на втора линия, зад хотел Вита  ..., тел.: 0894585226",,,False,продава,земя,Баня,Област Благоевград,0894585226,,https://plusproperty1.imot.bg,https://www.imot.bg/pcgi/imot.cgi?act=5&adv=1s172483718694970&slink=bt2aub&f1=1,,,,imotbg,618,,,,,,ed9d9a3eb2a460fdfc8b028588fc356a
Продава ЗЕМЕДЕЛСКА ЗЕМЯ,"Ливада, кат. 3, 4 дка, Баня, Имота разполага с прекрасна гледка към Пирин планина. През имота минава ток вода и минерална вода. В ..., тел.: 0894877612",,,False,продава,земя,Баня,Област Благоевград,0894877612,,https:None,https://www.imot.bg/pcgi/imot.cgi?act=5&adv=1s174033211563685&slink=bt2aub&f1=1,,,,imotbg,618,,,,,,ed9d9a3eb2a460fdfc8b028588fc356a
Продава ЗЕМЕДЕЛСКА ЗЕМЯ,"Нива, кат. 1, 0.561 дка, Нива с площ от 0.561 дка, с кад.идент. 57176.85.5, шеста категория, имот  085005, ЕКАТТЕ 57176. Имот ..., тел.: 0884265112",,,False,продава,земя,Поленица,Област Благоевград,0884265112,,https://dca.imot.bg,https://www.imot.bg/pcgi/imot.cgi?act=5&adv=1s173528649386062&slink=bt2aub&f1=1,,,,imotbg,618,,,,,,acfc32ec84d3b1762ee872e7baa2611f
Продава ЗЕМЕДЕЛСКА ЗЕМЯ,"Овощна градина, кат. 3, 1 дка, м. Бряста, Предлагаме за продажба 1 дка в землището на Ахелой, местност Бряста, на 50 м от асфалтов път, на 250 ..., тел.: 0893390880",,,False,продава,земя,Бургас,Област Бургас,0893390880,,https://asaviabs.imot.bg,https://www.imot.bg/pcgi/imot.cgi?act=5&adv=1s168061196976997&slink=bt2aub&f1=1,,,,imotbg,618,,,,,,b9068b8a624331e25af6df2dc737936c
Продава ЗЕМЕДЕЛСКА ЗЕМЯ,"Овощна градина, кат. 3, 12 дка, Голям поземлен имот до регулацията на гр. Ахелой, реф.н. CAT 577 НОВА НАМАЛЕНА ЦЕНА! БЕЗ КОМИСИОНА!  ..., тел.: 0886088088",,,False,продава,земя,Бургас,Област Бургас,0886088088,,https://petrakievi.imot.bg,https://www.imot.bg/pcgi/imot.cgi?act=5&adv=1s169901474791431&slink=bt2aub&f1=1,,,,imotbg,618,,,,,,b9068b8a624331e25af6df2dc737936c
Продава ЗЕМЕДЕЛСКА ЗЕМЯ,"Нива, кат. 3, 5 дка, Продаваме земеделска земя трета категория с площ 5 дка в гр. Ахелой, близо до Базата, продължението  ..., тел.: 0890311116",,,False,продава,земя,Бургас,Област Бургас,0890311116,,https://bgbroker.imot.bg,https://www.imot.bg/pcgi/imot.cgi?act=5&adv=1s168787013091421&slink=bt2aub&f1=1,,,,imotbg,618,,,,,,b9068b8a624331e25af6df2dc737936c
Продава ЗЕМЕДЕЛСКА ЗЕМЯ,"Нива, кат. 3, 3.502 дка, Недвижими имоти Ваня продава земеделска земя обл.Бургас гр.Ахелой м.Пречиствателна с площ 3502кв.м.  ..., тел.: 0888497881",,,False,продава,земя,Бургас,Област Бургас,0888497881,,https://imotivanya.imot.bg,https://www.imot.bg/pcgi/imot.cgi?act=5&adv=1s168985260788688&slink=bt2aub&f1=1,,,,imotbg,618,,,,,,b9068b8a624331e25af6df2dc737936c
Продава ЗЕМЕДЕЛСКА ЗЕМЯ,"Нива, кат. 3, 10 дка, Предлагаме Ви за продажба 10 декара 3-та категория земеделска земя с лице път и гледка море в гр. Ах ..., тел.: 0899802209",,,False,продава,земя,Бургас,Област Бургас,0899802209,,https://igprovide.imot.bg,https://www.imot.bg/pcgi/imot.cgi?act=5&adv=1s161960326163645&slink=bt2aub&f1=1,,,,imotbg,618,,,,,,b9068b8a624331e25af6df2dc737936c
Продава ЗЕМЕДЕЛСКА ЗЕМЯ,"Нива, кат. 3, 6 дка, Титан Пропъртис предлага на Вашето внимание за Продажба земеделска земя, находящ се в с.Ахелой, общ. ..., тел.: 0886092152",,,False,продава,земя,Бургас,Област Бургас,0886092152,,https://titansales.imot.bg,https://www.imot.bg/pcgi/imot.cgi?act=5&adv=1s170783140856275&slink=bt2aub&f1=1,,,,imotbg,618,,,,,,b9068b8a624331e25af6df2dc737936c
Продава ЗЕМЕДЕЛСКА ЗЕМЯ,"Нива, кат. 3, 11 дка, 1. Земеделска земя в Местност 'Коросиата-Зигрите' 11дка, близо до пътя Ахтопол-Царево, гледка към мо ..., тел.: 0889256794",,,False,продава,земя,Бургас,Област Бургас,0889256794,,https:None,https://www.imot.bg/pcgi/imot.cgi?act=5&adv=1s148770640957397&slink=bt2aub&f1=1,,,,imotbg,618,,,,,,b9068b8a624331e25af6df2dc737936c
Продава ЗЕМЕДЕЛСКА ЗЕМЯ,"Овощна градина, кат. 3, 7.33 дка, PROject HOME/ Проджект Хоум ви представя ексклузивно парцел със сливови дръвчета в ж.к. Долно Езоров ..., тел.: 0893008787",,,False,продава,земя,Бургас,Област Бургас,0893008787,,https://projecthome.imot.bg,https://www.imot.bg/pcgi/imot.cgi?act=5&adv=1s172131556618295&slink=bt2aub&f1=1,,,,imotbg,618,,,,,,b9068b8a624331e25af6df2dc737936c
Продава ЗЕМЕДЕЛСКА ЗЕМЯ,"Овощна градина, кат. 3, 5.7 дка, Поземлен имот 07079.2.594, област Бургас, община Бургас, гр. Бургас, м. ОНИКИЛИКА, вид собств. Частн ..., тел.: 0878421985",,,False,продава,земя,Бургас,Област Бургас,0878421985,,https://zaks.imot.bg,https://www.imot.bg/pcgi/imot.cgi?act=5&adv=1s163301471939668&slink=bt2aub&f1=1,,,,imotbg,618,,,,,,b9068b8a624331e25af6df2dc737936c
Продава ЗЕМЕДЕЛСКА ЗЕМЯ,"Нива, кат. 3, 8 дка, Сарафово, Поземлен имот с идентификатор 07079.1.297 по кадастралната карта и кадастрални регистри на гр. Бурга ..., тел.: 0899976545",,,False,продава,земя,Бургас,Област Бургас,0899976545,,https://ubb.imot.bg,https://www.imot.bg/pcgi/imot.cgi?act=5&adv=1s171879963857620&slink=bt2aub&f1=1,,,,imotbg,618,,,,,,b9068b8a624331e25af6df2dc737936c
Продава ЗЕМЕДЕЛСКА ЗЕМЯ,"Нива, кат. 3, с Аренден договор до 22.10.2025 г. и рента 400 лв./год., 3.6 дка, Продавам имот в землището на гр. Бургас. Поземлен имота  с номер 07079.2.36.36. За повече въпроси се ..., тел.: 0888607731",,,False,продава,земя,Бургас,Област Бургас,0888607731,,https:None,https://www.imot.bg/pcgi/imot.cgi?act=5&adv=1s171145039350505&slink=bt2aub&f1=1,,,,imotbg,618,,,,,,b9068b8a624331e25af6df2dc737936c
Продава ЗЕМЕДЕЛСКА ЗЕМЯ,"Нива, кат. 3, 2.394 дка, МЕСТНОСТ ТЕЦ ЛОЗОВО, Ем Джи Естейт продава ексклузивно! Два съседни парцела- земеделска земя в местност ТЕЦ Лозово. Едини ..., тел.: 0879252702",,,False,продава,земя,Бургас,Област Бургас,0879252702,,https://mgestate2020.imot.bg,https://www.imot.bg/pcgi/imot.cgi?act=5&adv=1s168209306187187&slink=bt2aub&f1=1,,,,imotbg,618,,,,,,b9068b8a624331e25af6df2dc737936c
Продава ЗЕМЕДЕЛСКА ЗЕМЯ,"Нива, кат. 3, 8.3 дка, Сарафово, Земеделска земя в близост до главния път Сарафово-Поморие. Категория 3.  Местност Кабалъка, тел.: 0883930330",,,False,продава,земя,Бургас,Област Бургас,0883930330,,https://millennium.imot.bg,https://www.imot.bg/pcgi/imot.cgi?act=5&adv=1s173471030215459&slink=bt2aub&f1=1,,,,imotbg,618,,,,,,b9068b8a624331e25af6df2dc737936c
Продава ЗЕМЕДЕЛСКА ЗЕМЯ,"Нива, кат. 3, 9.2 дка, Сарафово, ИМОТЕН ПАРТНЬОР продава земеделска земя с лице на главния път Бургас - Сарафово. Парцела е с правилн ..., тел.: 0886459439",,,False,продава,земя,Бургас,Област Бургас,0886459439,,https://imopartner.imot.bg,https://www.imot.bg/pcgi/imot.cgi?act=5&adv=1s169963072661180&slink=bt2aub&f1=1,,,,imotbg,618,,,,,,b9068b8a624331e25af6df2dc737936c
Продава ЗЕМЕДЕЛСКА ЗЕМЯ,"Нива, кат. 3, с Аренден договор до 31.12.2026 г. и рента 460 лв./год., 5 дка, От собственик! Продава земеделска земя с възможност за промяна на предназначание, в близост до пътна ..., тел.: 0895622633",,,False,продава,земя,Бургас,Област Бургас,0895622633,,https://vichvan-g.imot.bg,https://www.imot.bg/pcgi/imot.cgi?act=5&adv=1s165769574730464&slink=bt2aub&f1=1,,,,imotbg,618,,,,,,b9068b8a624331e25af6df2dc737936c
Продава ЗЕМЕДЕЛСКА ЗЕМЯ,"Нива, кат. 3, 12 дка, Предлагам за продажба парцел подходящ за  застрояване,  автокъща, открит магазин или склад.   Лице н ..., тел.: 0899149145",,,False,продава,земя,Бургас,Област Бургас,0899149145,,https:None,https://www.imot.bg/pcgi/imot.cgi?act=5&adv=1s168761081258494&slink=bt2aub&f1=1,,,,imotbg,618,,,,,,b9068b8a624331e25af6df2dc737936c
Продава ЗЕМЕДЕЛСКА ЗЕМЯ,"Нива, кат. 3, 4 дка, кв.Сарафово, Продава поземлен имот в кв.Сарафово, м.КАБАЛЪКА ,в близост до ВПД-Сарафово и до летище Бургас.Парцел ..., тел.: 0878289589",,,False,продава,земя,Бургас,Област Бургас,0878289589,,https://polipet.imot.bg,https://www.imot.bg/pcgi/imot.cgi?act=5&adv=1s173867840326460&slink=bt2aub&f1=1,,,,imotbg,618,,,,,,b9068b8a624331e25af6df2dc737936c
Продава ЗЕМЕДЕЛСКА ЗЕМЯ,"Нива, кат. 3, 4 дка, Меден Рудник, Компания Х представя на Вашето внимание земеделска земя с лице на главен път Бургас-Средец!  МЕСТОПО ..., тел.: 0887779990",,,False,продава,земя,Бургас,Област Бургас,0887779990,,https://xnvd_burgas.imot.bg,https://www.imot.bg/pcgi/imot.cgi?act=5&adv=1s173934673502305&slink=bt2aub&f1=1,,,,imotbg,618,,,,,,b9068b8a624331e25af6df2dc737936c
Продава ЗЕМЕДЕЛСКА ЗЕМЯ,"Нива, кат. 3, 4 дка, Сарафово, Предлагаме за продажба имот в землището на кв. Сарафово, м. Соката, с правилна форма и с лице на асф ..., тел.: 0899370285",,,False,продава,земя,Бургас,Област Бургас,0899370285,,https://interestates.imot.bg,https://www.imot.bg/pcgi/imot.cgi?act=5&adv=1s166195008847356&slink=bt2aub&f1=1,,,,imotbg,618,,,,,,b9068b8a624331e25af6df2dc737936c
Продава ЗЕМЕДЕЛСКА ЗЕМЯ,"Нива, кат. 3, 3.9 дка, Продава се имот отреден за промишлено строителство на главния път на входа на квартал Лозово в Бурга ..., тел.: 0888847300",,,False,продава,земя,Бургас,Област Бургас,0888847300,,https:None,https://www.imot.bg/pcgi/imot.cgi?act=5&adv=1s172249630813217&slink=bt2aub&f1=1,,,,imotbg,618,,,,,,b9068b8a624331e25af6df2dc737936c
Продава ЗЕМЕДЕЛСКА ЗЕМЯ,"Нива, кат. 3, 15 дка, Сарафово, Компания Х представя на Вашето внимание земеделска земя в Сарафово.    МЕСТОПОЛОЖЕНИЕ: Намира се в б ..., тел.: 0887779990",,,False,продава,земя,Бургас,Област Бургас,0887779990,,https://xnvd_burgas.imot.bg,https://www.imot.bg/pcgi/imot.cgi?act=5&adv=1s171084647155925&slink=bt2aub&f1=1,,,,imotbg,618,,,,,,b9068b8a624331e25af6df2dc737936c
Продава ЗЕМЕДЕЛСКА ЗЕМЯ,"Нива, кат. 3, 11.25 дка, Марина Реал предлага за продажба парцел в м. Муската, в района на тенис център Авеню. Имотът е земед ..., тел.: 0877588189",,,False,продава,земя,Бургас,Област Бургас,0877588189,,https://marinareal.imot.bg,https://www.imot.bg/pcgi/imot.cgi?act=5&adv=1s156183171189935&slink=bt2aub&f1=1,,,,imotbg,618,,,,,,b9068b8a624331e25af6df2dc737936c
Продава ЗЕМЕДЕЛСКА ЗЕМЯ,"Нива, кат. 3, 5.249 дка, Изгрев, Лъкшъри Инвестмент Ви представя чудесен ПИ за продажба в гр. Бургас.  Поземлен имот: 07079.2.1723 Пл ..., тел.: 0877 093 371",,,False,продава,земя,Бургас,Област Бургас,0877 093 371,,https://luxuryinvestment.imot.bg,https://www.imot.bg/pcgi/imot.cgi?act=5&adv=1s166767304193125&slink=bt2aub&f1=1,,,,imotbg,618,,,,,,b9068b8a624331e25af6df2dc737936c
Продава ЗЕМЕДЕЛСКА ЗЕМЯ,"Нива, кат. 3, 41 дка, м-т ОНИКИЛИКА, зад ДЖЪМБО, Предлагаме за продажба инвестиционен парцел с площ 41 496 кв.м., разположен в местност ОНИКИЛИКА, за ..., тел.: 0899991188",,,False,продава,земя,Бургас,Област Бургас,0899991188,,https://esteti.imot.bg,https://www.imot.bg/pcgi/imot.cgi?act=5&adv=1s172466499927813&slink=bt2aub&f1=2,,,,imotbg,618,,,,,,b9068b8a624331e25af6df2dc737936c
Продава ЗЕМЕДЕЛСКА ЗЕМЯ,"Нива, кат. 3, 41 дка, м-т ОНИКИЛИКА, зад ДЖЪМБО, Предлагаме за продажба инвестиционен парцел с площ 41 496 кв.м., разположен в местност ОНИКИЛИКА, за ..., тел.: 0899991188",,,False,продава,земя,Бургас,Област Бургас,0899991188,,https:None,https://www.imot.bg/pcgi/imot.cgi?act=5&adv=1s172466499927813&slink=bt2aub&f1=2,,,,imotbg,618,,,,,,b9068b8a624331e25af6df2dc737936c
Продава ЗЕМЕДЕЛСКА ЗЕМЯ,"Нива, кат. 3, 8 дка, местност  Чернозема , Продажба на парцел в м. Чернозема бивша Кабата Агенция IG Provide предлага за продажба атрактивен па ..., тел.: 0899802209",,,False,продава,земя,Бургас,Област Бургас,0899802209,,https://igprovide.imot.bg,https://www.imot.bg/pcgi/imot.cgi?act=5&adv=1s171808618934361&slink=bt2aub&f1=2,,,,imotbg,618,,,,,,b9068b8a624331e25af6df2dc737936c
Продава ЗЕМЕДЕЛСКА ЗЕМЯ,"Нива, кат. 3, 7.827 дка, Предлагаме за продажба парцел с площ от 7.827дка, в. Чернозема, с лице на автономен път, на 150м от  ..., тел.: 0877911921",,,False,продава,земя,Бургас,Област Бургас,0877911921,,https:None,https://www.imot.bg/pcgi/imot.cgi?act=5&adv=1s173659756670751&slink=bt2aub&f1=2,,,,imotbg,618,,,,,,b9068b8a624331e25af6df2dc737936c
Продава ЗЕМЕДЕЛСКА ЗЕМЯ,"Нива, кат. 3, 5 дка, Агенция за недвижими имоти ' Титан Пропъртис' предлага за продажба, Земеделска зема в ж.к Изгрев, м. ..., тел.: 0886092152",,,False,продава,земя,Бургас,Област Бургас,0886092152,,https://titansales.imot.bg,https://www.imot.bg/pcgi/imot.cgi?act=5&adv=1s173278884106758&slink=bt2aub&f1=2,,,,imotbg,618,,,,,,b9068b8a624331e25af6df2dc737936c
Продава ЗЕМЕДЕЛСКА ЗЕМЯ,"Нива, кат. 3, 9 дка, 9-ти километър, Само от Ем Джи Естейт! Предлагаме Ви уникален парцел (земеделска земя, трета категория) на изключите ..., тел.: 0879252702",,,False,продава,земя,Бургас,Област Бургас,0879252702,,https://mgestate2020.imot.bg,https://www.imot.bg/pcgi/imot.cgi?act=5&adv=1s172874206776477&slink=bt2aub&f1=2,,,,imotbg,618,,,,,,b9068b8a624331e25af6df2dc737936c
