raw_title,raw_description,price,currency,without_dds,offer_type,property_type,city,neighborhood,contact_info,agency,agency_url,details_url,num_photos,date_time_added,search_url,site,total_offers,ref_no,time,price_per_m2,area,floor,fingerprint_hash
Продава ЗЕМЕДЕЛСКА ЗЕМЯ,"Нива, кат. 3, 2.399 дка, ОФЕРТА 82632 Земеделска земя с площ 2 399кв.м., категория 3, Нива в м. Тръновица в район на нови къщ ..., тел.: 0893 568 645",,,False,продава,земя,Пловдив,Област Пловдив,0893 568 645,,https://rimex.imot.bg,https://www.imot.bg/pcgi/imot.cgi?act=5&adv=1s173978348446066&slink=bt2aub&f1=11,,,,imotbg,618,,,,,,99b4255d800a7e68ffa3726da19f4629
Продава ЗЕМЕДЕЛСКА ЗЕМЯ,"Нива, кат. 3, 11.798 дка, ПОПОВ КОНСУЛТ има удоволствието да Ви представи парцел на страхотна локация в село Браниполе! Имотът ..., тел.: 0886755477",,,False,продава,земя,Пловдив,Област Пловдив,0886755477,,https://popov_konsult.imot.bg,https://www.imot.bg/pcgi/imot.cgi?act=5&adv=1s172285513828210&slink=bt2aub&f1=11,,,,imotbg,618,,,,,,99b4255d800a7e68ffa3726da19f4629
Продава ЗЕМЕДЕЛСКА ЗЕМЯ,"Нива, кат. 3, 1.26 дка, Продава се земеделска земя в област Пловдив, с. Брестник, местност Варник, с обща площ 1.26 дка. Пар ..., тел.: 0894315828",,,False,продава,земя,Пловдив,Област Пловдив,0894315828,,https:None,https://www.imot.bg/pcgi/imot.cgi?act=5&adv=1s169063576801753&slink=bt2aub&f1=11,,,,imotbg,618,,,,,,99b4255d800a7e68ffa3726da19f4629
Продава ЗЕМЕДЕЛСКА ЗЕМЯ,"Овощна градина, кат. 3, 2 дка, Оферта 81618. Околовръстен път юг, в землището на Брестник, местост Чиирите, земеделски имот 2 000 к ..., тел.: 0893 568 644",,,False,продава,земя,Пловдив,Област Пловдив,0893 568 644,,https://rimex.imot.bg,https://www.imot.bg/pcgi/imot.cgi?act=5&adv=1s171396663908966&slink=bt2aub&f1=11,,,,imotbg,618,,,,,,99b4255d800a7e68ffa3726da19f4629
Продава ЗЕМЕДЕЛСКА ЗЕМЯ,"Нива, кат. 3, 2.789 дка, местност Шарпавица, Земеделска земя 2789 кв.м. , с идент.   06447.5.576 Нивата е близо до околовръстното шосе и прелеза  ..., тел.: 0895 703 643",,,False,продава,земя,Пловдив,Област Пловдив,0895 703 643,,https:None,https://www.imot.bg/pcgi/imot.cgi?act=5&adv=1s138541016122644&slink=bt2aub&f1=11,,,,imotbg,618,,,,,,99b4255d800a7e68ffa3726da19f4629
Продава ЗЕМЕДЕЛСКА ЗЕМЯ,"Нива, кат. 3, 5 дка, Представяме Ви голям земеделски имот с отлична локация, разположен в живописното село Брестник, обла ..., тел.: 0893901806",,,False,продава,земя,Пловдив,Област Пловдив,0893901806,,https:None,https://www.imot.bg/pcgi/imot.cgi?act=5&adv=1s172389881197338&slink=bt2aub&f1=11,,,,imotbg,618,,,,,,99b4255d800a7e68ffa3726da19f4629
Продава ЗЕМЕДЕЛСКА ЗЕМЯ,"Лозе, кат. 3, 3 дка, OPEN Homes представя поземлен имот с голям потенциал, разположена в началото на с. Брестник, област  ..., тел.: 0884040538",,,False,продава,земя,Пловдив,Област Пловдив,0884040538,,https://openhomes.imot.bg,https://www.imot.bg/pcgi/imot.cgi?act=5&adv=1s171146673026556&slink=bt2aub&f1=11,,,,imotbg,618,,,,,,99b4255d800a7e68ffa3726da19f4629
Продава ЗЕМЕДЕЛСКА ЗЕМЯ,"Лозе, кат. 3, 3 дка, Компания `Х` представя на Вашето внимание земеделска земя в Брестник!  МЕСТОПОЛОЖЕНИЕ: Брестник е ра ..., тел.: 0887 77 99 90",,,False,продава,земя,Пловдив,Област Пловдив,0887 77 99 90,,https://xnvd_plovdiv.imot.bg,https://www.imot.bg/pcgi/imot.cgi?act=5&adv=1s173287944293042&slink=bt2aub&f1=11,,,,imotbg,618,,,,,,99b4255d800a7e68ffa3726da19f4629
Продава ЗЕМЕДЕЛСКА ЗЕМЯ,"Нива, кат. 3, 5 дка, Земеделска земя 5534 кв м  с начин на трайно ползване - нива . трета категория при неполивани услови ..., тел.: 0887737333",,,False,продава,земя,Пловдив,Област Пловдив,0887737333,,https://tal.imot.bg,https://www.imot.bg/pcgi/imot.cgi?act=5&adv=1s170721249229320&slink=bt2aub&f1=11,,,,imotbg,618,,,,,,99b4255d800a7e68ffa3726da19f4629
Продава ЗЕМЕДЕЛСКА ЗЕМЯ,"Овощна градина, кат. 3, 2000 дка, Агенция ФОРУМ предлага Черешова градина в началото на с. Брестник. Намира се на втора линия от главн ..., тел.: 0882908145",,,False,продава,земя,Пловдив,Област Пловдив,0882908145,,https://forumimoti1.imot.bg,https://www.imot.bg/pcgi/imot.cgi?act=5&adv=1s171162997864801&slink=bt2aub&f1=11,,,,imotbg,618,,,,,,99b4255d800a7e68ffa3726da19f4629
Продава ЗЕМЕДЕЛСКА ЗЕМЯ,"Лозе, кат. 3, 4.77 дка,  ОФЕРТА 6031 Земеделски имот с правилна форма и голямо лице на път, подходящ заразделяне на малки УП ..., тел.: 0886194213",,,False,продава,земя,Пловдив,Област Пловдив,0886194213,,https://estateshop22.imot.bg,https://www.imot.bg/pcgi/imot.cgi?act=5&adv=1s171697505857090&slink=bt2aub&f1=11,,,,imotbg,618,,,,,,99b4255d800a7e68ffa3726da19f4629
Продава ЗЕМЕДЕЛСКА ЗЕМЯ,"Овощна градина, кат. 3, 9 дка, Компания `Х` представя на Вашето внимание  земеделска земя в Брестник!  МЕСТОПОЛОЖЕНИЕ: Село Брестни ..., тел.: 0887 77 99 90",,,False,продава,земя,Пловдив,Област Пловдив,0887 77 99 90,,https://xnvd_plovdiv.imot.bg,https://www.imot.bg/pcgi/imot.cgi?act=5&adv=1s173141215243672&slink=bt2aub&f1=11,,,,imotbg,618,,,,,,99b4255d800a7e68ffa3726da19f4629
Продава ЗЕМЕДЕЛСКА ЗЕМЯ,"Нива, кат. 3, с Аренден договор до 14.12.2025 г. и рента 1600 лв./год., 39 дка, Продавам 39 дка. земеделска земя трета категория в село Голям Чардак , община Съединение, област Пло ..., тел.: 0878409301",,,False,продава,земя,Пловдив,Област Пловдив,0878409301,,https://era1300.imot.bg,https://www.imot.bg/pcgi/imot.cgi?act=5&adv=1s173695749152082&slink=bt2aub&f1=12,,,,imotbg,618,,,,,,99b4255d800a7e68ffa3726da19f4629
Продава ЗЕМЕДЕЛСКА ЗЕМЯ,"Нива, кат. 3, с Аренден договор до 14.12.2025 г. и рента 1600 лв./год., 39 дка, Продавам 39 дка. земеделска земя трета категория в село Голям Чардак , община Съединение, област Пло ..., тел.: 0878409301",,,False,продава,земя,Пловдив,Област Пловдив,0878409301,,https:None,https://www.imot.bg/pcgi/imot.cgi?act=5&adv=1s173695749152082&slink=bt2aub&f1=12,,,,imotbg,618,,,,,,99b4255d800a7e68ffa3726da19f4629
Продава ЗЕМЕДЕЛСКА ЗЕМЯ,"Гори и храсти в земеделска земя, кат. 1, 1 дка, 'Бяла черква', Продава се 1 декар ГОРА в летовище 'Бяла Черква', землището на село Добралък. Имотът е в непосредств ..., тел.: 0886156567",,,False,продава,земя,Пловдив,Област Пловдив,0886156567,,https:None,https://www.imot.bg/pcgi/imot.cgi?act=5&adv=1s172432135187466&slink=bt2aub&f1=12,,,,imotbg,618,,,,,,99b4255d800a7e68ffa3726da19f4629
Продава ЗЕМЕДЕЛСКА ЗЕМЯ,"Нива, кат. 3, 9 дка, Компания `Х` представя на Вашето внимание земеделска земя в село Златитрап. МЕСТОПОЛОЖЕНИЕ: Село Зла ..., тел.: 0887779990",,,False,продава,земя,Пловдив,Област Пловдив,0887779990,,https://xnvd_plovdiv.imot.bg,https://www.imot.bg/pcgi/imot.cgi?act=5&adv=1s172786710677527&slink=bt2aub&f1=12,,,,imotbg,618,,,,,,99b4255d800a7e68ffa3726da19f4629
Продава ЗЕМЕДЕЛСКА ЗЕМЯ,"Овощна градина, кат. 3, 41 дка, КОДг 15664. Овощните градини 41дка ( 7,4дка сливи, 5дка череши, 6дка череши, 19,4дка ябълки). Масиви ..., тел.: 0894 216 451",,,False,продава,земя,Пловдив,Област Пловдив,0894 216 451,,https://continental_rea.imot.bg,https://www.imot.bg/pcgi/imot.cgi?act=5&adv=1s171171021211475&slink=bt2aub&f1=12,,,,imotbg,618,,,,,,99b4255d800a7e68ffa3726da19f4629
Продава ЗЕМЕДЕЛСКА ЗЕМЯ,"Овощна градина, кат. 2, 20 дка, Поливност, До ток, До път, До вода, До регулация, тел.: 0897879956",,,False,продава,земя,Пловдив,Област Пловдив,0897879956,,https:None,https://www.imot.bg/pcgi/imot.cgi?act=5&adv=1s174154677710279&slink=bt2aub&f1=12,,,,imotbg,618,,,,,,99b4255d800a7e68ffa3726da19f4629
Продава ЗЕМЕДЕЛСКА ЗЕМЯ,"Гори и храсти в земеделска земя, кат. 1, 10 дка, Недвижими имоти Ваня продава широколистна гора в землището на с.Красново обл.Пловдив с площ 10 000 к ..., тел.: 0888497881",,,False,продава,земя,Пловдив,Област Пловдив,0888497881,,https://imotivanya.imot.bg,https://www.imot.bg/pcgi/imot.cgi?act=5&adv=1s168917065036265&slink=bt2aub&f1=12,,,,imotbg,618,,,,,,99b4255d800a7e68ffa3726da19f4629
Продава ЗЕМЕДЕЛСКА ЗЕМЯ,"Нива, кат. 3, 4000 дка, тел.: 0888934113",,,False,продава,земя,Пловдив,Област Пловдив,0888934113,,https:None,https://www.imot.bg/pcgi/imot.cgi?act=5&adv=1s173608840083677&slink=bt2aub&f1=12,,,,imotbg,618,,,,,,99b4255d800a7e68ffa3726da19f4629
Продава ЗЕМЕДЕЛСКА ЗЕМЯ,"Нива, кат. 3, 4500 дка, ТОП ЦЕНА 67500 евро!!! ИНВЕСТИЦИОННО ПРЕДЛОЖЕНИЕ!!! НА АСЕНОВГРАДСКО ШОСЕ!!!  Инклузив недвижими имо ..., тел.: 0875363320",,,False,продава,земя,Пловдив,Област Пловдив,0875363320,,https:None,https://www.imot.bg/pcgi/imot.cgi?act=5&adv=1s172926307490486&slink=bt2aub&f1=12,,,,imotbg,618,,,,,,99b4255d800a7e68ffa3726da19f4629
Продава ЗЕМЕДЕЛСКА ЗЕМЯ,"Оризище, кат. 3, с Аренден договор до 30.09.2025 г. и рента 500 лв./год., 10 дка, кодг 62874. Нива 9700м2 с лице 150м на АМ Тракия и канал за поливане, с НТП оризище, 3-та кат. под а ..., тел.: 0894 216 451",,,False,продава,земя,Пловдив,Област Пловдив,0894 216 451,,https://continental_rea.imot.bg,https://www.imot.bg/pcgi/imot.cgi?act=5&adv=1s173684815022381&slink=bt2aub&f1=12,,,,imotbg,618,,,,,,99b4255d800a7e68ffa3726da19f4629
Продава ЗЕМЕДЕЛСКА ЗЕМЯ,"Нива, кат. 3, 22 дка, Номер на оферта: 619913  Агенция за недвижими имоти 'Trivium Estate' продава земеделска земя с площ  ..., тел.: 0896878933",,,False,продава,земя,Пловдив,Област Пловдив,0896878933,,https://trivium.imot.bg,https://www.imot.bg/pcgi/imot.cgi?act=5&adv=1s173102684767851&slink=bt2aub&f1=12,,,,imotbg,618,,,,,,99b4255d800a7e68ffa3726da19f4629
Продава ЗЕМЕДЕЛСКА ЗЕМЯ,"Нива, кат. 3, 32.461 дка, Оферта 75315 Рогошко шосе, на 5 км от магистрала Тракия, в землището на село Скутаре, земеделска зем ..., тел.: 0893568644",,,False,продава,земя,Пловдив,Област Пловдив,0893568644,,https://rimex.imot.bg,https://www.imot.bg/pcgi/imot.cgi?act=5&adv=1s164691423726900&slink=bt2aub&f1=12,,,,imotbg,618,,,,,,99b4255d800a7e68ffa3726da19f4629
Продава ЗЕМЕДЕЛСКА ЗЕМЯ,"Нива, кат. 3, 4 дка, Парцела се намира до завода за био газ в с Труд.Това там са места който много скоро ще влязат в регу ..., тел.: 0895763476",,,False,продава,земя,Пловдив,Област Пловдив,0895763476,,https:None,https://www.imot.bg/pcgi/imot.cgi?act=5&adv=1s162114839827936&slink=bt2aub&f1=12,,,,imotbg,618,,,,,,99b4255d800a7e68ffa3726da19f4629
Продава ЗЕМЕДЕЛСКА ЗЕМЯ,"Нива, кат. 3, 1.8 дка, Номер на оферта: 619354  Агенция за недвижими имоти 'TRIVIUM ESTATE' продава екслузивно земеделска з ..., тел.: 0896878933",,,False,продава,земя,Пловдив,Област Пловдив,0896878933,,https://trivium.imot.bg,https://www.imot.bg/pcgi/imot.cgi?act=5&adv=1s173102819258694&slink=bt2aub&f1=12,,,,imotbg,618,,,,,,99b4255d800a7e68ffa3726da19f4629
Продава ЗЕМЕДЕЛСКА ЗЕМЯ,"Нива, кат. 3, 5.2 дка, Компания `Х` представя на Вашето внимание земеделска земя в село Цалапица. МЕСТОПОЛОЖЕНИЕ: Село Цала ..., тел.: 0887779990",,,False,продава,земя,Пловдив,Област Пловдив,0887779990,,https://xnvd_plovdiv.imot.bg,https://www.imot.bg/pcgi/imot.cgi?act=5&adv=1s172795710267815&slink=bt2aub&f1=12,,,,imotbg,618,,,,,,99b4255d800a7e68ffa3726da19f4629
Продава ЗЕМЕДЕЛСКА ЗЕМЯ,"Нива, кат. 1, 15.9 дка, Продава се Земеделска земя в село Царимир, с лице 190 метра на асфалтов път.  Площ 16 декара и само  ..., тел.: 0899578882",,,False,продава,земя,Пловдив,Област Пловдив,0899578882,,https:None,https://www.imot.bg/pcgi/imot.cgi?act=5&adv=1s174107740390041&slink=bt2aub&f1=12,,,,imotbg,618,,,,,,99b4255d800a7e68ffa3726da19f4629
Продава ЗЕМЕДЕЛСКА ЗЕМЯ,"Гори и храсти в земеделска земя, кат. 3, 5 дка, Предлагаме за продажба имот, широколистна гора с площ 5 дка в местността 'БАИРА' на село Черничево.  ..., тел.: 0889409532",,,False,продава,земя,Пловдив,Област Пловдив,0889409532,,https://arena.imot.bg,https://www.imot.bg/pcgi/imot.cgi?act=5&adv=1s166860649955737&slink=bt2aub&f1=12,,,,imotbg,618,,,,,,99b4255d800a7e68ffa3726da19f4629
Продава ЗЕМЕДЕЛСКА ЗЕМЯ,"Гори и храсти в земеделска земя, кат. 2, 6 дка, Компания `Х` представя на Вашето внимание парцел в село Черничево!  МЕСТОПОЛОЖЕНИЕ: Село Черничево с ..., тел.: 0887 77 99 90",,,False,продава,земя,Пловдив,Област Пловдив,0887 77 99 90,,https://xnvd_plovdiv.imot.bg,https://www.imot.bg/pcgi/imot.cgi?act=5&adv=1s173082576315470&slink=bt2aub&f1=12,,,,imotbg,618,,,,,,99b4255d800a7e68ffa3726da19f4629
Продава ЗЕМЕДЕЛСКА ЗЕМЯ,"Гори и храсти в земеделска земя, кат. 3, 20 дка, Предлагаме за продажба 20 дка широколистна гора в землището на с. Черноземен, състоящи се от три имо ..., тел.: 0889409532",,,False,продава,земя,Пловдив,Област Пловдив,0889409532,,https://arena.imot.bg,https://www.imot.bg/pcgi/imot.cgi?act=5&adv=1s166860571069939&slink=bt2aub&f1=12,,,,imotbg,618,,,,,,99b4255d800a7e68ffa3726da19f4629
Продава ЗЕМЕДЕЛСКА ЗЕМЯ,"Нива, кат. 3, 8421 дка, Елешика, Земеделска Земя обработваща се в момента, до Пътя Пловдив - Ягодово. Категория 3, 8421кв.м., тел.: 0876076772",,,False,продава,земя,Пловдив,Област Пловдив,0876076772,,https:None,https://www.imot.bg/pcgi/imot.cgi?act=5&adv=1s172130154845730&slink=bt2aub&f1=12,,,,imotbg,618,,,,,,99b4255d800a7e68ffa3726da19f4629
Продава ЗЕМЕДЕЛСКА ЗЕМЯ,"Разсадник, кат. 3, 13 дка, Сгради в имота: 471 кв.м- обществена сграда 235 кв.м- обществена сграда 28 кв.м- обществена сграда   ..., тел.: 0878303508",,,False,продава,земя,Кубрат,Област Разград,0878303508,,https:None,https://www.imot.bg/pcgi/imot.cgi?act=5&adv=1s170236882608517&slink=bt2aub&f1=12,,,,imotbg,618,,,,,,11faa0d20b8e7f53f38b4ad418777662
Продава ЗЕМЕДЕЛСКА ЗЕМЯ,"Нива, кат. 3, 42 дка, 42 дка разделени на 2 имота 18дка и 24 дка, тел.: 0895604923",,,False,продава,земя,Духовец,Област Разград,0895604923,,https:None,https://www.imot.bg/pcgi/imot.cgi?act=5&adv=1s173999890797253&slink=bt2aub&f1=12,,,,imotbg,618,,,,,,825ad018efe2ffa141f3420b6dd202d2
Продава ЗЕМЕДЕЛСКА ЗЕМЯ,"Нива, кат. 3, 17.716 дка, Продавам нива  в с.Топчии,Разградска област,3-та категория,с идентификатор 72850.73.56 Нивата не се  ..., тел.: 0888343626",,,False,продава,земя,Топчии,Област Разград,0888343626,,https://toni55.imot.bg,https://www.imot.bg/pcgi/imot.cgi?act=5&adv=1s169211099155419&slink=bt2aub&f1=12,,,,imotbg,618,,,,,,d653cd93222745e9e273d0b0df98e58c
Продава ЗЕМЕДЕЛСКА ЗЕМЯ,"Нива, кат. 3, 30 дка, Продавам нива 30 дка в с.Топчии,Разградска област.Договорът изтича до една година,рента има,нивата е ..., тел.: 0888343626",,,False,продава,земя,Топчии,Област Разград,0888343626,,https://toni55.imot.bg,https://www.imot.bg/pcgi/imot.cgi?act=5&adv=1s169952925539745&slink=bt2aub&f1=12,,,,imotbg,618,,,,,,d653cd93222745e9e273d0b0df98e58c
Продава ЗЕМЕДЕЛСКА ЗЕМЯ,"Нива, кат. 3, 3.4 дка, Пътя Русе - София,  Агенция СТАР ХАУС продава 3.4 дка земеделска земя срещу ЖП Гара Долапите на главният път Русе- Софи ..., тел.: 0888979482",,,False,продава,земя,Русе,Област Русе,0888979482,,https://starhouse.imot.bg,https://www.imot.bg/pcgi/imot.cgi?act=5&adv=1s172725591048785&slink=bt2aub&f1=12,,,,imotbg,618,,,,,,2ed8dc8232a89981a538a307d32d7440
Продава ЗЕМЕДЕЛСКА ЗЕМЯ,"Зеленчукова градина, кат. 3, 4502 дка, кв. Средна кула,  Агенция 'Марая' Ви предлага за продажба равен парцел до асфалтов път, 3-та категория с площ 3502 кв ..., тел.: 0999 99 27 99",,,False,продава,земя,Русе,Област Русе,0999 99 27 99,,https://maraia.imot.bg,https://www.imot.bg/pcgi/imot.cgi?act=5&adv=1s173270085510048&slink=bt2aub&f1=12,,,,imotbg,618,,,,,,2ed8dc8232a89981a538a307d32d7440
Продава ЗЕМЕДЕЛСКА ЗЕМЯ,"Нива, кат. 3, с Аренден договор до 20.07.2029 г. и рента 80 лв./год., 36 дка, Продавам земя в с.Божичен,обработваема е,3-та категория,от които само 5 дка е 4-та категория.Аренден ..., тел.: 0888343626",,,False,продава,земя,Божичен,Област Русе,0888343626,,https://toni55.imot.bg,https://www.imot.bg/pcgi/imot.cgi?act=5&adv=1s171084956014332&slink=bt2aub&f1=12,,,,imotbg,618,,,,,,91dae2f1b3457441514fb2b5b9fe56a5
Продава ЗЕМЕДЕЛСКА ЗЕМЯ,"Гори и храсти в земеделска земя, кат. 3, 1 дка, Харманите, Продавам земеделска земя с орехови насаждения, трета категория в землището на с. Нисово. тел: 089560 ..., тел.: 082/51-98-51",,,False,продава,земя,Нисово,Област Русе,082/51-98-51,,https://avalonruse.imot.bg,https://www.imot.bg/pcgi/imot.cgi?act=5&adv=1s150876386530673&slink=bt2aub&f1=12,,,,imotbg,618,,,,,,9c34d0b73b2bcc60a515ba7f892cb78a
Продава ЗЕМЕДЕЛСКА ЗЕМЯ,"Нива, кат. 3, 24.429 дка, общ.Иваново, Предлагаме Ви нива  с големина 24 ,429 дка намираща се в село Нисово , местност Галица ., тел.: 0898770915",,,False,продава,земя,Нисово,Област Русе,0898770915,,https:None,https://www.imot.bg/pcgi/imot.cgi?act=5&adv=1s168538799049072&slink=bt2aub&f1=12,,,,imotbg,618,,,,,,9c34d0b73b2bcc60a515ba7f892cb78a
Продава ЗЕМЕДЕЛСКА ЗЕМЯ,"Нива, кат. 3, 15 дка, Продаваме 15 декара ниви и 600м2 лозе в район с. Помен и гр. Бяла Русенско. Земята е в Дунавската ра ..., тел.: 0877730080",,,False,продава,земя,Помен,Област Русе,0877730080,,https://alfaomega.imot.bg,https://www.imot.bg/pcgi/imot.cgi?act=5&adv=1s172529784951427&slink=bt2aub&f1=12,,,,imotbg,618,,,,,,57c9183e2688997508494129b494d854
Продава ЗЕМЕДЕЛСКА ЗЕМЯ,"Нива, кат. 3, с Аренден договор до 30.09.2024 г. и рента 85 лв./год., 5 дка, м. Барата , Икономически център 'КОМОР' отдел недвижими имоти предлага на вашето внимание земеделска земя в с. С ..., тел.: 0876677595",,,False,продава,земя,Сандрово,Област Русе,0876677595,,https://komor.imot.bg,https://www.imot.bg/pcgi/imot.cgi?act=5&adv=1s170852443134921&slink=bt2aub&f1=12,,,,imotbg,618,,,,,,7991ffc2695761706653a7a1e4e0545c
Продава ЗЕМЕДЕЛСКА ЗЕМЯ,"Овощна градина, кат. 3, 28 дка, ЕРА  недвижими имоти офис Лидер Ви предлага за продажба овощни орехови градини в активно плододаване ..., тел.: 0877688449",,,False,продава,земя,Семерджиево,Област Русе,0877688449,,https://eralider.imot.bg,https://www.imot.bg/pcgi/imot.cgi?act=5&adv=1s171024468242119&slink=bt2aub&f1=12,,,,imotbg,618,,,,,,5b54ae909a7457228e400dba9b95cefe
Продава ЗЕМЕДЕЛСКА ЗЕМЯ,"Зеленчукова градина, кат. 3, 0.649 дка, център, Продавам земя за зеленчукови култури в с.Табачка,местност 'До селото'649 кв.м.,на центъра, зад кметс ..., тел.: 0888343626",,,False,продава,земя,Табачка,Област Русе,0888343626,,https://toni55.imot.bg,https://www.imot.bg/pcgi/imot.cgi?act=5&adv=1s166981216044210&slink=bt2aub&f1=12,,,,imotbg,618,,,,,,13818a5d310a4287c7fe9b1d881e0a03
Продава ЗЕМЕДЕЛСКА ЗЕМЯ,"Нива, кат. 3, с Аренден договор до 01.10.2032 г. и рента 1500 лв./год., 20 дка, Дуана Сърт, Продавам 20 дка. земеделска земя трета категория в село Голеш, местност Дуана Сърт, община Кайнарджа ..., тел.: 0878409301",,,False,продава,земя,Голеш,Област Силистра,0878409301,,https:None,https://www.imot.bg/pcgi/imot.cgi?act=5&adv=1s173686955544268&slink=bt2aub&f1=12,,,,imotbg,618,,,,,,665a7748a5f0a3acc9a39127b32060d1
Продава ЗЕМЕДЕЛСКА ЗЕМЯ,"Нива, кат. 3, с Аренден договор до 30.06.2026 г. и рента 110 лв./год., 8 дка,  Площ 7,795дка. Разположена е на 240м. от асфалтов път., тел.: 0888320829",,,False,продава,земя,Господиново,Област Силистра,0888320829,,https://emonamaritime.imot.bg,https://www.imot.bg/pcgi/imot.cgi?act=5&adv=1s170550383620822&slink=bt2aub&f1=12,,,,imotbg,618,,,,,,e7afcd779adb70e1993440f682216209
