raw_title,raw_description,price,currency,without_dds,offer_type,property_type,city,neighborhood,contact_info,agency,agency_url,details_url,num_photos,date_time_added,search_url,site,total_offers,ref_no,time,price_per_m2,area,floor,fingerprint_hash
"продаваДвустаен апартамент,51 м2","Двустаен апартамент в добро състояние, на кръстовището на бул. Гоце Делчев и бул. България. Жилището се продава с налично обзавеждане при желание от бъдещия купувач. Разпределение: входно антре,...",200900.0,EUR,False,продава,двустаен,София,Белите брези,,продава,,https://www.imoti.net/bg/obiava/prodava/sofia/belite-brezi/dvustaen/6199027/?sid=iKI3oo&page=1,12,2026-02-03 06:15:00.444039,,imotinet,,,,Цена на /м2/:3 939EUR/7 704.44BGN,51 м2,Етаж: 6 от 11,b2f2bf80a022fa0dac67d6df52e9d163
"продаваДвустаен апартамент,59 м2","Двустаен апартамент в добро състояние, на кръстовището на бул. Гоце Делчев и бул. България. Жилището се продава с налично обзавеждане при желание от бъдещия купувач. Разпределение: входно антре,...",200900.0,EUR,False,продава,двустаен,София,Хиподрума,,продава,,https://www.imoti.net/bg/obiava/prodava/sofia/hipodruma/dvustaen/6199028/?sid=iKI3oo&page=1,12,2026-02-03 06:15:00.444847,,imotinet,,,,Цена на /м2/:3 405EUR/6 659.77BGN,59 м2,Етаж: 6 от 11,0cb7d10773418aebc07cc1d8ebfbe075
"продаваДвустаен апартамент,65 м2","Непреходен двустаен апартамент с едностранно южно изложение, състоящ се от две стаи, кухненски бокс с трапезария, баня с тоалетна и голяма тераса. Жилищната сграда се намира в характерната за горен...",259990.0,EUR,False,продава,двустаен,София,Лозенец,,продава,,https://www.imoti.net/bg/obiava/prodava/sofia/lozenec/dvustaen/6192324/?sid=iKI3oo&page=1,15,2026-02-03 06:15:00.445666,,imotinet,,,,Цена на /м2/:4 000EUR/7 823.02BGN,65 м2,Етаж: 4 от 4,b8213cd1d77377d2801499549e4bd801
"продаваТристаен апартамент,127 м2","Предлагаме за продажба голям и светъл тристаен апартамент със застроена площ от 127 кв.м., разположен във вътрешната част на квартала, в спокойна и озеленена зона с отлична инфраструктура....",370000.0,EUR,False,продава,тристаен,София,Лагера,,продава,,https://www.imoti.net/bg/obiava/prodava/sofia/lagera/tristaen/6147251/?sid=iKI3oo&page=1,26,2026-02-03 06:15:00.446425,,imotinet,,,,Цена на /м2/:2 913EUR/5 698.09BGN,127 м2,Етаж: 3 от 6,451605c6e4ff6d01253bd67321d02b8d
"продаваЧетиристаен апартамент,170 м2","RealNet продава просторен и функционален четиристаен апартамент, със застроена площ от 150 кв.м. (около 170 кв.м. с включени идеални части от общите части на сградата), находящ се на първи...",499000.0,EUR,False,продава,четиристаен,София,Лозенец,,продава,,https://www.imoti.net/bg/obiava/prodava/sofia/lozenec/chetiristaen/6181104/?sid=iKI3oo&page=1,14,2026-02-03 06:15:00.447175,,imotinet,,,,Цена на /м2/:2 935EUR/5 740.94BGN,170 м2,Етаж: 2 от 6,cb9658230b526c917034f3c3da6dd7d0
"продаваТристаен апартамент,201 м2","Представяме тристаен апартамент за продажба, част от нова сграда със смесено предназначение в кв. ""Лозенец"", гр. София.Сградата е с получен Акт 16.Районът е един от...",603240.0,EUR,False,продава,тристаен,София,Лозенец,,продава,,https://www.imoti.net/bg/obiava/prodava--v-stroej/sofia/lozenec/tristaen/5750082/?sid=iKI3oo&page=1,24,2026-02-03 06:15:00.448001,,imotinet,,,,Цена на /м2/:3 001EUR/5 869.83BGN,201 м2,Етаж:  от 9,494dfc3bceb1e277fcbf6601a0a458ad
"продаваТристаен апартамент,170 м2","A P A R T M E N T  0 1 2С Апартамент 012 ELEHOME ви предлага една изключително красива, функционална и резонираща с нашето ежедневие и съвременност архитектура. Семпла, изчистена и...",615000.0,EUR,False,продава,тристаен,София,Лозенец,,продава,,https://www.imoti.net/bg/obiava/prodava/sofia/lozenec/tristaen/5566759/?sid=iKI3oo&page=1,12,2026-02-03 06:15:00.448754,,imotinet,,,,Цена на /м2/:3 618EUR/7 075.50BGN,170 м2,Етаж: 3 от 8,19119fdad135d55fd96e2973bc1da39a
"продаваДвустаен апартамент,47 м2","Премиер Истейтс продава ексклузивно, жилище, разполжено на 8-ми етаж от 8, в сграда панелно сторителство от 1982-ра година, със ЗП от 46,37 кв.м и мазе, без тераса.Изложение...",140000.0,EUR,False,продава,двустаен,София,Лагера,,продава,,https://www.imoti.net/bg/obiava/prodava/sofia/lagera/dvustaen/6201830/?sid=iKI3oo&page=1,10,2026-02-03 06:15:00.449456,,imotinet,,,,Цена на /м2/:2 979EUR/5 825.88BGN,47 м2,Етаж: 8 от 8,adf4acda6f5dc9a4996b91227c15477d
"продаваДвустаен апартамент,45 м2","Продава се двустаен апартамент в кв. Лагера първи етаж, източно изложениеЛокация: кв. Лагера тиха и добре уредена част на София, с удобен достъп до центъра, градски транспорт (трамвай,...",160000.0,EUR,False,продава,двустаен,София,Лагера,,продава,,https://www.imoti.net/bg/obiava/prodava/sofia/lagera/dvustaen/6183919/?sid=iKI3oo&page=1,14,2026-02-03 06:15:00.450249,,imotinet,,,,Цена на /м2/:3 556EUR/6 954.06BGN,45 м2,Етаж: 1 от 4,4438766433e147ff97b8816aece2e7d3
"продаваДвустаен апартамент,45 м2","Компания `ЕКС` представя на Вашето внимание двустаен апартамент в ж.к. Лагера.МЕСТОПОЛОЖЕНИЕ: В близост ще намерите различни транспортни връзки, училища, детски градини и търговски...",179000.0,EUR,False,продава,двустаен,София,Лагера,,продава,,https://www.imoti.net/bg/obiava/prodava/sofia/lagera/dvustaen/6107928/?sid=iKI3oo&page=1,1,2026-02-03 06:15:00.450951,,imotinet,,,,Цена на /м2/:3 978EUR/7 779.86BGN,45 м2,Етаж: 3 от 6,f822bb01f3a47863bd03cdd68888d42b
"продаваДвустаен апартамент,45 м2","Светло двустайно жилище с югоизточно изложение, на 12-ти, последен етаж , с панорамни гледки към планината. Състои се от просторна дневна, спалня, обособен кухненески бокс,...",179000.0,EUR,False,продава,двустаен,София,Стрелбище,,продава,,https://www.imoti.net/bg/obiava/prodava/sofia/strelbishte/dvustaen/6197115/?sid=iKI3oo&page=1,14,2026-02-03 06:15:00.451627,,imotinet,,,,Цена на /м2/:3 978EUR/7 779.86BGN,45 м2,Етаж: 12 от 12,f822bb01f3a47863bd03cdd68888d42b
"продаваДвустаен апартамент,50 м2",,180000.0,EUR,False,продава,двустаен,София,Лагера,,продава,,https://www.imoti.net/bg/obiava/prodava/sofia/lagera/dvustaen/6099325/?sid=iKI3oo&page=1,6,2026-02-03 06:15:00.452318,,imotinet,,,,Цена на /м2/:3 600EUR/7 040.99BGN,50 м2,Етаж: 14 от 18,23445a86aefc548450dab3aca7433c7c
"продаваТристаен апартамент,55 м2","За повече информация свържете се с нас и цитирайте референтния номер на имота. Моля, кажете, че сте видeли обявата в imoti.net.Референтен номер: Sfa 87954Тел: 0882 817...",185000.0,EUR,False,продава,тристаен,София,Лозенец,,продава,,https://www.imoti.net/bg/obiava/prodava/sofia/lozenec/tristaen/6195910/?sid=iKI3oo&page=1,16,2026-02-03 06:15:00.453090,,imotinet,,,,Цена на /м2/:3 364EUR/6 578.70BGN,55 м2,Етаж:  от 1,4b4148ab30b208dc4d111885ac1d75fd
"продаваДвустаен апартамент,50 м2","Хоум Лайт предлага на Вашето внимание двустаен апартамент, разположен на метри от Южен парк в един от най- желаните райони на южна София, кв. Стрелбище.Тих, спокоен и зелен район с отлично...",190000.0,EUR,False,продава,двустаен,София,Стрелбище,,продава,,https://www.imoti.net/bg/obiava/prodava/sofia/strelbishte/dvustaen/6098655/?sid=iKI3oo&page=1,1,2026-02-03 06:15:00.453776,,imotinet,,,,Цена на /м2/:3 800EUR/7 432.15BGN,50 м2,Етаж: 3 от 14,a368c3b6c5bbb600f81a2e36d29ba14e
"продаваДвустаен апартамент,65 м2","Просторен двустаен апартамент с южно изложение в ж.к. Стрелбище!Представяме ви слънчев и уютен апартамент, разположен на девети етаж в добре поддържана панелна сграда в един от...",190000.0,EUR,False,продава,двустаен,София,Стрелбище,,продава,,https://www.imoti.net/bg/obiava/prodava/sofia/strelbishte/dvustaen/6152176/?sid=iKI3oo&page=1,15,2026-02-03 06:15:00.454490,,imotinet,,,,Цена на /м2/:2 923EUR/5 717.04BGN,65 м2,Етаж: 9 от 9,d6146a39fa44193ab36a0f36a7ae7d05
"продаваДвустаен апартамент,64 м2","МЕТРО!ПАЗАР КРАСНО СЕЛО!Предстоящо строителство на малка и кокетна сграда в един от най-предпочитаните райони за живеене, а именно район Красно село. Висок клас...",192000.0,EUR,False,продава,двустаен,София,Белите брези,,продава,,https://www.imoti.net/bg/obiava/prodava--v-stroej/sofia/belite-brezi/dvustaen/6139302/?sid=iKI3oo&page=1,1,2026-02-03 06:15:00.455213,,imotinet,,,,Цена на /м2/:3 000EUR/5 867.49BGN,64 м2,Етаж: 3 от 6,22f09e4844323c495e75e6c326435c5c
"продаваДвустаен апартамент,62 м2","ЕРА Голд представя двустаен апартамент в новострояща се сграда в ж.к. Стрелбище на перфектна локация в близост до бул. България, супермаркет Фантастико, не далеч от Южен Парк, в близост до...",192617.0,EUR,False,продава,двустаен,София,Стрелбище,,продава,,https://www.imoti.net/bg/obiava/prodava--v-stroej/sofia/strelbishte/dvustaen/6037572/?sid=iKI3oo&page=1,2,2026-02-03 06:15:00.455882,,imotinet,,,,Цена на /м2/:3 107EUR/6 076.23BGN,62 м2,Етаж: 6 от 8,5ccc6a51e902bae98b808764828d95aa
"продаваДвустаен апартамент,62 м2","Компания `ЕКС` представя на Вашето внимание двустаен апартамент в ж.к. Стрелбище.МЕСТОПОЛОЖЕНИЕ: В близост до спирки на градски транспорт, училище, магазини от всякакъв тип....",192617.0,EUR,False,продава,двустаен,София,Стрелбище,,продава,,https://www.imoti.net/bg/obiava/prodava/sofia/strelbishte/dvustaen/6001078/?sid=iKI3oo&page=1,1,2026-02-03 06:15:00.456596,,imotinet,,,,Цена на /м2/:3 107EUR/6 076.23BGN,62 м2,Етаж: 6 от 8,5ccc6a51e902bae98b808764828d95aa
"продаваДвустаен апартамент,72 м2","За повече информация свържете се с нас и цитирайте референтния номер на имота. Моля, кажете, че сте видeли обявата в imoti.net.Референтен номер: Sfa 85507Тел: 0882 817...",192617.0,EUR,False,продава,двустаен,София,Стрелбище,,продава,,https://www.imoti.net/bg/obiava/prodava--v-stroej/sofia/strelbishte/dvustaen/5957311/?sid=iKI3oo&page=1,20,2026-02-03 06:15:00.457375,,imotinet,,,,Цена на /м2/:2 675EUR/5 232.31BGN,72 м2,Етаж: 1 от 8,d5b6ba29014474b96882658fd61521a6
"продаваДвустаен апартамент,67 м2","Двустаен апартамент в новострояща се жилищна сграда пред Акт 14, жк. Лагера, гр. София.Очакван Акт 16 - Декември 2026г.Основни характеристики:Обща площ - 67 кв.м, чиста...",196286.0,EUR,False,продава,двустаен,София,Лагера,,продава,,https://www.imoti.net/bg/obiava/prodava/sofia/lagera/dvustaen/6192218/?sid=iKI3oo&page=1,2,2026-02-03 06:15:00.458100,,imotinet,,,,Цена на /м2/:2 930EUR/5 729.88BGN,67 м2,Етаж: 3 от 6,627235e70e17c9ad7b1675b0fb280081
"продаваДвустаен апартамент,75 м2",.  .  .  .  .  .  .  .  .  .  .  .  .  .  .  .  .  .  .  .  .  .  .  .  .  .  .  .  .  . НОВ .  .  .  .  .  .  .  .  .  .  .  .  .  .  .  .  .  .  .  .  .  .  .  .  .  .  .  .  .  .С А16...,198000.0,EUR,False,продава,двустаен,София,Хладилника,,продава,,https://www.imoti.net/bg/obiava/prodava/sofia/hladilnika/dvustaen/6020840/?sid=iKI3oo&page=1,1,2026-02-03 06:15:00.458794,,imotinet,,,,Цена на /м2/:2 640EUR/5 163.39BGN,75 м2,Етаж: 5 от 11,e2771f362ce4bebf86b7cb17c1944728
"продаваДвустаен апартамент,66 м2",,199999.0,EUR,False,продава,двустаен,София,Лагера,,продава,,https://www.imoti.net/bg/obiava/prodava/sofia/lagera/dvustaen/6032520/?sid=iKI3oo&page=1,16,2026-02-03 06:15:00.459535,,imotinet,,,,Цена на /м2/:3 030EUR/5 926.73BGN,66 м2,Етаж: 2 от 6,749deab6fc505e469419ead3241478da
"продаваТристаен апартамент,74 м2","Тристаен апартамент, състоящ се от: една стая, дневна, столова кухненски бокс и други сервизни помещения, със застроена площ от 73,84 в цената е включен и 22 кв.м. надземен гаражИмота...",200000.0,EUR,False,продава,тристаен,София,Стрелбище,,продава,,https://www.imoti.net/bg/obiava/prodava/sofia/strelbishte/tristaen/6165825/?sid=iKI3oo&page=1,3,2026-02-03 06:15:00.460247,,imotinet,,,,Цена на /м2/:2 703EUR/5 286.03BGN,74 м2,Етаж: 6 от 9,bdb791ae11fa1836ad2ed5776908fb60
"продаваДвустаен апартамент,72 м2","Предлагаме уютен  двустаен апартамент с площ 72 кв.м (застроена площ 59.40 кв.м), разположен в един от най-предпочитаните и зелени квартали на София – кв. Лагера....",207900.0,EUR,False,продава,двустаен,София,Лагера,,продава,,https://www.imoti.net/bg/obiava/prodava/sofia/lagera/dvustaen/6200620/?sid=iKI3oo&page=1,5,2026-02-03 06:15:00.460965,,imotinet,,,,Цена на /м2/:2 888EUR/5 647.46BGN,72 м2,Етаж: 2 от 7,c92d1bf9af5f3f66dd6c975e2c7a98e0
"продаваДвустаен апартамент,42 м2",Референтен номер: 2094783Революшън Естейт представя Двустаен апартамент в ж.к. Хиподрума.- Етаж: 1-ви от 3-ти.- Площ: 42 кв.м.- Разпределение:...,210000.0,EUR,False,продава,двустаен,София,Хиподрума,,продава,,https://www.imoti.net/bg/obiava/prodava/sofia/hipodruma/dvustaen/6141285/?sid=iKI3oo&page=1,10,2026-02-03 06:15:00.461684,,imotinet,,,,Цена на /м2/:5 000EUR/9 779.15BGN,42 м2,Етаж: 1 от 3,8e07a0c7b135a91a39788b91df650de4
"продаваДвустаен апартамент,57 м2","Предлагаме Ви двустаен обзаведен апартамент в кв Лагера. С възможнист за промяна в тристаен. Състои се от входно антре, всекидневна с кухненски бокс, спалня, баня с тоалетна, балкон. Югоизточно...",215990.0,EUR,False,продава,двустаен,София,Лагера,,продава,,https://www.imoti.net/bg/obiava/prodava/sofia/lagera/dvustaen/6088727/?sid=iKI3oo&page=1,8,2026-02-03 06:15:00.462382,,imotinet,,,,Цена на /м2/:3 789EUR/7 411.22BGN,57 м2,Етаж: 9 от 9,bb3ba8c7eed0b834aa46ae4229a405de
"продаваДвустаен апартамент,78 м2",New Estates има удоволствието да ви представи нова бутикова сграда в един от най-желаните райони в София - кв. Лозенец. Районът е добре позициониран от гледна точка на комуникации и достъпност в...,217775.0,EUR,False,продава,двустаен,София,Лозенец,,продава,,https://www.imoti.net/bg/obiava/prodava--v-stroej/sofia/lozenec/dvustaen/5759535/?sid=iKI3oo&page=1,17,2026-02-03 06:15:00.463084,,imotinet,,,,Цена на /м2/:2 792EUR/5 460.65BGN,78 м2,Етаж: 3 от 7,c971713090d42031e87e420bae7662e1
"продаваДвустаен апартамент,69 м2","Двустаен апартамент със застроена площ от 60кв.м. На метри от Метростанция ""Красно село"". Жилището се намира в новострояща се сграда, на четвърти жилищен етаж и се състои от входно...",217800.0,EUR,False,продава,двустаен,София,Лагера,,продава,,https://www.imoti.net/bg/obiava/prodava/sofia/lagera/dvustaen/6157925/?sid=iKI3oo&page=1,8,2026-02-03 06:15:00.463751,,imotinet,,,,Цена на /м2/:3 157EUR/6 173.62BGN,69 м2,Етаж: 4 от 7,9e470bc2b807e90d385279fe03d12b84
"продаваДвустаен апартамент,76 м2","Пред Акт 14 - 02.2026 г. Акт 16 - 11.2026 г.Представяме двустаен апартамент за продажба в атрактивна сграда ново строителство на топ локация в кв. ""Стрелбище"", в близост до булеварди...",218526.0,EUR,False,продава,двустаен,София,Стрелбище,,продава,,https://www.imoti.net/bg/obiava/prodava--v-stroej/sofia/strelbishte/dvustaen/6026314/?sid=iKI3oo&page=1,3,2026-02-03 06:15:00.464457,,imotinet,,,,Цена на /м2/:2 875EUR/5 623.68BGN,76 м2,Етаж:  от 8,1ac8839c84f2222ed24725411fd3274b
"продаваДвустаен апартамент,81 м2",РС ЕСТЕЙТС предлага за продажба:Двустаен апартамент в новострояща се луксозна сграда „Twin Tower“ – модерен жилищен проект в премиум градска среда. Първата бранд жилищна сграда у...,220000.0,EUR,False,продава,двустаен,София,Лозенец,,продава,,https://www.imoti.net/bg/obiava/prodava/sofia/lozenec/dvustaen/6154486/?sid=iKI3oo&page=1,12,2026-02-03 06:15:00.465160,,imotinet,,,,Цена на /м2/:2 716EUR/5 312.13BGN,81 м2,Етаж: 7 от 24,56c1f7ff2cc0e4fc3c0c7196861acb1c
"продаваДвустаен апартамент,69 м2","ЕРА Младост продава апартамент в сграда с разрешение за ползване от 2024 година,  в динамично развиващия се район Хладилника на община Лозенец, в частта известна като „белия квартал“. В...",223200.0,EUR,False,продава,двустаен,София,Хладилника,,продава,,https://www.imoti.net/bg/obiava/prodava/sofia/hladilnika/dvustaen/6155708/?sid=iKI3oo&page=2,1,2026-02-03 06:15:04.777414,,imotinet,,,,Цена на /м2/:3 235EUR/6 326.68BGN,69 м2,Етаж: 9 от 11,43715cc4559ee3981480b2fb041cac74
"продаваДвустаен апартамент,78 м2",АКТ 14 МАРТ НА 2026г.!АКТ 15 КРАЯ НА 2026!АКТ 16 НАЧАЛОТО НА 2027!ИРИДА НЕДВИЖИМИ ИМОТИ продава просторен двустаен апартамент в сграда с изключително висококачествено...,224596.0,EUR,False,продава,двустаен,София,Стрелбище,,продава,,https://www.imoti.net/bg/obiava/prodava--v-stroej/sofia/strelbishte/dvustaen/6038321/?sid=iKI3oo&page=2,6,2026-02-03 06:15:04.778194,,imotinet,,,,Цена на /м2/:2 879EUR/5 631.69BGN,78 м2,Етаж: 7 от 8,58e126723ea18a88a2dd0e4d2130e1f4
"продаваДвустаен апартамент,78 м2","ЕРА Голд представя двустаен апартамент в новострояща се сграда в ж.к. Стрелбище на перфектна локация в близост до бул. България, супермаркет Фантастико, не далеч от Южен Парк, в близост до...",224596.0,EUR,False,продава,двустаен,София,Стрелбище,,продава,,https://www.imoti.net/bg/obiava/prodava--v-stroej/sofia/strelbishte/dvustaen/6037574/?sid=iKI3oo&page=2,2,2026-02-03 06:15:04.778869,,imotinet,,,,Цена на /м2/:2 879EUR/5 631.69BGN,78 м2,Етаж: 7 от 8,58e126723ea18a88a2dd0e4d2130e1f4
"продаваДвустаен апартамент,83 м2","Слънчев, двустаен, напълно обзаведен апартамент на трети среден етаж от седем, в тухлена сграда с квадратура 83 кв.м. / 70 кв.м застроена площ/ и следното разпределение: коридор, много...",225000.0,EUR,False,продава,двустаен,София,Хиподрума,,продава,,https://www.imoti.net/bg/obiava/prodava/sofia/hipodruma/dvustaen/6070405/?sid=iKI3oo&page=2,9,2026-02-03 06:15:04.779549,,imotinet,,,,Цена на /м2/:2 711EUR/5 301.95BGN,83 м2,Етаж: 3 от 7,4ddc225760208089ca16c1bb127ff14a
"продаваДвустаен апартамент,79 м2","АКТ 14 МАРТ НА 2026г.!АКТ 15 КРАЯ НА 2026!АКТ 16 НАЧАЛОТО НА 2027!ИРИДА НЕДВИЖИМИ ИМОТИ продава двустаен апартамент в новоизграждаща се сграда, с изключително...",227000.0,EUR,False,продава,двустаен,София,Стрелбище,,продава,,https://www.imoti.net/bg/obiava/prodava--v-stroej/sofia/strelbishte/dvustaen/6038123/?sid=iKI3oo&page=2,6,2026-02-03 06:15:04.780307,,imotinet,,,,Цена на /м2/:2 873EUR/5 619.92BGN,79 м2,Етаж: 0 от 8,5180e2dc14ae64b7a5310787b1be030a
"продаваДвустаен апартамент,75 м2","Просторен тухлен апартамент в нова сграда, в района на Военномедицинска академия, супермаркет БИЛА, ул. Св. Георги Софийски и Медицинска академия.Съобразно, изключително привлекателното и...",230000.0,EUR,False,продава,двустаен,София,Лагера,,продава,,https://www.imoti.net/bg/obiava/prodava/sofia/lagera/dvustaen/6179093/?sid=iKI3oo&page=2,7,2026-02-03 06:15:04.781005,,imotinet,,,,Цена на /м2/:3 067EUR/5 997.88BGN,75 м2,Етаж: 2 от 6,497ec6002d16afbbdcc016ac664c820e
