raw_title,raw_description,price,currency,without_dds,offer_type,property_type,city,neighborhood,contact_info,agency,agency_url,details_url,num_photos,date_time_added,search_url,site,total_offers,ref_no,time,price_per_m2,area,floor
"продаваДвустаен апартамент,62 м2",Референтен номер: 2098010Революшън Естейт представя Двустаен апартамент в ж.к. Сухата река.- Етаж: 10-ти от 14-ти.- Площ: 62 кв.м.- Разпределение:...,150000.0,EUR,False,продава,двустаен,София,Суха Река,,продава,,https://www.imoti.net/bg/obiava/prodava/sofia/suha-reka/dvustaen/6168855/?sid=gFM8jD&page=1,4,2026-01-23 22:36:02.269232,,imotinet,0,,,Цена на /м2/:2 419EUR/4 731.85BGN,62 м2,Етаж: 10 от 14
"продаваДвустаен апартамент,65 м2",Продава се апартамент с потенциал за преустройство на тристаен в кв. „Редута“ – отличен избор за дом или инвестиция!Предлагаме на Вашето внимание светъл и функционален апартамент тип...,189000.0,EUR,False,продава,двустаен,София,Редута,,продава,,https://www.imoti.net/bg/obiava/prodava/sofia/reduta/dvustaen/6177224/?sid=gFM8jD&page=1,17,2026-01-23 22:36:02.270090,,imotinet,0,,,Цена на /м2/:2 908EUR/5 686.95BGN,65 м2,Етаж: 7 от 9
"продаваТристаен апартамент,89 м2","Нов панорамен тристаен мезонет до пл. Родина в сграда с Акт 16 от 2022 г. Намира се до ул. Черковна, на 200 м. от метростанция Подуяне. Завършен луксозно до ключ. Топ- локация в широк център само...",215000.0,EUR,False,продава,тристаен,София,Подуене,,продава,,https://www.imoti.net/bg/obiava/prodava/sofia/poduene/tristaen/6125730/?sid=gFM8jD&page=1,36,2026-01-23 22:36:02.270838,,imotinet,0,,,Цена на /м2/:2 416EUR/4 724.76BGN,89 м2,Етаж: 8 от 9
"продаваДвустаен апартамент,88 м2","Пред акт 16!Метро!Слънце и зеленина!Това не е просто жилище, а дом, подсигуряващ красив уют, окъпан в целодневна слънчева светлина, красива гкедка към синята...",244997.0,EUR,False,продава,двустаен,София,Суха Река,,продава,,https://www.imoti.net/bg/obiava/prodava--v-stroej/sofia/suha-reka/dvustaen/6203511/?sid=gFM8jD&page=1,9,2026-01-23 22:36:02.271606,,imotinet,0,,,Цена на /м2/:2 784EUR/5 445.14BGN,88 м2,Етаж: 5 от 10
"продаваДвустаен апартамент,68 м2","Предлагаме за продажба двустаен апартамент в малка, бутикова сграда в кв.Сухата река.-Функционално разпределение - антре, просторна дневна с кухненски бокс, спалня, баня с тоалетна,...",115000.0,EUR,False,продава,двустаен,София,Суха Река,,продава,,https://www.imoti.net/bg/obiava/prodava/sofia/suha-reka/dvustaen/6185297/?sid=gFM8jD&page=1,4,2026-01-23 22:36:02.272376,,imotinet,0,,,Цена на /м2/:1 691EUR/3 307.65BGN,68 м2,Етаж: 2 от 4
"продаваДвустаен апартамент,47 м2","Нов среден южен партерен имот със статут офис. Сграда с Акт 16 от 2024 г.ТЕЦ.Топ - локация в широк център, непосредствено до ул. Черковна. Сградата е на 200 метра от метростанция, 1040 м....",115000.0,EUR,False,продава,двустаен,София,Суха Река,,продава,,https://www.imoti.net/bg/obiava/prodava/sofia/suha-reka/dvustaen/6044312/?sid=gFM8jD&page=1,6,2026-01-23 22:36:02.273081,,imotinet,0,,,Цена на /м2/:2 447EUR/4 785.54BGN,47 м2,Етаж: 1 от 9
"продаваДвустаен апартамент,47 м2","Нов среден южен партерен имот със статут офис. Сграда с Акт 16 от 2024 г.ТЕЦ.Топ - локация в широк център, непосредствено до ул. Черковна. Сградата е на 200 метра от метростанция, 1040 м....",115000.0,EUR,False,продава,двустаен,София,Подуене,,продава,,https://www.imoti.net/bg/obiava/prodava/sofia/poduene/dvustaen/6044314/?sid=gFM8jD&page=1,16,2026-01-23 22:36:02.273776,,imotinet,0,,,Цена на /м2/:2 447EUR/4 785.54BGN,47 м2,Етаж: 1 от 9
"продаваДвустаен апартамент,47 м2","Нов среден южен партерен имот със статут офис. Сграда с Акт 16 от 2024 г.ТЕЦ.Топ - локация в широк център, непосредствено до ул. Черковна. Сградата е на 200 метра от метростанция, 1040 м....",115000.0,EUR,False,продава,двустаен,София,Оборище,,продава,,https://www.imoti.net/bg/obiava/prodava/sofia/oborishte/dvustaen/6044316/?sid=gFM8jD&page=1,9,2026-01-23 22:36:02.274464,,imotinet,0,,,Цена на /м2/:2 447EUR/4 785.54BGN,47 м2,Етаж: 1 от 9
"продаваДвустаен апартамент,42 м2",Реф. № 0127183D Виртуална разходка из апартамента -> https://my.matterport.com/show/?m=Q72j4CwkyidАгенция за недвижими имоти BAS Properties предлага за продажба двустаен...,120000.0,EUR,False,продава,двустаен,София,Суха Река,,продава,,https://www.imoti.net/bg/obiava/prodava/sofia/suha-reka/dvustaen/6195170/?sid=gFM8jD&page=1,8,2026-01-23 22:36:02.275178,,imotinet,0,,,Цена на /м2/:2 857EUR/5 588.09BGN,42 м2,Етаж: 2 от 8
"продаваДвустаен апартамент,59 м2","Двустаен апартамент състоящ се от: антре, дневна с кухненски бокс, спралня, баня с тоалетна и тераса. Към жилището има прилежащо мазе.Има възможност за закупуване на паркомясто.",125550.0,EUR,False,продава,двустаен,София,Суха Река,,продава,,https://www.imoti.net/bg/obiava/prodava/sofia/suha-reka/dvustaen/6110135/?sid=gFM8jD&page=1,7,2026-01-23 22:36:02.275886,,imotinet,0,,,Цена на /м2/:2 128EUR/4 161.94BGN,59 м2,Етаж: 2 от 5
"продаваДвустаен апартамент,63 м2","Двустаен апартамент състоящ се от: антре, дневна с кухненски бокс, спралня, баня с тоалетна и тераса. Към жилището има прилежащо мазе.Има възможност за закупуване на паркомясто.",126600.0,EUR,False,продава,двустаен,София,Суха Река,,продава,,https://www.imoti.net/bg/obiava/prodava/sofia/suha-reka/dvustaen/6177556/?sid=gFM8jD&page=1,7,2026-01-23 22:36:02.276580,,imotinet,0,,,Цена на /м2/:2 010EUR/3 930.29BGN,63 м2,Етаж: 2 от 5
"продаваЧетиристаен апартамент,86 м2","Имоти Премиер предлага на Вашето внимание имот със статут на апартамент в кв. Оборище.Намира се на полусутерен в тухлена сграда. Състои се от 4 помещения, два санитарни възела и има...",126800.0,EUR,False,продава,четиристаен,София,Оборище,,продава,,https://www.imoti.net/bg/obiava/prodava/sofia/oborishte/chetiristaen/5885595/?sid=gFM8jD&page=1,11,2026-01-23 22:36:02.277335,,imotinet,0,,,Цена на /м2/:1 474EUR/2 883.71BGN,86 м2,Етаж: 0 от 5
"продаваДвустаен апартамент,40 м2","Слънчева гарсониера преустроена на двустаен, находяща се на етаж 8. Има следното разпределение: дневна с кухненски бокс, отделна спалня, баня с WC, тераса. Имотът е практичен и функционален,...",129000.0,EUR,False,продава,двустаен,София,Суха Река,,продава,,https://www.imoti.net/bg/obiava/prodava/sofia/suha-reka/dvustaen/6129514/?sid=gFM8jD&page=1,7,2026-01-23 22:36:02.278020,,imotinet,0,,,Цена на /м2/:3 225EUR/6 307.55BGN,40 м2,Етаж: 8 от 8
"продаваДвустаен апартамент,40 м2","СВОБОДНО МЯСТО ЗА ПАРКИРАНЕ ! МЕТРОСТАНЦИЯ ! ТЕРАСА ! ГРАДСКИ ТРАНСПОРТПредлагаме едностаен апартамент с площ от 40 кв.м, разположен на 5/8 етаж в поддържана панелна сграда в...",130000.0,EUR,False,продава,двустаен,София,Суха Река,,продава,,https://www.imoti.net/bg/obiava/prodava/sofia/suha-reka/dvustaen/6176538/?sid=gFM8jD&page=1,6,2026-01-23 22:36:02.278712,,imotinet,0,,,Цена на /м2/:3 250EUR/6 356.45BGN,40 м2,Етаж: 5 от 8
"продаваДвустаен апартамент,67 м2","Агенция за недвижими имоти Пандора естейт продава ексклузивно.Реф. № 110163.Двустаен апартамент в кв. Дианабад, разположен в престижен район с отлични транспортни връзки....",130000.0,EUR,False,продава,двустаен,София,Дианабад,,продава,,https://www.imoti.net/bg/obiava/prodava/sofia/dianabad/dvustaen/6014130/?sid=gFM8jD&page=1,5,2026-01-23 22:36:02.279400,,imotinet,0,,,Цена на /м2/:1 940EUR/3 794.89BGN,67 м2,Етаж: 7 от 8
"продаваДвустаен апартамент,28 м2","Компания `ЕКС` представя на Вашето внимание двустаен апартамент в жк. Изток.МЕСТОПОЛОЖЕНИЕ: На метри от метростанция, спирка на градски транспорт, магазини от всякакъв тип и всичко...",135000.0,EUR,False,продава,двустаен,София,Изток,,продава,,https://www.imoti.net/bg/obiava/prodava/sofia/sofija-iztok/dvustaen/6203275/?sid=gFM8jD&page=1,9,2026-01-23 22:36:02.280097,,imotinet,0,,,Цена на /м2/:4 821EUR/9 429.89BGN,28 м2,Етаж: 1 от 5
"продаваДвустаен апартамент,40 м2","BG Broker предлага за продажба ремонтиран и преустроен двустаен апартамент (преустроена гарсониера) в кв. Сухата река, бл. 52, на бул. Ботевградско шосе, срещу 44 СУ „Неофит Бозвели“....",136000.0,EUR,False,продава,двустаен,София,Суха Река,,продава,,https://www.imoti.net/bg/obiava/prodava/sofia/suha-reka/dvustaen/6164405/?sid=gFM8jD&page=1,13,2026-01-23 22:36:02.280801,,imotinet,0,,,Цена на /м2/:3 400EUR/6 649.82BGN,40 м2,Етаж: 8 от 8
"продаваДвустаен апартамент,63 м2","МЕТРО!ТИШИНА!ЕЛЕГАНТНОСТ!ПРЕДПРОДАЖБА!СКОРО ОТНОВО ЩЕ ВДИГНЕМ ЦЕНАТА, ПОБЪРЗАЙТЕ!ВЕЧЕ 70% ОТ ЖИЛИЩАТА СА ЗАКУПЕНИ!Уникален мини...",144900.0,EUR,False,продава,двустаен,София,Подуене,,продава,,https://www.imoti.net/bg/obiava/prodava--v-stroej/sofia/poduene/dvustaen/5982550/?sid=gFM8jD&page=1,4,2026-01-23 22:36:02.281533,,imotinet,0,,,Цена на /м2/:2 300EUR/4 498.41BGN,63 м2,Етаж: 4 от 6
"продаваТристаен апартамент,90 м2","Агенция за недвижими имоти Пандора естейт продава ексклузивно.Реф. № 110185.Тристаен апартамент в кв. Дианабад.Цена: 155,000 евро.Площ: 90 кв.м.Етаж: 4 от...",155000.0,EUR,False,продава,тристаен,София,Дианабад,,продава,,https://www.imoti.net/bg/obiava/prodava/sofia/dianabad/tristaen/6019410/?sid=gFM8jD&page=1,5,2026-01-23 22:36:02.282252,,imotinet,0,,,Цена на /м2/:1 722EUR/3 368.37BGN,90 м2,Етаж: 4 от 8
"продаваДвустаен апартамент,62 м2","Продаваме непреходен, двустаен апартамент.Жилището се намира на 6-ти етаж от 8, вътрешно е и изключително топло.Изложенията са Югозапад/Североизток, като от всички стаи има...",156000.0,EUR,False,продава,двустаен,София,Суха Река,,продава,,https://www.imoti.net/bg/obiava/prodava/sofia/suha-reka/dvustaen/6177287/?sid=gFM8jD&page=1,17,2026-01-23 22:36:02.282977,,imotinet,0,,,Цена на /м2/:2 516EUR/4 921.12BGN,62 м2,Етаж: 6 от 8
"продаваТристаен апартамент,62 м2","Продаваме непреходен, двустаен апартамент.Жилището се намира на 6-ти етаж от 8, вътрешно е и изключително топло.Изложенията са Югозапад/Североизток, като от всички стаи има...",156000.0,EUR,False,продава,тристаен,София,Суха Река,,продава,,https://www.imoti.net/bg/obiava/prodava/sofia/suha-reka/tristaen/6177290/?sid=gFM8jD&page=1,17,2026-01-23 22:36:02.283673,,imotinet,0,,,Цена на /м2/:2 516EUR/4 921.12BGN,62 м2,Етаж: 6 от 8
"продаваДвустаен апартамент,28 м2","Открийте мястото, където ще се чувствате у дома от първия момент.Титан Пропъртис офис - Черни връх с радост предлага на Вашето внимание двустаен апартамент за продажба в ж.к. Изток....",159000.0,EUR,False,продава,двустаен,София,Изток,,продава,,https://www.imoti.net/bg/obiava/prodava/sofia/sofija-iztok/dvustaen/6199113/?sid=gFM8jD&page=1,8,2026-01-23 22:36:02.284354,,imotinet,0,,,Цена на /м2/:5 679EUR/11 106.32BGN,28 м2,Етаж: 1 от 4
"продаваДвустаен апартамент,53 м2","Mirador Real Estates има удоволствието да ви представи компактен Двустаен Апартамент в кв. Сура река ул. Тодорини кукли.Жилището е светло, топло, обзаведено и готово за нанасяне....",160000.0,EUR,False,продава,двустаен,София,Суха Река,,продава,,https://www.imoti.net/bg/obiava/prodava/sofia/suha-reka/dvustaen/6152540/?sid=gFM8jD&page=1,6,2026-01-23 22:36:02.285065,,imotinet,0,,,Цена на /м2/:3 019EUR/5 904.39BGN,53 м2,Етаж: 5 от 8
"продаваДвустаен апартамент,59 м2","ARCO REAL ESTATE предлага двустаен апартамент със застроена площ 51 кв.м., северозападно изложенив, в луксозна жилищна сграда на десет етажа в кв. Сухата река, на пет минути пешеходно разстояние от...",160000.0,EUR,False,продава,двустаен,София,Суха Река,,продава,,https://www.imoti.net/bg/obiava/prodava/sofia/suha-reka/dvustaen/6195584/?sid=gFM8jD&page=1,5,2026-01-23 22:36:02.285793,,imotinet,0,,,Цена на /м2/:2 712EUR/5 303.95BGN,59 м2,Етаж: 8 от 11
"продаваТристаен апартамент,67 м2","Предлагаме просторен тристаен апартамент с отлична локация – в непосредствена близост до парк „Герена“, пазар „Герена“, спирки на градски транспорт, училища, детска градина, супермаркет и...",163000.0,EUR,False,продава,тристаен,София,Суха Река,,продава,,https://www.imoti.net/bg/obiava/prodava/sofia/suha-reka/tristaen/6192490/?sid=gFM8jD&page=1,7,2026-01-23 22:36:02.286463,,imotinet,0,,,Цена на /м2/:2 433EUR/4 758.21BGN,67 м2,Етаж: 4 от 8
"продаваДвустаен апартамент,68 м2","Цена на инвеститор – 165 000 евро!!! БЕЗ КОМИСИОННА!!! Galiano Estates има удоволствието да ви представи слънчев двустаен апартамент в луксозна жилищна сграда, в кв. Подуяне, в близост до моста...",165000.0,EUR,False,продава,двустаен,София,Подуене,,продава,,https://www.imoti.net/bg/obiava/prodava/sofia/poduene/dvustaen/6139726/?sid=gFM8jD&page=1,5,2026-01-23 22:36:02.287201,,imotinet,0,,,Цена на /м2/:2 426EUR/4 745.76BGN,68 м2,Етаж: 6 от 9
"продаваТристаен апартамент,110 м2","Титан Пропъртис - офис Хиподрума с радост предлага на Вашето внимание тристаен апартамент в продажба в кв. Редута, София. Обща площ 110 кв.м. и функционално разпределение в нова четириетажна...",165000.0,EUR,False,продава,тристаен,София,Редута,,продава,,https://www.imoti.net/bg/obiava/prodava/sofia/reduta/tristaen/6158513/?sid=gFM8jD&page=1,3,2026-01-23 22:36:02.287880,,imotinet,0,,,Цена на /м2/:1 500EUR/2 933.75BGN,110 м2,Етаж: 1 от 4
"продаваТристаен апартамент,110 м2","Имоти Премиер представя уютен тристаен апартамент с отлична локация в кв. Редута, гр. София.С удоволствие ви запознаваме с този прекрасен имот, разположен в един от най-търсените и...",165000.0,EUR,False,продава,тристаен,София,Редута,,продава,,https://www.imoti.net/bg/obiava/prodava/sofia/reduta/tristaen/6076138/?sid=gFM8jD&page=1,8,2026-01-23 22:36:02.288610,,imotinet,0,,,Цена на /м2/:1 500EUR/2 933.75BGN,110 м2,Етаж: 0 от 5
"продаваДвустаен апартамент,68 м2","Просторен двустаен апартамент, състои се от: коридор, хол, кухня,  спалня, два балкона, баня с тоалетна. Площ от 68 кв.м. с възможност да се преустрой в съвременен тристаен...",167000.0,EUR,False,продава,двустаен,София,Суха Река,,продава,,https://www.imoti.net/bg/obiava/prodava/sofia/suha-reka/dvustaen/6170735/?sid=gFM8jD&page=1,12,2026-01-23 22:36:02.289296,,imotinet,0,,,Цена на /м2/:2 456EUR/4 803.29BGN,68 м2,Етаж: 8 от 8
"продаваДвустаен апартамент,61 м2","Слънчев и топъл апартамент в четириетажна тухлена сграда.Районът е чист и спокоен, с прекрасни, добре поддържани тревни площи и безпроблемно паркиране.",169000.0,EUR,False,продава,двустаен,София,Суха Река,,продава,,https://www.imoti.net/bg/obiava/prodava/sofia/suha-reka/dvustaen/6056399/?sid=gFM8jD&page=1,13,2026-01-23 22:36:02.290001,,imotinet,0,,,Цена на /м2/:2 770EUR/5 418.61BGN,61 м2,Етаж: 2 от 4
"продаваДвустаен апартамент,58 м2",Агенция за недвижими имоти 'Имотен център България' предлага за продажба двустаен апартамент в кв. 'Сухата река'.Сградата е санирана и се намира на бул. 'Ботевградско шосе' в близост до...,170000.0,EUR,False,продава,двустаен,София,Суха Река,,продава,,https://www.imoti.net/bg/obiava/prodava/sofia/suha-reka/dvustaen/6174730/?sid=gFM8jD&page=2,12,2026-01-23 22:36:06.034581,,imotinet,0,,,Цена на /м2/:2 931EUR/5 732.61BGN,58 м2,Етаж: 1 от 8
"продаваДвустаен апартамент,60 м2","Предлагаме за продажба просторен и светъл двустаен апартамент, разположен в един от най-предпочитаните и комуникативни райони на София – ж.к. „Сухата река“. Жилището се отличава с функционално...",170000.0,EUR,False,продава,двустаен,София,Суха Река,,продава,,https://www.imoti.net/bg/obiava/prodava--v-stroej/sofia/suha-reka/dvustaen/6172856/?sid=gFM8jD&page=2,10,2026-01-23 22:36:06.035288,,imotinet,0,,,Цена на /м2/:2 833EUR/5 541.52BGN,60 м2,Етаж:  от 7
"продаваДвустаен апартамент,58 м2",Агенция за недвижими имоти 'Имотен център България' предлага за продажба двустаен апартамент в кв. 'Сухата река'.Сградата е санирана и се намира на бул. 'Ботевградско шосе' в близост до...,170000.0,EUR,False,продава,двустаен,София,Подуене,,продава,,https://www.imoti.net/bg/obiava/prodava/sofia/poduene/dvustaen/6175196/?sid=gFM8jD&page=2,12,2026-01-23 22:36:06.036055,,imotinet,0,,,Цена на /м2/:2 931EUR/5 732.61BGN,58 м2,Етаж: 1 от 8
"продаваДвустаен апартамент,58 м2","Продаваме слънчев, двустаен апартамент.Жилището е с южно изложение, което е допълнение с голямото отстояние от близките сгради го прави изключително светло и топло.Сградата е с...",171000.0,EUR,False,продава,двустаен,София,Суха Река,,продава,,https://www.imoti.net/bg/obiava/prodava/sofia/suha-reka/dvustaen/6191798/?sid=gFM8jD&page=2,15,2026-01-23 22:36:06.036771,,imotinet,0,,,Цена на /м2/:2 948EUR/5 766.33BGN,58 м2,Етаж: 2 от 8
"продаваДвустаен апартамент,60 м2",.  .  .  .  .  .  .  .  .  .  .  .  .  .  .  .  .  .  .  .  .  .  .  .  .  .  .  .  .  .  ПРОДАВАМЕ  .  .  .  .  .  .  .  .  .  .  .  .  .  .  .  .  .  .  .  .  .  .  .  .  .  .  .  .  .  ....,173000.0,EUR,False,продава,двустаен,София,Подуене,,продава,,https://www.imoti.net/bg/obiava/prodava/sofia/poduene/dvustaen/6098100/?sid=gFM8jD&page=2,1,2026-01-23 22:36:06.037450,,imotinet,0,,,Цена на /м2/:2 883EUR/5 639.31BGN,60 м2,Етаж: 2 от 6
"продаваДвустаен апартамент,62 м2","Обзаведен апартамент в нова сграда от 2007 г. На бул. „Ботевградско шосе“.Разпределението включва, входно антре с портманто.Дневна, трапезария и кухненска част с...",173000.0,EUR,False,продава,двустаен,София,Суха Река,,продава,,https://www.imoti.net/bg/obiava/prodava/sofia/suha-reka/dvustaen/6096843/?sid=gFM8jD&page=2,0,2026-01-23 22:36:06.038125,,imotinet,0,,,Цена на /м2/:2 790EUR/5 457.40BGN,62 м2,Етаж: 2 от 6
"продаваТристаен апартамент,102 м2",МАЛКА БУТИКОВА СГРАДА!БЕЗ КОМИСИОННА ОТ КУПУВАЧА!Предлагаме за продажба просторен тристаен апартамент в новострояща се жилищна сграда в кв. Сухата река. Имотът е разположен на...,175000.0,EUR,False,продава,тристаен,София,Суха Река,,продава,,https://www.imoti.net/bg/obiava/prodava/sofia/suha-reka/tristaen/6203408/?sid=gFM8jD&page=2,4,2026-01-23 22:36:06.038878,,imotinet,0,,,Цена на /м2/:1 716EUR/3 355.59BGN,102 м2,Етаж: 2 от 4
"продаваДвустаен апартамент,74 м2","Представяме просторен, южен двустаен имот за продажба в спокоен и зелен район, на 10 мин пеша от парк ""Герена"".Имотът е разположен на 4-ти етаж от 6. Сградата е построена от...",175000.0,EUR,False,продава,двустаен,София,Суха Река,,продава,,https://www.imoti.net/bg/obiava/prodava--v-stroej/sofia/suha-reka/dvustaen/6087356/?sid=gFM8jD&page=2,14,2026-01-23 22:36:06.039599,,imotinet,0,,,Цена на /м2/:2 365EUR/4 625.27BGN,74 м2,Етаж:  от 6
