raw_title,raw_description,price,currency,without_dds,offer_type,property_type,city,neighborhood,contact_info,agency,agency_url,details_url,num_photos,date_time_added,search_url,site,total_offers,ref_no,time,price_per_m2,area,floor
"продаваДвустаен апартамент,67 м2","Агенция Пандора Естейт предлагаж ЕКСКЛУЗВИНО за продажба двустаен обзаведен апартамент в кв. Редута, в близост до парк, множество спирки на градския транспорт, супермаркети, училище....",183000.0,EUR,False,продава,двустаен,София,Редута,,продава,,https://www.imoti.net/bg/obiava/prodava/sofia/reduta/dvustaen/5982546/?sid=gFM8jD&page=2,4,2026-01-23 22:36:29.804994,,imotinet,0,,,Цена на /м2/:2 731EUR/5 342.04BGN,67 м2,Етаж: 2 от 5
"продаваТристаен апартамент,69 м2","Тристаен маломерен апартамент , преустроен от двустаен със следното разпределение : хол с кухненски бокс с усвоена тераса , две спални , едната от които с усвоена тераса а към другата има остъклен...",185000.0,EUR,False,продава,тристаен,София,Суха Река,,продава,,https://www.imoti.net/bg/obiava/prodava/sofia/suha-reka/tristaen/6193051/?sid=gFM8jD&page=2,7,2026-01-23 22:36:29.805697,,imotinet,0,,,Цена на /м2/:2 681EUR/5 243.89BGN,69 м2,Етаж: 6 от 14
"продаваДвустаен апартамент,65 м2","Ново строителство на НАЧАЛЕН ЕТАП. Модерна сграда, находяща се до парка на ул. Черковна и метростанция Хаджи Димитър. Комуникативна локация в широк център. В близост са множество спирки на градски...",185900.0,EUR,False,продава,двустаен,София,Суха Река,,продава,,https://www.imoti.net/bg/obiava/prodava/sofia/suha-reka/dvustaen/6132689/?sid=gFM8jD&page=2,8,2026-01-23 22:36:29.806375,,imotinet,0,,,Цена на /м2/:2 860EUR/5 593.67BGN,65 м2,Етаж: 7 от 8
"продаваДвустаен апартамент,66 м2","Ново строителство на НАЧАЛЕН ЕТАП. Модерна сграда, находяща се до парка на ул. Черковна и метростанция Хаджи Димитър. Комуникативна локация в широк център. В близост са множество спирки на градски...",185900.0,EUR,False,продава,двустаен,София,Подуене,,продава,,https://www.imoti.net/bg/obiava/prodava--v-stroej/sofia/poduene/dvustaen/6132696/?sid=gFM8jD&page=2,8,2026-01-23 22:36:29.807065,,imotinet,0,,,Цена на /м2/:2 817EUR/5 508.92BGN,66 м2,Етаж: 6 от 7
"продаваДвустаен апартамент,69 м2","iHOME REAL ESTATE предлага двустаен апартамент в новострояща се сграда в квартал Хаджи Димитър, в близост до бул. „Дондуков” и парк „Вл. Заимов"" на 9 етажа в секция А и 7 етажа в секция Б....",186000.0,EUR,False,продава,двустаен,София,Подуене,,продава,,https://www.imoti.net/bg/obiava/prodava/sofia/poduene/dvustaen/6191150/?sid=gFM8jD&page=2,3,2026-01-23 22:36:29.807825,,imotinet,0,,,Цена на /м2/:2 696EUR/5 272.24BGN,69 м2,Етаж: 3 от 9
"продаваДвустаен апартамент,69 м2","ARCO REAL ESTATE предлага двустаен апартамент на осми етаж от десет етажна жилищна сграда със застроена площ 60,38 кв.м., изложение- юг , в луксозна жилищна сграда в кв. Сухата река, на пет минути...",187500.0,EUR,False,продава,двустаен,София,Суха Река,,продава,,https://www.imoti.net/bg/obiava/prodava/sofia/suha-reka/dvustaen/6114938/?sid=gFM8jD&page=2,1,2026-01-23 22:36:29.808549,,imotinet,0,,,Цена на /м2/:2 717EUR/5 314.76BGN,69 м2,Етаж: 7 от 11
"продаваТристаен апартамент,110 м2","Агенция за недвижими имоти Пандора естейт продава ексклузивно.Реф. № 110191.Тристайни апартаменти в кв. Суха река, с просторни и светли помещения.Цена: 189,000 евро....",189000.0,EUR,False,продава,тристаен,София,Суха Река,,продава,,https://www.imoti.net/bg/obiava/prodava/sofia/suha-reka/tristaen/6019422/?sid=gFM8jD&page=2,6,2026-01-23 22:36:29.809270,,imotinet,0,,,Цена на /м2/:1 718EUR/3 360.47BGN,110 м2,Етаж: 3 от 5
"продаваТристаен апартамент,84 м2","Примо+ Недвижими имоти предлага за продажба тристаен апартамент в кв. Сухата река, София.Адрес: ж.к. Сухата река, ул. Тодорини Кукли, бл. 102АПлощ: апартамент – 83.72 кв.м; мазе –...",189000.0,EUR,False,продава,тристаен,София,Суха Река,,продава,,https://www.imoti.net/bg/obiava/prodava/sofia/suha-reka/tristaen/6182356/?sid=gFM8jD&page=2,18,2026-01-23 22:36:29.809978,,imotinet,0,,,Цена на /м2/:2 250EUR/4 400.62BGN,84 м2,Етаж: 5 от 6
"продаваТристаен апартамент,153 м2","Просторен тристаен апартамент в нова тухлена кооперация близо до Ботевградско шосе. Разпределението е входно антре, слънчева всекидневна с бокс и панорамна тераса, две спални, две санитарни...",190000.0,EUR,False,продава,тристаен,София,Суха Река,,продава,,https://www.imoti.net/bg/obiava/prodava/sofia/suha-reka/tristaen/3234140/?sid=gFM8jD&page=2,0,2026-01-23 22:36:29.810600,,imotinet,0,,,Цена на /м2/:1 242EUR/2 428.81BGN,153 м2,Етаж: 6 от 7
"продаваТристаен апартамент,98 м2","Без комисионна от купувача! Ново строителство на метри от ул. Черковна, църквата и реновирания и парк . Комуникативна локация в широк ценър, на 200 метра от Метростанция, пешеходно разстояние от...",194665.0,EUR,False,продава,тристаен,София,Подуене,,продава,,https://www.imoti.net/bg/obiava/prodava--v-stroej/sofia/poduene/tristaen/2613890/?sid=gFM8jD&page=2,3,2026-01-23 22:36:29.811289,,imotinet,0,,,Цена на /м2/:1 986EUR/3 885.02BGN,98 м2,Етаж: 7 от 9
"продаваДвустаен апартамент,56 м2",Агенция за недвижими имоти ' Имотен Център' има удоволствието да Ви представи двустаен апартамент в Дианабад.Сградата се намира на комуникативно място в близост до спирки на много...,195000.0,EUR,False,продава,двустаен,София,Дианабад,,продава,,https://www.imoti.net/bg/obiava/prodava/sofia/dianabad/dvustaen/6091364/?sid=gFM8jD&page=2,7,2026-01-23 22:36:29.812044,,imotinet,0,,,Цена на /м2/:3 482EUR/6 810.48BGN,56 м2,Етаж: 6 от 8
"продаваДвустаен апартамент,60 м2","Атиканте Естейтс предлага на Вашето внимание двустаен апартамент в кв. Дианабад.Жилището е с площ 57.12 кв.м., разположено на 7-ми етаж от 8 в панелна сграда, с отлична локация и удобна транспортна...",195000.0,EUR,False,продава,двустаен,София,Дианабад,,продава,,https://www.imoti.net/bg/obiava/prodava/sofia/dianabad/dvustaen/6133401/?sid=gFM8jD&page=2,17,2026-01-23 22:36:29.812741,,imotinet,0,,,Цена на /м2/:3 250EUR/6 356.45BGN,60 м2,Етаж: 7 от 8
"продаваДвустаен апартамент,64 м2","New Estates има удоволствието да ви представи 2-стаен апартамент в един от най-престижните жилищни комплекси в центъра на София. Новият отличителен проект се гордее със своя оригинален дизайн,...",195428.0,EUR,False,продава,двустаен,София,Оборище,,продава,,https://www.imoti.net/bg/obiava/prodava--v-stroej/sofia/oborishte/dvustaen/6027032/?sid=gFM8jD&page=2,17,2026-01-23 22:36:29.813415,,imotinet,0,,,Цена на /м2/:3 054EUR/5 972.25BGN,64 м2,Етаж: 12 от 14
"продаваДвустаен апартамент,80 м2","ARCO REAL ESTATE предлага двустаен апартамент със застроена площ 70 кв.м.,североизточно изложенив, в луксозна жилищна сграда на десет етажа в кв. Сухата река, на пет минути пешеходно разстояние от...",196500.0,EUR,False,продава,двустаен,София,Суха Река,,продава,,https://www.imoti.net/bg/obiava/prodava/sofia/suha-reka/dvustaen/5971433/?sid=gFM8jD&page=2,5,2026-01-23 22:36:29.814150,,imotinet,0,,,Цена на /м2/:2 456EUR/4 804.01BGN,80 м2,Етаж: 3 от 11
"продаваДвустаен апартамент,58 м2",Агенция за недвижими имоти 'Имотен център България' предлага за продажба двустаен апартамент в кв. 'Сухата река'.Сградата е санирана и се намира на бул. 'Ботевградско шосе' в близост до...,170000.0,EUR,False,продава,двустаен,София,Суха Река,,продава,,https://www.imoti.net/bg/obiava/prodava/sofia/suha-reka/dvustaen/6174730/?sid=gFM8jD&page=2,12,2026-01-23 22:36:33.266830,,imotinet,0,,,Цена на /м2/:2 931EUR/5 732.61BGN,58 м2,Етаж: 1 от 8
"продаваДвустаен апартамент,60 м2","Предлагаме за продажба просторен и светъл двустаен апартамент, разположен в един от най-предпочитаните и комуникативни райони на София – ж.к. „Сухата река“. Жилището се отличава с функционално...",170000.0,EUR,False,продава,двустаен,София,Суха Река,,продава,,https://www.imoti.net/bg/obiava/prodava--v-stroej/sofia/suha-reka/dvustaen/6172856/?sid=gFM8jD&page=2,10,2026-01-23 22:36:33.267518,,imotinet,0,,,Цена на /м2/:2 833EUR/5 541.52BGN,60 м2,Етаж:  от 7
"продаваДвустаен апартамент,58 м2",Агенция за недвижими имоти 'Имотен център България' предлага за продажба двустаен апартамент в кв. 'Сухата река'.Сградата е санирана и се намира на бул. 'Ботевградско шосе' в близост до...,170000.0,EUR,False,продава,двустаен,София,Подуене,,продава,,https://www.imoti.net/bg/obiava/prodava/sofia/poduene/dvustaen/6175196/?sid=gFM8jD&page=2,12,2026-01-23 22:36:33.268265,,imotinet,0,,,Цена на /м2/:2 931EUR/5 732.61BGN,58 м2,Етаж: 1 от 8
"продаваДвустаен апартамент,58 м2","Продаваме слънчев, двустаен апартамент.Жилището е с южно изложение, което е допълнение с голямото отстояние от близките сгради го прави изключително светло и топло.Сградата е с...",171000.0,EUR,False,продава,двустаен,София,Суха Река,,продава,,https://www.imoti.net/bg/obiava/prodava/sofia/suha-reka/dvustaen/6191798/?sid=gFM8jD&page=2,15,2026-01-23 22:36:33.268983,,imotinet,0,,,Цена на /м2/:2 948EUR/5 766.33BGN,58 м2,Етаж: 2 от 8
"продаваДвустаен апартамент,60 м2",.  .  .  .  .  .  .  .  .  .  .  .  .  .  .  .  .  .  .  .  .  .  .  .  .  .  .  .  .  .  ПРОДАВАМЕ  .  .  .  .  .  .  .  .  .  .  .  .  .  .  .  .  .  .  .  .  .  .  .  .  .  .  .  .  .  ....,173000.0,EUR,False,продава,двустаен,София,Подуене,,продава,,https://www.imoti.net/bg/obiava/prodava/sofia/poduene/dvustaen/6098100/?sid=gFM8jD&page=2,1,2026-01-23 22:36:33.269680,,imotinet,0,,,Цена на /м2/:2 883EUR/5 639.31BGN,60 м2,Етаж: 2 от 6
"продаваДвустаен апартамент,62 м2","Обзаведен апартамент в нова сграда от 2007 г. На бул. „Ботевградско шосе“.Разпределението включва, входно антре с портманто.Дневна, трапезария и кухненска част с...",173000.0,EUR,False,продава,двустаен,София,Суха Река,,продава,,https://www.imoti.net/bg/obiava/prodava/sofia/suha-reka/dvustaen/6096843/?sid=gFM8jD&page=2,0,2026-01-23 22:36:33.270339,,imotinet,0,,,Цена на /м2/:2 790EUR/5 457.40BGN,62 м2,Етаж: 2 от 6
"продаваТристаен апартамент,102 м2",МАЛКА БУТИКОВА СГРАДА!БЕЗ КОМИСИОННА ОТ КУПУВАЧА!Предлагаме за продажба просторен тристаен апартамент в новострояща се жилищна сграда в кв. Сухата река. Имотът е разположен на...,175000.0,EUR,False,продава,тристаен,София,Суха Река,,продава,,https://www.imoti.net/bg/obiava/prodava/sofia/suha-reka/tristaen/6203408/?sid=gFM8jD&page=2,4,2026-01-23 22:36:33.271103,,imotinet,0,,,Цена на /м2/:1 716EUR/3 355.59BGN,102 м2,Етаж: 2 от 4
"продаваДвустаен апартамент,74 м2","Представяме просторен, южен двустаен имот за продажба в спокоен и зелен район, на 10 мин пеша от парк ""Герена"".Имотът е разположен на 4-ти етаж от 6. Сградата е построена от...",175000.0,EUR,False,продава,двустаен,София,Суха Река,,продава,,https://www.imoti.net/bg/obiava/prodava--v-stroej/sofia/suha-reka/dvustaen/6087356/?sid=gFM8jD&page=2,14,2026-01-23 22:36:33.271840,,imotinet,0,,,Цена на /м2/:2 365EUR/4 625.27BGN,74 м2,Етаж:  от 6
"продаваДвустаен апартамент,60 м2","Начален етап на строителство!!!ИРИДА НЕДВИЖИМИ ИМОТИ продава голям двустаен апартамент в новоизграждаща се сграда, с изключително висококачествено строителство от доказан инвеститор...",176600.0,EUR,False,продава,двустаен,София,Дианабад,,продава,,https://www.imoti.net/bg/obiava/prodava--v-stroej/sofia/dianabad/dvustaen/6082472/?sid=gFM8jD&page=2,4,2026-01-23 22:36:33.272576,,imotinet,0,,,Цена на /м2/:2 943EUR/5 756.66BGN,60 м2,Етаж: 2 от 7
"продаваДвустаен апартамент,74 м2","ПРОСТОРЕН, НЕПРЕХОДЕН, ВЪТРЕШЕН, ТОПЪЛ апартамент в ЕПК блок от 70-те г. с отличен вход, на етаж 2 от 14, асансьор; в близост до Стадион Герена, бъдеща метростанция, детска градина, детска...",179000.0,EUR,False,продава,двустаен,София,Суха Река,,продава,,https://www.imoti.net/bg/obiava/prodava/sofia/suha-reka/dvustaen/6133305/?sid=gFM8jD&page=2,17,2026-01-23 22:36:33.273329,,imotinet,0,,,Цена на /м2/:2 419EUR/4 730.99BGN,74 м2,Етаж: 2 от 14
"продаваДвустаен апартамент,75 м2","Двустаен апартамент с площ от 75 кв.м, разположен на 2-ри етаж в ЕПК блок с добре поддържани общи части.Жилището е с функционално разпределение:-просторно антре,...",179000.0,EUR,False,продава,двустаен,София,Суха Река,,продава,,https://www.imoti.net/bg/obiava/prodava/sofia/suha-reka/dvustaen/6133736/?sid=gFM8jD&page=2,2,2026-01-23 22:36:33.274054,,imotinet,0,,,Цена на /м2/:2 387EUR/4 667.91BGN,75 м2,Етаж: 2
"продаваДвустаен апартамент,58 м2",,180000.0,EUR,False,продава,двустаен,София,Изток,,продава,,https://www.imoti.net/bg/obiava/prodava/sofia/sofija-iztok/dvustaen/6118758/?sid=gFM8jD&page=2,2,2026-01-23 22:36:33.274740,,imotinet,0,,,Цена на /м2/:3 103EUR/6 069.82BGN,58 м2,Етаж: 0 от 6
"продаваДвустаен апартамент,62 м2","Уют и пространство в сърцето на кв. Редута.Продава се апартамент с голям инвестиционен потенциал ,чиста жилищна площ 62 кв.м и 30% идеални части от дворното място. Апартаментът е...",180000.0,EUR,False,продава,двустаен,София,Редута,,продава,,https://www.imoti.net/bg/obiava/prodava--v-stroej/sofia/reduta/dvustaen/6147540/?sid=gFM8jD&page=2,8,2026-01-23 22:36:33.275423,,imotinet,0,,,Цена на /м2/:2 903EUR/5 678.22BGN,62 м2,Етаж:  от 2
"продаваДвустаен апартамент,63 м2","Ново строителство на НАЧАЛЕН ЕТАП. Модерна сграда, находяща се до парка на ул. Черковна и метростанция Хаджи Димитър. Комуникативна локация в широк център. В близост са множество спирки на градски...",180450.0,EUR,False,продава,двустаен,София,Суха Река,,продава,,https://www.imoti.net/bg/obiava/prodava--v-stroej/sofia/suha-reka/dvustaen/6134744/?sid=gFM8jD&page=2,2,2026-01-23 22:36:33.276112,,imotinet,0,,,Цена на /м2/:2 864EUR/5 602.06BGN,63 м2,Етаж: 2 от 8
"продаваДвустаен апартамент,62 м2","СХЕМА НА ПЛАЩАНЕ 30% НА ПД, 70% НА АКТ 16!Двустаен апартамент на етаж втори с РЗП-62.14м2., ЗП-52.59м2. и следното разпределение: коридор, дневна с кухненски бокс и...",181018.0,EUR,False,продава,двустаен,София,Дианабад,,продава,,https://www.imoti.net/bg/obiava/prodava/sofia/dianabad/dvustaen/6193311/?sid=gFM8jD&page=2,4,2026-01-23 22:36:33.276826,,imotinet,0,,,Цена на /м2/:2 920EUR/5 710.33BGN,62 м2,Етаж: 2 от 7
"продаваТристаен апартамент,79 м2","МЕТРО!ТИШИНА!ЕЛЕГАНТНОСТ!ПРЕДПРОДАЖБА!СКОРО ОТНОВО ЩЕ ВДИГНЕМ ЦЕНАТА, ПОБЪРЗАЙТЕ!ВЕЧЕ 60% ОТ ЖИЛИЩАТА СА ЗАКУПЕНИ!Уникален мини...",181621.0,EUR,False,продава,тристаен,София,Суха Река,,продава,,https://www.imoti.net/bg/obiava/prodava--v-stroej/sofia/suha-reka/tristaen/5986842/?sid=gFM8jD&page=2,4,2026-01-23 22:36:33.277550,,imotinet,0,,,Цена на /м2/:2 299EUR/4 496.45BGN,79 м2,Етаж: 7 от 7
"продаваДвустаен апартамент,67 м2","Агенция Пандора Естейт предлагаж ЕКСКЛУЗВИНО за продажба двустаен обзаведен апартамент в кв. Редута, в близост до парк, множество спирки на градския транспорт, супермаркети, училище....",183000.0,EUR,False,продава,двустаен,София,Редута,,продава,,https://www.imoti.net/bg/obiava/prodava/sofia/reduta/dvustaen/5982546/?sid=gFM8jD&page=2,4,2026-01-23 22:36:33.278252,,imotinet,0,,,Цена на /м2/:2 731EUR/5 342.04BGN,67 м2,Етаж: 2 от 5
"продаваТристаен апартамент,69 м2","Тристаен маломерен апартамент , преустроен от двустаен със следното разпределение : хол с кухненски бокс с усвоена тераса , две спални , едната от които с усвоена тераса а към другата има остъклен...",185000.0,EUR,False,продава,тристаен,София,Суха Река,,продава,,https://www.imoti.net/bg/obiava/prodava/sofia/suha-reka/tristaen/6193051/?sid=gFM8jD&page=2,7,2026-01-23 22:36:33.278937,,imotinet,0,,,Цена на /м2/:2 681EUR/5 243.89BGN,69 м2,Етаж: 6 от 14
"продаваДвустаен апартамент,65 м2","Ново строителство на НАЧАЛЕН ЕТАП. Модерна сграда, находяща се до парка на ул. Черковна и метростанция Хаджи Димитър. Комуникативна локация в широк център. В близост са множество спирки на градски...",185900.0,EUR,False,продава,двустаен,София,Суха Река,,продава,,https://www.imoti.net/bg/obiava/prodava/sofia/suha-reka/dvustaen/6132689/?sid=gFM8jD&page=2,8,2026-01-23 22:36:33.279609,,imotinet,0,,,Цена на /м2/:2 860EUR/5 593.67BGN,65 м2,Етаж: 7 от 8
"продаваДвустаен апартамент,66 м2","Ново строителство на НАЧАЛЕН ЕТАП. Модерна сграда, находяща се до парка на ул. Черковна и метростанция Хаджи Димитър. Комуникативна локация в широк център. В близост са множество спирки на градски...",185900.0,EUR,False,продава,двустаен,София,Подуене,,продава,,https://www.imoti.net/bg/obiava/prodava--v-stroej/sofia/poduene/dvustaen/6132696/?sid=gFM8jD&page=2,8,2026-01-23 22:36:33.280298,,imotinet,0,,,Цена на /м2/:2 817EUR/5 508.92BGN,66 м2,Етаж: 6 от 7
"продаваДвустаен апартамент,69 м2","iHOME REAL ESTATE предлага двустаен апартамент в новострояща се сграда в квартал Хаджи Димитър, в близост до бул. „Дондуков” и парк „Вл. Заимов"" на 9 етажа в секция А и 7 етажа в секция Б....",186000.0,EUR,False,продава,двустаен,София,Подуене,,продава,,https://www.imoti.net/bg/obiava/prodava/sofia/poduene/dvustaen/6191150/?sid=gFM8jD&page=2,3,2026-01-23 22:36:33.281043,,imotinet,0,,,Цена на /м2/:2 696EUR/5 272.24BGN,69 м2,Етаж: 3 от 9
"продаваДвустаен апартамент,69 м2","ARCO REAL ESTATE предлага двустаен апартамент на осми етаж от десет етажна жилищна сграда със застроена площ 60,38 кв.м., изложение- юг , в луксозна жилищна сграда в кв. Сухата река, на пет минути...",187500.0,EUR,False,продава,двустаен,София,Суха Река,,продава,,https://www.imoti.net/bg/obiava/prodava/sofia/suha-reka/dvustaen/6114938/?sid=gFM8jD&page=2,1,2026-01-23 22:36:33.281774,,imotinet,0,,,Цена на /м2/:2 717EUR/5 314.76BGN,69 м2,Етаж: 7 от 11
"продаваТристаен апартамент,110 м2","Агенция за недвижими имоти Пандора естейт продава ексклузивно.Реф. № 110191.Тристайни апартаменти в кв. Суха река, с просторни и светли помещения.Цена: 189,000 евро....",189000.0,EUR,False,продава,тристаен,София,Суха Река,,продава,,https://www.imoti.net/bg/obiava/prodava/sofia/suha-reka/tristaen/6019422/?sid=gFM8jD&page=2,6,2026-01-23 22:36:33.282471,,imotinet,0,,,Цена на /м2/:1 718EUR/3 360.47BGN,110 м2,Етаж: 3 от 5
