raw_title,raw_description,price,currency,without_dds,offer_type,property_type,city,neighborhood,contact_info,agency,agency_url,details_url,num_photos,date_time_added,search_url,site,total_offers,ref_no,time,price_per_m2,area,floor,fingerprint_hash
"продава Четиристаен апартамент, 125 м2","New Estates представя изключителна бутикова сграда, вписваща се перфектно на тиха локация, само на няколко метра от Южен парк. Проектът включва 8 апартамента, внимателно разпределени на 5 етажа,...",,,False,продава,четиристаен,София,Лозенец,,New Estates,,https://www.imoti.net/bg/obiava/prodava--v-stroej/sofia/lozenec/chetiristaen/5845758/?sid=iKI3oo&page=11,16.0,,,imotinet,,,,Цена на /м2/:4 725EUR, 125 м2,Етаж: 2 от 5,26eda480c3990308095595449cbe799a
"продава Четиристаен апартамент, 150 м2","Открийте мястото, където ще се чувствате у дома от първия момент. Титан Пропъртис- офис Хиподрума с радост предлага на Вашето внимание този изключителен тристаен апартамент, разположен на трети...",,,False,продава,четиристаен,София,Хладилника,,Титан Пропъртис София,,https://www.imoti.net/bg/obiava/prodava/sofia/hladilnika/chetiristaen/6098145/?sid=iKI3oo&page=11,19.0,,,imotinet,,,,Цена на /м2/:3 993EUR, 150 м2,Етаж: 3 от 6,1d1ce4e1b40fdf0e1c171933263ca9c3
"продава Тристаен апартамент, 201 м2","Представяме тристаен апартамент за продажба, част от нова сграда със смесено предназначение в кв. ""Лозенец"", гр. София.Сградата е с получен Акт 16.Районът е един от...",,,False,продава,тристаен,София,Лозенец,,Luximmo Finest Estates,,https://www.imoti.net/bg/obiava/prodava--v-stroej/sofia/lozenec/tristaen/5750082/?sid=iKI3oo&page=11,24.0,,,imotinet,,,,Цена на /м2/:3 001EUR, 201 м2,Етаж:  от 9,6af58e5ec27a08553cd1473142697ab6
"продава Тристаен апартамент, 124 м2","Тристаен апартамент луксозно и напълно обзаведен по индивидуален проект.Застроената площ на имота е 103.48 кв.м, а общата 124.15 кв.м с мазе.Състои се от коридор с килер...",,,False,продава,тристаен,София,Хладилника,,Имотека,,https://www.imoti.net/bg/obiava/prodava/sofia/hladilnika/tristaen/6088789/?sid=iKI3oo&page=11,21.0,,,imotinet,,,,Цена на /м2/:4 903EUR, 124 м2,Етаж: 2 от 6,0eb5a3a38912b31b6aba6f3abcf925c4
"продава Четиристаен апартамент, 143 м2","New Estates има удоволствието да представи на Вашето внимание четиристаен апартамент в една емблематична жилищна сграда в сърцето на престижния столичен квартал Лозенец, впечатляваща с изтънченост...",,,False,продава,четиристаен,София,Лозенец,,New Estates,,https://www.imoti.net/bg/obiava/prodava/sofia/lozenec/chetiristaen/6024982/?sid=iKI3oo&page=11,23.0,,,imotinet,,,,Цена на /м2/:4 301EUR, 143 м2,Етаж: 3 от 6,f843b67cc67e5f26b4030d0b9e3aa024
"продава Тристаен апартамент, 170 м2","A P A R T M E N T  0 1 2С Апартамент 012 ELEHOME ви предлага една изключително красива, функционална и резонираща с нашето ежедневие и съвременност архитектура. Семпла, изчистена и...",,,False,продава,тристаен,София,Лозенец,,ELEHOME,,https://www.imoti.net/bg/obiava/prodava/sofia/lozenec/tristaen/5566759/?sid=iKI3oo&page=11,12.0,,,imotinet,,,,Цена на /м2/:3 618EUR, 170 м2,Етаж: 3 от 8,d6c7f02b9cc66948e1de697d390d4a98
"продава Тристаен апартамент, 170 м2","С удоволствие представяме тристаен апартамент в новопостроена сграда с Акт 16!Апартаментът предлага източно и югозападно изложение, и разполага с просторен и светъл хол с кухня и...",,,False,продава,тристаен,София,Хладилника,,Luximmo Finest Estates,,https://www.imoti.net/bg/obiava/prodava--v-stroej/sofia/hladilnika/tristaen/6104644/?sid=iKI3oo&page=11,15.0,,,imotinet,,,,Цена на /м2/:3 618EUR, 170 м2,Етаж:  от 8,d6c7f02b9cc66948e1de697d390d4a98
"продава Тристаен апартамент, 162 м2","Тристаен апартамент с площ 161,74кв.м./ ЗП 145,38кв.м.с изложение юг-изток-запад. Жилището има следното разпределение: входно антре, просторен и светъл хол с кухненска зона и трапезарна част, две...",,,False,продава,тристаен,София,Хладилника,,Имотека,,https://www.imoti.net/bg/obiava/prodava/sofia/hladilnika/tristaen/6101397/?sid=iKI3oo&page=11,13.0,,,imotinet,,,,Цена на /м2/:3 796EUR, 162 м2,Етаж: 3 от 8,c6df92fd1b9164d79b66d4bdf96fa581
"продава Многостаен апартамент, 323 м2","БЕЗ КОМИСИОН ОТ КУПУВАЧА !!! РАБОТИМ С КОЛЕГИ !!!Представяме Ви ПРОСТОРЕН 4-СТАЕН апартамент, със следното разпределение:Входно антре, просторна всекидневна с кухненски бокс и...",,,False,продава,многостаен,София,Лозенец,,Имотека,,https://www.imoti.net/bg/obiava/prodava/sofia/lozenec/mnogostaen/6093579/?sid=iKI3oo&page=11,10.0,,,imotinet,,,,Цена на /м2/:1 935EUR, 323 м2,Етаж: -1 от 6,17f1df502aedb92ccaaddd55fc5b3d73
"продава Многостаен апартамент, 323 м2","БЕЗ КОМИСИОН ОТ КУПУВАЧА !!! РАБОТИМ С КОЛЕГИ !!!Представяме Ви ПРОСТОРЕН 4-СТАЕН апартамент, със следното разпределение:Входно антре, просторна всекидневна с кухненски бокс и...",,,False,продава,многостаен,София,Хладилника,,Имотека,,https://www.imoti.net/bg/obiava/prodava/sofia/hladilnika/mnogostaen/6093459/?sid=iKI3oo&page=11,10.0,,,imotinet,,,,Цена на /м2/:1 935EUR, 323 м2,Етаж: -1 от 6,17f1df502aedb92ccaaddd55fc5b3d73
"продава Многостаен апартамент, 256 м2","Многостаен мезонет с панорамна гледка в кв. ""Лозенец"" – 260 кв.м.  Просторен хол, три спални, две панорамни тераси, емпоре, три санитарни помещения, сауна   ...",,,False,продава,многостаен,София,Лозенец,,АДРЕС Недвижими имоти АД,,https://www.imoti.net/bg/obiava/prodava/sofia/lozenec/mnogostaen/6103072/?sid=iKI3oo&page=11,27.0,,,imotinet,,,,Цена на /м2/:2 461EUR, 256 м2,Етаж: 6 от 7,f45626e6812e14f0dacb548a3f7164c1
"продава Мезонет, 260 м2","Unique Estates има удоволствието да Ви представи изключително просторен и светъл мезонет, разположен в най-желаната част на кв. Лозенец, на бул. Джеймс Баучер. За Вашия уют и...",,,False,продава,мезонет,София,Лозенец,,ЮНИК ЕСТЕЙТС,,https://www.imoti.net/bg/obiava/prodava/sofia/lozenec/mezonet/6077834/?sid=iKI3oo&page=11,14.0,,,imotinet,,,,Цена на /м2/:2 423EUR, 260 м2,Етаж: 6 от 7,3f0d8b3781add342a8612b1bb7d33f95
"продава Многостаен апартамент, 230 м2","БЕЗ КОМИСИОН ОТ КУПУВАЧА !!! РАБОТИМ С КОЛЕГИ !!!Представяме Ви ПРОСТОРЕН 4-СТАЕН апартамент, със следното разпределение:Входно антре, просторна всекидневна с кухненски бокс и...",,,False,продава,многостаен,София,Лозенец,,Имотека,,https://www.imoti.net/bg/obiava/prodava/sofia/lozenec/mnogostaen/6093573/?sid=iKI3oo&page=11,14.0,,,imotinet,,,,Цена на /м2/:2 803EUR, 230 м2,Етаж: 5 от 6,d039cf39044bca8a4b3b3b1e5a972abf
"продава Многостаен апартамент, 230 м2","БЕЗ КОМИСИОН ОТ КУПУВАЧА !!! РАБОТИМ С КОЛЕГИ !!!Представяме Ви ПРОСТОРЕН 4-СТАЕН апартамент, със следното разпределение:Входно антре, просторна всекидневна с кухненски бокс и...",,,False,продава,многостаен,София,Хладилника,,Имотека,,https://www.imoti.net/bg/obiava/prodava/sofia/hladilnika/mnogostaen/6093440/?sid=iKI3oo&page=11,14.0,,,imotinet,,,,Цена на /м2/:2 803EUR, 230 м2,Етаж: 5 от 6,d039cf39044bca8a4b3b3b1e5a972abf
"продава Мезонет, 235 м2","САНДРАМАКС продава ПЕТСТАЕН мезонет на ЕМБЛЕМАТИЧНО място в кв. Лозенец ( до РЕЗИДЕНЦИЯ Лозенец ) с два надземни гаража, намиращи се до входа на кооперацията, които не са включени в...",,,False,продава,мезонет,София,Лозенец,,Сандрамакс,,https://www.imoti.net/bg/obiava/prodava/sofia/lozenec/mezonet/6072359/?sid=iKI3oo&page=11,16.0,,,imotinet,,,,Цена на /м2/:2 766EUR, 235 м2,Етаж: 4 от 5,de782310ce41835b43ffeb113d3700da
"продава Четиристаен апартамент, 160 м2",Unique Estates има удоволствието да представи на Вашето внимание апартамент в един от най-престижните квартали на София - Лозенец.Имотът се намира в близост...,,,False,продава,четиристаен,София,Лозенец,,ЮНИК ЕСТЕЙТС,,https://www.imoti.net/bg/obiava/prodava/sofia/lozenec/chetiristaen/6047784/?sid=iKI3oo&page=11,12.0,,,imotinet,,,,Цена на /м2/:4 063EUR, 160 м2,Етаж: 3 от 6,ce5a36f47cdd1aa172901e9a63859f3e
"продава Многостаен апартамент, 425 м2","Mезонет в кв. Хиподрума с 5 спални, 4 бани с тоалетни към тях, дневна, отоплението е на ТЕЦ и климатици, жилището е без скосявания. Сградата разполага с два асансьора, намира се до хипермаркет,...",,,False,продава,многостаен,София,Хиподрума,,Глобъл Сървисиз,,https://www.imoti.net/bg/obiava/prodava/sofia/hipodruma/mnogostaen/5853501/?sid=iKI3oo&page=11,1.0,,,imotinet,,,,Цена на /м2/:1 529EUR, 425 м2,Етаж: 11 от 12,20174b4a6dfe4da94d8fb0ec523c4fdf
"продава Многостаен апартамент, 235 м2","Многостаен апартамент,тип мезонет в престижна сграда срещу Резиденция ЛозенецBULGARIA SOTHEBY’S INTERNATIONAL REALTY представя на Вашето внимание многостаен апартамент, тип мезонет...",,,False,продава,многостаен,София,Лозенец,,BULGARIA SOTHEBY'S INTERNATIONAL REALTY,,https://www.imoti.net/bg/obiava/prodava/sofia/lozenec/mnogostaen/6086767/?sid=iKI3oo&page=11,18.0,,,imotinet,,,,Цена на /м2/:2 766EUR, 235 м2,Етаж: 4 от 5,603f0da1ef1b3b5e1343eb4371b6eac3
"продава Многостаен апартамент, 235 м2","САНДРАМАКС продава ПЕТСТАЕН мезонет на ЕМБЛЕМАТИЧНО място в кв. Лозенец ( до РЕЗИДЕНЦИЯ Лозенец ) с два надземни гаража, намиращи се до входа на кооперацията, които не са включени в...",,,False,продава,многостаен,София,Лозенец,,Сандрамакс,,https://www.imoti.net/bg/obiava/prodava/sofia/lozenec/mnogostaen/6074535/?sid=iKI3oo&page=11,16.0,,,imotinet,,,,Цена на /м2/:2 766EUR, 235 м2,Етаж: 4 от 5,603f0da1ef1b3b5e1343eb4371b6eac3
"продава Многостаен апартамент, 204 м2","Елегантност, мащаб и архитектурно съвършенство в сърцето на ""Лозенец""Представяме изключителна възможност за покупка на отличителен имот – многостаен апартамент в иновативна, бутикова...",,,False,продава,многостаен,София,Лозенец,,Luximmo Finest Estates,,https://www.imoti.net/bg/obiava/prodava--v-stroej/sofia/lozenec/mnogostaen/6080718/?sid=iKI3oo&page=11,6.0,,,imotinet,,,,Цена на /м2/:3 254EUR, 204 м2,Етаж:  от 8,4c58fa4721e75c2f25e9cab0d91857f8
"продава Тристаен апартамент, 203 м2","НОВА СГРАДА С МОДЕРНА ВИЗИЯ! ДОКАЗАН СТРОИТЕЛ! Надилена риъл естейтс предлага за продажба просторен 3-стаен апартамент с площ от 203кв.м.(застроена площ от 170.56кв.м.), ет.2, асансьор Kone,...",,,False,продава,тристаен,София,Лозенец,,Надилена риъл естейтс,,https://www.imoti.net/bg/obiava/prodava/sofia/lozenec/tristaen/6095465/?sid=iKI3oo&page=12,13.0,,,imotinet,,,,Цена на /м2/:3 300EUR, 203 м2,Етаж: 2 от 6,d54fc63845e3f76fa0580e1bbe0de946
"продава Тристаен апартамент, 203 м2","Unique Estates предлага отличен просторен апартамент в новострояща се сграда на акт. 15, разположена в тихо и озеленено място до гора. Сградата е модерна, а алуминиева дограма и...",,,False,продава,тристаен,София,Лозенец,,ЮНИК ЕСТЕЙТС,,https://www.imoti.net/bg/obiava/prodava--v-stroej/sofia/lozenec/tristaen/6092221/?sid=iKI3oo&page=12,3.0,,,imotinet,,,,Цена на /м2/:3 300EUR, 203 м2,Етаж: 2 от 7,d54fc63845e3f76fa0580e1bbe0de946
"продава Четиристаен апартамент, 258 м2","БЕЗ КОМИСИОН !АКТ 16 декември 2023г!ИРИДА НЕДВИЖИМИ ИМОТИ Ви предлага за продажба просторен четиристаен апартамент в нова 44-метрова модерна жилищна сграда, която...",,,False,продава,четиристаен,София,Лозенец,,ИРИДА НЕДВИЖИМИ ИМОТИ,,https://www.imoti.net/bg/obiava/prodava--v-stroej/sofia/lozenec/chetiristaen/5856873/?sid=iKI3oo&page=12,11.0,,,imotinet,,,,Цена на /м2/:2 614EUR, 258 м2,Етаж: 7 от 11,8a359a30f2c16dd9bbca158b0a7914a1
"продава Четиристаен апартамент, 184 м2","Unique Estates има удоволствието да ви представи просторен апартамент за продажба, завършен по проект на Chuchuline.Имотът е в сграда от 2010 година...",,,False,продава,четиристаен,София,Лозенец,,ЮНИК ЕСТЕЙТС,,https://www.imoti.net/bg/obiava/prodava/sofia/lozenec/chetiristaen/6077828/?sid=iKI3oo&page=12,10.0,,,imotinet,,,,Цена на /м2/:3 696EUR, 184 м2,Етаж: 4 от 6,d851d66dbcb523bbc79441ad0dd88c66
"продава Мезонет, 488 м2","Представяме за продажба пентхаус на две нива с просторни тераси и прекрасни гледки към града и Витоша, разположен в комуникативен район, в близост до болница ''Вита'', мол Paradise Center,...",,,False,продава,мезонет,София,Хладилника,,Luximmo Finest Estates,,https://www.imoti.net/bg/obiava/prodava--v-stroej/sofia/hladilnika/mezonet/5620132/?sid=iKI3oo&page=12,4.0,,,imotinet,,,,Цена на /м2/:1 434EUR, 488 м2,Етаж:  от 8,52e0e7a315a82d33f3b0d6ed8f3d8bc4
"продава Четиристаен апартамент, 235 м2",БЕЗ КОМИСИОННА ОТ КУПУВАЧА!Компания `ЕКС` представя на Вашето внимание четиристаен апартамент в кв. Хладилника.МЕСТОПОЛОЖЕНИЕ: В близост до спирка на градски...,,,False,продава,четиристаен,София,Хладилника,,ЕКС НВД,,https://www.imoti.net/bg/obiava/prodava/sofia/hladilnika/chetiristaen/6003166/?sid=iKI3oo&page=12,1.0,,,imotinet,,,,Цена на /м2/:3 000EUR, 235 м2,Етаж: 18 от 18,b4573fbd20b9b9d17b41308054c88fd3
"продава Четиристаен апартамент, 208 м2","Компания `ЕКС` представя на Вашето внимание четиристаен апартамент в един от най-желаните райони на гр. София- кв. Лозенец.МЕСТОПОЛОЖЕНИЕ: В близост до спирки на градски транспорт,...",,,False,продава,четиристаен,София,Лозенец,,ЕКС НВД,,https://www.imoti.net/bg/obiava/prodava/sofia/lozenec/chetiristaen/6001839/?sid=iKI3oo&page=12,1.0,,,imotinet,,,,Цена на /м2/:3 439EUR, 208 м2,Етаж: 4 от 6,c0568da43ed412084d6cc03f973e9076
"продава Мезонет, 270 м2","Продаваме голям мезонет (статут на Ателие), който е преустроен в 5 маломерни двустайни апартамента, намиращ се в кв. Лозенец, на ул. Богатица, близо до ресторант Хепи и Южен парк. Намира на...",,,False,продава,мезонет,София,Лозенец,,Бг Брокер,,https://www.imoti.net/bg/obiava/prodava/sofia/lozenec/mezonet/5996546/?sid=iKI3oo&page=12,17.0,,,imotinet,,,,Цена на /м2/:2 667EUR, 270 м2,Етаж: 7 от 8,7f2135d4c4cd94df2fc2e447a2b21816
"продава Мезонет, 174 м2","Юник Естейтс представя уникален пентхаус, разположен в един от най-предпочитаните квартали на София – Иван Вазов, в непосредствена близост до Южния парк, спортен комплекс...",,,False,продава,мезонет,София,Иван Вазов,,ЮНИК ЕСТЕЙТС,,https://www.imoti.net/bg/obiava/prodava/sofia/ivan-vazov/mezonet/6085651/?sid=iKI3oo&page=12,9.0,,,imotinet,,,,Цена на /м2/:4 138EUR, 174 м2,Етаж: 9 от 9,bd65a9a0d980c0a457433deb70b394d1
"продава Четиристаен апартамент, 201 м2","Galardo Real Estate ви представя апартамент, разположен в нова сграда, със стилна фасада, в близост до от хотел Маринела.Апартаментът е разположен на седми етаж с прекрасна тераса и изглед...",,,False,продава,четиристаен,София,Лозенец,,Galardo Real Estate,,https://www.imoti.net/bg/obiava/prodava/sofia/lozenec/chetiristaen/6012388/?sid=iKI3oo&page=12,12.0,,,imotinet,,,,Цена на /м2/:3 601EUR, 201 м2,Етаж: 7 от 7,7bd66a7e282aefcddfc1b40681b18f65
"продава Тристаен апартамент, 201 м2","Имоти Премиер представя изключителен тристаен апартамент, разположен в престижния квартал Лозенец, София!",,,False,продава,тристаен,София,Лозенец,,Имоти Премиер,,https://www.imoti.net/bg/obiava/prodava/sofia/lozenec/tristaen/6054157/?sid=iKI3oo&page=12,16.0,,,imotinet,,,,Цена на /м2/:3 601EUR, 201 м2,Етаж: 7 от 7,6af58e5ec27a08553cd1473142697ab6
"продава Четиристаен апартамент, 220 м2",Unique estates представя уникален апартамент разположен в най-хубавата част на кв.Стрелбище непосредствено до 126-то Училище.Пентхаусът е единствения...,,,False,продава,четиристаен,София,Стрелбище,,ЮНИК ЕСТЕЙТС,,https://www.imoti.net/bg/obiava/prodava/sofia/strelbishte/chetiristaen/6091538/?sid=iKI3oo&page=12,13.0,,,imotinet,,,,Цена на /м2/:3 314EUR, 220 м2,Етаж: 9 от 9,e45369c8d41b5eaee4a792d861993569
"продава Тристаен апартамент, 201 м2","BG Broker представяме за продажба тристаен апартамент в новопостроена луксозна сграда с разрешение за ползване от 2024г., в кв. Лозенец, срещу хотел Маринела, близо до метростанция „Джеймс Баучер“....",,,False,продава,тристаен,София,Лозенец,,Бг Брокер,,https://www.imoti.net/bg/obiava/prodava/sofia/lozenec/tristaen/6053303/?sid=iKI3oo&page=12,11.0,,,imotinet,,,,Цена на /м2/:3 637EUR, 201 м2,Етаж: 7 от 9,6af58e5ec27a08553cd1473142697ab6
"продава Четиристаен апартамент, 191 м2","ЛУКСОЗНА СГРАДА! СОБСТВЕН ДВОР!  ДО ХОТЕЛ 'ХЕМУС'!  Предлагаме на Вашето внимание просторен четиристаен апартамент находящ се на хубава, тиха улица в 'долен' Лозенец, същевременно в непосредствена...",,,False,продава,четиристаен,София,Лозенец,,Джей и Джей Корпорейшън,,https://www.imoti.net/bg/obiava/prodava/sofia/lozenec/chetiristaen/6096452/?sid=iKI3oo&page=12,12.0,,,imotinet,,,,Цена на /м2/:3 927EUR, 191 м2,Етаж: 1 от 4,1a2416bda9fc37e8022ea16b5fb4c586
"продава Тристаен апартамент, 144 м2","Unique Estates представя на Вашето внимание изключителен апартамент в един от най-предпочитаните райони в София - Лозенец.Стилен и изискан, апартамент с уникално...",,,False,продава,тристаен,София,Лозенец,,ЮНИК ЕСТЕЙТС,,https://www.imoti.net/bg/obiava/prodava/sofia/lozenec/tristaen/5996893/?sid=iKI3oo&page=12,12.0,,,imotinet,,,,Цена на /м2/:5 208EUR, 144 м2,Етаж: 4 от 4,53212433044fa21c898517e7aaae9df1
"продава Тристаен апартамент, 222 м2","Компания `ЕКС` представя на Вашето внимание тристаен апартамент в един от най-желаните райони на гр. София- кв. Лозенец.МЕСТОПОЛОЖЕНИЕ: В близост до спирки на градски транспорт,...",,,False,продава,тристаен,София,Лозенец,,ЕКС НВД,,https://www.imoti.net/bg/obiava/prodava/sofia/lozenec/tristaen/6001862/?sid=iKI3oo&page=12,1.0,,,imotinet,,,,Цена на /м2/:3 433EUR, 222 м2,Етаж: 1 от 6,1d69770f43f4a847e976bb3c59b92120
"продава Четиристаен апартамент, 177 м2","Представяме на Вашето внимание елегантен и впечатляващ апартамент с три спални в кв.Лозенец. Сградата е разположена в най-високата и зелена част на София, срещу Борисовата градина и Семинарията, от...",,,False,продава,четиристаен,София,Лозенец,,Luximmo Finest Estates,,https://www.imoti.net/bg/obiava/prodava--v-stroej/sofia/lozenec/chetiristaen/5685338/?sid=iKI3oo&page=12,33.0,,,imotinet,,,,Цена на /м2/:4 322EUR, 177 м2,Етаж:  от 7,7dab5bad8d48a2349032544e1d134a74
