raw_title,raw_description,price,currency,without_dds,offer_type,property_type,city,neighborhood,contact_info,agency,agency_url,details_url,num_photos,date_time_added,search_url,site,total_offers,ref_no,time,price_per_m2,area,floor,fingerprint_hash
Продава ЗЕМЕДЕЛСКА ЗЕМЯ,"Нива, кат. 4, 5.3 дка, Предлагаме на Вашето внимание земеделска земя, находяща се в с.Сокол, област Сливен, в месността 'Ес ..., тел.: 0888408055",,,False,продава,земя,Сокол,Област Сливен,0888408055,,https://jjcorporation.imot.bg,https://www.imot.bg/pcgi/imot.cgi?act=5&adv=1s172362318799473&slink=blq5u8&f1=12,,,,imotbg,717,,,,,,220ce7e7e4b03f3f25058d9a8a65da38
Продава ЗЕМЕДЕЛСКА ЗЕМЯ,"Нива, кат. 4, 22 дка, Собственик продава 22 декара напълно обработвами със рента 90 лв на декар, като има още една година  ..., тел.: 0877159296",,,False,продава,земя,Стоил войвода,Област Сливен,0877159296,,https://lidera.imot.bg,https://www.imot.bg/pcgi/imot.cgi?act=5&adv=1s173164456228459&slink=blq5u8&f1=13,,,,imotbg,717,,,,,,705eedd156b2f3b81262c4369d741bbf
Продава ЗЕМЕДЕЛСКА ЗЕМЯ,"Нива, кат. 4, 22 дка, Собственик продава 22 декара напълно обработвами със рента 90 лв на декар, като има още една година  ..., тел.: 0877159296",,,False,продава,земя,Стоил войвода,Област Сливен,0877159296,,https:None,https://www.imot.bg/pcgi/imot.cgi?act=5&adv=1s173164456228459&slink=blq5u8&f1=13,,,,imotbg,717,,,,,,705eedd156b2f3b81262c4369d741bbf
Продава ЗЕМЕДЕЛСКА ЗЕМЯ,"Ливада, кат. 4, 2650 дка, Утайника, Продавам земеделска земя с геотермални възможности за инвестиция, вътре има изворна вода, оранжерия  ..., тел.: 0895733632",,,False,продава,земя,Златоград,Област Смолян,0895733632,,https:None,https://www.imot.bg/pcgi/imot.cgi?act=5&adv=1s173195552047386&slink=blq5u8&f1=13,,,,imotbg,717,,,,,,01017c876b2f421a4da71ddc927eb08a
Продава ЗЕМЕДЕЛСКА ЗЕМЯ,"Ливада, кат. 4, 2650 дка, Продава се имот с ГЕОТЕРМАЛНИ възможности и потенциал!!! , тел.: 0878673811",,,False,продава,земя,Златоград,Област Смолян,0878673811,,https:None,https://www.imot.bg/pcgi/imot.cgi?act=5&adv=1s173669350822239&slink=blq5u8&f1=13,,,,imotbg,717,,,,,,01017c876b2f421a4da71ddc927eb08a
Продава ЗЕМЕДЕЛСКА ЗЕМЯ,"Ливада, кат. 4, 1.075 дка, село Полковник Серафимово - местност Манолевото 1075 кв.м Земеделска земя Ток и вода на границата с  ..., тел.: 0888453485",,,False,продава,земя,Полковник Серафимово,Област Смолян,0888453485,,https:None,https://www.imot.bg/pcgi/imot.cgi?act=5&adv=1s172396370712682&slink=blq5u8&f1=13,,,,imotbg,717,,,,,,363c54a318102afa11d59aeba50ce0bd
Продава ЗЕМЕДЕЛСКА ЗЕМЯ,"Нива, кат. 4, 5 дка, Предлагаме на Вашето внимание земеделска земя, находяща се в землището на гр. Банкя, район Банкя, ме ..., тел.: 0888408055",,,False,продава,земя,София,Област София,0888408055,,https://jjcorporation.imot.bg,https://www.imot.bg/pcgi/imot.cgi?act=5&adv=1s170438045625733&slink=blq5u8&f1=13,,,,imotbg,717,,,,,,0e9fc750b9c00a168d572d5d7804f32f
Продава ЗЕМЕДЕЛСКА ЗЕМЯ,"Нива, кат. 4, 13 дка, Земеделски имот, съставляващ два отделни масива от двете страни на улица Банско шосе, между кв. Репу ..., тел.: 0898414272",,,False,продава,земя,София,Област София,0898414272,,https://ekolit.imot.bg,https://www.imot.bg/pcgi/imot.cgi?act=5&adv=1s158383056566685&slink=blq5u8&f1=13,,,,imotbg,717,,,,,,0e9fc750b9c00a168d572d5d7804f32f
Продава ЗЕМЕДЕЛСКА ЗЕМЯ,"Нива, кат. 4, 7787 дка, с.Иваняне, Имоти Премиер предлага на Вашето внимание за продажба 7787 кв.м. Земеделска земя в район Банкя с. Ив ..., тел.: 0879590179",,,False,продава,земя,София,Област София,0879590179,,https://premierimotisf.imot.bg,https://www.imot.bg/pcgi/imot.cgi?act=5&adv=1s172897689095076&slink=blq5u8&f1=13,,,,imotbg,717,,,,,,0e9fc750b9c00a168d572d5d7804f32f
Продава ЗЕМЕДЕЛСКА ЗЕМЯ,"Нива, кат. 4, с Аренден договор до 01.01.2026 г. и рента 450 лв./год., 8 дка, Земеделска земя - 4 категория - 7499 кв.м., обработваема, с договор за аренда. Намира се в землището ..., тел.: 0894388088",,,False,продава,земя,София,Област София,0894388088,,https://immobilia.imot.bg,https://www.imot.bg/pcgi/imot.cgi?act=5&adv=1s167750355595342&slink=blq5u8&f1=13,,,,imotbg,717,,,,,,0e9fc750b9c00a168d572d5d7804f32f
Продава ЗЕМЕДЕЛСКА ЗЕМЯ,"Нива, кат. 4, 1 дка, Пролеша, Земеделска земя, в близост до кв.Черна бара,гр.Божурище.Достъп по полски път.Правилна форма., тел.: 0888756500",,,False,продава,земя,София,Област София,0888756500,,https://bulbag.imot.bg,https://www.imot.bg/pcgi/imot.cgi?act=5&adv=1s168854393052724&slink=blq5u8&f1=13,,,,imotbg,717,,,,,,0e9fc750b9c00a168d572d5d7804f32f
Продава ЗЕМЕДЕЛСКА ЗЕМЯ,"Нива, кат. 4, 2.275 дка, Трояно , СТЕРРА КОНСУЛТ  представя на Вашето внимание ЕКСКЛУЗИВНО  ЗЕМЕДЕЛСКА ЗЕМЯ , област София, община Бож ..., тел.: 0876939669",,,False,продава,земя,София,Област София,0876939669,,https://steraconsult.imot.bg,https://www.imot.bg/pcgi/imot.cgi?act=5&adv=1s169218504669966&slink=blq5u8&f1=13,,,,imotbg,717,,,,,,0e9fc750b9c00a168d572d5d7804f32f
Продава ЗЕМЕДЕЛСКА ЗЕМЯ,"Нива, кат. 4, 6.748 дка, Прекрасен парцел до регулациа в гр.Божурище., тел.: 0899950900",,,False,продава,земя,София,Област София,0899950900,,https://sunskica.imot.bg,https://www.imot.bg/pcgi/imot.cgi?act=5&adv=1s160734756708726&slink=blq5u8&f1=13,,,,imotbg,717,,,,,,0e9fc750b9c00a168d572d5d7804f32f
Продава ЗЕМЕДЕЛСКА ЗЕМЯ,"Нива, кат. 4, 3 дка, с. Гурмазово, Предлага се земеделски имот с правоъгълна форма, между Божурище и с. Гурмазово с начин на трайно пол ..., тел.: 0888250501",,,False,продава,земя,София,Област София,0888250501,,https://helanconsult.imot.bg,https://www.imot.bg/pcgi/imot.cgi?act=5&adv=1s173193727494108&slink=blq5u8&f1=13,,,,imotbg,717,,,,,,0e9fc750b9c00a168d572d5d7804f32f
Продава ЗЕМЕДЕЛСКА ЗЕМЯ,"Нива, кат. 4, 3.796 дка, Пролеша, Продава нива в село Пролеша с площ от 3796кв.м близо до главен път. За огледи : 0889/306603, 0896/60 ..., тел.: 0889/306603",,,False,продава,земя,София,Област София,0889/306603,,https://simeond.imot.bg,https://www.imot.bg/pcgi/imot.cgi?act=5&adv=1s171679289676086&slink=blq5u8&f1=13,,,,imotbg,717,,,,,,0e9fc750b9c00a168d572d5d7804f32f
Продава ЗЕМЕДЕЛСКА ЗЕМЯ,"Нива, кат. 4, 4 дка, Гурмазово, м-т Новините , Перфектни,готови за сделка документи! Предлагаме прекрасен, равен, слънчев парцел, отреден за промиш ..., тел.: 0888638313",,,False,продава,земя,София,Област София,0888638313,,https://luxsofia.imot.bg,https://www.imot.bg/pcgi/imot.cgi?act=5&adv=1s172007463724068&slink=blq5u8&f1=13,,,,imotbg,717,,,,,,0e9fc750b9c00a168d572d5d7804f32f
Продава ЗЕМЕДЕЛСКА ЗЕМЯ,"Нива, кат. 4, с Аренден договор до 15.09.2024 г. и рента 200 лв./год., 4 дка, Предлагаме за продажба поземлен имот, намиращ се в област София, община Божурище, село Пролеша, мест ..., тел.: 0878850916",,,False,продава,земя,София,Област София,0878850916,,https:None,https://www.imot.bg/pcgi/imot.cgi?act=5&adv=1s172175343460272&slink=blq5u8&f1=13,,,,imotbg,717,,,,,,0e9fc750b9c00a168d572d5d7804f32f
Продава ЗЕМЕДЕЛСКА ЗЕМЯ,"Нива, кат. 4, 7.398 дка, ТОП ЦЕНА ЗА РАЙОНА!  ПРОМОЦИЯ!  ПРОДАВА СЕ! ПЕРСПЕКТИВЕН Поземлен имот, находящи се в област София,  ..., тел.: 0899931948 АЛДЕС",,,False,продава,земя,София,Област София,0899931948 АЛДЕС,,https://aldes.imot.bg,https://www.imot.bg/pcgi/imot.cgi?act=5&adv=1s166005020660734&slink=blq5u8&f1=13,,,,imotbg,717,,,,,,0e9fc750b9c00a168d572d5d7804f32f
Продава ЗЕМЕДЕЛСКА ЗЕМЯ,"Нива, кат. 4, 2 дка,  Сердика 1 Недвижими имоти  предлага на Вашето внимание поземлен имот в гр. Елин Пелин, обл. София.  ..., тел.: 0878485556",,,False,продава,земя,София,Област София,0878485556,,https://serdika1.imot.bg,https://www.imot.bg/pcgi/imot.cgi?act=5&adv=1s169338554869289&slink=blq5u8&f1=13,,,,imotbg,717,,,,,,0e9fc750b9c00a168d572d5d7804f32f
Продава ЗЕМЕДЕЛСКА ЗЕМЯ,"Нива, кат. 4, 1.615 дка, ПРОДАВА СЕ! Поземлен имот, находящ се в област София, община Елин Пелин, гр. Елин Пелин, вид собств. ..., тел.: 0899931948 АЛДЕС",,,False,продава,земя,София,Област София,0899931948 АЛДЕС,,https://aldes.imot.bg,https://www.imot.bg/pcgi/imot.cgi?act=5&adv=1s165607544368589&slink=blq5u8&f1=13,,,,imotbg,717,,,,,,0e9fc750b9c00a168d572d5d7804f32f
Продава ЗЕМЕДЕЛСКА ЗЕМЯ,"Нива, кат. 4, 3.849 дка, ПРОДАВАТ СЕ! ПЕРСПЕКТИВНИ Поземлени имоти, находящи се в област София, община Елин Пелин, гр. Елин П ..., тел.: 0899931948 АЛДЕС",,,False,продава,земя,София,Област София,0899931948 АЛДЕС,,https://aldes.imot.bg,https://www.imot.bg/pcgi/imot.cgi?act=5&adv=1s165511299484733&slink=blq5u8&f1=13,,,,imotbg,717,,,,,,0e9fc750b9c00a168d572d5d7804f32f
Продава ЗЕМЕДЕЛСКА ЗЕМЯ,"Нива, кат. 4, 3.997 дка, ПРОДАВА СЕ земеделска земя, отдадена под аренда, засята със слънчоглед: Поземлен имот, находящ се в  ..., тел.: 0899931948 АЛДЕС",,,False,продава,земя,София,Област София,0899931948 АЛДЕС,,https://aldes.imot.bg,https://www.imot.bg/pcgi/imot.cgi?act=5&adv=1s169150210909609&slink=blq5u8&f1=13,,,,imotbg,717,,,,,,0e9fc750b9c00a168d572d5d7804f32f
Продава ЗЕМЕДЕЛСКА ЗЕМЯ,"Нива, кат. 4, 5.25 дка, Хоум Ту Ю представя на Вашето внимание поземлен имот с площ от 5.250 кв.м., находящ се в град Елин П ..., тел.: 0875363330",,,False,продава,земя,София,Област София,0875363330,,https://home2um.imot.bg,https://www.imot.bg/pcgi/imot.cgi?act=5&adv=1s165779817079118&slink=blq5u8&f1=13,,,,imotbg,717,,,,,,0e9fc750b9c00a168d572d5d7804f32f
Продава ЗЕМЕДЕЛСКА ЗЕМЯ,"Нива, кат. 4, 2.214 дка, местност ,,Лаката'',  Агенция за недвижими имоти Домосс предлага за продажба Земеделска земя в гр.Костинброд.  Предлагани ..., тел.: 0877237799",,,False,продава,земя,София,Област София,0877237799,,https://domoss.imot.bg,https://www.imot.bg/pcgi/imot.cgi?act=5&adv=1s169763492375308&slink=blq5u8&f1=13,,,,imotbg,717,,,,,,0e9fc750b9c00a168d572d5d7804f32f
Продава ЗЕМЕДЕЛСКА ЗЕМЯ,"Нива, кат. 4, 2 дка,  'Вивиенда' представя на Вашето внимание земеделска земя в землището на гр. Костинброд.  - 2300 кв.м ..., тел.: 0896815931",,,False,продава,земя,София,Област София,0896815931,,https://vivienda.imot.bg,https://www.imot.bg/pcgi/imot.cgi?act=5&adv=1s167940124961610&slink=blq5u8&f1=13,,,,imotbg,717,,,,,,0e9fc750b9c00a168d572d5d7804f32f
Продава ЗЕМЕДЕЛСКА ЗЕМЯ,"Нива, кат. 4, 1.5 дка,  Равен парцел граничещ с река 2500 кв.м. Намира се между с. Драговищица и с. Голяновци. Парцела е на ..., тел.: 0895133848",,,False,продава,земя,София,Област София,0895133848,,https:None,https://www.imot.bg/pcgi/imot.cgi?act=5&adv=1s173752242494330&slink=blq5u8&f1=13,,,,imotbg,717,,,,,,0e9fc750b9c00a168d572d5d7804f32f
Продава ЗЕМЕДЕЛСКА ЗЕМЯ,"Овощна градина, кат. 4, 6 дка, Представяме Ви: ЕКСКЛУЗИВНО: поземлен имот в кв. Маслово м. Лъката - овощна градина. В имота има 5го ..., тел.: 087 947 8300",,,False,продава,земя,София,Област София,087 947 8300,,https://7imoti.imot.bg,https://www.imot.bg/pcgi/imot.cgi?act=5&adv=1s171334306086944&slink=blq5u8&f1=13,,,,imotbg,717,,,,,,0e9fc750b9c00a168d572d5d7804f32f
Продава ЗЕМЕДЕЛСКА ЗЕМЯ,"Нива, кат. 4, 3 дка, Поземлен имот , близо до Ломско шосе,близо до ток,вода и път !!!Съдействие за вкарване на имота в ре ..., тел.: 0899353357",,,False,продава,земя,София,Област София,0899353357,,https:None,https://www.imot.bg/pcgi/imot.cgi?act=5&adv=1s167958542095520&slink=blq5u8&f1=13,,,,imotbg,717,,,,,,0e9fc750b9c00a168d572d5d7804f32f
Продава ЗЕМЕДЕЛСКА ЗЕМЯ,"Нива, кат. 4, 10 дка, Костинброд, Продавам земеделска земя област София, община Костинброд на разклона от Ломско шосе към с. Драговищи ..., тел.: 0885346697",,,False,продава,земя,София,Област София,0885346697,,https:None,https://www.imot.bg/pcgi/imot.cgi?act=5&adv=1s173727879191090&slink=blq5u8&f1=13,,,,imotbg,717,,,,,,0e9fc750b9c00a168d572d5d7804f32f
Продава ЗЕМЕДЕЛСКА ЗЕМЯ,"Нива, кат. 4, 13 дка, Намалена цена! Гарант дом Ви представя, земеделска земя с площ от 12854 кв.м., находящ се  в индустр ..., тел.: 0895600255",,,False,продава,земя,София,Област София,0895600255,,https://ggrarantdom.imot.bg,https://www.imot.bg/pcgi/imot.cgi?act=5&adv=1s168932894378040&slink=blq5u8&f1=13,,,,imotbg,717,,,,,,0e9fc750b9c00a168d572d5d7804f32f
Продава ЗЕМЕДЕЛСКА ЗЕМЯ,"Нива, кат. 4, 41 дка, 41 487 кв. м. в землището на гр. Костинброд, община Костинброд, област София. Лице от 355 метра на Л ..., тел.: 0884079239",,,False,продава,земя,София,Област София,0884079239,,https:None,https://www.imot.bg/pcgi/imot.cgi?act=5&adv=1s172466098465066&slink=blq5u8&f1=13,,,,imotbg,717,,,,,,0e9fc750b9c00a168d572d5d7804f32f
Продава ЗЕМЕДЕЛСКА ЗЕМЯ,"Нива, кат. 4, 50 дка, Advanced properties предлага 6 бр парцели в град Костинброд на различни локации с различни квадратур ..., тел.: 0878568686",,,False,продава,земя,София,Област София,0878568686,,https://advproperties.imot.bg,https://www.imot.bg/pcgi/imot.cgi?act=5&adv=1s173313348641062&slink=blq5u8&f1=13,,,,imotbg,717,,,,,,0e9fc750b9c00a168d572d5d7804f32f
Продава ЗЕМЕДЕЛСКА ЗЕМЯ,"Нива, кат. 4, 2.7 дка, Негован, Представям ви, два парцела, един до друг, земеделска земя,  4 категория : 2638 м2. - 20500 Е , 5739  ..., тел.: 0886252552",,,False,продава,земя,София,Област София,0886252552,,https:None,https://www.imot.bg/pcgi/imot.cgi?act=5&adv=1s170279618620973&slink=blq5u8&f1=13,,,,imotbg,717,,,,,,0e9fc750b9c00a168d572d5d7804f32f
Продава ЗЕМЕДЕЛСКА ЗЕМЯ,"Нива, кат. 4, 6 дка, Предлагаме на вашето внимание парцел с площ 5600 кв.м. Имотът се намира на Околовръстен път , преди  ..., тел.: 0885508549",,,False,продава,земя,София,Област София,0885508549,,https://rtb.imot.bg,https://www.imot.bg/pcgi/imot.cgi?act=5&adv=1s172061333166293&slink=blq5u8&f1=13,,,,imotbg,717,,,,,,0e9fc750b9c00a168d572d5d7804f32f
Продава ЗЕМЕДЕЛСКА ЗЕМЯ,"Нива, кат. 4, с Аренден договор до 02.08.2025 г. и рента 1000 лв./год., 10.249 дка, Земеделска земя до регулация - ул. Шопска и ул. Лозарски път, тел.: 0896078639",,,False,продава,земя,София,Област София,0896078639,,https:None,https://www.imot.bg/pcgi/imot.cgi?act=5&adv=1s173747607765269&slink=blq5u8&f1=13,,,,imotbg,717,,,,,,0e9fc750b9c00a168d572d5d7804f32f
Продава ЗЕМЕДЕЛСКА ЗЕМЯ,"Ливада, кат. 4, 0.82 дка, с. Свидня, АRCO REAL ESTATE предлага ексклузивно Поземлен имот от 820 кв.м в с. Свидня, общ. Своге, обл Софийск ..., тел.: 0896733915",,,False,продава,земя,София,Област София,0896733915,,https://arcoimoti.imot.bg,https://www.imot.bg/pcgi/imot.cgi?act=5&adv=1s171983108096686&slink=blq5u8&f1=13,,,,imotbg,717,,,,,,0e9fc750b9c00a168d572d5d7804f32f
Продава ЗЕМЕДЕЛСКА ЗЕМЯ,"Нива, кат. 4, 3 дка, Е80 разклона за с.Петърч, НИВА С 2 ЛИЦА - НА МЕЖДУНАРОДНИЯ ПЪТ Е-80 И НА СТАРИЯ ПЪТ ЗА ГР. СЛИВНИЦА. КАТО СЕ ПЪТУВА ОТ СЛИВНИЦ ..., тел.: 0888806450",,,False,продава,земя,София,Област София,0888806450,,https://asterisk.imot.bg,https://www.imot.bg/pcgi/imot.cgi?act=5&adv=1s113205008317914&slink=blq5u8&f1=13,,,,imotbg,717,,,,,,0e9fc750b9c00a168d572d5d7804f32f
Продава ЗЕМЕДЕЛСКА ЗЕМЯ,"Нива, кат. 4, 1 дка, Продавам имот в гр. София, кв. Требич с атрактивна локация. Имота се обработва. Изрядни документи. , тел.: 0888737886",,,False,продава,земя,София,Област София,0888737886,,https:None,https://www.imot.bg/pcgi/imot.cgi?act=5&adv=1s173804550755875&slink=blq5u8&f1=13,,,,imotbg,717,,,,,,0e9fc750b9c00a168d572d5d7804f32f
Продава ЗЕМЕДЕЛСКА ЗЕМЯ,"Нива, кат. 4, 0.5 дка, SVETLINA REAL ESTATE има удоволствието да Ви представи земеделска земя намираща се в р-н Кремиковци  ..., тел.: 0893006908",,,False,продава,земя,София,Област София,0893006908,,https://svetlina.imot.bg,https://www.imot.bg/pcgi/imot.cgi?act=5&adv=1s172604258470600&slink=blq5u8&f1=13,,,,imotbg,717,,,,,,0e9fc750b9c00a168d572d5d7804f32f
Продава ЗЕМЕДЕЛСКА ЗЕМЯ,"Нива, кат. 4, 1 дка, SVETLINA REAL ESTATE има удоволствието да Ви представи земеделска земя намираща се в р-н Кремиковци  ..., тел.: 0893006908",,,False,продава,земя,София,Област София,0893006908,,https://svetlina.imot.bg,https://www.imot.bg/pcgi/imot.cgi?act=5&adv=1s172604238800457&slink=blq5u8&f1=13,,,,imotbg,717,,,,,,0e9fc750b9c00a168d572d5d7804f32f
Продава ЗЕМЕДЕЛСКА ЗЕМЯ,"Ливада, кат. 4, 1.681 дка, село Бистрица, Панчарево, Продавам ливада с площ от 1681 кв.м., в близост до новопостроени къщи. Продава се и ливада от 1 дека ..., тел.: 0899956453",,,False,продава,земя,София,Област София,0899956453,,https:None,https://www.imot.bg/pcgi/imot.cgi?act=5&adv=1s173712765486334&slink=blq5u8&f1=13,,,,imotbg,717,,,,,,0e9fc750b9c00a168d572d5d7804f32f
Продава ЗЕМЕДЕЛСКА ЗЕМЯ,"Нива, кат. 4, 1 дка, с.Лозен, Имот с площ от 520 кв.м , със статут на земеделска земя и друг вид съпътстващо застрояване с подпома ..., тел.: 0898414272",,,False,продава,земя,София,Област София,0898414272,,https://ekolit.imot.bg,https://www.imot.bg/pcgi/imot.cgi?act=5&adv=1s167336204140094&slink=blq5u8&f1=13,,,,imotbg,717,,,,,,0e9fc750b9c00a168d572d5d7804f32f
Продава ЗЕМЕДЕЛСКА ЗЕМЯ,"Нива, кат. 4, 1 дка,  ПЗ Илиянци, Ние Ви предлагаме, поземлен имот с площ 1334 кв.м., категория 4-та в гр. София, район Надежда, м. Чу ..., тел.: 0876491121",,,False,продава,земя,София,Област София,0876491121,,https://zlatenkluch.imot.bg,https://www.imot.bg/pcgi/imot.cgi?act=5&adv=1s170263468005819&slink=blq5u8&f1=14,,,,imotbg,717,,,,,,0e9fc750b9c00a168d572d5d7804f32f
Продава ЗЕМЕДЕЛСКА ЗЕМЯ,"Нива, кат. 4, 1 дка,  ПЗ Илиянци, Ние Ви предлагаме, поземлен имот с площ 1334 кв.м., категория 4-та в гр. София, район Надежда, м. Чу ..., тел.: 0876491121",,,False,продава,земя,София,Област София,0876491121,,https://emilirealestate8.imot.bg,https://www.imot.bg/pcgi/imot.cgi?act=5&adv=1s170263468005819&slink=blq5u8&f1=14,,,,imotbg,717,,,,,,0e9fc750b9c00a168d572d5d7804f32f
Продава ЗЕМЕДЕЛСКА ЗЕМЯ,"Нива, кат. 4, 3 дка, Филиповци, Земеделски имот от категория 4 с правоъгълна форма и лице на стопански черен път. Имотът се намира в ..., тел.: 024683103",,,False,продава,земя,София,Област София,024683103,,https://ekolit.imot.bg,https://www.imot.bg/pcgi/imot.cgi?act=5&adv=1s158383016947471&slink=blq5u8&f1=14,,,,imotbg,717,,,,,,0e9fc750b9c00a168d572d5d7804f32f
Продава ЗЕМЕДЕЛСКА ЗЕМЯ,"Нива, кат. 4, 8.3 дка, Кремиковци, Имотът е разположен с лице на основния път /50 м./ непосредствено преди  влизане в квартал Сеславци, ..., тел.: 0898515970",,,False,продава,земя,София,Област София,0898515970,,https://mitra.imot.bg,https://www.imot.bg/pcgi/imot.cgi?act=5&adv=1s173392338339641&slink=blq5u8&f1=14,,,,imotbg,717,,,,,,0e9fc750b9c00a168d572d5d7804f32f
Продава ЗЕМЕДЕЛСКА ЗЕМЯ,"Нива, кат. 4, 2 дка,  ПЗ Илиянци, Ние Ви предлагаме поземлен имот с площ 2001 кв.м., категория 4-та в гр. София, район Надежда, м. Чуч ..., тел.: 0876491121",,,False,продава,земя,София,Област София,0876491121,,https://emilirealestate8.imot.bg,https://www.imot.bg/pcgi/imot.cgi?act=5&adv=1s170263494067595&slink=blq5u8&f1=14,,,,imotbg,717,,,,,,0e9fc750b9c00a168d572d5d7804f32f
Продава ЗЕМЕДЕЛСКА ЗЕМЯ,"Нива, кат. 4, 2 дка, С лице на асфалтов път до ТЕЦ Люлин и жп гара Волуяк, 2 дка, ток и вода в близост, на около 500 м от ..., тел.: 0887144307",,,False,продава,земя,София,Област София,0887144307,,https:None,https://www.imot.bg/pcgi/imot.cgi?act=5&adv=1s160045669860175&slink=blq5u8&f1=14,,,,imotbg,717,,,,,,0e9fc750b9c00a168d572d5d7804f32f
