raw_title,raw_description,price,currency,without_dds,offer_type,property_type,city,neighborhood,contact_info,agency,agency_url,details_url,num_photos,date_time_added,search_url,site,total_offers,ref_no,time,price_per_m2,area,floor,fingerprint_hash
Продава ЗЕМЕДЕЛСКА ЗЕМЯ,"Нива, кат. 3, 3.6 дка, ОФЕРТА 5737 Парцел с лице на път, в близост до асфалт, подходящ за жилищно или промишлено строителст ..., тел.: 0886194213",,,False,продава,земя,Пловдив,Област Пловдив,0886194213,,https://estateshop22.imot.bg,https://www.imot.bg/pcgi/imot.cgi?act=5&adv=1s171802483170303&slink=bjri0i&f1=9,,,,imotbg,471,,,,,,99b4255d800a7e68ffa3726da19f4629
Продава ЗЕМЕДЕЛСКА ЗЕМЯ,"Нива, кат. 3, 3.25 дка,  ОФЕРТА 4372 Земеделски имот в землището на с. Белащица, подходящо за парцелиране за жилищно или про ..., тел.: 0886194213",,,False,продава,земя,Пловдив,Област Пловдив,0886194213,,https://estateshop22.imot.bg,https://www.imot.bg/pcgi/imot.cgi?act=5&adv=1s171697555275851&slink=bjri0i&f1=9,,,,imotbg,471,,,,,,99b4255d800a7e68ffa3726da19f4629
Продава ЗЕМЕДЕЛСКА ЗЕМЯ,"Нива, кат. 3, 3 дка, Компания 'ЕКС' представя на Вашето внимание земеделска земя в Белащица.  МЕСТОПОЛОЖЕНИЕ: Имота се на ..., тел.: 0887 77 99 90",,,False,продава,земя,Пловдив,Област Пловдив,0887 77 99 90,,https://xnvd_plovdiv.imot.bg,https://www.imot.bg/pcgi/imot.cgi?act=5&adv=1s173462524574464&slink=bjri0i&f1=9,,,,imotbg,471,,,,,,99b4255d800a7e68ffa3726da19f4629
Продава ЗЕМЕДЕЛСКА ЗЕМЯ,"Нива, кат. 3, 3 дка, Каратопрак, Продавам изгодно поземлен имот в землището на Белащица (ДО РЕГУЛАЦИЯ!!)  Продавам изгодно поземлен и ..., тел.: 0895473979",,,False,продава,земя,Пловдив,Област Пловдив,0895473979,,https://largosofia.imot.bg,https://www.imot.bg/pcgi/imot.cgi?act=5&adv=1s173022712032512&slink=bjri0i&f1=9,,,,imotbg,471,,,,,,99b4255d800a7e68ffa3726da19f4629
Продава ЗЕМЕДЕЛСКА ЗЕМЯ,"Нива, кат. 3, 4.8 дка, ОФЕРТА 4752 Земеделски имот с правилна форма, подходящ за преубразуване в УПИ-та, за жилищно или про ..., тел.: 0886194213",,,False,продава,земя,Пловдив,Област Пловдив,0886194213,,https://estateshop22.imot.bg,https://www.imot.bg/pcgi/imot.cgi?act=5&adv=1s171802538514315&slink=bjri0i&f1=9,,,,imotbg,471,,,,,,99b4255d800a7e68ffa3726da19f4629
Продава ЗЕМЕДЕЛСКА ЗЕМЯ,"Нива, кат. 3, 4 дка, До ток, До път, До вода, тел.: 0877524755",,,False,продава,земя,Пловдив,Област Пловдив,0877524755,,https://dorin.imot.bg,https://www.imot.bg/pcgi/imot.cgi?act=5&adv=1s166676683969430&slink=bjri0i&f1=9,,,,imotbg,471,,,,,,99b4255d800a7e68ffa3726da19f4629
Продава ЗЕМЕДЕЛСКА ЗЕМЯ,"Лозе, кат. 3, 5.9 дка, ОФЕРТА 2130 Земеделски имот с правилна форма, подходящ за разделяне на малки УПИта, подходящ за жили ..., тел.: 0886194213",,,False,продава,земя,Пловдив,Област Пловдив,0886194213,,https://estateshop22.imot.bg,https://www.imot.bg/pcgi/imot.cgi?act=5&adv=1s171707169516190&slink=bjri0i&f1=9,,,,imotbg,471,,,,,,99b4255d800a7e68ffa3726da19f4629
Продава ЗЕМЕДЕЛСКА ЗЕМЯ,"Нива, кат. 3, 5.901 дка, Агенция за недвижими имоти ' ДОРИН ',предлага на Вашето внимание парцел с площ от 5901кв.м.  ..., тел.: 0877524755",,,False,продава,земя,Пловдив,Област Пловдив,0877524755,,https://dorin.imot.bg,https://www.imot.bg/pcgi/imot.cgi?act=5&adv=1s166212881087773&slink=bjri0i&f1=9,,,,imotbg,471,,,,,,99b4255d800a7e68ffa3726da19f4629
Продава ЗЕМЕДЕЛСКА ЗЕМЯ,"Нива, кат. 3, 4.909 дка, 6680 Предлагаме ви земеделска земя - нива 3 категория на изключително комуникативно място в близост  ..., тел.: 0876966282",,,False,продава,земя,Пловдив,Област Пловдив,0876966282,,https://arenaimot.imot.bg,https://www.imot.bg/pcgi/imot.cgi?act=5&adv=1s167532639266143&slink=bjri0i&f1=9,,,,imotbg,471,,,,,,99b4255d800a7e68ffa3726da19f4629
Продава ЗЕМЕДЕЛСКА ЗЕМЯ,"Нива, кат. 3, 6 дка, Организация Фокус има удоволствието да ви представи земеделска земя в с. Белащица, местност Герена!  ..., тел.: 0892083015",,,False,продава,земя,Пловдив,Област Пловдив,0892083015,,https://focusltd2020.imot.bg,https://www.imot.bg/pcgi/imot.cgi?act=5&adv=1s170074673620103&slink=bjri0i&f1=9,,,,imotbg,471,,,,,,99b4255d800a7e68ffa3726da19f4629
Продава ЗЕМЕДЕЛСКА ЗЕМЯ,"Овощна градина, кат. 3, 4.9 дка, Земята се намира на околовръстен път Белащица Пловдив срещу OMV хубаво и локално място 80лв.кв.Може  ..., тел.: 0896921270",,,False,продава,земя,Пловдив,Област Пловдив,0896921270,,https:None,https://www.imot.bg/pcgi/imot.cgi?act=5&adv=1s161569843324022&slink=bjri0i&f1=9,,,,imotbg,471,,,,,,99b4255d800a7e68ffa3726da19f4629
Продава ЗЕМЕДЕЛСКА ЗЕМЯ,"Нива, кат. 3, 9.999 дка, Агенция за недвижими имоти ' ДОРИН ',предлага на Вашето внимание парцел с площ от 9999кв.м. намиращ  ..., тел.: 0877524755",,,False,продава,земя,Пловдив,Област Пловдив,0877524755,,https://dorin.imot.bg,https://www.imot.bg/pcgi/imot.cgi?act=5&adv=1s166212933694121&slink=bjri0i&f1=9,,,,imotbg,471,,,,,,99b4255d800a7e68ffa3726da19f4629
Продава ЗЕМЕДЕЛСКА ЗЕМЯ,"Нива, кат. 3, 10 дка, Организация Фокус има удоволствието да ви представи земеделска  Парцелът е 9 999кв.м., а канализация ..., тел.: 0892083015",,,False,продава,земя,Пловдив,Област Пловдив,0892083015,,https://focusltd2020.imot.bg,https://www.imot.bg/pcgi/imot.cgi?act=5&adv=1s170074399009331&slink=bjri0i&f1=9,,,,imotbg,471,,,,,,99b4255d800a7e68ffa3726da19f4629
Продава ЗЕМЕДЕЛСКА ЗЕМЯ,"Нива, кат. 3, 6100 дка, Околовръстно шосе,   11250 - Продавам имот с идентификатор 03304.3.11, с. Белащица -  с  квадратура:  6100 кв.м., местн ..., тел.: 0888037161",,,False,продава,земя,Пловдив,Област Пловдив,0888037161,,https://megi_invest.imot.bg,https://www.imot.bg/pcgi/imot.cgi?act=5&adv=1s173288159806130&slink=bjri0i&f1=9,,,,imotbg,471,,,,,,99b4255d800a7e68ffa3726da19f4629
Продава ЗЕМЕДЕЛСКА ЗЕМЯ,"Нива, кат. 3, 9 дка, Организация Фокус има удоволствието да ви представи парцел в с. Белащица, местност Тръновица!  Парце ..., тел.: 0892083015",,,False,продава,земя,Пловдив,Област Пловдив,0892083015,,https://focusltd2020.imot.bg,https://www.imot.bg/pcgi/imot.cgi?act=5&adv=1s170893906946117&slink=bjri0i&f1=9,,,,imotbg,471,,,,,,99b4255d800a7e68ffa3726da19f4629
Продава ЗЕМЕДЕЛСКА ЗЕМЯ,"Нива, кат. 2, 7 дка, Автомагистрала Тракия, До ток, До път, тел.: 0898955435",,,False,продава,земя,Пловдив,Област Пловдив,0898955435,,https:None,https://www.imot.bg/pcgi/imot.cgi?act=5&adv=1s167991339999175&slink=bjri0i&f1=9,,,,imotbg,471,,,,,,99b4255d800a7e68ffa3726da19f4629
Продава ЗЕМЕДЕЛСКА ЗЕМЯ,"Нива, кат. 3, 11.798 дка, ПОПОВ КОНСУЛТ има удоволствието да Ви представи парцел на страхотна локация в село Браниполе! Имотът ..., тел.: 0886755477",,,False,продава,земя,Пловдив,Област Пловдив,0886755477,,https://popov_konsult.imot.bg,https://www.imot.bg/pcgi/imot.cgi?act=5&adv=1s172285513828210&slink=bjri0i&f1=9,,,,imotbg,471,,,,,,99b4255d800a7e68ffa3726da19f4629
Продава ЗЕМЕДЕЛСКА ЗЕМЯ,"Нива, кат. 3, 3 дка, OPEN Homes Ви представя поземлен имот, разположен в землището на с. Брестник, област Пловдив, с възм ..., тел.: 0884040538",,,False,продава,земя,Пловдив,Област Пловдив,0884040538,,https://openhomes.imot.bg,https://www.imot.bg/pcgi/imot.cgi?act=5&adv=1s171146633744738&slink=bjri0i&f1=9,,,,imotbg,471,,,,,,99b4255d800a7e68ffa3726da19f4629
Продава ЗЕМЕДЕЛСКА ЗЕМЯ,"Нива, кат. 3, 1.26 дка, Варник, Парцела се намира във местността Варник и е над последната вила..Статута на земята е за'труд и о ..., тел.: 0894315828",,,False,продава,земя,Пловдив,Област Пловдив,0894315828,,https:None,https://www.imot.bg/pcgi/imot.cgi?act=5&adv=1s169063576801753&slink=bjri0i&f1=9,,,,imotbg,471,,,,,,99b4255d800a7e68ffa3726da19f4629
Продава ЗЕМЕДЕЛСКА ЗЕМЯ,"Нива, кат. 3, 2.789 дка, местност Шарпавица, Земеделска земя 2789 кв.м. , с идент.   06447.5.576 Нивата е близо до околовръстното шосе и прелеза  ..., тел.: 0895 703 643",,,False,продава,земя,Пловдив,Област Пловдив,0895 703 643,,https:None,https://www.imot.bg/pcgi/imot.cgi?act=5&adv=1s138541016122644&slink=bjri0i&f1=9,,,,imotbg,471,,,,,,99b4255d800a7e68ffa3726da19f4629
Продава ЗЕМЕДЕЛСКА ЗЕМЯ,"Нива, кат. 3, 5 дка, Представяме Ви голям земеделски имот с отлична локация, разположен в живописното село Брестник, обла ..., тел.: 0893901806",,,False,продава,земя,Пловдив,Област Пловдив,0893901806,,https:None,https://www.imot.bg/pcgi/imot.cgi?act=5&adv=1s172389881197338&slink=bjri0i&f1=9,,,,imotbg,471,,,,,,99b4255d800a7e68ffa3726da19f4629
Продава ЗЕМЕДЕЛСКА ЗЕМЯ,"Лозе, кат. 3, 3 дка, OPEN Homes представя поземлен имот с голям потенциал, разположена в началото на с. Брестник, област  ..., тел.: 0884040538",,,False,продава,земя,Пловдив,Област Пловдив,0884040538,,https://openhomes.imot.bg,https://www.imot.bg/pcgi/imot.cgi?act=5&adv=1s171146673026556&slink=bjri0i&f1=9,,,,imotbg,471,,,,,,99b4255d800a7e68ffa3726da19f4629
Продава ЗЕМЕДЕЛСКА ЗЕМЯ,"Нива, кат. 3, 5 дка, Земеделска земя 5534 кв м  с начин на трайно ползване - нива . трета категория при неполивани услови ..., тел.: 0887737333",,,False,продава,земя,Пловдив,Област Пловдив,0887737333,,https://tal.imot.bg,https://www.imot.bg/pcgi/imot.cgi?act=5&adv=1s170721249229320&slink=bjri0i&f1=9,,,,imotbg,471,,,,,,99b4255d800a7e68ffa3726da19f4629
Продава ЗЕМЕДЕЛСКА ЗЕМЯ,"Овощна градина, кат. 3, 2000 дка, Агенция ФОРУМ предлага Черешова градина в началото на с. Брестник. Намира се на втора линия от главн ..., тел.: 0882908145",,,False,продава,земя,Пловдив,Област Пловдив,0882908145,,https://forumimoti1.imot.bg,https://www.imot.bg/pcgi/imot.cgi?act=5&adv=1s171162997864801&slink=bjri0i&f1=9,,,,imotbg,471,,,,,,99b4255d800a7e68ffa3726da19f4629
Продава ЗЕМЕДЕЛСКА ЗЕМЯ,"Лозе, кат. 3, 4.77 дка,  ОФЕРТА 6031 Земеделски имот с правилна форма и голямо лице на път, подходящ заразделяне на малки УП ..., тел.: 0886194213",,,False,продава,земя,Пловдив,Област Пловдив,0886194213,,https://estateshop22.imot.bg,https://www.imot.bg/pcgi/imot.cgi?act=5&adv=1s171697505857090&slink=bjri0i&f1=9,,,,imotbg,471,,,,,,99b4255d800a7e68ffa3726da19f4629
Продава ЗЕМЕДЕЛСКА ЗЕМЯ,"Нива, кат. 2, 5.5 дка, Прекрасен имот, на изключително комуникативно място, ограден е с ограда с бетонни колове.    Граничи ..., тел.: 0898777324",,,False,продава,земя,Пловдив,Област Пловдив,0898777324,,https:None,https://www.imot.bg/pcgi/imot.cgi?act=5&adv=1s159508022261494&slink=bjri0i&f1=9,,,,imotbg,471,,,,,,99b4255d800a7e68ffa3726da19f4629
Продава ЗЕМЕДЕЛСКА ЗЕМЯ,"Нива, кат. 3, с Аренден договор до 30.09.2025 г. и рента 500 лв./год., 5 дка, Кедерица, Земята се намира в непосредствена близост до с.Калековец.Малко след (на метри)табелата на селото пос ..., тел.: 0897030487",,,False,продава,земя,Пловдив,Област Пловдив,0897030487,,https://kondor.imot.bg,https://www.imot.bg/pcgi/imot.cgi?act=5&adv=1s173419234546576&slink=bjri0i&f1=10,,,,imotbg,471,,,,,,99b4255d800a7e68ffa3726da19f4629
Продава ЗЕМЕДЕЛСКА ЗЕМЯ,"Нива, кат. 3, с Аренден договор до 30.09.2025 г. и рента 500 лв./год., 5 дка, Кедерица, Земята се намира в непосредствена близост до с.Калековец.Малко след (на метри)табелата на селото пос ..., тел.: 0897030487",,,False,продава,земя,Пловдив,Област Пловдив,0897030487,,https:None,https://www.imot.bg/pcgi/imot.cgi?act=5&adv=1s173419234546576&slink=bjri0i&f1=10,,,,imotbg,471,,,,,,99b4255d800a7e68ffa3726da19f4629
Продава ЗЕМЕДЕЛСКА ЗЕМЯ,"Зеленчукова градина, кат. 3, 5 дка, с лице на пътя за Хисар, Парцел с лице на пътя за Хисар преди Калояново, тел.: 0899979697",,,False,продава,земя,Пловдив,Област Пловдив,0899979697,,https://plimoti.imot.bg,https://www.imot.bg/pcgi/imot.cgi?act=5&adv=1s171916582168565&slink=bjri0i&f1=10,,,,imotbg,471,,,,,,99b4255d800a7e68ffa3726da19f4629
Продава ЗЕМЕДЕЛСКА ЗЕМЯ,"Овощна градина, кат. 3, 41 дка, КОДг 15664. Овощните градини 41дка ( 7,4дка сливи, 5дка череши, 6дка череши, 19,4дка ябълки). Масиви ..., тел.: 0894 216 451",,,False,продава,земя,Пловдив,Област Пловдив,0894 216 451,,https://continental_rea.imot.bg,https://www.imot.bg/pcgi/imot.cgi?act=5&adv=1s171171021211475&slink=bjri0i&f1=10,,,,imotbg,471,,,,,,99b4255d800a7e68ffa3726da19f4629
Продава ЗЕМЕДЕЛСКА ЗЕМЯ,"Нива, кат. 3, 4000 дка, тел.: 0888934113",,,False,продава,земя,Пловдив,Област Пловдив,0888934113,,https:None,https://www.imot.bg/pcgi/imot.cgi?act=5&adv=1s173608840083677&slink=bjri0i&f1=10,,,,imotbg,471,,,,,,99b4255d800a7e68ffa3726da19f4629
Продава ЗЕМЕДЕЛСКА ЗЕМЯ,"Нива, кат. 3, 4500 дка, ТОП ЦЕНА 67500 евро!!! ИНВЕСТИЦИОННО ПРЕДЛОЖЕНИЕ!!! НА АСЕНОВГРАДСКО ШОСЕ!!!  Инклузив недвижими имо ..., тел.: 0875363320",,,False,продава,земя,Пловдив,Област Пловдив,0875363320,,https:None,https://www.imot.bg/pcgi/imot.cgi?act=5&adv=1s172926307490486&slink=bjri0i&f1=10,,,,imotbg,471,,,,,,99b4255d800a7e68ffa3726da19f4629
Продава ЗЕМЕДЕЛСКА ЗЕМЯ,"Нива, кат. 1, 13 дка, Панорамен поземлен имот 13 дка. граничещ с язовир Алмалъка с развит риболов. Прекрасен масив за разв ..., тел.: 0893371844",,,False,продава,земя,Пловдив,Област Пловдив,0893371844,,https:None,https://www.imot.bg/pcgi/imot.cgi?act=5&adv=1s173654018922381&slink=bjri0i&f1=10,,,,imotbg,471,,,,,,99b4255d800a7e68ffa3726da19f4629
Продава ЗЕМЕДЕЛСКА ЗЕМЯ,"Нива, кат. 3, 22 дка, Номер на оферта: 619913  Агенция за недвижими имоти 'Trivium Estate' продава земеделска земя ..., тел.: 0896878933",,,False,продава,земя,Пловдив,Област Пловдив,0896878933,,https://trivium.imot.bg,https://www.imot.bg/pcgi/imot.cgi?act=5&adv=1s173102684767851&slink=bjri0i&f1=10,,,,imotbg,471,,,,,,99b4255d800a7e68ffa3726da19f4629
Продава ЗЕМЕДЕЛСКА ЗЕМЯ,"Нива, кат. 3, 1.8 дка, Номер на оферта: 619354  Агенция за недвижими имоти 'TRIVIUM ESTATE' продава екслузивно земеделска з ..., тел.: 0896878933",,,False,продава,земя,Пловдив,Област Пловдив,0896878933,,https://trivium.imot.bg,https://www.imot.bg/pcgi/imot.cgi?act=5&adv=1s173102819258694&slink=bjri0i&f1=10,,,,imotbg,471,,,,,,99b4255d800a7e68ffa3726da19f4629
Продава ЗЕМЕДЕЛСКА ЗЕМЯ,"Нива, кат. 3, с Аренден договор до 30.09.2025 г. и рента 50 лв./год., 10 дка, С цялото ми уважение, НЕ мога да предложа комисион за посредници.  Продавам собствена земя , находящ ..., тел.: 0897348856",,,False,продава,земя,Пловдив,Област Пловдив,0897348856,,https:None,https://www.imot.bg/pcgi/imot.cgi?act=5&adv=1s173329868634734&slink=bjri0i&f1=10,,,,imotbg,471,,,,,,99b4255d800a7e68ffa3726da19f4629
Продава ЗЕМЕДЕЛСКА ЗЕМЯ,"Нива, кат. 3, 160 дка, Моля, свържете се чрез WhatsApp или viber. Полетата са на много добри места... , тел.: 0885144363",,,False,продава,земя,Завет,Област Разград,0885144363,,https:None,https://www.imot.bg/pcgi/imot.cgi?act=5&adv=1s173436291083204&slink=bjri0i&f1=10,,,,imotbg,471,,,,,,f9e496dbc95ff027231a241b1cf550e1
Продава ЗЕМЕДЕЛСКА ЗЕМЯ,"Нива, кат. 3, 3.5 дка, Дял от ниви., тел.: 0896180239",,,False,продава,земя,Кубрат,Област Разград,0896180239,,https:None,https://www.imot.bg/pcgi/imot.cgi?act=5&adv=1s171031943694632&slink=bjri0i&f1=10,,,,imotbg,471,,,,,,11faa0d20b8e7f53f38b4ad418777662
Продава ЗЕМЕДЕЛСКА ЗЕМЯ,"Нива, кат. 3, 21 дка, Анастасов кладенец, Предлага се за продажба 21 декара плодородна земеделска земя в село Дряновец, област Разград. Земята ..., тел.: 0895703496",,,False,продава,земя,Дряновец,Област Разград,0895703496,,https:None,https://www.imot.bg/pcgi/imot.cgi?act=5&adv=1s173657892093440&slink=bjri0i&f1=10,,,,imotbg,471,,,,,,5bcd722e67b73cdfd5210d1f6fa1bca5
Продава ЗЕМЕДЕЛСКА ЗЕМЯ,"Нива, кат. 3, 17.716 дка, Продавам нива  в с.Топчии,Разградска област,3-та категория,с идентификатор 72850.73.56 Нивата не се  ..., тел.: 0888343626",,,False,продава,земя,Топчии,Област Разград,0888343626,,https://toni55.imot.bg,https://www.imot.bg/pcgi/imot.cgi?act=5&adv=1s169211099155419&slink=bjri0i&f1=10,,,,imotbg,471,,,,,,d653cd93222745e9e273d0b0df98e58c
Продава ЗЕМЕДЕЛСКА ЗЕМЯ,"Нива, кат. 3, 30 дка, Продавам нива 30 дка в с.Топчии,Разградска област.Договорът изтича до една година,рента има,нивата е ..., тел.: 0888343626",,,False,продава,земя,Топчии,Област Разград,0888343626,,https://toni55.imot.bg,https://www.imot.bg/pcgi/imot.cgi?act=5&adv=1s169952925539745&slink=bjri0i&f1=10,,,,imotbg,471,,,,,,d653cd93222745e9e273d0b0df98e58c
Продава ЗЕМЕДЕЛСКА ЗЕМЯ,"Нива, кат. 3, 3.4 дка, Пътя Русе - София,  Агенция СТАР ХАУС продава 3.4 дка земеделска земя срещу ЖП Гара Долапите на главният път Русе- Софи ..., тел.: 0888979482",,,False,продава,земя,Русе,Област Русе,0888979482,,https://starhouse.imot.bg,https://www.imot.bg/pcgi/imot.cgi?act=5&adv=1s172725591048785&slink=bjri0i&f1=10,,,,imotbg,471,,,,,,2ed8dc8232a89981a538a307d32d7440
Продава ЗЕМЕДЕЛСКА ЗЕМЯ,"Зеленчукова градина, кат. 3, 4502 дка, кв. Средна кула,  Агенция 'Марая' Ви предлага за продажба равен парцел до асфалтов път, 3-та категория с площ 3502 кв ..., тел.: 0999 99 27 99",,,False,продава,земя,Русе,Област Русе,0999 99 27 99,,https://maraia.imot.bg,https://www.imot.bg/pcgi/imot.cgi?act=5&adv=1s173270085510048&slink=bjri0i&f1=10,,,,imotbg,471,,,,,,2ed8dc8232a89981a538a307d32d7440
Продава ЗЕМЕДЕЛСКА ЗЕМЯ,"Нива, кат. 3, 6.7 дка, тел.: 0896180239",,,False,продава,земя,Сливо поле,Област Русе,0896180239,,https:None,https://www.imot.bg/pcgi/imot.cgi?act=5&adv=1s171031764738842&slink=bjri0i&f1=10,,,,imotbg,471,,,,,,b0ecbff5266f46290ba574ff8554d2dc
Продава ЗЕМЕДЕЛСКА ЗЕМЯ,"Нива, кат. 3, с Аренден договор до 20.07.2029 г. и рента 80 лв./год., 36 дка, Продавам земя в с.Божичен,обработваема е,3-та категория,само 5 дка е 4-та категория.Аренден договор  ..., тел.: 0888343626",,,False,продава,земя,Божичен,Област Русе,0888343626,,https://toni55.imot.bg,https://www.imot.bg/pcgi/imot.cgi?act=5&adv=1s171084956014332&slink=bjri0i&f1=10,,,,imotbg,471,,,,,,91dae2f1b3457441514fb2b5b9fe56a5
Продава ЗЕМЕДЕЛСКА ЗЕМЯ,"Нива, кат. 3, 24.429 дка, общ.Иваново, Предлагаме Ви нива  с големина 24 ,429 дка намираща се в село Нисово , местност Галица ., тел.: 0898770915",,,False,продава,земя,Нисово,Област Русе,0898770915,,https:None,https://www.imot.bg/pcgi/imot.cgi?act=5&adv=1s168538799049072&slink=bjri0i&f1=10,,,,imotbg,471,,,,,,9c34d0b73b2bcc60a515ba7f892cb78a
Продава ЗЕМЕДЕЛСКА ЗЕМЯ,"Нива, кат. 3, 15 дка, Продаваме 15 декара ниви и 600м2 лозе в район с. Помен и гр. Бяла Русенско. Земята е в Дунавската ра ..., тел.: 0877730080",,,False,продава,земя,Помен,Област Русе,0877730080,,https://alfaomega.imot.bg,https://www.imot.bg/pcgi/imot.cgi?act=5&adv=1s172529784951427&slink=bjri0i&f1=10,,,,imotbg,471,,,,,,57c9183e2688997508494129b494d854
Продава ЗЕМЕДЕЛСКА ЗЕМЯ,"Нива, кат. 3, с Аренден договор до 30.09.2024 г. и рента 85 лв./год., 5 дка, м. Барата , Икономически център 'КОМОР' отдел недвижими имоти предлага на вашето внимание земеделска земя в с. С ..., тел.: 0876677595",,,False,продава,земя,Сандрово,Област Русе,0876677595,,https://komor.imot.bg,https://www.imot.bg/pcgi/imot.cgi?act=5&adv=1s170852443134921&slink=bjri0i&f1=10,,,,imotbg,471,,,,,,7991ffc2695761706653a7a1e4e0545c
Продава ЗЕМЕДЕЛСКА ЗЕМЯ,"Овощна градина, кат. 3, 28 дка, ЕРА  недвижими имоти офис Лидер Ви предлага за продажба овощни орехови градини в активно плододаване ..., тел.: 0877688449",,,False,продава,земя,Семерджиево,Област Русе,0877688449,,https://eralider.imot.bg,https://www.imot.bg/pcgi/imot.cgi?act=5&adv=1s171024468242119&slink=bjri0i&f1=10,,,,imotbg,471,,,,,,5b54ae909a7457228e400dba9b95cefe
