raw_title,raw_description,price,currency,without_dds,offer_type,property_type,city,neighborhood,contact_info,agency,agency_url,details_url,num_photos,date_time_added,search_url,site,total_offers,ref_no,time,price_per_m2,area,floor,fingerprint_hash
Продава ЗЕМЕДЕЛСКА ЗЕМЯ,"Лозе, кат. 3, 3 дка, Предлагаме за продажба, ЕКСКЛУЗИВ, лозе 3 дка, местност Озмина. Изрядни, документи за сделка. Тел 08 ..., тел.: 0876716939",,,False,продава,земя,Варна,Област Варна,0876716939,,https://assist.imot.bg,https://www.imot.bg/pcgi/imot.cgi?act=5&adv=1s173619936232542&slink=bjri0i&f1=1,,,,imotbg,471,,,,,,c990c844d2fe0d4eb9683f2ef6fad41d
Продава ЗЕМЕДЕЛСКА ЗЕМЯ,"Лозе, кат. 3, 3 дка, Предлагаме за продажба, ЕКСКЛУЗИВ, лозе 3 дка, местност Озмина. Изрядни, документи за сделка. Тел 08 ..., тел.: 0876716939",,,False,продава,земя,Варна,Област Варна,0876716939,,https:None,https://www.imot.bg/pcgi/imot.cgi?act=5&adv=1s173619936232542&slink=bjri0i&f1=1,,,,imotbg,471,,,,,,c990c844d2fe0d4eb9683f2ef6fad41d
Продава ЗЕМЕДЕЛСКА ЗЕМЯ,"Нива, кат. 3, с Аренден договор до 01.09.2025 г. и рента 70 лв./год., 81.53 дка, Предлагаме за продажба обработваема земеделска земя в землището на с. Радецки, общ. Нова Загора, обл ..., тел.: 0879332276",,,False,продава,земя,Радецки,Област Сливен,0879332276,,https:None,https://www.imot.bg/pcgi/imot.cgi?act=5&adv=1s173649180711166&slink=bjri0i&f1=1,,,,imotbg,471,,,,,,94654719dea318b241b2c64e973c47d4
Продава ЗЕМЕДЕЛСКА ЗЕМЯ,"Нива, кат. 3, с Аренден договор до 31.12.2024 г. и рента 2000 лв./год., 30 дка, Марина Реал, предлага за продажба Поземлени имоти на тихо и спокойно място в землището на гр. Българ ..., тел.: 0877588189",,,False,продава,земя,Бургас,Област Бургас,0877588189,,https://marinareal.imot.bg,https://www.imot.bg/pcgi/imot.cgi?act=5&adv=1s171828734734270&slink=bjri0i&f1=1,,,,imotbg,471,,,,,,b9068b8a624331e25af6df2dc737936c
Продава ЗЕМЕДЕЛСКА ЗЕМЯ,"Нива, кат. 3, с Аренден договор до 31.12.2024 г. и рента 1000 лв./год., 25 дка, Марина Реал, предлага за продажба Поземлени имоти на тихо и спокойно място в землището на с. Брястов ..., тел.: 0877588189",,,False,продава,земя,Бургас,Област Бургас,0877588189,,https://marinareal.imot.bg,https://www.imot.bg/pcgi/imot.cgi?act=5&adv=1s171828950194486&slink=bjri0i&f1=1,,,,imotbg,471,,,,,,b9068b8a624331e25af6df2dc737936c
Продава ЗЕМЕДЕЛСКА ЗЕМЯ,"Нива, кат. 3, 2.002 дка, ЕКСКЛУЗИВ-Предлагаме, за продажба зем. Земя, с. Дюлино. Земята е, с площ 2дка.Имота граничи, с къщит ..., тел.: 0877004168",,,False,продава,земя,Варна,Област Варна,0877004168,,https:None,https://www.imot.bg/pcgi/imot.cgi?act=5&adv=1s171865551800073&slink=bjri0i&f1=1,,,,imotbg,471,,,,,,c990c844d2fe0d4eb9683f2ef6fad41d
Продава ЗЕМЕДЕЛСКА ЗЕМЯ,"Нива, кат. 3, с Аренден договор до 31.10.2025 г. и рента 150 лв./год., 54 дка, БГ ИМОТИ предлага голям парцел 54 декара, с.Дъбрава. С договор за аренда преподисва се на две години ..., тел.: 0897900989",,,False,продава,земя,Дъбрава,Област Добрич,0897900989,,https://bg_imoti.imot.bg,https://www.imot.bg/pcgi/imot.cgi?act=5&adv=1s173528679292325&slink=bjri0i&f1=1,,,,imotbg,471,,,,,,778b1ab67f6fbc9dc8cd4f23b4d039d4
Продава ЗЕМЕДЕЛСКА ЗЕМЯ,"Нива, кат. 3, с Аренден договор до 31.10.2025 г. и рента 29200 лв./год., 911 дка, ive In Sofia Ви представя оферта LS 37  Продаваме пакет от обработваеми (487дка) и необработваеми(42 ..., тел.: 0878686690",,,False,продава,земя,Луковит,Област Ловеч,0878686690,,https://liveinsofia.imot.bg,https://www.imot.bg/pcgi/imot.cgi?act=5&adv=1s173633423037449&slink=bjri0i&f1=1,,,,imotbg,471,,,,,,b698d7af86535a00072eb8306ad33549
Продава ЗЕМЕДЕЛСКА ЗЕМЯ,"Нива, кат. 3, с Аренден договор до 31.10.2025 г. и рента 128730 лв./год., 1839 дка, Live In Sofia Ви представя оферта LS 36  Продаваме пакет от обработваеми земеделски земи   1839 дка  ..., тел.: 0878686690",,,False,продава,земя,Девенци,Област Плевен,0878686690,,https://liveinsofia.imot.bg,https://www.imot.bg/pcgi/imot.cgi?act=5&adv=1s173633402668977&slink=bjri0i&f1=1,,,,imotbg,471,,,,,,5fea0f1c6a45ef834b93316b903cdc77
Продава ЗЕМЕДЕЛСКА ЗЕМЯ,"Нива, кат. 3, 10 дка, Предлагаме Ви атрактивен парцел по главен път Габрово   Севлиево. Недвижим имот с различни възможнос ..., тел.: 0898 675 565",,,False,продава,земя,Габрово,Център,0898 675 565,,https://dikova.imot.bg,https://www.imot.bg/pcgi/imot.cgi?act=5&adv=1s155497096674724&slink=bjri0i&f1=1,,,,imotbg,471,,,,,,b9da4274e03ea9bc649826ced80b3bc4
Продава ЗЕМЕДЕЛСКА ЗЕМЯ,"Нива, кат. 3, 7770 дка, Явлена продава нива от 7,770 дка трета категория находяща се в местността ' Чанлъка' в землището на  ..., тел.: 0886426180",,,False,продава,земя,Стара Загора,Зора,0886426180,,https://yavlena_sz.imot.bg,https://www.imot.bg/pcgi/imot.cgi?act=5&adv=1s156655360699782&slink=bjri0i&f1=1,,,,imotbg,471,,,,,,b5cb6b4b33b1e4670a3c505cc2b7ff2c
Продава ЗЕМЕДЕЛСКА ЗЕМЯ,"Нива, кат. 1, 2.5 дка, ПРЕЦИЗ ИМОТИ Ви предлага: Земеделска нива от 2,5 дка, в регулация. Имота е напълно подходящ и за зас ..., тел.: 0897836446",,,False,продава,земя,Шумен,Дивдядово,0897836446,,https://preciz_imoti.imot.bg,https://www.imot.bg/pcgi/imot.cgi?act=5&adv=1s155299501559672&slink=bjri0i&f1=1,,,,imotbg,471,,,,,,2b00f1c2249dcbad07f8606d48251c21
Продава ЗЕМЕДЕЛСКА ЗЕМЯ,"Нива, кат. 3, 2.5 дка, тел.: 0887072928",,,False,продава,земя,Симитли,Област Благоевград,0887072928,,https:None,https://www.imot.bg/pcgi/imot.cgi?act=5&adv=1s170945746099634&slink=bjri0i&f1=1,,,,imotbg,471,,,,,,189abc6fcc14c7e2435a692305002a45
Продава ЗЕМЕДЕЛСКА ЗЕМЯ,"Нива, кат. 1, 1 дка, Предлагаме за продажба парцел земеделска земя по пътя Баня - Банско, на втора линия, зад хотел Вита  ..., тел.: 0894585226",,,False,продава,земя,Баня,Област Благоевград,0894585226,,https://plusproperty1.imot.bg,https://www.imot.bg/pcgi/imot.cgi?act=5&adv=1s172483718694970&slink=bjri0i&f1=1,,,,imotbg,471,,,,,,ed9d9a3eb2a460fdfc8b028588fc356a
Продава ЗЕМЕДЕЛСКА ЗЕМЯ,"Нива, кат. 1, 0.561 дка, Нива с площ от 0.561 дка, с кад.идент. 57176.85.5, шеста категория, имот  085005, ЕКАТТЕ 57176. Имот ..., тел.: 0884265112",,,False,продава,земя,Поленица,Област Благоевград,0884265112,,https://dca.imot.bg,https://www.imot.bg/pcgi/imot.cgi?act=5&adv=1s173528649386062&slink=bjri0i&f1=1,,,,imotbg,471,,,,,,acfc32ec84d3b1762ee872e7baa2611f
Продава ЗЕМЕДЕЛСКА ЗЕМЯ,"Нива, кат. 3, 32 дка, КАРА ПЕЛИТ, НА 100 метра от ШОСЕТО БУРГАС-АЙТОС, НА 1,5 км ОТ гр. АЙТОС, на 1 км от БИВШЕТО СЕЛСКОСТОПАНСКО ЛЕТИ ..., тел.: 0888725771",,,False,продава,земя,Бургас,Област Бургас,0888725771,,https:None,https://www.imot.bg/pcgi/imot.cgi?act=5&adv=1s173265648412077&slink=bjri0i&f1=1,,,,imotbg,471,,,,,,b9068b8a624331e25af6df2dc737936c
Продава ЗЕМЕДЕЛСКА ЗЕМЯ,"Овощна градина, кат. 3, 1 дка, м. Бряста, Предлагаме за продажба 1 дка в землището на Ахелой, местност Бряста, на 50 м от асфалтов път, на 250 ..., тел.: 0893390880",,,False,продава,земя,Бургас,Област Бургас,0893390880,,https://asaviabs.imot.bg,https://www.imot.bg/pcgi/imot.cgi?act=5&adv=1s168061196976997&slink=bjri0i&f1=1,,,,imotbg,471,,,,,,b9068b8a624331e25af6df2dc737936c
Продава ЗЕМЕДЕЛСКА ЗЕМЯ,"Овощна градина, кат. 3, 12 дка, Голям поземлен имот до регулацията на гр. Ахелой, реф.н. CAT 577 НОВА НАМАЛЕНА ЦЕНА! БЕЗ КОМИСИОНА!  ..., тел.: 0886088088",,,False,продава,земя,Бургас,Област Бургас,0886088088,,https://petrakievi.imot.bg,https://www.imot.bg/pcgi/imot.cgi?act=5&adv=1s169901474791431&slink=bjri0i&f1=1,,,,imotbg,471,,,,,,b9068b8a624331e25af6df2dc737936c
Продава ЗЕМЕДЕЛСКА ЗЕМЯ,"Нива, кат. 3, 5 дка, Продаваме земеделска земя трета категория с площ 5 дка в гр. Ахелой, близо до Базата, продължението  ..., тел.: 0890311116",,,False,продава,земя,Бургас,Област Бургас,0890311116,,https://bgbroker.imot.bg,https://www.imot.bg/pcgi/imot.cgi?act=5&adv=1s168787013091421&slink=bjri0i&f1=1,,,,imotbg,471,,,,,,b9068b8a624331e25af6df2dc737936c
Продава ЗЕМЕДЕЛСКА ЗЕМЯ,"Нива, кат. 3, 3.502 дка, Недвижими имоти Ваня продава земеделска земя обл.Бургас гр.Ахелой м.Пречиствателна с площ 3502кв.м.  ..., тел.: 0888497881",,,False,продава,земя,Бургас,Област Бургас,0888497881,,https://imotivanya.imot.bg,https://www.imot.bg/pcgi/imot.cgi?act=5&adv=1s168985260788688&slink=bjri0i&f1=1,,,,imotbg,471,,,,,,b9068b8a624331e25af6df2dc737936c
Продава ЗЕМЕДЕЛСКА ЗЕМЯ,"Нива, кат. 3, 10 дка, Предлагаме Ви за продажба 10 декара 3-та категория земеделска земя с лице път и гледка море в гр. Ах ..., тел.: 0899802209",,,False,продава,земя,Бургас,Област Бургас,0899802209,,https://igprovide.imot.bg,https://www.imot.bg/pcgi/imot.cgi?act=5&adv=1s161960326163645&slink=bjri0i&f1=1,,,,imotbg,471,,,,,,b9068b8a624331e25af6df2dc737936c
Продава ЗЕМЕДЕЛСКА ЗЕМЯ,"Нива, кат. 3, 6 дка, Титан Пропъртис предлага на Вашето внимание за Продажба земеделска земя, находящ се в с.Ахелой, общ. ..., тел.: 0886092152",,,False,продава,земя,Бургас,Област Бургас,0886092152,,https://titansales.imot.bg,https://www.imot.bg/pcgi/imot.cgi?act=5&adv=1s170783140856275&slink=bjri0i&f1=1,,,,imotbg,471,,,,,,b9068b8a624331e25af6df2dc737936c
Продава ЗЕМЕДЕЛСКА ЗЕМЯ,"Нива, кат. 3, 2999 дка, Предлагаме Ви отличен имот със стратегическа локация, подходящ за бъдещи инвестиционни проекти.  	 ..., тел.: 0888141708",,,False,продава,земя,Бургас,Област Бургас,0888141708,,https:None,https://www.imot.bg/pcgi/imot.cgi?act=5&adv=1s173340432492715&slink=bjri0i&f1=1,,,,imotbg,471,,,,,,b9068b8a624331e25af6df2dc737936c
Продава ЗЕМЕДЕЛСКА ЗЕМЯ,"Нива, кат. 3, 11 дка, 1. Земеделска земя в Местност 'Коросиата-Зигрите' 11дка, близо до пътя Ахтопол-Царево, гледка към мо ..., тел.: 0889256794",,,False,продава,земя,Бургас,Област Бургас,0889256794,,https:None,https://www.imot.bg/pcgi/imot.cgi?act=5&adv=1s148770640957397&slink=bjri0i&f1=1,,,,imotbg,471,,,,,,b9068b8a624331e25af6df2dc737936c
Продава ЗЕМЕДЕЛСКА ЗЕМЯ,"Овощна градина, кат. 3, 7.33 дка, PROject HOME/ Проджект Хоум ви представя ексклузивно парцел със сливови дръвчета в ж.к. Долно Езоров ..., тел.: 0893008787",,,False,продава,земя,Бургас,Област Бургас,0893008787,,https://projecthome.imot.bg,https://www.imot.bg/pcgi/imot.cgi?act=5&adv=1s172131556618295&slink=bjri0i&f1=1,,,,imotbg,471,,,,,,b9068b8a624331e25af6df2dc737936c
Продава ЗЕМЕДЕЛСКА ЗЕМЯ,"Нива, кат. 3, 9.2 дка, Сарафово, Земеделска земя с лице на главния път Бургас - Сарафово. Категория 3 местност Соката , тел.: 0883930330",,,False,продава,земя,Бургас,Област Бургас,0883930330,,https://millennium.imot.bg,https://www.imot.bg/pcgi/imot.cgi?act=5&adv=1s173314704100366&slink=bjri0i&f1=1,,,,imotbg,471,,,,,,b9068b8a624331e25af6df2dc737936c
Продава ЗЕМЕДЕЛСКА ЗЕМЯ,"Овощна градина, кат. 3, 5.7 дка, Поземлен имот 07079.2.594, област Бургас, община Бургас, гр. Бургас, м. ОНИКИЛИКА, вид собств. Частн ..., тел.: 0878421985",,,False,продава,земя,Бургас,Област Бургас,0878421985,,https://zaks.imot.bg,https://www.imot.bg/pcgi/imot.cgi?act=5&adv=1s163301471939668&slink=bjri0i&f1=1,,,,imotbg,471,,,,,,b9068b8a624331e25af6df2dc737936c
Продава ЗЕМЕДЕЛСКА ЗЕМЯ,"Нива, кат. 3, 8 дка, Сарафово, Поземлен имот с идентификатор 07079.1.297 по кадастралната карта и кадастрални регистри на гр. Бурга ..., тел.: 0899976545",,,False,продава,земя,Бургас,Област Бургас,0899976545,,https://ubb.imot.bg,https://www.imot.bg/pcgi/imot.cgi?act=5&adv=1s171879963857620&slink=bjri0i&f1=1,,,,imotbg,471,,,,,,b9068b8a624331e25af6df2dc737936c
Продава ЗЕМЕДЕЛСКА ЗЕМЯ,"Нива, кат. 3, 2.394 дка, МЕСТНОСТ ТЕЦ ЛОЗОВО, Ем Джи Естейт продава ексклузивно! Два съседни парцела- земеделска земя в местност ТЕЦ Лозово. Едини ..., тел.: 0879252702",,,False,продава,земя,Бургас,Област Бургас,0879252702,,https://mgestate2020.imot.bg,https://www.imot.bg/pcgi/imot.cgi?act=5&adv=1s168209306187187&slink=bjri0i&f1=1,,,,imotbg,471,,,,,,b9068b8a624331e25af6df2dc737936c
Продава ЗЕМЕДЕЛСКА ЗЕМЯ,"Нива, кат. 3, 9.2 дка, Сарафово, ИМОТЕН ПАРТНЬОР продава земеделска земя с лице на главния път Бургас - Сарафово. Парцела е с правилн ..., тел.: 0886459439",,,False,продава,земя,Бургас,Област Бургас,0886459439,,https://imopartner.imot.bg,https://www.imot.bg/pcgi/imot.cgi?act=5&adv=1s169963072661180&slink=bjri0i&f1=1,,,,imotbg,471,,,,,,b9068b8a624331e25af6df2dc737936c
Продава ЗЕМЕДЕЛСКА ЗЕМЯ,"Нива, кат. 3, с Аренден договор до 31.12.2026 г. и рента 460 лв./год., 5 дка, От собственик! Продава земеделска земя с възможност за промяна на предназначание, в близост до пътна ..., тел.: 0895622633",,,False,продава,земя,Бургас,Област Бургас,0895622633,,https://vichvan-g.imot.bg,https://www.imot.bg/pcgi/imot.cgi?act=5&adv=1s165769574730464&slink=bjri0i&f1=1,,,,imotbg,471,,,,,,b9068b8a624331e25af6df2dc737936c
Продава ЗЕМЕДЕЛСКА ЗЕМЯ,"Нива, кат. 3, 8.3 дка, Сарафово, Земеделска земя в близост до главния път Сарафово-Поморие. Категория 3.  Местност Кабалъка, тел.: 0883930330",,,False,продава,земя,Бургас,Област Бургас,0883930330,,https://millennium.imot.bg,https://www.imot.bg/pcgi/imot.cgi?act=5&adv=1s173471030215459&slink=bjri0i&f1=1,,,,imotbg,471,,,,,,b9068b8a624331e25af6df2dc737936c
Продава ЗЕМЕДЕЛСКА ЗЕМЯ,"Нива, кат. 3, 4 дка, Сарафово, Предлагаме за продажба имот в землището на кв. Сарафово, м. Соката, с правилна форма и с лице на асф ..., тел.: 0899370285",,,False,продава,земя,Бургас,Област Бургас,0899370285,,https://interestates.imot.bg,https://www.imot.bg/pcgi/imot.cgi?act=5&adv=1s166195008847356&slink=bjri0i&f1=1,,,,imotbg,471,,,,,,b9068b8a624331e25af6df2dc737936c
Продава ЗЕМЕДЕЛСКА ЗЕМЯ,"Нива, кат. 3, 3.9 дка, Продава се имот отреден за промишлено строителство (складове и безвредни производства) на главния пъ ..., тел.: 0888847300",,,False,продава,земя,Бургас,Област Бургас,0888847300,,https:None,https://www.imot.bg/pcgi/imot.cgi?act=5&adv=1s172249630813217&slink=bjri0i&f1=1,,,,imotbg,471,,,,,,b9068b8a624331e25af6df2dc737936c
Продава ЗЕМЕДЕЛСКА ЗЕМЯ,"Нива, кат. 3, 15 дка, Сарафово, Компания Х представя на Вашето внимание земеделска земя в Сарафово.    МЕСТОПОЛОЖЕНИЕ: Намира се в б ..., тел.: 0887779990",,,False,продава,земя,Бургас,Област Бургас,0887779990,,https://xnvd_burgas.imot.bg,https://www.imot.bg/pcgi/imot.cgi?act=5&adv=1s171084647155925&slink=bjri0i&f1=1,,,,imotbg,471,,,,,,b9068b8a624331e25af6df2dc737936c
Продава ЗЕМЕДЕЛСКА ЗЕМЯ,"Нива, кат. 3, 11.25 дка, Марина Реал предлага за продажба парцел в м. Муската, в района на тенис център Авеню. Имотът е земед ..., тел.: 0877588189",,,False,продава,земя,Бургас,Област Бургас,0877588189,,https://marinareal.imot.bg,https://www.imot.bg/pcgi/imot.cgi?act=5&adv=1s156183171189935&slink=bjri0i&f1=1,,,,imotbg,471,,,,,,b9068b8a624331e25af6df2dc737936c
Продава ЗЕМЕДЕЛСКА ЗЕМЯ,"Нива, кат. 3, 5.249 дка, Изгрев, Лъкшъри Инвестмент Ви представя чудесен ПИ за продажба в гр. Бургас.  Поземлен имот: 07079.2.1723 Пл ..., тел.: 0877 093 371",,,False,продава,земя,Бургас,Област Бургас,0877 093 371,,https://luxuryinvestment.imot.bg,https://www.imot.bg/pcgi/imot.cgi?act=5&adv=1s166767304193125&slink=bjri0i&f1=1,,,,imotbg,471,,,,,,b9068b8a624331e25af6df2dc737936c
Продава ЗЕМЕДЕЛСКА ЗЕМЯ,"Нива, кат. 3, 41 дка, м-т ОНИКИЛИКА, зад ДЖЪМБО, Предлагаме за продажба инвестиционен парцел с площ 41 496 кв.м., разположен в местност ОНИКИЛИКА, за ..., тел.: 0899991188",,,False,продава,земя,Бургас,Област Бургас,0899991188,,https:None,https://www.imot.bg/pcgi/imot.cgi?act=5&adv=1s172466499927813&slink=bjri0i&f1=1,,,,imotbg,471,,,,,,b9068b8a624331e25af6df2dc737936c
Продава ЗЕМЕДЕЛСКА ЗЕМЯ,"Нива, кат. 3, 7.827 дка, Предлагаме за продажба парцел с площ от 7.827дка, в. Чернозема, с лице на автономен път, на 150м от  ..., тел.: 0877911921",,,False,продава,земя,Бургас,Област Бургас,0877911921,,https:None,https://www.imot.bg/pcgi/imot.cgi?act=5&adv=1s173659756670751&slink=bjri0i&f1=1,,,,imotbg,471,,,,,,b9068b8a624331e25af6df2dc737936c
Продава ЗЕМЕДЕЛСКА ЗЕМЯ,"Нива, кат. 3, 8 дка, местност  Чернозема , Продажба на парцел в м. Чернозема бивша Кабата Агенция IG Provide предлага за продажба атрактивен па ..., тел.: 0899802209",,,False,продава,земя,Бургас,Област Бургас,0899802209,,https://igprovide.imot.bg,https://www.imot.bg/pcgi/imot.cgi?act=5&adv=1s171808618934361&slink=bjri0i&f1=1,,,,imotbg,471,,,,,,b9068b8a624331e25af6df2dc737936c
Продава ЗЕМЕДЕЛСКА ЗЕМЯ,"Нива, кат. 3, 5 дка, Агенция за недвижими имоти ' Титан Пропъртис' предлага за продажба, Земеделска зема в ж.к Изгрев, м. ..., тел.: 0886092152",,,False,продава,земя,Бургас,Област Бургас,0886092152,,https://titansales.imot.bg,https://www.imot.bg/pcgi/imot.cgi?act=5&adv=1s173278884106758&slink=bjri0i&f1=1,,,,imotbg,471,,,,,,b9068b8a624331e25af6df2dc737936c
Продава ЗЕМЕДЕЛСКА ЗЕМЯ,"Нива, кат. 3, 9 дка, 9-ти километър, Само от Ем Джи Естейт! Предлагаме Ви уникален парцел (земеделска земя, трета категория) на изключите ..., тел.: 0879252702",,,False,продава,земя,Бургас,Област Бургас,0879252702,,https://myplace.imot.bg,https://www.imot.bg/pcgi/imot.cgi?act=5&adv=1s172874206776477&slink=bjri0i&f1=2,,,,imotbg,471,,,,,,b9068b8a624331e25af6df2dc737936c
Продава ЗЕМЕДЕЛСКА ЗЕМЯ,"Нива, кат. 3, 9 дка, 9-ти километър, Само от Ем Джи Естейт! Предлагаме Ви уникален парцел (земеделска земя, трета категория) на изключите ..., тел.: 0879252702",,,False,продава,земя,Бургас,Област Бургас,0879252702,,https://mgestate2020.imot.bg,https://www.imot.bg/pcgi/imot.cgi?act=5&adv=1s172874206776477&slink=bjri0i&f1=2,,,,imotbg,471,,,,,,b9068b8a624331e25af6df2dc737936c
Продава ЗЕМЕДЕЛСКА ЗЕМЯ,"Нива, кат. 3, 42 дка, Долно Езерово, Предлагаме за продажба парцел в м.Краварника, разположен в близост до разклона за Долно Езерово, с л ..., тел.: 0899960550",,,False,продава,земя,Бургас,Област Бургас,0899960550,,https://asaviabs.imot.bg,https://www.imot.bg/pcgi/imot.cgi?act=5&adv=1s173220049927494&slink=bjri0i&f1=2,,,,imotbg,471,,,,,,b9068b8a624331e25af6df2dc737936c
Продава ЗЕМЕДЕЛСКА ЗЕМЯ,"Нива, кат. 3, 14 дка, Дванадесетте, АРГОС недвижими имоти продава земеделска земя, намираща се на пътя Бургас-кв. Ветрен. в местността Д ..., тел.: 0899937211",,,False,продава,земя,Бургас,Област Бургас,0899937211,,https://argosdom.imot.bg,https://www.imot.bg/pcgi/imot.cgi?act=5&adv=1s170671186173348&slink=bjri0i&f1=2,,,,imotbg,471,,,,,,b9068b8a624331e25af6df2dc737936c
Продава ЗЕМЕДЕЛСКА ЗЕМЯ,"Нива, кат. 3, 42097 дка, кв.Лозово, Home2U недвижими имоти предлага за продажба парцел с площ 42 000 кв.м ,разположен в бързо развиващия ..., тел.: 0875363330",,,False,продава,земя,Бургас,Област Бургас,0875363330,,https://home2uburgas.imot.bg,https://www.imot.bg/pcgi/imot.cgi?act=5&adv=1s172898572263492&slink=bjri0i&f1=2,,,,imotbg,471,,,,,,b9068b8a624331e25af6df2dc737936c
Продава ЗЕМЕДЕЛСКА ЗЕМЯ,"Нива, кат. 3, с Аренден договор до 31.12.2023 г. и рента 840 лв./год., 14 дка, м.Монопад, Поземлен имот с висока доходност!!! Марина Реал, предлага за продажба Поземлен имот на тихо и спокой ..., тел.: 0877588189",,,False,продава,земя,Бургас,Област Бургас,0877588189,,https://marinareal.imot.bg,https://www.imot.bg/pcgi/imot.cgi?act=5&adv=1s168907983533840&slink=bjri0i&f1=2,,,,imotbg,471,,,,,,b9068b8a624331e25af6df2dc737936c
