listing_id,price,title,location,description,contact_info,agency_url,details_url,num_photos,date_added,offer_type,search_url,total_offers
1c173711738733323,340 000 EUR,Продава 3-СТАЕН,"град София, Стрелбище","96 кв.м, 2-ри ет. от 6, ТЕЦ, Тухла 1998 г., Galardo Real Estate с удоволствие представя апартамент с две спални до ул. Нишава в кв. Стрелбище. З ..., тел.: 0885835852",0885835852,https://galardo.imot.bg,https://www.imot.bg/pcgi/imot.cgi?act=5&adv=1c173711738733323&slink=blq5my&f1=9,12,2025-01-25 18:02:30.208995,Продава,https://www.imot.bg/pcgi/imot.cgi?act=3&slink=blq5my&f1=9,494
1c171558429784782,340 000 EUR,Продава 3-СТАЕН,"град София, Стрелбище","100 кв.м, 3-ти ет. от 8, ТЕЦ, Напълно обзаведен апартамент. Състои се от дневна с трапезария и кухненски бокс, две спални , две те ..., тел.: 0885706434",0885706434,https://globalservices.imot.bg,https://www.imot.bg/pcgi/imot.cgi?act=5&adv=1c171558429784782&slink=blq5my&f1=9,,2025-01-25 18:02:30.209272,Продава,https://www.imot.bg/pcgi/imot.cgi?act=3&slink=blq5my&f1=9,494
1c173726581746784,347 257 EUR,Продава 3-СТАЕН,"град София, Стрелбище","133 кв.м, 6-ти ет. от 8, Тухла 2026 г., Отлично местоположение, тихо място, близо до бул.България, бул.Гоце Делчев, спирки на градския транс ..., тел.: 0887104488",0887104488,https://gmtinvest.imot.bg,https://www.imot.bg/pcgi/imot.cgi?act=5&adv=1c173726581746784&slink=blq5my&f1=9,5,2025-01-25 18:02:30.209529,Продава,https://www.imot.bg/pcgi/imot.cgi?act=3&slink=blq5my&f1=9,494
1c172830905907232,347 257 EUR,Продава 3-СТАЕН,"град София, Стрелбище","132 кв.м, 6-ти ет. от 8, ТЕЦ, Тухла 2026 г., Тристаен апартамент със застроена площ 102,51 кв.м. Разпределение: предверие, дневна с кухненски бок ..., тел.: 088 21 21 450",088 21 21 450,https://address.imot.bg,https://www.imot.bg/pcgi/imot.cgi?act=5&adv=1c172830905907232&slink=blq5my&f1=9,2,2025-01-25 18:02:30.209814,Продава,https://www.imot.bg/pcgi/imot.cgi?act=3&slink=blq5my&f1=9,494
1c172139148689594,351 780 EUR,Продава 3-СТАЕН,"град София, Стрелбище","123 кв.м, ул. Хайдушка гора, 3-ти ет. от 8, ТЕЦ, Тухла 2026 г., Цени на инвеститор. Без комисионна от купувача. Разсрочено плащане - 20% на предварителен договор и  ..., тел.: 0878899618",0878899618,https://services-group.imot.bg,https://www.imot.bg/pcgi/imot.cgi?act=5&adv=1c172139148689594&slink=blq5my&f1=9,11,2025-01-25 18:02:30.210085,Продава,https://www.imot.bg/pcgi/imot.cgi?act=3&slink=blq5my&f1=9,494
1c173143395506619,352 700 EUR,Продава 3-СТАЕН,"град София, Стрелбище","123 кв.м, 2-ри ет. от 7, Намира се на хубаво място в кв. 'Стрелбище' в новострояща се луксозна сграда. Апартамент 4. Етаж 1-в ..., тел.: 0887 547 122",0887 547 122,https://imeia.imot.bg,https://www.imot.bg/pcgi/imot.cgi?act=5&adv=1c173143395506619&slink=blq5my&f1=9,2,2025-01-25 18:02:30.210357,Продава,https://www.imot.bg/pcgi/imot.cgi?act=3&slink=blq5my&f1=9,494
1c172182636364826,352 736 EUR,Продава 3-СТАЕН,"град София, Стрелбище","124 кв.м, 2-ри ет. от 8, ТЕЦ, Тухла 2026 г., ДРИЙМ ВИЖЪН НЕДВИЖИМИ ИМОТИ Продава тристаен апартамент в кв. Стрелбище на много комуникативно място ..., тел.: 02/421 96 35",02/421 96 35,https://dreamvision.imot.bg,https://www.imot.bg/pcgi/imot.cgi?act=5&adv=1c172182636364826&slink=blq5my&f1=9,2,2025-01-25 18:02:30.210639,Продава,https://www.imot.bg/pcgi/imot.cgi?act=3&slink=blq5my&f1=9,494
1c171014294759399,352 736 EUR,Продава 3-СТАЕН,"град София, Стрелбище","123 кв.м, 2-ри ет. от 6, Тухла 2026 г., НОВ ИМОТ НА ПАЗАРА! Идеална локация!  На вашето внимание предлагаме,тристаен апартамент в новостроящ ..., тел.: 0877829955",0877829955,https://cpgroup.imot.bg,https://www.imot.bg/pcgi/imot.cgi?act=5&adv=1c171014294759399&slink=blq5my&f1=9,,2025-01-25 18:02:30.210928,Продава,https://www.imot.bg/pcgi/imot.cgi?act=3&slink=blq5my&f1=9,494
1c172830903761506,352 736 EUR,Продава 3-СТАЕН,"град София, Стрелбище","123 кв.м, 1-ви ет. от 8, ТЕЦ, Тухла 2026 г., Тристаен апартамент със застроена площ 95,30 кв.м. Разпределение: предверие, дневна с кухненски бокс ..., тел.: 088 21 21 450",088 21 21 450,https://address.imot.bg,https://www.imot.bg/pcgi/imot.cgi?act=5&adv=1c172830903761506&slink=blq5my&f1=9,2,2025-01-25 18:02:30.211182,Продава,https://www.imot.bg/pcgi/imot.cgi?act=3&slink=blq5my&f1=9,494
1c173489763917290,369 900 EUR,Продава 3-СТАЕН,"град София, Стрелбище","95 кв.м, 3-ти ет. от 5, ТЕЦ, Тухла 1965 г., Четиристаен апартамент находящ се на трети етаж в жилищна сграда  до втора английска гимназия.Чиста  ..., тел.: 0888991819",0888991819,https://cassiopeia.imot.bg,https://www.imot.bg/pcgi/imot.cgi?act=5&adv=1c173489763917290&slink=blq5my&f1=9,17,2025-01-25 18:02:30.211440,Продава,https://www.imot.bg/pcgi/imot.cgi?act=3&slink=blq5my&f1=9,494
1c173151872404321,370 400 EUR,Продава 3-СТАЕН,"град София, Стрелбище","129 кв.м, 5-ти ет. от 7, Намира се на хубаво място в кв. 'Стрелбище' в новострояща се луксозна сграда. Апартамент 25. Етаж 4- ..., тел.: 0887 547 122",0887 547 122,https://imeia.imot.bg,https://www.imot.bg/pcgi/imot.cgi?act=5&adv=1c173151872404321&slink=blq5my&f1=9,2,2025-01-25 18:02:30.211715,Продава,https://www.imot.bg/pcgi/imot.cgi?act=3&slink=blq5my&f1=9,494
1c173143437938196,370 400 EUR,Продава 3-СТАЕН,"град София, Стрелбище","129 кв.м, 2-ри ет. от 7, Намира се на хубаво място в кв. 'Стрелбище' в новострояща се луксозна сграда. Апартамент 5. Етаж 1-в ..., тел.: 0887 547 122",0887 547 122,https://imeia.imot.bg,https://www.imot.bg/pcgi/imot.cgi?act=5&adv=1c173143437938196&slink=blq5my&f1=9,2,2025-01-25 18:02:30.211973,Продава,https://www.imot.bg/pcgi/imot.cgi?act=3&slink=blq5my&f1=9,494
1c172180910320889,370 400 EUR,Продава 3-СТАЕН,"град София, Стрелбище","130 кв.м, 5-ти ет. от 8, ТЕЦ, Тухла 2026 г., БЕЗ КОМИСИОННА!!!   Пропърти Портал Ви представя 3-стаен апартамент в изискана бутикова 8-етажна нов ..., тел.: 0884020290",0884020290,https://propertyportal.imot.bg,https://www.imot.bg/pcgi/imot.cgi?act=5&adv=1c172180910320889&slink=blq5my&f1=9,2,2025-01-25 18:02:30.212230,Продава,https://www.imot.bg/pcgi/imot.cgi?act=3&slink=blq5my&f1=9,494
1c173501976170800,370 435 EUR,Продава 3-СТАЕН,"град София, Стрелбище","130 кв.м, 5-ти ет. от 7, Тухла 2026 г., Идеална локация! НОВО ПРЕДЛОЖЕНИЕ -  тристаен апартамент в новострояща се сграда до Южен парк  и мет ..., тел.: 0877829955",0877829955,https://cpgroup.imot.bg,https://www.imot.bg/pcgi/imot.cgi?act=5&adv=1c173501976170800&slink=blq5my&f1=9,,2025-01-25 18:02:30.212510,Продава,https://www.imot.bg/pcgi/imot.cgi?act=3&slink=blq5my&f1=9,494
1c173071087504460,370 465 EUR,Продава 3-СТАЕН,"град София, Стрелбище","130 кв.м, ул. Хайдушка гора, 5-ти ет. от 7, ТЕЦ, Тухла 2026 г., НОВА СГРАДА! ВИСОКОКАЧЕСТВЕНО СТРОИТЕЛСТВО! ХУБАВ КВАРТАЛ! Предлагаме на Вашето внимание тристаен ап ..., тел.: 0888235063",0888235063,https://jjcorporation.imot.bg,https://www.imot.bg/pcgi/imot.cgi?act=5&adv=1c173071087504460&slink=blq5my&f1=9,2,2025-01-25 18:02:30.212784,Продава,https://www.imot.bg/pcgi/imot.cgi?act=3&slink=blq5my&f1=9,494
1c173011118096380,370 465 EUR,Продава 3-СТАЕН,"град София, Стрелбище","129 кв.м, 2-ри ет. от 9, 443042 Без комисиона от купувача! Цени на инвеститор!  Продаваме 3-стаен апартамент в сграда с предп ..., тел.: 0883941389",0883941389,https://mirela.imot.bg,https://www.imot.bg/pcgi/imot.cgi?act=5&adv=1c173011118096380&slink=blq5my&f1=9,2,2025-01-25 18:02:30.213042,Продава,https://www.imot.bg/pcgi/imot.cgi?act=3&slink=blq5my&f1=9,494
1c172830903293746,370 465 EUR,Продава 3-СТАЕН,"град София, Стрелбище","130 кв.м, 1-ви ет. от 8, ТЕЦ, Тухла 2026 г., Тристаен апартамент със застроена площ 100,09 кв.м. Разпределение: предверие, дневна с кухненски бок ..., тел.: 088 21 21 450",088 21 21 450,https://address.imot.bg,https://www.imot.bg/pcgi/imot.cgi?act=5&adv=1c172830903293746&slink=blq5my&f1=9,2,2025-01-25 18:02:30.213301,Продава,https://www.imot.bg/pcgi/imot.cgi?act=3&slink=blq5my&f1=9,494
1c172830904665778,370 465 EUR,Продава 3-СТАЕН,"град София, Стрелбище","130 кв.м, 5-ти ет. от 8, ТЕЦ, Тухла 2026 г., Тристаен апартамент със застроена площ 100,09 кв.м. Разпределение: предверие, дневна с кухненски бок ..., тел.: 088 21 21 450",088 21 21 450,https://address.imot.bg,https://www.imot.bg/pcgi/imot.cgi?act=5&adv=1c172830904665778&slink=blq5my&f1=9,2,2025-01-25 18:02:30.213560,Продава,https://www.imot.bg/pcgi/imot.cgi?act=3&slink=blq5my&f1=9,494
1c172286176209438,381 000 EUR,Продава 3-СТАЕН,"град София, Стрелбище","123 кв.м, 4-ти ет. от 8, ТЕЦ, Тухла 2025 г., ARCO REAL ESTATE, предлага тристаен апартамент в новострояща се луксозна сграда, разположена в един  ..., тел.: 0894550679",0894550679,https://arcoimoti.imot.bg,https://www.imot.bg/pcgi/imot.cgi?act=5&adv=1c172286176209438&slink=blq5my&f1=9,3,2025-01-25 18:02:30.213851,Продава,https://www.imot.bg/pcgi/imot.cgi?act=3&slink=blq5my&f1=9,494
1c172251396630071,381 000 EUR,Продава 3-СТАЕН,"град София, Стрелбище","123 кв.м, 4-ти ет. от 6, ТЕЦ, Тухла 2025 г., VISTATE има удоволствието да ви представи тристаен апартамент в нова сграда с Акт 14 в отличен район ..., тел.: 0888248833",0888248833,https://property4u.imot.bg,https://www.imot.bg/pcgi/imot.cgi?act=5&adv=1c172251396630071&slink=blq5my&f1=9,4,2025-01-25 18:02:30.214110,Продава,https://www.imot.bg/pcgi/imot.cgi?act=3&slink=blq5my&f1=9,494
1c172293426409836,390 000 EUR,Продава 3-СТАЕН,"град София, Стрелбище","123 кв.м, 5-ти ет. от 8, ТЕЦ, Тухла 2025 г., ARCO REAL ESTATE, предлага тристаен апартамент в новострояща се луксозна сграда, разположена в един  ..., тел.: 0894550679",0894550679,https://arcoimoti.imot.bg,https://www.imot.bg/pcgi/imot.cgi?act=5&adv=1c172293426409836&slink=blq5my&f1=9,3,2025-01-25 18:02:30.214376,Продава,https://www.imot.bg/pcgi/imot.cgi?act=3&slink=blq5my&f1=9,494
1c173139987156324,410 000 EUR,Продава 3-СТАЕН,"град София, Стрелбище","123 кв.м, ул. Нишава, 4-ти ет. от 8, ТЕЦ, Тухла 2025 г., НОВОСТРОЯЩА СЕ ЛУКСОЗНА ЖИЛИЩНА СГРАДА на ул. Нишава в кв.Стрелбище. Много зелен, приятен и добре ур ..., тел.: 0888408055",0888408055,https://jjcorporation.imot.bg,https://www.imot.bg/pcgi/imot.cgi?act=5&adv=1c173139987156324&slink=blq5my&f1=9,13,2025-01-25 18:02:30.214656,Продава,https://www.imot.bg/pcgi/imot.cgi?act=3&slink=blq5my&f1=9,494
1c173045738737816,450 000 EUR,Продава 3-СТАЕН,"град София, Стрелбище","140 кв.м, ул. Нишава, 2-ри ет. от 8, ТЕЦ, Тухла 2025 г., НОВОСТРОЯЩА СЕ ЛУКСОЗНА ЖИЛИЩНА СГРАДА на ул.Нишава в кв.Стрелбище. Много зелен, приятен и добре уре ..., тел.: 0888408055",0888408055,https://jjcorporation.imot.bg,https://www.imot.bg/pcgi/imot.cgi?act=5&adv=1c173045738737816&slink=blq5my&f1=9,9,2025-01-25 18:02:30.214922,Продава,https://www.imot.bg/pcgi/imot.cgi?act=3&slink=blq5my&f1=9,494
1c172769741391064,465 000 EUR,Продава 3-СТАЕН,"град София, Стрелбище","143 кв.м, 5-ти ет. от 8, Тухла 2025 г., ARCO REAL ESTATE, предлага ТРИСТАЕН апартамент в новострояща се луксозна сграда, разположена в един  ..., тел.: 0894550679",0894550679,https://arcoimoti.imot.bg,https://www.imot.bg/pcgi/imot.cgi?act=5&adv=1c172769741391064&slink=blq5my&f1=9,3,2025-01-25 18:02:30.215180,Продава,https://www.imot.bg/pcgi/imot.cgi?act=3&slink=blq5my&f1=9,494
1c173140049905818,495 000 EUR,Продава 3-СТАЕН,"град София, Стрелбище","140 кв.м, ул. Нишава, 6-ти ет. от 8, ТЕЦ, Тухла 2025 г., НОВОСТРОЯЩА СЕ ЛУКСОЗНА ЖИЛИЩНА СГРАДА на ул. Нишава в кв.Стрелбище. Много зелен, приятен и добре ур ..., тел.: 0888408055",0888408055,https://jjcorporation.imot.bg,https://www.imot.bg/pcgi/imot.cgi?act=5&adv=1c173140049905818&slink=blq5my&f1=9,11,2025-01-25 18:02:30.215442,Продава,https://www.imot.bg/pcgi/imot.cgi?act=3&slink=blq5my&f1=9,494
1c171257942116956,499 000 EUR,Продава 3-СТАЕН,"град София, Стрелбище","190 кв.м, бул. България, 3-ти ет. от 7, ТЕЦ, Тухла 2004 г., Sofia In //www.sofiain.com/ представя на Вашето внимание:  3-стаен апартамент(с квадратура, позволяв ..., тел.: 0882654900",0882654900,https://sofiain.imot.bg,https://www.imot.bg/pcgi/imot.cgi?act=5&adv=1c171257942116956&slink=blq5my&f1=9,17,2025-01-25 18:02:30.215723,Продава,https://www.imot.bg/pcgi/imot.cgi?act=3&slink=blq5my&f1=9,494
1c173746382222318,850 000 EUR,Продава 3-СТАЕН,"град София, Стрелбище","190 кв.м, ул. Нишава, 5-ти ет. от 8, ТЕЦ, Тухла 2024 г., Вдъхновяващ тристаен апартамент, предлагащ несравнимо удобство и елегантност. Разположен на етаж 5,  ..., тел.: 0887044454",0887044454,https://eshome.imot.bg,https://www.imot.bg/pcgi/imot.cgi?act=5&adv=1c173746382222318&slink=blq5my&f1=10,14,2025-01-25 18:02:31.930580,Продава,https://www.imot.bg/pcgi/imot.cgi?act=3&slink=blq5my&f1=10,494
1c173746382222318,850 000 EUR,Продава 3-СТАЕН,"град София, Стрелбище","190 кв.м, ул. Нишава, 5-ти ет. от 8, ТЕЦ, Тухла 2024 г., Вдъхновяващ тристаен апартамент, предлагащ несравнимо удобство и елегантност. Разположен на етаж 5,  ..., тел.: 0887044454",0887044454,https:None,https://www.imot.bg/pcgi/imot.cgi?act=5&adv=1c173746382222318&slink=blq5my&f1=10,14,2025-01-25 18:02:31.931323,Продава,https://www.imot.bg/pcgi/imot.cgi?act=3&slink=blq5my&f1=10,494
1c173373851585629,197 500 EUR,Продава 3-СТАЕН,"град София, Хиподрума","78 кв.м, 14-ти ет. от 15, ТЕЦ, ЕПК 1980 г., 🔑 **Агенция за недвижими имоти предлага 3-стаен апартамент в сърцето на София - кв. Хиподрум ..., тел.: 0882731870",0882731870,https://eshome.imot.bg,https://www.imot.bg/pcgi/imot.cgi?act=5&adv=1c173373851585629&slink=blq5my&f1=10,14,2025-01-25 18:02:31.931656,Продава,https://www.imot.bg/pcgi/imot.cgi?act=3&slink=blq5my&f1=10,494
1c173762787131419,203 000 EUR,Продава 3-СТАЕН,"град София, Хиподрума","92 кв.м, ул. Софийски герой, 1-ви ет. от 14, ТЕЦ, ЕПК 1987 г., Продава се тристаен апартамент в кв. Хиподрума в близост до ВМА и в района на 51 СУ и читалище 'Сред ..., тел.: 0889556691",0889556691,https:None,https://www.imot.bg/pcgi/imot.cgi?act=5&adv=1c173762787131419&slink=blq5my&f1=10,5,2025-01-25 18:02:31.931932,Продава,https://www.imot.bg/pcgi/imot.cgi?act=3&slink=blq5my&f1=10,494
1c173641606821008,210 000 EUR,Продава 3-СТАЕН,"град София, Хиподрума","84 кв.м, 6-ти ет. от 10, ТЕЦ, ЕПК 1985 г., Предлагаме за продажба просторен и непреходен тристаен апартамент в сграда на ул.Лерин до ул.Кюстенд ..., тел.: 0885751014",0885751014,https://kantorasofia.imot.bg,https://www.imot.bg/pcgi/imot.cgi?act=5&adv=1c173641606821008&slink=blq5my&f1=10,6,2025-01-25 18:02:31.932229,Продава,https://www.imot.bg/pcgi/imot.cgi?act=3&slink=blq5my&f1=10,494
1c171041490324367,218 700 EUR,Продава 3-СТАЕН,"град София, Хиподрума","92 кв.м, 1-ви ет. от 14, ТЕЦ, ЕПК 1985 г., Много просторен тристаен апартамент със застроена площ от 92.07 кв.м. Състои се от входно антре, дне ..., тел.: 088 21 21 450",088 21 21 450,https://address.imot.bg,https://www.imot.bg/pcgi/imot.cgi?act=5&adv=1c171041490324367&slink=blq5my&f1=10,10,2025-01-25 18:02:31.932506,Продава,https://www.imot.bg/pcgi/imot.cgi?act=3&slink=blq5my&f1=10,494
1c173106090899990,246 100 EUR,Продава 3-СТАЕН,"град София, Хиподрума","107 кв.м, бул. Цар Борис III, 2-ри ет. от 6, ТЕЦ, Тухла 2025 г., 'Велиос Консулт' предлага за продажба тристаен апартамент в нова сграда - акт 14 с очакван акт 16 -м ..., тел.: 0886816784",0886816784,https://velios.imot.bg,https://www.imot.bg/pcgi/imot.cgi?act=5&adv=1c173106090899990&slink=blq5my&f1=10,5,2025-01-25 18:02:31.932809,Продава,https://www.imot.bg/pcgi/imot.cgi?act=3&slink=blq5my&f1=10,494
1c173229009793150,250 000 EUR,Продава 3-СТАЕН,"град София, Хиподрума","127 кв.м, 5-ти ет. от 5, ТЕЦ, Тухла 2009 г., ПРОМОЦИОНАЛНА ДО КРАЯ НА МЕСЕЦА! Агенция  Имотен Център България   има удоволствието да ви представи ..., тел.: 0877050888",0877050888,https://home_center.imot.bg,https://www.imot.bg/pcgi/imot.cgi?act=5&adv=1c173229009793150&slink=blq5my&f1=10,10,2025-01-25 18:02:31.933077,Продава,https://www.imot.bg/pcgi/imot.cgi?act=3&slink=blq5my&f1=10,494
1c171092322663127,266 800 EUR,Продава 3-СТАЕН,"град София, Хиподрума","116 кв.м, 2-ри ет. от 6, Тухла 2025 г., Строително-инвестиционна компания НОУБЪЛ ХАУС има удоволствието да Ви представи проекта си  EVERGREE ..., тел.: 0876300185",0876300185,https://noblehouse2018.imot.bg,https://www.imot.bg/pcgi/imot.cgi?act=5&adv=1c171092322663127&slink=blq5my&f1=10,5,2025-01-25 18:02:31.933341,Продава,https://www.imot.bg/pcgi/imot.cgi?act=3&slink=blq5my&f1=10,494
1c173600300378993,270 000 EUR,Продава 3-СТАЕН,"град София, Хиподрума","114 кв.м, 6-ти ет. от 7, ТЕЦ, Тухла 2002 г., АКТ 16!!! ОТЛИЧНА ЛОКАЦИЯ НА 5 МИНУТИ ОТ ЦЕНТЪРА!!! Агенция за недвижими имоти Имотен център предлаг ..., тел.: 0877050888",0877050888,https://home_center.imot.bg,https://www.imot.bg/pcgi/imot.cgi?act=5&adv=1c173600300378993&slink=blq5my&f1=10,9,2025-01-25 18:02:31.933615,Продава,https://www.imot.bg/pcgi/imot.cgi?act=3&slink=blq5my&f1=10,494
1c171759332442004,279 500 EUR,Продава 3-СТАЕН,"град София, Хиподрума","122 кв.м, 1-ви ет. от 14, ТЕЦ, ЕПК 2000 г., Уникален,три,четиристаен апартамент, който създава усещане за къща,сред добре организирана и подържа ..., тел.: 0895539823",0895539823,https://avista_balkan.imot.bg,https://www.imot.bg/pcgi/imot.cgi?act=5&adv=1c171759332442004&slink=blq5my&f1=10,17,2025-01-25 18:02:31.933887,Продава,https://www.imot.bg/pcgi/imot.cgi?act=3&slink=blq5my&f1=10,494
1c173192253038912,285 000 EUR,Продава 3-СТАЕН,"град София, Хиподрума","114 кв.м, 3-ти ет. от 7, ТЕЦ, Тухла 2025 г., Tристаен апартамент с перфектните параметри в ж.к. Хиподрума. Жилището се намира на среден етаж със  ..., тел.: 088 21 21 450",088 21 21 450,https://address.imot.bg,https://www.imot.bg/pcgi/imot.cgi?act=5&adv=1c173192253038912&slink=blq5my&f1=10,10,2025-01-25 18:02:31.934159,Продава,https://www.imot.bg/pcgi/imot.cgi?act=3&slink=blq5my&f1=10,494
1c171092337683149,289 000 EUR,Продава 3-СТАЕН,"град София, Хиподрума","123 кв.м, 4-ти ет. от 6, Тухла 2025 г., Строително-инвестиционна компания НОУБЪЛ ХАУС има удоволствието да Ви представи проекта си  EVERGREE ..., тел.: 0876300185",0876300185,https://noblehouse2018.imot.bg,https://www.imot.bg/pcgi/imot.cgi?act=5&adv=1c171092337683149&slink=blq5my&f1=10,5,2025-01-25 18:02:31.934433,Продава,https://www.imot.bg/pcgi/imot.cgi?act=3&slink=blq5my&f1=10,494
1c171889464275132,290 000 EUR,Продава 3-СТАЕН,"град София, Хиподрума","102 кв.м, 6-ти ет. от 8, ТЕЦ, Тухла 1968 г., Агенция SUPRIMMO: www.suprimmo.bg Просторен апартамент с двe спални на ул. Булаир ' в кв. Хиподр ..., тел.: 0882638455",0882638455,https://superimoti.imot.bg,https://www.imot.bg/pcgi/imot.cgi?act=5&adv=1c171889464275132&slink=blq5my&f1=10,17,2025-01-25 18:02:31.934719,Продава,https://www.imot.bg/pcgi/imot.cgi?act=3&slink=blq5my&f1=10,494
1c173088433929548,247 342 EURЦената е без ДДС,Продава 3-СТАЕН,"град София, Хиподрума","107 кв.м, бул. Цар Борис III, 1-ви ет. от 6, ТЕЦ, Тухла 2025 г., MД Естейт Ви представя 3-стаен апартамент в бутикова сграда на бул.Цар Борис III. Етап на сторителст ..., тел.: 0879960303",0879960303,https://mdestate.imot.bg,https://www.imot.bg/pcgi/imot.cgi?act=5&adv=1c173088433929548&slink=blq5my&f1=10,6,2025-01-25 18:02:31.934994,Продава,https://www.imot.bg/pcgi/imot.cgi?act=3&slink=blq5my&f1=10,494
1c173210242085872,307 582 EUR,Продава 3-СТАЕН,"град София, Хиподрума","102 кв.м, 3-ти ет. от 6, Тухла 2009 г., Агенция  Имотен Център България  представя на вашето внимание тристаен апартамент в сграда с акт 16  ..., тел.: 0877050888",0877050888,https://home_center.imot.bg,https://www.imot.bg/pcgi/imot.cgi?act=5&adv=1c173210242085872&slink=blq5my&f1=10,12,2025-01-25 18:02:31.935260,Продава,https://www.imot.bg/pcgi/imot.cgi?act=3&slink=blq5my&f1=10,494
1c173677089750999,330 000 EUR,Продава 3-СТАЕН,"град София, Хиподрума","96 кв.м, 4-ти ет. от 7, ТЕЦ, Тухла 2002 г., Селесте Пропърти предлага просторен тристаен апартамент за продажба в кв. Хладилника, на тиха улица  ..., тел.: 0897972056",0897972056,https://celeste123.imot.bg,https://www.imot.bg/pcgi/imot.cgi?act=5&adv=1c173677089750999&slink=blq5my&f1=10,10,2025-01-25 18:02:31.935524,Продава,https://www.imot.bg/pcgi/imot.cgi?act=3&slink=blq5my&f1=10,494
