raw_title,raw_description,price,currency,without_dds,offer_type,property_type,city,neighborhood,contact_info,agency,agency_url,details_url,num_photos,date_time_added,search_url,site,total_offers,ref_no,time,price_per_m2,area,floor
Дава под наем  2-стаен,"2-ри ет., ТЕЦ, TWO ROOMS, LUXURY, FURNISHED according to a designer project, APARTMENT next to 'Doctor's Garden' an ...",1100.0,EUR,True,наем,двустаен,град София,Докторски паметник,0898778349,,,https://www.imoti.com/obiava/36344858/dava-pod-naem-2-staen-grad-sofiya-doktorski-pametnik,0,2026-01-24 06:06:46.898511,,imoticom,0,,,,88 кв.м,
Дава под наем  2-стаен,"6-ти ет., ТЕЦ, Просторен и артистичен апартамент под наем до Докторски паметникПредставяме Ви изключително елеганте ...",1500.0,EUR,True,наем,двустаен,град София,Докторски паметник,089521-21-21,,,https://www.imoti.com/obiava/35411269/dava-pod-naem-2-staen-grad-sofiya-doktorski-pametnik,0,2026-01-24 06:06:46.898866,,imoticom,0,,,,93 кв.м,
Дава под наем  2-стаен,"5-ти ет., ТЕЦ, ТОП ЛОКАЦИЯ!АРТ ХАУС 94 има удоволствието да ви предложи 2 стаен  ОБЗАВЕДЕН апартамент под НАЕМ в кв ...",495.0,EUR,True,наем,двустаен,град София,Иван Вазов,0887803064,,,https://www.imoti.com/obiava/35812367/dava-pod-naem-2-staen-grad-sofiya-ivan-vazov,0,2026-01-24 06:06:46.899209,,imoticom,0,,,,50 кв.м,
Дава под наем  2-стаен,,500.0,EUR,True,наем,двустаен,град София,Иван Вазов,0898705214,,,https://www.imoti.com/obiava/56589791/dava-pod-naem-2-staen-grad-sofiya-ivan-vazov,0,2026-01-24 06:06:46.899565,,imoticom,0,,,,53 кв.м,
Дава под наем  2-стаен,"5-ти ет., ТЕЦ, Агенция SUPRIMMO: www.suprimmo.bgПредставяме Ви стилен и напълно обзаведен двустаен апартамент под н ...",820.0,EUR,True,наем,двустаен,град София,Изгрев,0884509595,,,https://www.imoti.com/obiava/24034631/dava-pod-naem-2-staen-grad-sofiya-izgrev,0,2026-01-24 06:06:46.899909,,imoticom,0,,,,73 кв.м,
Дава под наем  2-стаен,"1-ви ет., ТЕЦ, РЕАЛНА ОФЕРТА, частично обзаведен двустаен, на ул.Люляковапградина със следното разпределение: корид ...",430.0,EUR,True,наем,двустаен,град София,Изток,0878185260,,,https://www.imoti.com/obiava/14992789/dava-pod-naem-2-staen-grad-sofiya-iztok,0,2026-01-24 06:06:46.900251,,imoticom,0,,,,60 кв.м,
Дава под наем  2-стаен,"2-ри ет., Предлагаме ви двустаен апартамент в тухлена сграда намираща се на ул. Академик Методи Попов, апартам ...",599.0,EUR,True,наем,двустаен,град София,Изток,088 899 9861,,,https://www.imoti.com/obiava/47686057/dava-pod-naem-2-staen-grad-sofiya-iztok,0,2026-01-24 06:06:46.900603,,imoticom,0,,,,60 кв.м,
Дава под наем  2-стаен,"2-ри ет., ТЕЦ, Агенция за недвижими имоти Peak Real Estate предлага светъл и уютен двустаен апартамент, разположен  ...",630.0,EUR,True,наем,двустаен,град София,Изток,0882988975,,,https://www.imoti.com/obiava/17478840/dava-pod-naem-2-staen-grad-sofiya-iztok,0,2026-01-24 06:06:46.900947,,imoticom,0,,,,46 кв.м,
Дава под наем  2-стаен,"1-ви ет., ТЕЦ, Просторен двустаен апартамент в кв. Изток търси своите наематели.Апартаментът е ситуиран на 1ви жили ...",550.0,EUR,True,наем,двустаен,град София,Изток,0888575769,,,https://www.imoti.com/obiava/82619279/dava-pod-naem-2-staen-grad-sofiya-iztok,0,2026-01-24 06:06:46.901328,,imoticom,0,,,,60 кв.м,
Дава под наем  2-стаен,"3-ти ет., ТЕЦ, Агенция за недвижими имоти Vice Real Estate с удоволствие Ви представя двустаен апартамент под наем, ...",664.0,EUR,True,наем,двустаен,град София,Изток,0892976004,,,https://www.imoti.com/obiava/25251481/dava-pod-naem-2-staen-grad-sofiya-iztok,0,2026-01-24 06:06:46.901691,,imoticom,0,,,,58 кв.м,
Дава под наем  2-стаен,"3-ти ет., ТЕЦ, НЕ СЕ ДЪЛЖИ КОМИСИОННА! Предлагаме под наем, напълно обзаведен апартамент, разположен на трети етаж  ...",680.0,EUR,True,наем,двустаен,град София,Изток,0878887020,,,https://www.imoti.com/obiava/60904226/dava-pod-naem-2-staen-grad-sofiya-iztok,0,2026-01-24 06:06:46.902030,,imoticom,0,,,,65 кв.м,
Дава под наем  2-стаен,"2-ри ет., ТЕЦ,  ✨ Агенция АРТЕ МУНДО има удоволствието да Ви представи изключително стилен и напълно обновен ...",970.0,EUR,True,наем,двустаен,град София,Изток,0886404540,,,https://www.imoti.com/obiava/50409528/dava-pod-naem-2-staen-grad-sofiya-iztok,0,2026-01-24 06:06:46.902372,,imoticom,0,,,,70 кв.м,
Дава под наем  2-стаен,"6-ти ет., ТЕЦ, Мултибилдинг Пропърти предлага под наем чисто нов двустаен апартамент след основен ремонт, с площ 50 ...",690.0,EUR,True,наем,двустаен,град София,Медицинска академия,0876686660,,,https://www.imoti.com/obiava/45843420/dava-pod-naem-2-staen-grad-sofiya-meditsinska-akademiya,0,2026-01-24 06:06:46.902726,,imoticom,0,,,,50 кв.м,
Дава под наем  2-стаен,"3-ти ет., ТЕЦ, Дава под наем напълно обзаведен двустаен апартамент в р-н Оборище в сграда ново строителство.Намира  ...",650.0,EUR,True,наем,двустаен,град София,Оборище,0888650621,,,https://www.imoti.com/obiava/55360674/dava-pod-naem-2-staen-grad-sofiya-oborishte,0,2026-01-24 06:06:46.903071,,imoticom,0,,,,60 кв.м,
Дава под наем  2-стаен,ID: 1845🏡 ТОП ЛОКАЦИЯ до мол Сердика!| ОГЛЕД ПО ВСЯКО ВРЕМЕБЕЗ КОМИСИОННА!!! Представяме ви  ...,720.0,EUR,True,наем,двустаен,град София,Оборище,0882535754,,,https://www.imoti.com/obiava/93799207/dava-pod-naem-2-staen-grad-sofiya-oborishte,0,2026-01-24 06:06:46.903414,,imoticom,0,,,,70 кв.м,
Дава под наем  2-стаен,"3-ти ет., LUXIMMO FINEST ESTATES: www.luximmo.bgДвустаен, напълно обзаведен апартамент до Парк  Заимов на ул.& ...",750.0,EUR,True,наем,двустаен,град София,Оборище,0882817575,,,https://www.imoti.com/obiava/45857918/dava-pod-naem-2-staen-grad-sofiya-oborishte,0,2026-01-24 06:06:46.903773,,imoticom,0,,,,65 кв.м,
Дава под наем  2-стаен,"11-ти ет., ТЕЦ, Прекрасен малък двустаен апартамент в Хиподрума,на ул.Кюстендил(до Дойран).Много комуникативно място ...",460.0,EUR,True,наем,двустаен,град София,Хиподрума,0888506222,,,https://www.imoti.com/obiava/83583313/dava-pod-naem-2-staen-grad-sofiya-hipodruma,0,2026-01-24 06:06:46.904118,,imoticom,0,,,,55 кв.м,
Дава под наем  2-стаен,"2-ри ет., ТЕЦ, Агенция за недвижими имоти Калиста Естейт има огромното удоволствие да Ви представи двустаен апартам ...",1099.0,EUR,True,наем,двустаен,град София,Хиподрума,0884765100,,,https://www.imoti.com/obiava/53111876/dava-pod-naem-2-staen-grad-sofiya-hipodruma,0,2026-01-24 06:06:46.904467,,imoticom,0,,,,47 кв.м,
Дава под наем  2-стаен,"8-ми ет., ТЕЦ, Фирма АРЕТЕ предлага голям двустаен апартамент със самостоятелна кухня с трапезария, разположен в зе ...",600.0,EUR,True,наем,двустаен,град София,Хиподрума,0882508388,,,https://www.imoti.com/obiava/83988765/dava-pod-naem-2-staen-grad-sofiya-hipodruma,0,2026-01-24 06:06:46.904830,,imoticom,0,,,,68 кв.м,
Дава под наем  2-стаен,"5-ти ет., ТЕЦ, PL Group предлага голям двустаен апартамент в тухлена сграда в кв. Хиподрума.Апартамента е разположе ...",600.0,EUR,True,наем,двустаен,град София,Хиподрума,0886688821,,,https://www.imoti.com/obiava/65289632/dava-pod-naem-2-staen-grad-sofiya-hipodruma,0,2026-01-24 06:06:46.905177,,imoticom,0,,,,70 кв.м,
Дава под наем  2-стаен,"6-ти ет., ТЕЦ, Мултибилдинг Пропърти предлага под наем чисто нов двустаен апартамент след основен ремонт, с площ 50 ...",690.0,EUR,True,наем,двустаен,град София,Хиподрума,0876090606,,,https://www.imoti.com/obiava/70360580/dava-pod-naem-2-staen-grad-sofiya-hipodruma,0,2026-01-24 06:06:48.879701,,imoticom,0,,,,50 кв.м,
Дава под наем  2-стаен,"5-ти ет., ТЕЦ, Агенция SUPRIMMO: www.suprimmo.bgПредставяме просторен двустаен апартамент, подходящ и за офис за по ...",700.0,EUR,True,наем,двустаен,град София,Хиподрума,0884603907,,,https://www.imoti.com/obiava/71179686/dava-pod-naem-2-staen-grad-sofiya-hipodruma,0,2026-01-24 06:06:48.880055,,imoticom,0,,,,85 кв.м,
Дава под наем  2-стаен,"6-ти ет., Открийте мястото, където ще се чувствате у дома от първия момент.Титан Пропъртис - офис Младост с ра ...",600.0,EUR,True,наем,двустаен,град София,Хладилника,0897850387,,,https://www.imoti.com/obiava/90391180/dava-pod-naem-2-staen-grad-sofiya-hladilnika,0,2026-01-24 06:06:48.880400,,imoticom,0,,,,68 кв.м,
Дава под наем  2-стаен,"2-ри ет., Лок.отопл., АРЕТЕ 2000 предлага под наем чисто нов, напълно обзаведен апартамент с усещане за уют и семейна топл ...",1000.0,EUR,True,наем,двустаен,град София,Хладилника,0882508388,,,https://www.imoti.com/obiava/60789086/dava-pod-naem-2-staen-grad-sofiya-hladilnika,0,2026-01-24 06:06:48.880764,,imoticom,0,,,,61 кв.м,
Дава под наем  2-стаен,"Представям   ви гарсониера под наем, с местоположение - емблематичният квартал  ж.к. Яворов.   Жилищ ...",500.0,EUR,True,наем,двустаен,град София,Яворов,0892542568,,,https://www.imoti.com/obiava/85102318/dava-pod-naem-2-staen-grad-sofiya-yavorov,0,2026-01-24 06:06:48.881115,,imoticom,0,,,,51 кв.м,
Дава под наем  2-стаен,"2-ри ет., ТЕЦ, SUCCESSFUL PROPERTIES представя под наем просторен двустаен апартамент с отделна кухня на отлична ло ...",650.0,EUR,True,наем,двустаен,град София,Яворов,0879890105,,,https://www.imoti.com/obiava/44044348/dava-pod-naem-2-staen-grad-sofiya-yavorov,0,2026-01-24 06:06:48.881458,,imoticom,0,,,,80 кв.м,
Дава под наем  3-стаен,"2-ри ет., 3-стаен обзаведен апартамент под наем в Докторски паметник .Състои се от : Хол с трапезария и кухня, ...",1020.0,EUR,True,наем,тристаен,град София,Докторски паметник,089521-21-21,,,https://www.imoti.com/obiava/33396490/dava-pod-naem-3-staen-grad-sofiya-doktorski-pametnik,0,2026-01-24 06:06:48.881818,,imoticom,0,,,,100 кв.м,
Дава под наем  3-стаен,"3-ти ет., ТЕЦ, Просторен, светъл и стилно обзаведен, тристаен апартамент в аристократичната част на София.Локация - ...",1200.0,EUR,True,наем,тристаен,град София,Докторски паметник,0887613033,,,https://www.imoti.com/obiava/67321879/dava-pod-naem-3-staen-grad-sofiya-doktorski-pametnik,0,2026-01-24 06:06:48.882168,,imoticom,0,,,,100 кв.м,
Дава под наем  3-стаен,"4-ти ет., ТЕЦ, 📌 Референтен номер: 2153237❗ Революшън Естейт представя Тристаен в София, Център- Док ...",1250.0,EUR,True,наем,тристаен,град София,Докторски паметник,0899500900,,,https://www.imoti.com/obiava/70399106/dava-pod-naem-3-staen-grad-sofiya-doktorski-pametnik,0,2026-01-24 06:06:48.882533,,imoticom,0,,,,92 кв.м,
Дава под наем  3-стаен,"2-ри ет., ТЕЦ, Consulting G Real Estate отдава под наем луксозен 3-стаен апартамент в престижния район Оборище-Докт ...",1400.0,EUR,True,наем,тристаен,град София,Докторски паметник,0888825445,,,https://www.imoti.com/obiava/46756332/dava-pod-naem-3-staen-grad-sofiya-doktorski-pametnik,0,2026-01-24 06:06:48.882877,,imoticom,0,,,,120 кв.м,
Дава под наем  3-стаен,"4-ти ет., ТЕЦ, В обявата имота е обзаведен чрез изкуствен интелект с илюстративна цел.ЕМБЛЕМАТИЧНА ЛОКАЦИЯ НА УЛ.   ...",1800.0,EUR,True,наем,тристаен,град София,Докторски паметник,0877 26 8787,,,https://www.imoti.com/obiava/13608133/dava-pod-naem-3-staen-grad-sofiya-doktorski-pametnik,0,2026-01-24 06:06:48.883218,,imoticom,0,,,,140 кв.м,
Дава под наем  3-стаен,"4-ти ет., ТЕЦ, ЕМБЛЕМАТИЧНА ЛОКАЦИЯ НА УЛ.  ОБОРИЩЕ    ЛУКСОЗНО ИЗПЪЛНЕНИЕ И ROOFTOP ТЕРАСАRefer Real Estate има уд ...",1800.0,EUR,True,наем,тристаен,град София,Докторски паметник,0877 26 8787,,,https://www.imoti.com/obiava/35139881/dava-pod-naem-3-staen-grad-sofiya-doktorski-pametnik,0,2026-01-24 06:06:48.883607,,imoticom,0,,,,140 кв.м,
Дава под наем  3-стаен,"2-ри ет., ТЕЦ,  ТОП ИМОТ, СВОБОДЕН ЗА НАЕМАНЕ!!! Предлагаме Ви ОБЗАВЕДЕН И ОБОРУДВАН АПАРТАМЕНТ. Жилището е непрехо ...",850.0,EUR,True,наем,тристаен,град София,Иван Вазов,0885647788,,,https://www.imoti.com/obiava/72168764/dava-pod-naem-3-staen-grad-sofiya-ivan-vazov,0,2026-01-24 06:06:48.883954,,imoticom,0,,,,90 кв.м,
Дава под наем  3-стаен,"8-ми ет., ТЕЦ, Дава под наем луксозен тристаен апартамент на изключителна локация в центъра, в близост до Медицинск ...",1000.0,EUR,True,наем,тристаен,град София,Иван Вазов,0888777888,,,https://www.imoti.com/obiava/46976053/dava-pod-naem-3-staen-grad-sofiya-ivan-vazov,0,2026-01-24 06:06:48.884295,,imoticom,0,,,,90 кв.м,
Дава под наем  3-стаен,"4-ти ет., ТЕЦ, Луксозен чисто нов тристаен апартамент под наем до Южен парк, кв. Иван ВазовПредставяме Ви изключите ...",1499.0,EUR,True,наем,тристаен,град София,Иван Вазов,089521-21-21,,,https://www.imoti.com/obiava/79700096/dava-pod-naem-3-staen-grad-sofiya-ivan-vazov,0,2026-01-24 06:06:48.884652,,imoticom,0,,,,135 кв.м,
Дава под наем  3-стаен,"2-ри ет., ТЕЦ, First Estates предлага тристаен апартамент и гараж под наем на ул. 'Латинка' в кв. Изгрев и  ...",1250.0,EUR,True,наем,тристаен,град София,Изгрев,070015151,,,https://www.imoti.com/obiava/85623610/dava-pod-naem-3-staen-grad-sofiya-izgrev,0,2026-01-24 06:06:48.885047,,imoticom,0,,,,117 кв.м,
Дава под наем  3-стаен,"2-ри ет., ТЕЦ, Луксозен нов апартамент в представителна нова сграда, напълно обзаведен. Състои се от : хол с трапез ...",1300.0,EUR,True,наем,тристаен,град София,Изгрев,089521-21-21,,,https://www.imoti.com/obiava/30749818/dava-pod-naem-3-staen-grad-sofiya-izgrev,0,2026-01-24 06:06:48.885388,,imoticom,0,,,,110 кв.м,
Дава под наем  3-стаен,"7-ми ет., ТЕЦ, Луксозен тристаен апартамент с гледка към Витоша до басейн ДианабадПрекрасен, напълно обзаведен апар ...",1349.0,EUR,True,наем,тристаен,град София,Изгрев,089521-21-21,,,https://www.imoti.com/obiava/48391551/dava-pod-naem-3-staen-grad-sofiya-izgrev,0,2026-01-24 06:06:48.885750,,imoticom,0,,,,106 кв.м,
Дава под наем  3-стаен,"2-ри ет., ТЕЦ, Обзаведен апартамент в нова сграда с видео наблюдение.Апартамента състои се от:хол с трапезария и ба ...",1400.0,EUR,True,наем,тристаен,град София,Изгрев,089521-21-21,,,https://www.imoti.com/obiava/91937925/dava-pod-naem-3-staen-grad-sofiya-izgrev,0,2026-01-24 06:06:48.886092,,imoticom,0,,,,151 кв.м,
Дава под наем  3-стаен,"3-ти ет., ТЕЦ, Имотът се дава за първи наематели след ОСНОВЕН ремонт и НОВО обзавеждане ! ***Просторен тристаен/чет ...",950.0,EUR,True,наем,тристаен,град София,Изток,0888647901,,,https://www.imoti.com/obiava/35885088/dava-pod-naem-3-staen-grad-sofiya-iztok,0,2026-01-24 06:06:48.886436,,imoticom,0,,,,110 кв.м,
Дава под наем  3-стаен,"1-ви ет., ТЕЦ, Чудесен тристаен апартамент в ж.к. Изток. Намира се в непосредствена близост до Борисова градина, де ...",1000.0,EUR,True,наем,тристаен,град София,Изток,0888 818 921,,,https://www.imoti.com/obiava/14774039/dava-pod-naem-3-staen-grad-sofiya-iztok,0,2026-01-24 06:06:50.861733,,imoticom,0,,,,90 кв.м,
Дава под наем  3-стаен,"2-ри ет., ТЕЦ, ВИП сграда, ВИП апартамент ! Имаме удоволствието да ви предложим в  нова  сграда с  охрана на прести ...",1190.0,EUR,True,наем,тристаен,град София,Изток,0878833917,,,https://www.imoti.com/obiava/52289001/dava-pod-naem-3-staen-grad-sofiya-iztok,0,2026-01-24 06:06:50.862091,,imoticom,0,,,,105 кв.м,
Дава под наем  3-стаен,"3-ти ет., ТЕЦ, Прекрасен 2-стаен апартамент в нова сграда с 24-часова охрана.Хол, тарпезария и куня.2-спални с 1-ба ...",1199.0,EUR,True,наем,тристаен,град София,Изток,089521-21-21,,,https://www.imoti.com/obiava/55063506/dava-pod-naem-3-staen-grad-sofiya-iztok,0,2026-01-24 06:06:50.862453,,imoticom,0,,,,118 кв.м,
Дава под наем  3-стаен,"4-ти ет., ТЕЦ, Луксозно завършен и обзаведен апартамент по дизайнерски проект с висококачествени мебели по поръчка, ...",1200.0,EUR,True,наем,тристаен,град София,Изток,0888660255,,,https://www.imoti.com/obiava/62776868/dava-pod-naem-3-staen-grad-sofiya-iztok,0,2026-01-24 06:06:50.862817,,imoticom,0,,,,110 кв.м,
Дава под наем  3-стаен,"5-ти ет., ТЕЦ, Апартамент в затворен комплекс. Състои се от : просторен хол с трапезария , кухенски бокс , перално  ...",1400.0,EUR,True,наем,тристаен,град София,Изток,089521-21-21,,,https://www.imoti.com/obiava/68157947/dava-pod-naem-3-staen-grad-sofiya-iztok,0,2026-01-24 06:06:50.863165,,imoticom,0,,,,120 кв.м,
Дава под наем  3-стаен,"5-ти ет., ТЕЦ, Дизаро Естейтс представя ексклузивно на Вашето внимание 3-стаен апартамент намиращ се на ул. 'Ами Бу ...",850.0,EUR,True,наем,тристаен,град София,Медицинска академия,0897244622,,,https://www.imoti.com/obiava/15763673/dava-pod-naem-3-staen-grad-sofiya-meditsinska-akademiya,0,2026-01-24 06:06:50.863528,,imoticom,0,,,,97 кв.м,
Дава под наем  3-стаен,"6-ти ет., ТЕЦ, Предлагаме Ви модерен и луксозен тристаен апартамент!Разпределение на жилищната площ:- Просторна кух ...",1100.0,EUR,True,наем,тристаен,град София,Оборище,0887069908,,,https://www.imoti.com/obiava/71951197/dava-pod-naem-3-staen-grad-sofiya-oborishte,0,2026-01-24 06:06:50.863880,,imoticom,0,,,,120 кв.м,
Дава под наем  3-стаен,"2-ри ет., ТЕЦ, Агенция за недвижими имоти Vice Real Estate с удоволствие Ви представя тристаен апартамент под наем, ...",649.0,EUR,True,наем,тристаен,град София,Подуяне,0892976004,,,https://www.imoti.com/obiava/35539298/dava-pod-naem-3-staen-grad-sofiya-poduyane,0,2026-01-24 06:06:50.864228,,imoticom,0,,,,87 кв.м,
Дава под наем  3-стаен,"2-ри ет., Агенция за недвижими имоти Vice Real Estate с удоволствие Ви представя тристаен апартамент под наем, ...",949.0,EUR,True,наем,тристаен,град София,Хиподрума,0892976004,,,https://www.imoti.com/obiava/72222149/dava-pod-naem-3-staen-grad-sofiya-hipodruma,0,2026-01-24 06:06:50.864587,,imoticom,0,,,,95 кв.м,
Дава под наем  3-стаен,"2-ри ет., Отдава се под наем страхотен НОВ просторен апартамент -94 м2 в жк. Хиподрума. Жилището е бутиково, н ...",950.0,EUR,True,наем,тристаен,град София,Хиподрума,0887699259,,,https://www.imoti.com/obiava/15216970/dava-pod-naem-3-staen-grad-sofiya-hipodruma,0,2026-01-24 06:06:50.864937,,imoticom,0,,,,94 кв.м,
Дава под наем  3-стаен,"3-ти ет., ТЕЦ, Предлагаме Ви напълно обзаведен апартамент в непосредствена близост до бул.  България .Апартаментът  ...",1000.0,EUR,True,наем,тристаен,град София,Хиподрума,0888238737,,,https://www.imoti.com/obiava/66324097/dava-pod-naem-3-staen-grad-sofiya-hipodruma,0,2026-01-24 06:06:50.865283,,imoticom,0,,,,110 кв.м,
Дава под наем  3-стаен,"1-ви ет., Предлагаме Ви напълно обзаведен апартамент, разположен на изключително комуникативно място   входът  ...",790.0,EUR,True,наем,тристаен,град София,Хладилника,0888238737,,,https://www.imoti.com/obiava/75344293/dava-pod-naem-3-staen-grad-sofiya-hladilnika,0,2026-01-24 06:06:50.865643,,imoticom,0,,,,90 кв.м,
Дава под наем  3-стаен,"ID-1846;Топ локация!!! ОГЛЕД ПО ВСЯКО ВРЕМЕ!БЕЗ КОМИСИОННА!!!Представяме Ви тристаен, напълно обзаве ...",750.0,EUR,True,наем,тристаен,град София,Яворов,0884235446,,,https://www.imoti.com/obiava/89218040/dava-pod-naem-3-staen-grad-sofiya-yavorov,0,2026-01-24 06:06:50.865987,,imoticom,0,,,,100 кв.м,
Дава под наем  3-стаен,"2-ри ет., ТЕЦ, SUCCESSFUL PROPERTIES представя под наем просторен тристаен апартамент на отлична лоакция в ж.к. Яво ...",850.0,EUR,True,наем,тристаен,град София,Яворов,0879890105,,,https://www.imoti.com/obiava/87953114/dava-pod-naem-3-staen-grad-sofiya-yavorov,0,2026-01-24 06:06:50.866335,,imoticom,0,,,,95 кв.м,
