raw_title,raw_description,price,currency,without_dds,offer_type,property_type,city,neighborhood,contact_info,agency,agency_url,details_url,num_photos,date_time_added,search_url,site,total_offers,ref_no,time,price_per_m2,area,floor
Дава под наем  3-стаен,"5-ти ет., ТЕЦ, Луксозно обзаведен апартамент с ГАРАЖ в комплекс ЕСТЕ. Комплексът предлага всички удобства, характер ...",1400.0,EUR,True,наем,тристаен,град София,Изток,0898414272,,,https://www.imoti.com/obiava/35492499/dava-pod-naem-3-staen-grad-sofiya-iztok,0,2026-01-24 06:07:36.646799,,imoticom,0,,,,143 кв.м,
Дава под наем  3-стаен,"5-ти ет., ТЕЦ, Луксозно обзаведен апартамент с ГАРАЖ в комплекс ЕСТЕ. Комплексът предлага всички удобства, характер ...",1400.0,EUR,True,наем,тристаен,град София,Изток,0898414272,,,https://www.imoti.com/obiava/87262157/dava-pod-naem-3-staen-grad-sofiya-iztok,0,2026-01-24 06:07:36.647141,,imoticom,0,,,,143 кв.м,
Дава под наем  3-стаен,"4-ти ет., ТЕЦ, For English please call us! ID EH-23395 www.estatehouse.bgEstate House Realty има удоволствието да п ...",1417.0,EUR,True,наем,тристаен,град София,Изток,0885 406 333,,,https://www.imoti.com/obiava/60648276/dava-pod-naem-3-staen-grad-sofiya-iztok,0,2026-01-24 06:07:36.647483,,imoticom,0,,,,130 кв.м,
Дава под наем  3-стаен,"2-ри ет., ТЕЦ, Home Life ви предлага елегантен апартамент с две спални под наем в сграда на Артекс, кв. Изток на ул ...",1450.0,EUR,True,наем,тристаен,град София,Изток,0877488048,,,https://www.imoti.com/obiava/45769111/dava-pod-naem-3-staen-grad-sofiya-iztok,0,2026-01-24 06:07:36.647837,,imoticom,0,,,,95 кв.м,
Дава под наем  3-стаен,"4-ти ет., ТЕЦ, LUXIMMO FINEST ESTATES: www.luximmo.bgИмаме удоволствието да представим прекрасен, напълно обзаведен ...",1500.0,EUR,True,наем,тристаен,град София,Изток,0882812701,,,https://www.imoti.com/obiava/97835748/dava-pod-naem-3-staen-grad-sofiya-iztok,0,2026-01-24 06:07:36.648182,,imoticom,0,,,,130 кв.м,
Дава под наем  3-стаен,"6-ти ет., ТЕЦ, ЛУКСОЗЕН ИМОТ! СПОКОЙНА СРЕДА! ВОЛАНТИС БЪЛГАРИЯ представя тристаен апартамент в кв. 'Изгрев', в емб ...",1500.0,EUR,True,наем,тристаен,град София,Изток,0882 100111,,,https://www.imoti.com/obiava/67819723/dava-pod-naem-3-staen-grad-sofiya-iztok,0,2026-01-24 06:07:36.648533,,imoticom,0,,,,142 кв.м,
Дава под наем  3-стаен,"9-ти ет., ТЕЦ, Агенция дипломатически имоти в страната предлага тристаен апартамент под наем в кв. Изток.Апартамент ...",1400.0,EUR,True,наем,тристаен,град София,Изток,0882177784,,,https://www.imoti.com/obiava/80854336/dava-pod-naem-3-staen-grad-sofiya-iztok,0,2026-01-24 06:07:36.648874,,imoticom,0,,,,165 кв.м,
Дава под наем  3-стаен,"4-ти ет., ТЕЦ, За повече информация обадете ни се на тел: 0882 817 464 или 02 425 68 26 и цитирайте референтния ном ...",1700.0,EUR,True,наем,тристаен,град София,Изток,0882817464,,,https://www.imoti.com/obiava/64959107/dava-pod-naem-3-staen-grad-sofiya-iztok,0,2026-01-24 06:07:36.649215,,imoticom,0,,,,130 кв.м,
Дава под наем  3-стаен,"5-ти ет., ТЕЦ, Модерен и просторен апартамент под наем в затворен жилищен комплекс с 24-часова охрана, разположен д ...",1500.0,EUR,True,наем,тристаен,град София,Изток,0889601137,,,https://www.imoti.com/obiava/89187289/dava-pod-naem-3-staen-grad-sofiya-iztok,0,2026-01-24 06:07:36.649564,,imoticom,0,,,,110 кв.м,
Дава под наем  3-стаен,"7-ми ет. от 16, Имотът е собственост на АДИС ЕООД и се отдава без комисионна от наемателя!     Комфортен, модерно об ...",1800.0,EUR,True,наем,тристаен,град София,Изток,0882177784,,,https://www.imoti.com/obiava/16380425/dava-pod-naem-3-staen-grad-sofiya-iztok,0,2026-01-24 06:07:36.649904,,imoticom,0,,,,173 кв.м,
Дава под наем  3-стаен,"4-ти ет., ГАЗ, ТЕЦ, Unique Estates представя чисто нов апартамент с две спални  в нова срада с контролиран достъп и жива ...",1650.0,EUR,True,наем,тристаен,град София,Изток,0882 300 400,,,https://www.imoti.com/obiava/12709980/dava-pod-naem-3-staen-grad-sofiya-iztok,0,2026-01-24 06:07:36.650242,,imoticom,0,,,,94 кв.м,
Дава под наем  3-стаен,"1-ви ет., ТЕЦ, София Вайб Пропъртис предлага елегантен 3-стаен апартамент в комплекс Este   идеален за семейства, т ...",1800.0,EUR,True,наем,тристаен,град София,Изток,0889601137,,,https://www.imoti.com/obiava/29614447/dava-pod-naem-3-staen-grad-sofiya-iztok,0,2026-01-24 06:07:36.650593,,imoticom,0,,,,116 кв.м,
Дава под наем  3-стаен,"2-ри ет., ТЕЦ, Предлагаме под наем светъл и комфортен тристаен апартамент, разположен в престижен затворен комплекс ...",1830.0,EUR,True,наем,тристаен,град София,Изток,0889601137,,,https://www.imoti.com/obiava/74046097/dava-pod-naem-3-staen-grad-sofiya-iztok,0,2026-01-24 06:07:36.650928,,imoticom,0,,,,140 кв.м,
Дава под наем  3-стаен,"6-ти ет., Unique Estates предлага елегантен апартамент под наем, напълно обзаведен, в сграда на Артекс на ул.Л ...",3000.0,EUR,True,наем,тристаен,град София,Изток,0882 300 400,,,https://www.imoti.com/obiava/83612962/dava-pod-naem-3-staen-grad-sofiya-iztok,0,2026-01-24 06:07:36.651269,,imoticom,0,,,,209 кв.м,
Дава под наем  3-стаен,"2-ри ет., ТЕЦ, Агенция за недвижими имоти Калиста Естейт има огромното удоволствие да Ви представи тристаен апартам ...",599.0,EUR,True,наем,тристаен,град София,Медицинска академия,0884765100,,,https://www.imoti.com/obiava/13000440/dava-pod-naem-3-staen-grad-sofiya-meditsinska-akademiya,0,2026-01-24 06:07:38.629669,,imoticom,0,,,,70 кв.м,
Дава под наем  3-стаен,"2-ри ет., ТЕЦ, Агенция за недвижими имоти Vice Real Estate с удоволствие Ви представя тристаен апартамент под наем, ...",599.0,EUR,True,наем,тристаен,град София,Медицинска академия,0892976004,,,https://www.imoti.com/obiava/28527793/dava-pod-naem-3-staen-grad-sofiya-meditsinska-akademiya,0,2026-01-24 06:07:38.630040,,imoticom,0,,,,72 кв.м,
Дава под наем  3-стаен,"5-ти ет., До ВМА! Разкошен просторен и светъл непреходен обзаведен  апартамент , във вътрешна част , тихо мяст ...",600.0,EUR,True,наем,тристаен,град София,Медицинска академия,0893468328,,,https://www.imoti.com/obiava/53139436/dava-pod-naem-3-staen-grad-sofiya-meditsinska-akademiya,0,2026-01-24 06:07:38.630396,,imoticom,0,,,,65 кв.м,
Дава под наем  3-стаен,"2-ри ет., ТЕЦ, Титан Пропъртис - офис Хиподрума с радост предлага на Вашето внимание тристаен апартамент под наем в ...",600.0,EUR,True,наем,тристаен,град София,Медицинска академия,0892745642,,,https://www.imoti.com/obiava/44029119/dava-pod-naem-3-staen-grad-sofiya-meditsinska-akademiya,0,2026-01-24 06:07:38.630766,,imoticom,0,,,,70 кв.м,
Дава под наем  3-стаен,"6-ти ет., ТЕЦ,  Агенция Инжталант, ви предлага 3-стаен, обзаведен, тухлен, непреходен апартамент находящ се в жилищ ...",600.0,EUR,True,наем,тристаен,град София,Медицинска академия,0878283673,,,https://www.imoti.com/obiava/29390596/dava-pod-naem-3-staen-grad-sofiya-meditsinska-akademiya,0,2026-01-24 06:07:38.631122,,imoticom,0,,,,93 кв.м,
Дава под наем  3-стаен,"2-ри ет., ТЕЦ, 📌 Референтен номер: 2212773❗ Революшън Естейт представя Тристаен в София, Медицинска  ...",600.0,EUR,True,наем,тристаен,град София,Медицинска академия,0899500900,,,https://www.imoti.com/obiava/52443793/dava-pod-naem-3-staen-grad-sofiya-meditsinska-akademiya,0,2026-01-24 06:07:38.631481,,imoticom,0,,,,90 кв.м,
Дава под наем  3-стаен,"2-ри ет., Компания `ЕКС` представя на Вашето внимание тристаен апартамент в жк. Медицинска академия.МЕСТОПОЛОЖ ...",613.0,EUR,True,наем,тристаен,град София,Медицинска академия,0884 95 70 94,,,https://www.imoti.com/obiava/59143970/dava-pod-naem-3-staen-grad-sofiya-meditsinska-akademiya,0,2026-01-24 06:07:38.631847,,imoticom,0,,,,80 кв.м,
Дава под наем  3-стаен,"2-ри ет., Агенция за недвижими имоти IGV Consult предлага Тристаен, напълно обзаведен апартамент, след ремонт. ...",614.0,EUR,True,наем,тристаен,град София,Медицинска академия,0885132725,,,https://www.imoti.com/obiava/66021206/dava-pod-naem-3-staen-grad-sofiya-meditsinska-akademiya,0,2026-01-24 06:07:38.632197,,imoticom,0,,,,72 кв.м,
Дава под наем  3-стаен,"2-ри ет., ТЕЦ, 📌 Референтен номер: 2177070❗ Революшън Естейт представя тристаен апартамент  в София, ...",650.0,EUR,True,наем,тристаен,град София,Медицинска академия,0899500900,,,https://www.imoti.com/obiava/67885531/dava-pod-naem-3-staen-grad-sofiya-meditsinska-akademiya,0,2026-01-24 06:07:38.632560,,imoticom,0,,,,70 кв.м,
Дава под наем  3-стаен,,699.0,EUR,True,наем,тристаен,град София,Медицинска академия,0883252052,,,https://www.imoti.com/obiava/16962609/dava-pod-naem-3-staen-grad-sofiya-meditsinska-akademiya,0,2026-01-24 06:07:38.632914,,imoticom,0,,,,75 кв.м,
Дава под наем  3-стаен,"2-ри ет., ЕКСКЛУЗИВНО! ЕРА Голд отдава под наем просторен и слънчев тристаен апартамент срещу метростанция  ...",700.0,EUR,True,наем,тристаен,град София,Медицинска академия,0889115777,,,https://www.imoti.com/obiava/95067334/dava-pod-naem-3-staen-grad-sofiya-meditsinska-akademiya,0,2026-01-24 06:07:38.633265,,imoticom,0,,,,70 кв.м,
Дава под наем  3-стаен,"1-ви ет., Апартамента е с три спални, хол, кухня, килер, перално помещение.Жилището е отремонтирано, с нови ме ...",700.0,EUR,True,наем,тристаен,град София,Медицинска академия,0877786264,,,https://www.imoti.com/obiava/75481080/dava-pod-naem-3-staen-grad-sofiya-meditsinska-akademiya,0,2026-01-24 06:07:38.633633,,imoticom,0,,,,180 кв.м,
Дава под наем  3-стаен,"4-ти ет., ТЕЦ, Напълно обзаведен, основно ремонтиран тристаен апартамент на ул. Тунджа, в близост до ул. Хр. Станче ...",750.0,EUR,True,наем,тристаен,град София,Медицинска академия,0879430685,,,https://www.imoti.com/obiava/48257043/dava-pod-naem-3-staen-grad-sofiya-meditsinska-akademiya,0,2026-01-24 06:07:38.633988,,imoticom,0,,,,70 кв.м,
Дава под наем  3-стаен,"2-ри ет., ТЕЦ, Номер в агенцията 49766. Агенция Абела предлага ексклузивно нов , кокетен тристаен апартамент на ТОП ...",750.0,EUR,True,наем,тристаен,град София,Медицинска академия,0988963239,,,https://www.imoti.com/obiava/45048662/dava-pod-naem-3-staen-grad-sofiya-meditsinska-akademiya,0,2026-01-24 06:07:38.634346,,imoticom,0,,,,65 кв.м,
Дава под наем  3-стаен,"3-ти ет., ТЕЦ, Луксозно обзаведен, голям тристаен + вестибюл в района на пл.Петте кьошета и на кратко пешеходно раз ...",750.0,EUR,True,наем,тристаен,град София,Медицинска академия,0898414272,,,https://www.imoti.com/obiava/35001668/dava-pod-naem-3-staen-grad-sofiya-meditsinska-akademiya,0,2026-01-24 06:07:38.634715,,imoticom,0,,,,110 кв.м,
Дава под наем  3-стаен,"2-ри ет., ТЕЦ, Слънчев и топъл тристаен апартамент в центъра, до бул.'Пенчо Славейков' на ул.'Тунджа', до метростан ...",750.0,EUR,True,наем,тристаен,град София,Медицинска академия,02/910 10 10,,,https://www.imoti.com/obiava/37631575/dava-pod-naem-3-staen-grad-sofiya-meditsinska-akademiya,0,2026-01-24 06:07:38.635070,,imoticom,0,,,,80 кв.м,
Дава под наем  3-стаен,"2-ри ет., ТЕЦ, град София, Център, ул. Владайска 99,срещу'Пирогов', до Медицинския колеж, болница на МВР, детска гр ...",750.0,EUR,True,наем,тристаен,град София,Медицинска академия,02/910 10 10,,,https://www.imoti.com/obiava/23760956/dava-pod-naem-3-staen-grad-sofiya-meditsinska-akademiya,0,2026-01-24 06:07:38.635425,,imoticom,0,,,,80 кв.м,
Дава под наем  3-стаен,"2-ри ет., ТЕЦ, град София, Център, ул. Владайска, зад 'Астория гранд хотел', до Медицинския колеж, болница на МВР,  ...",750.0,EUR,True,наем,тристаен,град София,Медицинска академия,02/910 10 10,,,https://www.imoti.com/obiava/60695519/dava-pod-naem-3-staen-grad-sofiya-meditsinska-akademiya,0,2026-01-24 06:07:38.635792,,imoticom,0,,,,80 кв.м,
Дава под наем  3-стаен,"2-ри ет., Ексклузивно!!! Софконсулт предлага под наем обзаведен апартамент с две спални и паркомясто. В близос ...",766.0,EUR,True,наем,тристаен,град София,Медицинска академия,0889/203-682,,,https://www.imoti.com/obiava/82000124/dava-pod-naem-3-staen-grad-sofiya-meditsinska-akademiya,0,2026-01-24 06:07:38.636140,,imoticom,0,,,,98 кв.м,
Дава под наем  3-стаен,"4-ти ет., ТЕЦ, Номер на офертата в агенцията 18740. ЕКСКЛУЗИВ КЛЮЧ В АГЕНЦИЯТА!!! Предлагаме обзаведен двустаен апа ...",800.0,EUR,True,наем,тристаен,град София,Медицинска академия,0885706434,,,https://www.imoti.com/obiava/60247204/dava-pod-naem-3-staen-grad-sofiya-meditsinska-akademiya,0,2026-01-24 06:07:38.636490,,imoticom,0,,,,70 кв.м,
Дава под наем  3-стаен,"2-ри ет., Лъки Хоум Естейт представя просторен тристаен апартамент под наем, находящ се на ул. Здраве, в непос ...",800.0,EUR,True,наем,тристаен,град София,Медицинска академия,0879906111,,,https://www.imoti.com/obiava/52051638/dava-pod-naem-3-staen-grad-sofiya-meditsinska-akademiya,0,2026-01-24 06:07:40.619372,,imoticom,0,,,,90 кв.м,
Дава под наем  3-стаен,"6-ти ет., ТЕЦ, Агенция за недвижими имоти Peak Real Estate предлага в панелно строителство тристаен апартамент в ж. ...",800.0,EUR,True,наем,тристаен,град София,Медицинска академия,0882988975,,,https://www.imoti.com/obiava/24280356/dava-pod-naem-3-staen-grad-sofiya-meditsinska-akademiya,0,2026-01-24 06:07:40.619752,,imoticom,0,,,,84 кв.м,
Дава под наем  3-стаен,"2-ри ет., ТЕЦ, Прекрасен апартамент с две спални под наем в кв.  Иван Вазов Предлагаме под наем напълно обзаведен т ...",800.0,EUR,True,наем,тристаен,град София,Медицинска академия,0888660255,,,https://www.imoti.com/obiava/41587226/dava-pod-naem-3-staen-grad-sofiya-meditsinska-akademiya,0,2026-01-24 06:07:40.620106,,imoticom,0,,,,80 кв.м,
Дава под наем  3-стаен,"4-ти ет., ТЕЦ, Дава се под наем 3-стаен апартамент, на уникално и предпочитано място - срещу Военномедицинска акаде ...",820.0,EUR,True,наем,тристаен,град София,Медицинска академия,0896355005,,,https://www.imoti.com/obiava/57344094/dava-pod-naem-3-staen-grad-sofiya-meditsinska-akademiya,0,2026-01-24 06:07:40.620468,,imoticom,0,,,,86 кв.м,
Дава под наем  3-стаен,"6-ти ет., ТЕЦ, Агенция за недвижими имоти Vice Real Estate с удоволствие Ви представя тристаен апартамент под наем, ...",849.0,EUR,True,наем,тристаен,град София,Медицинска академия,0892976004,,,https://www.imoti.com/obiava/64338067/dava-pod-naem-3-staen-grad-sofiya-meditsinska-akademiya,0,2026-01-24 06:07:40.620842,,imoticom,0,,,,84 кв.м,
Дава под наем  3-стаен,"4-ти ет., Предлагаме на Вашето внимание изцяло обзаведен тристаен апартамент, находящ се на ул. Адриана Будевс ...",850.0,EUR,True,наем,тристаен,град София,Медицинска академия,0886083233,,,https://www.imoti.com/obiava/53691949/dava-pod-naem-3-staen-grad-sofiya-meditsinska-akademiya,0,2026-01-24 06:07:40.621201,,imoticom,0,,,,102 кв.м,
Дава под наем  3-стаен,"6-ти ет., ТЕЦ, Дава под наем тристаен апартамент, 84 кв. м., с две самостоятелни спални с климатици и тераси, дневн ...",850.0,EUR,True,наем,тристаен,град София,Медицинска академия,0888662414,,,https://www.imoti.com/obiava/96384880/dava-pod-naem-3-staen-grad-sofiya-meditsinska-akademiya,0,2026-01-24 06:07:40.621561,,imoticom,0,,,,84 кв.м,
Дава под наем  3-стаен,"2-ри ет., ТЕЦ, Луксозно обзаведен интериор, с модерна, цветна визия, и първокласна ЛОКАЦИЯ. Имотът се намира в най- ...",850.0,EUR,True,наем,тристаен,град София,Медицинска академия,0898414272,,,https://www.imoti.com/obiava/22472379/dava-pod-naem-3-staen-grad-sofiya-meditsinska-akademiya,0,2026-01-24 06:07:40.621910,,imoticom,0,,,,100 кв.м,
Дава под наем  3-стаен,"2-ри ет., ТЕЦ, Луксозно обзаведен интериор, с модерна, цветна визия, и първокласна ЛОКАЦИЯ. Имотът се намира в най- ...",850.0,EUR,True,наем,тристаен,град София,Медицинска академия,0898414272,,,https://www.imoti.com/obiava/20896069/dava-pod-naem-3-staen-grad-sofiya-meditsinska-akademiya,0,2026-01-24 06:07:40.622254,,imoticom,0,,,,100 кв.м,
Дава под наем  3-стаен,"5-ти ет., Обзаведен тристаен апартамент под наем в Център, до НДК и Медицинска академия. Ново строителство, съ ...",850.0,EUR,True,наем,тристаен,град София,Медицинска академия,0897279575,,,https://www.imoti.com/obiava/33823186/dava-pod-naem-3-staen-grad-sofiya-meditsinska-akademiya,0,2026-01-24 06:07:40.622615,,imoticom,0,,,,85 кв.м,
Дава под наем  3-стаен,"6-ти ет., ТЕЦ, MYAGKOV ESTATES предлага под наем страхотен тристаен апартамент в района на Медицинска академия, в н ...",850.0,EUR,True,наем,тристаен,град София,Медицинска академия,0877444505,,,https://www.imoti.com/obiava/79610240/dava-pod-naem-3-staen-grad-sofiya-meditsinska-akademiya,0,2026-01-24 06:07:40.622960,,imoticom,0,,,,84 кв.м,
Дава под наем  3-стаен,"4-ти ет., ТЕЦ, СВОБОДЕН ОТ 01.02.2026г.!ЛУКСОЗНО ОБЗАВЕДЕН!Предлагаме на Вашето внимание тристаен апартамент под на ...",900.0,EUR,True,наем,тристаен,град София,Медицинска академия,0887219224,,,https://www.imoti.com/obiava/70121139/dava-pod-naem-3-staen-grad-sofiya-meditsinska-akademiya,0,2026-01-24 06:07:40.623305,,imoticom,0,,,,92 кв.м,
Дава под наем  3-стаен,"6-ти ет., ТЕЦ, Уникално местоположение и панорама. Модерна цялостна визия на интериора. Луксозно обзавеждане с каче ...",900.0,EUR,True,наем,тристаен,град София,Медицинска академия,0898414272,,,https://www.imoti.com/obiava/11882718/dava-pod-naem-3-staen-grad-sofiya-meditsinska-akademiya,0,2026-01-24 06:07:40.623666,,imoticom,0,,,,122 кв.м,
Дава под наем  3-стаен,"6-ти ет., ТЕЦ, Селесте Пропърти предлага под наем тристаен апартамент в един от най-предпочитаните райони на столиц ...",900.0,EUR,True,наем,тристаен,град София,Медицинска академия,0893442186,,,https://www.imoti.com/obiava/24929045/dava-pod-naem-3-staen-grad-sofiya-meditsinska-akademiya,0,2026-01-24 06:07:40.624013,,imoticom,0,,,,84 кв.м,
Дава под наем  3-стаен,"6-ти ет., ТЕЦ, NEXT LEVEL PROPERTY Предлага на Вашето внимание тристайно жилище в ж.к. Медицинска академия.На минут ...",900.0,EUR,True,наем,тристаен,град София,Медицинска академия,0876708149,,,https://www.imoti.com/obiava/11085430/dava-pod-naem-3-staen-grad-sofiya-meditsinska-akademiya,0,2026-01-24 06:07:40.624357,,imoticom,0,,,,84 кв.м,
Дава под наем  3-стаен,"4-ти ет., ТЕЦ, Луксозно обзаведен тристаен апартамент до ВМА.Вътрешен с южно изложение. Състои се от просторна днев ...",900.0,EUR,True,наем,тристаен,град София,Медицинска академия,0888614141,,,https://www.imoti.com/obiava/26353469/dava-pod-naem-3-staen-grad-sofiya-meditsinska-akademiya,0,2026-01-24 06:07:40.624723,,imoticom,0,,,,103 кв.м,
Дава под наем  3-стаен,"6-ти ет., ТЕЦ, 7️⃣ 7Estate дарява 7% от печалбата за благотворителни каузи 📧 https://7estate.b ...",900.0,EUR,True,наем,тристаен,град София,Медицинска академия,0897900935,,,https://www.imoti.com/obiava/47699459/dava-pod-naem-3-staen-grad-sofiya-meditsinska-akademiya,0,2026-01-24 06:07:40.625073,,imoticom,0,,,,82 кв.м,
Дава под наем  3-стаен,"1-ви ет., ТЕЦ, Частно лице отдава на частно лице тристаен обзаведен след ремонт и изцяло ново обзавеждане. Втората  ...",946.0,EUR,True,наем,тристаен,град София,Медицинска академия,0888414124,,,https://www.imoti.com/obiava/35558120/dava-pod-naem-3-staen-grad-sofiya-meditsinska-akademiya,0,2026-01-24 06:07:40.625417,,imoticom,0,,,,94 кв.м,
