raw_title,raw_description,price,currency,without_dds,offer_type,property_type,city,neighborhood,contact_info,agency,agency_url,details_url,num_photos,date_time_added,search_url,site,total_offers,ref_no,time,price_per_m2,area,floor
Дава под наем  2-стаен,"6-ти ет., ТЕЦ, СОФЕСТЕЙТС има удоволствието да Ви представи страхотен двустаен апартамент в сграда на Артекс, с изц ...",1200.0,EUR,True,наем,двустаен,град София,Изток,0893351008,,,https://www.imoti.com/obiava/82882974/dava-pod-naem-2-staen-grad-sofiya-iztok,0,2026-01-24 06:07:02.823075,,imoticom,0,,,,74 кв.м,
Дава под наем  2-стаен,"1-ви ет., ТЕЦ, For english please contact us! ID EH-23417 https://estatehouse.bg/Estate House Realty има удоволстви ...",1277.0,EUR,True,наем,двустаен,град София,Изток,0885 406 333,,,https://www.imoti.com/obiava/67458488/dava-pod-naem-2-staen-grad-sofiya-iztok,0,2026-01-24 06:07:02.823429,,imoticom,0,,,,97 кв.м,
Дава под наем  2-стаен,"5-ти ет., ТЕЦ, Титан Пропъртис - офис Хиподрума с радост предлага на Вашето внимание двустаен апартамент под наем в ...",511.0,EUR,True,наем,двустаен,град София,Медицинска академия,0892745642,,,https://www.imoti.com/obiava/59469607/dava-pod-naem-2-staen-grad-sofiya-meditsinska-akademiya,0,2026-01-24 06:07:02.823798,,imoticom,0,,,,90 кв.м,
Дава под наем  2-стаен,"3-ти ет., ТЕЦ, Отдава се под наем двустаен напълно обзаведен апартамент в Медицинска академия. Имотът се състои от  ...",550.0,EUR,True,наем,двустаен,град София,Медицинска академия,0878589133,,,https://www.imoti.com/obiava/41352824/dava-pod-naem-2-staen-grad-sofiya-meditsinska-akademiya,0,2026-01-24 06:07:02.824153,,imoticom,0,,,,75 кв.м,
Дава под наем  2-стаен,"5-ти ет., ТЕЦ, Агенция ' Тера Булгари - Земя на българи ' дава под наем двустайно жилище в центъра на гр. София. Пе ...",560.0,EUR,True,наем,двустаен,град София,Медицинска академия,0884324703,,,https://www.imoti.com/obiava/31310776/dava-pod-naem-2-staen-grad-sofiya-meditsinska-akademiya,0,2026-01-24 06:07:02.824525,,imoticom,0,,,,44 кв.м,
Дава под наем  2-стаен,,590.0,EUR,True,наем,двустаен,град София,Медицинска академия,0887122012,,,https://www.imoti.com/obiava/29699199/dava-pod-naem-2-staen-grad-sofiya-meditsinska-akademiya,0,2026-01-24 06:07:02.824880,,imoticom,0,,,,52 кв.м,
Дава под наем  2-стаен,"5-ти ет., ТЕЦ, До ВМА! Близо до Метростанция .Разкошен просторен и светъл непреходен обзаведен двустаен  апартамент ...",600.0,EUR,True,наем,двустаен,град София,Медицинска академия,0893468328,,,https://www.imoti.com/obiava/63887004/dava-pod-naem-2-staen-grad-sofiya-meditsinska-akademiya,0,2026-01-24 06:07:02.825229,,imoticom,0,,,,65 кв.м,
Дава под наем  2-стаен,"4-ти ет., ТЕЦ, Нов, луксозно обзаведен апартамент в близост до пл. Ручей, ВМА и метроспирка бул. България.Апартамен ...",600.0,EUR,True,наем,двустаен,град София,Медицинска академия,0898414272,,,https://www.imoti.com/obiava/79236177/dava-pod-naem-2-staen-grad-sofiya-meditsinska-akademiya,0,2026-01-24 06:07:02.825592,,imoticom,0,,,,70 кв.м,
Дава под наем  2-стаен,,600.0,EUR,True,наем,двустаен,град София,Медицинска академия,0878686690,,,https://www.imoti.com/obiava/12895754/dava-pod-naem-2-staen-grad-sofiya-meditsinska-akademiya,0,2026-01-24 06:07:02.825940,,imoticom,0,,,,55 кв.м,
Дава под наем  2-стаен,"2-ри ет., ТЕЦ, Предлагаме просторен двустаен апартамент,в района на Медицинска академия,на бул.'Пенчо Славейков',бл ...",620.0,EUR,True,наем,двустаен,град София,Медицинска академия,0988829752,,,https://www.imoti.com/obiava/64434877/dava-pod-naem-2-staen-grad-sofiya-meditsinska-akademiya,0,2026-01-24 06:07:02.826299,,imoticom,0,,,,70 кв.м,
Дава под наем  2-стаен,"4-ти ет., ТЕЦ, Агенция за недвижими имоти Калиста Естейт има огромното удоволствие да Ви представи двустаен апартам ...",649.0,EUR,True,наем,двустаен,град София,Медицинска академия,0884765100,,,https://www.imoti.com/obiava/93983379/dava-pod-naem-2-staen-grad-sofiya-meditsinska-akademiya,0,2026-01-24 06:07:02.826663,,imoticom,0,,,,58 кв.м,
Дава под наем  2-стаен,"2-ри ет., 100458886 Под наем 2-СТАЕН апартамент в идеалния център на града - на тихата улица Доспат, в непосре ...",650.0,EUR,True,наем,двустаен,град София,Медицинска академия,0883941647,,,https://www.imoti.com/obiava/40483491/dava-pod-naem-2-staen-grad-sofiya-meditsinska-akademiya,0,2026-01-24 06:07:02.827014,,imoticom,0,,,,52 кв.м,
Дава под наем  2-стаен,"7-ми ет., ТЕЦ, Експрес имоти представя на Вашето внимание нов, обзаведен двустаен апартамент, в района на Медицинск ...",650.0,EUR,True,наем,двустаен,град София,Медицинска академия,0884579822,,,https://www.imoti.com/obiava/94099055/dava-pod-naem-2-staen-grad-sofiya-meditsinska-akademiya,0,2026-01-24 06:07:02.827365,,imoticom,0,,,,70 кв.м,
Дава под наем  2-стаен,"4-ти ет., ТЕЦ, Открийте мястото, където ще се чувствате у дома от първия момент.Титан Пропъртис - офис Младост с ра ...",650.0,EUR,True,наем,двустаен,град София,Медицинска академия,0897850387,,,https://www.imoti.com/obiava/87093984/dava-pod-naem-2-staen-grad-sofiya-meditsinska-akademiya,0,2026-01-24 06:07:02.827727,,imoticom,0,,,,58 кв.м,
Дава под наем  2-стаен,"4-ти ет., ТЕЦ, Ера София Тренд предлага двустаен обзаведен апартамент до метростамция и Медицински университет.0894 ...",650.0,EUR,True,наем,двустаен,град София,Медицинска академия,0899808182,,,https://www.imoti.com/obiava/81050067/dava-pod-naem-2-staen-grad-sofiya-meditsinska-akademiya,0,2026-01-24 06:07:02.828076,,imoticom,0,,,,60 кв.м,
Дава под наем  2-стаен,"4-ти ет., ТЕЦ, 📌 Референтен номер: 2109073❗ Революшън Естейт представя Двустаен в София, Медицинска  ...",650.0,EUR,True,наем,двустаен,град София,Медицинска академия,0899500900,,,https://www.imoti.com/obiava/37421104/dava-pod-naem-2-staen-grad-sofiya-meditsinska-akademiya,0,2026-01-24 06:07:02.828426,,imoticom,0,,,,58 кв.м,
Дава под наем  2-стаен,"2-ри ет., ТЕЦ, 'Рея Интернешънъл'  ви предлага дизайнерски направен и обзаведен апартамент, дело на  интериорно сту ...",650.0,EUR,True,наем,двустаен,град София,Медицинска академия,0895618787,,,https://www.imoti.com/obiava/75408218/dava-pod-naem-2-staen-grad-sofiya-meditsinska-akademiya,0,2026-01-24 06:07:02.828793,,imoticom,0,,,,58 кв.м,
Дава под наем  2-стаен,"6-ти ет., ТЕЦ, Предлагаме на Вашето внимание двустаен обзаведен апартамент в близост до медицинска академия. Имота  ...",650.0,EUR,True,наем,двустаен,град София,Медицинска академия,0889766464,,,https://www.imoti.com/obiava/44244229/dava-pod-naem-2-staen-grad-sofiya-meditsinska-akademiya,0,2026-01-24 06:07:02.829140,,imoticom,0,,,,77 кв.м,
Дава под наем  2-стаен,"2-ри ет., ТЕЦ, БИЛД2015 предлага обзаведен двустаен апартамент с ПАРКОМЯСТО в двора на сградата. Намира се в близос ...",650.0,EUR,True,наем,двустаен,град София,Медицинска академия,0888808590,,,https://www.imoti.com/obiava/86018140/dava-pod-naem-2-staen-grad-sofiya-meditsinska-akademiya,0,2026-01-24 06:07:04.815010,,imoticom,0,,,,68 кв.м,
Дава под наем  2-стаен,"2-ри ет., ТЕЦ, В посочената цена е включено паркомясто.Открийте мястото, където ще се чувствате у дома от първия мо ...",650.0,EUR,True,наем,двустаен,град София,Медицинска академия,0897850387,,,https://www.imoti.com/obiava/68277341/dava-pod-naem-2-staen-grad-sofiya-meditsinska-akademiya,0,2026-01-24 06:07:04.815370,,imoticom,0,,,,70 кв.м,
Дава под наем  2-стаен,"6-ти ет., NEXT LEVEL PROPERTY Предлага на Вашето внимание двустайно жилище в ж.к. Медицинска академия.На минут ...",650.0,EUR,True,наем,двустаен,град София,Медицинска академия,0876708149,,,https://www.imoti.com/obiava/81870363/dava-pod-naem-2-staen-grad-sofiya-meditsinska-akademiya,0,2026-01-24 06:07:04.815733,,imoticom,0,,,,60 кв.м,
Дава под наем  2-стаен,"2-ри ет., ТЕЦ,  📌 Референтен номер: 2197545❗ Революшън Естейт представя Двустаен в София, Медицинска ...",664.0,EUR,True,наем,двустаен,град София,Медицинска академия,0899500900,,,https://www.imoti.com/obiava/37806701/dava-pod-naem-2-staen-grad-sofiya-meditsinska-akademiya,0,2026-01-24 06:07:04.816078,,imoticom,0,,,,70 кв.м,
Дава под наем  2-стаен,"7-ми ет., ТЕЦ, Напълно обзаведен двустаен апартамент в нова сграда на бул. Ген. Ед. И. Тотлебен, в близост до ул. Я ...",690.0,EUR,True,наем,двустаен,град София,Медицинска академия,0879430685,,,https://www.imoti.com/obiava/78353953/dava-pod-naem-2-staen-grad-sofiya-meditsinska-akademiya,0,2026-01-24 06:07:04.816422,,imoticom,0,,,,75 кв.м,
Дава под наем  2-стаен,"3-ти ет., ТЕЦ, Предлагаме на Вашето внимание компактен обзаведен апартамент в тухлена сграда от 2008г. в непосредст ...",700.0,EUR,True,наем,двустаен,град София,Медицинска академия,0887761430,,,https://www.imoti.com/obiava/97861012/dava-pod-naem-2-staen-grad-sofiya-meditsinska-akademiya,0,2026-01-24 06:07:04.816777,,imoticom,0,,,,65 кв.м,
Дава под наем  2-стаен,"6-ти ет., Изключителен двустаен апартамент под наем в Медицинска академия, на 5 минути от спирка на метро! Пре ...",700.0,EUR,True,наем,двустаен,град София,Медицинска академия,0884904279,,,https://www.imoti.com/obiava/78640881/dava-pod-naem-2-staen-grad-sofiya-meditsinska-akademiya,0,2026-01-24 06:07:04.817119,,imoticom,0,,,,60 кв.м,
Дава под наем  2-стаен,"2-ри ет., ТЕЦ, ПРЕДЛАГАМЕ НА ВАШЕТО ВНИМАНИЕ ПРОСТОРЕН ДВУСТАЕН АПАРТАМЕНТ С ОТЛИЧНА ЛОКАЦИЯ ДО ПЛ.РУСКИ ПАМЕТНИК,  ...",700.0,EUR,True,наем,двустаен,град София,Медицинска академия,0888/236-188,,,https://www.imoti.com/obiava/55210498/dava-pod-naem-2-staen-grad-sofiya-meditsinska-akademiya,0,2026-01-24 06:07:04.817461,,imoticom,0,,,,74 кв.м,
Дава под наем  2-стаен,"4-ти ет., ТЕЦ, Напълно обзаведен апартамент в тухлена кооперация от 2005г. Разположен е на 4-ти етаж от 6, а квадра ...",730.0,EUR,True,наем,двустаен,град София,Медицинска академия,0988825952,,,https://www.imoti.com/obiava/45534700/dava-pod-naem-2-staen-grad-sofiya-meditsinska-akademiya,0,2026-01-24 06:07:04.817820,,imoticom,0,,,,75 кв.м,
Дава под наем  2-стаен,,730.0,EUR,True,наем,двустаен,град София,Медицинска академия,0899389696,,,https://www.imoti.com/obiava/86049628/dava-pod-naem-2-staen-grad-sofiya-meditsinska-akademiya,0,2026-01-24 06:07:04.818161,,imoticom,0,,,,77 кв.м,
Дава под наем  2-стаен,"1-ви ет., ТЕЦ, Агенция за недвижими имоти Калиста Естейт има огромното удоволствие да Ви представи двустаен апартам ...",749.0,EUR,True,наем,двустаен,град София,Медицинска академия,0884765100,,,https://www.imoti.com/obiava/87363958/dava-pod-naem-2-staen-grad-sofiya-meditsinska-akademiya,0,2026-01-24 06:07:04.818514,,imoticom,0,,,,78 кв.м,
Дава под наем  2-стаен,"2-ри ет., ТЕЦ, Предлагаме Ви напълно обзаведен двустаен апартамент, разположен на изключително комуникативно място  ...",750.0,EUR,True,наем,двустаен,град София,Медицинска академия,0888238737,,,https://www.imoti.com/obiava/16014157/dava-pod-naem-2-staen-grad-sofiya-meditsinska-akademiya,0,2026-01-24 06:07:04.818862,,imoticom,0,,,,55 кв.м,
Дава под наем  2-стаен,"7-ми ет., ТЕЦ, 📌Референтен номер: 2097280❗ Революшън Естейт представя Двустаен в София, Медицинска а ...",750.0,EUR,True,наем,двустаен,град София,Медицинска академия,0899500900,,,https://www.imoti.com/obiava/47749231/dava-pod-naem-2-staen-grad-sofiya-meditsinska-akademiya,0,2026-01-24 06:07:04.819209,,imoticom,0,,,,75 кв.м,
Дава под наем  2-стаен,,750.0,EUR,True,наем,двустаен,град София,Медицинска академия,0885461116,,,https://www.imoti.com/obiava/44605971/dava-pod-naem-2-staen-grad-sofiya-meditsinska-akademiya,0,2026-01-24 06:07:04.819564,,imoticom,0,,,,75 кв.м,
Дава под наем  2-стаен,"1-ви ет., ТЕЦ, Открийте мястото, където ще се чувствате у дома от първия момент.Титан Пропъртис - офис Младост с ра ...",750.0,EUR,True,наем,двустаен,град София,Медицинска академия,0897850387,,,https://www.imoti.com/obiava/51800841/dava-pod-naem-2-staen-grad-sofiya-meditsinska-akademiya,0,2026-01-24 06:07:04.819921,,imoticom,0,,,,78 кв.м,
Дава под наем  2-стаен,"2-ри ет., Агенция SUPRIMMO: www.suprimmo.bgОбзаведен двустаен апартамент под наем в кв. 'Медицинска академ ...",750.0,EUR,True,наем,двустаен,град София,Медицинска академия,0882723128,,,https://www.imoti.com/obiava/39030465/dava-pod-naem-2-staen-grad-sofiya-meditsinska-akademiya,0,2026-01-24 06:07:04.820261,,imoticom,0,,,,70 кв.м,
Дава под наем  2-стаен,"2-ри ет., ТЕЦ, Агенция за недвижими имоти Имотопия Ви представя двустаен апартамент в жк. Медицинска академия. Жили ...",790.0,EUR,True,наем,двустаен,град София,Медицинска академия,0893989869,,,https://www.imoti.com/obiava/26170625/dava-pod-naem-2-staen-grad-sofiya-meditsinska-akademiya,0,2026-01-24 06:07:04.820617,,imoticom,0,,,,89 кв.м,
Дава под наем  2-стаен,"1-ви ет., Агенция за недвижими имоти Експрес Дом Консулт България предлага на вашето внимание, слънчев, просто ...",799.0,EUR,True,наем,двустаен,град София,Медицинска академия,0888030444,,,https://www.imoti.com/obiava/60759197/dava-pod-naem-2-staen-grad-sofiya-meditsinska-akademiya,0,2026-01-24 06:07:04.820964,,imoticom,0,,,,70 кв.м,
Дава под наем  2-стаен,"1-ви ет., Открийте мястото, където ще се чувствате у дома от първия момент.Титан Пропъртис - офис Младост с ра ...",799.0,EUR,True,наем,двустаен,град София,Медицинска академия,0897850387,,,https://www.imoti.com/obiava/78900420/dava-pod-naem-2-staen-grad-sofiya-meditsinska-akademiya,0,2026-01-24 06:07:04.821309,,imoticom,0,,,,70 кв.м,
Дава под наем  2-стаен,"4-ти ет., ТЕЦ, Номер на офертата в агенцията 18740. ЕКСКЛУЗИВ КЛЮЧ В АГЕНЦИЯТА!!! Предлагаме обзаведен двустаен апа ...",800.0,EUR,True,наем,двустаен,град София,Медицинска академия,0885706434,,,https://www.imoti.com/obiava/10735658/dava-pod-naem-2-staen-grad-sofiya-meditsinska-akademiya,0,2026-01-24 06:07:04.821661,,imoticom,0,,,,70 кв.м,
Дава под наем  2-стаен,"4-ти ет., Явлена Изток,  Ви представя  луксозен двустаен апартамент , находящ се в топ център , в близост до   ...",800.0,EUR,True,наем,двустаен,град София,Медицинска академия,0892514509,,,https://www.imoti.com/obiava/57581739/dava-pod-naem-2-staen-grad-sofiya-meditsinska-akademiya,0,2026-01-24 06:07:06.793695,,imoticom,0,,,,62 кв.м,
Дава под наем  2-стаен,"2-ри ет., Явлена Изток, Ви представя луксозен двустаен апартамент , находящ се до Медицинска академив.  Апарта ...",800.0,EUR,True,наем,двустаен,град София,Медицинска академия,0892514953,,,https://www.imoti.com/obiava/44813392/dava-pod-naem-2-staen-grad-sofiya-meditsinska-akademiya,0,2026-01-24 06:07:06.794063,,imoticom,0,,,,60 кв.м,
Дава под наем  2-стаен,,800.0,EUR,True,наем,двустаен,град София,Медицинска академия,0894342044,,,https://www.imoti.com/obiava/83298555/dava-pod-naem-2-staen-grad-sofiya-meditsinska-akademiya,0,2026-01-24 06:07:06.794415,,imoticom,0,,,,60 кв.м,
Дава под наем  2-стаен,"2-ри ет., Прекрасен апартамент с една спалня на пешеходно разстояние от Медицинска Академия, градски транспорт ...",800.0,EUR,True,наем,двустаен,град София,Медицинска академия,089521-21-21,,,https://www.imoti.com/obiava/28115096/dava-pod-naem-2-staen-grad-sofiya-meditsinska-akademiya,0,2026-01-24 06:07:06.794780,,imoticom,0,,,,70 кв.м,
Дава под наем  2-стаен,"1-ви ет., Агенция за недвижими имоти Калиста Естейт има огромното удоволствие да Ви представи двустаен апартам ...",849.0,EUR,True,наем,двустаен,град София,Медицинска академия,0884765100,,,https://www.imoti.com/obiava/58345873/dava-pod-naem-2-staen-grad-sofiya-meditsinska-akademiya,0,2026-01-24 06:07:06.795127,,imoticom,0,,,,70 кв.м,
Дава под наем  2-стаен,"1-ви ет., 📌 Референтен номер: 2208171❗ Революшън Естейт представя Двустаен в София, Медицинска  ...",850.0,EUR,True,наем,двустаен,град София,Медицинска академия,0899500900,,,https://www.imoti.com/obiava/61341033/dava-pod-naem-2-staen-grad-sofiya-meditsinska-akademiya,0,2026-01-24 06:07:06.795476,,imoticom,0,,,,70 кв.м,
Дава под наем  2-стаен,"1-ви ет., LUXIMMO FINEST ESTATES: www.luximmo.bgПредставяме Ви уютен и светъл двустаен апартамент под наем, с  ...",850.0,EUR,True,наем,двустаен,град София,Медицинска академия,0884603738,,,https://www.imoti.com/obiava/30607587/dava-pod-naem-2-staen-grad-sofiya-meditsinska-akademiya,0,2026-01-24 06:07:06.795839,,imoticom,0,,,,70 кв.м,
Дава под наем  2-стаен,"6-ти ет., ТЕЦ, Предлагаме на Вашето внимание изцяло обзаведен двустаен апартамент след ремонт, находящ се на ул. Як ...",900.0,EUR,True,наем,двустаен,град София,Медицинска академия,0886 08 32 33,,,https://www.imoti.com/obiava/55513512/dava-pod-naem-2-staen-grad-sofiya-meditsinska-akademiya,0,2026-01-24 06:07:06.796187,,imoticom,0,,,,72 кв.м,
Дава под наем  2-стаен,,900.0,EUR,True,наем,двустаен,град София,Медицинска академия,0888660255,,,https://www.imoti.com/obiava/29643315/dava-pod-naem-2-staen-grad-sofiya-meditsinska-akademiya,0,2026-01-24 06:07:06.796549,,imoticom,0,,,,80 кв.м,
Дава под наем  2-стаен,"6-ти ет., ТЕЦ, Предлагаме на Вашето внимание обзаведен двустаен в Хиподрума.Жилището се намира е в близост до Медиц ...",900.0,EUR,True,наем,двустаен,град София,Медицинска академия,0888807672,,,https://www.imoti.com/obiava/68527664/dava-pod-naem-2-staen-grad-sofiya-meditsinska-akademiya,0,2026-01-24 06:07:06.796905,,imoticom,0,,,,83 кв.м,
Дава под наем  2-стаен,"2-ри ет., Galardo Real Estate представя на Вашето внимание луксозен двустаен апартамент в района НДК и Медицин ...",950.0,EUR,True,наем,двустаен,град София,Медицинска академия,028212121,,,https://www.imoti.com/obiava/46322604/dava-pod-naem-2-staen-grad-sofiya-meditsinska-akademiya,0,2026-01-24 06:07:06.797250,,imoticom,0,,,,85 кв.м,
Дава под наем  2-стаен,"1-ви ет., ТЕЦ, Напълно обзаведен, основно ремонтиран тристаен апартамент на ул. Виктор Григорович, в близост до ул. ...",980.0,EUR,True,наем,двустаен,град София,Медицинска академия,0879430685,,,https://www.imoti.com/obiava/24965564/dava-pod-naem-2-staen-grad-sofiya-meditsinska-akademiya,0,2026-01-24 06:07:06.797610,,imoticom,0,,,,94 кв.м,
Дава под наем  2-стаен,"1-ви ет., Galiano Estates ви представя луксозен двустаен апартамент, разположен в една от най-престижните и тъ ...",990.0,EUR,True,наем,двустаен,град София,Медицинска академия,0899980170,,,https://www.imoti.com/obiava/92183551/dava-pod-naem-2-staen-grad-sofiya-meditsinska-akademiya,0,2026-01-24 06:07:06.797956,,imoticom,0,,,,85 кв.м,
Дава под наем  2-стаен,"1-ви ет., Galardo Real Estate представя на Вашето внимание луксозен двустаен апартамент в района НДК и Медицин ...",990.0,EUR,True,наем,двустаен,град София,Медицинска академия,028212121,,,https://www.imoti.com/obiava/74355080/dava-pod-naem-2-staen-grad-sofiya-meditsinska-akademiya,0,2026-01-24 06:07:06.798299,,imoticom,0,,,,85 кв.м,
Дава под наем  2-стаен,"2-ри ет., ТЕЦ, Отдава се под наем НОВ страхотен просторен апартамент -94м2в жк.Хиподрума. Жилището е бутиково, мног ...",1000.0,EUR,True,наем,двустаен,град София,Медицинска академия,0888660255,,,https://www.imoti.com/obiava/77372916/dava-pod-naem-2-staen-grad-sofiya-meditsinska-akademiya,0,2026-01-24 06:07:06.798658,,imoticom,0,,,,100 кв.м,
