raw_title,raw_description,price,currency,without_dds,offer_type,property_type,city,neighborhood,contact_info,agency,agency_url,details_url,num_photos,date_time_added,search_url,site,total_offers,date,ref_no,time,price_per_m2,area,floor
"продава Двустаен апартамент, 62 м2","Представяме ви затворен комплекс в престижния квартал Оборище, на метри от парк ""Заимов"". Архитектурният проект предлага за продажба 277 двустайни, тристайни, четиристайни, многостайни апартаменти...",212770.0,EUR,False,продава,двустаен,София, Оборище,,Luximmo Finest Estates,,https://www.imoti.net/bg/obiava/prodava--v-stroej/sofia/oborishte/dvustaen/5719192/?sid=gFM8jD&page=3,14.0,2025-04-29 18:02:41.533301,https://www.imoti.net/bg/obiavi/r/prodava/sofia/?page=1&sid=gFM8jD,imoti.net,320,2025-04-29,,,Цена на /м2/:3 432EUR, 62 м2,Етаж:  от 14
"продава Двустаен апартамент, 65 м2","Без комисионна! Цена на инвеститор! Ера Младост представя взискателен жилищен комплекс с Централна локация продиктувана от няколко ключови изисквания за проекта:Градски силует, постигнат...",212770.0,EUR,False,продава,двустаен,София, Оборище,,ERA Младост,,https://www.imoti.net/bg/obiava/prodava--v-stroej/sofia/oborishte/dvustaen/5847979/?sid=gFM8jD&page=3,7.0,2025-04-29 18:02:41.533731,https://www.imoti.net/bg/obiavi/r/prodava/sofia/?page=1&sid=gFM8jD,imoti.net,320,2025-04-29,,,Цена на /м2/:3 273EUR, 65 м2,Етаж: 14 от 14
"продава Тристаен апартамент, 108 м2","Представяме тристаен апартамент за продажба в нова сграда с модерна визия в кв. ""Сухата река"", гр. София.Имотът е разположен на 3-ти етаж и предлага 108.49 кв.м, разпределена в антре,...",213340.0,EUR,False,продава,тристаен,София, Суха Река,,Luximmo Finest Estates,,https://www.imoti.net/bg/obiava/prodava--v-stroej/sofia/suha-reka/tristaen/5710105/?sid=gFM8jD&page=3,2.0,2025-04-29 18:02:41.534248,https://www.imoti.net/bg/obiavi/r/prodava/sofia/?page=1&sid=gFM8jD,imoti.net,320,2025-04-29,,,Цена на /м2/:1 975EUR, 108 м2,Етаж:  от 9
"продава Тристаен апартамент, 107 м2","БЕЗ КОМИСИОННА!!! Galiano Estates има удоволствието да ви представи функционален тристаен апартамент в модерна жилищна сграда - кв. ""Подуяне"". Централното, но същевременно тихо и спокойно...",213340.0,EUR,False,продава,тристаен,София, Подуене,,Galiano Estates,,https://www.imoti.net/bg/obiava/prodava--v-stroej/sofia/poduene/tristaen/6044091/?sid=gFM8jD&page=3,5.0,2025-04-29 18:02:41.534726,https://www.imoti.net/bg/obiavi/r/prodava/sofia/?page=1&sid=gFM8jD,imoti.net,320,2025-04-29,,,Цена на /м2/:1 994EUR, 107 м2,Етаж: 8 от 9
"продава Тристаен апартамент, 107 м2","БЕЗ КОМИСИОННА!!! Galiano Estates има удоволствието да ви представи отличен тристаен апартамент в модерна жилищна сграда – кв. Подуяне. Централното, но същевременно тихо и спокойно местоположение...",213340.0,EUR,False,продава,тристаен,София, Подуене,,Galiano Estates,,https://www.imoti.net/bg/obiava/prodava--v-stroej/sofia/poduene/tristaen/6044118/?sid=gFM8jD&page=3,5.0,2025-04-29 18:02:41.535218,https://www.imoti.net/bg/obiavi/r/prodava/sofia/?page=1&sid=gFM8jD,imoti.net,320,2025-04-29,,,Цена на /м2/:1 994EUR, 107 м2,Етаж: 5 от 9
"продава Тристаен апартамент, 70 м2","New Estates представя тристаен апартамент в новострояща се жилищна сграда, която се намира на едно от най-комуникативните места в София.Централното, но същевременно тихо и спокойно...",213340.0,EUR,False,продава,тристаен,София, Подуене,,New Estates,,https://www.imoti.net/bg/obiava/prodava--v-stroej/sofia/poduene/tristaen/6038002/?sid=gFM8jD&page=3,6.0,2025-04-29 18:02:41.535655,https://www.imoti.net/bg/obiavi/r/prodava/sofia/?page=1&sid=gFM8jD,imoti.net,320,2025-04-29,,,Цена на /м2/:3 048EUR, 70 м2,Етаж: 4 от 9
"продава Тристаен апартамент, 107 м2","Титан Пропъртис има удоволствието да Ви представи тристаен апартамент в новострояща се жилищна сграда в кв. Подуяне. В близост са разположени множество спирки на градския транспорт, търговски...",213340.0,EUR,False,продава,тристаен,София, Подуене,,Титан Пропъртис,,https://www.imoti.net/bg/obiava/prodava/sofia/poduene/tristaen/5970940/?sid=gFM8jD&page=3,6.0,2025-04-29 18:02:41.536102,https://www.imoti.net/bg/obiavi/r/prodava/sofia/?page=1&sid=gFM8jD,imoti.net,320,2025-04-29,,,Цена на /м2/:1 994EUR, 107 м2,Етаж: 5 от 9
"продава Тристаен апартамент, 126 м2",БЕЗ КОМИСИОН ЗА КУПУВАЧА!!!АКТ 14!!!ИРИДА НЕДВИЖИМИ ИМОТИ ПРОДАВА тристаен апартамент в новострояща се сграда в Сухата река.Жилището е със застроена площ от 100...,213700.0,EUR,False,продава,тристаен,София, Суха Река,,ИРИДА НЕДВИЖИМИ ИМОТИ,,https://www.imoti.net/bg/obiava/prodava--v-stroej/sofia/suha-reka/tristaen/6048568/?sid=gFM8jD&page=3,7.0,2025-04-29 18:02:41.536663,https://www.imoti.net/bg/obiavi/r/prodava/sofia/?page=1&sid=gFM8jD,imoti.net,320,2025-04-29,,,Цена на /м2/:1 696EUR, 126 м2,Етаж: 3 от 6
"продава Двустаен апартамент, 72 м2","Имоти Сердика 1 продава двустаен апартамент в ж.к. Редута, гр. София. Имотът е с площ от 72кв.м. и се състои от всекидневна с кухня, спалня, баня с тоалетна, балкон към задния двор на кооперацията...",214999.0,EUR,False,продава,двустаен,София, Редута,,Сердика 1,,https://www.imoti.net/bg/obiava/prodava--v-stroej/sofia/reduta/dvustaen/5984561/?sid=gFM8jD&page=3,10.0,2025-04-29 18:02:41.537114,https://www.imoti.net/bg/obiavi/r/prodava/sofia/?page=1&sid=gFM8jD,imoti.net,320,2025-04-29,,,Цена на /м2/:2 986EUR, 72 м2,Етаж: 3 от 5
"продава Двустаен апартамент, 46 м2","ОБЗАВЕДЕН! УЛ. ОБОРИЩЕ! АКТ 16! ГОТОВИ ДОКУМЕНТИ! ЕКСКЛУЗИВЕН! КЛЮЧ В АГЕНЦИЯТА!""Асенов Имоти"" Ви предлага готов за живеене и обзаведен двустаен апартамент на 3-ти от 6 жилищен...",215000.0,EUR,False,продава,двустаен,София, Оборище,,Асенов Имоти,,https://www.imoti.net/bg/obiava/prodava/sofia/oborishte/dvustaen/6053906/?sid=gFM8jD&page=3,12.0,2025-04-29 18:02:41.537544,https://www.imoti.net/bg/obiavi/r/prodava/sofia/?page=1&sid=gFM8jD,imoti.net,320,2025-04-29,,,Цена на /м2/:4 674EUR, 46 м2,Етаж: 3 от 6
"продава Тристаен апартамент, 115 м2","БЕЗ КОМИСИОН ОТ КУПУВАЧА!ИРИДА НЕДВИЖИМИ ИМОТИ Ви предлага за продажба просторен тристаен апартамент, в новострояща се луксозна сграда, строяща се само с най-качествени материали в...",217400.0,EUR,False,продава,тристаен,София, Суха Река,,ИРИДА НЕДВИЖИМИ ИМОТИ,,https://www.imoti.net/bg/obiava/prodava--v-stroej/sofia/suha-reka/tristaen/5936892/?sid=gFM8jD&page=3,5.0,2025-04-29 18:02:41.538039,https://www.imoti.net/bg/obiavi/r/prodava/sofia/?page=1&sid=gFM8jD,imoti.net,320,2025-04-29,,,Цена на /м2/:1 890EUR, 115 м2,Етаж: 5 от 6
"продава Тристаен апартамент, 125 м2","Galiano Estates ви предлага нов тристаен апартамент в жилищна сграда със сутерен, четири надземни и един подпокривен етаж. В сутерена на сградата се помещава подземният гараж, на партера са...",218300.0,EUR,False,продава,тристаен,София, Суха Река,,Galiano Estates,,https://www.imoti.net/bg/obiava/prodava--v-stroej/sofia/suha-reka/tristaen/5976610/?sid=gFM8jD&page=3,2.0,2025-04-29 18:02:41.538519,https://www.imoti.net/bg/obiavi/r/prodava/sofia/?page=1&sid=gFM8jD,imoti.net,320,2025-04-29,,,Цена на /м2/:1 746EUR, 125 м2,Етаж: 5 от 6
"продава Тристаен апартамент, 93 м2","Явлена-Изток продава тристаен апартамент в новострояща се сграда в кв. Редута с площ-93 кв.м. Състоящ  се от: дневна с кухненски бокс и балкон,  две спални от които се излиза на общ балкон , две...",220000.0,EUR,False,продава,тристаен,София, Редута,,Явлена Изток,,https://www.imoti.net/bg/obiava/prodava/sofia/reduta/tristaen/5989884/?sid=gFM8jD&page=3,6.0,2025-04-29 18:02:41.538960,https://www.imoti.net/bg/obiavi/r/prodava/sofia/?page=1&sid=gFM8jD,imoti.net,320,2025-04-29,,,Цена на /м2/:2 366EUR, 93 м2,Етаж: 4 от 7
"продава Тристаен апартамент, 102 м2","Тристаен апартамент 102,15 м2 в ж.к.Сухата река с паркомясто, на 300м от метростанция Хаджи Димитър и бул.Мадрид.  Доказан строител. Oтлична локация!Жилището е със застроена площ...",221450.0,EUR,False,продава,тристаен,София, Суха Река,,Анети,,https://www.imoti.net/bg/obiava/prodava--v-stroej/sofia/suha-reka/tristaen/6003014/?sid=gFM8jD&page=3,5.0,2025-04-29 18:02:41.539389,https://www.imoti.net/bg/obiavi/r/prodava/sofia/?page=1&sid=gFM8jD,imoti.net,320,2025-04-29,,,Цена на /м2/:2 171EUR, 102 м2,Етаж: 6 от 8
"продава Тристаен апартамент, 111 м2","Тристаен апартамент в новострояща се сграда “А” в кв.""Суха река"". Просторен и светъл апартамент с площ 111.20кв.м, сътоящ се от дневна с кухненски бокс,...",222400.0,EUR,False,продава,тристаен,София, Суха Река,,АДРЕС Недвижими имоти АД,,https://www.imoti.net/bg/obiava/prodava/sofia/suha-reka/tristaen/6065596/?sid=gFM8jD&page=3,4.0,2025-04-29 18:02:41.539829,https://www.imoti.net/bg/obiavi/r/prodava/sofia/?page=1&sid=gFM8jD,imoti.net,320,2025-04-29,,,Цена на /м2/:2 004EUR, 111 м2,Етаж: 6 от 9
"продава Тристаен апартамент, 124 м2",БЕЗ КОМИСИОН ЗА КУПУВАЧА!!!АКТ 14!!!ИРИДА НЕДВИЖИМИ ИМОТИ ПРОДАВА тристаен апартамент в новострояща се сграда в Сухата река.Жилището е със застроена площ от 97...,222900.0,EUR,False,продава,тристаен,София, Суха Река,,ИРИДА НЕДВИЖИМИ ИМОТИ,,https://www.imoti.net/bg/obiava/prodava--v-stroej/sofia/suha-reka/tristaen/6057715/?sid=gFM8jD&page=3,1.0,2025-04-29 18:02:41.540326,https://www.imoti.net/bg/obiavi/r/prodava/sofia/?page=1&sid=gFM8jD,imoti.net,320,2025-04-29,,,Цена на /м2/:1 798EUR, 124 м2,Етаж: 5 от 6
"продава Тристаен апартамент, 124 м2",КЛИЕНТИТЕ НА MARTIN'S СА ПО-ДОВОЛНИ! ПОПИТАЙ ЗАЩО!Предлагаме тристаен апартамент с обща площ от 124.42 кв.м. в сграда ново строителство. Имотът е ситуиран на втори етаж в сграда с общо 9...,223956.0,EUR,False,продава,тристаен,София, Суха Река,,MARTIN’S,,https://www.imoti.net/bg/obiava/prodava--v-stroej/sofia/suha-reka/tristaen/5970848/?sid=gFM8jD&page=3,3.0,2025-04-29 18:02:41.540757,https://www.imoti.net/bg/obiavi/r/prodava/sofia/?page=1&sid=gFM8jD,imoti.net,320,2025-04-29,,,Цена на /м2/:1 806EUR, 124 м2,Етаж: 2 от 9
"продава Тристаен апартамент, 125 м2",БЕЗ КОМИСИОН ЗА КУПУВАЧА!!!АКТ 14!!!ИРИДА НЕДВИЖИМИ ИМОТИ ПРОДАВА тристаен апартамент в новострояща се сграда в Сухата река.Жилището е със застроена площ от 99...,224600.0,EUR,False,продава,тристаен,София, Суха Река,,ИРИДА НЕДВИЖИМИ ИМОТИ,,https://www.imoti.net/bg/obiava/prodava--v-stroej/sofia/suha-reka/tristaen/6057716/?sid=gFM8jD&page=3,2.0,2025-04-29 18:02:41.541270,https://www.imoti.net/bg/obiavi/r/prodava/sofia/?page=1&sid=gFM8jD,imoti.net,320,2025-04-29,,,Цена на /м2/:1 797EUR, 125 м2,Етаж: 5 от 6
"продава Тристаен апартамент, 125 м2","Жилища с отлично функционално и пространстено решение, наличие на складови и гаражни пространства, богато решени общи части с контрол на достъпа. Монолитно изпълнение с тухла,окачени фасади,висок...",225000.0,EUR,False,продава,тристаен,София, Суха Река,,АДРЕС Недвижими имоти АД,,https://www.imoti.net/bg/obiava/prodava/sofia/suha-reka/tristaen/6065213/?sid=gFM8jD&page=3,2.0,2025-04-29 18:02:41.541689,https://www.imoti.net/bg/obiavi/r/prodava/sofia/?page=1&sid=gFM8jD,imoti.net,320,2025-04-29,,,Цена на /м2/:1 800EUR, 125 м2,Етаж: 5 от 6
"продава Тристаен апартамент, 125 м2",КЛИЕНТИТЕ НА MARTIN'S СА ПО-ДОВОЛНИ! ПОПИТАЙ ЗАЩО!Предлагаме тристаен апартамент с обща площ от 125.19 кв.м. в сграда ново строителство. Имотът е ситуиран на трети етаж в сграда с общо 9...,225342.0,EUR,False,продава,тристаен,София, Суха Река,,MARTIN’S,,https://www.imoti.net/bg/obiava/prodava--v-stroej/sofia/suha-reka/tristaen/5970849/?sid=gFM8jD&page=3,3.0,2025-04-29 18:02:41.542142,https://www.imoti.net/bg/obiavi/r/prodava/sofia/?page=1&sid=gFM8jD,imoti.net,320,2025-04-29,,,Цена на /м2/:1 803EUR, 125 м2,Етаж: 3 от 9
"продава Тристаен апартамент, 90 м2","Представяме Ви тристаен апартамент в малка бутикова сграда в кв. ""Оборище"", гр. София.Предварителни продажби. Очаква се Разрешение за строеж. Срок за изпълнение - 18 месеца.",226325.0,EUR,False,продава,тристаен,София, Оборище,,Luximmo Finest Estates,,https://www.imoti.net/bg/obiava/prodava--v-stroej/sofia/oborishte/tristaen/5579510/?sid=gFM8jD&page=3,3.0,2025-04-29 18:02:41.542631,https://www.imoti.net/bg/obiavi/r/prodava/sofia/?page=1&sid=gFM8jD,imoti.net,320,2025-04-29,,,Цена на /м2/:2 515EUR, 90 м2,Етаж:  от 6
"продава Тристаен апартамент, 126 м2",БЕЗ КОМИСИОН ЗА КУПУВАЧА!!!АКТ 14!!!ИРИДА НЕДВИЖИМИ ИМОТИ ПРОДАВА тристаен апартамент в новострояща се сграда в Сухата река.Жилището е със застроена площ от 100...,226700.0,EUR,False,продава,тристаен,София, Суха Река,,ИРИДА НЕДВИЖИМИ ИМОТИ,,https://www.imoti.net/bg/obiava/prodava--v-stroej/sofia/suha-reka/tristaen/6057714/?sid=gFM8jD&page=3,2.0,2025-04-29 18:02:41.543144,https://www.imoti.net/bg/obiavi/r/prodava/sofia/?page=1&sid=gFM8jD,imoti.net,320,2025-04-29,,,Цена на /м2/:1 799EUR, 126 м2,Етаж: 5 от 6
"продава Двустаен апартамент, 64 м2","БЕЗ КОМИСИОН ОТ КУПУВАЧА!ПРЕД АКТ 14!ИРИДА НЕДВИЖИМИ ИМОТИ Ви предлага за продажба двустаен апартамент, в новострояща се луксозна бутикова сграда в кв. Изгрев!...",226980.0,EUR,False,продава,двустаен,София, Изгрев,,ИРИДА НЕДВИЖИМИ ИМОТИ,,https://www.imoti.net/bg/obiava/prodava--v-stroej/sofia/sofija-izgrev/dvustaen/6038136/?sid=gFM8jD&page=3,1.0,2025-04-29 18:02:41.543639,https://www.imoti.net/bg/obiavi/r/prodava/sofia/?page=1&sid=gFM8jD,imoti.net,320,2025-04-29,,,Цена на /м2/:3 547EUR, 64 м2,Етаж: 2 от 8
"продава Двустаен апартамент, 126 м2","Компания `ЕКС` представя на Вашето внимание тристаен апартамент в жк Сухата река.МЕСТОПОЛОЖЕНИЕ: В близост до спирка на градски транспорт, детска градина, училище, магазини от...",227000.0,EUR,False,продава,двустаен,София, Суха Река,,ЕКС НВД,,https://www.imoti.net/bg/obiava/prodava/sofia/suha-reka/dvustaen/5900074/?sid=gFM8jD&page=3,2.0,2025-04-29 18:02:41.544083,https://www.imoti.net/bg/obiavi/r/prodava/sofia/?page=1&sid=gFM8jD,imoti.net,320,2025-04-29,,,Цена на /м2/:1 802EUR, 126 м2,Етаж: 6 от 6
"продава Тристаен апартамент, 126 м2",Mirador Real Estate има удоволствието да ви представи,227100.0,EUR,False,продава,тристаен,София, Подуене,,МИРАДОР НЕДВИЖИМИ ИМОТИ,,https://www.imoti.net/bg/obiava/prodava/sofia/poduene/tristaen/6067030/?sid=gFM8jD&page=3,6.0,2025-04-29 18:02:41.544506,https://www.imoti.net/bg/obiavi/r/prodava/sofia/?page=1&sid=gFM8jD,imoti.net,320,2025-04-29,,,Цена на /м2/:1 802EUR, 126 м2,Етаж: 3 от 6
"продава Тристаен апартамент, 91 м2","ЕКСКЛУЗИВНО! ЕРА ИДЕА предлага обзаведен апартамент в ж.к. ""Сухата река"". Жилището се намира на 1ви жилищен етаж над гаражи в малка тухлена сграда на пет етажа. Застроената площ на имота е 75...",228000.0,EUR,False,продава,тристаен,София, Суха Река,,Ера Идеа,,https://www.imoti.net/bg/obiava/prodava/sofia/suha-reka/tristaen/6065883/?sid=gFM8jD&page=4,12.0,2025-04-29 18:02:45.680160,https://www.imoti.net/bg/obiavi/r/prodava/sofia/?page=1&sid=gFM8jD,imoti.net,320,2025-04-29,,,Цена на /м2/:2 505EUR, 91 м2,Етаж: 2 от 5
"продава Тристаен апартамент, 107 м2",""" Estate Factory - Фабриката за имоти "" предлага тристаен апартамент на трети етаж в жилищна сграда, на едно от най-комуникативните места, ситуирана в близост до центъра на гр. София. Разполага с...",229136.0,EUR,False,продава,тристаен,София, Подуене,,Естейт Фактори,,https://www.imoti.net/bg/obiava/prodava--v-stroej/sofia/poduene/tristaen/5972356/?sid=gFM8jD&page=4,4.0,2025-04-29 18:02:45.680657,https://www.imoti.net/bg/obiavi/r/prodava/sofia/?page=1&sid=gFM8jD,imoti.net,320,2025-04-29,,,Цена на /м2/:2 141EUR, 107 м2,Етаж: 3 от 9
"продава Двустаен апартамент, 80 м2","АБ ИМОТИ КОНСУЛТ продава двустаен апартамент в сграда с Акт 16 от 2003 г. Намира се на бул. Драган Цанков до КАТ. Метростанция  Г. М. Димитров  е съвсем близо, също близо са и множество други...",230000.0,EUR,False,продава,двустаен,София, Изток,,АБ ИМОТИ КОНСУЛТ,,https://www.imoti.net/bg/obiava/prodava/sofia/sofija-iztok/dvustaen/6058391/?sid=gFM8jD&page=4,12.0,2025-04-29 18:02:45.681119,https://www.imoti.net/bg/obiavi/r/prodava/sofia/?page=1&sid=gFM8jD,imoti.net,320,2025-04-29,,,Цена на /м2/:2 875EUR, 80 м2,Етаж: 6 от 9
"продава Двустаен апартамент, 66 м2",Явлена    Изток    продава    двустаен  апартамент      в    ж.к.    Дианабад  в   нова  тухлена  сграда  от  2013  година находящ  се  на втори  етаж  .    Апартаментът     е    напълно...,233900.0,EUR,False,продава,двустаен,София, Дианабад,,Явлена Изток,,https://www.imoti.net/bg/obiava/prodava/sofia/dianabad/dvustaen/6057637/?sid=gFM8jD&page=4,11.0,2025-04-29 18:02:45.681554,https://www.imoti.net/bg/obiavi/r/prodava/sofia/?page=1&sid=gFM8jD,imoti.net,320,2025-04-29,,,Цена на /м2/:3 544EUR, 66 м2,Етаж: 2 от 8
"продава Тристаен апартамент, 106 м2","iHOME REAL ESTATE предлага 3-стаен апартамент в новострояща се сграда на минути от метростанция Хаджи Димитър.Апартаментът 8 е с площ 106,67 кв.м. и е разположен на 5 от 9 етажа....",234670.0,EUR,False,продава,тристаен,София, Подуене,,iHOME REAL ESTATE,,https://www.imoti.net/bg/obiava/prodava/sofia/poduene/tristaen/5962029/?sid=gFM8jD&page=4,7.0,2025-04-29 18:02:45.682065,https://www.imoti.net/bg/obiavi/r/prodava/sofia/?page=1&sid=gFM8jD,imoti.net,320,2025-04-29,,,Цена на /м2/:2 214EUR, 106 м2,Етаж: 5 от 9
"продава Тристаен апартамент, 107 м2","БЕЗ КОМИСИОН ОТ КУПУВАЧА!ПРЕД АКТ 14!ИРИДА НЕДВИЖИМИ ИМОТИ Ви предлага за продажба тристаен апартамент, в новострояща се сграда в район Подуяне!...",234674.0,EUR,False,продава,тристаен,София, Подуене,,ИРИДА НЕДВИЖИМИ ИМОТИ,,https://www.imoti.net/bg/obiava/prodava--v-stroej/sofia/poduene/tristaen/5943599/?sid=gFM8jD&page=4,4.0,2025-04-29 18:02:45.682564,https://www.imoti.net/bg/obiavi/r/prodava/sofia/?page=1&sid=gFM8jD,imoti.net,320,2025-04-29,,,Цена на /м2/:2 193EUR, 107 м2,Етаж: 5 от 9
"продава Двустаен апартамент, 106 м2","Ера Тера продава двустаен апартамент- А10 с площ 106.67 кв.м., намиращ се на шести жилищен етаж, състоящ се от: дневна, две спални, баня с тоалетна, тоалетна, антре, склад и балкон. Имотът се...",234674.0,EUR,False,продава,двустаен,София, Суха Река,,ERA TERA,,https://www.imoti.net/bg/obiava/prodava--v-stroej/sofia/suha-reka/dvustaen/5725298/?sid=gFM8jD&page=4,2.0,2025-04-29 18:02:45.683012,https://www.imoti.net/bg/obiavi/r/prodava/sofia/?page=1&sid=gFM8jD,imoti.net,320,2025-04-29,,,Цена на /м2/:2 214EUR, 106 м2,Етаж: 6 от 9
"продава Тристаен апартамент, 118 м2","Агенция Явлена ви представя тристаен апартамент за продажба ново строителство, разположено в тих и удобен и комуникативен район. Жилището включва входно антре, просторна дневна с кухненски бокс и...",236000.0,EUR,False,продава,тристаен,София, Дианабад,,Явлена Изток,,https://www.imoti.net/bg/obiava/prodava/sofia/dianabad/tristaen/6050108/?sid=gFM8jD&page=4,8.0,2025-04-29 18:02:45.683445,https://www.imoti.net/bg/obiavi/r/prodava/sofia/?page=1&sid=gFM8jD,imoti.net,320,2025-04-29,,,Цена на /м2/:2 000EUR, 118 м2,Етаж: 2 от 7
