raw_title,raw_description,price,currency,without_dds,offer_type,property_type,city,neighborhood,contact_info,agency,agency_url,details_url,num_photos,date_time_added,search_url,site,total_offers,date,ref_no,time,price_per_m2,area,floor
"продава Тристаен апартамент, 125 м2","БЕЗ КОМИСИОН ОТ КУПУВАЧА!ПРЕД АКТ 14!ИРИДА НЕДВИЖИМИ ИМОТИ Ви предлага за продажба тристаен апартамент, в новострояща се сграда в район Подуяне!...",273724.0,EUR,False,продава,тристаен,София, Подуене,,ИРИДА НЕДВИЖИМИ ИМОТИ,,https://www.imoti.net/bg/obiava/prodava--v-stroej/sofia/poduene/tristaen/5943380/?sid=gFM8jD&page=5,4.0,2025-04-29 18:02:48.673498,https://www.imoti.net/bg/obiavi/r/prodava/sofia/?page=1&sid=gFM8jD,imoti.net,320,2025-04-29,,,Цена на /м2/:2 190EUR, 125 м2,Етаж: 2 от 9
"продава Тристаен апартамент, 98 м2","Явлена-Изток представя тристаен апартамент в квартал Редута, на комуникативно място и добра локация. ПРЕД АКТ 16! В близост до училище и спирки на градски транспорт. Апартамента е непреходен, с...",274000.0,EUR,False,продава,тристаен,София, Редута,,Явлена Изток,,https://www.imoti.net/bg/obiava/prodava/sofia/reduta/tristaen/6031550/?sid=gFM8jD&page=5,8.0,2025-04-29 18:02:48.673969,https://www.imoti.net/bg/obiavi/r/prodava/sofia/?page=1&sid=gFM8jD,imoti.net,320,2025-04-29,,,Цена на /м2/:2 796EUR, 98 м2,Етаж: 1 от 8
"продава Тристаен апартамент, 68 м2","Galiano Estates има удоволствието да ви представи дизайнерски тристаен апартамент, в непосредствена близост до бул. ""Христо Ботев"" и Петте кьошета. Имотът е ситуиран на 2-ри етаж /първи над...",274900.0,EUR,False,продава,тристаен,София, Редута,,Galiano Estates,,https://www.imoti.net/bg/obiava/prodava/sofia/reduta/tristaen/5996740/?sid=gFM8jD&page=5,10.0,2025-04-29 18:02:48.674457,https://www.imoti.net/bg/obiavi/r/prodava/sofia/?page=1&sid=gFM8jD,imoti.net,320,2025-04-29,,,Цена на /м2/:4 043EUR, 68 м2,Етаж: 2 от 6
"продава Тристаен апартамент, 125 м2","iHOME REAL ESTATE предлага 3-стаен апартамент в новострояща се сграда в близост до Парк ""Заимов"", бул. ""Мадрид” и ул. “Черковна"".Апартаментът Б20 е с площ 125,19 кв.м. и е разположен на 5 от...",275400.0,EUR,False,продава,тристаен,София, Подуене,,iHOME REAL ESTATE,,https://www.imoti.net/bg/obiava/prodava/sofia/poduene/tristaen/5962028/?sid=gFM8jD&page=5,10.0,2025-04-29 18:02:48.674964,https://www.imoti.net/bg/obiavi/r/prodava/sofia/?page=1&sid=gFM8jD,imoti.net,320,2025-04-29,,,Цена на /м2/:2 203EUR, 125 м2,Етаж: 5 от 9
"продава Тристаен апартамент, 126 м2","БЕЗ КОМИСИОН ОТ КУПУВАЧА!ПРЕД АКТ 14!ИРИДА НЕДВИЖИМИ ИМОТИ Ви предлага за продажба тристаен апартамент, в новострояща се сграда в район Подуяне!...",275418.0,EUR,False,продава,тристаен,София, Подуене,,ИРИДА НЕДВИЖИМИ ИМОТИ,,https://www.imoti.net/bg/obiava/prodava--v-stroej/sofia/poduene/tristaen/5943604/?sid=gFM8jD&page=5,4.0,2025-04-29 18:02:48.675466,https://www.imoti.net/bg/obiavi/r/prodava/sofia/?page=1&sid=gFM8jD,imoti.net,320,2025-04-29,,,Цена на /м2/:2 186EUR, 126 м2,Етаж: 7 от 9
"продава Тристаен апартамент, 126 м2","БЕЗ КОМИСИОН ОТ КУПУВАЧА!ПРЕД АКТ 14!ИРИДА НЕДВИЖИМИ ИМОТИ Ви предлага за продажба тристаен апартамент, в новострояща се сграда в район Подуяне!...",275418.0,EUR,False,продава,тристаен,София, Подуене,,ИРИДА НЕДВИЖИМИ ИМОТИ,,https://www.imoti.net/bg/obiava/prodava--v-stroej/sofia/poduene/tristaen/5943379/?sid=gFM8jD&page=5,3.0,2025-04-29 18:02:48.675985,https://www.imoti.net/bg/obiavi/r/prodava/sofia/?page=1&sid=gFM8jD,imoti.net,320,2025-04-29,,,Цена на /м2/:2 186EUR, 126 м2,Етаж: 5 от 9
"продава Тристаен апартамент, 125 м2","Ера Тера продава тристаен апартамент - Б20 с площ 125,19  кв.м., намиращ се на пети жилищен етаж, състоящ се от: дневна, две спални, баня с тоалетна, отделна тоалетна, коридор, склад и два балкона....",275418.0,EUR,False,продава,тристаен,София, Суха Река,,ERA TERA,,https://www.imoti.net/bg/obiava/prodava/sofia/suha-reka/tristaen/5724917/?sid=gFM8jD&page=5,2.0,2025-04-29 18:02:48.676423,https://www.imoti.net/bg/obiavi/r/prodava/sofia/?page=1&sid=gFM8jD,imoti.net,320,2025-04-29,,,Цена на /м2/:2 203EUR, 125 м2,Етаж: 5 от 9
"продава Тристаен апартамент, 125 м2","#БЕЗ КОМИСИОН ОТ КУПУВАЧА!Местоположение: кв. Подуяне, СофияЦена: 275 418 евро - цена от инвеститорОписание на имота:ERA Фамилия представя на вашето внимание...",275418.0,EUR,False,продава,тристаен,София, Подуене,,ЕРА Фамилия,,https://www.imoti.net/bg/obiava/prodava--v-stroej/sofia/poduene/tristaen/6057462/?sid=gFM8jD&page=5,3.0,2025-04-29 18:02:48.676883,https://www.imoti.net/bg/obiavi/r/prodava/sofia/?page=1&sid=gFM8jD,imoti.net,320,2025-04-29,,,Цена на /м2/:2 203EUR, 125 м2,Етаж: 6 от 9
"продава Четиристаен апартамент, 140 м2","Без комисионна от Купувача!!!Ара Естейт продава четиристаен апартамент с площ 139.98 кв.м, намиращ се на осми етаж, състоящ се от: дневна, три спални, две бани с тоалетни и два...",279960.0,EUR,False,продава,четиристаен,София, Суха Река,,АРА ЕСТЕЙТ,,https://www.imoti.net/bg/obiava/prodava/sofia/suha-reka/chetiristaen/5976364/?sid=gFM8jD&page=5,2.0,2025-04-29 18:02:48.677330,https://www.imoti.net/bg/obiavi/r/prodava/sofia/?page=1&sid=gFM8jD,imoti.net,320,2025-04-29,,,Цена на /м2/:2 000EUR, 140 м2,Етаж: 8 от 9
"продава Тристаен апартамент, 100 м2","Явлена-Изток представя тристаен апартамент в квартал Редута, на комуникативно място и добра локация. ПРЕД  АКТ 16! В близост до училище и спирки на градски транспорт. Апартамента е непреходен, с...",280000.0,EUR,False,продава,тристаен,София, Редута,,Явлена Изток,,https://www.imoti.net/bg/obiava/prodava/sofia/reduta/tristaen/6031552/?sid=gFM8jD&page=5,8.0,2025-04-29 18:02:48.677758,https://www.imoti.net/bg/obiavi/r/prodava/sofia/?page=1&sid=gFM8jD,imoti.net,320,2025-04-29,,,Цена на /м2/:2 800EUR, 100 м2,Етаж: 2 от 8
"продава Тристаен апартамент, 81 м2","Скала Ди предлага на вниманието Ви ЕКСКЛУЗИВНО!СЛЪНЧЕВ, кокетен апартамент с ОТЛИЧНА ЛОКАЦИЯ- кв.Изток, в непосредствена близост до спирки на градски транспорт.Апартаментът е...",282000.0,EUR,False,продава,тристаен,София, Изток,,Скала Ди недвижими имоти,,https://www.imoti.net/bg/obiava/prodava/sofia/sofija-iztok/tristaen/6048496/?sid=gFM8jD&page=5,7.0,2025-04-29 18:02:48.678289,https://www.imoti.net/bg/obiavi/r/prodava/sofia/?page=1&sid=gFM8jD,imoti.net,320,2025-04-29,,,Цена на /м2/:3 481EUR, 81 м2,Етаж: 8 от 9
"продава Двустаен апартамент, 81 м2","Скала Ди предлага на вниманието Ви ЕКСКЛУЗИВНО!СЛЪНЧЕВ, кокетен апартамент с ОТЛИЧНА ЛОКАЦИЯ- кв.Изток, в непосредствена близост до спирки на градски транспорт.Апартаментът е...",282000.0,EUR,False,продава,двустаен,София, Изток,,Скала Ди недвижими имоти,,https://www.imoti.net/bg/obiava/prodava/sofia/sofija-iztok/dvustaen/6048497/?sid=gFM8jD&page=5,7.0,2025-04-29 18:02:48.678886,https://www.imoti.net/bg/obiavi/r/prodava/sofia/?page=1&sid=gFM8jD,imoti.net,320,2025-04-29,,,Цена на /м2/:3 481EUR, 81 м2,Етаж: 8 от 9
"продава Двустаен апартамент, 76 м2","НЕПРЕХОДЕН и ФУНКЦИОНАЛЕН ГОЛЯМ ДВУСТАЕН АПАРТАМЕНТ /възможност за ПРЕУСТРОЙСТВО в ТРИСТАЕН! в ЦЕНТЪР//кв. ОБОРИЩЕ, до ул. ОБОРИЩЕ на етаж 4НП/под тавани, БЕЗ асансьор, в тухлена сграда ЖСК от 1962...",287500.0,EUR,False,продава,двустаен,София, Оборище,,АЛДЕС ИМОТИ ЕООД,,https://www.imoti.net/bg/obiava/prodava/sofia/oborishte/dvustaen/5987276/?sid=gFM8jD&page=5,18.0,2025-04-29 18:02:48.679322,https://www.imoti.net/bg/obiavi/r/prodava/sofia/?page=1&sid=gFM8jD,imoti.net,320,2025-04-29,,,Цена на /м2/:3 783EUR, 76 м2,Етаж: 5 от 5
"продава Тристаен апартамент, 120 м2",Възможност за покупка чрез кредит!!! Безплатно съдействие за кредит при най добри условия за купувача!!! Нова жилищна сграда с Разрешение за ползване (Акт 16). Отлично местоположение  с  добре...,288000.0,EUR,False,продава,тристаен,София, Подуене,,Дом Консулт,,https://www.imoti.net/bg/obiava/prodava/sofia/poduene/tristaen/6033410/?sid=gFM8jD&page=5,13.0,2025-04-29 18:02:48.679748,https://www.imoti.net/bg/obiavi/r/prodava/sofia/?page=1&sid=gFM8jD,imoti.net,320,2025-04-29,,,Цена на /м2/:2 400EUR, 120 м2,Етаж: 6 от 8
"продава Тристаен апартамент, 120 м2",Възможност за покупка чрез кредит!!! Безплатно съдействие за кредит при най добри условия за купувача!!! Нова жилищна сграда с Разрешение за ползване (Акт 16). Отлично местоположение  с  добре...,288000.0,EUR,False,продава,тристаен,София, Суха Река,,Дом Консулт,,https://www.imoti.net/bg/obiava/prodava/sofia/suha-reka/tristaen/6033415/?sid=gFM8jD&page=5,13.0,2025-04-29 18:02:48.680205,https://www.imoti.net/bg/obiavi/r/prodava/sofia/?page=1&sid=gFM8jD,imoti.net,320,2025-04-29,,,Цена на /м2/:2 400EUR, 120 м2,Етаж: 6 от 8
"продава Тристаен апартамент, 87 м2",Продава се разкошен апартамент община ОборищеИдеален избор за инвестиция с висока възвръщаемост!Aко търсите висока доходност и стабилна възвръщаемост на вашата...,289000.0,EUR,False,продава,тристаен,София, Оборище,,ЕКС НВД,,https://www.imoti.net/bg/obiava/prodava/sofia/oborishte/tristaen/6005805/?sid=gFM8jD&page=5,11.0,2025-04-29 18:02:48.680651,https://www.imoti.net/bg/obiavi/r/prodava/sofia/?page=1&sid=gFM8jD,imoti.net,320,2025-04-29,,,Цена на /м2/:3 322EUR, 87 м2,Етаж: 3 от 3
"продава Тристаен апартамент, 87 м2",Продава се разкошен апартамент община ОборищеИдеален избор за инвестиция с висока възвръщаемост!Aко търсите висока доходност и стабилна възвръщаемост на вашата...,289000.0,EUR,False,продава,тристаен,София, Оборище,,ЕКС НВД,,https://www.imoti.net/bg/obiava/prodava/sofia/oborishte/tristaen/6005808/?sid=gFM8jD&page=5,11.0,2025-04-29 18:02:48.681124,https://www.imoti.net/bg/obiavi/r/prodava/sofia/?page=1&sid=gFM8jD,imoti.net,320,2025-04-29,,,Цена на /м2/:3 322EUR, 87 м2,Етаж: 3 от 3
"продава Тристаен апартамент, 133 м2","HOME REAL ESTATE представя БЕЗ КОМИСИОННА само чрез нас и БЕЗ начисляване на ДДС.С разрешение за ползване - АКТ 16.Сградата е модерна и висококачествена, с два асансьора от...",289000.0,EUR,False,продава,тристаен,София, Подуене,,iHOME REAL ESTATE,,https://www.imoti.net/bg/obiava/prodava/sofia/poduene/tristaen/5982968/?sid=gFM8jD&page=5,13.0,2025-04-29 18:02:48.681620,https://www.imoti.net/bg/obiavi/r/prodava/sofia/?page=1&sid=gFM8jD,imoti.net,320,2025-04-29,,,Цена на /м2/:2 173EUR, 133 м2,Етаж: 5 от 9
"продава Тристаен апартамент, 130 м2","Просторно жилище с дневна над 36 м2, ориентирана на изток към вътрешен двор, с прекрасна гледка, две големи спални. Застроена площ - 101 кв.м. Цената е без ДДС.",291864.0,EUR,False,продава,тристаен,София, Редута,,АДРЕС Недвижими имоти АД,,https://www.imoti.net/bg/obiava/prodava/sofia/reduta/tristaen/6057851/?sid=gFM8jD&page=5,5.0,2025-04-29 18:02:48.682079,https://www.imoti.net/bg/obiavi/r/prodava/sofia/?page=1&sid=gFM8jD,imoti.net,320,2025-04-29,,,Цена на /м2/:2 245EUR, 130 м2,Етаж: 5 от 7
"продава Двустаен апартамент, 77 м2","""Явлена - Изток"" предлага в предпочитания квартал ""Изток"" 2стаен апартамент на ул. ""Атанас Далчев"" в сграда постоена през 2007 г. и е с акт 16 и разрешение за ползване. Площта с общите части е 77...",292500.0,EUR,False,продава,двустаен,София, Изток,,Явлена Изток,,https://www.imoti.net/bg/obiava/prodava/sofia/sofija-iztok/dvustaen/5940768/?sid=gFM8jD&page=6,11.0,2025-04-29 18:02:51.680474,https://www.imoti.net/bg/obiavi/r/prodava/sofia/?page=1&sid=gFM8jD,imoti.net,320,2025-04-29,,,Цена на /м2/:3 799EUR, 77 м2,Етаж: 6 от 7
"продава Двустаен апартамент, 82 м2","Unique estates представя за продажба уютен апартамент с една спалня, разположен в престижния квартал ""Изток"". Имотът се намира в тиха и зелена зона, с лесен достъп до...",292500.0,EUR,False,продава,двустаен,София, Изток,,ЮНИК ЕСТЕЙТС,,https://www.imoti.net/bg/obiava/prodava/sofia/sofija-iztok/dvustaen/5939908/?sid=gFM8jD&page=6,5.0,2025-04-29 18:02:51.680986,https://www.imoti.net/bg/obiavi/r/prodava/sofia/?page=1&sid=gFM8jD,imoti.net,320,2025-04-29,,,Цена на /м2/:3 567EUR, 82 м2,Етаж: 6 от 8
"продава Тристаен апартамент, 108 м2","Имоти ПРЕМИЕР представя на Вашето внимание тристаен апартамент в р-н Оборище!﻿Жилището е ситуирано на етаж 3 от 6 в новострояща се бутикова, тухлена сграда. Изложение ЮГ/СЕВЕР. Обща...",297942.0,EUR,False,продава,тристаен,София, Оборище,,Имоти Премиер,,https://www.imoti.net/bg/obiava/prodava/sofia/oborishte/tristaen/6064378/?sid=gFM8jD&page=6,9.0,2025-04-29 18:02:51.681494,https://www.imoti.net/bg/obiavi/r/prodava/sofia/?page=1&sid=gFM8jD,imoti.net,320,2025-04-29,,,Цена на /м2/:2 759EUR, 108 м2,Етаж: 3 от 6
"продава Тристаен апартамент, 108 м2","Имоти ПРЕМИЕР представя на Вашето внимание тристаен апартамент в р-н Оборище!﻿Жилището е ситуирано на етаж 4 от 6 в новострояща се бутикова, тухлена сграда. Изложение ЮГ/СЕВЕР. Обща...",298411.0,EUR,False,продава,тристаен,София, Оборище,,Имоти Премиер,,https://www.imoti.net/bg/obiava/prodava/sofia/oborishte/tristaen/6064379/?sid=gFM8jD&page=6,9.0,2025-04-29 18:02:51.682028,https://www.imoti.net/bg/obiavi/r/prodava/sofia/?page=1&sid=gFM8jD,imoti.net,320,2025-04-29,,,Цена на /м2/:2 763EUR, 108 м2,Етаж: 4 от 6
"продава Четиристаен апартамент, 122 м2","ERA Младост представя просторен и светъл апартамент с потенциал да бъде преустроен в четиристаен, разположен на комуникативния бул. Мадрид. Имотът е със статут на апартамент и разполага с...",299000.0,EUR,False,продава,четиристаен,София, Оборище,,ERA Младост,,https://www.imoti.net/bg/obiava/prodava/sofia/oborishte/chetiristaen/6043724/?sid=gFM8jD&page=6,12.0,2025-04-29 18:02:51.682467,https://www.imoti.net/bg/obiavi/r/prodava/sofia/?page=1&sid=gFM8jD,imoti.net,320,2025-04-29,,,Цена на /м2/:2 451EUR, 122 м2,Етаж: 7 от 9
"продава Тристаен апартамент, 122 м2","ERA Младост представя просторен и светъл апартамент с потенциал да бъде преустроен в четиристаен, разположен на комуникативния бул. Мадрид. Имотът е със статут на апартамент и разполага с...",299000.0,EUR,False,продава,тристаен,София, Оборище,,ERA Младост,,https://www.imoti.net/bg/obiava/prodava/sofia/oborishte/tristaen/6066801/?sid=gFM8jD&page=6,12.0,2025-04-29 18:02:51.682912,https://www.imoti.net/bg/obiavi/r/prodava/sofia/?page=1&sid=gFM8jD,imoti.net,320,2025-04-29,,,Цена на /м2/:2 451EUR, 122 м2,Етаж: 7 от 9
"продава Четиристаен апартамент, 109 м2","Представяме ви просторен апартамент за продажба, разположен на втория етаж в квартал Дианабад в София, на самата граница с престижния квартал Изток, близо до булевард Драган Цанков, само на 350...",299900.0,EUR,False,продава,четиристаен,София, Дианабад,,SUPRIMMO,,https://www.imoti.net/bg/obiava/prodava--v-stroej/sofia/dianabad/chetiristaen/5931785/?sid=gFM8jD&page=6,12.0,2025-04-29 18:02:51.683349,https://www.imoti.net/bg/obiavi/r/prodava/sofia/?page=1&sid=gFM8jD,imoti.net,320,2025-04-29,,,Цена на /м2/:2 751EUR, 109 м2,Етаж:  от 8
"продава Двустаен апартамент, 87 м2","Представяме Ви изключителен, просторен двустаен апартамент със светли помещения и модерен дизайн, в кв. Редута. Жилището се намира на ул. Велчо Атанасов №8. Към него върви мазе и на отделна цена...",299900.0,EUR,False,продава,двустаен,София, Редута,,Luximmo Finest Estates,,https://www.imoti.net/bg/obiava/prodava--v-stroej/sofia/reduta/dvustaen/6050144/?sid=gFM8jD&page=6,12.0,2025-04-29 18:02:51.683887,https://www.imoti.net/bg/obiavi/r/prodava/sofia/?page=1&sid=gFM8jD,imoti.net,320,2025-04-29,,,Цена на /м2/:3 447EUR, 87 м2,Етаж:  от 5
"продава Тристаен апартамент, 121 м2","Нов тухлен тристаен апартамент в новопостроена жилищна сграда със Срок за Акт 16 - Май  2025г.Комуникативно местоположение, до училище, детска градина и парк.Разпределение: антре - коридор,  дневна...",300700.0,EUR,False,продава,тристаен,София, Редута,,Дом Консулт,,https://www.imoti.net/bg/obiava/prodava/sofia/reduta/tristaen/6039208/?sid=gFM8jD&page=6,4.0,2025-04-29 18:02:51.684347,https://www.imoti.net/bg/obiavi/r/prodava/sofia/?page=1&sid=gFM8jD,imoti.net,320,2025-04-29,,,Цена на /м2/:2 485EUR, 121 м2,Етаж: 6 от 7
"продава Тристаен апартамент, 109 м2","Unique Estates представя на вашето внимание тристаен апартамент в един от най- желаните квартали в София, а именно кв. Редута. Районът е предпочитан поради близостта си с...",304900.0,EUR,False,продава,тристаен,София, Редута,,ЮНИК ЕСТЕЙТС,,https://www.imoti.net/bg/obiava/prodava/sofia/reduta/tristaen/5978799/?sid=gFM8jD&page=6,5.0,2025-04-29 18:02:51.684837,https://www.imoti.net/bg/obiavi/r/prodava/sofia/?page=1&sid=gFM8jD,imoti.net,320,2025-04-29,,,Цена на /м2/:2 797EUR, 109 м2,Етаж: 2 от 5
"продава Двустаен апартамент, 96 м2","Ексклузивно представяме за продажба двустаен апартамент в сграда S-Tower - нов проект с отличителен дизайн, висок клас на изпълнение, комуникативна локация и отлична възможност за инвестиция....",307400.0,EUR,False,продава,двустаен,София, Дианабад,,Luximmo Finest Estates,,https://www.imoti.net/bg/obiava/prodava--v-stroej/sofia/dianabad/dvustaen/6019453/?sid=gFM8jD&page=6,12.0,2025-04-29 18:02:51.685329,https://www.imoti.net/bg/obiavi/r/prodava/sofia/?page=1&sid=gFM8jD,imoti.net,320,2025-04-29,,,Цена на /м2/:3 202EUR, 96 м2,Етаж:  от 15
"продава Тристаен апартамент, 136 м2","Разкошен тристаен апартамент, разположен на трети етаж в модерна сграда, само на 500 метра от мол Сердика, в сърцето на кв. Подуяне. Локацията е отлична – до спирки на трамвай 21 и 22, с бърз...",309700.0,EUR,False,продава,тристаен,София, Суха Река,,АДРЕС Недвижими имоти АД,,https://www.imoti.net/bg/obiava/prodava/sofia/suha-reka/tristaen/6065595/?sid=gFM8jD&page=6,15.0,2025-04-29 18:02:51.685778,https://www.imoti.net/bg/obiavi/r/prodava/sofia/?page=1&sid=gFM8jD,imoti.net,320,2025-04-29,,,Цена на /м2/:2 277EUR, 136 м2,Етаж: 3 от 9
"продава Тристаен апартамент, 88 м2","Представяме просторен имот с потенциал, тристайно жилище за основен ремонт, в престижния столичен район ""Изток"".ЛокацияЛокацията на сградата е в непосредствена близост...",310000.0,EUR,False,продава,тристаен,София, Изток,,SUPRIMMO,,https://www.imoti.net/bg/obiava/prodava--v-stroej/sofia/sofija-iztok/tristaen/6060808/?sid=gFM8jD&page=6,13.0,2025-04-29 18:02:51.686226,https://www.imoti.net/bg/obiavi/r/prodava/sofia/?page=1&sid=gFM8jD,imoti.net,320,2025-04-29,,,Цена на /м2/:3 523EUR, 88 м2,Етаж:  от 8
"продава Двустаен апартамент, 76 м2","РС ЕСТЕЙТС предлага за продажба:Двустаен апартамент с обща площ 76,55 кв.м. в един от най-желаните софийски райони кв. Изгрев.Жилището се намира в знаковата бутикова сграда...",310000.0,EUR,False,продава,двустаен,София, Изгрев,,РС ЕСТЕЙТС,,https://www.imoti.net/bg/obiava/prodava/sofia/sofija-izgrev/dvustaen/6037836/?sid=gFM8jD&page=6,18.0,2025-04-29 18:02:51.686707,https://www.imoti.net/bg/obiavi/r/prodava/sofia/?page=1&sid=gFM8jD,imoti.net,320,2025-04-29,,,Цена на /м2/:4 079EUR, 76 м2,Етаж: 6 от 7
