raw_title,raw_description,price,currency,without_dds,offer_type,property_type,city,neighborhood,contact_info,agency,agency_url,details_url,num_photos,date_time_added,search_url,site,total_offers,date,ref_no,time,price_per_m2,area,floor
"продава Двустаен апартамент, 78 м2","Светъл тристаен апартамент в нова сграда – кв. Подуяне | Югозападен | Близо до метро и магазиниПредлагаме Ви просторен и функционално преустроен апартамент в нова, модерна сграда на тихо, но...",145000.0,EUR,False,продава,двустаен,София, Подуене,,MODERN HOME,,https://www.imoti.net/bg/obiava/prodava/sofia/poduene/dvustaen/6056867/?sid=gFM8jD&page=1,14.0,2025-04-29 18:02:35.326564,https://www.imoti.net/bg/obiavi/r/prodava/sofia/?page=1&sid=gFM8jD,imoti.net,320,2025-04-29,,,Цена на /м2/:1 859EUR, 78 м2,Етаж: 2 от 7
"продава Двустаен апартамент, 64 м2","Открийте мястото, където ще се чувствате у дома от първия момент!Титан Пропъртис с радост предлага на Вашето внимание елегантен двустаен апартамент в кв. Оборище, София. Сградата е...",179424.0,EUR,False,продава,двустаен,София, Оборище,,Титан Пропъртис,,https://www.imoti.net/bg/obiava/prodava/sofia/oborishte/dvustaen/6064453/?sid=gFM8jD&page=1,10.0,2025-04-29 18:02:35.327065,https://www.imoti.net/bg/obiavi/r/prodava/sofia/?page=1&sid=gFM8jD,imoti.net,320,2025-04-29,,,Цена на /м2/:2 804EUR, 64 м2,Етаж: 2 от 6
"продава Двустаен апартамент, 64 м2","Открийте мястото, където ще се чувствате у дома от първия момент!Титан Пропъртис с радост предлага на Вашето внимание елегантен двустаен апартамент в кв. Оборище, София. Сградата е...",179424.0,EUR,False,продава,двустаен,София, Оборище,,Титан Пропъртис,,https://www.imoti.net/bg/obiava/prodava/sofia/oborishte/dvustaen/6064349/?sid=gFM8jD&page=1,10.0,2025-04-29 18:02:35.327496,https://www.imoti.net/bg/obiavi/r/prodava/sofia/?page=1&sid=gFM8jD,imoti.net,320,2025-04-29,,,Цена на /м2/:2 804EUR, 64 м2,Етаж: 4 от 6
"продава Тристаен апартамент, 114 м2","Тристаен апартамент 114,28 м2 в сухата река.БЕЗ КОМИСИОННА. С възможност за покупка на гараж или паркомясто. Доказан строител. Отлично местоположение!Разпределение на помещенията:",217400.0,EUR,False,продава,тристаен,София, Суха Река,,Анети,,https://www.imoti.net/bg/obiava/prodava--v-stroej/sofia/suha-reka/tristaen/6026479/?sid=gFM8jD&page=1,1.0,2025-04-29 18:02:35.327933,https://www.imoti.net/bg/obiavi/r/prodava/sofia/?page=1&sid=gFM8jD,imoti.net,320,2025-04-29,,,Цена на /м2/:1 907EUR, 114 м2,Етаж: 5 от 6
"продава Тристаен апартамент, 120 м2",Тристаен апартамент 120 м2 в кв.Сухата река. БЕЗ КОМИСИОННА. С възможност за покупка на гараж или паркомясто. Доказан строител. Отлично местоположение!Разпределение на...,228700.0,EUR,False,продава,тристаен,София, Суха Река,,Анети,,https://www.imoti.net/bg/obiava/prodava--v-stroej/sofia/suha-reka/tristaen/6043933/?sid=gFM8jD&page=1,2.0,2025-04-29 18:02:35.328357,https://www.imoti.net/bg/obiavi/r/prodava/sofia/?page=1&sid=gFM8jD,imoti.net,320,2025-04-29,,,Цена на /м2/:1 906EUR, 120 м2,Етаж: 6 от 6
"продава Двустаен апартамент, 89 м2","Ексклузивно представяме за продажба двустаен апартамент №4.28 в сграда S-Tower - нов проект с отличителен дизайн, висок клас на изпълнение, комуникативна локация и отлична възможност за инвестиция....",247041.0,EUR,False,продава,двустаен,София, Дианабад,,Luximmo Finest Estates,,https://www.imoti.net/bg/obiava/prodava--v-stroej/sofia/dianabad/dvustaen/6032718/?sid=gFM8jD&page=1,12.0,2025-04-29 18:02:35.328880,https://www.imoti.net/bg/obiavi/r/prodava/sofia/?page=1&sid=gFM8jD,imoti.net,320,2025-04-29,,,Цена на /м2/:2 776EUR, 89 м2,Етаж:  от 15
"продава Тристаен апартамент, 117 м2","Ексклузивно представяме за продажба комфортен тристаен апартамент №7.52 в сграда S-Tower - нов проект с отличителен дизайн, висок клас на изпълнение, комуникативна локация и отлична възможност за...",317620.0,EUR,False,продава,тристаен,София, Дианабад,,Luximmo Finest Estates,,https://www.imoti.net/bg/obiava/prodava--v-stroej/sofia/dianabad/tristaen/6017652/?sid=gFM8jD&page=1,12.0,2025-04-29 18:02:35.329344,https://www.imoti.net/bg/obiavi/r/prodava/sofia/?page=1&sid=gFM8jD,imoti.net,320,2025-04-29,,,Цена на /м2/:2 715EUR, 117 м2,Етаж:  от 15
"продава Тристаен апартамент, 130 м2","Ексклузивно представяме за продажба тристаен апартамент в сграда S-Tower - нов проект с отличителен дизайн, висок клас на изпълнение, комуникативна локация и отлична възможност за инвестиция....",344644.0,EUR,False,продава,тристаен,София, Дианабад,,Luximmo Finest Estates,,https://www.imoti.net/bg/obiava/prodava--v-stroej/sofia/dianabad/tristaen/5805229/?sid=gFM8jD&page=1,12.0,2025-04-29 18:02:35.329824,https://www.imoti.net/bg/obiavi/r/prodava/sofia/?page=1&sid=gFM8jD,imoti.net,320,2025-04-29,,,Цена на /м2/:2 651EUR, 130 м2,Етаж:  от 15
"продава Четиристаен апартамент, 175 м2",First Estates предлага за продажба голямо жилище на две нива в кв. Изток.Намира се на 9-ти и 10-ти етажи в сграда от 2002 г. в близост до метростанция Г.М.Димитров.От входа на...,472500.0,EUR,False,продава,четиристаен,София, Изток,,First Estates,,https://www.imoti.net/bg/obiava/prodava--v-stroej/sofia/sofija-iztok/chetiristaen/6023124/?sid=gFM8jD&page=1,24.0,2025-04-29 18:02:35.330294,https://www.imoti.net/bg/obiavi/r/prodava/sofia/?page=1&sid=gFM8jD,imoti.net,320,2025-04-29,,,Цена на /м2/:2 700EUR, 175 м2,Етаж: 8 от 9
"продава Тристаен апартамент, 160 м2","Фърст естейтс има удоволствието да Ви представи ексклузивно този просторен тристаен апартамент в престижния квартал Изток. Перфектно проектиран за съвременно живеене, този имот предлага комбинация...",650000.0,EUR,False,продава,тристаен,София, Изток,,First Estates,,https://www.imoti.net/bg/obiava/prodava/sofia/sofija-iztok/tristaen/6064746/?sid=gFM8jD&page=1,16.0,2025-04-29 18:02:35.330750,https://www.imoti.net/bg/obiavi/r/prodava/sofia/?page=1&sid=gFM8jD,imoti.net,320,2025-04-29,,,Цена на /м2/:4 063EUR, 160 м2,Етаж: 2 от 5
"продава Двустаен апартамент, 55 м2","Титан Пропъртис - офис Черни връх има удоволствието да Ви представи двустаен апартамент в Оборище. Мястото е комуникативно , в близост е до метростанция Театрална, спирки на градски транспорт,...",120000.0,EUR,False,продава,двустаен,София, Оборище,,Титан пропъртис продажби,,https://www.imoti.net/bg/obiava/prodava/sofia/oborishte/dvustaen/6022943/?sid=gFM8jD&page=1,7.0,2025-04-29 18:02:35.331203,https://www.imoti.net/bg/obiavi/r/prodava/sofia/?page=1&sid=gFM8jD,imoti.net,320,2025-04-29,,,Цена на /м2/:2 182EUR, 55 м2,Етаж: 1 от 4
"продава Тристаен апартамент, 84 м2","Явлена-Изток продава 3-стаен апартамент 84 кв.м. в ж.к. Сухата река. Състоящ се от: дневна, две спални, кухня, баня, тоалетна, мокро помещение, гардеробно и две тераси. Сградата е панел от 1974г....",125000.0,EUR,False,продава,тристаен,София, Суха Река,,Явлена Изток,,https://www.imoti.net/bg/obiava/prodava/sofia/suha-reka/tristaen/5675521/?sid=gFM8jD&page=1,12.0,2025-04-29 18:02:35.331641,https://www.imoti.net/bg/obiavi/r/prodava/sofia/?page=1&sid=gFM8jD,imoti.net,320,2025-04-29,,,Цена на /м2/:1 488EUR, 84 м2,Етаж: 6 от 8
"продава Двустаен апартамент, 47 м2","Нов среден южен партерен имот със статут офис. Сграда с Акт 16 от 2024 г.ТЕЦ.Топ - локация в широк център, непосредствено до ул. Черковна. Сградата е на 200 метра от метростанция, 1040 м....",125000.0,EUR,False,продава,двустаен,София, Суха Река,,Юпитер-8,,https://www.imoti.net/bg/obiava/prodava/sofia/suha-reka/dvustaen/6044312/?sid=gFM8jD&page=1,,2025-04-29 18:02:35.332069,https://www.imoti.net/bg/obiavi/r/prodava/sofia/?page=1&sid=gFM8jD,imoti.net,320,2025-04-29,,,Цена на /м2/:2 660EUR, 47 м2,Етаж: 1 от 9
"продава Двустаен апартамент, 47 м2","Нов среден южен партерен имот със статут офис. Сграда с Акт 16 от 2024 г.ТЕЦ.Топ - локация в широк център, непосредствено до ул. Черковна. Сградата е на 200 метра от метростанция, 1040 м....",125000.0,EUR,False,продава,двустаен,София, Подуене,,Юпитер-8,,https://www.imoti.net/bg/obiava/prodava/sofia/poduene/dvustaen/6044314/?sid=gFM8jD&page=1,,2025-04-29 18:02:35.332485,https://www.imoti.net/bg/obiavi/r/prodava/sofia/?page=1&sid=gFM8jD,imoti.net,320,2025-04-29,,,Цена на /м2/:2 660EUR, 47 м2,Етаж: 1 от 9
"продава Двустаен апартамент, 47 м2","Нов среден южен партерен имот със статут офис. Сграда с Акт 16 от 2024 г.ТЕЦ.Топ - локация в широк център, непосредствено до ул. Черковна. Сградата е на 200 метра от метростанция, 1040 м....",125000.0,EUR,False,продава,двустаен,София, Оборище,,Юпитер-8,,https://www.imoti.net/bg/obiava/prodava/sofia/oborishte/dvustaen/6044316/?sid=gFM8jD&page=1,,2025-04-29 18:02:35.332911,https://www.imoti.net/bg/obiavi/r/prodava/sofia/?page=1&sid=gFM8jD,imoti.net,320,2025-04-29,,,Цена на /м2/:2 660EUR, 47 м2,Етаж: 1 от 9
"продава Двустаен апартамент, 63 м2","Компания `ЕКС` представя на Вашето внимание двустаен апартамент в ж.к. Сухата река.МЕСТОПОЛОЖЕНИЕ: В близост до спирка на градски транспорт, детска градина, училище, магазини от...",125020.0,EUR,False,продава,двустаен,София, Суха Река,,ЕКС НВД,,https://www.imoti.net/bg/obiava/prodava/sofia/suha-reka/dvustaen/6020754/?sid=gFM8jD&page=1,1.0,2025-04-29 18:02:35.333346,https://www.imoti.net/bg/obiavi/r/prodava/sofia/?page=1&sid=gFM8jD,imoti.net,320,2025-04-29,,,Цена на /м2/:1 984EUR, 63 м2,Етаж: 2 от 8
"продава Двустаен апартамент, 66 м2","Представяме двустаен апартамент за продажба в нова сграда в кв. ""Редута"".Сградата е с Акт 16 от 2025 г.Имотът се намира на тиха и спокойна улица, гарантираща комфорта...",135000.0,EUR,False,продава,двустаен,София, Редута,,SUPRIMMO,,https://www.imoti.net/bg/obiava/prodava--v-stroej/sofia/reduta/dvustaen/6002958/?sid=gFM8jD&page=1,2.0,2025-04-29 18:02:35.333798,https://www.imoti.net/bg/obiavi/r/prodava/sofia/?page=1&sid=gFM8jD,imoti.net,320,2025-04-29,,,Цена на /м2/:2 045EUR, 66 м2,Етаж:  от 6
"продава Двустаен апартамент, 77 м2","Компания `ЕКС` представя на Вашето внимание двустаен апартамент в жк Сухата река.МЕСТОПОЛОЖЕНИЕ: В близост до спирка на градски транспорт, детска градина, училище, магазини от...",138726.0,EUR,False,продава,двустаен,София, Суха Река,,ЕКС НВД,,https://www.imoti.net/bg/obiava/prodava/sofia/suha-reka/dvustaen/5899149/?sid=gFM8jD&page=1,2.0,2025-04-29 18:02:35.334237,https://www.imoti.net/bg/obiavi/r/prodava/sofia/?page=1&sid=gFM8jD,imoti.net,320,2025-04-29,,,Цена на /м2/:1 802EUR, 77 м2,Етаж: 4 от 6
"продава Двустаен апартамент, 77 м2","Компания `ЕКС` представя на Вашето внимание двустаен апартамент в жк Сухата река.МЕСТОПОЛОЖЕНИЕ: В близост до спирка на градски транспорт, детска градина, училище, магазини от...",139000.0,EUR,False,продава,двустаен,София, Суха Река,,ЕКС НВД,,https://www.imoti.net/bg/obiava/prodava--v-stroej/sofia/suha-reka/dvustaen/5900575/?sid=gFM8jD&page=1,2.0,2025-04-29 18:02:35.334673,https://www.imoti.net/bg/obiavi/r/prodava/sofia/?page=1&sid=gFM8jD,imoti.net,320,2025-04-29,,,Цена на /м2/:1 805EUR, 77 м2,Етаж: 5 от 6
"продава Двустаен апартамент, 76 м2","Екипът на YOHOME недвижими имоти има удоволствието да ви представи двустаен апартамент в новострояща се сграда пред Акт 15 на минути от бул. ""Мадрид'', театър София и парка Заимов.Имотът е...",152440.0,EUR,False,продава,двустаен,София, Суха Река,,Йохоум,,https://www.imoti.net/bg/obiava/prodava/sofia/suha-reka/dvustaen/6011764/?sid=gFM8jD&page=1,1.0,2025-04-29 18:02:35.335120,https://www.imoti.net/bg/obiavi/r/prodava/sofia/?page=1&sid=gFM8jD,imoti.net,320,2025-04-29,,,Цена на /м2/:2 006EUR, 76 м2,Етаж: 2 от 9
"продава Двустаен апартамент, 76 м2",""" Estate Factory - Фабриката за имоти "" предлага двустаен апартамент на втори етаж в жилищна сграда, на едно от най-комуникативните места, ситуирана в близост до центъра на гр. София. Разполага с...",152440.0,EUR,False,продава,двустаен,София, Подуене,,Естейт Фактори,,https://www.imoti.net/bg/obiava/prodava--v-stroej/sofia/poduene/dvustaen/5972354/?sid=gFM8jD&page=1,4.0,2025-04-29 18:02:35.335551,https://www.imoti.net/bg/obiavi/r/prodava/sofia/?page=1&sid=gFM8jD,imoti.net,320,2025-04-29,,,Цена на /м2/:2 006EUR, 76 м2,Етаж: 2 от 9
"продава Двустаен апартамент, 70 м2","New Estates представя двустаен апартамент в новострояща се жилищна сграда, която се намира на едно от най-комуникативните места в София.Централното, но същевременно тихо и спокойно...",152920.0,EUR,False,продава,двустаен,София, Подуене,,New Estates,,https://www.imoti.net/bg/obiava/prodava--v-stroej/sofia/poduene/dvustaen/6044477/?sid=gFM8jD&page=1,6.0,2025-04-29 18:02:35.336006,https://www.imoti.net/bg/obiavi/r/prodava/sofia/?page=1&sid=gFM8jD,imoti.net,320,2025-04-29,,,Цена на /м2/:2 185EUR, 70 м2,Етаж: 8 от 9
"продава Двустаен апартамент, 76 м2",""" Estate Factory - Фабриката за имоти "" предлага двустаен апартамент на седми етаж в жилищна сграда, на едно от най-комуникативните места, ситуирана в близост до центъра на гр. София. Разполага с...",152920.0,EUR,False,продава,двустаен,София, Подуене,,Естейт Фактори,,https://www.imoti.net/bg/obiava/prodava--v-stroej/sofia/poduene/dvustaen/5972355/?sid=gFM8jD&page=1,4.0,2025-04-29 18:02:35.336446,https://www.imoti.net/bg/obiavi/r/prodava/sofia/?page=1&sid=gFM8jD,imoti.net,320,2025-04-29,,,Цена на /м2/:2 012EUR, 76 м2,Етаж: 7 от 9
"продава Двустаен апартамент, 85 м2","Компания `ЕКС` представя на Вашето внимание двустаен апартамент в жк Сухата река.МЕСТОПОЛОЖЕНИЕ: В близост до спирка на градски транспорт, детска градина, училище, магазини от...",154000.0,EUR,False,продава,двустаен,София, Суха Река,,ЕКС НВД,,https://www.imoti.net/bg/obiava/prodava--v-stroej/sofia/suha-reka/dvustaen/5900550/?sid=gFM8jD&page=1,2.0,2025-04-29 18:02:35.336895,https://www.imoti.net/bg/obiavi/r/prodava/sofia/?page=1&sid=gFM8jD,imoti.net,320,2025-04-29,,,Цена на /м2/:1 812EUR, 85 м2,Етаж: 5 от 6
"продава Двустаен апартамент, 85 м2","Компания `ЕКС` представя на Вашето внимание двустаен апартамент в жк Сухата река.МЕСТОПОЛОЖЕНИЕ: В близост до спирка на градски транспорт, детска градина, училище, магазини от...",154000.0,EUR,False,продава,двустаен,София, Суха Река,,ЕКС НВД,,https://www.imoti.net/bg/obiava/prodava/sofia/suha-reka/dvustaen/5899130/?sid=gFM8jD&page=1,2.0,2025-04-29 18:02:35.337335,https://www.imoti.net/bg/obiavi/r/prodava/sofia/?page=1&sid=gFM8jD,imoti.net,320,2025-04-29,,,Цена на /м2/:1 812EUR, 85 м2,Етаж: 4 от 6
"продава Двустаен апартамент, 136 м2","Просторен двустаен апартамент 136,32 м2, ул.М.Панарет, в близост до метростанция и парк, с възможност за втора спалня. Със самостоятелен вход.Подходящ както за живеене, така и за: офис,...",156000.0,EUR,False,продава,двустаен,София, Суха Река,,Анети,,https://www.imoti.net/bg/obiava/prodava--v-stroej/sofia/suha-reka/dvustaen/5866760/?sid=gFM8jD&page=1,15.0,2025-04-29 18:02:35.337777,https://www.imoti.net/bg/obiavi/r/prodava/sofia/?page=1&sid=gFM8jD,imoti.net,320,2025-04-29,,,Цена на /м2/:1 147EUR, 136 м2,Етаж: 2 от 2
"продава Двустаен апартамент, 88 м2","Компания `ЕКС` представя на Вашето внимание двустаен апартамент в жк Сухата река.МЕСТОПОЛОЖЕНИЕ: В близост до спирка на градски транспорт, детска градина, училище, магазини от...",159000.0,EUR,False,продава,двустаен,София, Суха Река,,ЕКС НВД,,https://www.imoti.net/bg/obiava/prodava/sofia/suha-reka/dvustaen/5899115/?sid=gFM8jD&page=1,2.0,2025-04-29 18:02:35.338219,https://www.imoti.net/bg/obiavi/r/prodava/sofia/?page=1&sid=gFM8jD,imoti.net,320,2025-04-29,,,Цена на /м2/:1 807EUR, 88 м2,Етаж: 4 от 6
"продава Двустаен апартамент, 88 м2","Компания `ЕКС` представя на Вашето внимание двустаен апартамент в жк Сухата река.МЕСТОПОЛОЖЕНИЕ: В близост до спирка на градски транспорт, детска градина, училище, магазини от...",159000.0,EUR,False,продава,двустаен,София, Суха Река,,ЕКС НВД,,https://www.imoti.net/bg/obiava/prodava--v-stroej/sofia/suha-reka/dvustaen/5900502/?sid=gFM8jD&page=1,2.0,2025-04-29 18:02:35.338657,https://www.imoti.net/bg/obiavi/r/prodava/sofia/?page=1&sid=gFM8jD,imoti.net,320,2025-04-29,,,Цена на /м2/:1 807EUR, 88 м2,Етаж: 5 от 6
"продава Двустаен апартамент, 63 м2",Революшън Естейт представя на Вашето внимание двустаен апартамент в сграда С АКТ 16 в ж.к. Сухата река.Локация: намира се в близост до главни булеварди: Владимир Вазов и Ген. Данаил...,163000.0,EUR,False,продава,двустаен,София, Суха Река,,Революшън Естейт България,,https://www.imoti.net/bg/obiava/prodava/sofia/suha-reka/dvustaen/6041050/?sid=gFM8jD&page=1,3.0,2025-04-29 18:02:35.339107,https://www.imoti.net/bg/obiavi/r/prodava/sofia/?page=1&sid=gFM8jD,imoti.net,320,2025-04-29,,,Цена на /м2/:2 587EUR, 63 м2,Етаж: 9 от 9
"продава Тристаен апартамент, 110 м2","достъп от ул. Поп Харитон, на 6м , от улична регулация( самостоятелен вход) . На кота терен ( партер) 75 кв.м., на кота сутерен (-3.00m)-35кв.м. Общо 110кв.м. чиста застроена площ ( без общите...",165000.0,EUR,False,продава,тристаен,София, Редута,,частно лице,,https://www.imoti.net/bg/obiava/prodava/sofia/reduta/tristaen/5648674/?sid=gFM8jD&page=1,6.0,2025-04-29 18:02:35.339538,https://www.imoti.net/bg/obiavi/r/prodava/sofia/?page=1&sid=gFM8jD,imoti.net,320,2025-04-29,,,Цена на /м2/:1 500EUR, 110 м2,Етаж: 1 от 5
"продава Двустаен апартамент, 76 м2","Продавам двустаен апартамент в ЖК Сухата река с площ от 76 кв.м , разположен на втори етаж.Жилището е просторно, функционално, светло и уютно. Намира в малка тухлена сграда на 4 етажа с...",165000.0,EUR,False,продава,двустаен,София, Суха Река,,частно лице,,https://www.imoti.net/bg/obiava/prodava/sofia/suha-reka/dvustaen/6059645/?sid=gFM8jD&page=2,11.0,2025-04-29 18:02:38.576951,https://www.imoti.net/bg/obiavi/r/prodava/sofia/?page=1&sid=gFM8jD,imoti.net,320,2025-04-29,,,Цена на /м2/:2 171EUR, 76 м2,Етаж: 2 от 4
"продава Двустаен апартамент, 76 м2","Слънчев и топъл апартамент в четириетажна тухлена сграда.Районът е чист и спокоен, с прекрасни, добре поддържани тревни площи и безпроблемно паркиране.",165000.0,EUR,False,продава,двустаен,София, Суха Река,,АДРЕС Недвижими имоти АД,,https://www.imoti.net/bg/obiava/prodava/sofia/suha-reka/dvustaen/6056399/?sid=gFM8jD&page=2,14.0,2025-04-29 18:02:38.577450,https://www.imoti.net/bg/obiavi/r/prodava/sofia/?page=1&sid=gFM8jD,imoti.net,320,2025-04-29,,,Цена на /м2/:2 171EUR, 76 м2,Етаж: 2 от 6
"продава Тристаен апартамент, 79 м2","МЕТРО!ТИШИНА!ЕЛЕГАНТНОСТ!ПРЕДПРОДАЖБА!СКОРО ОТНОВО ЩЕ ВДИГНЕМ ЦЕНАТА, ПОБЪРЗАЙТЕ!ВЕЧЕ 60% ОТ ЖИЛИЩАТА СА ЗАКУПЕНИ!Уникален мини...",165821.0,EUR,False,продава,тристаен,София, Суха Река,,Елеганс Естейт,,https://www.imoti.net/bg/obiava/prodava--v-stroej/sofia/suha-reka/tristaen/5986842/?sid=gFM8jD&page=2,4.0,2025-04-29 18:02:38.577931,https://www.imoti.net/bg/obiavi/r/prodava/sofia/?page=1&sid=gFM8jD,imoti.net,320,2025-04-29,,,Цена на /м2/:2 099EUR, 79 м2,Етаж: 7 от 7
