price_text,title,location,description,details_url,num_photos,agency,floor,price_per_m2,area,search_url,scraped_at
126 600€247 608BGN,"продаваДвустаен апартамент,63 м2","София, Суха Река","Двустаен апартамент състоящ се от: антре, дневна с кухненски бокс, спралня, баня с тоалетна и тераса. Към жилището има прилежащо мазе.Има възможност за закупуване на паркомясто.",/bg/obiava/prodava/sofia/suha-reka/dvustaen/6177556/?sid=gFM8jD&page=1,7,продава,Етаж: 2 от 5,Цена на /м2/:2 010EUR/3 930.29BGN,63 м2,https://www.imoti.net/bg/obiavi/r/prodava/sofia/?page=1&sid=gFM8jD,2026-01-21T18:11:46.178123
215 000€420 503BGN,"продаваТристаен апартамент,89 м2","София, Подуене","Нов панорамен тристаен мезонет до пл. Родина в сграда с Акт 16 от 2022 г. Намира се до ул. Черковна, на 200 м. от метростанция Подуяне. Завършен луксозно до ключ. Топ- локация в широк център само...",/bg/obiava/prodava/sofia/poduene/tristaen/6125730/?sid=gFM8jD&page=1,36,продава,Етаж: 8 от 9,Цена на /м2/:2 416EUR/4 724.76BGN,89 м2,https://www.imoti.net/bg/obiavi/r/prodava/sofia/?page=1&sid=gFM8jD,2026-01-21T18:11:46.178900
110 440€216 002BGN,"продаваДвустаен апартамент,58 м2","София, Суха Река","Двустайно жилище състоящо се от: антре, дневна с кухненски бокс, спралня, баня с тоалетна и тераса.Има възможност за закупуване на паркомясто.",/bg/obiava/prodava/sofia/suha-reka/dvustaen/6181839/?sid=gFM8jD&page=1,7,продава,Етаж: 4 от 5,Цена на /м2/:1 904EUR/3 724.17BGN,58 м2,https://www.imoti.net/bg/obiavi/r/prodava/sofia/?page=1&sid=gFM8jD,2026-01-21T18:11:46.179625
115 000€224 920BGN,"продаваДвустаен апартамент,68 м2","София, Суха Река","Предлагаме за продажба двустаен апартамент в малка, бутикова сграда в кв.Сухата река.-Функционално разпределение - антре, просторна дневна с кухненски бокс, спалня, баня с тоалетна,...",/bg/obiava/prodava/sofia/suha-reka/dvustaen/6185297/?sid=gFM8jD&page=1,4,продава,Етаж: 2 от 4,Цена на /м2/:1 691EUR/3 307.65BGN,68 м2,https://www.imoti.net/bg/obiavi/r/prodava/sofia/?page=1&sid=gFM8jD,2026-01-21T18:11:46.180385
115 000€224 920BGN,"продаваДвустаен апартамент,47 м2","София, Суха Река","Нов среден южен партерен имот със статут офис. Сграда с Акт 16 от 2024 г.ТЕЦ.Топ - локация в широк център, непосредствено до ул. Черковна. Сградата е на 200 метра от метростанция, 1040 м....",/bg/obiava/prodava/sofia/suha-reka/dvustaen/6044312/?sid=gFM8jD&page=1,6,продава,Етаж: 1 от 9,Цена на /м2/:2 447EUR/4 785.54BGN,47 м2,https://www.imoti.net/bg/obiavi/r/prodava/sofia/?page=1&sid=gFM8jD,2026-01-21T18:11:46.181078
115 000€224 920BGN,"продаваДвустаен апартамент,47 м2","София, Подуене","Нов среден южен партерен имот със статут офис. Сграда с Акт 16 от 2024 г.ТЕЦ.Топ - локация в широк център, непосредствено до ул. Черковна. Сградата е на 200 метра от метростанция, 1040 м....",/bg/obiava/prodava/sofia/poduene/dvustaen/6044314/?sid=gFM8jD&page=1,16,продава,Етаж: 1 от 9,Цена на /м2/:2 447EUR/4 785.54BGN,47 м2,https://www.imoti.net/bg/obiavi/r/prodava/sofia/?page=1&sid=gFM8jD,2026-01-21T18:11:46.181772
115 000€224 920BGN,"продаваДвустаен апартамент,47 м2","София, Оборище","Нов среден южен партерен имот със статут офис. Сграда с Акт 16 от 2024 г.ТЕЦ.Топ - локация в широк център, непосредствено до ул. Черковна. Сградата е на 200 метра от метростанция, 1040 м....",/bg/obiava/prodava/sofia/oborishte/dvustaen/6044316/?sid=gFM8jD&page=1,9,продава,Етаж: 1 от 9,Цена на /м2/:2 447EUR/4 785.54BGN,47 м2,https://www.imoti.net/bg/obiavi/r/prodava/sofia/?page=1&sid=gFM8jD,2026-01-21T18:11:46.182465
117 100€229 028BGN,"продаваДвустаен апартамент,62 м2","София, Суха Река","Двустайно жилище състоящо се от: антре, дневна с кухненски бокс, баня с тоалетна и тераса.Има възможност за закупуване на паркомясто.",/bg/obiava/prodava/sofia/suha-reka/dvustaen/6181838/?sid=gFM8jD&page=1,6,продава,Етаж: 4 от 5,Цена на /м2/:1 889EUR/3 694.00BGN,62 м2,https://www.imoti.net/bg/obiavi/r/prodava/sofia/?page=1&sid=gFM8jD,2026-01-21T18:11:46.183173
120 000€234 700BGN,"продаваДвустаен апартамент,42 м2","София, Суха Река",Реф. № 0127183D Виртуална разходка из апартамента -> https://my.matterport.com/show/?m=Q72j4CwkyidАгенция за недвижими имоти BAS Properties предлага за продажба двустаен...,/bg/obiava/prodava/sofia/suha-reka/dvustaen/6195170/?sid=gFM8jD&page=1,8,продава,Етаж: 2 от 8,Цена на /м2/:2 857EUR/5 588.09BGN,42 м2,https://www.imoti.net/bg/obiavi/r/prodava/sofia/?page=1&sid=gFM8jD,2026-01-21T18:11:46.183865
125 550€245 554BGN,"продаваДвустаен апартамент,59 м2","София, Суха Река","Двустаен апартамент състоящ се от: антре, дневна с кухненски бокс, спралня, баня с тоалетна и тераса. Към жилището има прилежащо мазе.Има възможност за закупуване на паркомясто.",/bg/obiava/prodava/sofia/suha-reka/dvustaen/6110135/?sid=gFM8jD&page=1,7,продава,Етаж: 2 от 5,Цена на /м2/:2 128EUR/4 161.94BGN,59 м2,https://www.imoti.net/bg/obiavi/r/prodava/sofia/?page=1&sid=gFM8jD,2026-01-21T18:11:46.184569
126 800€247 999BGN,"продаваЧетиристаен апартамент,86 м2","София, Оборище","Имоти Премиер предлага на Вашето внимание имот със статут на апартамент в кв. Оборище.Намира се на полусутерен в тухлена сграда. Състои се от 4 помещения, два санитарни възела и има...",/bg/obiava/prodava/sofia/oborishte/chetiristaen/5885595/?sid=gFM8jD&page=1,11,продава,Етаж: 0 от 5,Цена на /м2/:1 474EUR/2 883.71BGN,86 м2,https://www.imoti.net/bg/obiavi/r/prodava/sofia/?page=1&sid=gFM8jD,2026-01-21T18:11:46.185308
129 000€252 302BGN,"продаваДвустаен апартамент,40 м2","София, Суха Река","Слънчева гарсониера преустроена на двустаен, находяща се на етаж 8. Има следното разпределение: дневна с кухненски бокс, отделна спалня, баня с WC, тераса. Имотът е практичен и функционален,...",/bg/obiava/prodava/sofia/suha-reka/dvustaen/6129514/?sid=gFM8jD&page=1,7,продава,Етаж: 8 от 8,Цена на /м2/:3 225EUR/6 307.55BGN,40 м2,https://www.imoti.net/bg/obiavi/r/prodava/sofia/?page=1&sid=gFM8jD,2026-01-21T18:11:46.185970
130 000€254 258BGN,"продаваДвустаен апартамент,40 м2","София, Суха Река","СВОБОДНО МЯСТО ЗА ПАРКИРАНЕ ! МЕТРОСТАНЦИЯ ! ТЕРАСА ! ГРАДСКИ ТРАНСПОРТПредлагаме едностаен апартамент с площ от 40 кв.м, разположен на 5/8 етаж в поддържана панелна сграда в...",/bg/obiava/prodava/sofia/suha-reka/dvustaen/6176538/?sid=gFM8jD&page=1,6,продава,Етаж: 5 от 8,Цена на /м2/:3 250EUR/6 356.45BGN,40 м2,https://www.imoti.net/bg/obiavi/r/prodava/sofia/?page=1&sid=gFM8jD,2026-01-21T18:11:46.186675
130 000€254 258BGN,"продаваДвустаен апартамент,67 м2","София, Дианабад","Агенция за недвижими имоти Пандора естейт продава ексклузивно.Реф. № 110163.Двустаен апартамент в кв. Дианабад, разположен в престижен район с отлични транспортни връзки....",/bg/obiava/prodava/sofia/dianabad/dvustaen/6014130/?sid=gFM8jD&page=1,5,продава,Етаж: 7 от 8,Цена на /м2/:1 940EUR/3 794.89BGN,67 м2,https://www.imoti.net/bg/obiavi/r/prodava/sofia/?page=1&sid=gFM8jD,2026-01-21T18:11:46.187387
136 000€265 993BGN,"продаваДвустаен апартамент,40 м2","София, Суха Река","BG Broker предлага за продажба ремонтиран и преустроен двустаен апартамент (преустроена гарсониера) в кв. Сухата река, бл. 52, на бул. Ботевградско шосе, срещу 44 СУ „Неофит Бозвели“....",/bg/obiava/prodava/sofia/suha-reka/dvustaen/6164405/?sid=gFM8jD&page=1,13,продава,Етаж: 8 от 8,Цена на /м2/:3 400EUR/6 649.82BGN,40 м2,https://www.imoti.net/bg/obiavi/r/prodava/sofia/?page=1&sid=gFM8jD,2026-01-21T18:11:46.188076
144 900€283 400BGN,"продаваДвустаен апартамент,63 м2","София, Подуене","МЕТРО!ТИШИНА!ЕЛЕГАНТНОСТ!ПРЕДПРОДАЖБА!СКОРО ОТНОВО ЩЕ ВДИГНЕМ ЦЕНАТА, ПОБЪРЗАЙТЕ!ВЕЧЕ 70% ОТ ЖИЛИЩАТА СА ЗАКУПЕНИ!Уникален мини...",/bg/obiava/prodava--v-stroej/sofia/poduene/dvustaen/5982550/?sid=gFM8jD&page=1,4,продава,Етаж: 4 от 6,Цена на /м2/:2 300EUR/4 498.41BGN,63 м2,https://www.imoti.net/bg/obiavi/r/prodava/sofia/?page=1&sid=gFM8jD,2026-01-21T18:11:46.188817
150 000€293 375BGN,"продаваДвустаен апартамент,62 м2","София, Суха Река",Референтен номер: 2098010Революшън Естейт представя Двустаен апартамент в ж.к. Сухата река.- Етаж: 10-ти от 14-ти.- Площ: 62 кв.м.- Разпределение:...,/bg/obiava/prodava/sofia/suha-reka/dvustaen/6168855/?sid=gFM8jD&page=1,4,продава,Етаж: 10 от 14,Цена на /м2/:2 419EUR/4 731.85BGN,62 м2,https://www.imoti.net/bg/obiavi/r/prodava/sofia/?page=1&sid=gFM8jD,2026-01-21T18:11:46.189546
155 000€303 154BGN,"продаваТристаен апартамент,90 м2","София, Дианабад","Агенция за недвижими имоти Пандора естейт продава ексклузивно.Реф. № 110185.Тристаен апартамент в кв. Дианабад.Цена: 155,000 евро.Площ: 90 кв.м.Етаж: 4 от...",/bg/obiava/prodava/sofia/dianabad/tristaen/6019410/?sid=gFM8jD&page=1,5,продава,Етаж: 4 от 8,Цена на /м2/:1 722EUR/3 368.37BGN,90 м2,https://www.imoti.net/bg/obiavi/r/prodava/sofia/?page=1&sid=gFM8jD,2026-01-21T18:11:46.190262
156 000€305 109BGN,"продаваДвустаен апартамент,62 м2","София, Суха Река","Продаваме непреходен, двустаен апартамент.Жилището се намира на 6-ти етаж от 8, вътрешно е и изключително топло.Изложенията са Югозапад/Североизток, като от всички стаи има...",/bg/obiava/prodava/sofia/suha-reka/dvustaen/6177287/?sid=gFM8jD&page=1,17,продава,Етаж: 6 от 8,Цена на /м2/:2 516EUR/4 921.12BGN,62 м2,https://www.imoti.net/bg/obiavi/r/prodava/sofia/?page=1&sid=gFM8jD,2026-01-21T18:11:46.190941
156 000€305 109BGN,"продаваТристаен апартамент,62 м2","София, Суха Река","Продаваме непреходен, двустаен апартамент.Жилището се намира на 6-ти етаж от 8, вътрешно е и изключително топло.Изложенията са Югозапад/Североизток, като от всички стаи има...",/bg/obiava/prodava/sofia/suha-reka/tristaen/6177290/?sid=gFM8jD&page=1,17,продава,Етаж: 6 от 8,Цена на /м2/:2 516EUR/4 921.12BGN,62 м2,https://www.imoti.net/bg/obiavi/r/prodava/sofia/?page=1&sid=gFM8jD,2026-01-21T18:11:46.191637
159 000€310 977BGN,"продаваДвустаен апартамент,28 м2","София, Изток","Открийте мястото, където ще се чувствате у дома от първия момент.Титан Пропъртис офис - Черни връх с радост предлага на Вашето внимание двустаен апартамент за продажба в ж.к. Изток....",/bg/obiava/prodava/sofia/sofija-iztok/dvustaen/6199113/?sid=gFM8jD&page=1,8,продава,Етаж: 1 от 4,Цена на /м2/:5 679EUR/11 106.32BGN,28 м2,https://www.imoti.net/bg/obiavi/r/prodava/sofia/?page=1&sid=gFM8jD,2026-01-21T18:11:46.192336
160 000€312 933BGN,"продаваДвустаен апартамент,53 м2","София, Суха Река","Mirador Real Estates има удоволствието да ви представи компактен Двустаен Апартамент в кв. Сура река ул. Тодорини кукли.Жилището е светло, топло, обзаведено и готово за нанасяне....",/bg/obiava/prodava/sofia/suha-reka/dvustaen/6152540/?sid=gFM8jD&page=1,6,продава,Етаж: 5 от 8,Цена на /м2/:3 019EUR/5 904.39BGN,53 м2,https://www.imoti.net/bg/obiavi/r/prodava/sofia/?page=1&sid=gFM8jD,2026-01-21T18:11:46.193024
160 000€312 933BGN,"продаваДвустаен апартамент,59 м2","София, Суха Река","ARCO REAL ESTATE предлага двустаен апартамент със застроена площ 51 кв.м., северозападно изложенив, в луксозна жилищна сграда на десет етажа в кв. Сухата река, на пет минути пешеходно разстояние от...",/bg/obiava/prodava/sofia/suha-reka/dvustaen/6195584/?sid=gFM8jD&page=1,5,продава,Етаж: 8 от 11,Цена на /м2/:2 712EUR/5 303.95BGN,59 м2,https://www.imoti.net/bg/obiavi/r/prodava/sofia/?page=1&sid=gFM8jD,2026-01-21T18:11:46.193753
163 000€318 800BGN,"продаваТристаен апартамент,67 м2","София, Суха Река","Предлагаме просторен тристаен апартамент с отлична локация – в непосредствена близост до парк „Герена“, пазар „Герена“, спирки на градски транспорт, училища, детска градина, супермаркет и...",/bg/obiava/prodava/sofia/suha-reka/tristaen/6192490/?sid=gFM8jD&page=1,7,продава,Етаж: 4 от 8,Цена на /м2/:2 433EUR/4 758.21BGN,67 м2,https://www.imoti.net/bg/obiavi/r/prodava/sofia/?page=1&sid=gFM8jD,2026-01-21T18:11:46.194431
165 000€322 712BGN,"продаваДвустаен апартамент,68 м2","София, Подуене","Цена на инвеститор – 165 000 евро!!! БЕЗ КОМИСИОННА!!! Galiano Estates има удоволствието да ви представи слънчев двустаен апартамент в луксозна жилищна сграда, в кв. Подуяне, в близост до моста...",/bg/obiava/prodava/sofia/poduene/dvustaen/6139726/?sid=gFM8jD&page=1,5,продава,Етаж: 6 от 9,Цена на /м2/:2 426EUR/4 745.76BGN,68 м2,https://www.imoti.net/bg/obiavi/r/prodava/sofia/?page=1&sid=gFM8jD,2026-01-21T18:11:46.195161
165 000€322 712BGN,"продаваТристаен апартамент,110 м2","София, Редута","Титан Пропъртис - офис Хиподрума с радост предлага на Вашето внимание тристаен апартамент в продажба в кв. Редута, София. Обща площ 110 кв.м. и функционално разпределение в нова четириетажна...",/bg/obiava/prodava/sofia/reduta/tristaen/6158513/?sid=gFM8jD&page=1,3,продава,Етаж: 1 от 4,Цена на /м2/:1 500EUR/2 933.75BGN,110 м2,https://www.imoti.net/bg/obiavi/r/prodava/sofia/?page=1&sid=gFM8jD,2026-01-21T18:11:46.195824
165 000€322 712BGN,"продаваТристаен апартамент,110 м2","София, Редута","Имоти Премиер представя уютен тристаен апартамент с отлична локация в кв. Редута, гр. София.С удоволствие ви запознаваме с този прекрасен имот, разположен в един от най-търсените и...",/bg/obiava/prodava/sofia/reduta/tristaen/6076138/?sid=gFM8jD&page=1,5,продава,Етаж: 0 от 5,Цена на /м2/:1 500EUR/2 933.75BGN,110 м2,https://www.imoti.net/bg/obiavi/r/prodava/sofia/?page=1&sid=gFM8jD,2026-01-21T18:11:46.196576
167 000€326 624BGN,"продаваДвустаен апартамент,68 м2","София, Суха Река","Просторен двустаен апартамент, състои се от: коридор, хол, кухня,  спалня, два балкона, баня с тоалетна. Площ от 68 кв.м. с възможност да се преустрой в съвременен тристаен...",/bg/obiava/prodava/sofia/suha-reka/dvustaen/6170735/?sid=gFM8jD&page=1,12,продава,Етаж: 8 от 8,Цена на /м2/:2 456EUR/4 803.29BGN,68 м2,https://www.imoti.net/bg/obiavi/r/prodava/sofia/?page=1&sid=gFM8jD,2026-01-21T18:11:46.197253
169 000€330 535BGN,"продаваДвустаен апартамент,61 м2","София, Суха Река","Слънчев и топъл апартамент в четириетажна тухлена сграда.Районът е чист и спокоен, с прекрасни, добре поддържани тревни площи и безпроблемно паркиране.",/bg/obiava/prodava/sofia/suha-reka/dvustaen/6056399/?sid=gFM8jD&page=1,13,продава,Етаж: 2 от 4,Цена на /м2/:2 770EUR/5 418.61BGN,61 м2,https://www.imoti.net/bg/obiavi/r/prodava/sofia/?page=1&sid=gFM8jD,2026-01-21T18:11:46.197937
170 000€332 491BGN,"продаваДвустаен апартамент,58 м2","София, Суха Река",Агенция за недвижими имоти 'Имотен център България' предлага за продажба двустаен апартамент в кв. 'Сухата река'.Сградата е санирана и се намира на бул. 'Ботевградско шосе' в близост до...,/bg/obiava/prodava/sofia/suha-reka/dvustaen/6174730/?sid=gFM8jD&page=1,12,продава,Етаж: 1 от 8,Цена на /м2/:2 931EUR/5 732.61BGN,58 м2,https://www.imoti.net/bg/obiavi/r/prodava/sofia/?page=1&sid=gFM8jD,2026-01-21T18:11:46.198664
170 000€332 491BGN,"продаваДвустаен апартамент,60 м2","София, Суха Река","Предлагаме за продажба просторен и светъл двустаен апартамент, разположен в един от най-предпочитаните и комуникативни райони на София – ж.к. „Сухата река“. Жилището се отличава с функционално...",/bg/obiava/prodava--v-stroej/sofia/suha-reka/dvustaen/6172856/?sid=gFM8jD&page=2,10,продава,Етаж:  от 7,Цена на /м2/:2 833EUR/5 541.52BGN,60 м2,https://www.imoti.net/bg/obiavi/r/prodava/sofia/?page=1&sid=gFM8jD,2026-01-21T18:11:50.512119
170 000€332 491BGN,"продаваДвустаен апартамент,58 м2","София, Подуене",Агенция за недвижими имоти 'Имотен център България' предлага за продажба двустаен апартамент в кв. 'Сухата река'.Сградата е санирана и се намира на бул. 'Ботевградско шосе' в близост до...,/bg/obiava/prodava/sofia/poduene/dvustaen/6175196/?sid=gFM8jD&page=2,12,продава,Етаж: 1 от 8,Цена на /м2/:2 931EUR/5 732.61BGN,58 м2,https://www.imoti.net/bg/obiavi/r/prodava/sofia/?page=1&sid=gFM8jD,2026-01-21T18:11:50.512871
171 000€334 447BGN,"продаваДвустаен апартамент,58 м2","София, Суха Река","Продаваме слънчев, двустаен апартамент.Жилището е с южно изложение, което е допълнение с голямото отстояние от близките сгради го прави изключително светло и топло.Сградата е с...",/bg/obiava/prodava/sofia/suha-reka/dvustaen/6191798/?sid=gFM8jD&page=2,15,продава,Етаж: 2 от 8,Цена на /м2/:2 948EUR/5 766.33BGN,58 м2,https://www.imoti.net/bg/obiavi/r/prodava/sofia/?page=1&sid=gFM8jD,2026-01-21T18:11:50.513602
173 000€338 359BGN,"продаваДвустаен апартамент,60 м2","София, Подуене",.  .  .  .  .  .  .  .  .  .  .  .  .  .  .  .  .  .  .  .  .  .  .  .  .  .  .  .  .  .  ПРОДАВАМЕ  .  .  .  .  .  .  .  .  .  .  .  .  .  .  .  .  .  .  .  .  .  .  .  .  .  .  .  .  .  ....,/bg/obiava/prodava/sofia/poduene/dvustaen/6098100/?sid=gFM8jD&page=2,1,продава,Етаж: 2 от 6,Цена на /м2/:2 883EUR/5 639.31BGN,60 м2,https://www.imoti.net/bg/obiavi/r/prodava/sofia/?page=1&sid=gFM8jD,2026-01-21T18:11:50.514304
173 000€338 359BGN,"продаваДвустаен апартамент,62 м2","София, Суха Река","Обзаведен апартамент в нова сграда от 2007 г. На бул. „Ботевградско шосе“.Разпределението включва, входно антре с портманто.Дневна, трапезария и кухненска част с...",/bg/obiava/prodava/sofia/suha-reka/dvustaen/6096843/?sid=gFM8jD&page=2,,продава,Етаж: 2 от 6,Цена на /м2/:2 790EUR/5 457.40BGN,62 м2,https://www.imoti.net/bg/obiavi/r/prodava/sofia/?page=1&sid=gFM8jD,2026-01-21T18:11:50.514973
175 000€342 270BGN,"продаваДвустаен апартамент,74 м2","София, Суха Река","Представяме просторен, южен двустаен имот за продажба в спокоен и зелен район, на 10 мин пеша от парк ""Герена"".Имотът е разположен на 4-ти етаж от 6. Сградата е построена от...",/bg/obiava/prodava--v-stroej/sofia/suha-reka/dvustaen/6087356/?sid=gFM8jD&page=2,14,продава,Етаж:  от 6,Цена на /м2/:2 365EUR/4 625.27BGN,74 м2,https://www.imoti.net/bg/obiavi/r/prodava/sofia/?page=1&sid=gFM8jD,2026-01-21T18:11:50.515723
176 600€345 400BGN,"продаваДвустаен апартамент,60 м2","София, Дианабад","Начален етап на строителство!!!ИРИДА НЕДВИЖИМИ ИМОТИ продава голям двустаен апартамент в новоизграждаща се сграда, с изключително висококачествено строителство от доказан инвеститор...",/bg/obiava/prodava--v-stroej/sofia/dianabad/dvustaen/6082472/?sid=gFM8jD&page=2,4,продава,Етаж: 2 от 7,Цена на /м2/:2 943EUR/5 756.66BGN,60 м2,https://www.imoti.net/bg/obiavi/r/prodava/sofia/?page=1&sid=gFM8jD,2026-01-21T18:11:50.516495
179 000€350 094BGN,"продаваДвустаен апартамент,74 м2","София, Суха Река","ПРОСТОРЕН, НЕПРЕХОДЕН, ВЪТРЕШЕН, ТОПЪЛ апартамент в ЕПК блок от 70-те г. с отличен вход, на етаж 2 от 14, асансьор; в близост до Стадион Герена, бъдеща метростанция, детска градина, детска...",/bg/obiava/prodava/sofia/suha-reka/dvustaen/6133305/?sid=gFM8jD&page=2,17,продава,Етаж: 2 от 14,Цена на /м2/:2 419EUR/4 730.99BGN,74 м2,https://www.imoti.net/bg/obiavi/r/prodava/sofia/?page=1&sid=gFM8jD,2026-01-21T18:11:50.517240
