title,price_and_currency,location,details_url,property_type,area,agency,floor,price_per_m2,description,is_top_ad,num_photos,date_added,search_url,total_offers
"продава Двустаен апартамент, 50 м2",99 990EUR,"София, Дианабад",https://www.imoti.net/bg/obiava/prodava/sofia/dianabad/dvustaen/6087866/?sid=gFM8jD&page=1,продава Двустаен апартамент, 50 м2,Dekris,Етаж: 0 от 6,Цена на /м2/:2 000EUR,"С ключ сме!Голямо помещение КОЕТО МОЖЕ ДА СЕ ОФОРМИ КАТО ДНЕВНА с бокс и една спалня.Има Акт16.Пода е на теракот , стени латекс . В близост до бул.Г.М.Димитров,зад Търговска лига.  Височина на...",True,1,2025-07-06 18:02:21.489912,https://www.imoti.net/bg/obiavi/r/prodava/sofia/?page=1&sid=gFM8jD,385
"продава Двустаен апартамент, 90 м2",166 000EUR,"София, Редута",https://www.imoti.net/bg/obiava/prodava--v-stroej/sofia/reduta/dvustaen/6092078/?sid=gFM8jD&page=1,продава Двустаен апартамент, 90 м2,Home One,Етаж: 2 от 6,Цена на /м2/:1 844EUR,"БЕЗ КОМИСИОННА !!!ТОП ЛОКАЦИЯ !!! ПАРК ГЕО МИЛЕВ !!!Предлагаме за продажба двустаен апартамент в новострояща се жилищна сграда, разположена на метри от парк Гео Милев и...",True,1,2025-07-06 18:02:21.490403,https://www.imoti.net/bg/obiavi/r/prodava/sofia/?page=1&sid=gFM8jD,385
"продава Тристаен апартамент, 96 м2",192 000EUR,"София, Редута",https://www.imoti.net/bg/obiava/prodava--v-stroej/sofia/reduta/tristaen/6092079/?sid=gFM8jD&page=1,продава Тристаен апартамент, 96 м2,Home One,Етаж: 2 от 6,Цена на /м2/:2 000EUR,"БЕЗ КОМИСИОННА !!! ТОП ЛОКАЦИЯ !!! ПАРК ГЕО МИЛЕВ !!!Предлагаме за продажба тристаен апартамент в новострояща се жилищна сграда, разположена на метри от парк Гео Милев и в...",True,1,2025-07-06 18:02:21.490829,https://www.imoti.net/bg/obiavi/r/prodava/sofia/?page=1&sid=gFM8jD,385
"продава Двустаен апартамент, 89 м2",247 041EUR,"София, Дианабад",https://www.imoti.net/bg/obiava/prodava--v-stroej/sofia/dianabad/dvustaen/6032718/?sid=gFM8jD&page=1,продава Двустаен апартамент, 89 м2,Luximmo Finest Estates,Етаж:  от 15,Цена на /м2/:2 776EUR,"Ексклузивно представяме за продажба двустаен апартамент №4.28 в сграда S-Tower - нов проект с отличителен дизайн, висок клас на изпълнение, комуникативна локация и отлична възможност за инвестиция....",True,12,2025-07-06 18:02:21.491293,https://www.imoti.net/bg/obiavi/r/prodava/sofia/?page=1&sid=gFM8jD,385
"продава Тристаен апартамент, 95 м2",305 000EUR,"София, Редута",https://www.imoti.net/bg/obiava/prodava/sofia/reduta/tristaen/6090649/?sid=gFM8jD&page=1,продава Тристаен апартамент, 95 м2,ДОМИНО Риъл Естейт,Етаж: 5 от 6,Цена на /м2/:3 211EUR,"Обзаведен, панорамен, тристаен апартамент с възможност за паркиране във вътрешен двор на сградата. Намира се в непосредствена близост до ул. Велчо Атанасов и ул. Атанас Узунов. В близост има детска...",True,18,2025-07-06 18:02:21.491755,https://www.imoti.net/bg/obiavi/r/prodava/sofia/?page=1&sid=gFM8jD,385
"продава Тристаен апартамент, 125 м2",327 132EUR,"София, Суха Река",https://www.imoti.net/bg/obiava/prodava--v-stroej/sofia/suha-reka/tristaen/5829598/?sid=gFM8jD&page=1,продава Тристаен апартамент, 125 м2,Luximmo Finest Estates,Етаж:  от 10,Цена на /м2/:2 617EUR,"Представяме тристаен апартамент в чисто нова бутикова сграда с отлична локация в кв. „Сухата река“. В непосредствена близост се намира метростанция „Хаджи Димитър“, а популярният парк „Заимов“,...",True,5,2025-07-06 18:02:21.492231,https://www.imoti.net/bg/obiavi/r/prodava/sofia/?page=1&sid=gFM8jD,385
"продава Тристаен апартамент, 130 м2",344 644EUR,"София, Дианабад",https://www.imoti.net/bg/obiava/prodava--v-stroej/sofia/dianabad/tristaen/5805229/?sid=gFM8jD&page=1,продава Тристаен апартамент, 130 м2,Luximmo Finest Estates,Етаж:  от 15,Цена на /м2/:2 651EUR,"Ексклузивно представяме за продажба тристаен апартамент в сграда S-Tower - нов проект с отличителен дизайн, висок клас на изпълнение, комуникативна локация и отлична възможност за инвестиция....",True,12,2025-07-06 18:02:21.492678,https://www.imoti.net/bg/obiavi/r/prodava/sofia/?page=1&sid=gFM8jD,385
"продава Тристаен апартамент, 168 м2",635 000EUR,"София, Изток",https://www.imoti.net/bg/obiava/prodava/sofia/sofija-iztok/tristaen/6090722/?sid=gFM8jD&page=1,продава Тристаен апартамент, 168 м2,First Estates,Етаж: 2 от 5,Цена на /м2/:3 780EUR,"Фърст естейтс има удоволствието да Ви представи ексклузивно този просторен тристаен апартамент в престижния квартал Изток. Перфектно проектиран за съвременно живеене, този имот предлага комбинация...",True,16,2025-07-06 18:02:21.493146,https://www.imoti.net/bg/obiavi/r/prodava/sofia/?page=1&sid=gFM8jD,385
"продава Четиристаен апартамент, 197 м2",650 000EUR,"София, Изток",https://www.imoti.net/bg/obiava/prodava--v-stroej/sofia/sofija-iztok/chetiristaen/5983325/?sid=gFM8jD&page=1,продава Четиристаен апартамент, 197 м2,Luximmo Finest Estates,Етаж:  от 8,Цена на /м2/:3 299EUR,"Ексклузивно представяме супер просторен и уютен, четиристаен апартамент в един от най-предпочитаните райони на София – квартал ""Изток"".Жилището е част от модерна сграда, разположена...",True,14,2025-07-06 18:02:21.493604,https://www.imoti.net/bg/obiavi/r/prodava/sofia/?page=1&sid=gFM8jD,385
"продава Двустаен апартамент, 55 м2",110 000EUR,"София, Оборище",https://www.imoti.net/bg/obiava/prodava/sofia/oborishte/dvustaen/6022943/?sid=gFM8jD&page=1,продава Двустаен апартамент, 55 м2,Титан пропъртис продажби,Етаж: 1 от 4,Цена на /м2/:2 000EUR,"Титан Пропъртис - офис Черни връх има удоволствието да Ви представи двустаен апартамент в Оборище. Мястото е комуникативно , в близост е до метростанция Театрална, спирки на градски транспорт,...",False,7,2025-07-06 18:02:21.494047,https://www.imoti.net/bg/obiavi/r/prodava/sofia/?page=1&sid=gFM8jD,385
"продава Тристаен апартамент, 84 м2",125 000EUR,"София, Суха Река",https://www.imoti.net/bg/obiava/prodava/sofia/suha-reka/tristaen/5675521/?sid=gFM8jD&page=1,продава Тристаен апартамент, 84 м2,Явлена Изток,Етаж: 6 от 8,Цена на /м2/:1 488EUR,"Явлена-Изток продава 3-стаен апартамент 84 кв.м. в ж.к. Сухата река. Състоящ се от: дневна, две спални, кухня, баня, тоалетна, мокро помещение, гардеробно и две тераси. Сградата е панел от 1974г....",False,12,2025-07-06 18:02:21.494475,https://www.imoti.net/bg/obiavi/r/prodava/sofia/?page=1&sid=gFM8jD,385
"продава Двустаен апартамент, 40 м2",125 000EUR,"София, Суха Река",https://www.imoti.net/bg/obiava/prodava--v-stroej/sofia/suha-reka/dvustaen/6092807/?sid=gFM8jD&page=1,продава Двустаен апартамент, 40 м2,SUPRIMMO,Етаж:  от 8,Цена на /м2/:3 125EUR,"Представяме за продажба светъл и топъл двустаен апартамент, разположен в масивна тухлена сграда в кв. ""Сухата река"", София. Районът е спокоен и добре уреден, предпочитан за живеене и подходящ за...",False,4,2025-07-06 18:02:21.494914,https://www.imoti.net/bg/obiavi/r/prodava/sofia/?page=1&sid=gFM8jD,385
"продава Двустаен апартамент, 47 м2",125 000EUR,"София, Суха Река",https://www.imoti.net/bg/obiava/prodava/sofia/suha-reka/dvustaen/6044312/?sid=gFM8jD&page=1,продава Двустаен апартамент, 47 м2,Юпитер-8,Етаж: 1 от 9,Цена на /м2/:2 660EUR,"Нов среден южен партерен имот със статут офис. Сграда с Акт 16 от 2024 г.ТЕЦ.Топ - локация в широк център, непосредствено до ул. Черковна. Сградата е на 200 метра от метростанция, 1040 м....",False,,2025-07-06 18:02:21.495324,https://www.imoti.net/bg/obiavi/r/prodava/sofia/?page=1&sid=gFM8jD,385
"продава Двустаен апартамент, 47 м2",125 000EUR,"София, Подуене",https://www.imoti.net/bg/obiava/prodava/sofia/poduene/dvustaen/6044314/?sid=gFM8jD&page=1,продава Двустаен апартамент, 47 м2,Юпитер-8,Етаж: 1 от 9,Цена на /м2/:2 660EUR,"Нов среден южен партерен имот със статут офис. Сграда с Акт 16 от 2024 г.ТЕЦ.Топ - локация в широк център, непосредствено до ул. Черковна. Сградата е на 200 метра от метростанция, 1040 м....",False,,2025-07-06 18:02:21.495727,https://www.imoti.net/bg/obiavi/r/prodava/sofia/?page=1&sid=gFM8jD,385
"продава Двустаен апартамент, 47 м2",125 000EUR,"София, Оборище",https://www.imoti.net/bg/obiava/prodava/sofia/oborishte/dvustaen/6044316/?sid=gFM8jD&page=1,продава Двустаен апартамент, 47 м2,Юпитер-8,Етаж: 1 от 9,Цена на /м2/:2 660EUR,"Нов среден южен партерен имот със статут офис. Сграда с Акт 16 от 2024 г.ТЕЦ.Топ - локация в широк център, непосредствено до ул. Черковна. Сградата е на 200 метра от метростанция, 1040 м....",False,,2025-07-06 18:02:21.496143,https://www.imoti.net/bg/obiavi/r/prodava/sofia/?page=1&sid=gFM8jD,385
"продава Четиристаен апартамент, 86 м2",126 800EUR,"София, Оборище",https://www.imoti.net/bg/obiava/prodava/sofia/oborishte/chetiristaen/5885595/?sid=gFM8jD&page=1,продава Четиристаен апартамент, 86 м2,Имоти Премиер,Етаж: 0 от 5,Цена на /м2/:1 474EUR,"Имоти Премиер предлага на Вашето внимание имот със статут на апартамент в кв. Оборище.Намира се на полусутерен в тухлена сграда. Състои се от 4 помещения, два санитарни възела и има...",False,11,2025-07-06 18:02:21.496620,https://www.imoti.net/bg/obiavi/r/prodava/sofia/?page=1&sid=gFM8jD,385
"продава Двустаен апартамент, 66 м2",135 000EUR,"София, Редута",https://www.imoti.net/bg/obiava/prodava--v-stroej/sofia/reduta/dvustaen/6002958/?sid=gFM8jD&page=1,продава Двустаен апартамент, 66 м2,SUPRIMMO,Етаж:  от 6,Цена на /м2/:2 045EUR,"Представяме двустаен апартамент за продажба в нова сграда в кв. ""Редута"".Сградата е с Акт 16 от 2025 г.Имотът се намира на тиха и спокойна улица, гарантираща комфорта...",False,2,2025-07-06 18:02:21.497062,https://www.imoti.net/bg/obiavi/r/prodava/sofia/?page=1&sid=gFM8jD,385
"продава Двустаен апартамент, 77 м2",138 726EUR,"София, Суха Река",https://www.imoti.net/bg/obiava/prodava--v-stroej/sofia/suha-reka/dvustaen/5899149/?sid=gFM8jD&page=1,продава Двустаен апартамент, 77 м2,ЕКС НВД,Етаж: 4 от 6,Цена на /м2/:1 802EUR,"Компания `ЕКС` представя на Вашето внимание двустаен апартамент в жк Сухата река.МЕСТОПОЛОЖЕНИЕ: В близост до спирка на градски транспорт, детска градина, училище, магазини от...",False,2,2025-07-06 18:02:21.497488,https://www.imoti.net/bg/obiavi/r/prodava/sofia/?page=1&sid=gFM8jD,385
"продава Двустаен апартамент, 77 м2",139 000EUR,"София, Суха Река",https://www.imoti.net/bg/obiava/prodava--v-stroej/sofia/suha-reka/dvustaen/5900575/?sid=gFM8jD&page=1,продава Двустаен апартамент, 77 м2,ЕКС НВД,Етаж: 5 от 6,Цена на /м2/:1 805EUR,"Компания `ЕКС` представя на Вашето внимание двустаен апартамент в жк Сухата река.МЕСТОПОЛОЖЕНИЕ: В близост до спирка на градски транспорт, детска градина, училище, магазини от...",False,2,2025-07-06 18:02:21.497924,https://www.imoti.net/bg/obiavi/r/prodava/sofia/?page=1&sid=gFM8jD,385
"продава Двустаен апартамент, 73 м2",152 000EUR,"София, Суха Река",https://www.imoti.net/bg/obiava/prodava/sofia/suha-reka/dvustaen/6088247/?sid=gFM8jD&page=1,продава Двустаен апартамент, 73 м2,ARCO REAL ESTATE,Етаж: 8 от 11,Цена на /м2/:2 082EUR,"ARCO REAL ESTATE предлага двустаен апартамент със застроена площ 63 кв.м., западно изложение, в луксозна жилищна сграда на десет етажа в кв. Сухата река, на пет минути пешеходно разстояние от...",False,5,2025-07-06 18:02:21.498395,https://www.imoti.net/bg/obiavi/r/prodava/sofia/?page=1&sid=gFM8jD,385
"продава Двустаен апартамент, 70 м2",152 920EUR,"София, Подуене",https://www.imoti.net/bg/obiava/prodava--v-stroej/sofia/poduene/dvustaen/6044477/?sid=gFM8jD&page=1,продава Двустаен апартамент, 70 м2,New Estates,Етаж: 8 от 9,Цена на /м2/:2 185EUR,"New Estates представя двустаен апартамент в новострояща се жилищна сграда, която се намира на едно от най-комуникативните места в София.Централното, но същевременно тихо и спокойно...",False,6,2025-07-06 18:02:21.498829,https://www.imoti.net/bg/obiavi/r/prodava/sofia/?page=1&sid=gFM8jD,385
"продава Тристаен апартамент, 54 м2",157 000EUR,"София, Суха Река",https://www.imoti.net/bg/obiava/prodava/sofia/suha-reka/tristaen/6092150/?sid=gFM8jD&page=1,продава Тристаен апартамент, 54 м2,АДРЕС Недвижими имоти АД,Етаж: 9 от 15,Цена на /м2/:2 907EUR,"Тристаен апартамент, преустроен от двустаен, с площ от 54 кв.м по нотариален акт, разположен на 9-ти етаж от 15-етажна сграда тип ЕПК.Жилището е с функционално разпределение, включващо:...",False,9,2025-07-06 18:02:21.499270,https://www.imoti.net/bg/obiavi/r/prodava/sofia/?page=1&sid=gFM8jD,385
"продава Тристаен апартамент, 110 м2",165 000EUR,"София, Редута",https://www.imoti.net/bg/obiava/prodava/sofia/reduta/tristaen/6076138/?sid=gFM8jD&page=1,продава Тристаен апартамент, 110 м2,Имоти Премиер,Етаж: 0 от 5,Цена на /м2/:1 500EUR,"Имоти Премиер представя уютен тристаен апартамент с отлична локация в кв. Редута, гр. София.С удоволствие ви запознаваме с този прекрасен имот, разположен в един от най-търсените и...",False,5,2025-07-06 18:02:21.499754,https://www.imoti.net/bg/obiavi/r/prodava/sofia/?page=1&sid=gFM8jD,385
"продава Тристаен апартамент, 79 м2",165 821EUR,"София, Суха Река",https://www.imoti.net/bg/obiava/prodava--v-stroej/sofia/suha-reka/tristaen/5986842/?sid=gFM8jD&page=1,продава Тристаен апартамент, 79 м2,Елеганс Естейт,Етаж: 7 от 7,Цена на /м2/:2 099EUR,"МЕТРО!ТИШИНА!ЕЛЕГАНТНОСТ!ПРЕДПРОДАЖБА!СКОРО ОТНОВО ЩЕ ВДИГНЕМ ЦЕНАТА, ПОБЪРЗАЙТЕ!ВЕЧЕ 60% ОТ ЖИЛИЩАТА СА ЗАКУПЕНИ!Уникален мини...",False,4,2025-07-06 18:02:21.500210,https://www.imoti.net/bg/obiavi/r/prodava/sofia/?page=1&sid=gFM8jD,385
"продава Тристаен апартамент, 79 м2",165 900EUR,"София, Суха Река",https://www.imoti.net/bg/obiava/prodava/sofia/suha-reka/tristaen/6085996/?sid=gFM8jD&page=1,продава Тристаен апартамент, 79 м2,Глобъл Сървисиз,Етаж: 1 от 8,Цена на /м2/:2 100EUR,,False,1,2025-07-06 18:02:21.500656,https://www.imoti.net/bg/obiavi/r/prodava/sofia/?page=1&sid=gFM8jD,385
"продава Двустаен апартамент, 80 м2",167 000EUR,"София, Суха Река",https://www.imoti.net/bg/obiava/prodava/sofia/suha-reka/dvustaen/6088250/?sid=gFM8jD&page=1,продава Двустаен апартамент, 80 м2,ARCO REAL ESTATE,Етаж: 5 от 10,Цена на /м2/:2 088EUR,"ARCO REAL ESTATE предлага двустаен апартамент на пети етаж от десет етажна жилищна сграда със застроена площ 70 кв.м., изложение- изток/север, в луксозна жилищна сграда в кв. Сухата река, на пет...",False,4,2025-07-06 18:02:21.501142,https://www.imoti.net/bg/obiavi/r/prodava/sofia/?page=1&sid=gFM8jD,385
"продава Двустаен апартамент, 80 м2",168 500EUR,"София, Суха Река",https://www.imoti.net/bg/obiava/prodava/sofia/suha-reka/dvustaen/5971433/?sid=gFM8jD&page=1,продава Двустаен апартамент, 80 м2,ARCO REAL ESTATE,Етаж: 2 от 10,Цена на /м2/:2 106EUR,"ARCO REAL ESTATE предлага двустаен апартамент със застроена площ 70 кв.м.,североизточно изложенив, в луксозна жилищна сграда на десет етажа в кв. Сухата река, на пет минути пешеходно разстояние от...",False,5,2025-07-06 18:02:21.501620,https://www.imoti.net/bg/obiavi/r/prodava/sofia/?page=1&sid=gFM8jD,385
"продава Двустаен апартамент, 84 м2",169 000EUR,"София, Суха Река",https://www.imoti.net/bg/obiava/prodava/sofia/suha-reka/dvustaen/6088253/?sid=gFM8jD&page=1,продава Двустаен апартамент, 84 м2,ARCO REAL ESTATE,Етаж: 2 от 10,Цена на /м2/:2 012EUR,"ARCO REAL ESTATE предлага двустаен апартамент на втори етаж от десет етажна жилищна сграда със застроена площ 73 кв.м.,  изложение- юг/изток, в луксозна жилищна сграда на десет етажа в кв. Сухата...",False,4,2025-07-06 18:02:21.502108,https://www.imoti.net/bg/obiavi/r/prodava/sofia/?page=1&sid=gFM8jD,385
"продава Двустаен апартамент, 61 м2",169 000EUR,"София, Суха Река",https://www.imoti.net/bg/obiava/prodava/sofia/suha-reka/dvustaen/6056399/?sid=gFM8jD&page=1,продава Двустаен апартамент, 61 м2,АДРЕС Недвижими имоти АД,Етаж: 2 от 4,Цена на /м2/:2 770EUR,"Слънчев и топъл апартамент в четириетажна тухлена сграда.Районът е чист и спокоен, с прекрасни, добре поддържани тревни площи и безпроблемно паркиране.",False,13,2025-07-06 18:02:21.502540,https://www.imoti.net/bg/obiavi/r/prodava/sofia/?page=1&sid=gFM8jD,385
"продава Двустаен апартамент, 60 м2",176 600EUR,"София, Дианабад",https://www.imoti.net/bg/obiava/prodava--v-stroej/sofia/dianabad/dvustaen/6082472/?sid=gFM8jD&page=1,продава Двустаен апартамент, 60 м2,ИРИДА НЕДВИЖИМИ ИМОТИ,Етаж: 2 от 7,Цена на /м2/:2 943EUR,"Начален етап на строителство!!!ИРИДА НЕДВИЖИМИ ИМОТИ продава голям двустаен апартамент в новоизграждаща се сграда, с изключително висококачествено строителство от доказан инвеститор...",False,2,2025-07-06 18:02:21.503034,https://www.imoti.net/bg/obiavi/r/prodava/sofia/?page=1&sid=gFM8jD,385
"продава Двустаен апартамент, 69 м2",177 000EUR,"София, Подуене",https://www.imoti.net/bg/obiava/prodava/sofia/poduene/dvustaen/6093046/?sid=gFM8jD&page=2,продава Двустаен апартамент, 69 м2,Galiano Estates,Етаж: 2 от 9,Цена на /м2/:2 565EUR,"Ексклузивно!!! Galiano Estates има удоволствието да ви представи уютен двустаен апартамент със статут на ателие в луксозна жилищна сграда с АКТ 16, в кв. ""Подуяне"". Изключително комуникативно...",False,3,2025-07-06 18:02:25.616351,https://www.imoti.net/bg/obiavi/r/prodava/sofia/?page=1&sid=gFM8jD,385
"продава Двустаен апартамент, 64 м2",179 424EUR,"София, Оборище",https://www.imoti.net/bg/obiava/prodava/sofia/oborishte/dvustaen/6064453/?sid=gFM8jD&page=2,продава Двустаен апартамент, 64 м2,Титан Пропъртис,Етаж: 2 от 6,Цена на /м2/:2 804EUR,"Открийте мястото, където ще се чувствате у дома от първия момент!Титан Пропъртис с радост предлага на Вашето внимание елегантен двустаен апартамент в кв. Оборище, София. Сградата е...",False,10,2025-07-06 18:02:25.616854,https://www.imoti.net/bg/obiavi/r/prodava/sofia/?page=1&sid=gFM8jD,385
"продава Двустаен апартамент, 64 м2",179 424EUR,"София, Оборище",https://www.imoti.net/bg/obiava/prodava/sofia/oborishte/dvustaen/6064349/?sid=gFM8jD&page=2,продава Двустаен апартамент, 64 м2,Титан Пропъртис,Етаж: 4 от 6,Цена на /м2/:2 804EUR,"Открийте мястото, където ще се чувствате у дома от първия момент!Титан Пропъртис с радост предлага на Вашето внимание елегантен двустаен апартамент в кв. Оборище, София. Сградата е...",False,10,2025-07-06 18:02:25.617302,https://www.imoti.net/bg/obiavi/r/prodava/sofia/?page=1&sid=gFM8jD,385
