title,price_and_currency,location,details_url,property_type,area,agency,floor,price_per_m2,description,is_top_ad,num_photos,date_added,search_url,total_offers
"продава Четиристаен апартамент, 220 м2",448 500EUR,"София, Суха Река",https://www.imoti.net/bg/obiava/prodava/sofia/suha-reka/chetiristaen/6090751/?sid=gFM8jD&page=9,продава Четиристаен апартамент, 220 м2,ARCO REAL ESTATE,Етаж: 3 от 10,Цена на /м2/:2 039EUR,"ARCO REAL ESTATE предлага четиристаен  апартамент със застроена площ 192 кв.м., изложенив: север/юг, в луксозна жилищна сграда на десет етажа в кв. Сухата река, на пет минути пешеходно разстояние...",False,5,2025-07-06 18:02:52.590099,https://www.imoti.net/bg/obiavi/r/prodava/sofia/?page=1&sid=gFM8jD,385
"продава Тристаен апартамент, 140 м2",450 000EUR,"София, Оборище",https://www.imoti.net/bg/obiava/prodava/sofia/oborishte/tristaen/5876985/?sid=gFM8jD&page=9,продава Тристаен апартамент, 140 м2,ЮНИК ЕСТЕЙТС,Етаж: 6 от 9,Цена на /м2/:3 214EUR,"Unique Estates представя на Вашето внимание слънчев апартамент за продажба, намиращ се в район Оборище. Имотът е изключително просторен с отлично...",False,6,2025-07-06 18:02:52.590522,https://www.imoti.net/bg/obiavi/r/prodava/sofia/?page=1&sid=gFM8jD,385
"продава Четиристаен апартамент, 138 м2",450 000EUR,"София, Редута",https://www.imoti.net/bg/obiava/prodava--v-stroej/sofia/reduta/chetiristaen/6062586/?sid=gFM8jD&page=9,продава Четиристаен апартамент, 138 м2,SUPRIMMO,Етаж:  от 4,Цена на /м2/:3 261EUR,"Предлагаме за продажба напълно обзаведен многостаен апартамент в кв. Редута, на ул. „Стоил Войвода”. Районът е богато озеленен и осигурява спокойна и приятна жилищна атмосфера, същевременно...",False,15,2025-07-06 18:02:52.590950,https://www.imoti.net/bg/obiavi/r/prodava/sofia/?page=1&sid=gFM8jD,385
"продава Четиристаен апартамент, 137 м2",450 565EUR,"София, Дианабад",https://www.imoti.net/bg/obiava/prodava--v-stroej/sofia/dianabad/chetiristaen/6082477/?sid=gFM8jD&page=9,продава Четиристаен апартамент, 137 м2,ИРИДА НЕДВИЖИМИ ИМОТИ,Етаж: 7 от 7,Цена на /м2/:3 289EUR,"Начален етап на строителство!!!ИРИДА НЕДВИЖИМИ ИМОТИ продава четиристаен апартамент в новоизграждаща се сграда, с изключително висококачествено строителство от доказан инвеститор на...",False,2,2025-07-06 18:02:52.591430,https://www.imoti.net/bg/obiavi/r/prodava/sofia/?page=1&sid=gFM8jD,385
"продава Многостаен апартамент, 137 м2",450 565EUR,"София, Дианабад",https://www.imoti.net/bg/obiava/prodava--v-stroej/sofia/dianabad/mnogostaen/6082478/?sid=gFM8jD&page=9,продава Многостаен апартамент, 137 м2,ИРИДА НЕДВИЖИМИ ИМОТИ,Етаж: 7 от 7,Цена на /м2/:3 289EUR,"Начален етап на строителство!!!ИРИДА НЕДВИЖИМИ ИМОТИ продава четиристаен апартамент в новоизграждаща се сграда, с изключително висококачествено строителство от доказан инвеститор на...",False,2,2025-07-06 18:02:52.591910,https://www.imoti.net/bg/obiavi/r/prodava/sofia/?page=1&sid=gFM8jD,385
"продава Четиристаен апартамент, 195 м2",456 225EUR,"София, Оборище",https://www.imoti.net/bg/obiava/prodava--v-stroej/sofia/oborishte/chetiristaen/6027030/?sid=gFM8jD&page=9,продава Четиристаен апартамент, 195 м2,New Estates,Етаж: 8 от 14,Цена на /м2/:2 340EUR,,False,17,2025-07-06 18:02:52.592326,https://www.imoti.net/bg/obiavi/r/prodava/sofia/?page=1&sid=gFM8jD,385
"продава Мезонет, 266 м2",457 520EUR,"София, Изток",https://www.imoti.net/bg/obiava/prodava/sofia/sofija-iztok/mezonet/3523449/?sid=gFM8jD&page=9,продава Мезонет, 266 м2,АРСЕНАЛ - недвижими имоти,Етаж: 4 от 5,Цена на /м2/:1 720EUR,".  .  .  .  .  .  .  .  .  .  .  .  .  .  . ЩЕ .  .  .  .  .  .  .  .  .  .  .  .  .  .  .  .  .  .  .  . Ви предложим УНИКАЛЕН като МЕСТОПОЛОЖЕНИЕ, внушителен като полезна използваема площ и...",False,12,2025-07-06 18:02:52.592736,https://www.imoti.net/bg/obiavi/r/prodava/sofia/?page=1&sid=gFM8jD,385
"продава Тристаен апартамент, 166 м2",465 000EUR,"София, Редута",https://www.imoti.net/bg/obiava/prodava/sofia/reduta/tristaen/6031549/?sid=gFM8jD&page=10,продава Тристаен апартамент, 166 м2,Явлена Изток,Етаж: 4 от 8,Цена на /м2/:2 801EUR,"Явлена-Изток представя тристаен апартамент в квартал Редута, на комуникативно място и добра локация. ПРЕД АКТ 16! Апартамента е непреходен, със северозападно изложение, на четвърти етаж. Голяма...",False,7,2025-07-06 18:02:56.254481,https://www.imoti.net/bg/obiavi/r/prodava/sofia/?page=1&sid=gFM8jD,385
"продава Тристаен апартамент, 138 м2",465 540EUR,"София, Оборище",https://www.imoti.net/bg/obiava/prodava/sofia/oborishte/tristaen/5814591/?sid=gFM8jD&page=10,продава Тристаен апартамент, 138 м2,Бг Брокер,Етаж: 7 от 14,Цена на /м2/:3 373EUR,"БЕЗ КОМИСИОННА! Предлагаме тристаен апартамент в новостроящ се бутиков жилищен комплекс, близо до метростанция 'Театрална' и парк 'Заимов'. Имотът е на етаж 7 от 14 с обща площ 138.55 кв.м и чиста...",False,6,2025-07-06 18:02:56.254999,https://www.imoti.net/bg/obiavi/r/prodava/sofia/?page=1&sid=gFM8jD,385
"продава Многостаен апартамент, 120 м2",470 000EUR,"София, Оборище",https://www.imoti.net/bg/obiava/prodava/sofia/oborishte/mnogostaen/5898604/?sid=gFM8jD&page=10,продава Многостаен апартамент, 120 м2,Титан пропъртис продажби,Етаж: 5 от 6,Цена на /м2/:3 917EUR,"Титан Пропъртис - офис Черни връх има удоволствието да ви престави многостаен апартамент , в един от най - предпочитаните райони на град София , а именно район Оборище - комуникативно място , в...",False,10,2025-07-06 18:02:56.255428,https://www.imoti.net/bg/obiavi/r/prodava/sofia/?page=1&sid=gFM8jD,385
"продава Тристаен апартамент, 144 м2",472 200EUR,"София, Оборище",https://www.imoti.net/bg/obiava/prodava--v-stroej/sofia/oborishte/tristaen/6040120/?sid=gFM8jD&page=10,продава Тристаен апартамент, 144 м2,ИРИДА НЕДВИЖИМИ ИМОТИ,Етаж: 7 от 14,Цена на /м2/:3 279EUR,"ИРИДА НЕДВИЖИМИ ИМОТИ продава слънчев тристаен апартамент в новоизграждащ се затворен жилищен комплекс, с изключително висококачествено строителство от доказан инвеститор на комуникативно място, в...",False,7,2025-07-06 18:02:56.255912,https://www.imoti.net/bg/obiavi/r/prodava/sofia/?page=1&sid=gFM8jD,385
"продава Тристаен апартамент, 144 м2",472 200EUR,"София, Оборище",https://www.imoti.net/bg/obiava/prodava--v-stroej/sofia/oborishte/tristaen/5909423/?sid=gFM8jD&page=10,продава Тристаен апартамент, 144 м2,ИРИДА НЕДВИЖИМИ ИМОТИ,Етаж: 7 от 14,Цена на /м2/:3 279EUR,"ИРИДА НЕДВИЖИМИ ИМОТИ продава слънчев тристаен апартамент в новоизграждащ се затворен жилищен комплекс, с изключително висококачествено строителство от доказан инвеститор на комуникативно място, в...",False,1,2025-07-06 18:02:56.256391,https://www.imoti.net/bg/obiavi/r/prodava/sofia/?page=1&sid=gFM8jD,385
"продава Мезонет, 175 м2",472 500EUR,"София, Изток",https://www.imoti.net/bg/obiava/prodava/sofia/sofija-iztok/mezonet/6088232/?sid=gFM8jD&page=10,продава Мезонет, 175 м2,ARCO REAL ESTATE,Етаж: 9 от 10,Цена на /м2/:2 700EUR,"ARCO Real Estate представя на вашето внимание обзаведен мезонет на комуникативно място в кв. Изток. Жилището се намира на бул. Драган Цанков в района на КАТ – София в близост до две метро спирки,...",False,25,2025-07-06 18:02:56.256875,https://www.imoti.net/bg/obiavi/r/prodava/sofia/?page=1&sid=gFM8jD,385
"продава Тристаен апартамент, 148 м2",485 900EUR,"София, Оборище",https://www.imoti.net/bg/obiava/prodava--v-stroej/sofia/oborishte/tristaen/6040119/?sid=gFM8jD&page=10,продава Тристаен апартамент, 148 м2,ИРИДА НЕДВИЖИМИ ИМОТИ,Етаж: 7 от 14,Цена на /м2/:3 283EUR,"ИРИДА НЕДВИЖИМИ ИМОТИ продава слънчев тристаен апартамент в новоизграждащ се затворен жилищен комплекс, с изключително висококачествено строителство от доказан инвеститор на комуникативно място в...",False,7,2025-07-06 18:02:56.257347,https://www.imoti.net/bg/obiavi/r/prodava/sofia/?page=1&sid=gFM8jD,385
"продава Тристаен апартамент, 148 м2",485 900EUR,"София, Оборище",https://www.imoti.net/bg/obiava/prodava--v-stroej/sofia/oborishte/tristaen/5909424/?sid=gFM8jD&page=10,продава Тристаен апартамент, 148 м2,ИРИДА НЕДВИЖИМИ ИМОТИ,Етаж: 7 от 14,Цена на /м2/:3 283EUR,"ИРИДА НЕДВИЖИМИ ИМОТИ продава слънчев тристаен апартамент в новоизграждащ се затворен жилищен комплекс, с изключително висококачествено строителство от доказан инвеститор на комуникативно място в...",False,1,2025-07-06 18:02:56.257815,https://www.imoti.net/bg/obiavi/r/prodava/sofia/?page=1&sid=gFM8jD,385
"продава Тристаен апартамент, 147 м2",487 500EUR,"София, Оборище",https://www.imoti.net/bg/obiava/prodava--v-stroej/sofia/oborishte/tristaen/6045931/?sid=gFM8jD&page=10,продава Тристаен апартамент, 147 м2,ИРИДА НЕДВИЖИМИ ИМОТИ,Етаж: 9 от 14,Цена на /м2/:3 316EUR,"ИРИДА НЕДВИЖИМИ ИМОТИ продава слънчев тристаен апартамент в новоизграждащ се затворен жилищен комплекс, с изключително висококачествено строителство от доказан инвеститор на комуникативно място, в...",False,5,2025-07-06 18:02:56.258296,https://www.imoti.net/bg/obiavi/r/prodava/sofia/?page=1&sid=gFM8jD,385
"продава Тристаен апартамент, 200 м2",500 000EUR,"София, Оборище",https://www.imoti.net/bg/obiava/prodava--v-stroej/sofia/oborishte/tristaen/5868552/?sid=gFM8jD&page=10,продава Тристаен апартамент, 200 м2,SUPRIMMO,Етаж:  от 5,Цена на /м2/:2 500EUR,"Тристайният апартамент, който представяме за продажба е част от нова бурикова сграда в кв.""Оборище"". Имотът е подходящ за лично позване или отадване под наем като жилище или офис пространство....",False,7,2025-07-06 18:02:56.258714,https://www.imoti.net/bg/obiavi/r/prodava/sofia/?page=1&sid=gFM8jD,385
"продава Тристаен апартамент, 122 м2",500 000EUR,"София, Изток",https://www.imoti.net/bg/obiava/prodava/sofia/sofija-iztok/tristaen/6059287/?sid=gFM8jD&page=10,продава Тристаен апартамент, 122 м2,Location,Етаж: 5 от 7,Цена на /м2/:4 098EUR,"Предлагам завършен и обзаведен апартамент, ситуиран в к-с ЕСТЕ.Изцяло вътрешен и южен, с панорамна гледка! Апартаментът е със площ 121.77кв.м. (ЗП 107.20кв.м), състои се от входно антре...",False,17,2025-07-06 18:02:56.259178,https://www.imoti.net/bg/obiavi/r/prodava/sofia/?page=1&sid=gFM8jD,385
"продава Тристаен апартамент, 139 м2",509 820EUR,"София, Оборище",https://www.imoti.net/bg/obiava/prodava/sofia/oborishte/tristaen/6010495/?sid=gFM8jD&page=10,продава Тристаен апартамент, 139 м2,АДРЕС Недвижими имоти АД,Етаж: 5 от 14,Цена на /м2/:3 668EUR,"Апартаментът се състои от 2 спални- към едната от спалните има прилежаща баня с WC и гардеробна; дневна с трапезария и кухненски бокс, 2 бани с WC;мокро помешение; входно антре със...",False,18,2025-07-06 18:02:56.259598,https://www.imoti.net/bg/obiavi/r/prodava/sofia/?page=1&sid=gFM8jD,385
"продава Тристаен апартамент, 134 м2",510 360EUR,"София, Оборище",https://www.imoti.net/bg/obiava/prodava/sofia/oborishte/tristaen/6010494/?sid=gFM8jD&page=10,продава Тристаен апартамент, 134 м2,АДРЕС Недвижими имоти АД,Етаж: 6 от 14,Цена на /м2/:3 809EUR,"Апартаментът се състои от 2 спални- към едната от спалните има прилежаща баня с WC и гардеробна; дневна с трапезария и кухненски бокс, 2 бани с WC;мокро помешение; входно антре със...",False,18,2025-07-06 18:02:56.260031,https://www.imoti.net/bg/obiavi/r/prodava/sofia/?page=1&sid=gFM8jD,385
"продава Многостаен апартамент, 171 м2",514 080EUR,"София, Оборище",https://www.imoti.net/bg/obiava/prodava/sofia/oborishte/mnogostaen/6064382/?sid=gFM8jD&page=10,продава Многостаен апартамент, 171 м2,Имоти Премиер,Етаж: 6 от 6,Цена на /м2/:3 006EUR,"Имоти ПРЕМИЕР представя на Вашето внимание многостаен апартамент в р-н Оборище!﻿Жилището е ситуирано на етаж 6 от 6 в новострояща се бутикова, тухлена сграда. Единствен на етажа!...",False,9,2025-07-06 18:02:56.260507,https://www.imoti.net/bg/obiavi/r/prodava/sofia/?page=1&sid=gFM8jD,385
"продава Тристаен апартамент, 135 м2",516 240EUR,"София, Оборище",https://www.imoti.net/bg/obiava/prodava/sofia/oborishte/tristaen/6011695/?sid=gFM8jD&page=10,продава Тристаен апартамент, 135 м2,АДРЕС Недвижими имоти АД,Етаж: 6 от 14,Цена на /м2/:3 824EUR,"Апартаментът се състои от 2 спални- към едната от спалните има прилежаща баня с WC; дневна с трапезария и кухненски бокс, 2 бани с WC; входно антре със складово помещение ; тераси....",False,18,2025-07-06 18:02:56.260938,https://www.imoti.net/bg/obiavi/r/prodava/sofia/?page=1&sid=gFM8jD,385
"продава Тристаен апартамент, 127 м2",520 000EUR,"София, Дианабад",https://www.imoti.net/bg/obiava/prodava--v-stroej/sofia/dianabad/tristaen/6080716/?sid=gFM8jD&page=10,продава Тристаен апартамент, 127 м2,Luximmo Finest Estates,Етаж:  от 16,Цена на /м2/:4 094EUR,"Представяме луксозен тристаен апартамент в една от емблематичните сгради в столицата, на топ локация до метростанция ""Г.М. Димитров"". Близо до ключов голям булевард ""Г.М. Димитров"", в сърцето на...",False,40,2025-07-06 18:02:56.261413,https://www.imoti.net/bg/obiavi/r/prodava/sofia/?page=1&sid=gFM8jD,385
"продава Тристаен апартамент, 143 м2",521 640EUR,"София, Оборище",https://www.imoti.net/bg/obiava/prodava/sofia/oborishte/tristaen/6011696/?sid=gFM8jD&page=10,продава Тристаен апартамент, 143 м2,АДРЕС Недвижими имоти АД,Етаж: 5 от 14,Цена на /м2/:3 648EUR,"Апартаментът се състои от 2 спални- към едната от спалните има прилежаща баня с WC; дневна с трапезария и кухненски бокс, 2 бани с WC; входно антре със складово помещение ; тераси....",False,18,2025-07-06 18:02:56.261845,https://www.imoti.net/bg/obiavi/r/prodava/sofia/?page=1&sid=gFM8jD,385
"продава Тристаен апартамент, 149 м2",530 000EUR,"София, Изток",https://www.imoti.net/bg/obiava/prodava/sofia/sofija-iztok/tristaen/5986359/?sid=gFM8jD&page=10,продава Тристаен апартамент, 149 м2,Революшън Естейт България,Етаж: 3 от 4,Цена на /м2/:3 557EUR,Революшън Естейт има удоволствието да Ви представи просторен тристаен апартамент в ж.к. Изток.Основни характеристики на имота:- Площ: 149 кв.м.-...,False,11,2025-07-06 18:02:56.262286,https://www.imoti.net/bg/obiavi/r/prodava/sofia/?page=1&sid=gFM8jD,385
"продава Четиристаен апартамент, 180 м2",531 700EUR,"София, Оборище",https://www.imoti.net/bg/obiava/prodava/sofia/oborishte/chetiristaen/5852954/?sid=gFM8jD&page=10,продава Четиристаен апартамент, 180 м2,Galiano Estates,Етаж: 3 от 14,Цена на /м2/:2 954EUR,"БЕЗ КОМИСИОННА ОТ КУПУВАЧА! Galiano Estates има удоволствието да ви представи уникален четиристаен апартамент в затворен комплекс ""Teatralna Park Residence"" в кв. Оборище до парк ""Заимов"" и...",False,6,2025-07-06 18:02:56.262770,https://www.imoti.net/bg/obiavi/r/prodava/sofia/?page=1&sid=gFM8jD,385
"продава Четиристаен апартамент, 176 м2",531 700EUR,"София, Оборище",https://www.imoti.net/bg/obiava/prodava--v-stroej/sofia/oborishte/chetiristaen/5909982/?sid=gFM8jD&page=10,продава Четиристаен апартамент, 176 м2,ИРИДА НЕДВИЖИМИ ИМОТИ,Етаж: 3 от 14,Цена на /м2/:3 021EUR,"ИРИДА НЕДВИЖИМИ ИМОТИ продава слънчев четиристаен апартамент в новоизграждащ се затворен жилищен комплекс, с изключително висококачествено строителство от доказан инвеститор на комуникативно място...",False,1,2025-07-06 18:02:56.263255,https://www.imoti.net/bg/obiavi/r/prodava/sofia/?page=1&sid=gFM8jD,385
"продава Четиристаен апартамент, 178 м2",532 800EUR,"София, Оборище",https://www.imoti.net/bg/obiava/prodava--v-stroej/sofia/oborishte/chetiristaen/6045939/?sid=gFM8jD&page=10,продава Четиристаен апартамент, 178 м2,ИРИДА НЕДВИЖИМИ ИМОТИ,Етаж: 7 от 14,Цена на /м2/:2 993EUR,"ИРИДА НЕДВИЖИМИ ИМОТИ продава слънчев четиристаен апартамент в новоизграждащ се затворен жилищен комплекс, с изключително висококачествено строителство от доказан инвеститор на комуникативно място...",False,4,2025-07-06 18:02:56.263725,https://www.imoti.net/bg/obiavi/r/prodava/sofia/?page=1&sid=gFM8jD,385
"продава Двустаен апартамент, 96 м2",533 005EUR,"София, Изток",https://www.imoti.net/bg/obiava/prodava--v-stroej/sofia/sofija-iztok/dvustaen/6084973/?sid=gFM8jD&page=10,продава Двустаен апартамент, 96 м2,BULGARIAN PROPERTIES,Етаж: 1 от 7,Цена на /м2/:5 552EUR,"За повече информация свържете се с нас и цитирайте референтния номер на имота. Моля, кажете, че сте видeли обявата в imoti.net.Референтен номер: Sfa 87396Тел: 0882 817...",False,20,2025-07-06 18:02:56.264215,https://www.imoti.net/bg/obiavi/r/prodava/sofia/?page=1&sid=gFM8jD,385
"продава Тристаен апартамент, 121 м2",535 000EUR,"София, Оборище",https://www.imoti.net/bg/obiava/prodava--v-stroej/sofia/oborishte/tristaen/6066001/?sid=gFM8jD&page=10,продава Тристаен апартамент, 121 м2,Luximmo Finest Estates,Етаж:  от 6,Цена на /м2/:4 421EUR,"Ексклузивно представяме една рядко срещана възможност за покупка на тристаен апартамент в престижния кв. ""Оборище"".Апартаментът се намира на топ локация на улица ""Буная"" №14, само на...",False,28,2025-07-06 18:02:56.264692,https://www.imoti.net/bg/obiavi/r/prodava/sofia/?page=1&sid=gFM8jD,385
"продава Тристаен апартамент, 132 м2",537 300EUR,"София, Оборище",https://www.imoti.net/bg/obiava/prodava/sofia/oborishte/tristaen/6010506/?sid=gFM8jD&page=10,продава Тристаен апартамент, 132 м2,АДРЕС Недвижими имоти АД,Етаж: 9 от 14,Цена на /м2/:4 070EUR,"Апартаментът се състои от 2 спални- към едната от спалните има прилежаща баня с WC; дневна с трапезария и кухненски бокс, 2 бани с WC; входно антре със складово помещение ; тераси....",False,18,2025-07-06 18:02:56.265122,https://www.imoti.net/bg/obiavi/r/prodava/sofia/?page=1&sid=gFM8jD,385
"продава Четиристаен апартамент, 183 м2",539 700EUR,"София, Оборище",https://www.imoti.net/bg/obiava/prodava--v-stroej/sofia/oborishte/chetiristaen/6045938/?sid=gFM8jD&page=10,продава Четиристаен апартамент, 183 м2,ИРИДА НЕДВИЖИМИ ИМОТИ,Етаж: 6 от 14,Цена на /м2/:2 949EUR,"ИРИДА НЕДВИЖИМИ ИМОТИ продава слънчев четиристаен апартамент в новоизграждащ се затворен жилищен комплекс, с изключително висококачествено строителство от доказан инвеститор на комуникативно място...",False,4,2025-07-06 18:02:56.265589,https://www.imoti.net/bg/obiavi/r/prodava/sofia/?page=1&sid=gFM8jD,385
