title,price_and_currency,location,details_url,property_type,area,agency,floor,price_per_m2,description,is_top_ad,num_photos,date_added,search_url,total_offers
"продава Двустаен апартамент, 50 м2",99 990€195 563BGN,"София, Дианабад",https://www.imoti.net/bg/obiava/prodava/sofia/dianabad/dvustaen/6106207/?sid=gFM8jD&page=1,продава Двустаен апартамент, 50 м2,Dekris,Етаж: 0 от 6,Цена на /м2/:2 000EUR/3 911.27BGN,"С ключ сме!Завършено е! Голямо помещение КОЕТО МОЖЕ ДА СЕ ОФОРМИ КАТО ДНЕВНА с бокс и една спалня. Има климатик и централен тец ,централно топла вода . Има Акт16.Пода е на теракот , стени латекс ....",True,1,2025-08-11 18:02:50.563256,https://www.imoti.net/bg/obiavi/r/prodava/sofia/?page=1&sid=gFM8jD,352
"продава Двустаен апартамент, 63 м2",144 900€283 400BGN,"София, Подуене",https://www.imoti.net/bg/obiava/prodava--v-stroej/sofia/poduene/dvustaen/5982550/?sid=gFM8jD&page=1,продава Двустаен апартамент, 63 м2,Елеганс Естейт,Етаж: 4 от 6,Цена на /м2/:2 300EUR/4 498.41BGN,"МЕТРО!ТИШИНА!ЕЛЕГАНТНОСТ!ПРЕДПРОДАЖБА!СКОРО ОТНОВО ЩЕ ВДИГНЕМ ЦЕНАТА, ПОБЪРЗАЙТЕ!ВЕЧЕ 70% ОТ ЖИЛИЩАТА СА ЗАКУПЕНИ!Уникален мини...",True,4,2025-08-11 18:02:50.563809,https://www.imoti.net/bg/obiavi/r/prodava/sofia/?page=1&sid=gFM8jD,352
"продава Двустаен апартамент, 53 м2",164 000€320 756BGN,"София, Редута",https://www.imoti.net/bg/obiava/prodava/sofia/reduta/dvustaen/6098033/?sid=gFM8jD&page=1,продава Двустаен апартамент, 53 м2,Революшън Естейт България,Етаж: 5 от 8,Цена на /м2/:3 094EUR/6 052.00BGN,Референтен номер: 2093558.Революшън Естейт представя двустаен апартамент в ж.к. Редута.-  Квадратура: 53 кв.м-  Етаж: 5 от 8 .-  Изложение: Изток....,True,10,2025-08-11 18:02:50.564273,https://www.imoti.net/bg/obiavi/r/prodava/sofia/?page=1&sid=gFM8jD,352
"продава Двустаен апартамент, 78 м2",194 900€381 191BGN,"София, Дианабад",https://www.imoti.net/bg/obiava/prodava--v-stroej/sofia/dianabad/dvustaen/6071658/?sid=gFM8jD&page=1,продава Двустаен апартамент, 78 м2,ИРИДА НЕДВИЖИМИ ИМОТИ,Етаж: 2 от 6,Цена на /м2/:2 499EUR/4 887.07BGN,"ИРИДА НЕДВИЖИМИ ИМОТИ, С КЛЮЧ В АГЕНЦИЯТА!!! Ви представя за продажба прекрасен двустаен апартамент в кв. Дианабад в гр. София, в близост до множество обществен транспорт, осигуряващ връзки с...",True,12,2025-08-11 18:02:50.564764,https://www.imoti.net/bg/obiavi/r/prodava/sofia/?page=1&sid=gFM8jD,352
"продава Тристаен апартамент, 132 м2",359 961€704 023BGN,"София, Суха Река",https://www.imoti.net/bg/obiava/prodava--v-stroej/sofia/suha-reka/tristaen/6052785/?sid=gFM8jD&page=1,продава Тристаен апартамент, 132 м2,Елеганс Естейт,Етаж: 9 от 10,Цена на /м2/:2 727EUR/5 333.51BGN,"МЕТРОПАРКЛУКСЕлеганс Естейт има удоволствието да представи на своите клиенти една емблематична новострояща се сграда, намираща се в непосредствена...",True,5,2025-08-11 18:02:50.565217,https://www.imoti.net/bg/obiavi/r/prodava/sofia/?page=1&sid=gFM8jD,352
"продава Тристаен апартамент, 95 м2",360 000€704 099BGN,"София, Оборище",https://www.imoti.net/bg/obiava/prodava/sofia/oborishte/tristaen/6062498/?sid=gFM8jD&page=1,продава Тристаен апартамент, 95 м2,Диана Хоумс,Етаж: 3 от 3,Цена на /м2/:3 789EUR/7 411.57BGN,Просторен тристаен апартамент в непосредствена близост до ул.Оборище и на пешеходно разстояние от мол Сердика- само на няколко крачки.  В близост е кръстовището на ул.Черковна и ул.Оборище и...,True,10,2025-08-11 18:02:50.565700,https://www.imoti.net/bg/obiavi/r/prodava/sofia/?page=1&sid=gFM8jD,352
"продава Тристаен апартамент, 144 м2",472 200€923 543BGN,"София, Оборище",https://www.imoti.net/bg/obiava/prodava--v-stroej/sofia/oborishte/tristaen/6040120/?sid=gFM8jD&page=1,продава Тристаен апартамент, 144 м2,ИРИДА НЕДВИЖИМИ ИМОТИ,Етаж: 7 от 14,Цена на /м2/:3 279EUR/6 413.49BGN,"ИРИДА НЕДВИЖИМИ ИМОТИ продава слънчев тристаен апартамент в новоизграждащ се затворен жилищен комплекс, с изключително висококачествено строителство от доказан инвеститор на комуникативно място, в...",True,6,2025-08-11 18:02:50.566180,https://www.imoti.net/bg/obiavi/r/prodava/sofia/?page=1&sid=gFM8jD,352
"продава Тристаен апартамент, 122 м2",525 000€1 026 811BGN,"София, Изгрев",https://www.imoti.net/bg/obiava/prodava/sofia/sofija-izgrev/tristaen/6101060/?sid=gFM8jD&page=1,продава Тристаен апартамент, 122 м2,Джей и Джей Корпорейшън,Етаж: 4 от 7,Цена на /м2/:4 303EUR/8 416.48BGN,"НОВА СГРАДА С АКТ 16! В НАЙ-ЖЕЛАНИЯ КВАРТАЛ - ИЗГРЕВ! Представяме на Вашето внимание тристаен апартамент, разположен на ул. Тинтява - район, който се отличава с тишина, много зеленина и модерна...",True,18,2025-08-11 18:02:50.566633,https://www.imoti.net/bg/obiavi/r/prodava/sofia/?page=1&sid=gFM8jD,352
"продава Четиристаен апартамент, 197 м2",650 000€1 271 290BGN,"София, Изток",https://www.imoti.net/bg/obiava/prodava--v-stroej/sofia/sofija-iztok/chetiristaen/5983325/?sid=gFM8jD&page=1,продава Четиристаен апартамент, 197 м2,Luximmo Finest Estates,Етаж:  от 8,Цена на /м2/:3 299EUR/6 453.25BGN,"Ексклузивно представяме супер просторен и уютен, четиристаен апартамент в един от най-предпочитаните райони на София – квартал ""Изток"".Жилището е част от модерна сграда, разположена...",True,14,2025-08-11 18:02:50.567121,https://www.imoti.net/bg/obiavi/r/prodava/sofia/?page=1&sid=gFM8jD,352
"продава Двустаен апартамент, 58 м2",100 148€195 872BGN,"София, Суха Река",https://www.imoti.net/bg/obiava/prodava/sofia/suha-reka/dvustaen/6096692/?sid=gFM8jD&page=1,продава Двустаен апартамент, 58 м2,АДРЕС Недвижими имоти АД,Етаж: 4 от 5,Цена на /м2/:1 727EUR/3 377.11BGN,"Двустайно жилище състоящо се от: антре, дневна с кухненски бокс, спралня, баня с тоалетна и тераса. Към жилището има прилежащо мазе.Има възможност за закупуване на паркомясто.",False,5,2025-08-11 18:02:50.567611,https://www.imoti.net/bg/obiavi/r/prodava/sofia/?page=1&sid=gFM8jD,352
"продава Двустаен апартамент, 46 м2",100 148€195 872BGN,"София, Суха Река",https://www.imoti.net/bg/obiava/prodava/sofia/suha-reka/dvustaen/6095588/?sid=gFM8jD&page=1,продава Двустаен апартамент, 46 м2,Имотека,Етаж: 4 от 5,Цена на /м2/:2 177EUR/4 258.10BGN,Предлагаме за продажба пред АКТ 14двустайно ателие номер 1Разпределение:▪ входно антре▪  дневна с кухненски бокс▪ самостоятелна спалня,False,2,2025-08-11 18:02:50.568100,https://www.imoti.net/bg/obiavi/r/prodava/sofia/?page=1&sid=gFM8jD,352
"продава Двустаен апартамент, 62 м2",106 185€207 680BGN,"София, Суха Река",https://www.imoti.net/bg/obiava/prodava/sofia/suha-reka/dvustaen/6096691/?sid=gFM8jD&page=1,продава Двустаен апартамент, 62 м2,АДРЕС Недвижими имоти АД,Етаж: 4 от 5,Цена на /м2/:1 713EUR/3 349.67BGN,"Двустайно жилище състоящо се от: антре, дневна с кухненски бокс, спралня, баня с тоалетна и тераса. Към жилището има прилежащо мазе.Има възможност за закупуване на паркомясто.",False,5,2025-08-11 18:02:50.568588,https://www.imoti.net/bg/obiavi/r/prodava/sofia/?page=1&sid=gFM8jD,352
"продава Двустаен апартамент, 49 м2",106 185€207 680BGN,"София, Суха Река",https://www.imoti.net/bg/obiava/prodava/sofia/suha-reka/dvustaen/6095587/?sid=gFM8jD&page=1,продава Двустаен апартамент, 49 м2,Имотека,Етаж: 4 от 5,Цена на /м2/:2 167EUR/4 238.36BGN,Предлагаме за продажба пред АКТ 14двустаен апартамент №2Разпределение:▪ входно антре▪ просторна дневна с кухненски бокс▪ самостоятелна спалня...,False,2,2025-08-11 18:02:50.569074,https://www.imoti.net/bg/obiavi/r/prodava/sofia/?page=1&sid=gFM8jD,352
"продава Двустаен апартамент, 70 м2",112 000€219 053BGN,"София, Подуене",https://www.imoti.net/bg/obiava/prodava/sofia/poduene/dvustaen/6106676/?sid=gFM8jD&page=1,продава Двустаен апартамент, 70 м2,ХОУМЛАЙТ,Етаж: 3 от 6,Цена на /м2/:1 600EUR/3 129.33BGN,"Хоумлайт Ви представя за продажба двустаен апартамент в кв. Подуяне.Имотът се намира в малка бутикова жилищна сграда в процес на строителство, разположена на комуникативна локация, с удобен...",False,6,2025-08-11 18:02:50.569602,https://www.imoti.net/bg/obiavi/r/prodava/sofia/?page=1&sid=gFM8jD,352
"продава Двустаен апартамент, 59 м2",112 462€219 957BGN,"София, Суха Река",https://www.imoti.net/bg/obiava/prodava/sofia/suha-reka/dvustaen/6096693/?sid=gFM8jD&page=1,продава Двустаен апартамент, 59 м2,АДРЕС Недвижими имоти АД,Етаж: 2 от 5,Цена на /м2/:1 906EUR/3 728.08BGN,"Двустаен апартамент състоящ се от: антре, дневна с кухненски бокс, спралня, баня с тоалетна и тераса. Към жилището има прилежащо мазе.Има възможност за закупуване на паркомясто.",False,5,2025-08-11 18:02:50.570072,https://www.imoti.net/bg/obiavi/r/prodava/sofia/?page=1&sid=gFM8jD,352
"продава Двустаен апартамент, 46 м2",112 462€219 957BGN,"София, Суха Река",https://www.imoti.net/bg/obiava/prodava/sofia/suha-reka/dvustaen/6101634/?sid=gFM8jD&page=1,продава Двустаен апартамент, 46 м2,ARCO REAL ESTATE,Етаж: 2 от 5,Цена на /м2/:2 445EUR/4 781.66BGN,"ARCO REAL ESTATE представя: Двустаен апартамент в нова кооперация с АКТ 14 в кв.Сухата река.Апартамент 1 е на ет.1-ви над гаражи, със застроена площ 43..67 кв.м. с западно изложение....",False,2,2025-08-11 18:02:50.570608,https://www.imoti.net/bg/obiavi/r/prodava/sofia/?page=1&sid=gFM8jD,352
"продава Двустаен апартамент, 47 м2",113 650€222 280BGN,"София, Суха Река",https://www.imoti.net/bg/obiava/prodava/sofia/suha-reka/dvustaen/6095589/?sid=gFM8jD&page=1,продава Двустаен апартамент, 47 м2,Имотека,Етаж: 2 от 5,Цена на /м2/:2 418EUR/4 729.36BGN,"Предлагаме за продажба пред АКТ 14двустаен апартамент №1,разположен на втори етаж в модерна сграда ново строителствоРазпределение:▪ входно антре",False,2,2025-08-11 18:02:50.571107,https://www.imoti.net/bg/obiavi/r/prodava/sofia/?page=1&sid=gFM8jD,352
"продава Тристаен апартамент, 84 м2",125 000€244 479BGN,"София, Суха Река",https://www.imoti.net/bg/obiava/prodava/sofia/suha-reka/tristaen/5675521/?sid=gFM8jD&page=1,продава Тристаен апартамент, 84 м2,Явлена Изток,Етаж: 6 от 8,Цена на /м2/:1 488EUR/2 910.46BGN,"Явлена-Изток продава 3-стаен апартамент 84 кв.м. в ж.к. Сухата река. Състоящ се от: дневна, две спални, кухня, баня, тоалетна, мокро помещение, гардеробно и две тераси. Сградата е панел от 1974г....",False,12,2025-08-11 18:02:50.571583,https://www.imoti.net/bg/obiavi/r/prodava/sofia/?page=1&sid=gFM8jD,352
"продава Двустаен апартамент, 47 м2",125 000€244 479BGN,"София, Подуене",https://www.imoti.net/bg/obiava/prodava/sofia/poduene/dvustaen/6044314/?sid=gFM8jD&page=1,продава Двустаен апартамент, 47 м2,Юпитер-8,Етаж: 1 от 9,Цена на /м2/:2 660EUR/5 201.68BGN,"Нов среден южен партерен имот със статут офис. Сграда с Акт 16 от 2024 г.ТЕЦ.Топ - локация в широк център, непосредствено до ул. Черковна. Сградата е на 200 метра от метростанция, 1040 м....",False,6,2025-08-11 18:02:50.572045,https://www.imoti.net/bg/obiavi/r/prodava/sofia/?page=1&sid=gFM8jD,352
"продава Двустаен апартамент, 47 м2",125 000€244 479BGN,"София, Оборище",https://www.imoti.net/bg/obiava/prodava/sofia/oborishte/dvustaen/6044316/?sid=gFM8jD&page=1,продава Двустаен апартамент, 47 м2,Юпитер-8,Етаж: 1 от 9,Цена на /м2/:2 660EUR/5 201.68BGN,"Нов среден южен партерен имот със статут офис. Сграда с Акт 16 от 2024 г.ТЕЦ.Топ - локация в широк център, непосредствено до ул. Черковна. Сградата е на 200 метра от метростанция, 1040 м....",False,9,2025-08-11 18:02:50.572512,https://www.imoti.net/bg/obiavi/r/prodava/sofia/?page=1&sid=gFM8jD,352
"продава Двустаен апартамент, 80 м2",128 000€250 346BGN,"София, Подуене",https://www.imoti.net/bg/obiava/prodava/sofia/poduene/dvustaen/6106527/?sid=gFM8jD&page=1,продава Двустаен апартамент, 80 м2,ХОУМЛАЙТ,Етаж: 1 от 6,Цена на /м2/:1 600EUR/3 129.33BGN,"Хоумлайт Ви представя за продажба двустаен апартамент в кв. Подуяне.Имотът се намира в малка бутикова жилищна сграда в процес на строителство, разположена на комуникативна локация, с удобен...",False,5,2025-08-11 18:02:50.573041,https://www.imoti.net/bg/obiavi/r/prodava/sofia/?page=1&sid=gFM8jD,352
"продава Двустаен апартамент, 77 м2",138 726€271 324BGN,"София, Суха Река",https://www.imoti.net/bg/obiava/prodava--v-stroej/sofia/suha-reka/dvustaen/5899149/?sid=gFM8jD&page=1,продава Двустаен апартамент, 77 м2,ЕКС НВД,Етаж: 4 от 6,Цена на /м2/:1 802EUR/3 523.69BGN,"Компания `ЕКС` представя на Вашето внимание двустаен апартамент в жк Сухата река.МЕСТОПОЛОЖЕНИЕ: В близост до спирка на градски транспорт, детска градина, училище, магазини от...",False,2,2025-08-11 18:02:50.573610,https://www.imoti.net/bg/obiavi/r/prodava/sofia/?page=1&sid=gFM8jD,352
"продава Двустаен апартамент, 77 м2",139 000€271 860BGN,"София, Суха Река",https://www.imoti.net/bg/obiava/prodava--v-stroej/sofia/suha-reka/dvustaen/5900575/?sid=gFM8jD&page=1,продава Двустаен апартамент, 77 м2,ЕКС НВД,Етаж: 5 от 6,Цена на /м2/:1 805EUR/3 530.64BGN,"Компания `ЕКС` представя на Вашето внимание двустаен апартамент в жк Сухата река.МЕСТОПОЛОЖЕНИЕ: В близост до спирка на градски транспорт, детска градина, училище, магазини от...",False,2,2025-08-11 18:02:50.574111,https://www.imoti.net/bg/obiavi/r/prodava/sofia/?page=1&sid=gFM8jD,352
"продава Двустаен апартамент, 60 м2",145 000€283 595BGN,"София, Суха Река",https://www.imoti.net/bg/obiava/prodava/sofia/suha-reka/dvustaen/6102304/?sid=gFM8jD&page=1,продава Двустаен апартамент, 60 м2,МИРАДОР НЕДВИЖИМИ ИМОТИ,Етаж: 1 от 8,Цена на /м2/:2 417EUR/4 726.59BGN,"Mirador Real Estates има удоволствието да Ви представим двустаен апартамент, 60кв.м гр.София, кв. Сухата река. В близост до метростанция (3 мин.пеша), училище, детска градина, парк Герена....",False,12,2025-08-11 18:02:50.574585,https://www.imoti.net/bg/obiavi/r/prodava/sofia/?page=1&sid=gFM8jD,352
"продава Двустаен апартамент, 60 м2",155 000€303 154BGN,"София, Суха Река",https://www.imoti.net/bg/obiava/prodava/sofia/suha-reka/dvustaen/6098362/?sid=gFM8jD&page=1,продава Двустаен апартамент, 60 м2,Титан Пропъртис София,Етаж: 2 от 8,Цена на /м2/:2 583EUR/5 052.56BGN,"Открийте мястото, където ще се чувствате у дома от първия момент.Титан Пропъртис- офис Хиподрума с радост предлага на Вашето внимание двустаен апартамент в ж.к. Сухата река, София....",False,3,2025-08-11 18:02:50.575051,https://www.imoti.net/bg/obiavi/r/prodava/sofia/?page=1&sid=gFM8jD,352
"продава Тристаен апартамент, 63 м2",160 000€312 933BGN,"София, Суха Река",https://www.imoti.net/bg/obiava/prodava/sofia/suha-reka/tristaen/6094846/?sid=gFM8jD&page=1,продава Тристаен апартамент, 63 м2,Имоти Премиер,Етаж: 3 от 3,Цена на /м2/:2 540EUR/4 967.19BGN,,False,16,2025-08-11 18:02:50.575575,https://www.imoti.net/bg/obiavi/r/prodava/sofia/?page=1&sid=gFM8jD,352
"продава Двустаен апартамент, 138 м2",162 000€316 844BGN,"София, Подуене",https://www.imoti.net/bg/obiava/prodava/sofia/poduene/dvustaen/6106677/?sid=gFM8jD&page=1,продава Двустаен апартамент, 138 м2,ХОУМЛАЙТ,Етаж: 6 от 6,Цена на /м2/:1 174EUR/2 295.97BGN,"Хоумлайт Ви представя за продажба двустаен апартамент в кв. Подуяне.Имотът се намира в малка бутикова жилищна сграда в процес на строителство, разположена на комуникативна локация, с удобен...",False,6,2025-08-11 18:02:50.576098,https://www.imoti.net/bg/obiavi/r/prodava/sofia/?page=1&sid=gFM8jD,352
"продава Тристаен апартамент, 110 м2",165 000€322 712BGN,"София, Редута",https://www.imoti.net/bg/obiava/prodava/sofia/reduta/tristaen/5648674/?sid=gFM8jD&page=1,продава Тристаен апартамент, 110 м2,частно лице,Етаж: 1 от 5,Цена на /м2/:1 500EUR/2 933.75BGN,"достъп от ул. Поп Харитон, на 6м , от улична регулация( самостоятелен вход) . На кота терен ( партер) 75 кв.м., на кота сутерен (-3.00m)-35кв.м. Общо 110кв.м. чиста застроена площ ( без общите...",False,6,2025-08-11 18:02:50.576573,https://www.imoti.net/bg/obiavi/r/prodava/sofia/?page=1&sid=gFM8jD,352
"продава Двустаен апартамент, 61 м2",169 000€330 535BGN,"София, Суха Река",https://www.imoti.net/bg/obiava/prodava/sofia/suha-reka/dvustaen/6056399/?sid=gFM8jD&page=1,продава Двустаен апартамент, 61 м2,АДРЕС Недвижими имоти АД,Етаж: 2 от 4,Цена на /м2/:2 770EUR/5 418.61BGN,"Слънчев и топъл апартамент в четириетажна тухлена сграда.Районът е чист и спокоен, с прекрасни, добре поддържани тревни площи и безпроблемно паркиране.",False,13,2025-08-11 18:02:50.577036,https://www.imoti.net/bg/obiavi/r/prodava/sofia/?page=1&sid=gFM8jD,352
"продава Двустаен апартамент, 60 м2",176 600€345 400BGN,"София, Дианабад",https://www.imoti.net/bg/obiava/prodava--v-stroej/sofia/dianabad/dvustaen/6082472/?sid=gFM8jD&page=1,продава Двустаен апартамент, 60 м2,ИРИДА НЕДВИЖИМИ ИМОТИ,Етаж: 2 от 7,Цена на /м2/:2 943EUR/5 756.66BGN,"Начален етап на строителство!!!ИРИДА НЕДВИЖИМИ ИМОТИ продава голям двустаен апартамент в новоизграждаща се сграда, с изключително висококачествено строителство от доказан инвеститор...",False,4,2025-08-11 18:02:50.577552,https://www.imoti.net/bg/obiavi/r/prodava/sofia/?page=1&sid=gFM8jD,352
"продава Двустаен апартамент, 74 м2",178 500€349 116BGN,"София, Суха Река",https://www.imoti.net/bg/obiava/prodava--v-stroej/sofia/suha-reka/dvustaen/6087356/?sid=gFM8jD&page=2,продава Двустаен апартамент, 74 м2,SUPRIMMO,Етаж:  от 6,Цена на /м2/:2 412EUR/4 717.78BGN,"Представяме просторен, южен двустаен имот за продажба в спокоен и зелен район, на 10 мин пеша от парк ""Герена"".Имотът е разположен на 4-ти етаж от 6. Сградата е построена от...",False,1,2025-08-11 18:02:54.893094,https://www.imoti.net/bg/obiavi/r/prodava/sofia/?page=1&sid=gFM8jD,352
"продава Двустаен апартамент, 64 м2",179 424€350 923BGN,"София, Оборище",https://www.imoti.net/bg/obiava/prodava/sofia/oborishte/dvustaen/6064453/?sid=gFM8jD&page=2,продава Двустаен апартамент, 64 м2,Титан Пропъртис,Етаж: 2 от 6,Цена на /м2/:2 804EUR/5 483.17BGN,"Открийте мястото, където ще се чувствате у дома от първия момент!Титан Пропъртис с радост предлага на Вашето внимание елегантен двустаен апартамент в кв. Оборище, София. Сградата е...",False,10,2025-08-11 18:02:54.893616,https://www.imoti.net/bg/obiavi/r/prodava/sofia/?page=1&sid=gFM8jD,352
"продава Двустаен апартамент, 64 м2",179 424€350 923BGN,"София, Оборище",https://www.imoti.net/bg/obiava/prodava/sofia/oborishte/dvustaen/6064349/?sid=gFM8jD&page=2,продава Двустаен апартамент, 64 м2,Титан Пропъртис,Етаж: 4 от 6,Цена на /м2/:2 804EUR/5 483.17BGN,"Открийте мястото, където ще се чувствате у дома от първия момент!Титан Пропъртис с радост предлага на Вашето внимание елегантен двустаен апартамент в кв. Оборище, София. Сградата е...",False,10,2025-08-11 18:02:54.894076,https://www.imoti.net/bg/obiavi/r/prodava/sofia/?page=1&sid=gFM8jD,352
