title,price_and_currency,location,details_url,property_type,area,agency,floor,price_per_m2,description,is_top_ad,num_photos,date_added,search_url,total_offers
"продава Тристаен апартамент, 113 м2",316 400€618 825BGN,"София, Суха Река",https://www.imoti.net/bg/obiava/prodava--v-stroej/sofia/suha-reka/tristaen/5971906/?sid=gFM8jD&page=6,продава Тристаен апартамент, 113 м2,Елеганс Естейт,Етаж: 5 от 10,Цена на /м2/:2 800EUR/5 476.32BGN,АКТ 14!!!НА 1 МИН. ОТ МЕТРОТО! НА 10 МИН. ОТ КУБЕТАТА НА ХРАМ ПАМЕТНИК АЛЕКСАНДЪР НЕВСКИ!Ексклузивно предложение!Това е една от най-красивите сгради в София....,False,6,2025-08-11 18:03:10.660499,https://www.imoti.net/bg/obiavi/r/prodava/sofia/?page=1&sid=gFM8jD,352
"продава Тристаен апартамент, 117 м2",317 620€621 211BGN,"София, Дианабад",https://www.imoti.net/bg/obiava/prodava--v-stroej/sofia/dianabad/tristaen/6017652/?sid=gFM8jD&page=6,продава Тристаен апартамент, 117 м2,Luximmo Finest Estates,Етаж:  от 15,Цена на /м2/:2 715EUR/5 309.49BGN,"Ексклузивно представяме за продажба комфортен тристаен апартамент №7.52 в сграда S-Tower - нов проект с отличителен дизайн, висок клас на изпълнение, комуникативна локация и отлична възможност за...",False,12,2025-08-11 18:03:10.661010,https://www.imoti.net/bg/obiavi/r/prodava/sofia/?page=1&sid=gFM8jD,352
"продава Тристаен апартамент, 98 м2",319 000€623 910BGN,"София, Изток",https://www.imoti.net/bg/obiava/prodava/sofia/sofija-iztok/tristaen/6079386/?sid=gFM8jD&page=6,продава Тристаен апартамент, 98 м2,Скала Ди недвижими имоти,Етаж: 2 от 4,Цена на /м2/:3 255EUR/6 366.43BGN,"Скала Ди предлага имот с уникална локация в престижния кв. Изток. Комуникативно място, на пешеходно разстояние от Метростанция и автобусна спирка, В близост до детска ясла и детска градина,...",False,12,2025-08-11 18:03:10.661529,https://www.imoti.net/bg/obiavi/r/prodava/sofia/?page=1&sid=gFM8jD,352
"продава Двустаен апартамент, 68 м2",320 000€625 866BGN,"София, Оборище",https://www.imoti.net/bg/obiava/prodava/sofia/oborishte/dvustaen/6106651/?sid=gFM8jD&page=6,продава Двустаен апартамент, 68 м2,Революшън Естейт България,Етаж: 5 от 9,Цена на /м2/:4 706EUR/9 203.91BGN,"Референтен номер: 2095368Революшън Естейт представя Двустаен в ж.к. Оборище.- Етаж: 5-ти от 9-ти.- Площ: 68.44 кв.м- Разпределение: входно антре,...",False,7,2025-08-11 18:03:10.662004,https://www.imoti.net/bg/obiavi/r/prodava/sofia/?page=1&sid=gFM8jD,352
"продава Двустаен апартамент, 88 м2",320 000€625 866BGN,"София, Изгрев",https://www.imoti.net/bg/obiava/prodava/sofia/sofija-izgrev/dvustaen/5988906/?sid=gFM8jD&page=6,продава Двустаен апартамент, 88 м2,АРСЕНАЛ - недвижими имоти,Етаж: 2 от 17,Цена на /м2/:3 636EUR/7 112.11BGN,.  .  .  .  .  .  .  .  .  .  .  .  .  .  .  .  .  .  .  .  .  .  .  .  .  .  .  .  .  . ПРЕУСТРОЕН .  .  .  .  .  .  .  .  .  .  .  .  .  .  .  .  .  .  .  .  .  .  .  .  .  .  .  .  .  .В...,False,10,2025-08-11 18:03:10.662457,https://www.imoti.net/bg/obiavi/r/prodava/sofia/?page=1&sid=gFM8jD,352
"продава Тристаен апартамент, 117 м2",320 000€625 866BGN,"София, Оборище",https://www.imoti.net/bg/obiava/prodava/sofia/oborishte/tristaen/6083153/?sid=gFM8jD&page=6,продава Тристаен апартамент, 117 м2,АДРЕС Недвижими имоти АД,Етаж: 2 от 11,Цена на /м2/:2 735EUR/5 349.28BGN,"Тристаен апартамент, в нов, модерен затворен комплекс в престижния квартал ""Оборище"", на метри от парк ""Заимов"".Имотът е разположен във вход ""Е"", на втори етаж и е с...",False,4,2025-08-11 18:03:10.662919,https://www.imoti.net/bg/obiavi/r/prodava/sofia/?page=1&sid=gFM8jD,352
"продава Тристаен апартамент, 68 м2",320 000€625 866BGN,"София, Оборище",https://www.imoti.net/bg/obiava/prodava/sofia/oborishte/tristaen/6106734/?sid=gFM8jD&page=6,продава Тристаен апартамент, 68 м2,БАС Пропъртис,Етаж: 5 от 9,Цена на /м2/:4 706EUR/9 203.91BGN,"Реф. № 012233Агенция за недвижими имоти BAS Properties предлага за продажба обзаведен апартамент в престижния кв. Оборище, в непосредствена близост до парк „Заимов“. Имотът се...",False,16,2025-08-11 18:03:10.663386,https://www.imoti.net/bg/obiavi/r/prodava/sofia/?page=1&sid=gFM8jD,352
"продава Четиристаен апартамент, 115 м2",320 000€625 866BGN,"София, Изток",https://www.imoti.net/bg/obiava/prodava/sofia/sofija-iztok/chetiristaen/5608324/?sid=gFM8jD&page=6,продава Четиристаен апартамент, 115 м2,АРСЕНАЛ - недвижими имоти,Етаж: 2 от 9,Цена на /м2/:2 783EUR/5 442.31BGN,".  .  .  .  .  .  .  .  .  .  .  ЩЕ .  .  .  .  .  .  .  .  .  .  .  .  .  .  .  .  .  .  .  .  . Ви предложим 'многофункционален' имот, ПОДХОДЯЩ както за жилище, така и за офис. Апартаментът се...",False,10,2025-08-11 18:03:10.663871,https://www.imoti.net/bg/obiavi/r/prodava/sofia/?page=1&sid=gFM8jD,352
"продава Тристаен апартамент, 144 м2",320 000€625 866BGN,"София, Оборище",https://www.imoti.net/bg/obiava/prodava--v-stroej/sofia/oborishte/tristaen/6037232/?sid=gFM8jD&page=6,продава Тристаен апартамент, 144 м2,ЮНИК ЕСТЕЙТС,Етаж: 2 от 6,Цена на /м2/:2 222EUR/4 346.29BGN,"Unique Estates представя на Вашето внимание един просторен тристаен апартамент с площ от 144кв.м., в новострояща се сграда в близост до ул. Черковна.",False,4,2025-08-11 18:03:10.664346,https://www.imoti.net/bg/obiavi/r/prodava/sofia/?page=1&sid=gFM8jD,352
"продава Двустаен апартамент, 75 м2",325 000€635 645BGN,"София, Изток",https://www.imoti.net/bg/obiava/prodava/sofia/sofija-iztok/dvustaen/6023443/?sid=gFM8jD&page=6,продава Двустаен апартамент, 75 м2,ХОУМЛАЙТ,Етаж: 9 от 10,Цена на /м2/:4 333EUR/8 475.26BGN,"ХОУМ ЛАЙТ Ви предлага уютен, двустаен апартамент на перфектна локация в кв. Изток!Жилището се намира на девети етаж в тухлена сграда, разположена в непосредствена близост до парк...",False,11,2025-08-11 18:03:10.664882,https://www.imoti.net/bg/obiavi/r/prodava/sofia/?page=1&sid=gFM8jD,352
"продава Тристаен апартамент, 108 м2",325 000€635 645BGN,"София, Редута",https://www.imoti.net/bg/obiava/prodava/sofia/reduta/tristaen/6102303/?sid=gFM8jD&page=6,продава Тристаен апартамент, 108 м2,МИРАДОР НЕДВИЖИМИ ИМОТИ,Етаж: 3 от 4,Цена на /м2/:3 009EUR/5 885.60BGN,"Mirador Real Estates има удоволствието да Ви представи разкошен тристаен апартамент,срещу Мол Сердика, на втора линия от булевард Ситняково .Намира се на тиха вътрешна уличка със...",False,7,2025-08-11 18:03:10.665355,https://www.imoti.net/bg/obiavi/r/prodava/sofia/?page=1&sid=gFM8jD,352
"продава Тристаен апартамент, 125 м2",327 132€639 815BGN,"София, Суха Река",https://www.imoti.net/bg/obiava/prodava--v-stroej/sofia/suha-reka/tristaen/5829598/?sid=gFM8jD&page=6,продава Тристаен апартамент, 125 м2,Luximmo Finest Estates,Етаж:  от 10,Цена на /м2/:2 617EUR/5 118.52BGN,"Представяме тристаен апартамент в чисто нова бутикова сграда с отлична локация в кв. „Сухата река“. В непосредствена близост се намира метростанция „Хаджи Димитър“, а популярният парк „Заимов“,...",False,5,2025-08-11 18:03:10.665883,https://www.imoti.net/bg/obiavi/r/prodava/sofia/?page=1&sid=gFM8jD,352
"продава Тристаен апартамент, 81 м2",328 000€641 512BGN,"София, Оборище",https://www.imoti.net/bg/obiava/prodava/sofia/oborishte/tristaen/6086676/?sid=gFM8jD&page=6,продава Тристаен апартамент, 81 м2,БАС Пропъртис,Етаж: 2 от 4,Цена на /м2/:4 049EUR/7 919.90BGN,"Реф. № 012053Агенция за недвижими имоти BAS Properties предлага за продажба тристаен апартамент, разположен в престижния кв. Оборище, гр. София. Имотът е обзаведен, вътрешен, с...",False,10,2025-08-11 18:03:10.666349,https://www.imoti.net/bg/obiavi/r/prodava/sofia/?page=1&sid=gFM8jD,352
"продава Тристаен апартамент, 97 м2",330 000€645 424BGN,"София, Редута",https://www.imoti.net/bg/obiava/prodava/sofia/reduta/tristaen/6047262/?sid=gFM8jD&page=6,продава Тристаен апартамент, 97 м2,Революшън Естейт България,Етаж: 3 от 5,Цена на /м2/:3 402EUR/6 653.85BGN,"Революшън Естейт представя на Вашето внимание тристаен апартамент в ж.к. Редута.Намира се на комуникативно място в близост до ясли, детски градини, парк Гео Милев, спирки на градски...",False,15,2025-08-11 18:03:10.666828,https://www.imoti.net/bg/obiavi/r/prodava/sofia/?page=1&sid=gFM8jD,352
"продава Тристаен апартамент, 119 м2",332 000€649 336BGN,"София, Редута",https://www.imoti.net/bg/obiava/prodava/sofia/reduta/tristaen/6031547/?sid=gFM8jD&page=6,продава Тристаен апартамент, 119 м2,Явлена Изток,Етаж: 0 от 8,Цена на /м2/:2 790EUR/5 456.60BGN,"Явлена-Изток представя тристаен апартамент в квартал Редута, на комуникативно място и добра локация. ПРЕД АКТ 16!Апартамента е непреходен, със северозападно изложение, на партерен етаж с...",False,8,2025-08-11 18:03:10.667289,https://www.imoti.net/bg/obiavi/r/prodava/sofia/?page=1&sid=gFM8jD,352
"продава Двустаен апартамент, 74 м2",333 000€651 291BGN,"София, Дианабад",https://www.imoti.net/bg/obiava/prodava/sofia/dianabad/dvustaen/6088416/?sid=gFM8jD&page=6,продава Двустаен апартамент, 74 м2,ЮНИК ЕСТЕЙТС,Етаж: 1 от 6,Цена на /м2/:4 500EUR/8 801.24BGN,"Unique estates има удоволствието да ви представи на вашето внимание едно изключително предложение за продажба – прекрасно обзаведен двустаен апартамент, разположен в...",False,10,2025-08-11 18:03:10.667791,https://www.imoti.net/bg/obiavi/r/prodava/sofia/?page=1&sid=gFM8jD,352
"продава Тристаен апартамент, 100 м2",335 000€655 203BGN,"София, Изток",https://www.imoti.net/bg/obiava/prodava--v-stroej/sofia/sofija-iztok/tristaen/5716842/?sid=gFM8jD&page=6,продава Тристаен апартамент, 100 м2,Luximmo Finest Estates,Етаж:  от 14,Цена на /м2/:3 350EUR/6 552.03BGN,"Ексклузивно представяме автентично тристайно жилище от 80-те години, с обща площ 100 кв.м, за продажба в престижния столичен кв. ""Изток"".Местоположението на имота е на емблематичната...",False,5,2025-08-11 18:03:10.668302,https://www.imoti.net/bg/obiavi/r/prodava/sofia/?page=1&sid=gFM8jD,352
"продава Двустаен апартамент, 139 м2",335 328€655 845BGN,"София, Редута",https://www.imoti.net/bg/obiava/prodava--v-stroej/sofia/reduta/dvustaen/6079631/?sid=gFM8jD&page=6,продава Двустаен апартамент, 139 м2,Ера Идеа,Етаж: 5 от 6,Цена на /м2/:2 412EUR/4 718.31BGN,"ЕРА Идеа предлага тристаен апартамент в нова  жилищна сграда в кв. ""Редута"" - на 200м. от парк ""Гео Милев"", най -привлекателната част на квартала.Апартаментът се намира на 5ти жилищен етаж....",False,2,2025-08-11 18:03:10.668779,https://www.imoti.net/bg/obiavi/r/prodava/sofia/?page=1&sid=gFM8jD,352
"продава Тристаен апартамент, 139 м2",335 328€655 845BGN,"София, Редута",https://www.imoti.net/bg/obiava/prodava--v-stroej/sofia/reduta/tristaen/6070498/?sid=gFM8jD&page=7,продава Тристаен апартамент, 139 м2,Luximmo Finest Estates,Етаж:  от 6,Цена на /м2/:2 412EUR/4 718.31BGN,"Предлагаме на Вашето внимание тристаен апартамент, разположен на пети етаж в модерна жилищна сграда в един от най-предпочитаните райони на столицата – кв. Редута. Имотът е с обща площ от 53.70...",False,4,2025-08-11 18:03:14.927564,https://www.imoti.net/bg/obiavi/r/prodava/sofia/?page=1&sid=gFM8jD,352
"продава Тристаен апартамент, 130 м2",344 645€674 067BGN,"София, Дианабад",https://www.imoti.net/bg/obiava/prodava--v-stroej/sofia/dianabad/tristaen/5805229/?sid=gFM8jD&page=7,продава Тристаен апартамент, 130 м2,Luximmo Finest Estates,Етаж:  от 15,Цена на /м2/:2 651EUR/5 185.13BGN,"Ексклузивно представяме за продажба тристаен апартамент в сграда S-Tower - нов проект с отличителен дизайн, висок клас на изпълнение, комуникативна локация и отлична възможност за инвестиция....",False,12,2025-08-11 18:03:14.928127,https://www.imoti.net/bg/obiavi/r/prodava/sofia/?page=1&sid=gFM8jD,352
"продава Многостаен апартамент, 145 м2",349 000€682 585BGN,"София, Изток",https://www.imoti.net/bg/obiava/prodava/sofia/sofija-iztok/mnogostaen/6002209/?sid=gFM8jD&page=7,продава Многостаен апартамент, 145 м2,Явлена София,Етаж: 2 от 6,Цена на /м2/:2 407EUR/4 707.48BGN,"ПРОСТОРЕН!!! ИМОТ С ПОТЕНЦИАЛ !!! В ТИХАТА ЧАСТ НА КВ.ИЗТОК!!! Явлена представя на Вашето внимание многостаен апартамент находящ се в един от най-предпочитаните квартали в столицата, а именно...",False,10,2025-08-11 18:03:14.928650,https://www.imoti.net/bg/obiavi/r/prodava/sofia/?page=1&sid=gFM8jD,352
"продава Четиристаен апартамент, 114 м2",350 000€684 541BGN,"София, Оборище",https://www.imoti.net/bg/obiava/prodava--v-stroej/sofia/oborishte/chetiristaen/5897035/?sid=gFM8jD&page=7,продава Четиристаен апартамент, 114 м2,SUPRIMMO,Етаж:  от 6,Цена на /м2/:3 070EUR/6 004.74BGN,"Представяме на Вашето внимание четиристаен апартамент за продажба в бутикова жилищна сграда в престижния столичен квартал “Оборище”.Разположен в живописното спокойствие на уединена улица,...",False,5,2025-08-11 18:03:14.929112,https://www.imoti.net/bg/obiavi/r/prodava/sofia/?page=1&sid=gFM8jD,352
"продава Тристаен апартамент, 102 м2",350 000€684 541BGN,"София, Изток",https://www.imoti.net/bg/obiava/prodava/sofia/sofija-iztok/tristaen/5944672/?sid=gFM8jD&page=7,продава Тристаен апартамент, 102 м2,АДРЕС Недвижими имоти АД,Етаж: 2 от 5,Цена на /м2/:3 431EUR/6 711.18BGN,"Тристаен, непреходен апартамент със застроена площ от 101,6 кв.м. на ет. 2. Разпределение: коридор, всекидневна с трапезария, отделна кухня, две спални, баня с тоалетна, тоалетна,...",False,16,2025-08-11 18:03:14.929578,https://www.imoti.net/bg/obiavi/r/prodava/sofia/?page=1&sid=gFM8jD,352
"продава Тристаен апартамент, 116 м2",352 700€689 821BGN,"София, Редута",https://www.imoti.net/bg/obiava/prodava--v-stroej/sofia/reduta/tristaen/6054933/?sid=gFM8jD&page=7,продава Тристаен апартамент, 116 м2,Ера Идеа,Етаж: 5 от 6,Цена на /м2/:3 041EUR/5 946.73BGN,"ЕРА Идеа предлага в продажба тристаен апартамент - ново строителство в кв. Редута! Жилището се намира на 5ти етаж в бутикова жилищна сграда, която се строи в най - хубавата част на квартала! В...",False,3,2025-08-11 18:03:14.930024,https://www.imoti.net/bg/obiavi/r/prodava/sofia/?page=1&sid=gFM8jD,352
"продава Двустаен апартамент, 135 м2",354 000€692 364BGN,"София, Дианабад",https://www.imoti.net/bg/obiava/prodava/sofia/dianabad/dvustaen/5682489/?sid=gFM8jD&page=7,продава Двустаен апартамент, 135 м2,BULGARIAN PROPERTIES,Етаж: 3,Цена на /м2/:2 622EUR/5 128.62BGN,"За повече информация свържете се с нас и цитирайте референтния номер на имота. Моля, кажете, че сте видeли обявата в imoti.net.Референтен номер: Sfa 80351Тел: 0882 817...",False,18,2025-08-11 18:03:14.930542,https://www.imoti.net/bg/obiavi/r/prodava/sofia/?page=1&sid=gFM8jD,352
"продава Тристаен апартамент, 100 м2",355 000€694 320BGN,"София, Изток",https://www.imoti.net/bg/obiava/prodava/sofia/sofija-iztok/tristaen/6087764/?sid=gFM8jD&page=7,продава Тристаен апартамент, 100 м2,частно лице,Етаж: 1 от 5,Цена на /м2/:3 550EUR/6 943.20BGN,"Собственик продава личен тристаен, преходен апартамент в най-спокойните и предпочитане за живеене в София квартал Изток. В близост до Билла / Цариградско Шосе висок партер (над мазета), на 200м от...",False,11,2025-08-11 18:03:14.930987,https://www.imoti.net/bg/obiavi/r/prodava/sofia/?page=1&sid=gFM8jD,352
"продава Многостаен апартамент, 147 м2",356 000€696 275BGN,"София, Оборище",https://www.imoti.net/bg/obiava/prodava/sofia/oborishte/mnogostaen/6013993/?sid=gFM8jD&page=7,продава Многостаен апартамент, 147 м2,АДРЕС Недвижими имоти АД,Етаж: 5 от 6,Цена на /м2/:2 422EUR/4 736.57BGN,"Многостаен апартамент в квартал Оборище, на три нива с обща застроена площ от 147,20 кв. м. състоящ се на първо ниво от дневна и трапезария,кухня, тераса, спалня, баня и тоалетна. Второ ниво:...",False,14,2025-08-11 18:03:14.931425,https://www.imoti.net/bg/obiavi/r/prodava/sofia/?page=1&sid=gFM8jD,352
"продава Тристаен апартамент, 132 м2",360 000€704 099BGN,"София, Суха Река",https://www.imoti.net/bg/obiava/prodava/sofia/suha-reka/tristaen/5937462/?sid=gFM8jD&page=7,продава Тристаен апартамент, 132 м2,АДРЕС Недвижими имоти АД,Етаж: 9 от 10,Цена на /м2/:2 727EUR/5 334.08BGN,"Просторен и светъл тристаен апартамент в сграда до бул.""Мадрид"". Разположен на висок етаж.  Застроена площ от 109 кв.м..Свободни паркоместа на отделна...",False,3,2025-08-11 18:03:14.931883,https://www.imoti.net/bg/obiavi/r/prodava/sofia/?page=1&sid=gFM8jD,352
"продава Тристаен апартамент, 132 м2",360 000€704 099BGN,"София, Оборище",https://www.imoti.net/bg/obiava/prodava/sofia/oborishte/tristaen/6035440/?sid=gFM8jD&page=7,продава Тристаен апартамент, 132 м2,АДРЕС Недвижими имоти АД,Етаж: 9 от 10,Цена на /м2/:2 727EUR/5 334.08BGN,"Просторен и светъл тристаен апартамент в сграда до бул.""Мадрид"". Разположен на висок етаж.  Застроена площ от 109 кв.м..Свободни паркоместа на отделна...",False,2,2025-08-11 18:03:14.932335,https://www.imoti.net/bg/obiavi/r/prodava/sofia/?page=1&sid=gFM8jD,352
"продава Двустаен апартамент, 105 м2",365 995€715 824BGN,"София, Дианабад",https://www.imoti.net/bg/obiava/prodava--v-stroej/sofia/dianabad/dvustaen/6076431/?sid=gFM8jD&page=7,продава Двустаен апартамент, 105 м2,ЮНИК ЕСТЕЙТС,Етаж: 7 от 15,Цена на /м2/:3 486EUR/6 817.37BGN,"Unique Estates представя на Вашето внимание двустаен апартамент за продажба в уникална по рода си сграда, съчетаваща модерна архитектура, първокласно качество на строителство и...",False,9,2025-08-11 18:03:14.932793,https://www.imoti.net/bg/obiavi/r/prodava/sofia/?page=1&sid=gFM8jD,352
"продава Тристаен апартамент, 146 м2",366 365€716 548BGN,"София, Оборище",https://www.imoti.net/bg/obiava/prodava--v-stroej/sofia/oborishte/tristaen/6027028/?sid=gFM8jD&page=7,продава Тристаен апартамент, 146 м2,New Estates,Етаж: 5 от 14,Цена на /м2/:2 509EUR/4 907.86BGN,"New Estates има удоволствието да ви представи 3-стаен апартамент в един от най-престижните жилищни комплекси в центъра на София. Новият отличителен проект се гордее със своя оригинален дизайн,...",False,17,2025-08-11 18:03:14.933237,https://www.imoti.net/bg/obiavi/r/prodava/sofia/?page=1&sid=gFM8jD,352
"продава Тристаен апартамент, 166 м2",367 092€717 970BGN,"София, Суха Река",https://www.imoti.net/bg/obiava/prodava--v-stroej/sofia/suha-reka/tristaen/6091313/?sid=gFM8jD&page=7,продава Тристаен апартамент, 166 м2,Ера Идеа,Етаж: 7 от 9,Цена на /м2/:2 211EUR/4 325.12BGN,"С АКТ 14! ЕРА Идеа предлага тристаен апартамент  в нова жилищна сграда в ж.к. Сухата река. Само  на 100м. от парк ""Родина"", в най - привлекателната част на квартала.Апартаментът се намира на...",False,2,2025-08-11 18:03:14.933698,https://www.imoti.net/bg/obiavi/r/prodava/sofia/?page=1&sid=gFM8jD,352
