title,price_and_currency,location,details_url,property_type,area,agency,floor,price_per_m2,description,is_top_ad,num_photos,date_added,search_url,total_offers
"продава Двустаен апартамент, 63 м2",212 770€416 142BGN,"София, Оборище",https://www.imoti.net/bg/obiava/prodava/sofia/oborishte/dvustaen/6088257/?sid=gFM8jD&page=3,продава Двустаен апартамент, 63 м2,Фортън АД,Етаж: 14 от 14,Цена на /м2/:3 377EUR/6 605.43BGN,Forton Homes представя двустаен апартамент в комплекс от ново поколение в сърцето на София!Проект от затворен тип с иновативни решения за удобство и модерен начин живот.,False,11,2025-08-11 18:02:58.912073,https://www.imoti.net/bg/obiavi/r/prodava/sofia/?page=1&sid=gFM8jD,352
"продава Двустаен апартамент, 63 м2",212 770€416 142BGN,"София, Оборище",https://www.imoti.net/bg/obiava/prodava/sofia/oborishte/dvustaen/6037113/?sid=gFM8jD&page=3,продава Двустаен апартамент, 63 м2,Galiano Estates,Етаж: 14 от 14,Цена на /м2/:3 377EUR/6 605.43BGN,БЕЗ КОМИСИОННА ОТ КУПУВАЧА! Galiano Estates има удоволствието да ви представи разкошен двустаен апартамент в затворен комплекс Teatralna Park Residence в кв. Оборище до парк Заимов и метростанция...,False,6,2025-08-11 18:02:58.912590,https://www.imoti.net/bg/obiavi/r/prodava/sofia/?page=1&sid=gFM8jD,352
"продава Двустаен апартамент, 65 м2",212 770€416 142BGN,"София, Оборище",https://www.imoti.net/bg/obiava/prodava--v-stroej/sofia/oborishte/dvustaen/5847979/?sid=gFM8jD&page=3,продава Двустаен апартамент, 65 м2,ERA Младост,Етаж: 14 от 14,Цена на /м2/:3 273EUR/6 402.18BGN,"Без комисионна! Цена на инвеститор! Ера Младост представя взискателен жилищен комплекс с Централна локация продиктувана от няколко ключови изисквания за проекта:Градски силует, постигнат...",False,7,2025-08-11 18:02:58.913037,https://www.imoti.net/bg/obiavi/r/prodava/sofia/?page=1&sid=gFM8jD,352
"продава Тристаен апартамент, 107 м2",213 340€417 257BGN,"София, Подуене",https://www.imoti.net/bg/obiava/prodava/sofia/poduene/tristaen/5970940/?sid=gFM8jD&page=3,продава Тристаен апартамент, 107 м2,Титан Пропъртис,Етаж: 5 от 9,Цена на /м2/:1 994EUR/3 899.60BGN,"Титан Пропъртис има удоволствието да Ви представи тристаен апартамент в новострояща се жилищна сграда в кв. Подуяне. В близост са разположени множество спирки на градския транспорт, търговски...",False,6,2025-08-11 18:02:58.913496,https://www.imoti.net/bg/obiavi/r/prodava/sofia/?page=1&sid=gFM8jD,352
"продава Тристаен апартамент, 114 м2",217 000€424 415BGN,"София, Суха Река",https://www.imoti.net/bg/obiava/prodava/sofia/suha-reka/tristaen/6035256/?sid=gFM8jD&page=3,продава Тристаен апартамент, 114 м2,АДРЕС Недвижими имоти АД,Етаж: 5 от 6,Цена на /м2/:1 904EUR/3 722.94BGN,"Жилище с отлично функционално и пространстено решение, уникална схема с две спални, едната тип мастер, три изложения!, наличие на складови и гаражни пространства, богато решени общи части с...",False,2,2025-08-11 18:02:58.913936,https://www.imoti.net/bg/obiavi/r/prodava/sofia/?page=1&sid=gFM8jD,352
"продава Двустаен апартамент, 90 м2",217 872€426 121BGN,"София, Редута",https://www.imoti.net/bg/obiava/prodava--v-stroej/sofia/reduta/dvustaen/6070503/?sid=gFM8jD&page=3,продава Двустаен апартамент, 90 м2,Luximmo Finest Estates,Етаж:  от 6,Цена на /м2/:2 421EUR/4 734.67BGN,"Предлагаме на Вашето внимание двустаен апартамент, разположен на трети етаж в модерна жилищна сграда в един от най-предпочитаните райони на столицата – кв. Редута. Имотът е с обща площ от 90.78...",False,4,2025-08-11 18:02:58.914428,https://www.imoti.net/bg/obiavi/r/prodava/sofia/?page=1&sid=gFM8jD,352
"продава Тристаен апартамент, 93 м2",220 000€430 283BGN,"София, Редута",https://www.imoti.net/bg/obiava/prodava/sofia/reduta/tristaen/5989884/?sid=gFM8jD&page=3,продава Тристаен апартамент, 93 м2,Явлена Изток,Етаж: 4 от 7,Цена на /м2/:2 366EUR/4 626.69BGN,"Явлена-Изток продава тристаен апартамент в новострояща се сграда в кв. Редута с площ-93 кв.м. Състоящ  се от: дневна с кухненски бокс и балкон,  две спални от които се излиза на общ балкон , две...",False,6,2025-08-11 18:02:58.914884,https://www.imoti.net/bg/obiavi/r/prodava/sofia/?page=1&sid=gFM8jD,352
"продава Двустаен апартамент, 74 м2",220 680€431 613BGN,"София, Дианабад",https://www.imoti.net/bg/obiava/prodava--v-stroej/sofia/dianabad/dvustaen/6082471/?sid=gFM8jD&page=3,продава Двустаен апартамент, 74 м2,ИРИДА НЕДВИЖИМИ ИМОТИ,Етаж: 2 от 7,Цена на /м2/:2 982EUR/5 832.60BGN,"Начален етап на строителство!!!ИРИДА НЕДВИЖИМИ ИМОТИ продава голям двустаен апартамент в новоизграждаща се сграда, с изключително висококачествено строителство от доказан инвеститор...",False,4,2025-08-11 18:02:58.915382,https://www.imoti.net/bg/obiavi/r/prodava/sofia/?page=1&sid=gFM8jD,352
"продава Тристаен апартамент, 111 м2",222 400€434 977BGN,"София, Суха Река",https://www.imoti.net/bg/obiava/prodava/sofia/suha-reka/tristaen/6065596/?sid=gFM8jD&page=3,продава Тристаен апартамент, 111 м2,АДРЕС Недвижими имоти АД,Етаж: 6 от 9,Цена на /м2/:2 004EUR/3 918.71BGN,"Тристаен апартамент в новострояща се сграда “А” в кв.""Суха река"". Просторен и светъл апартамент с площ 111.20кв.м, сътоящ се от дневна с кухненски бокс,...",False,4,2025-08-11 18:02:58.915838,https://www.imoti.net/bg/obiavi/r/prodava/sofia/?page=1&sid=gFM8jD,352
"продава Двустаен апартамент, 117 м2",225 000€440 062BGN,"София, Суха Река",https://www.imoti.net/bg/obiava/prodava/sofia/suha-reka/dvustaen/6020642/?sid=gFM8jD&page=3,продава Двустаен апартамент, 117 м2,Явлена София,Етаж:,Цена на /м2/:1 923EUR/3 761.21BGN,Явлена предлага за продажба двустаен апартамент на две нива в сграда на етап Акт 14 в квартал Сухата река. Апартаментът е разположен на 6-ти и 7-ми етаж и има застроена площ от 104 кв.м....,False,5,2025-08-11 18:02:58.916335,https://www.imoti.net/bg/obiavi/r/prodava/sofia/?page=1&sid=gFM8jD,352
"продава Тристаен апартамент, 125 м2",225 000€440 062BGN,"София, Суха Река",https://www.imoti.net/bg/obiava/prodava/sofia/suha-reka/tristaen/6065213/?sid=gFM8jD&page=3,продава Тристаен апартамент, 125 м2,АДРЕС Недвижими имоти АД,Етаж: 5 от 6,Цена на /м2/:1 800EUR/3 520.49BGN,"Жилища с отлично функционално и пространстено решение, наличие на складови и гаражни пространства, богато решени общи части с контрол на достъпа. Монолитно изпълнение с тухла,окачени фасади,висок...",False,2,2025-08-11 18:02:58.916786,https://www.imoti.net/bg/obiavi/r/prodava/sofia/?page=1&sid=gFM8jD,352
"продава Тристаен апартамент, 91 м2",226 000€442 018BGN,"София, Суха Река",https://www.imoti.net/bg/obiava/prodava/sofia/suha-reka/tristaen/6106708/?sid=gFM8jD&page=3,продава Тристаен апартамент, 91 м2,Ера Идеа,Етаж: 2 от 5,Цена на /м2/:2 484EUR/4 857.34BGN,"ЕРА Идеа предлага обзаведен тристаен апартамент в ж.к. ""Сухата река"" в сграда, въведена в експлоатация през 2024г. Жилището се намира на първи жилищен етаж над гаражи. Застроената площ на имота е...",False,18,2025-08-11 18:02:58.917224,https://www.imoti.net/bg/obiavi/r/prodava/sofia/?page=1&sid=gFM8jD,352
"продава Тристаен апартамент, 90 м2",226 325€442 653BGN,"София, Оборище",https://www.imoti.net/bg/obiava/prodava--v-stroej/sofia/oborishte/tristaen/5579510/?sid=gFM8jD&page=3,продава Тристаен апартамент, 90 м2,Luximmo Finest Estates,Етаж:  от 6,Цена на /м2/:2 515EUR/4 918.37BGN,"Представяме Ви тристаен апартамент в малка бутикова сграда в кв. ""Оборище"", гр. София.Предварителни продажби. Очаква се Разрешение за строеж. Срок за изпълнение - 18 месеца.",False,3,2025-08-11 18:02:58.917737,https://www.imoti.net/bg/obiavi/r/prodava/sofia/?page=1&sid=gFM8jD,352
"продава Тристаен апартамент, 126 м2",227 000€443 973BGN,"София, Суха Река",https://www.imoti.net/bg/obiava/prodava/sofia/suha-reka/tristaen/6035254/?sid=gFM8jD&page=3,продава Тристаен апартамент, 126 м2,АДРЕС Недвижими имоти АД,Етаж:  от 6,Цена на /м2/:1 802EUR/3 523.60BGN,"Жилище с отлично функционално и пространстено решение,класическа схема с южна дневна и отделена зона сън, наличие на складови и гаражни пространства, богато решени общи части с контрол на...",False,2,2025-08-11 18:02:58.918198,https://www.imoti.net/bg/obiavi/r/prodava/sofia/?page=1&sid=gFM8jD,352
"продава Тристаен апартамент, 100 м2",228 456€446 821BGN,"София, Редута",https://www.imoti.net/bg/obiava/prodava/sofia/reduta/tristaen/5933332/?sid=gFM8jD&page=3,продава Тристаен апартамент, 100 м2,АДРЕС Недвижими имоти АД,Етаж: 2 от 7,Цена на /м2/:2 285EUR/4 468.21BGN,"Тристаен апартамент състоящ се от обширна дневна (29 кв.м.), две спални, два санитарни възела, склад и тераса. ЗП - 84 кв.м.",False,4,2025-08-11 18:02:58.918656,https://www.imoti.net/bg/obiavi/r/prodava/sofia/?page=1&sid=gFM8jD,352
"продава Двустаен апартамент, 80 м2",230 000€449 841BGN,"София, Изток",https://www.imoti.net/bg/obiava/prodava/sofia/sofija-iztok/dvustaen/6058391/?sid=gFM8jD&page=3,продава Двустаен апартамент, 80 м2,АБ ИМОТИ КОНСУЛТ,Етаж: 6 от 9,Цена на /м2/:2 875EUR/5 623.01BGN,"АБ ИМОТИ КОНСУЛТ продава двустаен апартамент в сграда с Акт 16 от 2003 г. Намира се на бул. Драган Цанков до КАТ. Метростанция  Г. М. Димитров  е съвсем близо, също близо са и множество други...",False,12,2025-08-11 18:02:58.919100,https://www.imoti.net/bg/obiavi/r/prodava/sofia/?page=1&sid=gFM8jD,352
"продава Двустаен апартамент, 85 м2",230 000€449 841BGN,"София, Оборище",https://www.imoti.net/bg/obiava/prodava/sofia/oborishte/dvustaen/5946872/?sid=gFM8jD&page=3,продава Двустаен апартамент, 85 м2,Глобъл Сървисиз,Етаж: 4 от 6,Цена на /м2/:2 706EUR/5 292.25BGN,Просторен 2ст апартамент напълно завършен и обзаведен в добре поддържана сграда на тихо и спокойно място и същевременно на централна локация до бул. Дондуков и в близост до Народното...,False,17,2025-08-11 18:02:58.919557,https://www.imoti.net/bg/obiavi/r/prodava/sofia/?page=1&sid=gFM8jD,352
"продава Двустаен апартамент, 66 м2",233 900€457 469BGN,"София, Дианабад",https://www.imoti.net/bg/obiava/prodava/sofia/dianabad/dvustaen/6057637/?sid=gFM8jD&page=3,продава Двустаен апартамент, 66 м2,Явлена Изток,Етаж: 2 от 8,Цена на /м2/:3 544EUR/6 931.34BGN,Явлена    Изток    продава    двустаен  апартамент      в    ж.к.    Дианабад  в   нова  тухлена  сграда  от  2013  година находящ  се  на втори  етаж  .    Апартаментът     е    напълно...,False,11,2025-08-11 18:02:58.920003,https://www.imoti.net/bg/obiavi/r/prodava/sofia/?page=1&sid=gFM8jD,352
"продава Тристаен апартамент, 106 м2",234 674€458 982BGN,"София, Суха Река",https://www.imoti.net/bg/obiava/prodava/sofia/suha-reka/tristaen/6035734/?sid=gFM8jD&page=3,продава Тристаен апартамент, 106 м2,АДРЕС Недвижими имоти АД,Етаж: 8 от 9,Цена на /м2/:2 214EUR/4 330.02BGN,"Просторен тристаен апартамент. Състои се от: две спални, дневна с кухненски бокс, две бани с тоалетни, мокро помещение и две тераси. Изложението е север-юг.",False,3,2025-08-11 18:02:58.920446,https://www.imoti.net/bg/obiavi/r/prodava/sofia/?page=1&sid=gFM8jD,352
"продава Тристаен апартамент, 106 м2",234 674€458 982BGN,"София, Суха Река",https://www.imoti.net/bg/obiava/prodava/sofia/suha-reka/tristaen/6035736/?sid=gFM8jD&page=3,продава Тристаен апартамент, 106 м2,АДРЕС Недвижими имоти АД,Етаж: 6 от 9,Цена на /м2/:2 214EUR/4 330.02BGN,"Просторен тристаен апартамент. Състои се от: две спални, дневна с кухненски бокс, две бани с тоалетни, мокро помещение и две тераси. Изложението е север-юг.",False,3,2025-08-11 18:02:58.920894,https://www.imoti.net/bg/obiavi/r/prodava/sofia/?page=1&sid=gFM8jD,352
"продава Тристаен апартамент, 106 м2",234 674€458 982BGN,"София, Суха Река",https://www.imoti.net/bg/obiava/prodava/sofia/suha-reka/tristaen/6035737/?sid=gFM8jD&page=3,продава Тристаен апартамент, 106 м2,АДРЕС Недвижими имоти АД,Етаж: 5 от 9,Цена на /м2/:2 214EUR/4 330.02BGN,"Просторен тристаен апартамент. Състои се от: две спални, дневна с кухненски бокс, две бани с тоалетни, мокро помещение и две тераси. Изложението е север-юг.",False,3,2025-08-11 18:02:58.921344,https://www.imoti.net/bg/obiavi/r/prodava/sofia/?page=1&sid=gFM8jD,352
"продава Тристаен апартамент, 106 м2",234 674€458 982BGN,"София, Суха Река",https://www.imoti.net/bg/obiava/prodava/sofia/suha-reka/tristaen/6035738/?sid=gFM8jD&page=3,продава Тристаен апартамент, 106 м2,АДРЕС Недвижими имоти АД,Етаж: 4 от 9,Цена на /м2/:2 214EUR/4 330.02BGN,"Просторен тристаен апартамент. Състои се от: две спални, дневна с кухненски бокс, две бани с тоалетни, мокро помещение и две тераси. Изложението е север-юг.",False,3,2025-08-11 18:02:58.921808,https://www.imoti.net/bg/obiavi/r/prodava/sofia/?page=1&sid=gFM8jD,352
"продава Тристаен апартамент, 107 м2",234 674€458 982BGN,"София, Подуене",https://www.imoti.net/bg/obiava/prodava/sofia/poduene/tristaen/6071113/?sid=gFM8jD&page=3,продава Тристаен апартамент, 107 м2,Бг Брокер,Етаж: 5 от 9,Цена на /м2/:2 193EUR/4 289.56BGN,"БЕЗ КОМИСИОН ОТ КУПУВАЧ!Предлагаме тристаен апартамент в новострояща се жилищна сграда с два входа, находяща се в кв. Подуяне, на 3 мин от метростанция Хаджи Димитър и на 13 мин....",False,6,2025-08-11 18:02:58.922257,https://www.imoti.net/bg/obiavi/r/prodava/sofia/?page=1&sid=gFM8jD,352
"продава Двустаен апартамент, 106 м2",234 674€458 982BGN,"София, Суха Река",https://www.imoti.net/bg/obiava/prodava--v-stroej/sofia/suha-reka/dvustaen/5725298/?sid=gFM8jD&page=3,продава Двустаен апартамент, 106 м2,ERA TERA,Етаж: 6 от 9,Цена на /м2/:2 214EUR/4 330.02BGN,"Ера Тера продава двустаен апартамент- А10 с площ 106.67 кв.м., намиращ се на шести жилищен етаж, състоящ се от: дневна, две спални, баня с тоалетна, тоалетна, антре, склад и балкон. Имотът се...",False,2,2025-08-11 18:02:58.922705,https://www.imoti.net/bg/obiavi/r/prodava/sofia/?page=1&sid=gFM8jD,352
"продава Тристаен апартамент, 86 м2",235 000€459 620BGN,"София, Суха Река",https://www.imoti.net/bg/obiava/prodava--v-stroej/sofia/suha-reka/tristaen/6038096/?sid=gFM8jD&page=3,продава Тристаен апартамент, 86 м2,New Estates,Етаж: 5 от 11,Цена на /м2/:2 733EUR/5 344.42BGN,"Представяме ви просторен тристаен апартамент с изцяло подменени ел. и ВиК инсталации. Жилището е подготвено за финални довършителни работи – готово за полагане на настилки, гипсокартон и санитария...",False,5,2025-08-11 18:02:58.923151,https://www.imoti.net/bg/obiavi/r/prodava/sofia/?page=1&sid=gFM8jD,352
"продава Двустаен апартамент, 89 м2",235 000€459 620BGN,"София, Дианабад",https://www.imoti.net/bg/obiava/prodava/sofia/dianabad/dvustaen/6040426/?sid=gFM8jD&page=4,продава Двустаен апартамент, 89 м2,АДРЕС Недвижими имоти АД,Етаж: 4 от 6,Цена на /м2/:2 640EUR/5 164.27BGN,"Двустаен апартамент със застроена площ от 74.29кв.м, ситуиран на 4-ти етаж от 6. Състои се от антре, дневна с кухненски бокс (30.26 кв.м), спалня (18.01 кв.м), баня с тоалетна. Цената е без...",False,10,2025-08-11 18:03:02.724145,https://www.imoti.net/bg/obiavi/r/prodava/sofia/?page=1&sid=gFM8jD,352
"продава Двустаен апартамент, 48 м2",235 000€459 620BGN,"София, Оборище",https://www.imoti.net/bg/obiava/prodava--v-stroej/sofia/oborishte/dvustaen/6089416/?sid=gFM8jD&page=4,продава Двустаен апартамент, 48 м2,ИРИДА НЕДВИЖИМИ ИМОТИ,Етаж: 4 от 4,Цена на /м2/:4 896EUR/9 575.42BGN,ИРИДА НЕДВИЖИМИ ИМОТИ Ви предлага за продажба обзаведен двустаен апартамент в кв. Оборище . Разположен на четвърти жилищен етаж от четири .Намира се в непосредствена близост до детски...,False,8,2025-08-11 18:03:02.724822,https://www.imoti.net/bg/obiavi/r/prodava/sofia/?page=1&sid=gFM8jD,352
"продава Тристаен апартамент, 118 м2",236 000€461 576BGN,"София, Дианабад",https://www.imoti.net/bg/obiava/prodava/sofia/dianabad/tristaen/6050108/?sid=gFM8jD&page=4,продава Тристаен апартамент, 118 м2,Явлена Изток,Етаж: 2 от 7,Цена на /м2/:2 000EUR/3 911.66BGN,"Агенция Явлена ви представя тристаен апартамент за продажба ново строителство, разположено в тих и удобен и комуникативен район. Жилището включва входно антре, просторна дневна с кухненски бокс и...",False,8,2025-08-11 18:03:02.725307,https://www.imoti.net/bg/obiavi/r/prodava/sofia/?page=1&sid=gFM8jD,352
"продава Тристаен апартамент, 77 м2",237 030€463 590BGN,"София, Дианабад",https://www.imoti.net/bg/obiava/prodava--v-stroej/sofia/dianabad/tristaen/6082474/?sid=gFM8jD&page=4,продава Тристаен апартамент, 77 м2,ИРИДА НЕДВИЖИМИ ИМОТИ,Етаж: 4 от 7,Цена на /м2/:3 078EUR/6 020.65BGN,"Начален етап на строителство!!!ИРИДА НЕДВИЖИМИ ИМОТИ продава маломерен тристаен апартамент в новоизграждаща се сграда, с изключително висококачествено строителство от доказан...",False,4,2025-08-11 18:03:02.725860,https://www.imoti.net/bg/obiavi/r/prodava/sofia/?page=1&sid=gFM8jD,352
"продава Тристаен апартамент, 137 м2",239 000€467 443BGN,"София, Суха Река",https://www.imoti.net/bg/obiava/prodava/sofia/suha-reka/tristaen/6035258/?sid=gFM8jD&page=4,продава Тристаен апартамент, 137 м2,АДРЕС Недвижими имоти АД,Етаж: 4 от 6,Цена на /м2/:1 745EUR/3 412.00BGN,"Жилище с отлично функционално и пространстено решение, уникална планировка с богата дневна част, ориентация на юг с панорамна гледка, светли коридори и сервизни помещения!,наличие на складови...",False,2,2025-08-11 18:03:02.726337,https://www.imoti.net/bg/obiavi/r/prodava/sofia/?page=1&sid=gFM8jD,352
"продава Тристаен апартамент, 104 м2",239 096€467 631BGN,"София, Суха Река",https://www.imoti.net/bg/obiava/prodava--v-stroej/sofia/suha-reka/tristaen/5986854/?sid=gFM8jD&page=4,продава Тристаен апартамент, 104 м2,Елеганс Естейт,Етаж: 7 от 8,Цена на /м2/:2 299EUR/4 496.45BGN,МЕТРО!ТИШИНА!ЕЛЕГАНТНОСТ!ПОБЪРЗАЙТЕ!ВЕЧЕ 70% ОТ ЖИЛИЩАТА СА ЗАКУПЕНИ!Уникален мини комплекс предстои да се издигне в един от най-бързо...,False,1,2025-08-11 18:03:02.726857,https://www.imoti.net/bg/obiavi/r/prodava/sofia/?page=1&sid=gFM8jD,352
"продава Двустаен апартамент, 63 м2",240 000€469 399BGN,"София, Изгрев",https://www.imoti.net/bg/obiava/prodava/sofia/sofija-izgrev/dvustaen/5958471/?sid=gFM8jD&page=4,продава Двустаен апартамент, 63 м2,First Estates,Етаж: 3 от 8,Цена на /м2/:3 810EUR/7 450.78BGN,"Агенция за недвижими имоти ""First Estates"" с удоволствие представя двустаен апартамент в иновативна жилищна сграда, първата в България, която ще бъде сертифицирана по международния стандарт за...",False,8,2025-08-11 18:03:02.727409,https://www.imoti.net/bg/obiavi/r/prodava/sofia/?page=1&sid=gFM8jD,352
