title,price_and_currency,location,details_url,property_type,area,agency,floor,price_per_m2,description,is_top_ad,num_photos,date_added,search_url,total_offers
"продава Тристаен апартамент, 116 м2",260 000€508 516BGN,"София, Хиподрума",https://www.imoti.net/bg/obiava/prodava/sofia/hipodruma/tristaen/6145973/?sid=iKI3oo&page=4,продава Тристаен апартамент, 116 м2,АДРЕС Недвижими имоти АД,Етаж: 1 от 7,Цена на /м2/:2 241EUR/4 383.76BGN,Тристаен апартамент с перфектните параметри в ж.к. Хиподрума. Жилището се намира на първи висок етаж със застроена площ от 100кв.м. ( 116 ОЧ) и има следното разпределение: огромна всекидневна...,False,14,2026-01-02 06:04:23.047284,https://www.imoti.net/bg/obiavi/r/prodava/sofia/?page=1&sid=iKI3oo,465
"продава Тристаен апартамент, 76 м2",260 000€508 516BGN,"София, Стрелбище",https://www.imoti.net/bg/obiava/prodava/sofia/strelbishte/tristaen/6097371/?sid=iKI3oo&page=4,продава Тристаен апартамент, 76 м2,Глобъл Сървисиз,Етаж: 6 от 8,Цена на /м2/:3 421EUR/6 691.00BGN,,False,1,2026-01-02 06:04:23.047726,https://www.imoti.net/bg/obiavi/r/prodava/sofia/?page=1&sid=iKI3oo,465
"продава Двустаен апартамент, 82 м2",262 000€512 427BGN,"София, Стрелбище",https://www.imoti.net/bg/obiava/prodava--v-stroej/sofia/strelbishte/dvustaen/6038125/?sid=iKI3oo&page=4,продава Двустаен апартамент, 82 м2,ИРИДА НЕДВИЖИМИ ИМОТИ,Етаж: 4 от 9,Цена на /м2/:3 195EUR/6 249.12BGN,С АКТ 14АКТ 15 МАЙ НА 2026г.!АКТ16 КРАЯ НА 2026!ИРИДА НЕДВИЖИМИ ИМОТИ продава просторен двустаен апартамент в сграда с изключително висококачествено строителство от...,False,3,2026-01-02 06:04:23.048241,https://www.imoti.net/bg/obiavi/r/prodava/sofia/?page=1&sid=iKI3oo,465
"продава Двустаен апартамент, 68 м2",264 000€516 339BGN,"София, Лозенец",https://www.imoti.net/bg/obiava/prodava/sofia/lozenec/dvustaen/6154913/?sid=iKI3oo&page=4,продава Двустаен апартамент, 68 м2,АДРЕС Недвижими имоти АД,Етаж: 14 от 21,Цена на /м2/:3 882EUR/7 593.22BGN,"СВОБОДА, СТИЛ И ЛУКС!Функционално двустайно ателие с отлично разпределение – перфектен избор както за лично ползване, така и за инвестиция. С площ от 67.25 кв.м / 58.48 кв.м с...",False,7,2026-01-02 06:04:23.048688,https://www.imoti.net/bg/obiavi/r/prodava/sofia/?page=1&sid=iKI3oo,465
"продава Тристаен апартамент, 96 м2",265 000€518 295BGN,"София, Лагера",https://www.imoti.net/bg/obiava/prodava/sofia/lagera/tristaen/6141955/?sid=iKI3oo&page=4,продава Тристаен апартамент, 96 м2,Имотека,Етаж: 1 от 6,Цена на /м2/:2 760EUR/5 398.91BGN,"Нов апартамент на шпакловка и замазка с Акт16, със застроена площ от 85.53кв.м. и мазе 2.96кв.м. Жилището се състои от входно антре, баня с тоалетна, отделно тоалетна, дневна с...",False,12,2026-01-02 06:04:23.049140,https://www.imoti.net/bg/obiavi/r/prodava/sofia/?page=1&sid=iKI3oo,465
"продава Двустаен апартамент, 63 м2",270 000€528 074BGN,"София, Лозенец",https://www.imoti.net/bg/obiava/prodava/sofia/lozenec/dvustaen/6151182/?sid=iKI3oo&page=4,продава Двустаен апартамент, 63 м2,АДРЕС Недвижими имоти АД,Етаж: 1 от 4,Цена на /м2/:4 286EUR/8 382.13BGN,"Търсиш място, което има всичко? Това е твоят дом в сърцето на Лозенец - между две метростанции и Борисовата градина. И не е просто апартамент...получаваш два имота в един! Предимства, които си...",False,18,2026-01-02 06:04:23.049586,https://www.imoti.net/bg/obiavi/r/prodava/sofia/?page=1&sid=iKI3oo,465
"продава Двустаен апартамент, 64 м2",270 000€528 074BGN,"София, Лагера",https://www.imoti.net/bg/obiava/prodava/sofia/lagera/dvustaen/6127674/?sid=iKI3oo&page=4,продава Двустаен апартамент, 64 м2,Титан Пропъртис София,Етаж: 6 от 7,Цена на /м2/:4 219EUR/8 251.16BGN,"Открийте мястото, където ще се чувствате у дома от първия момент.Титан Пропъртис- офис Хиподрума с радост предлага на Вашето внимание двустаен апартамент за продажба в ж.к. Лагера,...",False,9,2026-01-02 06:04:23.050052,https://www.imoti.net/bg/obiavi/r/prodava/sofia/?page=1&sid=iKI3oo,465
"продава Двустаен апартамент, 77 м2",270 000€528 074BGN,"София, Стрелбище",https://www.imoti.net/bg/obiava/prodava/sofia/strelbishte/dvustaen/6139064/?sid=iKI3oo&page=4,продава Двустаен апартамент, 77 м2,Глобъл Сървисиз,Етаж: 2 от 7,Цена на /м2/:3 506EUR/6 858.11BGN,"Двустаен апартамент за продажба в София, кв. Стрелбище – стил, простор и отлична локация!•",False,6,2026-01-02 06:04:23.050504,https://www.imoti.net/bg/obiavi/r/prodava/sofia/?page=1&sid=iKI3oo,465
"продава Тристаен апартамент, 101 м2",274 000€535 897BGN,"София, Лозенец",https://www.imoti.net/bg/obiava/prodava/sofia/lozenec/tristaen/5925091/?sid=iKI3oo&page=4,продава Тристаен апартамент, 101 м2,АДРЕС Недвижими имоти АД,Етаж: 5 от 20,Цена на /м2/:2 713EUR/5 305.92BGN,"Тристаен апартамент на 5 етан изложение И/З.Състои се от антре , самостоятелна кухня с малка тераса, две спални, дневна с излаз на тераса, баня и отделна тоалетна.Към жилището има мазе 7.23...",False,4,2026-01-02 06:04:23.050960,https://www.imoti.net/bg/obiavi/r/prodava/sofia/?page=1&sid=iKI3oo,465
"продава Тристаен апартамент, 109 м2",274 300€536 484BGN,"София, Хладилника",https://www.imoti.net/bg/obiava/prodava/sofia/hladilnika/tristaen/6183934/?sid=iKI3oo&page=4,продава Тристаен апартамент, 109 м2,ERA Младост,Етаж: 3 от 11,Цена на /м2/:2 517EUR/4 921.87BGN,"ЕРА Младост продава апартамент в сграда с разрешение за ползване от 2024 година,  в динамично развиващия се район Хладилника на община Лозенец, в частта известна като „белия квартал“. В...",False,1,2026-01-02 06:04:23.051403,https://www.imoti.net/bg/obiavi/r/prodava/sofia/?page=1&sid=iKI3oo,465
"продава Двустаен апартамент, 88 м2",277 550€542 841BGN,"София, Хладилника",https://www.imoti.net/bg/obiava/prodava/sofia/hladilnika/dvustaen/6181852/?sid=iKI3oo&page=4,продава Двустаен апартамент, 88 м2,АДРЕС Недвижими имоти АД,Етаж: 7,Цена на /м2/:3 154EUR/6 168.64BGN,"Двустаен апартамент с южно изложение, предлагащ светлина и комфорт през целия ден. Жилището е със застроена площ от 75 кв.м. и обща площ от 88 кв.м., функционално разпределени, както следва:...",False,5,2026-01-02 06:04:23.051847,https://www.imoti.net/bg/obiavi/r/prodava/sofia/?page=1&sid=iKI3oo,465
"продава Тристаен апартамент, 80 м2",279 000€545 677BGN,"София, Хиподрума",https://www.imoti.net/bg/obiava/prodava/sofia/hipodruma/tristaen/6139882/?sid=iKI3oo&page=4,продава Тристаен апартамент, 80 м2,Galiano Estates,Етаж: 2 от 7,Цена на /м2/:3 488EUR/6 820.96BGN,Galiano Estates Ви представя просторен тристаен апартамент застроена площ 80 кв. м много добра локация Ж.К Хиподрума. Апартаментът се състои от от хол с портал към отделна стая и друга стая с врата...,False,15,2026-01-02 06:04:23.052352,https://www.imoti.net/bg/obiavi/r/prodava/sofia/?page=1&sid=iKI3oo,465
"продава Двустаен апартамент, 82 м2",280 000€547 632BGN,"София, Стрелбище",https://www.imoti.net/bg/obiava/prodava/sofia/strelbishte/dvustaen/6143787/?sid=iKI3oo&page=4,продава Двустаен апартамент, 82 м2,Глобъл Сървисиз,Етаж: 4 от 8,Цена на /м2/:3 415EUR/6 678.44BGN,,False,1,2026-01-02 06:04:23.052799,https://www.imoti.net/bg/obiavi/r/prodava/sofia/?page=1&sid=iKI3oo,465
"продава Тристаен апартамент, 110 м2",280 000€547 632BGN,"София, Лагера",https://www.imoti.net/bg/obiava/prodava/sofia/lagera/tristaen/6049687/?sid=iKI3oo&page=4,продава Тристаен апартамент, 110 м2,Имоти Премиер,Етаж: 14 от 18,Цена на /м2/:2 545EUR/4 978.48BGN,"Имоти ПРЕМИЕР представя на Вашето внимание тристаен апартамент в ж.к Лагера! УНИКАЛНА ГЛЕДКА КЪМ ВИТОША!Жилището е ситуирано на етаж 14 от 18 в сграда ЕПК .Обща площ от 110м2 , която...",False,10,2026-01-02 06:04:23.053330,https://www.imoti.net/bg/obiavi/r/prodava/sofia/?page=1&sid=iKI3oo,465
"продава Двустаен апартамент, 95 м2",280 000€547 632BGN,"София, Лозенец",https://www.imoti.net/bg/obiava/prodava/sofia/lozenec/dvustaen/6143682/?sid=iKI3oo&page=4,продава Двустаен апартамент, 95 м2,Глобъл Сървисиз,Етаж: 0,Цена на /м2/:2 947EUR/5 764.55BGN,,False,3,2026-01-02 06:04:23.053774,https://www.imoti.net/bg/obiavi/r/prodava/sofia/?page=1&sid=iKI3oo,465
"продава Тристаен апартамент, 98 м2",281 078€549 741BGN,"София, Стрелбище",https://www.imoti.net/bg/obiava/prodava--v-stroej/sofia/strelbishte/tristaen/6109559/?sid=iKI3oo&page=4,продава Тристаен апартамент, 98 м2,ЕРА Голд,Етаж: 8 от 9,Цена на /м2/:2 868EUR/5 609.60BGN,"ЕРА Голд представя тристаен апартамент в новострояща се сграда в ж.к. Стрелбище на перфектна локация в близост до бул. България, супермаркет Фантастико, не далеч от Южен Парк, в близост до...",False,2,2026-01-02 06:04:23.054232,https://www.imoti.net/bg/obiavi/r/prodava/sofia/?page=1&sid=iKI3oo,465
"продава Двустаен апартамент, 63 м2",283 000€553 500BGN,"София, Лозенец",https://www.imoti.net/bg/obiava/prodava/sofia/lozenec/dvustaen/6108895/?sid=iKI3oo&page=4,продава Двустаен апартамент, 63 м2,Революшън Естейт България,Етаж: 2 от 7,Цена на /м2/:4 492EUR/8 785.71BGN,Референтен номер: 2095505Революшън Естейт Ви  представя двустаен апартамент в луксозна сграда с АКТ 16 на 2 минути пешеходно разтояние до Южен парк  в ж.к. Лозенец.-...,False,13,2026-01-02 06:04:23.054689,https://www.imoti.net/bg/obiavi/r/prodava/sofia/?page=1&sid=iKI3oo,465
"продава Двустаен апартамент, 81 м2",283 500€554 478BGN,"София, Белите Брези",https://www.imoti.net/bg/obiava/prodava/sofia/belite-brezi/dvustaen/6143989/?sid=iKI3oo&page=4,продава Двустаен апартамент, 81 м2,Глобъл Сървисиз,Етаж: 2 от 7,Цена на /м2/:3 500EUR/6 845.41BGN,"Голям ъглов двустаен апартамент без аналог на пазара на висок първи етаж над гаражи 81кв.м. На 300м. от пазар и метростанция Красно Село. В момента е тристаен маломерен, много подходящ и за офис....",False,1,2026-01-02 06:04:23.055150,https://www.imoti.net/bg/obiavi/r/prodava/sofia/?page=1&sid=iKI3oo,465
"продава Двустаен апартамент, 101 м2",283 643€554 757BGN,"София, Хладилника",https://www.imoti.net/bg/obiava/prodava/sofia/hladilnika/dvustaen/6035571/?sid=iKI3oo&page=4,продава Двустаен апартамент, 101 м2,АДРЕС Недвижими имоти АД,Етаж: 6 от 15,Цена на /м2/:2 808EUR/5 492.65BGN,"Вашият дом с история и бъдеще. Енергоефективност, независимост, иновативност и заслужен комфорт за всички собственици на комплекса. Двустаен апартамент състоящ се от: дневна с кухненски бокс,...",False,11,2026-01-02 06:04:23.055592,https://www.imoti.net/bg/obiavi/r/prodava/sofia/?page=1&sid=iKI3oo,465
"продава Двустаен апартамент, 75 м2",285 000€557 412BGN,"София, Хладилника",https://www.imoti.net/bg/obiava/prodava/sofia/hladilnika/dvustaen/6016010/?sid=iKI3oo&page=5,продава Двустаен апартамент, 75 м2,Еколит,Етаж: 4 от 11,Цена на /м2/:3 800EUR/7 432.15BGN,"Ексклузивно, БЕЗ КОМИСИОН от купувач.Предлагаме нов, функционален апартамент в модерна сграда с А16-юни 2024г.Сградата е разположена на ул. Филип Кутев, в близост до МОЛ Парадайс,...",False,,2026-01-02 06:04:28.096752,https://www.imoti.net/bg/obiavi/r/prodava/sofia/?page=1&sid=iKI3oo,465
"продава Двустаен апартамент, 63 м2",285 000€557 412BGN,"София, Лозенец",https://www.imoti.net/bg/obiava/prodava/sofia/lozenec/dvustaen/6133537/?sid=iKI3oo&page=5,продава Двустаен апартамент, 63 м2,BULGARIAN PROPERTIES,Етаж: 2,Цена на /м2/:4 524EUR/8 847.80BGN,"За повече информация свържете се с нас и цитирайте референтния номер на имота. Моля, кажете, че сте видeли обявата в imoti.net.Референтен номер: Sfa 88306Тел: 0882 817...",False,20,2026-01-02 06:04:28.097329,https://www.imoti.net/bg/obiavi/r/prodava/sofia/?page=1&sid=iKI3oo,465
"продава Тристаен апартамент, 87 м2",285 000€557 412BGN,"София, Хиподрума",https://www.imoti.net/bg/obiava/prodava/sofia/hipodruma/tristaen/6053534/?sid=iKI3oo&page=5,продава Тристаен апартамент, 87 м2,Имоти Премиер,Етаж: 8 от 9,Цена на /м2/:3 276EUR/6 407.03BGN,"Имоти Премиер представя една изключителна възможност за покупка на тристаен апартамент в София, квартал Хиподрума!** с възможност за преустроиство в четиристаен!!!",False,15,2026-01-02 06:04:28.097842,https://www.imoti.net/bg/obiavi/r/prodava/sofia/?page=1&sid=iKI3oo,465
"продава Двустаен апартамент, 101 м2",285 631€558 646BGN,"София, Хладилника",https://www.imoti.net/bg/obiava/prodava/sofia/hladilnika/dvustaen/6035569/?sid=iKI3oo&page=5,продава Двустаен апартамент, 101 м2,АДРЕС Недвижими имоти АД,Етаж: 7 от 15,Цена на /м2/:2 828EUR/5 531.15BGN,"Вашият дом с история и бъдеще. Енергоефективност, независимост, иновативност и заслужен комфорт за всички собственици на комплекса. Двустаен апартамент състоящ се от: дневна с кухненски бокс,...",False,14,2026-01-02 06:04:28.098310,https://www.imoti.net/bg/obiavi/r/prodava/sofia/?page=1&sid=iKI3oo,465
"продава Тристаен апартамент, 105 м2",289 999€567 189BGN,"София, Белите Брези",https://www.imoti.net/bg/obiava/prodava--v-stroej/sofia/belite-brezi/tristaen/6045929/?sid=iKI3oo&page=5,продава Тристаен апартамент, 105 м2,ИРИДА НЕДВИЖИМИ ИМОТИ,Етаж: 1 от 5,Цена на /м2/:2 762EUR/5 401.80BGN,НА 10МИНУТИ ОТ ЮЖЕН ПАРКМЕТРОСТАНЦИЯ БЪЛГАРИЯПАРКОМЯСТО В ЦЕНАТАИРИДА НЕДВИЖИМИ ИМОТИ Ви предлага за продажба обзаведен тристаен апартамент в квартал Белите...,False,16,2026-01-02 06:04:28.098825,https://www.imoti.net/bg/obiavi/r/prodava/sofia/?page=1&sid=iKI3oo,465
"продава Тристаен апартамент, 131 м2",290 000€567 191BGN,"София, Лагера",https://www.imoti.net/bg/obiava/prodava--v-stroej/sofia/lagera/tristaen/6052575/?sid=iKI3oo&page=5,продава Тристаен апартамент, 131 м2,Luximmo Finest Estates,Етаж:  от 8,Цена на /м2/:2 214EUR/4 329.70BGN,"Представяме нов, супер просторен тристаен апартамент за продажба, в новострояща се сграда на удобна локация в столицата, до бул. ""Цар Борис III"", кв. ""Лагера"".Сградата е разположена в...",False,6,2026-01-02 06:04:28.099346,https://www.imoti.net/bg/obiavi/r/prodava/sofia/?page=1&sid=iKI3oo,465
"продава Двустаен апартамент, 92 м2",294 400€575 796BGN,"София, Хладилника",https://www.imoti.net/bg/obiava/prodava/sofia/hladilnika/dvustaen/6093340/?sid=iKI3oo&page=5,продава Двустаен апартамент, 92 м2,Имотека,Етаж: 5 от 8,Цена на /м2/:3 200EUR/6 258.66BGN,"Двустаен апартамент със застроена площ от 74.52 кв.м. и обща площ от 91.85 кв.м. Разположен е на пети от осем етажа. Състои се от: дневна с кухненски бокс – 29.24 кв.м., спалня – 13.16...",False,10,2026-01-02 06:04:28.099791,https://www.imoti.net/bg/obiavi/r/prodava/sofia/?page=1&sid=iKI3oo,465
"продава Двустаен апартамент, 92 м2",294 400€575 796BGN,"София, Хладилника",https://www.imoti.net/bg/obiava/prodava/sofia/hladilnika/dvustaen/6093342/?sid=iKI3oo&page=5,продава Двустаен апартамент, 92 м2,Имотека,Етаж: 4 от 8,Цена на /м2/:3 200EUR/6 258.66BGN,Двустаен апартамент със застроена площ от 74.52 кв.м. и обща площ от 91.85кв.м.Разположен е на четвърти от осем етажа.Състои се от: дневна с кухненски бокс –...,False,9,2026-01-02 06:04:28.100261,https://www.imoti.net/bg/obiavi/r/prodava/sofia/?page=1&sid=iKI3oo,465
"продава Тристаен апартамент, 100 м2",295 000€576 970BGN,"София, Хиподрума",https://www.imoti.net/bg/obiava/prodava/sofia/hipodruma/tristaen/6155830/?sid=iKI3oo&page=5,продава Тристаен апартамент, 100 м2,Имотен център България 2021,Етаж: 1 от 5,Цена на /м2/:2 950EUR/5 769.70BGN,,False,12,2026-01-02 06:04:28.100755,https://www.imoti.net/bg/obiavi/r/prodava/sofia/?page=1&sid=iKI3oo,465
"продава Тристаен апартамент, 114 м2",297 700€582 251BGN,"София, Хладилника",https://www.imoti.net/bg/obiava/prodava/sofia/hladilnika/tristaen/6183932/?sid=iKI3oo&page=5,продава Тристаен апартамент, 114 м2,ERA Младост,Етаж: 5 от 11,Цена на /м2/:2 611EUR/5 107.46BGN,"ЕРА Младост продава апартамент в сграда с разрешение за ползване от 2024 година,  в динамично развиващия се район Хладилника на община Лозенец, в частта известна като „белия квартал“. В...",False,1,2026-01-02 06:04:28.101213,https://www.imoti.net/bg/obiavi/r/prodava/sofia/?page=1&sid=iKI3oo,465
"продава Тристаен апартамент, 86 м2",298 000€582 837BGN,"София, Лагера",https://www.imoti.net/bg/obiava/prodava/sofia/lagera/tristaen/6154519/?sid=iKI3oo&page=5,продава Тристаен апартамент, 86 м2,СОФИЯ ИМОТИ ГРУП,Етаж: 3 от 9,Цена на /м2/:3 465EUR/6 777.18BGN,СОФИЯ ИМОТИ ГРУП предлага тристаен апартамент за продажба в един от предпочитаните квартали в София - Лагера.Площ: 86м2 чиста площ без общи части и тераси....,False,9,2026-01-02 06:04:28.101669,https://www.imoti.net/bg/obiavi/r/prodava/sofia/?page=1&sid=iKI3oo,465
"продава Четиристаен апартамент, 100 м2",299 000€584 793BGN,"София, Белите Брези",https://www.imoti.net/bg/obiava/prodava/sofia/belite-brezi/chetiristaen/6181278/?sid=iKI3oo&page=5,продава Четиристаен апартамент, 100 м2,БАС Пропъртис,Етаж: 7 от 8,Цена на /м2/:2 990EUR/5 847.93BGN,"Реф. № 012603Агенция за недвижими имоти BAS Properties предлага за продажба светъл и просторен мезонет, разположен в един от най-предпочитаните квартали на София – Белите...",False,9,2026-01-02 06:04:28.102134,https://www.imoti.net/bg/obiavi/r/prodava/sofia/?page=1&sid=iKI3oo,465
"продава Тристаен апартамент, 100 м2",299 500€585 771BGN,"София, Лагера",https://www.imoti.net/bg/obiava/prodava/sofia/lagera/tristaen/6137173/?sid=iKI3oo&page=5,продава Тристаен апартамент, 100 м2,Имотека,Етаж: 6 от 7,Цена на /м2/:2 995EUR/5 857.71BGN,"Прекрасен тристаен апартамент, на метри от Метростанция ""Красно село"". Жилището се намира в новострояща сграда, на пети жилищен етаж и се състои от просторна дневна с трапезария и...",False,16,2026-01-02 06:04:28.102579,https://www.imoti.net/bg/obiavi/r/prodava/sofia/?page=1&sid=iKI3oo,465
"продава Двустаен апартамент, 96 м2",299 796€586 350BGN,"София, Хладилника",https://www.imoti.net/bg/obiava/prodava/sofia/hladilnika/dvustaen/6035570/?sid=iKI3oo&page=5,продава Двустаен апартамент, 96 м2,АДРЕС Недвижими имоти АД,Етаж: 7 от 15,Цена на /м2/:3 123EUR/6 107.81BGN,"Вашият дом с история и бъдеще. Енергоефективност, независимост, иновативност и заслужен комфорт за всички собственици на комплекса. Двустаен апартамент състоящ се от: дневна с кухненски бокс,...",False,11,2026-01-02 06:04:28.103031,https://www.imoti.net/bg/obiavi/r/prodava/sofia/?page=1&sid=iKI3oo,465
"продава Многостаен апартамент, 100 м2",300 000€586 749BGN,"София, Белите Брези",https://www.imoti.net/bg/obiava/prodava/sofia/belite-brezi/mnogostaen/6182177/?sid=iKI3oo&page=5,продава Многостаен апартамент, 100 м2,ХоумТед,Етаж: 5 от 6,Цена на /м2/:3 000EUR/5 867.49BGN,"Водещ брокер: Кристиян Узунски -0896166717Продава се мезонет с три спални в кв. Бели Брези, София на три минути от м.Красно село.Площ: 100 кв.м. чиста жилищна площПредлагаме за продажба...",False,13,2026-01-02 06:04:28.103510,https://www.imoti.net/bg/obiavi/r/prodava/sofia/?page=1&sid=iKI3oo,465
