title,price_and_currency,location,details_url,property_type,area,agency,floor,price_per_m2,description,is_top_ad,num_photos,date_added,search_url,total_offers
"продава Двустаен апартамент, 115 м2",400 000€782 332BGN,"София, Лозенец",https://www.imoti.net/bg/obiava/prodava/sofia/lozenec/dvustaen/6190154/?sid=iKI3oo&page=1,продава Двустаен апартамент, 115 м2,DHI group Ltd,Етаж: 4 от 6,Цена на /м2/:3 478EUR/6 802.89BGN,"Квартал Лозенец е с утвърден престиж, отлична инфраструктура и бърз достъп до:•	супермаркети и бутикови магазини•	училища, детски градини и паркове•	удобен градски...",True,1,2026-01-02 06:04:09.081090,https://www.imoti.net/bg/obiavi/r/prodava/sofia/?page=1&sid=iKI3oo,465
"продава Четиристаен апартамент, 150 м2",499 500€976 937BGN,"София, Лозенец",https://www.imoti.net/bg/obiava/prodava/sofia/lozenec/chetiristaen/6181104/?sid=iKI3oo&page=1,продава Четиристаен апартамент, 150 м2,RealNet Office Partners,Етаж: 2 от 6,Цена на /м2/:3 330EUR/6 512.91BGN,"RealNet продава просторен и функционален четиристаен апартамент, със застроена площ от 150 кв.м. (около 170 кв.м. с включени идеални части от общите части на сградата), находящ се на първи...",True,14,2026-01-02 06:04:09.081557,https://www.imoti.net/bg/obiavi/r/prodava/sofia/?page=1&sid=iKI3oo,465
"продава Тристаен апартамент, 201 м2",603 240€1 179 835BGN,"София, Лозенец",https://www.imoti.net/bg/obiava/prodava--v-stroej/sofia/lozenec/tristaen/5750082/?sid=iKI3oo&page=1,продава Тристаен апартамент, 201 м2,Luximmo Finest Estates,Етаж:  от 9,Цена на /м2/:3 001EUR/5 869.83BGN,"Представяме тристаен апартамент за продажба, част от нова сграда със смесено предназначение в кв. ""Лозенец"", гр. София.Сградата е с получен Акт 16.Районът е един от...",True,24,2026-01-02 06:04:09.082051,https://www.imoti.net/bg/obiavi/r/prodava/sofia/?page=1&sid=iKI3oo,465
"продава Тристаен апартамент, 170 м2",615 000€1 202 835BGN,"София, Лозенец",https://www.imoti.net/bg/obiava/prodava/sofia/lozenec/tristaen/5566759/?sid=iKI3oo&page=1,продава Тристаен апартамент, 170 м2,ELEHOME,Етаж: 3 от 8,Цена на /м2/:3 618EUR/7 075.50BGN,"A P A R T M E N T  0 1 2С Апартамент 012 ELEHOME ви предлага една изключително красива, функционална и резонираща с нашето ежедневие и съвременност архитектура. Семпла, изчистена и...",True,12,2026-01-02 06:04:09.082478,https://www.imoti.net/bg/obiavi/r/prodava/sofia/?page=1&sid=iKI3oo,465
"продава Тристаен апартамент, 87 м2",132 000€258 170BGN,"София, Белите Брези",https://www.imoti.net/bg/obiava/prodava/sofia/belite-brezi/tristaen/5983760/?sid=iKI3oo&page=1,продава Тристаен апартамент, 87 м2,Пандора естейт,Етаж: 9 от 12,Цена на /м2/:1 517EUR/2 967.47BGN,"Агенция за недвижими имоти ""Пандора Естейт"" продава ексклузивно тристаен апартамент в кв. Бели Брези на цена от 132,000 евро.Имотът е с площ от 87 кв.м, разположен на 9-ти етаж от...",False,6,2026-01-02 06:04:09.082940,https://www.imoti.net/bg/obiavi/r/prodava/sofia/?page=1&sid=iKI3oo,465
"продава Двустаен апартамент, 45 м2",149 000€291 419BGN,"София, Лагера",https://www.imoti.net/bg/obiava/prodava/sofia/lagera/dvustaen/6183919/?sid=iKI3oo&page=1,продава Двустаен апартамент, 45 м2,Имотен център България 2021,Етаж: 1 от 4,Цена на /м2/:3 311EUR/6 475.97BGN,"Продава се двустаен апартамент в кв. Лагера първи етаж, източно изложениеЛокация: кв. Лагера тиха и добре уредена част на София, с удобен достъп до центъра, градски транспорт (трамвай,...",False,14,2026-01-02 06:04:09.083436,https://www.imoti.net/bg/obiavi/r/prodava/sofia/?page=1&sid=iKI3oo,465
"продава Двустаен апартамент, 55 м2",175 000€342 270BGN,"София, Лозенец",https://www.imoti.net/bg/obiava/prodava/sofia/lozenec/dvustaen/6143857/?sid=iKI3oo&page=1,продава Двустаен апартамент, 55 м2,Глобъл Сървисиз,Етаж: 5 от 5,Цена на /м2/:3 182EUR/6 223.10BGN,"Продава се двустаен апартамент в Лозенец, подходящ за инвестиция. Апартаментът се намира на последен етаж в тухлена сграда без асансьор. Състои се от две стаи -: хол с кухненски бокс и спалня,...",False,7,2026-01-02 06:04:09.083886,https://www.imoti.net/bg/obiavi/r/prodava/sofia/?page=1&sid=iKI3oo,465
"продава Двустаен апартамент, 45 м2",179 000€350 094BGN,"София, Лагера",https://www.imoti.net/bg/obiava/prodava/sofia/lagera/dvustaen/6107928/?sid=iKI3oo&page=1,продава Двустаен апартамент, 45 м2,ЕКС НВД,Етаж: 3 от 6,Цена на /м2/:3 978EUR/7 779.86BGN,"Компания `ЕКС` представя на Вашето внимание двустаен апартамент в ж.к. Лагера.МЕСТОПОЛОЖЕНИЕ: В близост ще намерите различни транспортни връзки, училища, детски градини и търговски...",False,1,2026-01-02 06:04:09.084338,https://www.imoti.net/bg/obiavi/r/prodava/sofia/?page=1&sid=iKI3oo,465
"продава Двустаен апартамент, 50 м2",180 000€352 049BGN,"София, Лагера",https://www.imoti.net/bg/obiava/prodava/sofia/lagera/dvustaen/6099325/?sid=iKI3oo&page=1,продава Двустаен апартамент, 50 м2,Глобъл Сървисиз,Етаж: 14 от 18,Цена на /м2/:3 600EUR/7 040.99BGN,,False,6,2026-01-02 06:04:09.084776,https://www.imoti.net/bg/obiavi/r/prodava/sofia/?page=1&sid=iKI3oo,465
"продава Двустаен апартамент, 71 м2",183 600€359 090BGN,"София, Лагера",https://www.imoti.net/bg/obiava/prodava/sofia/lagera/dvustaen/6143775/?sid=iKI3oo&page=1,продава Двустаен апартамент, 71 м2,Глобъл Сървисиз,Етаж: 5 от 6,Цена на /м2/:2 586EUR/5 057.61BGN,"Предлагаме за продажба двустаен апартамент с разгъната застроена площ от 71 кв.м., разположен на 5-ти етаж от общо 6 в тухлена сграда с асансьор.Имотът е на шпакловка и замазка, което дава...",False,8,2026-01-02 06:04:09.085229,https://www.imoti.net/bg/obiavi/r/prodava/sofia/?page=1&sid=iKI3oo,465
"продава Двустаен апартамент, 78 м2",187 000€365 740BGN,"София, Стрелбище",https://www.imoti.net/bg/obiava/prodava/sofia/strelbishte/dvustaen/5982548/?sid=iKI3oo&page=1,продава Двустаен апартамент, 78 м2,Пандора естейт,Етаж: 7 от 13,Цена на /м2/:2 397EUR/4 688.98BGN,"Агенция Пандора Естейт предлага ЕКСКЛУЗИВНО за продажба двустаен обзаведен апартамент в кв. Стрелбище.Имотът разполага с отопление на ток, с възможност за поставяне на радиатори за...",False,4,2026-01-02 06:04:09.085672,https://www.imoti.net/bg/obiavi/r/prodava/sofia/?page=1&sid=iKI3oo,465
"продава Двустаен апартамент, 45 м2",188 000€367 696BGN,"София, Стрелбище",https://www.imoti.net/bg/obiava/prodava/sofia/strelbishte/dvustaen/6165824/?sid=iKI3oo&page=1,продава Двустаен апартамент, 45 м2,Имотека,Етаж: 12 от 12,Цена на /м2/:4 178EUR/8 171.02BGN,"Двустайно жилище с югоизточно изложение, на 12-ти, последен етаж , с панорамни гледки към планината и много светлина. Състои се от просторна дневна, спалня, обособен кухненески...",False,13,2026-01-02 06:04:09.086122,https://www.imoti.net/bg/obiavi/r/prodava/sofia/?page=1&sid=iKI3oo,465
"продава Двустаен апартамент, 65 м2",190 000€371 608BGN,"София, Стрелбище",https://www.imoti.net/bg/obiava/prodava/sofia/strelbishte/dvustaen/6152176/?sid=iKI3oo&page=1,продава Двустаен апартамент, 65 м2,Имотека,Етаж: 9 от 9,Цена на /м2/:2 923EUR/5 717.04BGN,"Просторен двустаен апартамент с южно изложение в ж.к. Стрелбище!Представяме ви слънчев и уютен апартамент, разположен на девети етаж в добре поддържана панелна сграда в един от...",False,15,2026-01-02 06:04:09.086565,https://www.imoti.net/bg/obiavi/r/prodava/sofia/?page=1&sid=iKI3oo,465
"продава Тристаен апартамент, 84 м2",191 000€373 564BGN,"София, Хиподрума",https://www.imoti.net/bg/obiava/prodava/sofia/hipodruma/tristaen/6019423/?sid=iKI3oo&page=1,продава Тристаен апартамент, 84 м2,Пандора естейт,Етаж: 2 от 15,Цена на /м2/:2 274EUR/4 447.18BGN,"Агенция за недвижими имоти Пандора естейт продава ексклузивно.Реф. № 110192.Тристайни апартаменти в кв. Хиподрума, с отличен достъп до транспортни средства и удобства.Цена:...",False,8,2026-01-02 06:04:09.087020,https://www.imoti.net/bg/obiavi/r/prodava/sofia/?page=1&sid=iKI3oo,465
"продава Двустаен апартамент, 62 м2",192 617€376 726BGN,"София, Стрелбище",https://www.imoti.net/bg/obiava/prodava--v-stroej/sofia/strelbishte/dvustaen/6037572/?sid=iKI3oo&page=1,продава Двустаен апартамент, 62 м2,ЕРА Голд,Етаж: 6 от 8,Цена на /м2/:3 107EUR/6 076.23BGN,"ЕРА Голд представя двустаен апартамент в новострояща се сграда в ж.к. Стрелбище на перфектна локация в близост до бул. България, супермаркет Фантастико, не далеч от Южен Парк, в близост до...",False,2,2026-01-02 06:04:09.087458,https://www.imoti.net/bg/obiavi/r/prodava/sofia/?page=1&sid=iKI3oo,465
"продава Двустаен апартамент, 72 м2",192 617€376 726BGN,"София, Стрелбище",https://www.imoti.net/bg/obiava/prodava--v-stroej/sofia/strelbishte/dvustaen/5957311/?sid=iKI3oo&page=1,продава Двустаен апартамент, 72 м2,BULGARIAN PROPERTIES,Етаж: 1 от 8,Цена на /м2/:2 675EUR/5 232.31BGN,"За повече информация свържете се с нас и цитирайте референтния номер на имота. Моля, кажете, че сте видeли обявата в imoti.net.Референтен номер: Sfa 85507Тел: 0882 817...",False,20,2026-01-02 06:04:09.087967,https://www.imoti.net/bg/obiavi/r/prodava/sofia/?page=1&sid=iKI3oo,465
"продава Двустаен апартамент, 75 м2",198 000€387 254BGN,"София, Хладилника",https://www.imoti.net/bg/obiava/prodava/sofia/hladilnika/dvustaen/6020840/?sid=iKI3oo&page=1,продава Двустаен апартамент, 75 м2,АРСЕНАЛ - недвижими имоти,Етаж: 5 от 11,Цена на /м2/:2 640EUR/5 163.39BGN,.  .  .  .  .  .  .  .  .  .  .  .  .  .  .  .  .  .  .  .  .  .  .  .  .  .  .  .  .  . НОВ .  .  .  .  .  .  .  .  .  .  .  .  .  .  .  .  .  .  .  .  .  .  .  .  .  .  .  .  .  .С А16...,False,1,2026-01-02 06:04:09.088410,https://www.imoti.net/bg/obiavi/r/prodava/sofia/?page=1&sid=iKI3oo,465
"продава Двустаен апартамент, 77 м2",198 000€387 254BGN,"София, Лозенец",https://www.imoti.net/bg/obiava/prodava/sofia/lozenec/dvustaen/5981942/?sid=iKI3oo&page=1,продава Двустаен апартамент, 77 м2,Пандора естейт,Етаж: 5 от 7,Цена на /м2/:2 571EUR/5 029.28BGN,Агенция Пандора Естейт предлага ексклузивно за продажба двустаен апартамент в престижния квартал Лозенец.Площ: 77 кв. мТип строителство: ТухлаГодина на строителство:...,False,4,2026-01-02 06:04:09.088860,https://www.imoti.net/bg/obiavi/r/prodava/sofia/?page=1&sid=iKI3oo,465
"продава Двустаен апартамент, 66 м2",199 999€391 164BGN,"София, Лагера",https://www.imoti.net/bg/obiava/prodava/sofia/lagera/dvustaen/6032520/?sid=iKI3oo&page=1,продава Двустаен апартамент, 66 м2,Имоти Премиер,Етаж: 2 от 6,Цена на /м2/:3 030EUR/5 926.73BGN,,False,16,2026-01-02 06:04:09.089363,https://www.imoti.net/bg/obiavi/r/prodava/sofia/?page=1&sid=iKI3oo,465
"продава Двустаен апартамент, 52 м2",199 999€391 164BGN,"София, Лагера",https://www.imoti.net/bg/obiava/prodava/sofia/lagera/dvustaen/6167198/?sid=iKI3oo&page=1,продава Двустаен апартамент, 52 м2,ЕКС НВД,Етаж: 13 от 13,Цена на /м2/:3 846EUR/7 522.39BGN,Компания `ЕКС` представя на Вашето внимание двустаен апартамент в жк. Лагера.МЕСТОПОЛОЖЕНИЕ: Намира се в близост до трамвайна спирка ж.к. 'Лагера'.СТРОИТЕЛСТВО:...,False,8,2026-01-02 06:04:09.089810,https://www.imoti.net/bg/obiavi/r/prodava/sofia/?page=1&sid=iKI3oo,465
"продава Тристаен апартамент, 74 м2",200 000€391 166BGN,"София, Стрелбище",https://www.imoti.net/bg/obiava/prodava/sofia/strelbishte/tristaen/6165825/?sid=iKI3oo&page=1,продава Тристаен апартамент, 74 м2,Имотека,Етаж: 6 от 9,Цена на /м2/:2 703EUR/5 286.03BGN,"Тристаен апартамент, състоящ се от: една стая, дневна, столова кухненски бокс и други сервизни помещения, със застроена площ от 73,84 в цената е включен и 22 кв.м. надземен гаражИмота...",False,3,2026-01-02 06:04:09.090272,https://www.imoti.net/bg/obiavi/r/prodava/sofia/?page=1&sid=iKI3oo,465
"продава Двустаен апартамент, 62 м2",200 000€391 166BGN,"София, Стрелбище",https://www.imoti.net/bg/obiava/prodava/sofia/strelbishte/dvustaen/6142562/?sid=iKI3oo&page=1,продава Двустаен апартамент, 62 м2,Тамбуков недвижими имоти,Етаж: 7 от 7,Цена на /м2/:3 226EUR/6 309.13BGN,"Ексклузивно предложение!!! Двустаен, обзаведен в стара тухлена сграда със ЗП- 56.07 кв.м. на ул.“Деде Агач“ в близост до училище, супермаркет, пазар, метростанция, стадион, парк, спирки на градския...",False,14,2026-01-02 06:04:09.090710,https://www.imoti.net/bg/obiavi/r/prodava/sofia/?page=1&sid=iKI3oo,465
"продава Двустаен апартамент, 65 м2",200 000€391 166BGN,"София, Стрелбище",https://www.imoti.net/bg/obiava/prodava/sofia/strelbishte/dvustaen/6184151/?sid=iKI3oo&page=1,продава Двустаен апартамент, 65 м2,Глобъл Сървисиз,Етаж: 1 от 6,Цена на /м2/:3 077EUR/6 017.94BGN,Global Services предлага на Вашето внимание двустаен апартамент в непосредствена близост до входа на ЮЖЕН ПАРК в кв. Стрелбище.Жилището е в отлично състояние и напълно обзаведено....,False,3,2026-01-02 06:04:09.091167,https://www.imoti.net/bg/obiavi/r/prodava/sofia/?page=1&sid=iKI3oo,465
"продава Двустаен апартамент, 69 м2",205 600€402 119BGN,"София, Хладилника",https://www.imoti.net/bg/obiava/prodava/sofia/hladilnika/dvustaen/6155708/?sid=iKI3oo&page=1,продава Двустаен апартамент, 69 м2,ERA Младост,Етаж: 9 от 11,Цена на /м2/:2 980EUR/5 827.81BGN,"ЕРА Младост продава апартамент в сграда с разрешение за ползване от 2024 година,  в динамично развиващия се район Хладилника на община Лозенец, в частта известна като „белия квартал“. В...",False,1,2026-01-02 06:04:09.091609,https://www.imoti.net/bg/obiavi/r/prodava/sofia/?page=1&sid=iKI3oo,465
"продава Тристаен апартамент, 84 м2",207 000€404 857BGN,"София, Лагера",https://www.imoti.net/bg/obiava/prodava/sofia/lagera/tristaen/6144001/?sid=iKI3oo&page=1,продава Тристаен апартамент, 84 м2,Глобъл Сървисиз,Етаж: 5 от 6,Цена на /м2/:2 464EUR/4 819.72BGN,"Продава се мезонет/тризонет в кв. Лагера, гр. СофияСамо на 170 м от метростанция „Красно село“!Просторен, обзаведен и готов за живеене имот, разположен на последните два...",False,17,2026-01-02 06:04:09.092072,https://www.imoti.net/bg/obiavi/r/prodava/sofia/?page=1&sid=iKI3oo,465
"продава Двустаен апартамент, 40 м2",207 500€405 835BGN,"София, Лозенец",https://www.imoti.net/bg/obiava/prodava/sofia/lozenec/dvustaen/6085382/?sid=iKI3oo&page=1,продава Двустаен апартамент, 40 м2,Глобъл Сървисиз,Етаж: 3 от 5,Цена на /м2/:5 188EUR/10 145.87BGN,,False,2,2026-01-02 06:04:09.092516,https://www.imoti.net/bg/obiavi/r/prodava/sofia/?page=1&sid=iKI3oo,465
"продава Двустаен апартамент, 72 м2",209 900€410 529BGN,"София, Лагера",https://www.imoti.net/bg/obiava/prodava/sofia/lagera/dvustaen/6152785/?sid=iKI3oo&page=1,продава Двустаен апартамент, 72 м2,АДРЕС Недвижими имоти АД,Етаж: 2 от 7,Цена на /м2/:2 915EUR/5 701.79BGN,"Предлагаме уютен  двустаен апартамент с площ 72 кв.м (застроена площ 59.40 кв.м), разположен в един от най-предпочитаните и зелени квартали на София – кв. Лагера....",False,7,2026-01-02 06:04:09.092975,https://www.imoti.net/bg/obiavi/r/prodava/sofia/?page=1&sid=iKI3oo,465
"продава Двустаен апартамент, 60 м2",210 000€410 724BGN,"София, Белите Брези",https://www.imoti.net/bg/obiava/prodava/sofia/belite-brezi/dvustaen/6144004/?sid=iKI3oo&page=1,продава Двустаен апартамент, 60 м2,Глобъл Сървисиз,Етаж: 5 от 6,Цена на /м2/:3 500EUR/6 845.41BGN,"светъл и уютен апартамент.Състоящ се от спалня, кухня ,трапезария ,санитарен възел и огромна тераса,която може да бъде обособена.Апартамента е вътрешен и топъл в зимните...",False,1,2026-01-02 06:04:09.093425,https://www.imoti.net/bg/obiavi/r/prodava/sofia/?page=1&sid=iKI3oo,465
"продава Двустаен апартамент, 42 м2",210 000€410 724BGN,"София, Хиподрума",https://www.imoti.net/bg/obiava/prodava/sofia/hipodruma/dvustaen/6141285/?sid=iKI3oo&page=1,продава Двустаен апартамент, 42 м2,Революшън Естейт България,Етаж: 1 от 3,Цена на /м2/:5 000EUR/9 779.15BGN,Референтен номер: 2094783Революшън Естейт представя Двустаен апартамент в ж.к. Хиподрума.- Етаж: 1-ви от 3-ти.- Площ: 42 кв.м.- Разпределение:...,False,10,2026-01-02 06:04:09.093893,https://www.imoti.net/bg/obiavi/r/prodava/sofia/?page=1&sid=iKI3oo,465
"продава Двустаен апартамент, 57 м2",214 300€419 134BGN,"София, Лагера",https://www.imoti.net/bg/obiava/prodava/sofia/lagera/dvustaen/6181301/?sid=iKI3oo&page=1,продава Двустаен апартамент, 57 м2,BULGARIA REAL ESTATE,Етаж: 6 от 6,Цена на /м2/:3 760EUR/7 353.23BGN,"BULGARIA REAL ESTATE Ви предлагаДвустаен апартамент за продажба в София, кв. Лагера – функционален, светъл и уютен дом, подходящ както за лично ползване, така и за инвестиция. Сграда от 2011...",False,10,2026-01-02 06:04:09.094340,https://www.imoti.net/bg/obiavi/r/prodava/sofia/?page=1&sid=iKI3oo,465
"продава Двустаен апартамент, 57 м2",215 990€422 440BGN,"София, Лагера",https://www.imoti.net/bg/obiava/prodava/sofia/lagera/dvustaen/6088727/?sid=iKI3oo&page=2,продава Двустаен апартамент, 57 м2,Имотека,Етаж: 9 от 9,Цена на /м2/:3 789EUR/7 411.22BGN,"Предлагаме Ви двустаен обзаведен апартамент в кв Лагера. С възможнист за промяна в тристаен. Състои се от входно антре, всекидневна с кухненски бокс, спалня, баня с тоалетна, балкон. Югоизточно...",False,8,2026-01-02 06:04:13.671126,https://www.imoti.net/bg/obiavi/r/prodava/sofia/?page=1&sid=iKI3oo,465
"продава Двустаен апартамент, 78 м2",217 775€425 931BGN,"София, Лозенец",https://www.imoti.net/bg/obiava/prodava--v-stroej/sofia/lozenec/dvustaen/5759535/?sid=iKI3oo&page=2,продава Двустаен апартамент, 78 м2,New Estates,Етаж: 3 от 7,Цена на /м2/:2 792EUR/5 460.65BGN,New Estates има удоволствието да ви представи нова бутикова сграда в един от най-желаните райони в София - кв. Лозенец. Районът е добре позициониран от гледна точка на комуникации и достъпност в...,False,17,2026-01-02 06:04:13.671628,https://www.imoti.net/bg/obiavi/r/prodava/sofia/?page=1&sid=iKI3oo,465
"продава Двустаен апартамент, 69 м2",217 800€425 980BGN,"София, Лагера",https://www.imoti.net/bg/obiava/prodava/sofia/lagera/dvustaen/6157925/?sid=iKI3oo&page=2,продава Двустаен апартамент, 69 м2,Имотека,Етаж: 4 от 7,Цена на /м2/:3 157EUR/6 173.62BGN,"Двустаен апартамент със застроена площ от 60кв.м. На метри от Метростанция ""Красно село"". Жилището се намира в новострояща се сграда, на четвърти жилищен етаж и се състои от входно...",False,8,2026-01-02 06:04:13.672092,https://www.imoti.net/bg/obiavi/r/prodava/sofia/?page=1&sid=iKI3oo,465
"продава Двустаен апартамент, 76 м2",218 526€427 400BGN,"София, Стрелбище",https://www.imoti.net/bg/obiava/prodava--v-stroej/sofia/strelbishte/dvustaen/6038314/?sid=iKI3oo&page=2,продава Двустаен апартамент, 76 м2,ИРИДА НЕДВИЖИМИ ИМОТИ,Етаж: 2 от 8,Цена на /м2/:2 875EUR/5 623.68BGN,НАЧАЛЕН ЕТАП НА СТРОИТЕЛСТВО!АКТ 14 МАРТ НА 2026г.!АКТ 15 КРАЯ НА 2026г!АКТ 16 НАЧАЛОТО НА 2027г!ИРИДА НЕДВИЖИМИ ИМОТИ продава просторен двустаен апартамент в...,False,6,2026-01-02 06:04:13.672600,https://www.imoti.net/bg/obiavi/r/prodava/sofia/?page=1&sid=iKI3oo,465
