title,price_and_currency,location,details_url,property_type,area,agency,floor,price_per_m2,description,is_top_ad,num_photos,date_added,search_url,total_offers
"продава Тристаен апартамент, 123 м2",473 000€925 108BGN,"София, Лозенец",https://www.imoti.net/bg/obiava/prodava/sofia/lozenec/tristaen/6096183/?sid=iKI3oo&page=12,продава Тристаен апартамент, 123 м2,Имотека,Етаж: 12 от 21,Цена на /м2/:3 846EUR/7 521.20BGN,"Многостаен апартамент, състоящ се от дневна с кухненски бокс, две спални, две бани с тоалетна и тераса.",False,8,2026-01-02 06:05:00.632607,https://www.imoti.net/bg/obiavi/r/prodava/sofia/?page=1&sid=iKI3oo,465
"продава Тристаен апартамент, 123 м2",473 000€925 108BGN,"София, Лозенец",https://www.imoti.net/bg/obiava/prodava/sofia/lozenec/tristaen/6064104/?sid=iKI3oo&page=12,продава Тристаен апартамент, 123 м2,АДРЕС Недвижими имоти АД,Етаж: 12 от 21,Цена на /м2/:3 846EUR/7 521.20BGN,"СВОБОДА, СТИЛ И ЛУКС!Тристаен апартамент с отлично разпределение – перфектен избор както за лично ползване, така и за инвестиция. С площ от 122.51 кв.м / 106.53 кв.м с изложение...",False,7,2026-01-02 06:05:00.633074,https://www.imoti.net/bg/obiavi/r/prodava/sofia/?page=1&sid=iKI3oo,465
"продава Мезонет, 190 м2",475 000€929 019BGN,"София, Белите Брези",https://www.imoti.net/bg/obiava/prodava/sofia/belite-brezi/mezonet/5734045/?sid=iKI3oo&page=12,продава Мезонет, 190 м2,BULGARIAN PROPERTIES,Етаж: 5,Цена на /м2/:2 500EUR/4 889.58BGN,"За повече информация свържете се с нас и цитирайте референтния номер на имота. Моля, кажете, че сте видeли обявата в imoti.net.Референтен номер: Sfa 81624Тел: 0882 817...",False,17,2026-01-02 06:05:00.633581,https://www.imoti.net/bg/obiavi/r/prodava/sofia/?page=1&sid=iKI3oo,465
"продава Четиристаен апартамент, 120 м2",475 000€929 019BGN,"София, Лозенец",https://www.imoti.net/bg/obiava/prodava--v-stroej/sofia/lozenec/chetiristaen/6115525/?sid=iKI3oo&page=12,продава Четиристаен апартамент, 120 м2,Luximmo Finest Estates,Етаж:  от 6,Цена на /м2/:3 958EUR/7 741.83BGN,"Четиристаен апартамент с отлично местоположение само на метри от Южен парк и центъра на столицата. Жилището е част от сграда с Разрешение за ползване от 1995 г., разположена в кв. Лозенец. Районът...",False,20,2026-01-02 06:05:00.634086,https://www.imoti.net/bg/obiavi/r/prodava/sofia/?page=1&sid=iKI3oo,465
"продава Четиристаен апартамент, 200 м2",480 000€938 798BGN,"София, Иван Вазов",https://www.imoti.net/bg/obiava/prodava/sofia/ivan-vazov/chetiristaen/5937421/?sid=iKI3oo&page=12,продава Четиристаен апартамент, 200 м2,Глобъл Сървисиз,Етаж: 8 от 8,Цена на /м2/:2 400EUR/4 693.99BGN,"Мезонет в сграда от 2008г. със следното разпределение: първо ниво 150кв.м състоящо се от хол с кухненски бокс , просторна дневна с две тераси, две бани с тоалетни, две спални с тераси, складово...",False,7,2026-01-02 06:05:00.634532,https://www.imoti.net/bg/obiavi/r/prodava/sofia/?page=1&sid=iKI3oo,465
"продава Тристаен апартамент, 140 м2",480 000€938 798BGN,"София, Стрелбище",https://www.imoti.net/bg/obiava/prodava/sofia/strelbishte/tristaen/6143788/?sid=iKI3oo&page=12,продава Тристаен апартамент, 140 м2,Глобъл Сървисиз,Етаж: 2 от 8,Цена на /м2/:3 429EUR/6 705.70BGN,,False,1,2026-01-02 06:05:00.634984,https://www.imoti.net/bg/obiavi/r/prodava/sofia/?page=1&sid=iKI3oo,465
"продава Тристаен апартамент, 120 м2",480 000€938 798BGN,"София, Лозенец",https://www.imoti.net/bg/obiava/prodava/sofia/lozenec/tristaen/6093121/?sid=iKI3oo&page=12,продава Тристаен апартамент, 120 м2,Глобъл Сървисиз,Етаж: 7 от 10,Цена на /м2/:4 000EUR/7 823.32BGN,,False,13,2026-01-02 06:05:00.635430,https://www.imoti.net/bg/obiavi/r/prodava/sofia/?page=1&sid=iKI3oo,465
"продава Тристаен апартамент, 110 м2",480 000€938 798BGN,"София, Лозенец",https://www.imoti.net/bg/obiava/prodava--v-stroej/sofia/lozenec/tristaen/6096309/?sid=iKI3oo&page=12,продава Тристаен апартамент, 110 м2,Luximmo Finest Estates,Етаж:  от 6,Цена на /м2/:4 364EUR/8 534.53BGN,"Представяме полуобзаведен тристаен апартамент в бутикова сграда в кв. ""Лозенец"". Локацията на имота е на тиха локация, на крачки от Южен парк и същевременно на метри от бул. ""Черни връх"" и от там...",False,30,2026-01-02 06:05:00.635933,https://www.imoti.net/bg/obiavi/r/prodava/sofia/?page=1&sid=iKI3oo,465
"продава Тристаен апартамент, 111 м2",480 000€938 798BGN,"София, Лозенец",https://www.imoti.net/bg/obiava/prodava/sofia/lozenec/tristaen/6125773/?sid=iKI3oo&page=12,продава Тристаен апартамент, 111 м2,Barnes Bulgaria,Етаж: 2 от 6,Цена на /м2/:4 324EUR/8 457.64BGN,"Представяме полуобзаведен тристаен апартамент в бутикова сграда в кв. ""Лозенец"". Локацията на имота е на тиха локация, на крачки от Южен парк и същевременно на метри от бул. ""Черни връх"" и от там...",False,19,2026-01-02 06:05:00.636451,https://www.imoti.net/bg/obiavi/r/prodava/sofia/?page=1&sid=iKI3oo,465
"продава Тристаен апартамент, 140 м2",480 000€938 798BGN,"София, Стрелбище",https://www.imoti.net/bg/obiava/prodava--v-stroej/sofia/strelbishte/tristaen/5760746/?sid=iKI3oo&page=12,продава Тристаен апартамент, 140 м2,Luximmo Finest Estates,Етаж:  от 8,Цена на /м2/:3 429EUR/6 705.70BGN,"БЕЗ КОМИСИОННА!БЕЗ ИНДЕКСАЦИЯ НА ЦЕНАТА!НАПРЕДВАЩО СТОИТЕЛСТВО!LUXIMMO представя луксозна сграда с отличителен дизайн, висок клас на изпълнение, комуникативна локация и...",False,4,2026-01-02 06:05:00.636966,https://www.imoti.net/bg/obiavi/r/prodava/sofia/?page=1&sid=iKI3oo,465
"продава Многостаен апартамент, 190 м2",489 000€956 401BGN,"София, Лозенец",https://www.imoti.net/bg/obiava/prodava--v-stroej/sofia/lozenec/mnogostaen/6098673/?sid=iKI3oo&page=12,продава Многостаен апартамент, 190 м2,МАРТИТРАНС,Етаж: 0 от 2,Цена на /м2/:2 574EUR/5 033.69BGN,"Просторен апартамент на две нива с градина и атриум – ТОП локация в кв. Лозенец, ул. Голо Бърдо 8.Продава се уникален имот с площ от 190 кв.м., разположен на партерно и сутеренно...",False,1,2026-01-02 06:05:00.637413,https://www.imoti.net/bg/obiavi/r/prodava/sofia/?page=1&sid=iKI3oo,465
"продава Многостаен апартамент, 211 м2",490 000€958 357BGN,"София, Белите Брези",https://www.imoti.net/bg/obiava/prodava/sofia/belite-brezi/mnogostaen/6079835/?sid=iKI3oo&page=12,продава Многостаен апартамент, 211 м2,АДРЕС Недвижими имоти АД,Етаж: 5 от 6,Цена на /м2/:2 322EUR/4 541.97BGN,"Многостаен апартамент  в Бели брези, след ремонт и закупуване на нови ел. уреди и мебели, в кв. Бели брези с паркомясто във вътрешен двор с ограничен достъп включено в цената, с възможност за...",False,37,2026-01-02 06:05:00.637849,https://www.imoti.net/bg/obiavi/r/prodava/sofia/?page=1&sid=iKI3oo,465
"продава Мезонет, 185 м2",490 000€958 357BGN,"София, Хладилника",https://www.imoti.net/bg/obiava/prodava/sofia/hladilnika/mezonet/6172255/?sid=iKI3oo&page=12,продава Мезонет, 185 м2,ANTRE,Етаж: 6 от 7,Цена на /м2/:2 649EUR/5 180.31BGN,"До два парка и метростанция. Уникални гледки към парка и Витоша. Огромни стаи. Гараж.Представяме Ви просторен мезонет на бул. Никола Й. Вапцаров 29, на метри от два парка, метростанция,...",False,13,2026-01-02 06:05:00.638309,https://www.imoti.net/bg/obiavi/r/prodava/sofia/?page=1&sid=iKI3oo,465
"продава Многостаен апартамент, 154 м2",490 000€958 357BGN,"София, Лагера",https://www.imoti.net/bg/obiava/prodava/sofia/lagera/mnogostaen/6158694/?sid=iKI3oo&page=12,продава Многостаен апартамент, 154 м2,Имотека,Етаж: 3 от 6,Цена на /м2/:3 182EUR/6 223.10BGN,"Функционален многостаен апартамент С ВКЛЮЧЕНО ПОДЗЕМНО ПАРКОМЯСТО В ЦЕНАТА!Хол с трапезария и кухненски бокс, три непреходни спални, три бани, гардеробно, перално, две тераси....",False,6,2026-01-02 06:05:00.638758,https://www.imoti.net/bg/obiavi/r/prodava/sofia/?page=1&sid=iKI3oo,465
"продава Четиристаен апартамент, 124 м2",492 210€962 679BGN,"София, Лозенец",https://www.imoti.net/bg/obiava/prodava--v-stroej/sofia/lozenec/chetiristaen/5966944/?sid=iKI3oo&page=12,продава Четиристаен апартамент, 124 м2,ЕРА Голд,Етаж: 2 от 5,Цена на /м2/:3 969EUR/7 763.54BGN,"БЕЗ КОМИСИОНА ОТ КУПУВАЧА! ЕРА Голд има удоволствието да Ви представи слънчев четиристаен апартамент със зелени гледки в кв. Лозенец. Сградата е разположена на тиха улица, с богато озеленена околна...",False,6,2026-01-02 06:05:00.639228,https://www.imoti.net/bg/obiavi/r/prodava/sofia/?page=1&sid=iKI3oo,465
"продава Тристаен апартамент, 140 м2",495 000€968 136BGN,"София, Стрелбище",https://www.imoti.net/bg/obiava/prodava--v-stroej/sofia/strelbishte/tristaen/6038128/?sid=iKI3oo&page=12,продава Тристаен апартамент, 140 м2,ИРИДА НЕДВИЖИМИ ИМОТИ,Етаж: 6 от 9,Цена на /м2/:3 536EUR/6 915.26BGN,"С АКТ 14!АКТ 15 МАЙ НА 2026г.!АКТ16 КРАЯ НА 2026!ИРИДА НЕДВИЖИМИ ИМОТИ продава панорамен слънчев тристаен апартамент в новоизграждаща се сграда, с изключително...",False,3,2026-01-02 06:05:00.639740,https://www.imoti.net/bg/obiavi/r/prodava/sofia/?page=1&sid=iKI3oo,465
"продава Тристаен апартамент, 88 м2",495 000€968 136BGN,"София, Лозенец",https://www.imoti.net/bg/obiava/prodava/sofia/lozenec/tristaen/6157964/?sid=iKI3oo&page=12,продава Тристаен апартамент, 88 м2,АДРЕС Недвижими имоти АД,Етаж: 4 от 5,Цена на /м2/:5 625EUR/11 001.54BGN,"Слънчев  тристаен апартамент в кв.""Лозенец"". Статут на Ателие. Застроена площ от 75.13 кв.м. Хол с кухненси бокс- около 25 м.кв, две спални между 8 м.кв и 9 м.кв. Усвоен балкон...",False,10,2026-01-02 06:05:00.640196,https://www.imoti.net/bg/obiavi/r/prodava/sofia/?page=1&sid=iKI3oo,465
"продава Тристаен апартамент, 90 м2",495 000€968 136BGN,"София, Лозенец",https://www.imoti.net/bg/obiava/prodava/sofia/lozenec/tristaen/6157965/?sid=iKI3oo&page=12,продава Тристаен апартамент, 90 м2,АДРЕС Недвижими имоти АД,Етаж: 4 от 5,Цена на /м2/:5 500EUR/10 757.07BGN,"Тристаен непреходен апартамент със застроена площ от 78 кв.м. Разполага с хол с кухненски бокс от около 25 кв.м. и две неголеми спални, от които се излиза на балкон. Разположен е на висок...",False,14,2026-01-02 06:05:00.640641,https://www.imoti.net/bg/obiavi/r/prodava/sofia/?page=1&sid=iKI3oo,465
"продава Четиристаен апартамент, 180 м2",499 000€975 959BGN,"София, Лозенец",https://www.imoti.net/bg/obiava/prodava/sofia/lozenec/chetiristaen/6019397/?sid=iKI3oo&page=12,продава Четиристаен апартамент, 180 м2,Глобъл Сървисиз,Етаж: 3 от 5,Цена на /м2/:2 772EUR/5 422.00BGN,"Предлагаме светъл и просторен апартамент в Лозенец – отлична локация!Представяме на Вашето внимание просторен и светъл апартамент, разположен в предпочитания квартал Лозенец, в...",False,16,2026-01-02 06:05:00.641099,https://www.imoti.net/bg/obiavi/r/prodava/sofia/?page=1&sid=iKI3oo,465
"продава Четиристаен апартамент, 224 м2",499 990€977 895BGN,"София, Хладилника",https://www.imoti.net/bg/obiava/prodava/sofia/hladilnika/chetiristaen/6109941/?sid=iKI3oo&page=12,продава Четиристаен апартамент, 224 м2,Galardo Real Estate,Етаж: 6 от 7,Цена на /м2/:2 232EUR/4 365.60BGN,Galardo Real Estate предлага за продажба четиристаен мезонет с усещане за къща – в една от най-желаните локации на София.Имотът е разположен срещу Paradise Center и на крачки от Южен парк –...,False,6,2026-01-02 06:05:00.641546,https://www.imoti.net/bg/obiavi/r/prodava/sofia/?page=1&sid=iKI3oo,465
"продава Четиристаен апартамент, 260 м2",499 990€977 895BGN,"София, Хладилника",https://www.imoti.net/bg/obiava/prodava/sofia/hladilnika/chetiristaen/6109942/?sid=iKI3oo&page=12,продава Четиристаен апартамент, 260 м2,Galardo Real Estate,Етаж: 6 от 7,Цена на /м2/:1 923EUR/3 761.14BGN,Galardo Real Estate предлага за продажба четиристаен мезонет с усещане за къща – в една от най-желаните локации на София.Имотът е разположен срещу Paradise Center и на крачки от Южен парк –...,False,14,2026-01-02 06:05:00.642013,https://www.imoti.net/bg/obiavi/r/prodava/sofia/?page=1&sid=iKI3oo,465
"продава Мезонет, 150 м2",500 000€977 915BGN,"София, Лозенец",https://www.imoti.net/bg/obiava/prodava/sofia/lozenec/mezonet/5727513/?sid=iKI3oo&page=12,продава Мезонет, 150 м2,АРСЕНАЛ - недвижими имоти,Етаж: 6 от 7,Цена на /м2/:3 333EUR/6 519.43BGN,". . . . . . . . . . . . . . . . . УНИКАЛЕН . . . . . . . . . . . . . . . . мезонет ситуиран в тухлена кооперация с ТЕЦ и АСАНСЬОР, разположен до ул. 'Трепетлика' и 'Водната кула'. Жилището е с...",False,1,2026-01-02 06:05:00.642460,https://www.imoti.net/bg/obiavi/r/prodava/sofia/?page=1&sid=iKI3oo,465
"продава Тристаен апартамент, 145 м2",500 000€977 915BGN,"София, Лозенец",https://www.imoti.net/bg/obiava/prodava/sofia/lozenec/tristaen/6131484/?sid=iKI3oo&page=12,продава Тристаен апартамент, 145 м2,Имотека,Етаж:  от 2,Цена на /м2/:3 448EUR/6 744.24BGN,"Апартамент в представителна сграда със съвременна фасада с изолация . Намира се  ул. 'Галичица'. б близост до ул. Златовръх. Застроена площ 122 кв.м. Състои се от антре с коридор,...",False,29,2026-01-02 06:05:00.642916,https://www.imoti.net/bg/obiavi/r/prodava/sofia/?page=1&sid=iKI3oo,465
"продава Тристаен апартамент, 145 м2",500 000€977 915BGN,"София, Лозенец",https://www.imoti.net/bg/obiava/prodava/sofia/lozenec/tristaen/6104180/?sid=iKI3oo&page=12,продава Тристаен апартамент, 145 м2,Джей и Джей Корпорейшън,Етаж: 2 от 7,Цена на /м2/:3 448EUR/6 744.24BGN,"ОТЛИЧЕН РАЙОН! СЛЕД РЕМОНТ! ГАРАЖ!JJcorporation  предлага на Вашето внимание просторен тристаен апартамент, находящ се тихо и спокойно място в кв. Лозенец на ул. Галичица. Апартаментът е на...",False,12,2026-01-02 06:05:00.643364,https://www.imoti.net/bg/obiavi/r/prodava/sofia/?page=1&sid=iKI3oo,465
"продава Тристаен апартамент, 145 м2",500 000€977 915BGN,"София, Лозенец",https://www.imoti.net/bg/obiava/prodava/sofia/lozenec/tristaen/6033809/?sid=iKI3oo&page=12,продава Тристаен апартамент, 145 м2,Революшън Естейт България,Етаж: 1 от 7,Цена на /м2/:3 448EUR/6 744.24BGN,"Революшън Естейт Ви представя красив тристаен апартамент с възможност за закупуване на ГАРАЖ в ж.к. Лозенец.Сградата се намира на чудесна локация - НА МЕТРИ до бул. Пейо К. Яворов,...",False,18,2026-01-02 06:05:00.643860,https://www.imoti.net/bg/obiavi/r/prodava/sofia/?page=1&sid=iKI3oo,465
"продава Тристаен апартамент, 170 м2",500 000€977 915BGN,"София, Лозенец",https://www.imoti.net/bg/obiava/prodava/sofia/lozenec/tristaen/6130149/?sid=iKI3oo&page=13,продава Тристаен апартамент, 170 м2,Galardo Real Estate,Етаж: 2 от 8,Цена на /м2/:2 941EUR/5 752.44BGN,"Galardo Real Estate има удоволствието да Ви представи един прекрасен апартамент с 2 спални, разположен в един от най-перспективните райони в столицата - кв. Хладилника. Едва на минути от...",False,13,2026-01-02 06:05:05.086055,https://www.imoti.net/bg/obiavi/r/prodava/sofia/?page=1&sid=iKI3oo,465
"продава Четиристаен апартамент, 150 м2",500 000€977 915BGN,"София, Стрелбище",https://www.imoti.net/bg/obiava/prodava/sofia/strelbishte/chetiristaen/6032108/?sid=iKI3oo&page=13,продава Четиристаен апартамент, 150 м2,Глобъл Сървисиз,Етаж: 3 от 12,Цена на /м2/:3 333EUR/6 519.43BGN,"Просторен 4-стаен апартамент в кв. СтрелбищеПредлагаме изцяло ремонтиран и луксозно обзаведен 4-стаен апартамент, разположен на комуникативно място в кв. Стрелбище.",False,19,2026-01-02 06:05:05.086545,https://www.imoti.net/bg/obiavi/r/prodava/sofia/?page=1&sid=iKI3oo,465
"продава Тристаен апартамент, 106 м2",508 560€994 657BGN,"София, Лозенец",https://www.imoti.net/bg/obiava/prodava/sofia/lozenec/tristaen/6090035/?sid=iKI3oo&page=13,продава Тристаен апартамент, 106 м2,ARCO REAL ESTATE,Етаж: 2 от 5,Цена на /м2/:4 798EUR/9 383.56BGN,ARCO REAL ESTATE предлага тристаен апартамент с площ 106 (89) кв.м. в малка бутикова сграда в кв. Лозенец в близост до Семинарията.Апартамента разполага с дневна с трапезария и кухненски...,False,1,2026-01-02 06:05:05.087068,https://www.imoti.net/bg/obiavi/r/prodava/sofia/?page=1&sid=iKI3oo,465
"продава Тристаен апартамент, 156 м2",510 000€997 473BGN,"София, Хиподрума",https://www.imoti.net/bg/obiava/prodava/sofia/hipodruma/tristaen/6179369/?sid=iKI3oo&page=13,продава Тристаен апартамент, 156 м2,Barnes Bulgaria,Етаж: 5 от 7,Цена на /м2/:3 269EUR/6 394.06BGN,"Представяме просторен тристаен апартамент за продажба в кв. ""Хиподрума"". Локацията на имота е на изключително комуникативно място. На метри са бул. ""България"", бул. ""Петко Ю. Тодоров"", бул....",False,17,2026-01-02 06:05:05.087592,https://www.imoti.net/bg/obiavi/r/prodava/sofia/?page=1&sid=iKI3oo,465
"продава Тристаен апартамент, 175 м2",510 000€997 473BGN,"София, Стрелбище",https://www.imoti.net/bg/obiava/prodava/sofia/strelbishte/tristaen/6178485/?sid=iKI3oo&page=13,продава Тристаен апартамент, 175 м2,Barnes Bulgaria,Етаж: 5 от 7,Цена на /м2/:2 914EUR/5 699.85BGN,"Представяме просторен тристаен апартамент за продажба в кв. ""Стрелбище"". Локацията на имота е на изключително комуникативно място. На метри са бул. ""България"", бул. ""Петко Ю. Тодоров"", бул....",False,16,2026-01-02 06:05:05.088122,https://www.imoti.net/bg/obiavi/r/prodava/sofia/?page=1&sid=iKI3oo,465
"продава Тристаен апартамент, 175 м2",510 000€997 473BGN,"София, Белите Брези",https://www.imoti.net/bg/obiava/prodava/sofia/belite-brezi/tristaen/6177976/?sid=iKI3oo&page=13,продава Тристаен апартамент, 175 м2,Barnes Bulgaria,Етаж: 5 от 7,Цена на /м2/:2 914EUR/5 699.85BGN,"Представяме просторен тристаен апартамент за продажба в кв. ""Бели Брези"". Локацията на имота е на изключително комуникативно място. На метри са бул. ""България"", бул. ""Петко Ю. Тодоров"", бул....",False,17,2026-01-02 06:05:05.088641,https://www.imoti.net/bg/obiavi/r/prodava/sofia/?page=1&sid=iKI3oo,465
"продава Тристаен апартамент, 100 м2",520 000€1 017 032BGN,"София, Лозенец",https://www.imoti.net/bg/obiava/prodava/sofia/lozenec/tristaen/6144070/?sid=iKI3oo&page=13,продава Тристаен апартамент, 100 м2,Глобъл Сървисиз,Етаж: 3 от 4,Цена на /м2/:5 200EUR/10 170.32BGN,"Продава се апартамент в озеленено пространство и в близост до паркПРОДАВА СЕ АПАРТАМЕНТ С ДВЕ СПАЛНИ, ОТДЕЛНА КУХНЯ И ХОЛ! 100КВ. ЧИСТА ПЛОЩ!Продава се апартамент от собственик в...",False,8,2026-01-02 06:05:05.089095,https://www.imoti.net/bg/obiavi/r/prodava/sofia/?page=1&sid=iKI3oo,465
"продава Мезонет, 254 м2",520 000€1 017 032BGN,"София, Лозенец",https://www.imoti.net/bg/obiava/prodava/sofia/lozenec/mezonet/6143955/?sid=iKI3oo&page=13,продава Мезонет, 254 м2,Глобъл Сървисиз,Етаж: 6 от 8,Цена на /м2/:2 047EUR/4 004.06BGN,"ЮЖЕН МЕЗОНЕТ ЛУКС, ПРОСТОР И ТОП ЛОКАЦИЯ! ДИРЕКТНО ОТ СОБСТВЕНИК!Несравнима локация до Paradise Center, метростанция Витоша, Южен парк, бул. Хенрик Ибсен.Готови документи за сделка! Огледи по всяко...",False,17,2026-01-02 06:05:05.089530,https://www.imoti.net/bg/obiavi/r/prodava/sofia/?page=1&sid=iKI3oo,465
